h135pi8,2021-06-08T09:06:20.000-07:00,"canada’s trudeau vows to fight far-right groups after muslim family slain as opposed to like an accident, or a targeted murder of individuals or something?  

he had a ballistics helmet and vest on, so he was expecting to get shot at, that's something, at least.",liberals
h135r9x,2021-06-08T09:06:45.000-07:00,"jeff bennett, pc candidate for london west in 2014, shares his thoughts on the muslim attack honestly i'd be happier if traditional progressive conservatives stepped up and retook the party from the fringe elements that have taken over.",conservatives
h135w4w,2021-06-08T09:07:52.000-07:00,"‘this is a terrorist attack’: trudeau condemns tragedy in london, ont. that left 4 dead &gt; as we see from this very thread , he was, and is, rightly concerned about freedom of speech and charter rights ...

it was a non-binding resolution to condemn islamophobia and start a committee to investigate it, pretty far cry from infringing speech or rights.",liberals
h135y8f,2021-06-08T09:08:22.000-07:00,trudeau’s liberals promised to end the blood ban. now they say it’s ‘complicated’. [deleted],liberals
h13684k,2021-06-08T09:10:42.000-07:00,"‘this is a terrorist attack’: trudeau condemns tragedy in london, ont. that left 4 dead &gt; carbon tax is one of the best policy solutions we have to climate change.

everything i've been told from people with doctorates in environmental studies tells me it is one of the *worst* policy solutions for climate change.  it's both weak at actually reducing co2 emissions, and it hurts poor people and requires them to know how to file for tax rebates to prevent that.  

the cap and trade program we instituted on sulfur dioxide in 1992 to eliminate acid rain has proven success, why didn't we go with that again?",liberals
h1369n0,2021-06-08T09:11:03.000-07:00,"‘this is a terrorist attack’: trudeau condemns tragedy in london, ont. that left 4 dead [removed]",liberals
h136a50,2021-06-08T09:11:10.000-07:00,canada’s trudeau vows to fight far-right groups after muslim family slain [deleted],liberals
h136d2a,2021-06-08T09:11:51.000-07:00,"‘this is a terrorist attack’: trudeau condemns tragedy in london, ont. that left 4 dead &gt; we have only 1 major party that refuses to deal with the reality of the situation.

genuinely not sure which party you're referring to there.  i think you could say at least two, maybe 3 major parties.",liberals
h136mwi,2021-06-08T09:14:08.000-07:00,"‘this is a terrorist attack’: trudeau condemns tragedy in london, ont. that left 4 dead [removed]",liberals
h136pjr,2021-06-08T09:14:45.000-07:00,"‘this is a terrorist attack’: trudeau condemns tragedy in london, ont. that left 4 dead [removed]",liberals
h136rd0,2021-06-08T09:15:10.000-07:00,"trudeau’s liberals promised to end the blood ban. now they say it’s ‘complicated’. 1. anal sex is uniquely risky for transmitting hiv, and msm practice a lot more anal sex than any other gender pairing.

2. a subset - maybe a fairly large one - of gay guys have a *lot* more sexual partners than any comparable subset of straight people. i've had sex with close to 100 guys in the last ~10 years, and a lot of my gay friends have similar partner counts or higher. i am on the low end of partner counts in some of my groups of friends. i know very few - maybe no - straight people with similar magnitude of partner counts.

3. once hiv became disproportionately prevalent among gay men, this supercharged the impact of the above two factors.

there is an anecdote from the book \"and the band played on\" (a history of the hiv/aids pandemic in the us) that is rather chilling in retrospect, describing how gay men used to meet pretty frequently at sti clinics. they'd just been treated - this was before hiv/aids, when everything could be treated with some antibiotics - and you know they're probably decent in bed. why not go home and bump your newly-treated uglies together?

gay guys have a lot of hiv because a lot of gay guys have high sexual partner counts, the activities gay guys practice with their sexual partners are much riskier on average than the activities practiced by comparable straight couples, and the prevalence of hiv in the population continuously supercharged those two factors.",liberals
h136ux2,2021-06-08T09:16:00.000-07:00,"‘this is a terrorist attack’: trudeau condemns tragedy in london, ont. that left 4 dead [deleted]",liberals
h136xsz,2021-06-08T09:16:41.000-07:00,"‘this is a terrorist attack’: trudeau condemns tragedy in london, ont. that left 4 dead what is your definition of \"left wing\"?",liberals
h137138,2021-06-08T09:17:27.000-07:00,"experts say trudeau’s acknowledgment of indigenous genocide could have legal impacts thanks for the sources

i would say that it isn't legit to expect someone to read a 200 page book

but that's not what you gave me

you gave me two pretty short readable sources

for me i think everyone on this territory of canada should be treated equally under the law.  ie. i don't think that people from fn stock should have different rights or obligations under the law compared to people of nigerian stock

your sources make the pretty obviously correct point that there were people living here before the europeans first came and that they had societies.  that i think is pretty obviously inarguable and i am not looking to disagree with that.

your sources also go into some details on the political conflicts between the european nation states and the indigenous nation states.  and more recently into the decisions of a couple of dudes and dudettes on the candian supreme court

obv what once were the indigenous nation states kind of got fucked over to put it mildly.  and the indigenous people also got kind of fucked over.  i don't think anyone is looking to say otherwise

for me though, what it boils down to, is i don't really care about either the history or about the law.  if the history is that some bunch of people got fucked over that sucks, but that's basically all of history. 
 if the law says that something has to be done then if i think it's a law that makes sense i would agree with it, and if i think it's a law that doesn't make sense then i would think we should get rid of that law.  to be clear i think that if a law in any way treats people differently based on their ethnicity it is an evil law.  i think that all people living here have a moral intrinsic right to be treated equally and that this supersedes anything else.  i think that anything that runs counter to equal treatment irrespective of a person's ethnic background is an abomination.  

and basically the asks of fn groups are that people who are ethnically fn should have different and superior rights

so i don't see why i would be on board with their asks considering i am vehemently against the principles that underly what they are asking for",liberals
h1374o7,2021-06-08T09:18:15.000-07:00,"‘this is a terrorist attack’: trudeau condemns tragedy in london, ont. that left 4 dead left wing is inherently authoritarian, what are you talking about?",liberals
h1374u8,2021-06-08T09:18:18.000-07:00,"jeff bennett, pc candidate for london west in 2014, shares his thoughts on the muslim attack perhaps, but the problem of the right welcoming racists in their midst and attempting to please them is not specifically canadian. the problem is with conservatives who are willing to indulge in xenophobia.",conservatives
h13761k,2021-06-08T09:18:35.000-07:00,"‘this is a terrorist attack’: trudeau condemns tragedy in london, ont. that left 4 dead i mean, we do all of that, to the point where nobody significantly out does us on it, yet many countries don't have these problems. why not?",liberals
h1378d6,2021-06-08T09:19:07.000-07:00,"‘this is a terrorist attack’: trudeau condemns tragedy in london, ont. that left 4 dead [deleted]",liberals
h137if7,2021-06-08T09:21:23.000-07:00,"‘this is a terrorist attack’: trudeau condemns tragedy in london, ont. that left 4 dead [removed]",liberals
h137kba,2021-06-08T09:21:49.000-07:00,"‘this is a terrorist attack’: trudeau condemns tragedy in london, ont. that left 4 dead [removed]",liberals
h137os5,2021-06-08T09:22:51.000-07:00,"conservatives present plan to help canadians buy homes they did said they'll replace the first-time home buyer incentive program, but we'll see if the replacement will be good, bad or ugly.",conservatives
h1381y5,2021-06-08T09:25:56.000-07:00,"‘this is a terrorist attack’: trudeau condemns tragedy in london, ont. that left 4 dead [deleted]",liberals
h138fs6,2021-06-08T09:29:13.000-07:00,"trudeau mum on calls to abandon appeals of compensation for first nations kids &gt; if they want to negotiate further compensation then that should be outside of the courts, but that’s not what they are trying to do.

&gt; you're telling on yourself because, yes that is what they're trying to do lol.

so you’re telling me that they are appealing not because they think some people should get less than $40k and some more, but because everyone should get $40k as a minimum?",liberals
h138m1o,2021-06-08T09:30:41.000-07:00,"conservatives present plan to help canadians buy homes condo glut? i wouldn't confuse pandemic effects with the long term trend. when urban offices reopen, many people will need to move back into the city to be closer to work.",conservatives
h138n58,2021-06-08T09:30:57.000-07:00,"‘this is a terrorist attack’: trudeau condemns tragedy in london, ont. that left 4 dead [removed]",liberals
h138oni,2021-06-08T09:31:17.000-07:00,"trudeau mum on calls to abandon appeals of compensation for first nations kids cool, that’s not my argument. my argument is none of them deserve less than $40k.",liberals
h138pc1,2021-06-08T09:31:28.000-07:00,conservatives present plan to help canadians buy homes probably with some weird frankenstein tax credit that helps no one.,conservatives
h138zb2,2021-06-08T09:33:50.000-07:00,"‘this is a terrorist attack’: trudeau condemns tragedy in london, ont. that left 4 dead &gt;now if only we could translate that change into action that lowers the amount of terrorists being randomly created by hate groups.

mental health should be covered by health insurance in every province.

psychology should be mostly public, not a private service.",liberals
h138zg5,2021-06-08T09:33:52.000-07:00,trudeau mum on calls to abandon appeals of compensation for first nations kids that’s interesting. good to know. thanks,liberals
h1398v5,2021-06-08T09:36:04.000-07:00,"‘this is a terrorist attack’: trudeau condemns tragedy in london, ont. that left 4 dead lol that's like saying you're the smartest idiot in the world. it's not like we're setting up concentration camps, they should be grateful it's just random attacks and stop whining?",liberals
h139r67,2021-06-08T09:40:25.000-07:00,canada’s trudeau vows to fight far-right groups after muslim family slain remindme! 4 weeks,liberals
h139rtc,2021-06-08T09:40:33.000-07:00,"‘this is a terrorist attack’: trudeau condemns tragedy in london, ont. that left 4 dead i am unmoved and neutral on the matter, as i remember the truck attack on a christmas market in germany a few years ago which killed 12 people.",liberals
h139s2x,2021-06-08T09:40:38.000-07:00,canada’s trudeau vows to fight far-right groups after muslim family slain the presser i heard referenced social media posts before the killings.,liberals
h139uwp,2021-06-08T09:41:17.000-07:00,"conservatives present plan to help canadians buy homes foreign ownership ban i agree will have no effect on the market. we see this year with no foreigners coming in due to covid, that this caused no cooling effect on the market. new zealand has also banned foreign owners and there has been no cooling effect as well. it's an easy political point to score but to expect any real change from it will be pointless.

i am not sure what your supply point is. while i agree the federal government likely can't do much regarding supply if we expand it to municipal governments, that is a level where a government mandate can create change. while i doubt any local party will run on increasing supply because that is typically against what the home owning majority voting population wants, they can change zoning laws to increase housing densification. i used to work in public accounting with developers in vancouver and they are chomping at the bits to see municipalities approve zoning changes quickly to build more townhomes, low rises and condos. the appetite is there for developer to increase supply, it is the local governments not catching up.",conservatives
h139vgo,2021-06-08T09:41:25.000-07:00,"canada’s trudeau vows to fight far-right groups after muslim family slain &gt;  the high profile cases we've had in canada mostly haven't been through organized directed groups but young disaffected men that have gotten radicalized online. often without any direct coaching or prompting.

this is correct. but also women. *cough*karens*cough*

we have a situation where a great many canadians feel unwanted, hated, and rejected by their communities and society; it's an abatement resulting from the moral absolutism of modern society.

no one wakes up one day and states, \"_y'know what, yesterday i was progressive, and today i'm gonna kill some `_`_\". it happens in degrees, in response to numerous and tiny microaggressions.

the more we _hate_ the more we create enemies worthy of that hate.",liberals
h13a528,2021-06-08T09:43:41.000-07:00,"canada’s trudeau vows to fight far-right groups after muslim family slain the correct response to radicalization is love.

yes, that's a hard pill to swallow, but it's love and appreciation that pulls people away from cults, gangs, and hate groups. those are the estuaries of the unwanted.",liberals
h13a8zg,2021-06-08T09:44:36.000-07:00,"‘this is a terrorist attack’: trudeau condemns tragedy in london, ont. that left 4 dead you quite clearly don't know much about hate groups. unless you're being sarcastic.

hate groups go after the lonely, the outcast, many times poor and disadvantaged. vulnerable people. these people are vulnerable to radicalization.

further, they are not positive groups to be in, they want to keep you angry at where you're at and blame your problems on the group's \"enemies,\" whoever that would happen to be.

normally this is the part where some action would be ordered by a leader or leadership. online hate groups are a bit different, everyone just sits around shitposting and someone makes a plan on their own. it erases culpability for any particular person in the group because each actor looks like a lone wolf, it's as smart as it is despicable.

for further reading look up \"stochastic terrorism\" which is what i just described to you.",liberals
h13aaa5,2021-06-08T09:44:54.000-07:00,canada’s trudeau vows to fight far-right groups after muslim family slain [removed],liberals
h13ajwm,2021-06-08T09:47:09.000-07:00,"conservative mps opposed a motion to condemn islamophobia in 2017. after the london hate crime, advocates say their condolences ring hollow and people ask me why i don't trust o'toole or the cpc. had more than one person making their case time and again about how the cpc is not what i think it is, and that it's really progressive and so on and so forth. 

yeah, i wasn't convinced back then, i'm even less convinced now.",conservatives
h13ap9t,2021-06-08T09:48:22.000-07:00,"‘this is a terrorist attack’: trudeau condemns tragedy in london, ont. that left 4 dead do you think he murdered a muslim family just for shits and giggles? i suppose there is the possibility the attack was entirely random. my statement was giving the definition of what terrorism was, and this certainly looks like terrorism given the circumstances.

obviously it's impossible to know directly what any person believes. the investigation will hopefully turn up a motive.",liberals
h13b822,2021-06-08T09:52:34.000-07:00,"canada’s trudeau vows to fight far-right groups after muslim family slain there’s nothing “right-wing” about hate-fuelled murder.  or racism.  or xenophobia.  we need a better term to describe. 

groups that spew hatred typically don’t represent anything but that hatred, so it’s not anything traditionally associated with conservatism.",liberals
h13bdh1,2021-06-08T09:53:50.000-07:00,"‘this is a terrorist attack’: trudeau condemns tragedy in london, ont. that left 4 dead the carbon tax is on companies, and will probably be passed down to the consumer. but people are the ones wh oget the rebate.",liberals
h13bf60,2021-06-08T09:54:14.000-07:00,canada’s trudeau vows to fight far-right groups after muslim family slain [removed],liberals
h13bl0t,2021-06-08T09:55:34.000-07:00,"canada’s trudeau vows to fight far-right groups after muslim family slain is modern society really any more morally absolute than what's come before?  social media and the current media environment are certainly new and disruptive but back in the day when your community shunned you that was as good as being set adrift on an ice floe.  there might be more what could be termed \"political\" judgement than the 70's-early 2000's but i'd call that a difference in category than a difference in degree.

these days maybe people might find that they're not accepted into their preferred communities, or one with sufficiently desirable social status, but they'll generally be able to find one.

now, if we want to get into a discussion about how shallow and transitory modern community can be versus what humans might be seeking, there may be more gristle to chew there.",liberals
h13bvyi,2021-06-08T09:58:05.000-07:00,"‘this is a terrorist attack’: trudeau condemns tragedy in london, ont. that left 4 dead i literally have no idea what this shitbird was thinking. zero. that’s kinda my point.

police and our leaders have spoken out which suggests the there is evidence they have seen that we aren’t privy to. i am sure it will come out in due course.

i will absolutely change my opinion based on evidence, but right now the only public evidence i have seen is “bunch of politicians use tragedy to jockey for position and preempt political attacks”. it’s just the click bait climate we find ourselves in.",liberals
h13bxe2,2021-06-08T09:58:25.000-07:00,"leger federal poll: lpc 32 cpc 29 ndp 22 bq 6 gpc 6 newfoundland literally cannot afford a cpc government because the last election was quite literally fought over who has the best ability to extract federal money to help pay for the province's mistakes, in particular ones by premier williams.  the cpc is ideological less \"generous\", we'll call it.

though i will note newfoundland would be even worse off if the harper government hadn't given their latest megaproject a loan guarantee. which is more than the trudeau government has done.",liberals
h13bxy3,2021-06-08T09:58:33.000-07:00,"canada’s trudeau vows to fight far-right groups after muslim family slain its more that far-right groups pose a potential organized threat, or could serve as a basis from which people become radicalized. examples can be found with jeremy christian and patriot prayer as well as anders brevrik and the english defence league.",liberals
h13bzzi,2021-06-08T09:59:02.000-07:00,"‘this is a terrorist attack’: trudeau condemns tragedy in london, ont. that left 4 dead [removed]",liberals
h13ch6z,2021-06-08T10:03:01.000-07:00,"canada’s trudeau vows to fight far-right groups after muslim family slain &gt; is modern society really any more morally absolute than what's come before?

yes.

https://www.acsh.org/news/2018/11/28/polarization-society-even-scientists-become-tribal-13628

https://www.pewresearch.org/fact-tank/2020/11/13/america-is-exceptional-in-the-nature-of-its-political-divide/

https://www.wsj.com/articles/why-social-media-is-so-good-at-polarizing-us-11603105204

https://en.wikipedia.org/wiki/political_polarization#causes

&gt; these days maybe people might find that they're not accepted into their preferred communities, or one with sufficiently desirable social status, but they'll generally be able to find one.

_that's precisely the problem_.

where we used to tolerate _diversity_ in our communities, we now able to prefer _homogeneity_ and reject those who make us uncomfortable. 50y ago the crazy guy ranting about the government at the end of the bar was still a member of his small town; but nowadays he's an outcast in his community, and finds acceptance among _like minded people_.",liberals
h13chhh,2021-06-08T10:03:05.000-07:00,"‘this is a terrorist attack’: trudeau condemns tragedy in london, ont. that left 4 dead [removed]",liberals
h13cpyb,2021-06-08T10:05:01.000-07:00,"‘this is a terrorist attack’: trudeau condemns tragedy in london, ont. that left 4 dead [removed]",liberals
h13ctq0,2021-06-08T10:05:54.000-07:00,"‘this is a terrorist attack’: trudeau condemns tragedy in london, ont. that left 4 dead my understanding is that they are effectively equivalent, but the issues with filing taxes are important. the government recently announced they may move to auto filing taxes so that would help a lot.",liberals
h13cwzb,2021-06-08T10:06:39.000-07:00,"‘this is a terrorist attack’: trudeau condemns tragedy in london, ont. that left 4 dead [removed]",liberals
h13d159,2021-06-08T10:07:36.000-07:00,"‘this is a terrorist attack’: trudeau condemns tragedy in london, ont. that left 4 dead statistics say one thing, but a feeling cannot be qualified. am i able to speak on how much you love your mother? statistics say you would, but gosh darn it i just have hunch you don't.

feelings aren't statistics and so unless you're a member of the group in question, you genuinely cannot say whether or not they feel safe. it's not that hard and if you feel otherwise that's at best a crazy paternalistic attitude and at worst just straight racism.",liberals
h13d5wy,2021-06-08T10:08:42.000-07:00,"canada’s trudeau vows to fight far-right groups after muslim family slain if you're looking for a neutral term, i think the usual one is \"radicalization.\" but i think it's pretty common for anti-immigrant parties like the [national front](https://en.wikipedia.org/wiki/national_rally) in france to be described as \"far right.\"",liberals
h13d6qb,2021-06-08T10:08:54.000-07:00,"conservative mps opposed a motion to condemn islamophobia in 2017. after the london hate crime, advocates say their condolences ring hollow im glad he's getting pushback in this because it's not ok.  that whole fight was made worse by the conservatives leadership race where every candidate including otoole were fighting to show how much they didn't care about islamophobia.  it was awful then, and after today's apology it makes him look hypocritical and opportunistic.  he needs to address this",conservatives
h13dcsw,2021-06-08T10:10:20.000-07:00,"‘this is a terrorist attack’: trudeau condemns tragedy in london, ont. that left 4 dead [removed]",liberals
gv2xumj,2021-04-18T23:53:59.000-07:00,"erin o'toole faces backlash from 'surprised and frustrated' conservatives over carbon pricing plan why do i need the government to tell me how to save my rebate. in what conservative world is more government control a good thing?

give me my rebate and let me decide how i want it saved, and used. i don't want some private company collecting interest, and investment income off my tax rebate. that money should be mine.",conservatives
gv2y7v4,2021-04-18T23:56:54.000-07:00,"rex murphy: o’toole is digging a political grand canyon there will be no getting out of i think you strongly overestimate both the degree of the self destruction and the degree of xenophobia in canada.    

i don't think the collective \"we\" are as unfamiliar with jagmeet singh at this point.

i also suspect trudeau may not move on an election unless he's forced and i don't see that happening until after ontario and alta. are under control",liberals
gv2yrbj,2021-04-19T00:01:10.000-07:00,"trudeau pledges more health-care workers, rapid testing for pandemic-battered ontario [removed]",liberals
gv2z3ie,2021-04-19T00:03:53.000-07:00,opposition parties denounce ford government proposal to shut down legislature amid covid-19 crisis it’s unfortunately a proven effective strategy for saving face and shutting down discussion. voters tend not to care.  the federal liberals have done it multiple times during their scandals without suffering consequences. harper is the only guy in recent memory i can think of who prorogued parliament and suffered political consequences for it.,liberals
gv2zuii,2021-04-19T00:09:44.000-07:00,opposition parties denounce ford government proposal to shut down legislature amid covid-19 crisis voters tend not to care normally because most issues don't affect their lives. trudeau did it to avoid the we scandal and harper did it to avoid losing a confidence vote. this is different. every single ontarian is locked at home due to ford's inaction and him going into hiding now while the rest of the world (and canada) gets better is not going to be missed by anyone.,liberals
gv31doo,2021-04-19T00:21:25.000-07:00,"ontario’s covid crisis: ‘this scenario was entirely preventable’ i noted this before but to the people who say \"this is trudeau's fault, he should give ford more vaccines like ford says!\" hey wiseguy, ford was given the schedule of vaccines since what a year or so ago? more? and trudeau surpassed that initial schedule of vaccines, what, every month or almost every month?

and ford still screwed up the rollout. with a year's+ worth of notice.

if trudeau had given him 50 million vaccines, ford would still screw it up and the spread would be wild just as it is now because he would be too busy banning campgrounds rather than instituting paid sick leave as his own experts have been telling him.

