hpuvrkk,2021-12-24T06:33:07.000-08:00,"liberals put 6-month pause on efforts to lower cost of patented medicines certainly. but the sensibility that pharma companies are just running around ripping people off is very ignorant.

canada has spent $400 billion mitigating the pandemic. and we want to squabble over a couple of companies doing the heavy lifting and making a couple billion? that's not how this works.

a lot of people don't understand the cost of risk. we're blessed and lucky not to have to worry about much risk in our day to day lives, but that's not how a lot of businesses get to work (business owner here).

american pharma is a big mess, but that's built in to a system of rent seeking. it's hard to say that the companies following their fiduciary duty and saving billions of lives are at fault... but fixing corrupt government is hard.",liberals
hpux6bp,2021-12-24T06:45:10.000-08:00,"liberals put 6-month pause on efforts to lower cost of patented medicines 
&gt;oh did they do all the development for the vaccine in 2020? i guess the previous 4 decades were free then...

they were, at least from the perspective of pfizer; the vast majority of pre-2020 mrna vaccine development happened in universities and nonprofit orgs like the salk institute. pfizer-biontech just built on the foundation of published research—biontech didn't even *exist* before 2008. it seems like you fundamentally do not understand how research is performed and published. you're living on another planet if you seriously believe that pharmaceutical companies pursue technology for decades without a commercial product in the hopes that it some day bears fruit.

&gt;also an mrna vaccine isn't the only drug ever brought to market. since you're googling, you can look up what other drugs cost in phase 3. i didn't specify it has to be only the vaccines for covid.

gosh, here you go again making claims that can [easily be falsified with a google search:](https://www.sofpromed.com/how-much-does-a-clinical-trial-cost)

&gt;the average cost of phase 1, 2, and 3 clinical trials across therapeutic areas is around $4, 13, and 20 million respectively.

that's \"million\" with an m.",liberals
hpuyndx,2021-12-24T06:58:00.000-08:00,"liberals put 6-month pause on efforts to lower cost of patented medicines median yes. not maximum. https://www.nature.com/articles/nrd.2018.198

fair enough, $347 million isn't quite a billion, i was wrong.",liberals
hpuz7ck,2021-12-24T07:02:57.000-08:00,"courts approve $8b settlement between first nations, feds in clean water class action it's time as a federalist government in is charge, albeit nationalist. the big thing is that every province has to sign the paper for it to pass (beside la belle province ;) ). i wonder if reactionary conservatives will like it.",conservatives
hpuz7uv,2021-12-24T07:03:04.000-08:00,"liberals put 6-month pause on efforts to lower cost of patented medicines i think you should probably look up what an outlier is, too, while you're at it",liberals
hpv02y7,2021-12-24T07:10:42.000-08:00,"kenney's wuhan bat soup comment draws criticism, premier's office claims 'scientific theory' far from racist what if i told you a ubi could be fiscally conservative as it would eliminate extra costs? or the climate change pledges could easily bring about a green boom in industry if we charged for externalities like pollution (plastics, ghg's)

it just happens that they only hijacked the name of fiscal conservatism and we have no party to represent the fiscally conservative. closest are liberals.",liberals
hgp4bnd,2021-10-14T13:40:57.000-07:00,"is the solution to our labour shortage more foreign workers? businesses say yes, others say it’s a way to fill vacancies without raising wages the temporary foreign worker program should be used rarely, if i recall it expanded greatly when jason kenney was immigration minister. before it was exclusively or used mostly for things like getting farm hands and the conservatives expanded it so that tim hortons in every remote community in canada could suddenly be staffed entirely by indentured third world servants all from the same country. if a business can’t compete because the locals refuse to work there because of crap pay or working conditions let them close their doors. people will adapt their behaviour by making their own coffee or someone might come along who provides good jobs and treats employees well while making a profit selling coffee. people want to work where they feel they’re compensated fairly for their time and where they are treated well and valued. big business controls the narrative about immigration in canada and they pushed things like “diversity is our strength” very cleverly for them, it makes it impossible to talk about needing to revisit immigration policies, targets, and laws without being branded an extremist.",conservatives
hgp7i2h,2021-10-14T14:09:32.000-07:00,[deleted by user] the only mps that voted to ban discrimination of the unborn based on sex were conservative. all the other parties were fine with abortions happening even if the only reason for the abortion was that the child was a girl. that sure sounds like the conservatives care more about women than the other parties.,conservatives
hgpa13p,2021-10-14T14:33:20.000-07:00,"matt gurney: the ppc surge was real, but it didn't hurt o'toole (at least not much) i'm not a ppc supporter, but i can see how they were able to make wide horizontal gains across all the parties. they were the only party to offer a meaningfully distinct stance on covid policy, immigration, firearms, freedom of expression, equalization, ... actually, basically every policy of note they zigged where every other party zagged (some moreso than others).",conservatives
gqb4sfo,2021-03-08T16:43:33.000-08:00,"advocates urge liberals to cancel devastating cut to services for canadians with print reading disabilities &gt;and before people say \"omg why aren't you willing to pay $0.01 to help the blind omfgwtfbbbq!!!\" there are more costs than just financial ones.

not really a good reason pal. there are costs to everything in life. the only question is whether that cost is worth it. not worth it to you, but worth it in general. a common problem with humans, is we tend to forget that once we pay things like taxes, that money isn't really 'yours' anymore. it's everyone's.

so, if enough of us decide my idea is worth it, your opinion matters not. welcome to democracy.

also, i don't say this to be a jerk about it all. i just have heard your arguments before in regards to many things. i don't care much for it, because it always boils down to \"why do we have to spend money on x thing, when my y thing is better?\" or something like that. admit it, you know i am right. or at least you will  understand i am right once you see a situation where this logic applies that you can accept.",liberals
gqb58ok,2021-03-08T16:51:06.000-08:00,"a social conservative group plans to force the conservative party to change its position on abortion. here’s how pro choice != pro abortion

this is beyond being anti abortionist",conservatives
gqbbgvr,2021-03-08T18:34:23.000-08:00,a social conservative group plans to force the conservative party to change its position on abortion. here’s how [removed],conservatives
ghv2jok,2021-01-02T05:04:47.000-08:00,"conservative mp ron liepert has travelled to california twice since march for 'essential house maintenance' there's no evidence trudeau has travelled overseas for vacation, it would probably be leaked by now.  this isn't a partisan issue, ordinary canadians have made enormous sacrifices and leaders need to show leadership by modelling good behaviour.  


your comment adds nothing to the discussion other than trudea = bad and partisan whining.",liberals
ghv2l4z,2021-01-02T05:05:09.000-08:00,"conservative mp ron liepert has travelled to california twice since march for 'essential house maintenance' this is a conservative member, he's a federal party member, not ucp.

trudeau's at his house in harrington lake, it's an official pm residence.

&gt; 9 of the past 11 days he has taken personal days

...because it's christmas holidays.",liberals
ghv2me7,2021-01-02T05:05:27.000-08:00,"conservative mp ron liepert has travelled to california twice since march for 'essential house maintenance' that's your proof? a tweet by some liberal who is making tweets about ucp not following the rules?
we know that finance minister of ontario staged his twitter, you don't think the libs would do that for trudeau?",liberals
gi42m74,2021-01-04T05:57:39.000-08:00,"conservative mp david sweet resigns as chair of the ethics committee after travelling to the u.s. during the holidays along with stepping down as ethics committee chair, [he will not be seeking re-election in flamborough-glanbrook](https://twitter.com/davidsweetmp/status/1346210538980831233) whenever the next federal election comes around. 

for those keeping score at home, here is a list of mps who will not be running in the 44th general election. coincidentally, they are all long-tenured conservatives from ontario.

**conservative**

* [bruce stanton](https://globalnews.ca/news/7112408/simcoe-north-mp-bruce-stanton-not-running/) (simcoe north)

* [diane finley](https://www.brantfordexpositor.ca/news/local-news/h-n-mp-diane-finley-will-not-seek-re-election/wcm/d4449786-eaf6-463b-a6f4-2f90efc56362) (haldimand-norfolk)

* [peter kent](https://toronto.ctvnews.ca/longtime-conservative-mp-peter-kent-won-t-run-again-in-key-riding-for-the-party-1.5200762) (thornhill)

* [phil mccoleman](https://www.thestar.com/politics/2020/12/30/conservative-mp-phil-mccoleman-says-he-wont-seek-re-election.html) (brantford-brant)

* [david sweet](https://twitter.com/davidsweetmp/status/1346210538980831233) (flamborough-glanbrook)",conservatives
gi42xa6,2021-01-04T06:00:04.000-08:00,identity politics risk trapping trudeau in quebec [deleted],liberals
gi431rb,2021-01-04T06:01:01.000-08:00,"identity politics risk trapping trudeau in quebec if you google \"le français recule à montréal\", the chief statistics used is french spoken at home.

see, for instance, [this article](https://www.journaldemontreal.com/2020/12/07/situation-du-francais--andre-pratte-replique-a-son-tour) that was published a month ago.

&gt;les auteurs préfèrent celui de la langue d’usage. selon leurs projections (et celles de statistique canada), la proportion de québécois parlant français le plus souvent à la maison (la langue d’usage) diminuera au cours des 15 (statistique canada) ou 35 prochaines années (inrs), alors que l’anglais «gagnera un point». cette tendance est préoccupante et la mise en place de mesures supplémentaires s’impose.",liberals
gi44359,2021-01-04T06:09:15.000-08:00,"identity politics risk trapping trudeau in quebec you’re saying that and pointing to op ed pieces written by individual authors but ignore all the ink that was spilled about workplace usage and downtown usage. your selective sampling is weak and ignores the real issues that people really care about, all to discredit the topic.",liberals
gi46i6m,2021-01-04T06:28:47.000-08:00,identity politics risk trapping trudeau in quebec my point was crystal clear,liberals
gi471z1,2021-01-04T06:33:13.000-08:00,return of the strong gods: understanding the new right - quillette canadian conservatives have roots in british toryism. that is why cpc is so radically different from the gop while at the same time being pretty simmilar to current british conservative party.,conservatives
gi47egs,2021-01-04T06:36:06.000-08:00,"allard resigns from cabinet, kenney's chief of staff steps down i was just looking through the list of politicians who took trips during the pandemic. the list is mostly a type  conservative party alignment. most of the members of the other parties have faced some sort of demotion, or stepped down themselves. not as much from the conservative side of things, so this is the right call for the ucp to do. the approval rating keeps dropping (like here in manitoba with pallister, who did manage a costa rican vacation this year). now it's time for o'toole to start holding the federal members to a higher standard.",conservatives
gi47ft3,2021-01-04T06:36:25.000-08:00,"raising the carbon tax makes more sense than you might think i'd refer you back to nordhaus regarding carbon taxation working as an incentivizer (and it's not just about evs). and sure, you're welcome to disagree with how trudeau is using the revenue, but that's no reason to throw the baby out with the bathwater. you're shifting goalposts a bit there. your original claim was that carbon taxes are useless. now you're saying that the way trudeau is implementing them doesn't work. well then push for a better carbon tax, like it exists in other places like california (which i mentioned for a reason).",liberals
gi47uam,2021-01-04T06:39:43.000-08:00,"conservative senate leader don plett back in canada after a holiday trip to mexico &gt;the senate couldn't scrounge up enough moral fibre to condemn a racist in beyak

they voted repeatedly to suspend her without pay, and are currently considering a motion to have her expelled from the chamber permanently. what are you referring to?

&gt;doubt much will happen as a result of this, particularly with the conservatives being the largest grouping

conservatives are not the largest grouping in the senate. as of today, the current standings in the upper chamber are:

* independent senators group: 44
* conservatives: 20
* canadian senators group: 13
* progressive senate group: 11
* non-affiliated: 6
* vacant: 11

&gt;it ought to be easier to reform this dysfunctional house of sober second thought.

that statement implies someone in a position to do so has actually tried, or that the government has ever had a senate reform agenda. but neither of those things is true.

the government appointed a bunch of independent senators, but hasn't taken any position on the senate reform file itself, instead saying \"that's for senators to figure out for themselves.\" but it's a giant and nebulous question, and one piece in a long list of non-government business in a chamber whose rules don't create consistent time for non-government business. and that's before you factor in divergent opinions and the senate's internal divisions.

if the government had an honest-to-god senate reform agenda (e.g. a sweeping set of rule changes backed by amendments to the parliament of canada act), that would be different. they could appoint a senator to be the minister responsible for the reforms, drive the necessary debates forward on the order paper, and wrangle enough senators together to vote for the changes. it isn't hard to do if it's a priority.",conservatives
gi48y57,2021-01-04T06:48:59.000-08:00,"conservative senate leader don plett back in canada after a holiday trip to mexico &gt;is that something that he can do? i thought the senators had to vote on stuff like that but i could be wrong.

the party leader decides on their party's house and senate officers, including the position of leader of the opposition in the senate. if he wishes to remove sen. plett from that role unilaterally, he can.

&gt;otherwise beyak would be out surely.

sen. beyak was kicked out of the cpc caucus years ago, by andrew scheer, and has been sitting (or rather, hasn't, since she's repeatedly been suspended without pay)  as a non-affiliated independent. although a vote of the house caucus is required in the current parliament for a cpc mp to be removed from caucus, that limitation does not apply to whether or not a senator is allowed in the party caucus.",conservatives
hnz8yf1,2021-12-09T20:19:28.000-08:00,"uncertain if liberals can pass two remaining priority bills before christmas break ###this is a reminder to [read the rules before posting in this subreddit](https://www.reddit.com/r/canadapolitics/wiki/rules-thelongversion).
 
1. **headline titles should be changed only [when the original headline is unclear](https://www.reddit.com/r/canadapolitics/wiki/rules-thelongversion#wiki_1._headline_titles_should_be_changed_only_where_it_improves_clarity.)**
2. **be [respectful](https://www.reddit.com/r/canadapolitics/wiki/rules-thelongversion#wiki_2._be_respectful).**
3. **keep submissions and comments [substantive](https://www.reddit.com/r/canadapolitics/wiki/rules-thelongversion#wiki_3._keep_submissions_and_comments_substantive).**
4. **avoid [direct advocacy](https://www.reddit.com/r/canadapolitics/wiki/rules-thelongversion#wiki_4._avoid_direct_advocacy).**
5. **link submissions must be [about canadian politics and recent](https://www.reddit.com/r/canadapolitics/wiki/rules-thelongversion#wiki_5._link_submissions_must_be_canadian_and_recent).**
6. **post [only one news article per story](https://www.reddit.com/r/canadapolitics/wiki/rules-thelongversion#wiki_6._post_only_one_news_article_per_story).** ([with one exception](https://www.reddit.com/r/canadapolitics/comments/3wkd0n/rule_reminder_and_experimental_changes/))
7. **replies to removed comments or removal notices will be removed** without notice, at the discretion of the moderators.
8. **downvoting posts or comments**, along with urging others to downvote, **[is not allowed](https://www.reddit.com/r/canadapolitics/wiki/downvotes)** in this subreddit. bans will be given on the first offence.
9. **[do not copy &amp; paste the entire content of articles in comments](https://www.reddit.com/r/canadapolitics/wiki/rules-thelongversion#wiki_9._do_not_copy_.26amp.3b_paste_entire_articles_in_the_comments.)**. if you want to read the contents of a paywalled article, please consider supporting the media outlet.

*please [message the moderators](https://www.reddit.com/message/compose?to=%2fr%2fcanadapolitics) if you wish to discuss a removal.* **do not reply to the removal notice in-thread**, *you will not receive a response and your comment will be removed. thanks.*


*i am a bot, and this action was performed automatically. please [contact the moderators of this subreddit](/message/compose/?to=/r/canadapolitics) if you have any questions or concerns.*",liberals
hnzcs5p,2021-12-09T20:58:27.000-08:00,uncertain if liberals can pass two remaining priority bills before christmas break [removed],liberals
hnzf0qh,2021-12-09T21:19:29.000-08:00,"erin o'toole says bill 21 is a quebec issue while some of his mps take tougher stand we need to get rid of this loser.  
not because of this particular issue, but we need to toss him if we ever want to win another election.",conservatives
hnzf4jm,2021-12-09T21:20:27.000-08:00,"justin trudeau and christya freeland are attending fund raising event today, according to cpac very interesting. i hope they don't raise any money!",liberals
hnom0sh,2021-12-07T12:54:55.000-08:00,why conservatives are terrified to give teens the vote don't hurt yourself with that massive stretch.,conservatives
hnosfmc,2021-12-07T14:06:02.000-08:00,"the woman problem, why the overwhelming majority of women vote left. i dunno, as for women politicians, i really like leslyn lewis, and back in the day i thought elizabeth may was pretty respectable.

i'm a woman myself, and thankfully most of my female family members are more conservative-minded or centrist, though only recently did some of us start to regularly vote conservative - most, including myself, have long been swing voters. part of it is because, let's not kid ourselves here, if you're a social conservative in any fashion, there is basically no major party that will do anything meaningful on issues you care about, including the conservatives. a few of us realized that a long time ago, and so we'd vote based on other issues, depending on what the platforms and issues of the time were. that meant we didn't always vote conservative.

in a more broad sense, though? wokeism has gone totally off the rails, and dragged a lot of women with it. i think a big part of it is that feminism has gone super woke and that means a lot of women are basically walking around with a big target on their backs. *we* are one of their big target audiences, and so they tailor a lot of their garbage to sound like it's in our best interest. most people are not super into keeping tabs on the news from a variety of sources, and even fewer will have the critical thinking skills necessary to notice some of the subtle ways in which they're being manipulated *without* having that variety of sources. this is all the more true if the issues at hand play into something a person has vulnerabilities around - like experiences of sexism or racism, for example, and that gets even worse given the trend to take any negative feeling or small slight and turn it into a social justice cause. i think this goes for a lot of groups that are the target of some big ideological push, and in this case it just happens to be women, targeted by a huge woke feminist wave. that's my theory, anyway.",conservatives
gi81mj3,2021-01-05T05:00:31.000-08:00,trudeau says he's 'frustrated' with the pace of vaccine rollout [removed],liberals
gi8289t,2021-01-05T05:04:29.000-08:00,trudeau says he's 'frustrated' with the pace of vaccine rollout [deleted],liberals
gi83uta,2021-01-05T05:14:57.000-08:00,"trudeau says he's 'frustrated' with the pace of vaccine rollout damn, maybe we should have done what the ndp suggested and had a federally managed vaccine rollout and administrations plan. which trudeau could still do by the way, but instead he'll say he's \"frustrated\" then not do anything. like how he did absolute nothing in regards to police violence and discrimination against bipoc when he said he would over 7 months ago, and didn't anything during his previous 4.5 years as pm.",liberals
gi8418e,2021-01-05T05:16:05.000-08:00,trudeau says he's 'frustrated' with the pace of vaccine rollout [removed],liberals
gi84bib,2021-01-05T05:17:58.000-08:00,trudeau says he's 'frustrated' with the pace of vaccine rollout [removed],liberals
gi84gcq,2021-01-05T05:18:50.000-08:00,"trudeau says he's 'frustrated' with the pace of vaccine rollout similar story in australia with regards to the federal govt. completely shit the bed.

states got together and shut borders / enforced quarantine to protect themselves. some are doing a better job than others.",liberals
gi84hys,2021-01-05T05:19:08.000-08:00,trudeau says he's 'frustrated' with the pace of vaccine rollout we don't have all vaccinne necessary though.,liberals
gi84pd7,2021-01-05T05:20:25.000-08:00,"trudeau says he's 'frustrated' with the pace of vaccine rollout i feel like trudeau says he's \"frustrated\" with things waay too much.",liberals
gi8525a,2021-01-05T05:22:41.000-08:00,"trudeau says he's 'frustrated' with the pace of vaccine rollout this week =/= in a week. ontario says they'll finish by the weekend and the vaccines will have arrived by then. 

i'm not mad at anyone personally. you may be mad at whomever you wish. i'm not sure what makes you think i, as a random redditor, am qualified to tell you how to feel.",liberals
gi85nwe,2021-01-05T05:26:39.000-08:00,"trudeau says he's 'frustrated' with the pace of vaccine rollout what country has all the vaccines necessary at this juncture? it takes time to produce and ship them... and that is a monstrous logistical effort. 

the federal government negotiated for vaccines, and by all accounts canada secured far more than we need. it's just not going snap into existence, however.",liberals
gi85pw9,2021-01-05T05:27:01.000-08:00,trudeau says he's 'frustrated' with the pace of vaccine rollout be mad at the covidiots. always them.,liberals
gi8a66l,2021-01-05T05:55:54.000-08:00,did justin trudeau just come back from an overseas holiday? removed for rule 3.,liberals
gi8a94o,2021-01-05T05:56:27.000-08:00,trudeau says he's 'frustrated' with the pace of vaccine rollout rule 2,liberals
hgb7v3x,2021-10-11T13:15:11.000-07:00,"trudeau's 'durable' brand will survive his 'tone deaf' tofino vacation, say public opinion analysts former senior liberals are generally blue libs who dislike the direction trudeau has taken the party. some of them are quite bitter. and it shows.",liberals
hgb9n15,2021-10-11T13:28:41.000-07:00,opinion | canada’s conservatives seem determined to double down on erin o’toole’s failed strategy barely viable? they won the popular vote. clearly lots of canadians support them enough to vote for them.,conservatives
hgba39o,2021-10-11T13:32:10.000-07:00,"trudeau's 'durable' brand will survive his 'tone deaf' tofino vacation, say public opinion analysts [removed]",liberals
hgba8h6,2021-10-11T13:33:13.000-07:00,"canadians most often said bernier, trudeau should leave roles following election, according to nanos research poll bernier doesn’t have to leave. the ppc has no constitution or bylaws. there is no way for members to trigger a leadership race. he did say he is going to have the members vote on if he should stay or go. it would be funny to watch a bunch of cpc supporters purchase memberships to vote him out.",liberals
hgbb0vl,2021-10-11T13:39:20.000-07:00,"kgb archives show how chrystia freeland drew the ire (and respect) of soviet intelligence services stale and overblown statements. plus, i wouldn't believe anything coming from the federal government. after all, trudeau promised himself more democracy in canada and let us believe that there will be the last election under fptp when he defeated harper. guess what, he lied, we continue to have the bare bone, most archaic form of democratic method used in canada. by these standards, venezuela is light years ahead.",liberals
hgbbb4j,2021-10-11T13:41:38.000-07:00,"trudeau's 'durable' brand will survive his 'tone deaf' tofino vacation, say public opinion analysts it should hurt his brand but wont.  if his other scandals cant take him down something like this wont. people will vote/support liberal just because they always vote/support liberal",liberals
