gpfqz8t,2021-03-02T01:43:08.000-08:00,"‘justin trudeau is gutless’: brian kilmeade flames canadian pm for refusing to fight for keystone xl pipeline ###this is a reminder to [read the rules before posting in this subreddit](https://www.reddit.com/r/canadapolitics/wiki/rules-thelongversion).
 
1. **headline titles should be changed only [when the original headline is unclear](https://www.reddit.com/r/canadapolitics/wiki/rules-thelongversion#wiki_1._headline_titles_should_be_changed_only_where_it_improves_clarity.)**
2. **be [respectful](https://www.reddit.com/r/canadapolitics/wiki/rules-thelongversion#wiki_2._be_respectful).**
3. **keep submissions and comments [substantive](https://www.reddit.com/r/canadapolitics/wiki/rules-thelongversion#wiki_3._keep_submissions_and_comments_substantive).**
4. **avoid [direct advocacy](https://www.reddit.com/r/canadapolitics/wiki/rules-thelongversion#wiki_4._avoid_direct_advocacy).**
5. **link submissions must be [about canadian politics and recent](https://www.reddit.com/r/canadapolitics/wiki/rules-thelongversion#wiki_5._link_submissions_must_be_canadian_and_recent).**
6. **post [only one news article per story](https://www.reddit.com/r/canadapolitics/wiki/rules-thelongversion#wiki_6._post_only_one_news_article_per_story).** ([with one exception](https://www.reddit.com/r/canadapolitics/comments/3wkd0n/rule_reminder_and_experimental_changes/))
7. **replies to removed comments or removal notices will be removed** without notice, at the discretion of the moderators.
8. **downvoting posts or comments**, along with urging others to downvote, **[is not allowed](https://www.reddit.com/r/canadapolitics/wiki/downvotes)** in this subreddit. bans will be given on the first offence.
9. **[do not copy &amp; paste the entire content of articles in comments](https://www.reddit.com/r/canadapolitics/wiki/rules-thelongversion#wiki_9._do_not_copy_.26amp.3b_paste_entire_articles_in_the_comments.)**. if you want to read the contents of a paywalled article, please consider supporting the media outlet.

*please [message the moderators](https://www.reddit.com/message/compose?to=%2fr%2fcanadapolitics) if you wish to discuss a removal.* **do not reply to the removal notice in-thread**, *you will not receive a response and your comment will be removed. thanks.*


*i am a bot, and this action was performed automatically. please [contact the moderators of this subreddit](/message/compose/?to=/r/canadapolitics) if you have any questions or concerns.*",liberals
gpfr9xl,2021-03-02T01:45:18.000-08:00,"most canadians confident federal vaccine rollout is back on track: poll yeah, they were given billions, and there's still no website?  why?  because they'd prefer people are upset when they think they can shift the blame to trudeau or municipalities.  they pocketed billions in federal transfers, and then passed responsibility to the municipal health units.",liberals
gpfrhx2,2021-03-02T01:46:56.000-08:00,‘justin trudeau is gutless’: brian kilmeade flames canadian pm for refusing to fight for keystone xl pipeline [removed],liberals
gpfrpt2,2021-03-02T01:48:32.000-08:00,"most canadians confident federal vaccine rollout is back on track: poll by september, the bulk of canadians will be vaccinated.  the government will exceed their delivery goal.  by december, we will have had another federal election, and conservative pundits will be calling for o'toole to resign to make way for the next harper cabinet minister....  or maybe... doug ford.",conservatives
gpfskod,2021-03-02T01:54:42.000-08:00,"‘justin trudeau is gutless’: brian kilmeade flames canadian pm for refusing to fight for keystone xl pipeline daily caller? seriously?       

there's nothing to fight. it's dead. it's an easy political win for him with the left. it's something obama had already done. we're not changing his mind.",liberals
gpfufz3,2021-03-02T02:08:15.000-08:00,‘justin trudeau is gutless’: brian kilmeade flames canadian pm for refusing to fight for keystone xl pipeline removed for rule 5.,liberals
gpfv5y6,2021-03-02T02:13:29.000-08:00,"liberals rhetorically support ndp pharmacare bill, then vote against it which they did because they knew they were broke and couldn't afford an election, not because of any desire to support the liberals (who would have likely gained seats).",liberals
gpfvfa2,2021-03-02T02:15:21.000-08:00,"biden spokesperson rules out helping canada, mexico with vaccine supply before all americans are inoculated do you mean the contracts we signed that obviously do not have tight delivery schedules?  while many others clearly and indisputably did have clear delivery schedules?  those contracts? 

can sino debunked ?  it was a major and puzzling screwup by trudeau.  after all that has happened with china , why would we eagerly commit to being screwed by the people’s liberation  army?",liberals
gu9ig1i,2021-04-12T01:31:18.000-07:00,"trudeau government threatens halifax security forum over proposed taiwan award worse really.

we ( or more precisely the us under nixon ) waited a while and then decided that brezhnev's ussr was worse then mao's china when choosing which side of the sino-soviet split to back and from that followed decades of getting closer to one while keeping the other as *the enemy*.

while there's many points in the history of russia/ussr and china where you might have a hard time telling which is worse or might even choose russia/ussr 1972 was not one of those years in my view and we really should have leaned the other way and recognized taiwan at the time.",liberals
gu9ix0d,2021-04-12T01:34:52.000-07:00,"jagmeet singh's convention speech: 'some of us are in leaky lifeboats, while others are in luxury yachts' [full transcript] &gt; canadians overwhelmingly support a wealth tax 

&amp;hellip; to pay for the costs of the pandemic.  be careful here about the phrasing.  i _absolutely agree_ that a wealth tax would be more popular as a pay-for than a broad tax increase, but i predict that the lpc will not be so stupid as to introduce the latter.

if the question is a wealth tax versus nothing, i think the latter wins.  it's a matter of diffuse benefits versus concentrated (and politically connected) costs.  if the ndp wants to push a wealth tax policy, then in my opinion the best way to campaign on it would be to frame it as a reshuffling of tax costs: raise a wealth tax and lower the gst.

&gt;  and believe inequality is a major problem. 

which unfortunately does not have a direct policy prescription.  there's no side-effect-free \"inequality\" knob for the government to turn.  and when you get down to the details, canadians tend to be happy with at least some aspects of that inequality; nobody would dare tax home equity on a current basis for example.

&gt; it actually pretty clear to me that the liberal base actually wants these kind of social democratic policies that the liberals are not going to deliver.

i don't think this is yet proven.  you can obviously point to slow/non-implementation of previous campaign promises like electoral reform or pharmacare as evidence that the liberal party is not in fact progressive, but since these facts are plain as day then why is a progressive youth wing still enthusiastic about the party?

&gt; the biggest problem for the ndp is that the liberals sound progressive and that's enough for most canadians.

i think maybe that is in fact enough for most canadians &amp;ndash; progressive policies are an admirable goal, but a slow and measured implementation may be enough.  this is more consistent with the political costs associated with implementation, where people really do have to concern themselves with the pay-fors, provincial negotiations, and limits of any implementation. 

as a more concrete example, look at pharmacare.  this is a net-good policy, but implementing it in a budget-neutral way requires white-collar-employed people to give up existing prescription coverage and pay a tax instead.  that shift of costs from the private to public side of the ledger is _visible_, which can easily make it unpopular.

this is also how quebec's public prescription coverage works.  ramq has a (low) baseline benefit and works acceptably as prescription insurance for the poor, elderly, and those facing catastrophic costs, but the [annual premium](https://www.ramq.gouv.qc.ca/en/citizens/prescription-drug-insurance/annual-premium) (currently $662/person/yr above an income threshold) is not cheap, and it's entirely avoided by those who receive an equivalent-or-better employee plan.",liberals
gu9j1fv,2021-04-12T01:35:46.000-07:00,trudeau government threatens halifax security forum over proposed taiwan award [removed],liberals
gu9k9s8,2021-04-12T01:44:47.000-07:00,"ipsos poll: lpc- 40%, cpc 30%, ndp 13%, bq 9%, grn 8% browse the ontario or toronto subreddits and you'll see just how many comments saying they absolutely refuse to vote conservative federally because of doug ford. even andrew scheer refused to meet with doug ford when he was campaigning in 2019 because he didn't want to be negatively associated with ford. 

many see the distinction at the two levels, and many do not. many far-left, pro-union, pro-labour groups have a policy \"abc - anything but conservative\" doesn't matter if it's federal or provincial. hell even buzz hargrove was thrown out of the ontario ndp over supporting some liberal candidates in the federal election. 

on the conservative side we see the same - people blindly voting conservative because they're not liberal/ndp.",conservatives
gu9kapr,2021-04-12T01:44:59.000-07:00,"canadians are ‘confused and anxious’: covid-19’s third wave making trudeau liberals ‘vulnerable,’ say pollsters ###this is a reminder to [read the rules before posting in this subreddit](https://www.reddit.com/r/canadapolitics/wiki/rules-thelongversion).
 
1. **headline titles should be changed only [when the original headline is unclear](https://www.reddit.com/r/canadapolitics/wiki/rules-thelongversion#wiki_1._headline_titles_should_be_changed_only_where_it_improves_clarity.)**
2. **be [respectful](https://www.reddit.com/r/canadapolitics/wiki/rules-thelongversion#wiki_2._be_respectful).**
3. **keep submissions and comments [substantive](https://www.reddit.com/r/canadapolitics/wiki/rules-thelongversion#wiki_3._keep_submissions_and_comments_substantive).**
4. **avoid [direct advocacy](https://www.reddit.com/r/canadapolitics/wiki/rules-thelongversion#wiki_4._avoid_direct_advocacy).**
5. **link submissions must be [about canadian politics and recent](https://www.reddit.com/r/canadapolitics/wiki/rules-thelongversion#wiki_5._link_submissions_must_be_canadian_and_recent).**
6. **post [only one news article per story](https://www.reddit.com/r/canadapolitics/wiki/rules-thelongversion#wiki_6._post_only_one_news_article_per_story).** ([with one exception](https://www.reddit.com/r/canadapolitics/comments/3wkd0n/rule_reminder_and_experimental_changes/))
7. **replies to removed comments or removal notices will be removed** without notice, at the discretion of the moderators.
8. **downvoting posts or comments**, along with urging others to downvote, **[is not allowed](https://www.reddit.com/r/canadapolitics/wiki/downvotes)** in this subreddit. bans will be given on the first offence.
9. **[do not copy &amp; paste the entire content of articles in comments](https://www.reddit.com/r/canadapolitics/wiki/rules-thelongversion#wiki_9._do_not_copy_.26amp.3b_paste_entire_articles_in_the_comments.)**. if you want to read the contents of a paywalled article, please consider supporting the media outlet.

*please [message the moderators](https://www.reddit.com/message/compose?to=%2fr%2fcanadapolitics) if you wish to discuss a removal.* **do not reply to the removal notice in-thread**, *you will not receive a response and your comment will be removed. thanks.*


*i am a bot, and this action was performed automatically. please [contact the moderators of this subreddit](/message/compose/?to=/r/canadapolitics) if you have any questions or concerns.*",liberals
gu9kisa,2021-04-12T01:46:38.000-07:00,"justin trudeau hasn’t delivered on his pledge to establish public pharmacare ###this is a reminder to [read the rules before posting in this subreddit](https://www.reddit.com/r/canadapolitics/wiki/rules-thelongversion).
 
1. **headline titles should be changed only [when the original headline is unclear](https://www.reddit.com/r/canadapolitics/wiki/rules-thelongversion#wiki_1._headline_titles_should_be_changed_only_where_it_improves_clarity.)**
2. **be [respectful](https://www.reddit.com/r/canadapolitics/wiki/rules-thelongversion#wiki_2._be_respectful).**
3. **keep submissions and comments [substantive](https://www.reddit.com/r/canadapolitics/wiki/rules-thelongversion#wiki_3._keep_submissions_and_comments_substantive).**
4. **avoid [direct advocacy](https://www.reddit.com/r/canadapolitics/wiki/rules-thelongversion#wiki_4._avoid_direct_advocacy).**
5. **link submissions must be [about canadian politics and recent](https://www.reddit.com/r/canadapolitics/wiki/rules-thelongversion#wiki_5._link_submissions_must_be_canadian_and_recent).**
6. **post [only one news article per story](https://www.reddit.com/r/canadapolitics/wiki/rules-thelongversion#wiki_6._post_only_one_news_article_per_story).** ([with one exception](https://www.reddit.com/r/canadapolitics/comments/3wkd0n/rule_reminder_and_experimental_changes/))
7. **replies to removed comments or removal notices will be removed** without notice, at the discretion of the moderators.
8. **downvoting posts or comments**, along with urging others to downvote, **[is not allowed](https://www.reddit.com/r/canadapolitics/wiki/downvotes)** in this subreddit. bans will be given on the first offence.
9. **[do not copy &amp; paste the entire content of articles in comments](https://www.reddit.com/r/canadapolitics/wiki/rules-thelongversion#wiki_9._do_not_copy_.26amp.3b_paste_entire_articles_in_the_comments.)**. if you want to read the contents of a paywalled article, please consider supporting the media outlet.

*please [message the moderators](https://www.reddit.com/message/compose?to=%2fr%2fcanadapolitics) if you wish to discuss a removal.* **do not reply to the removal notice in-thread**, *you will not receive a response and your comment will be removed. thanks.*


*i am a bot, and this action was performed automatically. please [contact the moderators of this subreddit](/message/compose/?to=/r/canadapolitics) if you have any questions or concerns.*",liberals
gu9laid,2021-04-12T01:52:17.000-07:00,"canadians are ‘confused and anxious’: covid-19’s third wave making trudeau liberals ‘vulnerable,’ say pollsters [removed]",liberals
gu9levn,2021-04-12T01:53:09.000-07:00,"justin trudeau hasn’t delivered on his pledge to establish public pharmacare has anyone else noticed that when there's an article dragging on trudeau it uses an older photo of him?  i thought this article was from 2016 from the picture. the new ndp ad does the same thing. 

&gt;the new democratic party recently brought forward the canada pharmacare act (bill c-213) in a largely symbolic attempt to test the trudeau government’s commitment. 

largely symbolic is a good way to describe it.  the ndp bill wasn't workable and they knew it.  no duh that it failed. too bad too, maybe if it had been a more serious attempt it would have passed.  who can say. as it was, it wasnt about actually passing it it was about getting attach articles like this.  anyone else tired of the the political game show?",liberals
gu9m41d,2021-04-12T01:58:17.000-07:00,"before liberals get too excited about mark carney, they should remember michael ignatieff [removed]",liberals
gu9m5e3,2021-04-12T01:58:34.000-07:00,"these \"hot spots\" getting vaccine priority are less hard-hit by covid-19 than ontario average if this conspiracy theory had any truth to it, there would be a lot more than four fsas prioritized in conservative-friendly ridings.

the actual story is pretty simple - fsas are smaller in long-standing urban areas which allows finer prioritization, and those urban areas rarely vote for conservatives. in suburban areas, many fsas will contain a mix of low-risk and high-risk areas, and those high-risk areas are probably at a higher risk than downtown hamilton and suburban niagara falls.",conservatives
gu9maca,2021-04-12T01:59:35.000-07:00,"ranger unit failed to deal with extremist members, says army investigation report &gt;is this individual racist? 

from the article
&gt;myggland's ex-wife was also a member of 4crpg. she acknowledged in an email exchange with cbc news last year that she briefly supported her ex-husband in his association with the two groups but quit them after seeing racist activity.

so it was racist enough for his ex wife to leave the group over.  that's what op was talking about.


&gt;not all far right wingers are racist.

that venn diagram is damn near a circle.  if someone starts spouting about trudeau for treason or saying he's coming to steal  your guns it's reasonable to assume they're not too keen on minorities.",liberals
gu9mtqp,2021-04-12T02:03:35.000-07:00,trudeau winds up liberal convention with election campaign-style speech mps know it's coming and are preparing. obviously it could still be called off but the plan is for an election this year.,liberals
gu9n45q,2021-04-12T02:05:43.000-07:00,"jagmeet singh’s push to win over ordinary people on the point of jagmeet's image, i do think the ndp went into the post-mulcair era looking for their answer to trudeau, i.e. a very photogenic leader. i agree i'd rather see a more authentic leader, but he won leadership pretty decisively and considering every other party is inauthentic and hollow anyways, it's not going to keep me from voting for them.",liberals
gu9n8nx,2021-04-12T02:06:38.000-07:00,"ipsos poll: lpc- 40%, cpc 30%, ndp 13%, bq 9%, grn 8% and, indeed, by becoming more conservative those areas turned other ridings off the conservatives. dumb politics.",conservatives
gu9o8gc,2021-04-12T02:13:58.000-07:00,"canadians are ‘confused and anxious’: covid-19’s third wave making trudeau liberals ‘vulnerable,’ say pollsters regionally this is a pretty good liberal poll. 

however, i think they will drop some in the coming weeks. this third wave is a pretty big kick in the teeth even with optimism about vaccines. 

that could start turning around if cases start dropping in a few weeks and vaccines get up to the 40% or so with one shot range. but i can see them slipping until at least then.

edit: yea, a little slippage in most recent nanos as well. down to an 8/9 pt spread rather than the 12 or so it was before. nanos is a rolling average (i think with new data added to old) so i tend to look at it for trends rather than anything else. 

i think this third wave is a pretty easy moment for the general public to finally lose patience with waiting for normalcy and impose some political consequences. it’s ironic because honestly, the third wave being so bad is mostly on the provinces imo but life isn’t fair.

the good thing for the liberals is that they will be able to wait until the vaccines start kicking in, the economy picks up and it’s summer before they even have to think about calling an election. i doubt the opposition would try to force one.

edit: what’s the estimate for 50% with at least one shot? it’s almost 20% today.",liberals
gu9otq5,2021-04-12T02:18:17.000-07:00,"the liberal convention: everything now &gt;every inch of space in my heart  
is filled with something i'll never start 

arcade fire - everything now

both the liberals and national media constantly push for the same issues with little, if any, discussion about the logistics or costs involved.

national high speed rail?  if one person or group doesn't like the route or concept, they will tie it up in court for decades.

national child care?  that is provincial jurisdiction and i question if ford and kenney are onboard with another big national program that the feds could cut funding for (like they did to health care in the 90s) leaving them to either pick up the bill or endure the unpopularity of scaling it back.

long term care...again, provincial jurisdiction.

it is great they are on the same page, they are just at the wrong level of government to accomplish it.",liberals
gu9otxi,2021-04-12T02:18:19.000-07:00,"jagmeet singh's convention speech: 'some of us are in leaky lifeboats, while others are in luxury yachts' [full transcript] &gt;if the question is a wealth tax versus nothing, i think the latter wins.

okay, do you have a shred of evidence to back that up?

&gt;… to pay for the costs of the pandemic.  be careful here about the phrasing.

[a strong majority of canadians supported a wealth tax in 2019 too.](https://i.imgur.com/exuuzqb.png)

&gt;nobody would dare tax home equity on a current basis for example.

i might be confused by what you mean here, but isn't this just property tax?

&gt;i don't think this is yet proven.  you can obviously point to  slow/non-implementation of previous campaign promises like electoral  reform or pharmacare as evidence that the liberal party is not in fact  progressive, but since these facts are plain as day then why is a  progressive youth wing still enthusiastic about the party?

i think we can take people at their word that they want the things they say they want. the question of why people say they want these things and then support a party that doesn't deliver them is a good one. i don't have any hard evidence here, but when i talk to liberal voters i know, the number one motivation seems to be avoiding a conservative government. the second factor is that most people simply don't track policy that closely and think that the liberal government is just doing a lot more than it really is. how much longer this can hold up is an interesting question. six years in, i've certainly noticed an increase in skepticism driven by the lack of progress on files like childcare, pharmacare and housing. these are areas where soaring liberal rhetoric really fails to match realities. the final thing i'll say is that american politics has really infected us. i don't know of a good way to measure this, but i do suspect that canadians regard politics in a more polarized and less nuanced way than they used to.

&gt;as a more concrete example, look at pharmacare.  this is a net-good  policy, but implementing it in a budget-neutral way requires  white-collar-employed people to give up existing prescription coverage  and pay a tax instead.  that shift of costs from the private to public  side of the ledger is *visible*, which can easily make it unpopular.

is it really though? the government could implement universal pharmacare, implement an employer-side payroll tax of roughly equal cost and regular people would barely know the difference. i know the idea that 'taxes are unpopular' is practically canon in liberal circles, but the foundation of this belief seems incredibly shakey.",liberals
gu9ox68,2021-04-12T02:18:58.000-07:00,"o'toole will vote against mp's private member's bill on sex-selective abortion ###this is a reminder to [read the rules before posting in this subreddit](https://www.reddit.com/r/canadapolitics/wiki/rules-thelongversion).
 
1. **headline titles should be changed only [when the original headline is unclear](https://www.reddit.com/r/canadapolitics/wiki/rules-thelongversion#wiki_1._headline_titles_should_be_changed_only_where_it_improves_clarity.)**
2. **be [respectful](https://www.reddit.com/r/canadapolitics/wiki/rules-thelongversion#wiki_2._be_respectful).**
3. **keep submissions and comments [substantive](https://www.reddit.com/r/canadapolitics/wiki/rules-thelongversion#wiki_3._keep_submissions_and_comments_substantive).**
4. **avoid [direct advocacy](https://www.reddit.com/r/canadapolitics/wiki/rules-thelongversion#wiki_4._avoid_direct_advocacy).**
5. **link submissions must be [about canadian politics and recent](https://www.reddit.com/r/canadapolitics/wiki/rules-thelongversion#wiki_5._link_submissions_must_be_canadian_and_recent).**
6. **post [only one news article per story](https://www.reddit.com/r/canadapolitics/wiki/rules-thelongversion#wiki_6._post_only_one_news_article_per_story).** ([with one exception](https://www.reddit.com/r/canadapolitics/comments/3wkd0n/rule_reminder_and_experimental_changes/))
7. **replies to removed comments or removal notices will be removed** without notice, at the discretion of the moderators.
8. **downvoting posts or comments**, along with urging others to downvote, **[is not allowed](https://www.reddit.com/r/canadapolitics/wiki/downvotes)** in this subreddit. bans will be given on the first offence.
9. **[do not copy &amp; paste the entire content of articles in comments](https://www.reddit.com/r/canadapolitics/wiki/rules-thelongversion#wiki_9._do_not_copy_.26amp.3b_paste_entire_articles_in_the_comments.)**. if you want to read the contents of a paywalled article, please consider supporting the media outlet.

*please [message the moderators](https://www.reddit.com/message/compose?to=%2fr%2fcanadapolitics) if you wish to discuss a removal.* **do not reply to the removal notice in-thread**, *you will not receive a response and your comment will be removed. thanks.*


*i am a bot, and this action was performed automatically. please [contact the moderators of this subreddit](/message/compose/?to=/r/canadapolitics) if you have any questions or concerns.*",conservatives
gu9pc49,2021-04-12T02:21:57.000-07:00,"no, the ndp doesn’t have a ‘pathological preoccupation’ with israel because like i’ve said before, i’d rather have three strong parties rather than the liberals, tories, annd “alsoran” student activists.",liberals
