gzzxgy8,2021-05-30T04:12:51.000-07:00,"opinion: the term ‘bipoc’ is a bad fit for the canadian discourse on race &gt; why are we still talking about that? he wasn't.

i wasn't referring to trudeau specifically. 

&gt; he didn't grow up as one. 

he did his high school studies in french, and his dad made the whole family speak french in certain areas at home, notably at the kitchen table. that doesn't give justin any \"merit\" whatsoever, but he still spent a good portion of of his years growing up by speaking french.

&gt; he didn't grow up as one. he didn't experience living as a minority language speaker in canada because he is perfectly happy to switch to his mother tongue when the situation requires.

which is applicable to a large amount of francophones too. many have been and still are more than happy to switch to english.

&gt; when he gets tired, it's french he loses, not english.

a problem that encountered by many francophones outside quebec. if you know that much about trudeau's struggles in french, than you know about the original context in which this was published, which was about insecure francophones struggling with their mother tongue in anglophone pockets. 

&gt; the framing of him as a francophone by federalists and canadians is a clumsy attempt to cheapen and demean what it means to be a francophone in canada.

\"what it means to be francophone\" has become an increasingly more vague aspect. because the english-centric oppression has gotten significantly weaker in the past decades with the quiet revolution and bill 101, as francophones get jobs, climb the corporate ladder, etc., experiences of francophones are less and less coherent with each other. 

&gt; when i start using english regularly, i start to be able to pass as a native anglophone yet i am not. like trudeau in french i have little buy in into that culture. i'm currently learning a third language and while it will be a rewarding experience i won't be anywhere near able to understand the native experience and it would be insulting to natives to pretend i do.

if you speak english outside of your personal life, and french otherwise, then it would be weird to call yourself an anglophone. it's a much harder call to make when languages are intertwined in your personal life, however, which is the case of many second-generation immigrants, francophones outside quebec and families like trudeau's.",liberals
gzzzw3w,2021-05-30T04:32:53.000-07:00,"with a majority in reach, the liberals are courting quebec ridings held by the bloc alberta is trying to change - i don’t know about sask or manitoba, but that’s irrelevant. these provinces all vote for parties that run in every single province.",liberals
h000d1w,2021-05-30T04:36:45.000-07:00,"with a majority in reach, the liberals are courting quebec ridings held by the bloc [removed]",liberals
h00265j,2021-05-30T04:51:39.000-07:00,terry glavin: of course trudeau refused to say 'genocide.' he has zero credibility on china [deleted],liberals
hjhpy25,2021-11-05T10:49:43.000-07:00,"google warns liberals' online harms bill 'will result in the blocking of legitimate content' but you fools voted for them folks.  so suck it up and be censored, control your speech, change your pronouns,   blah blah….be happy because those are sunny ways.",liberals
hjhqdl3,2021-11-05T10:52:59.000-07:00,"google warns liberals' online harms bill 'will result in the blocking of legitimate content' fennec f-droid (firefox) + decentraleyes, privacy badger, https everywhere, noscript, ublockorigin is my prefered combo. a silent \"take that\" to google lol

i could be missing something, but i think that covers most of what google wants from me anyways.",liberals
hjhqwzy,2021-11-05T10:57:07.000-07:00,"o’toole asks mps to keep quiet on hot-button political issues o'toole asks gladu to \"please, just please.  stop acting like a horse's ass.  this is worse than the costumes and the poetry.\"",conservatives
hjhtfdq,2021-11-05T11:16:28.000-07:00,google warns liberals' online harms bill 'will result in the blocking of legitimate content' [deleted],liberals
hjhtlpo,2021-11-05T11:17:49.000-07:00,google warns liberals' online harms bill 'will result in the blocking of legitimate content' can we just let quebec who’s the one pushing for these laws to become a shitty police state while the rest of us have actual freedom and rights.,liberals
hjhtoh6,2021-11-05T11:18:24.000-07:00,google warns liberals' online harms bill 'will result in the blocking of legitimate content' i remember seeing your account name on another post i upvoted. your comments are funny. you’re funny.. but maybe too funny. flagged,liberals
hjhtwsp,2021-11-05T11:20:10.000-07:00,google warns liberals' online harms bill 'will result in the blocking of legitimate content' i’m not your buddy guy,liberals
hjhuk3h,2021-11-05T11:25:09.000-07:00,google warns liberals' online harms bill 'will result in the blocking of legitimate content' [deleted],liberals
hjhvwx1,2021-11-05T11:35:39.000-07:00,"google warns liberals' online harms bill 'will result in the blocking of legitimate content' yes because at least i can vote them out of office. 

the voters in alphabet inc are shareholders and they don’t care what we think.",liberals
hjhvx3f,2021-11-05T11:35:42.000-07:00,"google warns liberals' online harms bill 'will result in the blocking of legitimate content' people need to realize these algorithms know us better than we know ourselves collectively. they use this collected  
information to shape our wants, preferences and even opinions.   


it's really marketing being taken to the extreme ultimately allowing foreign governments to sow division through disinformation, targeted advertising and false accounts.   


i far more trust my government to regulate this transparently than any mega-corporations driven by profits and the benefits of this disinformation. facebook (for ex.) has repeatedly done the wrong thing and buried its head in the pile of money anytime there is public outcry. we can't sit on our hands and call it protected free speech anymore.",liberals
hjhwjjc,2021-11-05T11:40:32.000-07:00,google warns liberals' online harms bill 'will result in the blocking of legitimate content' i didn’t vote for them :),liberals
hjhws89,2021-11-05T11:42:24.000-07:00,macdougall: conservatives need to start picking fights they can win that party is gonna grow,conservatives
glcw5sx,2021-01-29T19:10:51.000-08:00,"np view: trudeau botched payette appointment. her replacement should be dull as dishwater ###this is a reminder to [read the rules before posting in this subreddit](https://www.reddit.com/r/canadapolitics/wiki/rules-thelongversion).
 
1. **headline titles should be changed only [when the original headline is unclear](https://www.reddit.com/r/canadapolitics/wiki/rules-thelongversion#wiki_1._headline_titles_should_be_changed_only_where_it_improves_clarity.)**
2. **be [respectful](https://www.reddit.com/r/canadapolitics/wiki/rules-thelongversion#wiki_2._be_respectful).**
3. **keep submissions and comments [substantive](https://www.reddit.com/r/canadapolitics/wiki/rules-thelongversion#wiki_3._keep_submissions_and_comments_substantive).**
4. **avoid [direct advocacy](https://www.reddit.com/r/canadapolitics/wiki/rules-thelongversion#wiki_4._avoid_direct_advocacy).**
5. **link submissions must be [about canadian politics and recent](https://www.reddit.com/r/canadapolitics/wiki/rules-thelongversion#wiki_5._link_submissions_must_be_canadian_and_recent).**
6. **post [only one news article per story](https://www.reddit.com/r/canadapolitics/wiki/rules-thelongversion#wiki_6._post_only_one_news_article_per_story).** ([with one exception](https://www.reddit.com/r/canadapolitics/comments/3wkd0n/rule_reminder_and_experimental_changes/))
7. **replies to removed comments or removal notices will be removed** without notice, at the discretion of the moderators.
8. **downvoting posts or comments**, along with urging others to downvote, **[is not allowed](https://www.reddit.com/r/canadapolitics/wiki/downvotes)** in this subreddit. bans will be given on the first offence.
9. **[do not copy &amp; paste the entire content of articles in comments](https://www.reddit.com/r/canadapolitics/wiki/rules-thelongversion#wiki_9._do_not_copy_.26amp.3b_paste_entire_articles_in_the_comments.)**. if you want to read the contents of a paywalled article, please consider supporting the media outlet.

*please [message the moderators](https://www.reddit.com/message/compose?to=%2fr%2fcanadapolitics) if you wish to discuss a removal.* **do not reply to the removal notice in-thread**, *you will not receive a response and your comment will be removed. thanks.*


*i am a bot, and this action was performed automatically. please [contact the moderators of this subreddit](/message/compose/?to=/r/canadapolitics) if you have any questions or concerns.*",liberals
glcxoq0,2021-01-29T19:34:23.000-08:00,sean speer: the struggle for the moral foundations of the conservative party [removed],conservatives
glcxvtz,2021-01-29T19:37:25.000-08:00,"gun advocates, social conservatives question place in o’toole’s party &gt; so i'm correct on all four points, this is an american cultural war dragged up into canadian soil. thank you for confirming.

ah yes the good old ingore all the points and pretend your correct. 

the only american cultural being dragged into canada is an assault weapon ban.",conservatives
gld16np,2021-01-29T20:27:17.000-08:00,"majority of canadians oppose trudeau government’s immigration plan: study yes like his beautiful hairline. seriously i bet more then 50% of the population voted for him because he is so handsome. i remember his first election, first i saw him i saw through all his lies.",liberals
gld17ab,2021-01-29T20:27:32.000-08:00,"majority of canadians oppose trudeau government’s immigration plan: study /u/meat-vehicle, i have found an error in your comment:

 &gt; “bet more ~~then~~ [**than**] 50%”

in this post, you, meat-vehicle, ought to have used “bet more ~~then~~ [**than**] 50%” instead. unlike the adverb ‘then’, ‘than’ compares.

 ^(this is an automated bot. i do not intend to shame your mistakes. if you think the errors which i found are incorrect, please contact me through dms or contact my owner elitedamyth!)",liberals
gld2ukf,2021-01-29T20:50:07.000-08:00,"jesse kline: moderna cutting vaccine shipments by a quarter another blow to trudeau ###this is a reminder to [read the rules before posting in this subreddit](https://www.reddit.com/r/canadapolitics/wiki/rules-thelongversion).
 
1. **headline titles should be changed only [when the original headline is unclear](https://www.reddit.com/r/canadapolitics/wiki/rules-thelongversion#wiki_1._headline_titles_should_be_changed_only_where_it_improves_clarity.)**
2. **be [respectful](https://www.reddit.com/r/canadapolitics/wiki/rules-thelongversion#wiki_2._be_respectful).**
3. **keep submissions and comments [substantive](https://www.reddit.com/r/canadapolitics/wiki/rules-thelongversion#wiki_3._keep_submissions_and_comments_substantive).**
4. **avoid [direct advocacy](https://www.reddit.com/r/canadapolitics/wiki/rules-thelongversion#wiki_4._avoid_direct_advocacy).**
5. **link submissions must be [about canadian politics and recent](https://www.reddit.com/r/canadapolitics/wiki/rules-thelongversion#wiki_5._link_submissions_must_be_canadian_and_recent).**
6. **post [only one news article per story](https://www.reddit.com/r/canadapolitics/wiki/rules-thelongversion#wiki_6._post_only_one_news_article_per_story).** ([with one exception](https://www.reddit.com/r/canadapolitics/comments/3wkd0n/rule_reminder_and_experimental_changes/))
7. **replies to removed comments or removal notices will be removed** without notice, at the discretion of the moderators.
8. **downvoting posts or comments**, along with urging others to downvote, **[is not allowed](https://www.reddit.com/r/canadapolitics/wiki/downvotes)** in this subreddit. bans will be given on the first offence.
9. **[do not copy &amp; paste the entire content of articles in comments](https://www.reddit.com/r/canadapolitics/wiki/rules-thelongversion#wiki_9._do_not_copy_.26amp.3b_paste_entire_articles_in_the_comments.)**. if you want to read the contents of a paywalled article, please consider supporting the media outlet.

*please [message the moderators](https://www.reddit.com/message/compose?to=%2fr%2fcanadapolitics) if you wish to discuss a removal.* **do not reply to the removal notice in-thread**, *you will not receive a response and your comment will be removed. thanks.*


*i am a bot, and this action was performed automatically. please [contact the moderators of this subreddit](/message/compose/?to=/r/canadapolitics) if you have any questions or concerns.*",liberals
h7dgtuu,2021-08-01T10:26:28.000-07:00,erin o’toole approaches an election with a party so fractured that some conservatives want him to lose [deleted],conservatives
h7dgyhg,2021-08-01T10:27:36.000-07:00,erin o’toole approaches an election with a party so fractured that some conservatives want him to lose [deleted],conservatives
h7dgzt9,2021-08-01T10:27:57.000-07:00,erin o’toole approaches an election with a party so fractured that some conservatives want him to lose [deleted],conservatives
h7dhfyo,2021-08-01T10:31:57.000-07:00,"crimes have been committed against canada’s indigenous people. justin trudeau has no excuse for not bringing the perpetrators to justice it's not just an academic political exercise. you just need to look south of our border to see what happens when the leader of a country starts ordering the attorney general around. it's fine when you have someone sane and competent in charge, but if you don't then it's exactly the kind of thing that leads to dictatorship and corruption.",liberals
h7dhgpp,2021-08-01T10:32:09.000-07:00,erin o’toole approaches an election with a party so fractured that some conservatives want him to lose [deleted],conservatives
h7dhw3u,2021-08-01T10:35:59.000-07:00,a fall election? the liberals may not get a better window. [deleted],liberals
h7dhwz7,2021-08-01T10:36:12.000-07:00,"erin o’toole approaches an election with a party so fractured that some conservatives want him to lose o'toole is very electable. it's the party that's become unelectable because it is beholden to extremists, much like the republican party in the u.s. it's just become too divided on policy.",conservatives
h7dhy5d,2021-08-01T10:36:28.000-07:00,erin o’toole approaches an election with a party so fractured that some conservatives want him to lose [deleted],conservatives
h7di4bv,2021-08-01T10:38:01.000-07:00,"'be ready for aug. 8’: some senior liberals expect to kick off federal election campaign in a week i’m all in for supporting the ndp candidate in my riding if they show up and mount a proper campaign against the cpc member we have now. 

the liberals don’t seem to make much of sn effort where i live anyways. 

i like what singh’s been saying and interacting with the public on.",liberals
h7diolf,2021-08-01T10:43:00.000-07:00,"the burning of canada’s churches well said. this is pretty much where i'm at too.

 i have a lot more in common ideologically with the left. i'm pro choice, i strongly support organized labor, i'm not opposed to environmental regulation, and i have little in common with social conservatives.

during the last few years i've been seeing more and more stuff like this that i can't ignore and i'm not willing to make excuses for. and it seems like if i'm not willing to back this stuff 100%, a lot of the left views me as an enemy or a conservative. these days even acknowledging that any act of violence is wrong and should not be tolerated is often enough to be categorized as a conservation, or often even have accusations of racism tossed around.

i'm not downplaying what happened with the residential schools and i'm open to further investigation. but trying to correct a historical wrong through acts of violence is never ok, and it will only lead to more violence in the future. so its incredibly disappointing to see our leaders remain largely silent on this, because they view it as politically beneficial.",conservatives
h7dj5ys,2021-08-01T10:47:21.000-07:00,trudeau: “every woman in canada has a right to a safe and legal abortion” 1000% yes,liberals
h7dj7gu,2021-08-01T10:47:44.000-07:00,'be ready for aug. 8’: some senior liberals expect to kick off federal election campaign in a week [removed],liberals
h7dj7wz,2021-08-01T10:47:51.000-07:00,'be ready for aug. 8’: some senior liberals expect to kick off federal election campaign in a week me too! i can’t wait!,liberals
h7dj8xz,2021-08-01T10:48:06.000-07:00,erin o’toole approaches an election with a party so fractured that some conservatives want him to lose [removed],conservatives
h7dja8c,2021-08-01T10:48:26.000-07:00,"'be ready for aug. 8’: some senior liberals expect to kick off federal election campaign in a week if they can keep their seats, that is.",liberals
h7djuu0,2021-08-01T10:53:31.000-07:00,"erin o’toole approaches an election with a party so fractured that some conservatives want him to lose spot on. exactly my assessment on every point, especially charest, even though he does have some baggage.

the problem i think the party faces now is its well deserved (imo) association with the post-reform socons. and to fix that i think they need to find a charest, over even an o’toole maybe, who is willing to punt an election cycle or two and spend the time rebuilding the party’s image, and who knows, maybe come up with some attractive policies.

the base will never stand for this though.",conservatives
h7djwy4,2021-08-01T10:54:03.000-07:00,"justin trudeau said ottawa would ban conversion therapy. cities across canada aren’t waiting for him to keep that promise a week old account whose comments are solely about hating on trudeau? nope, nothing to see here",liberals
h7dkry5,2021-08-01T11:01:43.000-07:00,"crimes have been committed against canada’s indigenous people. justin trudeau has no excuse for not bringing the perpetrators to justice except the pmo does order the ag around. see: snc-lavalin scandal.

furthermore, you and i both know pushing for extradition has very little to some the the ag and more to do with the pmo and global affairs canada. pretending otherwise is just sad.",liberals
h7dl2rz,2021-08-01T11:04:23.000-07:00,"crimes have been committed against canada’s indigenous people. justin trudeau has no excuse for not bringing the perpetrators to justice it's exactly why snc lavalin was such a huge fucking scandal, and that wasn't even an instance where the pm gave a blatant direct order to the ag, but he exerted \"undue influence\". and again, i hate to repeat myself, but my response was to the article that the op linked. it doesn't mention anything about extradition. it is about demanding that justin trudeau order the attorney general to appoint a special prosecutor. if you want to be mad about justin trudeau failing to get a rapist priest extradited, then you should be mad about that, but that's outside the scope of this discussion.",liberals
h7dliyy,2021-08-01T11:08:25.000-07:00,"'be ready for aug. 8’: some senior liberals expect to kick off federal election campaign in a week like... we're interested in hearing concrete policies here, not the end result? it's like saying you're gonna make government less corrupt or more efficient, if you don't tell us how all you're telling us is an aspiration. is the ndp planning to create a crown corp developer and develop housing directly? do they have a plan to cut red tape that slows down existing housing development? are they just going to subsidize existing developers to make them build more housing somehow? (which still would presumably require getting rid of the red tape)

i think a lot of us are skeptical of campaign promises that don't have an actual policy plan attached, because an objective without a plan is mostly just campaign fluff.",liberals
h7dm86m,2021-08-01T11:14:38.000-07:00,"erin o’toole approaches an election with a party so fractured that some conservatives want him to lose you know that aggregate weigh different polls based on historical leans and differences in methodology right? the point of using aggregates is to account for that.

and they are not anecdotes? that such a weird thing to say lol. i'm not here telling you about what i heard from my neightbours.",conservatives
h7dm8f8,2021-08-01T11:14:41.000-07:00,a fall election? the liberals may not get a better window. [removed],liberals
h7dn16b,2021-08-01T11:21:42.000-07:00,erin o’toole approaches an election with a party so fractured that some conservatives want him to lose kenny is just as bad as bernier,conservatives
h7dn9bb,2021-08-01T11:23:42.000-07:00,erin o’toole approaches an election with a party so fractured that some conservatives want him to lose [removed],conservatives
h7dnfxt,2021-08-01T11:25:18.000-07:00,'be ready for aug. 8’: some senior liberals expect to kick off federal election campaign in a week [removed],liberals
h7dni41,2021-08-01T11:25:51.000-07:00,'be ready for aug. 8’: some senior liberals expect to kick off federal election campaign in a week [removed],liberals
h7dnoru,2021-08-01T11:27:25.000-07:00,erin o’toole approaches an election with a party so fractured that some conservatives want him to lose [removed],conservatives
h7dnx9q,2021-08-01T11:29:29.000-07:00,"erin o’toole approaches an election with a party so fractured that some conservatives want him to lose &gt; trump still got more votes than any other presidential candidate ever save joe biden and biden didn’t have the ndp cutting him off at the knees.

on the contrary, many \"establishment republicans\" wanted trump to lose. 

that's was the whole point behind projects like the so-called lincoln project.

https://en.wikipedia.org/wiki/the_lincoln_project",conservatives
hjtcci6,2021-11-07T23:45:40.000-08:00,ndp and liberals in talks to keep minority government in power removed for rule 2.,liberals
hjtcx16,2021-11-07T23:49:34.000-08:00,"ndp and liberals in talks to keep minority government in power more opinions without evidence? what fun! it must be impressive to watch you dominate debates with the tactic of \"pedantically insisting that you're right just because you said so\"",liberals
hjtd4tt,2021-11-07T23:51:04.000-08:00,ndp and liberals in talks to keep minority government in power removed for rule 2.,liberals
hjtd8el,2021-11-07T23:51:45.000-08:00,ndp and liberals in talks to keep minority government in power removed for rule 2.,liberals
hjtd8pf,2021-11-07T23:51:48.000-08:00,ndp and liberals in talks to keep minority government in power removed for rule 2.,liberals
hjtdfk3,2021-11-07T23:53:09.000-08:00,ndp and liberals in talks to keep minority government in power removed for rule 3.,liberals
hjtdsh9,2021-11-07T23:55:37.000-08:00,"alberta government should refuse equalization if liberals plans to cap emission. there has to be some retaliation. so will having all alberta residents drink poison and die. no more income tax from alberta! boy, they sure showed those jerks in ottawa :) 

it's about the same thing. alberta couldn't survive for very long as a landlocked independent country on it's own. it's just not a real thing. 

i really don't think the equalization system is fair at all and at minimum needs a massive overhaul and simplification, but lets try to keep it real shall we?",liberals
hjtdv8p,2021-11-07T23:56:09.000-08:00,"ndp and liberals in talks to keep minority government in power remember when the election started and liberal partisans were trying to convince us that it wasn't just a cynical ploy for power? remember how nobody believed that, and they immediately lost their lead in the polls after calling the election? that's what will happen again if they don't cooperate with the ndp.",liberals
hjte7mg,2021-11-07T23:58:31.000-08:00,google warns liberals' online harms bill 'will result in the blocking of legitimate content' removed for rule 2.,liberals
hjtfkf0,2021-11-08T00:07:45.000-08:00,"pipeline pile-on: biden faces heat from canada, republicans, michigan’s governor and the price of propane in a bid to avoid unpopular fuel issues in the areas that are the liberal base, irrespective of the need to accelerate the energy transition, trudeau liberals are on the same side as the republicans.",liberals
hjtgngf,2021-11-08T00:15:09.000-08:00,"jeffrey f. collins: without plan for new submarines canada faces defence gap in the arctic sorry, just so i understand, the national post's jeffery f collins wants justin trudeau to have access to nuclear submarines?  neat.",liberals
hjtgx0a,2021-11-08T00:16:56.000-08:00,ndp and liberals in talks to keep minority government in power [deleted],liberals
