hhrqb01,2021-10-23T04:53:02.000-07:00,"ndp will vote against the liberals ‘if they do something that hurts canadians,’ jagmeet singh says i'd argue that since this principle has been used for every government since confederation that it is a standard aspect of our country's parliamentary system, and that defeating a government bill should be considered confidence. if the government can't pass its agenda then the pm should be dismissed and either an election is called or the opposition should try to form government.",liberals
hhrqg00,2021-10-23T04:54:03.000-07:00,"conservatives, just get your shots already the stupidity of an elected official refusing the vaccine during a pandemic has nothing to do with liberal narratives. the fact that they didn't expect they'd be banned from parliament for doing it doesn't make it an intelligent choice.",conservatives
hhrqmd1,2021-10-23T04:55:20.000-07:00,"o'toole does about-face on vaccine mandate for mps in commons, now says decision 'infringes' on their rights how much more likely, and what is the rate of asymptomatic spread from the unvaccinated to the vaccinated?

you said it yourself the vaccinated are still a threat to eachother, and everyone else. the question is exactly how much of a threat? and does that justify trampling people's democratic rights.

assuming a quarter of the conservative leadership isn't vaccinated(i don't believe they've stated how many arent) that would still put the vaccine coverage at about 92%. thats safer than the national average. exactly how many people need to be vaccinated for it to be safe enough?

how about instead every mp has to participate in a routine antigen test. it's a much safer and fairer way for them to operate. no one is unconstituionally barred from representing or being represented. it would drastically reduce transmissions, and even if there is a spreader event it will be smaller and easily traced.",conservatives
hhru2z5,2021-10-23T05:20:28.000-07:00,"conservatives, just get your shots already [removed]",conservatives
hhrudbt,2021-10-23T05:22:33.000-07:00,"doug ford says the quiet part about canada’s view of immigrants out loud can someone explain to me how someone with no skills or economic benefit can be immigrated into a country? 

not talking refugee, or asylum seekers or anything. i had a buddy just go off on a complete tangent about how we one want \"the good ones\" how they're a \"drain on the system\". that trudeau wants to bring in hundreds of thousands of them and something about having no borders and no country. 

frankly, i am concerned. there are a lot of accusations here. but, to me there just seems to be no difference to some of these people.",liberals
hhrv4q8,2021-10-23T05:28:12.000-07:00,"trans rights? yes. toxic, in-your-face activism? no you sound like one of those white liberals who call black trump supporters \"uncle toms\". 

why would you think the author advocates for repressing transgender rights? i can't find anything in the article that seems to indicate that. she disagrees with the mainstream trans narrative, and i know this is very controversial, but i think that's very different that hating transgender people. it seems quite clear she's writing the article with the goal of increasing the rights of trans people through what she views as a more effective strategy of activism.",liberals
gz5hf4d,2021-05-22T21:46:18.000-07:00,trudeau tightens up mortgage rules after macklem sounds housing alarm people want suburbs. we live in a democracy. urbanism wont solve the housing problem because it's not what the majority want.,liberals
gz5hixp,2021-05-22T21:47:44.000-07:00,"trudeau tightens up mortgage rules after macklem sounds housing alarm no one wants to live in shoeboxes. this is north america. your plan would never work. we live in a democracy, people choose how they live.",liberals
gz5ijct,2021-05-22T22:01:09.000-07:00,justin trudeau says he has advice that backs quebec’s plan to change the constitution. every poli sci professor i've had would disagree with you but okay,liberals
gz5isdf,2021-05-22T22:04:25.000-07:00,"trudeau tightens up mortgage rules after macklem sounds housing alarm you still have a choice, new york and tokyo are still democracies. you just have to weigh the option of 90m commute, $5000/mo mortgage,  500sqft studio you only sleep in, or living and working elsewhere. the cities that currently offer this choice also have some of the best restaurants, entertainment, and transit. 

it already happened to new york which is still north america. people made their choices. affordability is not likely without compromising space.",liberals
gz5k12z,2021-05-22T22:20:11.000-07:00,"this week marks four years since andrew scheer was elected leader of the conservative party. scheer suffered a tragic, narrow loss in the 2019 federal election, despite winning the popular vote and reducing the lpc to a minority gov't. had 19 seats flipped from red to blue, he would have become pm. you were so close kid!",conservatives
gz5m9za,2021-05-22T22:46:24.000-07:00,"trudeau tightens up mortgage rules after macklem sounds housing alarm it is both sides, but i think the high demand is here to stay and therefore is a new base line. whereas, supply hasn’t kept up. it’s kind of out of the hands of the feds though because supply is a provincial and municipal issue.",liberals
gz5olwp,2021-05-22T23:11:06.000-07:00,"singh calls for wartime era-like housing push and a return to 30-year mortgages do you think that we have a fair voting system? 

first past the post was promised by papa trudeau to be done with in 2015 - do you think that the results would be different if we had a more fair voting system?",liberals
h7mt05g,2021-08-03T12:50:47.000-07:00,"ethics watchdog says trudeau didn’t further interests of lifelong friend pitfield was \"we-ghazi\" really a screw up? its somewhat (entirely) anecdotal but my general sense is that people think there was something to that still. i think it worked politically at least, though i guess it only adds one to the count of ill-defined trudeau scandals.",liberals
h7mt11j,2021-08-03T12:50:59.000-07:00,"ethics watchdog says trudeau didn’t further interests of lifelong friend pitfield martin was an idiot for calling the gomery commission, and even that whole thing was a foolhardy gambit on his part to use it for political purposes to shove out chretien. but even harper's \"lapdog\" mary dawson, who with her verdict on the aga khan nonsense said that she wanted to \"go out with a bang,\" later testified in regret during the we-ghazi brouhaha that she had come to realize the definition of \"friend\" was murky and unclear but that she felt she had to go along with it anyway. she said that she was concerned by how the office and the framework was being used to provide political ammunition instead of accountability once the we thing took on a life of its own. and that she didn't feel the pm was \"corrupt\" but that he in fact had his heart in the right place with these decisions, but that he sometimes doesn't cross all his ts or dot all his is and gets into trouble as a result. media and opposition continued on the bloody feeding frenzy that spiraled so out of control it led to private citizens facing death threats. this wasn't what the act was meant for but it's another example of the road to hell being paved with good intentions.

legal analysts tore dion's snc verdict to shreds, and he has been criticized for having a reputation for a spotty handling of conflicts of interests and overreach of his mandate. he completely ignored the lpc's contention that jwr was impossible to work with, and all the other mitigating circumstances that any jury worth their salt would take into account instead of the one-sided prejudgment of the accused that had taken place. he got this one right and we. that's what you call a broken clock being right twice a day.

unlike a court, the ec is a tribunal with no recourse for appeal. the committee is by design a partisan circus. the office only \"works\" if you're a tough-on-crime hardass who likes seeing minor hr disputes and policy wonk bullshit on par with the tedium over hillary clinton's email server blown up into the trial of the century. its abuse over the years as fodder for political gamesmanship has revealed it to be a waste of taxpayer dollars more serious than any minor \"conflict\" could ever be.",liberals
h7mtl2w,2021-08-03T12:56:01.000-07:00,"unifor uses stephen harper, jason kenney to target ‘the new 2021 o’toole’ there are many unifor members who absolutely despise the union's support of the liberal party of canada.",liberals
h7mtome,2021-08-03T12:56:55.000-07:00,"people's party of canada leader maxime bernier says he won't get a covid-19 vaccine they were never okay with abortion, gay rights, and climate change. they had to be dragged kicking and screaming through that.

michael chong was laughed out of the election and called a liberal. they always allow a \"free vote\" whenever they can to appease the base on the gay rights and abortion whenever they manage to drag it back into public eye. 

some conservatives are now accepting.",conservatives
h7mv5gy,2021-08-03T13:10:02.000-07:00,"ethics watchdog says trudeau didn’t further interests of lifelong friend pitfield &gt;less of a law and more of a regulation/guideline.

no, very much a law. the conflict of interest act is an act of parliament, not just a guideline.

&gt;we're talking speeding tickets rather than murder.

technically speaking, we are, in fact, talking about criminal offences, not regulatory ones. as i'm sure you're aware, most of the prohibitions in the coi act do not contain prescibed penalties (with the exception of reporting offences). which means that section 126 of the criminal code (reproduced below for your convenience) is directly applicable.

&gt;126 (1) every person who, without lawful excuse, contravenes an act of parliament by intentionally doing anything that it forbids or by intentionally omitting to do anything that it requires to be done is, unless a punishment is expressly provided by law, guilty of

&gt;(a) an indictable offence and liable to imprisonment for a term of not more than two years; or

&gt;(b) an offence punishable on summary conviction.",liberals
h7mvqqe,2021-08-03T13:15:23.000-07:00,ethics watchdog says trudeau didn’t further interests of lifelong friend pitfield [removed],liberals
h7mw58c,2021-08-03T13:19:02.000-07:00,"ethics watchdog says trudeau didn’t further interests of lifelong friend pitfield &gt; an indictable offence and liable to imprisonment for a term of not more than two years

now see this is what i'm talking about here. it's a logistical trap. the penny-ante nontroversies and red tape that trudeau has been caught up in shouldn't in the least merit *imprisonment* or even the thought of it. but as we've seen with the abuse of parliamentary privilege at the committees all throughout this session of parliament, if rabid partisans want to \"get their guy,\" they will issue them with trumpian \"lock 'em up\" threats that, apparently, they are within their authority to do.

this kind of draconian punishment serves no one and only discourages good people from running for elected office. it doesn't mean that the kind of scandal-mongering the act encourages bears any validity in the least.

repeal it.",liberals
h7mwe1a,2021-08-03T13:21:16.000-07:00,is canada’s governor general just a rubber stamp for the pm? yes but the scenario that my come to play in the coming months is if i'm not mistaken the following. trudeau maintains the confidence of the house and merely asked for an election. am i wrong? i thought a confidence vote has to fail for an election to be called?,liberals
h7mwma5,2021-08-03T13:23:21.000-07:00,"ethics watchdog says trudeau didn’t further interests of lifelong friend pitfield &gt;the penny-ante nontroversies and red tape that trudeau has been caught up in shouldn't in the least merit imprisonment or even the thought of it.

strongly disagree on at least two of his findings of guilt.

&gt;and only discourages good people from running for elected office.

respectfully, good people don't solicit gifts from their lobbyists, or keep trying to pressure their attorney general to do something that's, at best, of dubious legality and clearly contrary to the constitutional principle of prosecutorial independence after it's been explained to them that that's not on the table. 

if a judge attempted to solicit a gift from a lawyer trying a case before them (essentially the judicial branch's equivalent of a lobbyist), i doubt you'd be suggesting jail is out of the realm of reasonable responses. why is the pm any different?

we *should* hold our leadership to high standards.",liberals
h7mwyae,2021-08-03T13:26:27.000-07:00,"leger federal poll: lpc 36 cpc 29 ndp 20 bq 7 gpc 4 ppc 3 oth 2 most people don't yet realize the extreme turn the party has taken under o'toole. this will be the first time they really find out when they see their policies. the good thing is, the recoil might be the wake up call the cpc badly needs. it's ridiculous we don't have a viable right wing alternative to the cpc, just a rush limbaugh/fox news one. harper bottled these people up for a reason, because when people look at what they say by themselves, it's really scary, and not the canada many will accept.",conservatives
h7mwyya,2021-08-03T13:26:37.000-07:00,"people's party of canada leader maxime bernier says he won't get a covid-19 vaccine both i'd say. since he created his own party he is trying to appeal to a different crowd. if he acts exactly like the other parties, he will not be distinct. in one of his interviews, he claims that the cpc is similar to the liberal party, which means he will go the extra mile making extreme statements and acting stupid to swing cpc voters onto him.  


desperate tactics in my opinion, although it may work to get him a few seats next time, who knows...",liberals
h7mxnj6,2021-08-03T13:33:02.000-07:00,"unifor uses stephen harper, jason kenney to target ‘the new 2021 o’toole’ not really. 

i shared it right away and thought it made the point that the cpc is a broken old model. the genre of truck commercials speaks directly to the trades people and workers that are traditionally conservative. consider also the commercial demotivates the conservative vote.abothet thing is truck owners tend to lean conservative, so the used pos truck analogy speaks to them. 

another effective thing about this ad is its timing. pre election writ and when everyone is dogpiling on uncool o'toole.",conservatives
h7mxzih,2021-08-03T13:36:05.000-07:00,"leger federal poll: lpc 36 cpc 29 ndp 20 bq 7 gpc 4 ppc 3 oth 2 by aggregate polling, no the liberals are now in a majority with the leger turn. especially when you throw out the two biggest outliers on either side that have huge holes in them.",liberals
h7mz2me,2021-08-03T13:46:15.000-07:00,ethics watchdog says trudeau didn’t further interests of lifelong friend pitfield [removed],liberals
hiih98z,2021-10-28T23:56:25.000-07:00,"in netherlands ahead of g20, trudeau warns disinformation threatens democracy, global economy [removed]",liberals
hiihdo9,2021-10-28T23:57:19.000-07:00,"in netherlands ahead of g20, trudeau warns disinformation threatens democracy, global economy [deleted]",liberals
hiihxtm,2021-10-29T00:01:23.000-07:00,"in netherlands ahead of g20, trudeau warns disinformation threatens democracy, global economy we really should give the government more control over what we communicate. do we have a “ministry of truth” yet? if not, we should get one.",liberals
hiiig5a,2021-10-29T00:05:05.000-07:00,"in netherlands ahead of g20, trudeau warns disinformation threatens democracy, global economy that's not at all what they mean by disinformation. holy fuck the comments in this sub are brain dead.",liberals
hiiigj8,2021-10-29T00:05:09.000-07:00,"in netherlands ahead of g20, trudeau warns disinformation threatens democracy, global economy my instinct says that private would be better, but i have trouble squaring that with the recent evidence that for profit nursing homes had 78% more covid-19 deaths than non profits. who would pay to go to a place that's worse?

https://www.thestar.com/politics/provincial/2021/01/20/ontarios-for-profit-nursing-homes-have-78-more-covid-19-deaths-than-non-profits-report-finds.html",liberals
hiiit4c,2021-10-29T00:07:38.000-07:00,"in netherlands ahead of g20, trudeau warns disinformation threatens democracy, global economy [removed]",liberals
hiiiusf,2021-10-29T00:07:57.000-07:00,"in netherlands ahead of g20, trudeau warns disinformation threatens democracy, global economy [removed]",liberals
hiij4pa,2021-10-29T00:09:56.000-07:00,"in netherlands ahead of g20, trudeau warns disinformation threatens democracy, global economy i doubt some of your statements. such as work environments and compensation in the public system being worse off. 
but at least you’ve recognized that the well off don’t want to mix with the poor if they can avoid it.",liberals
hiijfb5,2021-10-29T00:12:01.000-07:00,"in netherlands ahead of g20, trudeau warns disinformation threatens democracy, global economy yeah. it's called facebook.  

i don't understand why everyone is getting so apoplectic about the government acknowledging a massive threat to our well-being. disinformation is a huge issue, and it's not a government one; it's all in the name of profit and control for companies like facebook. they need to be dismantled and regulated asap.",liberals
hiijmir,2021-10-29T00:13:27.000-07:00,"in netherlands ahead of g20, trudeau warns disinformation threatens democracy, global economy the issue isn't that social media gave any person a voice. that's not the issue at all.  

the issue is that social media started to favour increasingly angry, paranoid, delusional voices to create more angry, paranoid, delusional people who are addicted to social media. social media is outrage addiction, and our society is dealing with the externalities of facebook's profit structure.",liberals
hiijriw,2021-10-29T00:14:25.000-07:00,"in netherlands ahead of g20, trudeau warns disinformation threatens democracy, global economy it’s actually not called facebook anymore. it’s called “meta”",liberals
hiik1hp,2021-10-29T00:16:22.000-07:00,"in netherlands ahead of g20, trudeau warns disinformation threatens democracy, global economy rules for thee and not for me. it was a totally preventable disaster that the government used to further their cause. and again we are no closer to preventing it from happening again.",liberals
hiik5h2,2021-10-29T00:17:09.000-07:00,"in netherlands ahead of g20, trudeau warns disinformation threatens democracy, global economy it’s like alternate facts",liberals
hiiknlg,2021-10-29T00:20:37.000-07:00,"in netherlands ahead of g20, trudeau warns disinformation threatens democracy, global economy i 100% believe there's disinformation floating around, and that it's harmful.

i don't trust  a politician telling me which information is disinformation, however.",liberals
hiimm0k,2021-10-29T00:34:03.000-07:00,"canada's grocery chains stocked with tomato products connected to chinese forced labour that is a rather weak whatabout argument that doesn’t address the fact that the chinese communist party uses slave labour, while at the same time trudeau insisted in the netherlands today that canada engage it on trade.",liberals
hiimrbc,2021-10-29T00:35:04.000-07:00,"in netherlands ahead of g20, trudeau warns disinformation threatens democracy, global economy i don’t trust the guy who took an airbus to a climate change meeting that could have been done over skype",liberals
hiin0dk,2021-10-29T00:36:47.000-07:00,"in netherlands ahead of g20, trudeau warns disinformation threatens democracy, global economy [removed]",liberals
hiinazy,2021-10-29T00:38:48.000-07:00,"in netherlands ahead of g20, trudeau warns disinformation threatens democracy, global economy [deleted]",liberals
hiinkqa,2021-10-29T00:40:39.000-07:00,"in netherlands ahead of g20, trudeau warns disinformation threatens democracy, global economy &gt; but at least you’ve recognized that the well off don’t want to mix with the poor if they can avoid it.

i made no such claim.

poor people access private care all the time; they come in with employer provided group health insurance or on icbc and wcb claims.

hell, many gp and drop in clinics are privately owned and operated; here in bc.",liberals
hiinuvm,2021-10-29T00:42:36.000-07:00,"in netherlands ahead of g20, trudeau warns disinformation threatens democracy, global economy so, of course cue the comments quickly filling up with people claiming or implying that disinformation doesn’t really exist, making conspiratorial allusions, and dropping whataboutisms. these comments simply prove trudeau’s point.

i’m not sure why, at the end of 2021, this point still needs to be made, but i guess it does. people are literally dying in suffocating agony because of facebook posts spreading lies about a life-saving vaccine. but, yeah, disinformation isn’t real or something. of course, you [don’t have to ask the prime minister](https://www.tvo.org/video/ron-deibert-fix-social-media-save-democracy):

&gt;one specific thing i talk about in the book is the way in which social media and the entire communications ecosystem helps propel forward authoritarianism. and it really happens in two ways: one is around what we just talked about. this environment on the content lair, if you will, the fact that you have content that's pushed forward at a rapid pace, that's emotional and extreme and so on. it makes it difficult for people to fact-check, to stop, slow down, and really examine claims. but it also turns out to be the perfect environment for those who wish to sow chaos and division and undermine society. a lot of that is with respect to russia, its disinformation campaigns. russia is not alone. there are many governments out there that are beginning to see social media as a kind of giant disinformation laboratory, and the aim here is not really to push a particular ideology. it's not to push an agenda. it's simply to confuse, distract, disorient, and ultimately kind of bring about a political paralysis through fatigue. so you start questioning, you know, what's real or not, what's the truth or not, can i believe anything? that serves their end. the other way in which it really helps authoritarian practices is by the inherent insecurity. so, as i said, the aim of these technology platforms is to push more and more sensors out, more and more applications, constantly to get closer and closer to us. so, you have this ecosystem that is invasive by design but highly insecure.

[similar points have been made by yale historian of 20th century europe and authoritarianism, timothy snyder.](https://www.washingtonpost.com/news/posteverything/wp/2018/05/21/fascism-is-back-blame-the-internet/) [freedom house agrees.](https://freedomhouse.org/report/freedom-net/2019/crisis-social-media) and there’s [this](https://twitter.com/davetroy/status/1452290807491440648):

&gt;disinformation is the operational end of a process designed to break down society and radicalize it into cultish forms. this process leads people away from truth.  
&gt;  
&gt;we can’t address this process by distributing truth; the cure for disinfo is not simply truth.  
&gt;  
&gt;…  
&gt;  
&gt;we don’t look enough at the relationship between identity, in-group, and belief. they are all reflections of the same thing and you can’t alter one without altering the others. this is why injecting garbage breaks down social ties and alters belief and identity.  
&gt;  
&gt;sufficiently radicalized, people won’t recover their prior social connections, leaving them stranded on “islands of dissensus.” there is no natural pathway back from this. it’s a one way process. throwing truth at them doesn’t restore lost social/family ties; it alienates them.

many of the denialist and conspiratorial comments posted here thus far simply prove these points. but it would make sense, in a twisted sort of way. we’re on social media, so of course those things would show up on a post about disinformation and conspiracy. gotta keep feeding the beast, i guess.",liberals
hiinwhx,2021-10-29T00:42:55.000-07:00,"in netherlands ahead of g20, trudeau warns disinformation threatens democracy, global economy \"government and big tech\" aren't the ones perpetuating climate change and pollution. climate change is and will be the biggest threat to any global system in the next couple hundred years.",liberals
hiioho3,2021-10-29T00:46:56.000-07:00,"in netherlands ahead of g20, trudeau warns disinformation threatens democracy, global economy no no that’s the company name now, the app is still called facebook /rolleyes

because you know when i think of google i instantly think of alphabet.",liberals
hiioni1,2021-10-29T00:48:02.000-07:00,"in netherlands ahead of g20, trudeau warns disinformation threatens democracy, global economy [deleted]",liberals
hq68l8i,2021-12-27T02:09:58.000-08:00,jordan peterson interviewed preston manning and pierre poilievre will be appearing on his show soon.....yet erin o'toole declined the cpc supported most of the covid spending bills over the last two years. they also passed the conversion therapy ban by consent decree. there is a lot more cooperation than you might think.,conservatives
