gvqgz4m,2021-04-24T04:25:11.000-07:00,"no reason to fear doses of astrazeneca-oxford vaccine provided by u.s., trudeau says | cbc news ###this is a reminder to [read the rules before posting in this subreddit](https://www.reddit.com/r/canadapolitics/wiki/rules-thelongversion).
 
1. **headline titles should be changed only [when the original headline is unclear](https://www.reddit.com/r/canadapolitics/wiki/rules-thelongversion#wiki_1._headline_titles_should_be_changed_only_where_it_improves_clarity.)**
2. **be [respectful](https://www.reddit.com/r/canadapolitics/wiki/rules-thelongversion#wiki_2._be_respectful).**
3. **keep submissions and comments [substantive](https://www.reddit.com/r/canadapolitics/wiki/rules-thelongversion#wiki_3._keep_submissions_and_comments_substantive).**
4. **avoid [direct advocacy](https://www.reddit.com/r/canadapolitics/wiki/rules-thelongversion#wiki_4._avoid_direct_advocacy).**
5. **link submissions must be [about canadian politics and recent](https://www.reddit.com/r/canadapolitics/wiki/rules-thelongversion#wiki_5._link_submissions_must_be_canadian_and_recent).**
6. **post [only one news article per story](https://www.reddit.com/r/canadapolitics/wiki/rules-thelongversion#wiki_6._post_only_one_news_article_per_story).** ([with one exception](https://www.reddit.com/r/canadapolitics/comments/3wkd0n/rule_reminder_and_experimental_changes/))
7. **replies to removed comments or removal notices will be removed** without notice, at the discretion of the moderators.
8. **downvoting posts or comments**, along with urging others to downvote, **[is not allowed](https://www.reddit.com/r/canadapolitics/wiki/downvotes)** in this subreddit. bans will be given on the first offence.
9. **[do not copy &amp; paste the entire content of articles in comments](https://www.reddit.com/r/canadapolitics/wiki/rules-thelongversion#wiki_9._do_not_copy_.26amp.3b_paste_entire_articles_in_the_comments.)**. if you want to read the contents of a paywalled article, please consider supporting the media outlet.

*please [message the moderators](https://www.reddit.com/message/compose?to=%2fr%2fcanadapolitics) if you wish to discuss a removal.* **do not reply to the removal notice in-thread**, *you will not receive a response and your comment will be removed. thanks.*


*i am a bot, and this action was performed automatically. please [contact the moderators of this subreddit](/message/compose/?to=/r/canadapolitics) if you have any questions or concerns.*",liberals
gvqh1ld,2021-04-24T04:25:44.000-07:00,"why do we keep allowing cuts to universities? &gt;almost

as if that's not part of their value system. conservatives believe you should pay your own way, i.e. education should be for the rich.",conservatives
gvqi6s0,2021-04-24T04:35:17.000-07:00,"voters divided on budget, with would-be ndp and green voters now less likely to vote liberal &gt;considering the fact that the liberals aren't even hitting targets harper declared so far.

harper never attempted to hit his targets, so i can't see how this is useful.

&gt;not to mention that we are 4th last on climate target progress under the liberals.

can you explain why you like the ccpi's method of comparison? \"target progress\" seems like a poor way to describe a score that is:

- ghg emissions (40% of overall score)
- renewable energy (20% of overall score)
- energy use (20% of overall score)
- climate policy (20% of overall score)

it's more a matter of current status - they put us at rank 22 for emissions per capita *trend*, but give us the worst score over our current emissions. the trend metric may actually put us at 19th, actually (given how the organization likes to leave ranks 1-3 empty as a form of protest).

or, regarding renewables:

&gt;the renewable energies grew also only by 4% within 5 years. this comparable low growth rate is rated very low, contributing to a very low rating in the renewable energy category.

their explanation for canada's score here is a bit odd, as well. this is a real mix of \"current status\" and \"growth/progress\", and canada gains a well above-average amount of its energy from renewable sources. how does this justify a \"very low\" score for renewables? are you siding with their attack on...talking about nuclear energy?

&gt;experts also cite a troubling recent emphasis on supporting “small” modular nuclear reactors, and potentially even an interest in considering nuclear as a green source of supply.",liberals
gpgelkk,2021-03-02T04:32:02.000-08:00,first 500k astrazeneca doses on their way; will be part of nearly 945k doses delivered this week you know that health canada isn't liberal right? do you think trudeau was in a lab working with samples?,liberals
gpgf7bg,2021-03-02T04:36:17.000-08:00,canadian economy suffers biggest contraction since the great depression thank you trudeau.,liberals
gpgfilq,2021-03-02T04:38:31.000-08:00,"federal ndp unveils election-style promises to support small businesses in pandemic &gt;man, they keep releasing campaign promises... i thought he said he wasn't going to cause an election to be triggered?..

he is releasing promises for the same reason he said he wasn't going to trigger an election: because it is obvious to everyone in ottawa that trudeau wants an election.",liberals
gpgfux1,2021-03-02T04:40:57.000-08:00,federal ndp unveils election-style promises to support small businesses in pandemic well he can't trigger one himself anyways. but it's smart to do this now when the liberals started getting candidates together before other parties. it's reasonable for every party to get ready and assume there may be an election in the late summer or in the fall.,liberals
gpgfy93,2021-03-02T04:41:37.000-08:00,"federal ndp unveils election-style promises to support small businesses in pandemic the ndp can't prevent an election the liberals want, and the liberals are obviously preparing for one.

it would be dumb for the ndp not to also prepare. i'm not sure this is a sign of anything more than that.",liberals
gpgg621,2021-03-02T04:43:09.000-08:00,"leantossup federal model: lpc 164 - cpc 109 - ndp 31 - bq 31 - gpc 2 - ind 1 the recent léger poll had the liberals at 49% and greens at 16% in atlantic canada. it's unfortunate that we can't see the atlantic regionals by province, but i'm willing to bet that nb (and pei) was hiking up that green number. 

after all the may gaffes and poor campaign, nb and pei still voted respectively 17% and 21% for the greens in 2019. if, as i expect, paul performs better on the stage, these numbers will, at minimum, remain stable. and this time atwin has the incumbency advantage and a raised profile nationally. you can bet that not only the federal greens, but also the nb greens &amp; david coon especially will campaign hard for her. 

or to put it in another way...if megan mitton could retain memramcook-tantramar by an increase of 500+ in 2020 (only 11 votes in 2018) in what's destined to be a perpetual green-liberal two-way race as long as the anti-french wing persists in the pcs, i think jenica atwin will be able to do so more easily in the green-conservative-liberal three-way pie that is fredericton. 

the massive pro-liberal votes in new brunswick are mostly coming from moncton + rural french areas +unenthusiastic anti-harper voters in english nb. wayne long will keep winning st-john for the libs only because he is wayne long. but fredericton has never been all that pro-liberal honestly and atwin is a convenient asset for all of these \"fuck all of these traditional parties\" folks. all of that to say that i don't see a liberal rise in atlantic canada necessarily affecting fredericton. it might help them win miramichi more comfortably, but i don't foresee seat changes.",liberals
gpgi421,2021-03-02T04:56:39.000-08:00,"federal ndp unveils election-style promises to support small businesses in pandemic it's no secret that the liberals want an election, it would be foolish to not prepare for one. in fact, if an election does happen, i'd wager it's becuase the lpc pulled the trigger themselves.",liberals
gpgicoq,2021-03-02T04:58:19.000-08:00,"federal ndp unveils election-style promises to support small businesses in pandemic he's not going to, but the liberals definitely will at the moment they think they're best positioned for a majority.  it'll definitely be this year, most likely early fall as vaccine rollout is fully rolling.",liberals
gpgij6s,2021-03-02T04:59:35.000-08:00,"federal ndp unveils election-style promises to support small businesses in pandemic you might be right on that, either way everyone has been gearing up for the possibility.

earliest i remember any party openly announcing they're selecting candidates for the next election was the liberals in december.

was the cpc doing so in november?",liberals
gpgl63o,2021-03-02T05:18:08.000-08:00,"federal ndp unveils election-style promises to support small businesses in pandemic the liberals are obviously pushing for an election, probably called within the next 2-3 months. if they can't make the september vaccination target, there will be warning signs of that well beforehand. if they call the election too late those warning signs will take over the campaign narrative and they'll be sunk. if they don't call the election and miss the september target, their poll numbers will take a huge hit that they won't be able to make up. so they'll call it well ahead of time.",liberals
guj980x,2021-04-14T07:22:47.000-07:00,conservative leader erin o'toole confirms that free vote is allowed on mp cathay wagantall's ‘sex-selective abortion’ bill [removed],conservatives
guj9ew0,2021-04-14T07:24:17.000-07:00,"alberta ndp would likely form majority if election held today, new poll suggests trudeau got zero seats in alberta? what could he do in alberta that would be political suicide? the worst thing he could do is be pro alberta. nobody progressive outside of alberta is down with the oil sands",liberals
guj9mo3,2021-04-14T07:26:00.000-07:00,"conservative leader erin o'toole confirms that free vote is allowed on mp cathay wagantall's ‘sex-selective abortion’ bill &gt;the political anti-abortion organization rightnow says it welcomes the news that o'toole is sticking to his campaign pledge to allow his mps free votes on matters of conscience.

&gt;“while we are happy that erin has confirmed this commitment to pro-lifers, we are still disappointed in his decision to not vote for this reasonable and popular piece of legislation,” organization co-founder alissa golob said in a release circulated wednesday.

&gt;\"we will continue to keep a close eye on which members of parliament vote in favour and against the legislation and encourage our supporters to vote and volunteer accordingly in the upcoming election.\"

other canadians may be keeping an eye on it too, but not for the same reason as they are. 

kind of related to this topic, today i learned that there is a conservative parliamentary \"pro-life caucus\"? from [here](https://pressprogress.ca/conservative-mp-says-anti-abortion-activists-helped-develop-new-private-members-bill/):

&gt;block, who is a member of the conservative’s parliamentary “pro-life caucus,” recently tabled legislation called the protection of freedom of conscience act, which would allow medical professionals to not participate in providing medically assisted death under bill c-7.

if true, are they the only party that has this?",conservatives
guj9r6t,2021-04-14T07:26:59.000-07:00,"trudeau says he supports restricting interprovincial travel when necessary to stem spread of covid-19 ###this is a reminder to [read the rules before posting in this subreddit](https://www.reddit.com/r/canadapolitics/wiki/rules-thelongversion).
 
1. **headline titles should be changed only [when the original headline is unclear](https://www.reddit.com/r/canadapolitics/wiki/rules-thelongversion#wiki_1._headline_titles_should_be_changed_only_where_it_improves_clarity.)**
2. **be [respectful](https://www.reddit.com/r/canadapolitics/wiki/rules-thelongversion#wiki_2._be_respectful).**
3. **keep submissions and comments [substantive](https://www.reddit.com/r/canadapolitics/wiki/rules-thelongversion#wiki_3._keep_submissions_and_comments_substantive).**
4. **avoid [direct advocacy](https://www.reddit.com/r/canadapolitics/wiki/rules-thelongversion#wiki_4._avoid_direct_advocacy).**
5. **link submissions must be [about canadian politics and recent](https://www.reddit.com/r/canadapolitics/wiki/rules-thelongversion#wiki_5._link_submissions_must_be_canadian_and_recent).**
6. **post [only one news article per story](https://www.reddit.com/r/canadapolitics/wiki/rules-thelongversion#wiki_6._post_only_one_news_article_per_story).** ([with one exception](https://www.reddit.com/r/canadapolitics/comments/3wkd0n/rule_reminder_and_experimental_changes/))
7. **replies to removed comments or removal notices will be removed** without notice, at the discretion of the moderators.
8. **downvoting posts or comments**, along with urging others to downvote, **[is not allowed](https://www.reddit.com/r/canadapolitics/wiki/downvotes)** in this subreddit. bans will be given on the first offence.
9. **[do not copy &amp; paste the entire content of articles in comments](https://www.reddit.com/r/canadapolitics/wiki/rules-thelongversion#wiki_9._do_not_copy_.26amp.3b_paste_entire_articles_in_the_comments.)**. if you want to read the contents of a paywalled article, please consider supporting the media outlet.

*please [message the moderators](https://www.reddit.com/message/compose?to=%2fr%2fcanadapolitics) if you wish to discuss a removal.* **do not reply to the removal notice in-thread**, *you will not receive a response and your comment will be removed. thanks.*


*i am a bot, and this action was performed automatically. please [contact the moderators of this subreddit](/message/compose/?to=/r/canadapolitics) if you have any questions or concerns.*",liberals
guja14l,2021-04-14T07:29:10.000-07:00,"amid third wave of covid, trudeau says he has no regrets about canada's vaccine rollout really?  trudeau doesn't regret transferring canadian intellectual property to china for the cansino vaccine, which wasted precious time, and amounted to nothing more than transferring our property for zero vaccines?  we don't need to wait for a postmortem to evaluate that as an enormous blunder.",liberals
guja426,2021-04-14T07:29:48.000-07:00,"alberta ndp would likely form majority if election held today, new poll suggests are you talking about trudeau? he’s made mistake after mistake, drove the budget into the ground, killed off jobs, gave almost a billion dollars to he’s friends charity which in turned payed him and his family. his made us look like a bunch of fools and it’s all for optics. what did he do that’s so great?",liberals
gujahvz,2021-04-14T07:32:50.000-07:00,"amid third wave of covid, trudeau says he has no regrets about canada's vaccine rollout rights seem like a burden to you?",liberals
gujap01,2021-04-14T07:34:24.000-07:00,"conservative leader erin o'toole confirms that free vote is allowed on mp cathay wagantall's ‘sex-selective abortion’ bill no chance in hell that the lpc or ndp have one, and i doubt that the bq do - so yes, they are more than likely the only party with a pro-life caucus.",conservatives
gujax90,2021-04-14T07:36:11.000-07:00,"ottawa aims to convert 90,000 temporary workers and graduated students into permanent residents this is part of the bargain in tolerating deficits year after year. the only reason deficits and debt makes sense is if you are growing your gdp.

if you can't grow your way out of a debt hole with productivity gains, you grow your way out by increasing the population to make more use of the infrastructure you've already built and raise the gdp through brute force.

i wouldn't be surprised to see our government increase immigration significantly as one way out of this. that, plus inflation. if they are saying they will continue with significant deficits without any major tax increases, and if even the conservatives weren't able to solve the \"low canadian productivity\" issue, what else is there?",conservatives
gujb2ks,2021-04-14T07:37:21.000-07:00,john robson: if canada was a serious country we'd demand transparent government i love when authors act like canada was perfect before trudeau was elected. half the talk about a “serious canada” is literally things that aren’t really true or are still continuing on just in a way the author disagrees with.,liberals
gujb68k,2021-04-14T07:38:09.000-07:00,"conservatives launch petition to have governors general cut off if they resign before end of term ###this is a reminder to [read the rules before posting in this subreddit](https://www.reddit.com/r/canadapolitics/wiki/rules-thelongversion).
 
1. **headline titles should be changed only [when the original headline is unclear](https://www.reddit.com/r/canadapolitics/wiki/rules-thelongversion#wiki_1._headline_titles_should_be_changed_only_where_it_improves_clarity.)**
2. **be [respectful](https://www.reddit.com/r/canadapolitics/wiki/rules-thelongversion#wiki_2._be_respectful).**
3. **keep submissions and comments [substantive](https://www.reddit.com/r/canadapolitics/wiki/rules-thelongversion#wiki_3._keep_submissions_and_comments_substantive).**
4. **avoid [direct advocacy](https://www.reddit.com/r/canadapolitics/wiki/rules-thelongversion#wiki_4._avoid_direct_advocacy).**
5. **link submissions must be [about canadian politics and recent](https://www.reddit.com/r/canadapolitics/wiki/rules-thelongversion#wiki_5._link_submissions_must_be_canadian_and_recent).**
6. **post [only one news article per story](https://www.reddit.com/r/canadapolitics/wiki/rules-thelongversion#wiki_6._post_only_one_news_article_per_story).** ([with one exception](https://www.reddit.com/r/canadapolitics/comments/3wkd0n/rule_reminder_and_experimental_changes/))
7. **replies to removed comments or removal notices will be removed** without notice, at the discretion of the moderators.
8. **downvoting posts or comments**, along with urging others to downvote, **[is not allowed](https://www.reddit.com/r/canadapolitics/wiki/downvotes)** in this subreddit. bans will be given on the first offence.
9. **[do not copy &amp; paste the entire content of articles in comments](https://www.reddit.com/r/canadapolitics/wiki/rules-thelongversion#wiki_9._do_not_copy_.26amp.3b_paste_entire_articles_in_the_comments.)**. if you want to read the contents of a paywalled article, please consider supporting the media outlet.

*please [message the moderators](https://www.reddit.com/message/compose?to=%2fr%2fcanadapolitics) if you wish to discuss a removal.* **do not reply to the removal notice in-thread**, *you will not receive a response and your comment will be removed. thanks.*


*i am a bot, and this action was performed automatically. please [contact the moderators of this subreddit](/message/compose/?to=/r/canadapolitics) if you have any questions or concerns.*",conservatives
gujbcvu,2021-04-14T07:39:39.000-07:00,"alberta ndp would likely form majority if election held today, new poll suggests you're wrong. québec voted massively for two anglophones in modern history, mulroney in the 80s and layton in 2011. both of these leaders had a good level of french (in mulroney's case you could even say it was a perfect mastery) and knew how to connect with québec voters, nationalists and non-nationalists alike. 

that no anglo leaders have succeeded afterwards is a reflection of a poor québec strategy / knowledge, inadequate french, and in the case of conservatives, having a \"we'll force a pipeline on you\" message and blatant social conservatism. 

linguistically speaking, québec is not unwilling to consider anglophones. they're unwilling to consider barely bilingual candidates who butcher their french in debates and normal conversations. francophones (and i include myself as a new brunswick acadian) don't want their prime minister to see french language as an afterthought, we want someone who respects english-french equality enough to have mastered the french language enough to communicate and debate with a good flow. we don't need perfection, just effort.",conservatives
gujbum8,2021-04-14T07:43:37.000-07:00,conservative leader erin o'toole confirms that free vote is allowed on mp cathay wagantall's ‘sex-selective abortion’ bill [deleted],conservatives
gujbvfb,2021-04-14T07:43:47.000-07:00,"conservative leader erin o'toole confirms that free vote is allowed on mp cathay wagantall's ‘sex-selective abortion’ bill if they voice forced birth opinions, or back forced birth positions, they are removed from caucus.

it is one of the things that i approve of in the lpc - if you don't back a woman's right to control her body, you don't get to remain a member of the party.

the cpc and greens could learn from them on this file.",conservatives
gujbvzt,2021-04-14T07:43:55.000-07:00,conservative leader erin o'toole confirms that free vote is allowed on mp cathay wagantall's ‘sex-selective abortion’ bill [removed],conservatives
gujc30g,2021-04-14T07:45:27.000-07:00,"alberta ndp would likely form majority if election held today, new poll suggests yeah but their parents lived through it and no doubt they heard about the evils of trudeau every night at dinner",liberals
gujc6wm,2021-04-14T07:46:19.000-07:00,"alberta ndp would likely form majority if election held today, new poll suggests mulroney (conservative govt) axed our vaccine program. it takes years to get it up and running. trudeaus only option was to order abroad. then places like us put export embargo’s on vaccines until their populations were more vaccinated. absolutely none of that is under trudeau’s control. 

he ordered way more then necessary from many sources to try and get as many into canada as quick as possible. that’s the only thing in his control is placing orders and he did a good job.",liberals
gujcarz,2021-04-14T07:47:09.000-07:00,"trudeau says he supports restricting interprovincial travel when necessary to stem spread of covid-19 the atlantic provinces and the territories all restricted interprovincial travel. they are the places that are open right now.  

if there had been better provincial leadership we wouldn't be seeing these outbreaks.  the places like ontario and bc that are seeing the huge spoke have all resisted the idea of shutting down travel.  it was a huge huge mistake and has led to far more infections.",liberals
gujcgyh,2021-04-14T07:48:31.000-07:00,"kelly mcparland: it's time for tories, ndp to hold their nose and say no kelly mcparland is going to be disappointed when the budget passes with minimal drama. with current polling numbers it would be unwise for opposition to trigger an election as liberals have a good shot at getting a majority.",liberals
gujdcr6,2021-04-14T07:55:36.000-07:00,conservative leader erin o'toole confirms that free vote is allowed on mp cathay wagantall's ‘sex-selective abortion’ bill [deleted],conservatives
gujdn51,2021-04-14T07:57:54.000-07:00,"conservative leader erin o'toole confirms that free vote is allowed on mp cathay wagantall's ‘sex-selective abortion’ bill so, like, why is this individual bothering with re-introducing an abortion bill (sex-selective abortion) when it's painfully obvious it will fail immediately.

ignoring my opinion on this, i think it's easily loopholed and generally unnecessary. most medical orgs used to have policies against identifying the gender of an embryo, but not anymore. why not? because information is a patient's right, and people don't have to provide a reason for abortions. this bill won't change that, but if it did, a simple \"no\" to the question is literally enough.

i'm a believer in slippery slopes, so i see this bill in the same way.",conservatives
gujdoy8,2021-04-14T07:58:18.000-07:00,conservatives launch petition to have governors general cut off if they resign before end of term [removed],conservatives
gujds1c,2021-04-14T07:58:59.000-07:00,"alberta ndp would likely form majority if election held today, new poll suggests is that true? stats can says 13% were born outside of canada and 10% in canads but out of province. even allowing for the large migrations of the 90s and 00s that would account for native born albertans with non-native parents that doesn't make for a majority. plus migrant populations tend to live in cities, but the anti-trudeau feeling is most pronounced in the powerful rural counties that most assuredly do have generations of anti-east, anti-trudeau sentiment.",liberals
gujdtwj,2021-04-14T07:59:25.000-07:00,conservatives launch petition to have governors general cut off if they resign before end of term [removed],conservatives
gujf8fr,2021-04-14T08:10:51.000-07:00,"oil lobby, trudeau government formed secretive committee during pandemic [removed]",liberals
gujfdeh,2021-04-14T08:12:00.000-07:00,"conservative leader erin o'toole confirms that free vote is allowed on mp cathay wagantall's ‘sex-selective abortion’ bill &gt;so, like, why is this individual bothering with re-introducing an abortion bill (sex-selective abortion) when it's painfully obvious it will fail immediately.

virtue signalling for the conservative base.",conservatives
