h21z5jd,2021-06-16T14:48:15.000-07:00,"jenny kwan: clearly, the liberals' current approach to housing is failing canadians it's the new interference with their own autonomy that would cause the separation, except bc, they need to keep the housing bubble or they are fucked.  one of the other big threads in this sub is about qc pushing for nation recognition, now you'd expect them to suddenly take more federal control over their policy's lol, that's a stretch my friend.  quebec would probably be the first to flip shit over what you're recommending.",liberals
h21z7xf,2021-06-16T14:48:57.000-07:00,"jenny kwan: clearly, the liberals' current approach to housing is failing canadians [deleted]",liberals
h21z93d,2021-06-16T14:49:18.000-07:00,"analysis: 63% of news articles posted in r/canadapolitics are from left-leaning sources and articles from left-leaning sources receive 69% of the upvotes because it's absolutely true, just because the liberals are left-wing and also trying to take away canadians digital rights doesn't mean the cbc reporting on that is indicative on them not being biased in their favour.",liberals
h21zbnu,2021-06-16T14:50:01.000-07:00,"jenny kwan: clearly, the liberals' current approach to housing is failing canadians the fed would never do that and the provinces would never take it.  i'm already replying to someone who said something similar in this thread.",liberals
h21zhle,2021-06-16T14:51:49.000-07:00,"jenny kwan: clearly, the liberals' current approach to housing is failing canadians ¯\\\\\\_(ツ)\\_/¯  it would never happen, the fed won't do it and the provinces wouldn't let them so i'm not going to debate it anymore, have a good night.",liberals
h21zwnp,2021-06-16T14:56:15.000-07:00,"jenny kwan: clearly, the liberals' current approach to housing is failing canadians what can the provinces do? what do you think happened when the bank of canada bought all bad mortgages from banks at face value? or the fact that banking regulation that was set to go into effect in april 2020 went out the window, giving banks more money to hand out. or the fact boc continues to buy mortgage backed securities… and before you say the boc is independent, canada was one of few countries in 08 not to do qe (buying up of mortgage or government bonds/debt) and that was under harper. under trudeau, canada printed multiples of current currency in circulation since march 2020.

the boc told banks to lend money to anyone, especially mortgages. the federal government kept going out and saying how they’ll increase immigration, as stories of housing collapsing because people are leaving or immigration numbers are low. this was very much intentional.",liberals
h2211ym,2021-06-16T15:08:48.000-07:00,"jenny kwan: clearly, the liberals' current approach to housing is failing canadians [deleted]",liberals
h222rhs,2021-06-16T15:28:49.000-07:00,"jenny kwan: clearly, the liberals' current approach to housing is failing canadians this is a municipal, and thus provincial, issue. _primarily_.

we could have the cmhc get _back_ into building housing; and we probably should. but cmhc housing always focused on the bottom end of the market, and we need to deal with supply constraint at the middle and top, as well.

and that's zoning and permits. municipal. and municipalities are creatures of the provinces. 

if we _really_ want change then we need to be holding the provincial governments accountable; and yes, the federal government can play a role here, as well, but it would mean acknowledging that it's not a federal portfolio for the most part.",liberals
h2232i8,2021-06-16T15:32:33.000-07:00,"caq boots mna claire samson from caucus over donation to conservative party i don't think so, at least not automatically, unless she won a by-election as conservative. aussant wasn't invited as option nationale leader and he had a seat.",conservatives
h223y3b,2021-06-16T15:43:17.000-07:00,"trudeau, canadian delegation check in to covid-19 hotel after overseas g7 trip just pointing out that these government policies affect members of government differently from the public.

in canada these days it's just \"politicians bad\". i had high hopes for trudeau but have been very disappointed.",liberals
h22415h,2021-06-16T15:44:21.000-07:00,"trudeau, canadian delegation check in to covid-19 hotel after overseas g7 trip i guess seeing your 90 year old grandmother before she dies is considered \"leisure\" in your example?

and who do you think pays for the fancy dinners and champagne?",liberals
h224php,2021-06-16T15:52:44.000-07:00,"jenny kwan: clearly, the liberals' current approach to housing is failing canadians ive seen housing projects started and completed. affordable housing. assisted living and low income housing. actual stuff done in my city and province. thanks largely to an influx of federal funding that has allowed these projects to happen. this is going to be a long process and yes we're still not doing enough as it is. but let's at least acknowledge the progress made and support more action like it instead of relying on hyperbole and ignoring facts please.",liberals
h22592c,2021-06-16T15:59:39.000-07:00,"trudeau, canadian delegation check in to covid-19 hotel after overseas g7 trip you do realize that small business and freelancer expenses are basically out of pocket right?

as are the costs for anyone hoping to see their family.",liberals
h225elw,2021-06-16T16:01:37.000-07:00,"jenny kwan: clearly, the liberals' current approach to housing is failing canadians monetary policy is entirely in controlled by the bank of canada. what they've been doing has been entirely in line with mainstream economics and in line with their mandate of long run 2% per annum inflation.",liberals
h2260tj,2021-06-16T16:09:41.000-07:00,"‘so racist, so sexist’: annamie paul slams a bid to oust her as green party leader it’s about as savvy as waking up to learn you just inherited a million bucks. after reading this news it feels like the liberals probably just returned her phone call.",liberals
h226m5w,2021-06-16T16:17:34.000-07:00,"liberal mps help to defeat ndp's dental-care motion the ndp's motion, as i understand it, is literally just to motion that the house should support dental care and is non-binding.

how is that putting the cart before... anything? there's barely a cart or a horse. performative... sure? it's illustrative that liberals won't even agree to non-binding motion. there's nothing wrong with getting a public statement, a voting statement, one way or another.

in other words, i want dental care covered, and even \"cheap,\" \"performative,\" or whatever derogatory term you wish to use, motions are a step in the right direction. yep. there's a lot of hard work let to be done. not disputing that. and what the ndp has put forward isn't that. but they're also not in a position to drive that effort like the liberals are.",liberals
hjootqw,2021-11-07T00:50:34.000-07:00,google warns liberals' online harms bill 'will result in the blocking of legitimate content' indeed google cannot arrest you and toss you in jail but the goverment can... big difference... if you think now is bad is just about to get worse,liberals
hjop0bb,2021-11-07T00:51:45.000-07:00,google warns liberals' online harms bill 'will result in the blocking of legitimate content' indeed google cannot arrest you and toss you in jail but the goverment can... big difference... if you think now is bad is just about to get worse,liberals
hjoqsgs,2021-11-07T01:03:30.000-07:00,google warns liberals' online harms bill 'will result in the blocking of legitimate content' let's say i find your reply hateful 24 hours time is not enough time for reddit to evaluate.... quickly the system gets overwhelmed... to play it safe in the future every post from anyone deemed hateful will be taken down without due process. even assuming that a post incorrectly called hateful the process could take months and by then the thread is by then irrelevant because the pace of social media. democracy dies in silence,liberals
hjosq9x,2021-11-07T01:16:25.000-07:00,"google warns liberals' online harms bill 'will result in the blocking of legitimate content' if reddit can't look at user reports of crimes on their platform within 24 hours, then that's a problem with their business model.  who would have thought that giant online platforms with many millions of users might need to hire a lot of staff to run things smoothly?

if every post is taken down, then reddit will just go from having to look at the posts to having to look at and respond to the appeals by the users whose posts were taken down.  the legislation requires an appeals process and reporting.",liberals
hjot1pf,2021-11-07T01:18:31.000-07:00,"did trudeau's \"middle class\" tax cuts actually help you? nope.

trudeau's tax cut started at something like $48,000 per year.  i never made $48,000 in any year in my life, and i am now retired.

harper cut the gst, and income tax across the board, and brought in income splitting.  those cuts helped me.",liberals
h5ua94i,2021-07-19T14:50:22.000-07:00,"how did harper's minority government perform yeah, basically this. he won confidence votes because the liberals were stuck sucking fumes in quebec. a strong bloc and later ndp made any shot at governing a non-starter, so what was the point of forcing an election? harper was often accused of governing as if he had a majority.

i feel like 2011 through 2015 was a missed opportunity which led us into the political wilderness again. we just haven't been able to grow beyond our base around quebec city, so we're still entirely reliant upon ontario and bc. harper was technically proficient, but badly lacked charisma. there may be some daylight with trudeau's non-french speaking gg pick, but we will see if that translates to, at the very least, a strong bloc rebound. unfortunately, we need the bloc to bleed liberal support in quebec.",liberals
h5uci4h,2021-07-19T15:15:54.000-07:00,"how did harper's minority government perform &gt;unfortunately, we need the bloc to bleed liberal support in quebec.

*the enemy of my enemy is my friend?* not really a good policy for securing a majority government, especially given the uncertainty of the opposition making massive mistakes, constantly, being a prerequisite for winning a majority. as gaff, accident, and mistake-prone as trudeau is, that's not a consistent strategy we can use going forward.

we need to grow conservatism in quebec, somehow. i just don't know how to do it successfully.",liberals
h5uedua,2021-07-19T15:38:35.000-07:00,"how did harper's minority government perform well, the bloc's early members were conservatives. we have to convince quebec that the conservatives will stand up for quebecois rights. that will be a tough climb though, they are very much seen as a western-centric party now. bend too far, like on oil extraction and you lose the prairie base, bend not far enough and the party is seen as outsiders. i think that a high profile quebec-based conservative leader would change the equation greatly, but how you pull that off without reform party version 2.0 popping up is another question.",conservatives
h5ufh2c,2021-07-19T15:52:08.000-07:00,kinsella: erin o’toole appears poised to win fewer seats than his predecessor do you mean trudeau's successor?   his predecessor was michael ignatieff.,liberals
hnnqu7k,2021-12-07T08:24:45.000-08:00,"liberals bring back bill to tackle over-incarceration of indigenous and black people forgive me if i'm wrong but i believe the \"cruel and unusual\" part applies to being sentenced via formula rather than by a living human who can understand nuance.

why not just replace judges with flowcharts that lead to sentences?",liberals
hnns5u5,2021-12-07T08:35:13.000-08:00,"why conservatives are terrified to give teens the vote &gt;gen z is more conservative than many realize

false.",conservatives
hnnse4u,2021-12-07T08:37:01.000-08:00,"liberals bring back bill to tackle over-incarceration of indigenous and black people because you need that discretion for individual circumstance, however i don't believe confining judgement to being within an acceptable range constitutes cruel and unusual punishment, and if it is in fact cruel and unusual that their sentence should be confined by legislation, then that should reasonably also apply to any maximum sentencing as well.",liberals
hnnt5g8,2021-12-07T08:43:08.000-08:00,"ndp mp rachel blaney introduces right to housing bill &gt; north island-powell river mp rachel blaney took a step towards ensuring people in canada have the right to appropriate and affordable housing.


uhhh...no? she literally just proposed declaring something and then doing nothing to make it happen.

&gt; “ensure that the right to housing is firmly recognized as law. it would redefine the federal framework for housing legislation and would set a requirement for the minister of justice to ensure every regulation change is consistent with the right.”

did our housing crisis start because of a regulation change? no, we experiencing a combination of structural factors which must be addressed through hard work, such as \"actually building houses\"

&gt; “the liberals have agreed in their national housing strategy that housing is a basic human right, but we’re not seeing any action or accountability in our communities where it matters,” said blaney. “putting it in the bill of rights sets a requirement, and allows laws to be challenged in court if they are failing to meet that requirement.”

since when are the courts in a position to regulate the economy? are they going to outlaw supply and demand? 

if this were a law which stipulated that *the government guarantees to provide a house for every canadian*, then that would be different but this mp doesn't choose to go that far. she wants the government to be legally responsible to enforce her ideological priorities through the courts and through regulation yet she isn't willing to go one step further and actually propose a functioning universal housing program.

they will just do absolutely anything to solve the lack of housing crisis besides actually building houses

\"maybe rent control will force landlords to build cheap new houses?\" nope.

\"maybe investment restrictions will force developers to build cheap new houses?\" nope

\"maybe we can just pass a law that says 'everyone gets a house' and it will magically happen?\". no!!

this is all so ideological. it's more about an anti-capitalist crusade than about actually solving the housing crisis.",liberals
hnnuf8c,2021-12-07T08:53:24.000-08:00,"senate passes bill to ban conversion therapy valid point. probably some from column a some from column b. 

whatever the underlying reason, its a good thing to see. 

there are only two approaches for the conservatives to handle that group of whackos: the harper iron fist of \"say something stupid and you're done\" or the approach o'toole is taking of \"let the crazies go sit alone in a corner\".

both work, but i think o'toole's approach is easier to maintain in the long run and better for the party and for canadians.",conservatives
hnnuxqq,2021-12-07T08:57:40.000-08:00,"federal poll (léger) — lpc 36%, cpc 29%, ndp 19%, bq 7%, ppc 5%, grn 3% i'm not sure that would do anything.  they could release something that's to the left of the liberals, and most voters wouldn't believe them.",liberals
hnnwfzc,2021-12-07T09:10:11.000-08:00,"senate passes bill to ban conversion therapy well, that's hardly a fair statement. the only other party that has ever had the ability to appoint senators is the liberals, and their \"independent appointments\" are both very new and also by all accounts not actually particularly independent. in truth, the structure of the senate basically precludes any real influence by a party over a senator in the first place. the ability to kick a senator from caucus, or any other methods of party discipline have no real impact because senators do not have to worry about winning the next election and cannot be removed from their seat by external forces.",liberals
hnnwg1p,2021-12-07T09:10:11.000-08:00,"federal poll (léger) — lpc 36%, cpc 29%, ndp 19%, bq 7%, ppc 5%, grn 3% no fan of the bc liberals but the public narrative did swing towards the “lol get fucked” direction against them. 

now, a lot of government shortcomings being able to be traced back to the clark government and wilkinson’s inability to provide a real coherent alternative to the incumbent’s steady hand certainly played a bigger role.",liberals
hnnwy1g,2021-12-07T09:14:23.000-08:00,"senate passes bill to ban conversion therapy you are right, the liberals and cpc/pc were the only ones to appoint senators, but they have appointed senators at the advice of other parties. my understanding is that the ndp have always rejected appoints under their party banner and as you pointed out, the liberals recently followed suit and all liberal senators either formed their own caucuses or went independent.

&gt;in 2014 liberal leader justin trudeau expelled all senators from the liberal caucus and, as prime minister in 2016, created the independent advisory board for senate appointments,[14] both of which were attempts to make the senate less partisan without requiring constitutional change.[12] members of the board include members from each jurisdiction where there is a vacancy.[15] the prime minister is not bound to accept the board's recommendation.[16] some provinces refused to participate, stating that it would make the situation worse by lending the senate some legitimacy.[17] since this new appointments process was launched in 2016, 52 new senators, all selected under this procedure, were appointed to fill vacancies. all canadians may now apply directly for a senate appointment at any time, or nominate someone they believe meets the merit criteria.[18]

from: https://en.wikipedia.org/wiki/senate_of_canada#senate_reform

&gt;in truth, the structure of the senate basically precludes any real influence by a party over a senator in the first place

also true, but if we are going the whole way, the senate basically has no real influence at all. if the senate was to attempt to overrule the lower house there would be a huge stink. i cannot recall the last time the senate actually did override the lower house. they have asked for changes, but i cannot recall them, in recent history, fully rejecting a bill.",liberals
hi1bfyt,2021-10-25T07:28:29.000-07:00,"jean chrétien says he never heard about abuse in residential schools while he was minister reading the article yesterday about chrétien talking about the liberals not talking to him about their governing had me a little confused, i thought for sure maybe some insiders talked with former liberal pms but now this makes sense. what an out of touch blank.",liberals
hi1bnia,2021-10-25T07:29:58.000-07:00,"three more mps say they're running in house speaker’s election i think the bloc won’t put up a speaker because the image they want to project above all else is fighting for quebec interests and avoid weighing in on issues that aren’t relevant to quebec, which would be hard to do if you’re supposed to be an impartial speaker who is supposed to show balance with mps from other regions and parties, which i suspect would be more unpopular in the bloc’s circles than elsewhere. assistant speakers are also expected to tone down the partisanship and speak on less contentious issues when in the house while the speaker is on duty.

normally the speaker position has electoral benefits that can be communicated to constituents about holding parliament to account, but i think it plays less well for the bloc electorally since the impartiality of the position is in conflict with their brand.

i suspect godin will attract the bloc vote as a quebec mp, since they would probably choose him over mendes as a way to vote against the government (she also doesn’t have a strong reputation as speaker, granted she’s also very inexperienced compared to rota and hughes.

that said it would be nice if the only woman speaker we had wasn’t 40 years ago, so i also hope hughes gets it since she’s been assistant speaker for a while now. i suspect it will go to rota though, unless something funky happens with the vote split leading to godin.

also an interesting tidbit is that the vote for speaker is actually a ranked ballot.

edit: just to add, rota was an upset for speaker in the previous parliament, as geoff regan was the liberal incumbent. with the ranked ballot system, the liberals were likely comfortable putting rota and regan in their top 2 without all of them having regan as their first pick, so if the liberals were more relaxed on their top picks with the ranked system, in theory a single opposition party like the cpc could disrupt the vote by putting all their weight behind rota.",liberals
hi1bvdz,2021-10-25T07:31:30.000-07:00,jean chrétien says he never heard about abuse in residential schools while he was minister some people trudeau currently surrounds himself with were certainly around then.,liberals
hi1bzem,2021-10-25T07:32:18.000-07:00,"innovative research poll: tofino trip more damaging to trudeau than we or blackface i agree, this is both something that happened very recently and an issue that liberal voters care about. it's one thing to piss off people who only vote conservative/ndp, but another when the people upset just voted for your party.

the only good news from this is it just happened after an election so a lot of heat will have died down by the next one (unless the next election campaign occurs during t&amp;r day in which case the opposition will remind the public on what happened).",liberals
hi1cqic,2021-10-25T07:37:39.000-07:00,trudeau should 'resign' over school documents comment says chief in b.c. [removed],liberals
hi1e1hw,2021-10-25T07:46:51.000-07:00,"after saying tories 'will respect' decision on vaccine mandate for mps, o’toole now says it 'infringes' on their rights | national post omg!

what an o'toole! this twit needs to be uncerimoniously disposed of. what a limp noodle.",conservatives
hi1e5vn,2021-10-25T07:47:44.000-07:00,"if the ppc didn't split the vote we would have a conservative minority government if the cpc won more seats than the liberal party but less than a majority, then trudeau would still have had first crack at forming a government.",liberals
hi1epuf,2021-10-25T07:51:42.000-07:00,"liberal mps want to know why leadership taking their ‘sweet-ass time’ to call first post-election caucus meeting, say liberal sources unless we have a election in a few months this won't really matter much. liberal partisans can rationalize this delay and others will forget about it. 

my guess is trudeau is sulking a bit - the election failure, the disaster he caused with national day for truth and reconciliation. it's not how he wanted things to go. 

christmas/newyear is sorta a reset - i suspect there is some strategy in delaying resuming to take a bit of the fire out of opposition, put the election further back in liberal mps mind. with a bit of luck some good covid and economic news, ministers who got demoted will have cooled off, and cpc will be in a leadership crisis.",liberals
hi1f2xc,2021-10-25T07:54:19.000-07:00,"jean chrétien says he never heard about abuse in residential schools while he was minister chretien won his pm role with populist ideas that he didn't follow through on just like trudeau.

his red book which promised to eliminate free trade and the gst was binned the moment the polls closed.   that was the lynchpin of his platform.

he was successful in reducing the federal deficit, mostly by offloading it to the provinces, but that was for naught anyway as our federal deficit is larger than ever and the provincial costs have not been re-absorbed by the federal gov't.",liberals
hi1flu5,2021-10-25T07:58:05.000-07:00,"liberal mps want to know why leadership taking their ‘sweet-ass time’ to call first post-election caucus meeting, say liberal sources &gt; not sure what the mp from the article was aiming for but this just makes them seem like they're trying to sow division or just mad they were left out. 

if you're a liberal mp who doesn't think trudeau is solid, making other mp's feel more emboldened and putting a bit of fear in trudeau/pmo that mp's aren't afraid to go to the media is not a bad strategy.",liberals
hi1ip6o,2021-10-25T08:20:38.000-07:00,"canada’s voting system regularly elects legislative assemblies that distort voters’ views because they never promised pr, trudeau wanted irv and then dropped the promise when it became clear he couldn't get it, rather than push for pr",liberals
h1ue80c,2021-06-14T23:08:03.000-07:00,"trudeau government to recognize french as the official language of quebec, report says &gt;thinking that minorities must be assimilated or disenfranchised is never going to work.

tell that to francois legault, the caq, and practically every quebecois nationalist.",liberals
h1ueb6g,2021-06-14T23:08:53.000-07:00,"the more canadians find out about erin o'toole, the more unpopular he becomes yeah it really just sounds like an accent. like how some people pronounce ‘burrito’ as ‘boodito’ but you don’t notice unless you listen close.",conservatives
h1ueeh8,2021-06-14T23:09:44.000-07:00,"trudeau government to recognize french as the official language of quebec, report says [removed]",liberals
h1uevpj,2021-06-14T23:14:14.000-07:00,"the more canadians find out about erin o'toole, the more unpopular he becomes [removed]",conservatives
