hm5dye2,2021-11-25T20:46:53.000-08:00,"the greatest strategy i have seen yet for the cpc. conservatism in action, rather than reaction. this is specifically what i mean. ideologically one can say that the ndp is more socially democratic(which is true), but their position aids the neo liberal establishment.

the one main thing neo-liberals want is a mass of people, willing to spend as much money as possible, on as many goods as possible. 

this means that there are 2 parts of the recipe that is needed.

1. social hedonism: guess what? if people dont want to buy your stuff, especially if they dont want to buy your stuff with eagerness. they arent gonna buy it. infact if they find what you sell to be evil, they will shut you down. the free market works pretty well, if the society it is in would be mostly moral. buuuuut, what the state, corporations, universities, etc.... shove down peoples throats is this new progressive religion. it teaches you that you must seek pleasure as much as possible + care about harm reduction. this is done so that people, are willing to sell important things for a price tag. ever wonder about the only fans stuff?? women are out here selling their sexuality. your sexuality, used to be reserved for one very important person, that you loved dearly. it was a gift, that you shared with each other, that was ***priceless.*** today women are taught that, \"hey, be sexually liberated, go and be as sexual as you want, and sell your nudes on only fans for $18.\" something priceless, now being sold on the freemarket, for a couple of bucks. who benefits? not the women, they are getting ripped off, turned into sex symbols. but hey, the neo liberal system benefits. that is just more money. do you think this would work in a conservative free market? no, people would shut down anyone who tries to dehumanize women, and men like this. so the neo liberals love the leftist hedonism.
2. they need to ensure that the free markets run well, see as i said the free markets work well, when society is moral, not too well when society is hedonistic. the neo liberals must ensure that there is as much economic freedom, for them to do their dirty work. in addition, since what they sell is hedonistic. exporting it to the rest of the world, is an easy job. you dont need to do much, just show the people what is possible. destroy their home culture, and shove this down their throats.

the ndp does **part 1.** for the neo liberal state.

the lpc does **part 1, &amp; part 2** for the neo liberal state

the cpc does **part 2** for the neo liberal state

the lpc is the best for the neo liberals, the other two arent as great. but, they will still contribute in someway, aiding the establishment. 

imagine if there was a party, that was as big as the ndp, that wasnt aiding them in any of those parts? they aint gonna like that one.",liberals
hm5dyia,2021-11-25T20:46:55.000-08:00,"liberals say they will allow provinces to ban handguns, citing rise in gun violence [removed]",liberals
hm5e023,2021-11-25T20:47:26.000-08:00,the conservatives' inflation argument is flawed — but it still might work how is it fair?  he claims inflation wasn't an issue in the election and he cites kevin page completely inaccurately.,conservatives
hm5e38m,2021-11-25T20:48:25.000-08:00,liberals downplay concerns about record-breaking milk prices - national by ending supply management and allowing competition,liberals
hm5e3f4,2021-11-25T20:48:28.000-08:00,"liberals say they will allow provinces to ban handguns, citing rise in gun violence [deleted]",liberals
hm5e5fu,2021-11-25T20:49:05.000-08:00,liberals downplay concerns about record-breaking milk prices - national let them separate. everyone wins,liberals
hm5eg40,2021-11-25T20:52:25.000-08:00,"liberals say they will allow provinces to ban handguns, citing rise in gun violence what do you like doing?",liberals
hm5emms,2021-11-25T20:54:28.000-08:00,liberals downplay concerns about record-breaking milk prices - national i seriously doubt it.,liberals
hm5eoin,2021-11-25T20:55:03.000-08:00,"liberals say they will allow provinces to ban handguns, citing rise in gun violence its exactly what they're saying. \"i don't like it or see the point, so you shouldn't have it\".",liberals
hm5eupx,2021-11-25T20:56:59.000-08:00,"liberals say they will allow provinces to ban handguns, citing rise in gun violence no. they aren't considered a firearm and can be carried legally.",liberals
hm5evds,2021-11-25T20:57:11.000-08:00,"liberals say they will allow provinces to ban handguns, citing rise in gun violence toronto banned the sale of all gun and shooting ranges within city limits. it did nothing, gun violence rose. banning firearms doesn't stop them from being smuggled into the country. its not like we have a few giant lake that are under patrolled, and the longest continuous land border. its a general consensus in law enforcement and through research that the gun majority of guns used in gun violence are smuggled in.

but the bigger picture is, we do not have a gun violence epidemic. trudeau is using it as a hot button issue, without accurately explaining our firearm laws to the boarder population. he hasn't explained a single thing. a ton of the guns he banned in may of 2020 are used for hunting, but look scary.

what we do have in canada is a epidemic of social injustice, social inequality, inequity, etc. we need our officials to do is actually follow through with social reforms, and create a social safety net in our under served communities so that people don't turn to gang and gun violence, because they don't see any other option to make money, or have that social or familial connection. we need to protect vulnerable youth and families to create spaces for them to grow and thrive. our leaders have always said all these niceties but have never followed through. people do not turn to gun violence. we need to fight for complete social reform.

there are some issues with our gun license acquisition process, the rcmp doesn't always call the references.

i'm a city kid, who hunts, and votes ndp.

side bar, the vast majority of gun deaths in canada are from suicide.",liberals
hm5f75i,2021-11-25T21:00:45.000-08:00,"liberals say they will allow provinces to ban handguns, citing rise in gun violence [deleted]",liberals
hm5fghh,2021-11-25T21:03:36.000-08:00,"liberals say they will allow provinces to ban handguns, citing rise in gun violence it's going to cost billions i'd say. the long gun registry cost 2 billion dollars. going around and collecting firearms and processing the data to do it will cost way more. it's going to eat up police time that could be spent fighting actual crime.",liberals
hm5fr6k,2021-11-25T21:06:50.000-08:00,"canada pm trudeau says he is extremely concerned by soaring cost of living i don't know if it has anything to do with just in time manufacturing, unless you mean the efficiency of the chain being for things to arrive consistently to a certain level of secondary use and direct shipping.

there's a lot of product stuck in shipping containers off the us coast. lots of stuff waiting to go into ships in china. even if chinese manufacturers all shut down for a couple days they'd still not catch up on either side of the shipping lane.

of course some things in particular facing true manufacturing shortages like chips as you say. 

opec constraining oil supply doesn't help either. they reduced production due to covid and haven't fully caught up yet to pre pandemic production levels.

it's a multifaceted issue as you point out but that doesn't mean we can't eventually get back to pre pandemic supply chain eventually. just not for a while. and as always some of the prices will stick. though certainly not all.

and i still don't think the government supports are a major driver of this. the kinda of supports they gave would have had short term inflationary results which combatted the big deflationary pressures of our shut down policies here. 

the forced savings and shift in monthly commute costs to homes by high earners coupled with low interest rates lead to housing issues, but the people receiving government support weren't the ones driving that issue so i think we can hardly blame them. i mean people are now able to keep good jobs and live in cheaper parts of the country if they leave the gta as white collar professionals. that's a problem for affordability but it's not a government cause. 

what i think is going to be interesting to watch is just how much work from home remains a thing in 2022/23 and just how many people are going to be seeing increased costs to commuting for example and if they factored that into their \"im gonna take these savings and plop em into a further away bigger place to live\" plans.",liberals
ho9x8jy,2021-12-12T02:18:44.000-08:00,"opinion: canada’s rural-urban divide is getting deeper, and that hurts all canadians it's directly a problem of having one chamber make legislation for a diversity of regions. if vancouver were its own province, then it banning the hunt would have no effect on a hypothetical northern mainland province; just as the ban in bc had no effect on residents of the yukon.

**edit: i'm going to assume, by the downvoting and the subreddit demographics, that many urban liberals dislike the idea that they shouldn't have the power to force their will upon others.**",liberals
ho9yorh,2021-12-12T02:27:54.000-08:00,"quebec premier françois legault says school board wrong to hire teacher who wore hijab thanks for the helpful suggestion. while i'm at it, i'll just call my local mp and have them tell trudeau to brush my teeth for me.",liberals
hoa4cs5,2021-12-12T03:04:07.000-08:00,"338canada: the quebec liberals in free-fall ###this is a reminder to [read the rules before posting in this subreddit](https://www.reddit.com/r/canadapolitics/wiki/rules-thelongversion).
 
1. **headline titles should be changed only [when the original headline is unclear](https://www.reddit.com/r/canadapolitics/wiki/rules-thelongversion#wiki_1._headline_titles_should_be_changed_only_where_it_improves_clarity.)**
2. **be [respectful](https://www.reddit.com/r/canadapolitics/wiki/rules-thelongversion#wiki_2._be_respectful).**
3. **keep submissions and comments [substantive](https://www.reddit.com/r/canadapolitics/wiki/rules-thelongversion#wiki_3._keep_submissions_and_comments_substantive).**
4. **avoid [direct advocacy](https://www.reddit.com/r/canadapolitics/wiki/rules-thelongversion#wiki_4._avoid_direct_advocacy).**
5. **link submissions must be [about canadian politics and recent](https://www.reddit.com/r/canadapolitics/wiki/rules-thelongversion#wiki_5._link_submissions_must_be_canadian_and_recent).**
6. **post [only one news article per story](https://www.reddit.com/r/canadapolitics/wiki/rules-thelongversion#wiki_6._post_only_one_news_article_per_story).** ([with one exception](https://www.reddit.com/r/canadapolitics/comments/3wkd0n/rule_reminder_and_experimental_changes/))
7. **replies to removed comments or removal notices will be removed** without notice, at the discretion of the moderators.
8. **downvoting posts or comments**, along with urging others to downvote, **[is not allowed](https://www.reddit.com/r/canadapolitics/wiki/downvotes)** in this subreddit. bans will be given on the first offence.
9. **[do not copy &amp; paste the entire content of articles in comments](https://www.reddit.com/r/canadapolitics/wiki/rules-thelongversion#wiki_9._do_not_copy_.26amp.3b_paste_entire_articles_in_the_comments.)**. if you want to read the contents of a paywalled article, please consider supporting the media outlet.

*please [message the moderators](https://www.reddit.com/message/compose?to=%2fr%2fcanadapolitics) if you wish to discuss a removal.* **do not reply to the removal notice in-thread**, *you will not receive a response and your comment will be removed. thanks.*


*i am a bot, and this action was performed automatically. please [contact the moderators of this subreddit](/message/compose/?to=/r/canadapolitics) if you have any questions or concerns.*",liberals
hcj1nzj,2021-09-11T15:14:47.000-07:00,"politics, polls, and punditry - sunday, september 12, 2021 quebec has shown itself to have little loyalty to any political party, i think without trudeau they can definitely break 40 seats, it's not that hard for them, they've done it many times in the past.

sure, separatist sentiment has been declining in quebec. however, quebec nationalism certainly has not, and the bloc seem to prefer to pander to quebec's alive and kicking nationalist tendencies rather than explicit separatism. they can definitely expand beyond 40 if the lpc is weak.",liberals
hcj1wx0,2021-09-11T15:17:35.000-07:00,"views on the ndp? if getting the pipeline through is the top priority *get it done by any means necessary*, then we'd either need to have the feds force it through, or offer them the same terms alberta rejected when demanded by the bc liberals.

anything short of a straight bribe and i'm not seeing it happen. even another lac-mégantic rail disaster wouldn't have them sold. that train was taking american bakken-shale field crude to the irving refinery in new brunswick; the same end-destinations served by the proposed energy-east pipeline.",liberals
hcj20p4,2021-09-11T15:18:45.000-07:00,"yukon would have elected a conservative in 2019 had the ppc not existed. in fact, in the 2019 election, the ppc costed the cpc six seats. it will be more this time, increasing the chances of trudeau's third term. let's just say that **three quarters** of those ppc voters  (213 out of 284) would have voted cpc had the ppc not existed.

cpc votes would have been 7,094 rather than 6,881, enough to beat the liberal candidate.",liberals
hcj22z5,2021-09-11T15:19:26.000-07:00,"politics, polls, and punditry - sunday, september 12, 2021 i have a feeling that this time the bloc surge will be mostly concentrated in rural areas and some suburbs. thus the liberals could still potentially gain seats in quebec if the bloc is not surging at the right places.",liberals
hcj2n4r,2021-09-11T15:25:41.000-07:00,"max and erin has adopted the same covid policy-rapid testing instead of vax pp, then why ppc voters are voting for ppc then? a vote for ppc is a vote for trudeau. max is spreading misinformation that erin supports vax pp.what is stopping ppc voters to vote cpc when both cpc and ppc has same policy? the vaccinated can spread the virus too. 

the only rational, but unrealistic way to prevent its spread would be to deploy rapid testing everywhere instead of a useless \\#vaccinepassport.

what governments want is to control us, not control the spread of the virus.

***

posted by [@maximebernier](https://twitter.com/maximebernier)

^[(github)](https://github.com/username) ^| ^[(what's new)](https://github.com/username)",liberals
hcj2xme,2021-09-11T15:28:55.000-07:00,"max and erin has adopted the same covid policy-rapid testing instead of vax pp, then why ppc voters are voting for ppc then? a vote for ppc is a vote for trudeau. max is spreading misinformation that erin supports vax pp.what is stopping ppc voters to vote cpc when both cpc and ppc has same policy? self serving politician maxime bernier is spreading misinformation about erin o toole's covid policy. these two have the same policy but one is spreading misinformation about the other, and the other is silent on ppc. erin must do something to stop the vote splitting.

* a vote for ppc=a vote for trudeau's vaccine pp, anti free speech laws and disastrous left wing laws
* a vote cpc= no vaxx pp, pro free speech laws,and  a government that is better than trudeau's govt.",liberals
hcj38mz,2021-09-11T15:32:24.000-07:00,people's party official charged with assault in justin trudeau stone-throwing incident i did nazi that coming,liberals
hcj3a5d,2021-09-11T15:32:52.000-07:00,"yukon would have elected a conservative in 2019 had the ppc not existed. in fact, in the 2019 election, the ppc costed the cpc six seats. it will be more this time, increasing the chances of trudeau's third term. i think with the person that posted this thinking is that people would have voted for shear most likely the ppc didn't exist most people won't even bother voting in last election",liberals
hcj3oux,2021-09-11T15:37:23.000-07:00,'i did not want her to lie’: trudeau rejects wilson-raybould’s claims about snc-lavalin talk dunno.. [the prophecy](https://www.youtube.com/watch?v=vhpnnlk6znc) says she'll be around longer than that..,liberals
hcj3v82,2021-09-11T15:39:21.000-07:00,"politics, polls, and punditry - sunday, september 12, 2021 am i the only one who finds it humorous that harper tried to unite the right by allying his far ultra right wing canadian alliance with the moderate progressive conservatives.  and now the ppc has popped up basically destroying that unite the right idea?

&amp;#x200b;

add on to the fact that he also effectively destroyed peter mckay's politican career as he was always the leader of the progressive conservatives this whole time, the only ones with a chance of getting elected more than a one off and done.

&amp;#x200b;

i voted for the  cpc but i don't think they will win, nor can they.  harper destroyed the progressive conservatives in my view. only when all the crazies go and join the ppc will the cpc be a viable party again.",conservatives
hcj474e,2021-09-11T15:43:10.000-07:00,"politics, polls, and punditry - sunday, september 12, 2021 the progressive conservatives were already screwed before harper took over. alberta and saskatchewan were electing the reform party (canadian alliance) since they viewed the pcs as the party of the east.

i believe the canadian alliance were already the main conservative voice before the merger.",conservatives
hcj4qxn,2021-09-11T15:49:29.000-07:00,"politics, polls, and punditry - sunday, september 12, 2021 liberals get first crack at passing a budget. if they decline or vote fails then the cpc gets to try. if they decline or vote fails the gg has to decide next steps. 

the gg’s role is to ensure a functioning government, so she would probably try to mediate or encourage the parties to sort something out. if someone can convince her that they can win a budget vote, they will get a chance. 

finally, if this doesn’t work the gg would be forced to call another election.",liberals
hcj512p,2021-09-11T15:52:40.000-07:00,"politics, polls, and punditry - sunday, september 12, 2021 in this election it will be a lot closer to 30 than 40. post trudeau they will crack 40 seats more often",liberals
hcj5f2t,2021-09-11T15:57:11.000-07:00,are the conservatives worried about the people’s party of canada — or should they be? [deleted],conservatives
hcj5h7i,2021-09-11T15:57:53.000-07:00,trudeau calls debate question on quebec's secularism law 'offensive' [removed],liberals
hcj5hgg,2021-09-11T15:57:58.000-07:00,"[deleted by user] i remember back in august 2018 when bernier threw a tantrum and left the cpc to create the ppc.

he argued that scheer (who is a staunch social conservative and anti-carbon tax) is a \"fake conservative\" based on a single-issue, mass immigration.

so yeah scheer is anti-carbon tax, anti-gay marriage, pro-life and wants to cut the budget but he's a fake conservative because he supports mass immigration. got it.",conservatives
hcj5tkq,2021-09-11T16:01:51.000-07:00,"politics, polls, and punditry - sunday, september 12, 2021 harper got a decade of power out of it and produced a conservative party that is in a close race to take power again. the ppc have yet to show themselves to be anywhere close to the reform/alliance in terms of tearing the right apart (especially as the ppc are appearing to be pull from all over the spectrum).

whether his coalition is going to be sustainable is yet to be seen (as we’re seeing more cracks build over time) but as of now it’s still an undeniable success for him",conservatives
hcj5tsq,2021-09-11T16:01:55.000-07:00,are the conservatives worried about the people’s party of canada — or should they be? fuck ezra levant and his stupid smiling face (that appears on half of his youtube thumbnails).,conservatives
hcj62tf,2021-09-11T16:04:49.000-07:00,"max and erin has adopted the same covid policy-rapid testing instead of vax pp, then why ppc voters are voting for ppc then? a vote for ppc is a vote for trudeau. max is spreading misinformation that erin supports vax pp.what is stopping ppc voters to vote cpc when both cpc and ppc has same policy? for a lot of ppc voters it's about more than just unvaccinated and vaccinated it's about a lot more",liberals
hcj7dnw,2021-09-11T16:20:06.000-07:00,"politics, polls, and punditry - sunday, september 12, 2021 i think the weirdest scenario would be trudeau calling another election… if he even remains leader for that far.",liberals
hcj890v,2021-09-11T16:30:40.000-07:00,"shower thought: ppc voters despise trudeau so much that they're technically making him win a third term............. conspiracy time: get your tinfoil hats ready

china wants trudeau to win. they're doing that by spreading all this misinformation and getting voters to vote ppc in an attempt to bleed the cpc. 

the beijing institute endorsing the lpc tells you everything you need to know who the ccp wants canada politics. this sort of political sabotage isn't new and we know china has the means and is capable.",liberals
hcj8zre,2021-09-11T16:39:42.000-07:00,"federal election projections - september 11, 2021 - 338canada look at the seat projections. liberals are +-45",liberals
gucja91,2021-04-12T17:34:07.000-07:00,"majority of ontarians feel doug ford has failed pandemic response, poll finds then so did trudeau. replace them both. i have no problem with that. but those that blame ford are often the same people that praise trudeau for his response.",liberals
hko0gl2,2021-11-14T09:47:53.000-08:00,"justin trudeau calls for clearing cyberspace of hate, disinformation at internet panel i think 100% of the senate. house of sober second thought after all",liberals
hko1i1h,2021-11-14T09:55:45.000-08:00,trudeau and kenney to reveal an affordable child-care agreement on monday morning [removed],liberals
hko33bg,2021-11-14T10:07:53.000-08:00,"kamal khera, trudeau's youngest minister, says she'll draw on her pandemic experiences in cabinet as minister of seniors seniors are not a catch all- there’s so much diversity: social, economic, regional and cultural. khera comes from a community where supporting seniors in a family unit is fundamental, providing and caring for seniors is a essential from her background. she also has experience by caring for seniors so seeing policy from a human lens and understanding how it could impact seniors is an asset. my dad is 65: should he be the seniors minister? age isn’t the qualifier here, leadership and being able to intake and give perspectives are.",liberals
hko3nkn,2021-11-14T10:12:10.000-08:00,"at a tense moment for canada-u.s. relations, trudeau travels to d.c. for trilateral talks [removed]",liberals
hko781s,2021-11-14T10:39:18.000-08:00,"apparently we don't have inherit rights as human beings, there is an \"unspoken pact of polite society.\" i agree with you. the problem is that the unvaccinated want their cake and to eat it too.

they want personal choice without personal responsibility.

it's sad that so many \"conservatives\" believe they should have the freedom to do whatever they want and yet expect society to clean up after them.",conservatives
h7t6m9o,2021-08-05T00:23:09.000-07:00,"canadian home buyers need up to 34 years of savings for a down payment: nbc the problem is supply, not demand. most municipalities have awful zoning that restricts mid-density housing, so we're way too slow to build housing. we end up with huge, expensive condos downtown and huge, expensive single-detached housing in the suburbs, which leaves middle and low income people stranded. increasingly a lot of people are looking to townhouses and mid-rise buildings as a more affordable, cost-effective option, and that certainly is the case, but not enough are being built because we make it too hard.

  
immigration is a contributing factor to the increasing unaffordability of housing, but not the root cause. people seem to forget that immigrants also suffer from housing insecurity (even more so because they tend to have less capital to begin with), and many are looking outside of toronto and vancouver for cheaper options. in any case, slightly reducing immigration to fix housing is like taking a tylenol to fight cancer - it's choosing temporary relief over the actual solution. now, eliminating all immigration? yes that would certainly drive down demand significantly...because we would start to see a population decline in canada, and with an aging population that's no good.

  
the ridiculous thing is that we've created regulations that cause low housing supply, but when we end up with low housing supply, we blame everything and everyone else.

&gt;interestingly i highly doubt 10 story low income apartment buildings are going up beside trudeaus muskoka cottage or home anytime soon.

come on, you have to know this is a bad point. of course we're not gonna have low income apartment buildings in fucking muskoka. high density development happens where there is demand. muskoka is not an urban population centre, toronto is.",liberals
h7t6wkw,2021-08-05T00:24:17.000-07:00,liberals ahead by 12 as election speculation heats up [removed],liberals
h7t6xwr,2021-08-05T00:24:25.000-07:00,liberals ahead by 12 as election speculation heats up [removed],liberals
h7t6zo4,2021-08-05T00:24:37.000-07:00,liberals ahead by 12 as election speculation heats up [removed],liberals
h7t78h2,2021-08-05T00:25:51.000-07:00,liberals ahead by 12 as election speculation heats up tomorrow a trip to rideau hall. i'd bet a drink at the bar.,liberals
