hg4wz2a,2021-10-10T05:02:22.000-07:00,"to the critics of social conservatives, please study protestantism and catholicism, because otherwise you're not making much sense. the united church is very leanient in their ways. their church structure, allows for this. so you can be a very conservative church body, or a very progressive church body. the united church structure has allowed for theology like that united church paster i linked. they even allow athiests to become pastors. the church is not very christian if it allows such things to be preached in their pulpits.

&amp;#x200b;

jesus is god. all of gods word is suitable for teaching and practicing sound doctrine(2 timothy 3:16)

jesus has a specific purpose in his time on earth. he didnt come to teach everything. rather to fulfill prophesy, and die for our sins.",conservatives
hg4y3n2,2021-10-10T05:10:04.000-07:00,"to the critics of social conservatives, please study protestantism and catholicism, because otherwise you're not making much sense. sectarianism is a thing. 

technically if you are a catholic, it would be accurate to say that those in the united church aren't the right christians. a major difference between catholicism and the protestants is where authority rests. for a lot of protestants, it's scripture alone. for catholics, it's the church who they believe stretches all the way back to jesus and saint peter (the first pope) himself.

for catholics, anyone who diverts from the one true church, and it's code and theology is not the right type of christian. there is some nuance there for sure, but what you said isn't as inaccurate as you think it is.",conservatives
hg4z0ac,2021-10-10T05:16:19.000-07:00,the inside story of how the liberals turned around their faltering campaign and won the 2021 election removed for rule 2.,liberals
hg4z15w,2021-10-10T05:16:30.000-07:00,the inside story of how the liberals turned around their faltering campaign and won the 2021 election removed for rule 2.,liberals
hg4z3fb,2021-10-10T05:16:55.000-07:00,the inside story of how the liberals turned around their faltering campaign and won the 2021 election nice spin. anything to back it up?  specifically how the liberals wanted to quash any of those things?  and then maybe how the glorious ndp saved us all.,liberals
hg4z794,2021-10-10T05:17:38.000-07:00,"do you think poilievre supports o'toole? poilievre walked away from a leadership race that i believe he would have won hands down.  

yes, he supports o'toole.

let's not go down this divisive path.",conservatives
hg50k70,2021-10-10T05:27:05.000-07:00,for everyone who voted ppc thank for re-electing trudeau [removed],liberals
hg50ywf,2021-10-10T05:29:59.000-07:00,"the inside story of how the liberals turned around their faltering campaign and won the 2021 election yeesh, yeah its not how i would do it but i guess it takes all kinds.",liberals
hg50zpn,2021-10-10T05:30:09.000-07:00,for everyone who voted ppc thank for re-electing trudeau [removed],liberals
hg518n1,2021-10-10T05:31:50.000-07:00,for everyone who voted ppc thank for re-electing trudeau [removed],liberals
hg5192d,2021-10-10T05:31:56.000-07:00,"opinion | canada’s conservatives seem determined to double down on erin o’toole’s failed strategy i'm pretty sure that, technically, and even within the constitution, the sovereign of our country is the queen.",conservatives
hg51e9t,2021-10-10T05:32:56.000-07:00,"to the critics of social conservatives, please study protestantism and catholicism, because otherwise you're not making much sense. tautologically untrue lol",conservatives
hg52lmn,2021-10-10T05:41:02.000-07:00,for everyone who voted ppc thank for re-electing trudeau that's because they receive subsidies to invest in renewables. most of them can't possibly meet our energy needs but it would be stupid of these o&amp;g companies not to grab some of that tax payer money.,liberals
hg543kg,2021-10-10T05:51:05.000-07:00,"opinion | canada’s conservatives seem determined to double down on erin o’toole’s failed strategy the thing is that's not what party elders can just dictate.

the problem is that there's a significant number of these reactionary folks in the cpc and until they decide to ditch the cpc for a more right wing party say ppc, they're going to have considerable influence within the cpc.",conservatives
hmiwikp,2021-11-28T20:37:49.000-08:00,"conservatives' survey has would-be candidates worried o'toole will change nomination rules to reward loyalists ###this is a reminder to [read the rules before posting in this subreddit](https://www.reddit.com/r/canadapolitics/wiki/rules-thelongversion).
 
1. **headline titles should be changed only [when the original headline is unclear](https://www.reddit.com/r/canadapolitics/wiki/rules-thelongversion#wiki_1._headline_titles_should_be_changed_only_where_it_improves_clarity.)**
2. **be [respectful](https://www.reddit.com/r/canadapolitics/wiki/rules-thelongversion#wiki_2._be_respectful).**
3. **keep submissions and comments [substantive](https://www.reddit.com/r/canadapolitics/wiki/rules-thelongversion#wiki_3._keep_submissions_and_comments_substantive).**
4. **avoid [direct advocacy](https://www.reddit.com/r/canadapolitics/wiki/rules-thelongversion#wiki_4._avoid_direct_advocacy).**
5. **link submissions must be [about canadian politics and recent](https://www.reddit.com/r/canadapolitics/wiki/rules-thelongversion#wiki_5._link_submissions_must_be_canadian_and_recent).**
6. **post [only one news article per story](https://www.reddit.com/r/canadapolitics/wiki/rules-thelongversion#wiki_6._post_only_one_news_article_per_story).** ([with one exception](https://www.reddit.com/r/canadapolitics/comments/3wkd0n/rule_reminder_and_experimental_changes/))
7. **replies to removed comments or removal notices will be removed** without notice, at the discretion of the moderators.
8. **downvoting posts or comments**, along with urging others to downvote, **[is not allowed](https://www.reddit.com/r/canadapolitics/wiki/downvotes)** in this subreddit. bans will be given on the first offence.
9. **[do not copy &amp; paste the entire content of articles in comments](https://www.reddit.com/r/canadapolitics/wiki/rules-thelongversion#wiki_9._do_not_copy_.26amp.3b_paste_entire_articles_in_the_comments.)**. if you want to read the contents of a paywalled article, please consider supporting the media outlet.

*please [message the moderators](https://www.reddit.com/message/compose?to=%2fr%2fcanadapolitics) if you wish to discuss a removal.* **do not reply to the removal notice in-thread**, *you will not receive a response and your comment will be removed. thanks.*


*i am a bot, and this action was performed automatically. please [contact the moderators of this subreddit](/message/compose/?to=/r/canadapolitics) if you have any questions or concerns.*",conservatives
hmiwra7,2021-11-28T20:40:26.000-08:00,"investors are pouring fuel onto a hot housing market. the consequences could hurt everyone they're familiar with the conservative party, right?",conservatives
hmix9ny,2021-11-28T20:45:56.000-08:00,"canadian home prices have risen 70 percent or by $300,000 since justin trudeau took power in 2015 prices in niagara region now average above 700k. literally a step across the border in the buffalo metro area the average home price is 200k usd or 256k cad with higher wages for virtually every non-public sector job.

is buffalo just that much better run than niagara? or is there something else going on?",liberals
hmixudy,2021-11-28T20:51:50.000-08:00,"canadian home prices have risen 70 percent or by $300,000 since justin trudeau took power in 2015 [this scotia report](https://www.scotiabank.com/ca/en/about/economics/economics-publications/post.other-publications.housing.housing-note.housing-note--may-12-2021-.html) is still the gold standard for me on the issue. it provides real data and puts it in an international context.

some highlights:

canada has the lowest housing stock per capita in the g7.

canada's ratio has gone down since 2015.

it would take 2mm homes built overnight to bring canada to the g7 average.

[from statscan:](https://www150.statcan.gc.ca/t1/tbl1/en/tv.action?pid=3410013501&amp;pickmembers%5b0%5d=1.1&amp;pickmembers%5b1%5d=4.1&amp;cubetimeframe.startmonth=07&amp;cubetimeframe.startyear=1948&amp;cubetimeframe.endmonth=07&amp;cubetimeframe.endyear=2021&amp;referenceperiods=19480701%2c20210701)

canada builds about 200-250k homes a year.

canada built more homes in absolute numbers in the 1970s.",liberals
hk0low0,2021-11-09T10:05:31.000-08:00,"majority support trudeau’s climate policy pitches made at cop26, poll suggests [removed]",liberals
hk0mjbh,2021-11-09T10:11:54.000-08:00,o'toole leaves mps who questioned vaccine policy out of his shadow cabinet [deleted],conservatives
hk0n8b0,2021-11-09T10:17:09.000-08:00,"majority support trudeau’s climate policy pitches made at cop26, poll suggests [removed]",liberals
hk0na4f,2021-11-09T10:17:31.000-08:00,"majority support trudeau’s climate policy pitches made at cop26, poll suggests [removed]",liberals
hk0nckq,2021-11-09T10:18:02.000-08:00,"will the poppy ever be \"cancelled\"? every remembrance day, there are members within the chinese community that speak out against canadian canadians observing remembrance day. their arguments against remembrance ranges from...

\"it is a canadian holiday, why do you care.\" (guess these people don't see themselves as canadian)

\"the poppy is what lead to china's century of humilation.\" (these people have a problem understanding that the opium plant and poppy are two completely separate species)

\"canadians soldiers killed chinese soldiers in the korean war.\" (this is the most common argument)

don't believe me, use google translate and translate this entire thread.

https://forum.vanpeople.com/forum.php?mod=viewthread&amp;tid=503299

fortunately, these are just a minority. however, we all thought that the disinformation campaign against the conservative party are only a minority within the chinese community. look what happened to conservative votes in chinese majority ridings all over canada...",conservatives
hk0nxs2,2021-11-09T10:22:26.000-08:00,"o'toole leaves mps who questioned vaccine policy out of his shadow cabinet it really is. you can’t have a shadow minister who can’t even be in the house of commons to ask questions during qp. there is zero chance lewis wouldn’t have been a shadow minister if she was vaccinated. otherwise genius, scheer, rood, fast, etc. wouldn’t have been in cabinet.

same reason gladu isn’t in shadow cabinet this time. you can’t do that job from home anymore.",conservatives
hk0pspn,2021-11-09T10:36:07.000-08:00,"trudeau in talks to attend first three amigos summit since 2016, source says [removed]",liberals
hk0qbbv,2021-11-09T10:39:58.000-08:00,"majority support trudeau’s climate policy pitches made at cop26, poll suggests i’m no expert but a heat pump (air source) takes heat from the outside air and brings it into the house. in the reverse it’s an air conditioner so it does the same.   it works with forced air. 

there are other types of heat pumps that use ground heat but t that’s not what i’m talking about.",liberals
hk0qwwo,2021-11-09T10:44:25.000-08:00,"o'toole leaves mps who questioned vaccine policy out of his shadow cabinet i'm all for vaccination. the problem that the conservatives are facing in my opinion is voters were unaware which mps were vaccinated. if voters from a riding want an unvaccinated mp then that's their proagative and those mps have a right to represent their voters.

edit: what i meant was surrounding the banishment of unvaccinated mps from the commons which was suggested by opposition.",conservatives
hk0qzr3,2021-11-09T10:45:01.000-08:00,"majority support trudeau’s climate policy pitches made at cop26, poll suggests how would that work for heating a home in the winter? maybe i am confused.",liberals
hk0rhnz,2021-11-09T10:48:44.000-08:00,"majority support trudeau’s climate policy pitches made at cop26, poll suggests they work until about -16c. i could be off by a couple of degrees. you need a back up like electric or a furnace.",liberals
hcsgtt1,2021-09-13T16:15:55.000-07:00,trudeau lashes out at protester who made sexist slur about his wife [removed],liberals
hcsgvq5,2021-09-13T16:16:38.000-07:00,"politics, polls, and punditry - tuesday, september 14, 2021 bryan from 2closetocall did a reverse engineer of the \"already voted\" numbers buried in the angus reid poll.

[https://twitter.com/2closetocall/status/1437561748664438784](https://twitter.com/2closetocall/status/1437561748664438784)

he has regionals too. tl;dr - liberals better hope our vote turns out on e-day, cause if not we're third in votes and probably seats.",liberals
hcsgxyo,2021-09-13T16:17:26.000-07:00,338canada: was legault's endorsement a blessing or a curse for erin o'toole? - macleans.ca le retour du pq 😍,conservatives
hcsh7sr,2021-09-13T16:20:51.000-07:00,"trudeau lashes out at protester who made sexist slur about his wife thats a good comeback, hardly \"lashing out\"",liberals
hcshacx,2021-09-13T16:21:45.000-07:00,"trudeau lashes out at protester who made sexist slur about his wife &gt;claims to be a \"feminist\" yet he fired two strong female mps for not going along with his scheme to skirt the justice system.

the liberal government opened the door for more inclusive leadership roles for women and bipoc. the 2015 cabinet was ahead of its time. in 2021, main, bay, and wall street are now working to ensure their leadership teams involve diverse backgrounds.

&gt;claims to be for the middle class, yet has allowed housing prices to skyrocket (through weak accounting disclosure laws) and has imposed new taxes on the middle class, including a home equity tax. 

canadian housing prices have been climbing for decades, well b4 the liberals came into power. 

https://en.m.wikipedia.org/wiki/canadian_property_bubble

the home equity tax is just for flippers that live in a house for less than 12 months. this won't apply to most canadians.

in fact, under the conservative plan, real estate investors will get to defer capital gains on rental properties. they will get to bid for replacement properties using pre-tax dollars while middle class families can only use after-tax dollars to bid for a home. that will only escalate house prices.

&gt;china first/canada last policies which included a failed vaccine procurement strategy

canada is one of the most vaccinated countries in the world. it's ahead of france, uk, germany, us to name a few.

https://ourworldindata.org/covid-vaccinations

&gt;toronto and montreal having some of the longest lockdowns in the world.

at some point, adults need to take responsibility for their own behaviour. if you don't want to take covid seriously, people get sick and overwhelm the healthcare system, and hence the lockdown implemented by provincial governments.

&gt;fiscal irresponsibility that lead to canada adding the most amount of debt per capita, not surprised considering he \"doesn't think about monetary policy\"

covid caused the entire global economy to shut down. economically, canada hasn't faced a drop in gdp this bad since the great depression. gdp declined by about 5.5% during covid. the great recession was a cake walk in comparison.

the only option for all world governments was to flood main street with cash in the form of support programs. world governments had learned from the great depression that austerity doesn't work in times of crisis. yes, inflation is generated but it's a hell of a lot better than seeing millions of citizens in soup lines and being evicted or having their mortgages foreclosed. a hell of a lot more businesses would have been foreclosed and a lot more personal suffering would have occurred if world governments didn't take swift action. inflation doesn't just exist in canada which many fail to acknowledge. it exists in europe, us, and asia as a result of the pandemic. we live in a global economy and the entire supply chain grounded to a halt.

https://www.usnews.com/news/economy/articles/2021-07-13/inflation-spikes-in-june-to-fastest-pace-in-13-years

&gt;numerous ethical breaches (aga kahn, we charity) numerous pr scandals (black face photo, alleged groping allegation)insensitive behaviour and gaffes

the federal government is made up of more than one individual. there are numerous departments, countless procedures, and many checks and balances. canadians don't care about trudeau. they only care about themselves and what their government will do for them in their hour of need.

&gt;calling an election during the 4th wave of a pandemic which the majority of canadians didn't want

most minority governments end in about 2 years because they are inherently unstable. 

https://en.m.wikipedia.org/wiki/federal_minority_governments_in_canada

as for the pandemic, elections canada expected 5 million mail in ballot requests. it received under a million. guest people aren't too scared to vote.

https://www.cbc.ca/news/politics/mail-in-voting-deadline-1.6173854",liberals
hcshedy,2021-09-13T16:23:10.000-07:00,"the cpc losing and doing as badly as possible is the best thing that could happen for the ppc i think a lot of us would vote ppc if our vote had a chance.  actually read what maxine posts rather than get secondary filtered/manipulated material from the liberal media.

but this election it's much more important to remove trudeau from the pmo, so i'm voting conservative in my riding where it is a very tough race between libs and cons. libs currently hold the seat.

i'm happy to see the ppc gaining ground and hopefully they will win a couple of seats. if your riding isn't a close race, it's worth voting ppc so that they will have enough of the popular votes to partake in next election's debates.",liberals
hcshmjq,2021-09-13T16:26:07.000-07:00,the seats the ppc cost the cpc in 2019 have fun winning zero seats then crying about trudeau for 4 years lol,liberals
hcshuph,2021-09-13T16:29:04.000-07:00,"trudeau lashes out at protester who made sexist slur about his wife damn, the alt right seems to be boiling over in canada all of a sudden… these people need to smarten up and get a life.",liberals
hcshve8,2021-09-13T16:29:19.000-07:00,trudeau lashes out at protester who made sexist slur about his wife [removed],liberals
hcsi0cw,2021-09-13T16:31:08.000-07:00,"a little unspoken truth bomb about trudeau hey i don’t think it’s out of the question to ask for sources for something this big

its more important to flesh out bad ideas within your own party then in other parties",liberals
hcsi2yf,2021-09-13T16:32:04.000-07:00,trudeau lashes out at protester who made sexist slur about his wife [removed],liberals
hcsijld,2021-09-13T16:38:05.000-07:00,"trudeau lashes out at protester who made sexist slur about his wife your comment is deep. most people will ignore it because you have empathy towards difficult people. that doesnt mean you agree with them, rather that yiu try to understand the why.

most folks are too angry to care.",liberals
hcsimc4,2021-09-13T16:39:07.000-07:00,"trudeau lashes out at protester who made sexist slur about his wife you think this is just the trades? 

its everywhere. even nurses",liberals
hcsinxx,2021-09-13T16:39:43.000-07:00,trudeau lashes out at protester who made sexist slur about his wife [removed],liberals
hcsirkt,2021-09-13T16:41:03.000-07:00,"trudeau lashes out at protester who made sexist slur about his wife if they get covid, they will.spread it.",liberals
hcsj7ze,2021-09-13T16:47:12.000-07:00,"trudeau lashes out at protester who made sexist slur about his wife i moved to toronto when harper was prime minister. prices were already very high by then.

a lot of the price increases there and in vancouver date back to the aftermath of the 2008 recession.",liberals
hcsjgvp,2021-09-13T16:50:31.000-07:00,"politics, polls, and punditry - tuesday, september 14, 2021 i dunno, we'll see. i still think it's a likely minority government given how tight everything is right now, however it does seem like the polling is going back to the pre-campaign numbers though which would probably suggest a liberal gain if not a majority. i think people got over their irritation for trudeau calling this thing and are just voting like normal now.",liberals
hcsjtr6,2021-09-13T16:55:22.000-07:00,"politics, polls, and punditry - tuesday, september 14, 2021 either mainstreet is wrong or everyone else is wrong in the province. bc might not show it's cards until the last minute in this election. my feeling with bc is that the liberals won't do as bad as expected bcause the ndp will underperform there and win one or two addtional seats at best. so the liberals vote won't get spilt like crazy in their competitive ridings.",liberals
hcslrg0,2021-09-13T17:22:24.000-07:00,"have canadians wearied of trudeau's vapid wokeness? ###this is a reminder to [read the rules before posting in this subreddit](https://www.reddit.com/r/canadapolitics/wiki/rules-thelongversion).
 
1. **headline titles should be changed only [when the original headline is unclear](https://www.reddit.com/r/canadapolitics/wiki/rules-thelongversion#wiki_1._headline_titles_should_be_changed_only_where_it_improves_clarity.)**
2. **be [respectful](https://www.reddit.com/r/canadapolitics/wiki/rules-thelongversion#wiki_2._be_respectful).**
3. **keep submissions and comments [substantive](https://www.reddit.com/r/canadapolitics/wiki/rules-thelongversion#wiki_3._keep_submissions_and_comments_substantive).**
4. **avoid [direct advocacy](https://www.reddit.com/r/canadapolitics/wiki/rules-thelongversion#wiki_4._avoid_direct_advocacy).**
5. **link submissions must be [about canadian politics and recent](https://www.reddit.com/r/canadapolitics/wiki/rules-thelongversion#wiki_5._link_submissions_must_be_canadian_and_recent).**
6. **post [only one news article per story](https://www.reddit.com/r/canadapolitics/wiki/rules-thelongversion#wiki_6._post_only_one_news_article_per_story).** ([with one exception](https://www.reddit.com/r/canadapolitics/comments/3wkd0n/rule_reminder_and_experimental_changes/))
7. **replies to removed comments or removal notices will be removed** without notice, at the discretion of the moderators.
8. **downvoting posts or comments**, along with urging others to downvote, **[is not allowed](https://www.reddit.com/r/canadapolitics/wiki/downvotes)** in this subreddit. bans will be given on the first offence.
9. **[do not copy &amp; paste the entire content of articles in comments](https://www.reddit.com/r/canadapolitics/wiki/rules-thelongversion#wiki_9._do_not_copy_.26amp.3b_paste_entire_articles_in_the_comments.)**. if you want to read the contents of a paywalled article, please consider supporting the media outlet.

*please [message the moderators](https://www.reddit.com/message/compose?to=%2fr%2fcanadapolitics) if you wish to discuss a removal.* **do not reply to the removal notice in-thread**, *you will not receive a response and your comment will be removed. thanks.*


*i am a bot, and this action was performed automatically. please [contact the moderators of this subreddit](/message/compose/?to=/r/canadapolitics) if you have any questions or concerns.*",liberals
hcslwow,2021-09-13T17:24:31.000-07:00,"trudeau lashes out at protester who made sexist slur about his wife yeah... i am not a huge fan either but...i would prefer him over the guy in the right.

its too bad we cant vote for pm directly and choose between our first choice snd the runner up.
actually...its too bad we cant do that locally as well.",liberals
hcsmcx3,2021-09-13T17:31:06.000-07:00,trudeau lashes out at protester who made sexist slur about his wife much worse,liberals
hcso21u,2021-09-13T17:57:02.000-07:00,"politics, polls, and punditry - tuesday, september 14, 2021 been following both and it's funny how polling has shifted left in both elections since not too long ago. it looked like newsom was gonna be recalled and that trudeau was gonna lose a few weeks ago but now it's the other way around.",liberals
hcso7db,2021-09-13T17:59:18.000-07:00,"maxime bernier spreading misinformation about erin o toole. thank you global news for spreading misinformation and splitting cpc votes. erin respects medical decision of canadians, and definitely not national vaxx pp, trudueau must be so happy at maxime bernier for splitting cpc vote. a vote for o’toole, trudeau or singh is a vote for the \\#vaccinepassport and for china’s orwellian social credit system. 
\\#voteppc2021 

***

posted by [@maximebernier](https://twitter.com/maximebernier)

photos in tweet |  [photo 1](http://pbs.twimg.com/media/e_lil0mxeammf8r.jpg) 

^[(github)](https://github.com/username) ^| ^[(what's new)](https://github.com/username)",liberals
hp96c10,2021-12-19T11:52:49.000-08:00,from fighting ivory trade in canada to fixing your fridge: six things you may have missed in trudeau's mandate letters what does he want to do with the horses if he's going to ban shipping them for slaughter? just burry them?,liberals
hp96l3j,2021-12-19T11:54:54.000-08:00,justin trudeau’s position looks strong heading into 2022 — but only compared to his opponents [removed],liberals
hp96vau,2021-12-19T11:57:18.000-08:00,"trudeau says it's not just governments who can fight quebec secularism law i don’t want to have theist supremacist beliefs forced on me, or to live as a second class citizen.   if you want to bow to theist supremacists, and give them special exemptions that no other canadians get, then perhaps what you want is to live in a theocracy.",liberals
