hbq0s8c,2021-09-05T05:39:50.000-07:00,"o'toole reverses course on guns, says he will keep liberal ban in place i think it's an easy liberal defense that things have gotten worse. the laws they got worse under were put in place by the cpc, they have been changed or tried to be changed by the lpc and some measures have been stalled out by cpc members procedurally.

plus it's 2021, not 2013 and any government would have faced the same gun crime issues but it was the lpc who have introduced measures to deal with them as a result.

- the defense writes itself and it's a poor attack.

otoole would have done better to clarify that he wished to reclassify and modernize the classification system for guns which has been ignored for decades. some line about how banning individual guns doesn't make sense, but having a better classification system that better identifies classes/types/etc guns to be more uniform in approach - evidence based - that's a better argument.

but they've thrown that away now. too late.",conservatives
hbq0uwt,2021-09-05T05:40:22.000-07:00,"o'toole reverses course on guns, says he will keep liberal ban in place with ppc now in existence is this really an smart move? the people that want this are not going to see this as a promise cpc is going to keep cause of their platform. while the cpc supporters that don't want it have another choice (ppc) especially if we getting another liberal + ndp government",conservatives
hbq10dn,2021-09-05T05:41:27.000-07:00,justin trudeau’s political style swept him into office. it may now see him out money isn’t artificial. there are real-world consequences for that kind of thinking.,liberals
hbq112q,2021-09-05T05:41:35.000-07:00,"o'toole reverses course on guns, says he will keep liberal ban in place the problem he is calling for a review of the ban. whats to stop him from setting up a panel of his choosing to get the conclusion he wants? voters that want the ban don't want weak promises and reviews, they want the ban to stay in effect.",conservatives
hbq1196,2021-09-05T05:41:36.000-07:00,"o'toole reverses course on guns, says he will keep liberal ban in place [removed]",conservatives
hbq12ov,2021-09-05T05:41:54.000-07:00,"o'toole reverses course on guns, says he will keep liberal ban in place they just say over and over that he agrees with and gets his gun policy from jt. damage done.

i kind of agree with this move campaign-wise though. there don't seem to be many ridings where cpc will lose to ppc because of this, but their may be many ridings where this will tip the scales past the lpc. they may lose support in rural atlantic as many people have pointed out, but they may gain in urban/suburban ont and que. i'm not sure, i haven't done the math but i'm sure they have.

edit: i find this particularly interesting as my riding went ndp last cycle by less votes than the ppc got. this will definitely hurt the cpcs chances of winning my riding.",conservatives
hbq1bru,2021-09-05T05:43:42.000-07:00,"o'toole reverses course on guns, says he will keep liberal ban in place hmm they can say he is going to stack the review in gun owners favours to reverse the ban. it's  such a easy issue to continue to attack.  it would be different if he said we will continue the ban and not do a review... but the problem than becomes what else will he change his position on if he gets in power.",conservatives
hbq1c4p,2021-09-05T05:43:46.000-07:00,"o'toole reverses course on guns, says he will keep liberal ban in place oh that will be gone if he gets in, no question.",conservatives
hbq1iuk,2021-09-05T05:45:08.000-07:00,"o'toole reverses course on guns, says he will keep liberal ban in place 
yikes, after arguing against it so much now changing his mind? obviously the hardcore tory base won’t leave but it will damage his credibility, makes him more of a flipflopper",conservatives
hbq1kxr,2021-09-05T05:45:34.000-07:00,"o'toole reverses course on guns, says he will keep liberal ban in place it isn't. he is not going to be able to win that many more seats in the gta. he needs atlantic canada to switch heavily if he is going to offset liberal gains in quebec. as far as i'm concerned this will probably seal at least a liberal minority.",conservatives
hbq1oza,2021-09-05T05:46:22.000-07:00,"o'toole reverses course on guns, says he will keep liberal ban in place he also appealed to the social conservatives in order to win cpc leadership, and then flip-flopped on some of that afterward too.

he doesn't have any principles, he simply wants power.

it's no wonder people think he has a hidden agenda, when he hides his views due to convenience.",conservatives
hbq1pb6,2021-09-05T05:46:26.000-07:00,"o'toole reverses course on guns, says he will keep liberal ban in place let's just agree to disagree.",conservatives
hbq1xwn,2021-09-05T05:48:11.000-07:00,"o'toole fucks up on gun control i'm in the same boat. is your mp any good? i'm supporting mine because he deserves his job. 

and i keep telling myself that people like pierre poilievre are on this team.",conservatives
hbq240e,2021-09-05T05:49:26.000-07:00,"o'toole reverses course on guns, says he will keep liberal ban in place getting rid of the day care program is how he will keep the deficit to the level  he promised.  daycare has to get cut for his finances.",conservatives
hbq25g4,2021-09-05T05:49:44.000-07:00,it’s the riding keeping the greens from being a one-seat party. can paul manly fend off the ndp and conservatives in nanaimo-ladysmith? how many of those moved forward into actual action?,conservatives
hbq27oo,2021-09-05T05:50:12.000-07:00,singh not critical of trudeau’s handling of 2 michaels detained in china [removed],liberals
hbq2gnw,2021-09-05T05:52:00.000-07:00,"o'toole reverses course on guns, says he will keep liberal ban in place [removed]",conservatives
hbq2idu,2021-09-05T05:52:22.000-07:00,"o'toole reverses course on guns, says he will keep liberal ban in place that, and everyone seems to viewing this development strictly through the issue rather than the damage a flip flop on any major issue can do to one’s brand. there could very well be people out there who don’t particularly care much about firearms legislation, were tempted to vote cpc for other reasons and now see that o’toole can’t be trusted, period.",conservatives
hbq2j3u,2021-09-05T05:52:31.000-07:00,o'toole fucks up on gun control he is willing to upset his base to gain more liberal voters.,conservatives
hbq2kxi,2021-09-05T05:52:54.000-07:00,o'toole fucks up on gun control it's not even satire at this point,conservatives
hbq2t69,2021-09-05T05:54:39.000-07:00,o'toole fucks up on gun control my mp is marco medicino so it’s safe to say he won’t get my vote lol,conservatives
h6bvyef,2021-07-23T13:53:21.000-07:00,"victims of communism memorial received donations honouring fascists, nazi collaborators, according to website because the conservative party wants to remind canadians that \"socialism bad!\" this is a move to influence culture on their part.",conservatives
h6bx104,2021-07-23T14:04:28.000-07:00,pierre trudeau ahead of harper as best recent pm for canadians you incorrectly said that trudeau is mythologized. i just pointed out trudeau 's top 5 lasting policy and constitutional initiatives that define canada  to this day. these are not myths. nor are they cherry picked.,liberals
h6bx1sq,2021-07-23T14:04:41.000-07:00,"erin o'toole draws fire from party insiders, his own mps over staff member who works for social conservatives harper put his thumb on the scale to get both scheer and eot picked. they're reform men, not people who'd put their own stamp on the cpc like mackay, bernier or charest all could have.

scheer and eot even *look* harperish.",conservatives
h6bxyq0,2021-07-23T14:14:24.000-07:00,"a housing crisis is costing canadians billions. what are politicians going to do about it? it's clearly used as a ratchet to keep up pressure on housing stock.

by keeping demand above supply it forces heavy bidding, elevating prices. what they are doing is utterly disgusting. it's immoral.

i can't believe people on here ever defend trudeau. a western country where the leaders are basically saying \"we can't house people in a sustainable way\". this clearly can be done, it's a political choice not to, and that choice is immoral.",liberals
h6byhyu,2021-07-23T14:20:11.000-07:00,"erin o'toole draws fire from party insiders, his own mps over staff member who works for social conservatives harper is too busy leading the idu and getting more regressive governments elected around the world. 

i really doubt mr. “old stock canadians” has anything new to offer that people didn’t reject before.",conservatives
h6bzi46,2021-07-23T14:31:11.000-07:00,pierre trudeau ahead of harper as best recent pm for canadians so?,liberals
h6bzkm1,2021-07-23T14:31:55.000-07:00,pierre trudeau ahead of harper as best recent pm for canadians &gt;canada has some hilarious polls like who are these people and why do we actually discuss polls like they show anything accurate since 2000?,liberals
h6bzqhc,2021-07-23T14:33:37.000-07:00,pierre trudeau ahead of harper as best recent pm for canadians still doesn’t make much sense what with residential schools in the news constantly right now.,liberals
h6c0adf,2021-07-23T14:39:27.000-07:00,"opinion: liberal ideologues’ continued support of justin trudeau is the party’s great, unshakable shame | the globe &amp; mail i think the the way the lgbt movement operates now, living without interference from other people was never the goal. the fact that anything contrary to lgbt dogma is a hate crime shows you it's less about liberty from an oppressive culture and more about permanently changing the structure of the canadian family.",liberals
h6c2cg8,2021-07-23T15:02:45.000-07:00,pierre trudeau ahead of harper as best recent pm for canadians [removed],liberals
h6c2ts3,2021-07-23T15:08:24.000-07:00,pierre trudeau ahead of harper as best recent pm for canadians just be grateful he wasnt a complete idiot like trump or ford.,liberals
hnv6jsx,2021-12-09T00:10:10.000-08:00,justin trudeau shouldn’t lecture attendees at the summit for democracy. he should take notes [removed],liberals
hnv8gvn,2021-12-09T00:22:29.000-08:00,"automatic pardon bill hailed by experts as ‘most significant’ justice reform in a long time you make a good point here. i can't stand the liberals and my trust in them to follow through on anything remotely helpful to the general public is rock bottom. 

that said, this is at least a bill, which is a hell of a lot farther than electoral reform ever got under the liberals. and unlike er this doesn't really require the liberals to put the needs of the citizenry above the interests of their own party, so fingers crossed.",liberals
hnv9uvt,2021-12-09T00:31:16.000-08:00,"wells: trudeau, joly and canada's (un)diplomatic corps ###this is a reminder to [read the rules before posting in this subreddit](https://www.reddit.com/r/canadapolitics/wiki/rules-thelongversion).
 
1. **headline titles should be changed only [when the original headline is unclear](https://www.reddit.com/r/canadapolitics/wiki/rules-thelongversion#wiki_1._headline_titles_should_be_changed_only_where_it_improves_clarity.)**
2. **be [respectful](https://www.reddit.com/r/canadapolitics/wiki/rules-thelongversion#wiki_2._be_respectful).**
3. **keep submissions and comments [substantive](https://www.reddit.com/r/canadapolitics/wiki/rules-thelongversion#wiki_3._keep_submissions_and_comments_substantive).**
4. **avoid [direct advocacy](https://www.reddit.com/r/canadapolitics/wiki/rules-thelongversion#wiki_4._avoid_direct_advocacy).**
5. **link submissions must be [about canadian politics and recent](https://www.reddit.com/r/canadapolitics/wiki/rules-thelongversion#wiki_5._link_submissions_must_be_canadian_and_recent).**
6. **post [only one news article per story](https://www.reddit.com/r/canadapolitics/wiki/rules-thelongversion#wiki_6._post_only_one_news_article_per_story).** ([with one exception](https://www.reddit.com/r/canadapolitics/comments/3wkd0n/rule_reminder_and_experimental_changes/))
7. **replies to removed comments or removal notices will be removed** without notice, at the discretion of the moderators.
8. **downvoting posts or comments**, along with urging others to downvote, **[is not allowed](https://www.reddit.com/r/canadapolitics/wiki/downvotes)** in this subreddit. bans will be given on the first offence.
9. **[do not copy &amp; paste the entire content of articles in comments](https://www.reddit.com/r/canadapolitics/wiki/rules-thelongversion#wiki_9._do_not_copy_.26amp.3b_paste_entire_articles_in_the_comments.)**. if you want to read the contents of a paywalled article, please consider supporting the media outlet.

*please [message the moderators](https://www.reddit.com/message/compose?to=%2fr%2fcanadapolitics) if you wish to discuss a removal.* **do not reply to the removal notice in-thread**, *you will not receive a response and your comment will be removed. thanks.*


*i am a bot, and this action was performed automatically. please [contact the moderators of this subreddit](/message/compose/?to=/r/canadapolitics) if you have any questions or concerns.*",liberals
hnv9zh4,2021-12-09T00:32:05.000-08:00,"justin trudeau shouldn’t lecture attendees at the summit for democracy. he should take notes so, to be clear, your response to the roughly 15 examples of anti-democratic conduct on the part of the current government and the 5 systemic issues coyne identifies is: a magazine ranked us 5th (out of 7 \"full democracies,\" by the way)?",liberals
hnv9zo2,2021-12-09T00:32:07.000-08:00,"if justin trudeau believes in parliament, he has a funny way of showing it the problem with this is you start setting the bar lower and lower. the lib voters get away with this, then the cpc gets frustrated and pulls the same thing when they get in and when the left cries about it the right points to the fact they didnt' complain when someone they liked did it, and now it becomes 'standard'. 

we also see it with corruption or dirty political tricks to win votes - when the libs set the bar low and their supporters reward it eventually other parties give up trying because what the hell is the point of playing by the rules when nobody else does and the voters don't seem to care. 

so eventually what you wind up with is a system that's unaccountable and corrupt no matter who's in power and at that point there's little the people can do because there's no other choices. we see that more in the states right now where each party abuses the presidential powers a little more than the last one but it's happening here too. 

the biggest argument against democracy is the average voter.",liberals
hnvbzix,2021-12-09T00:44:53.000-08:00,justin trudeau shouldn’t lecture attendees at the summit for democracy. he should take notes [removed],liberals
hnvd4pf,2021-12-09T00:52:10.000-08:00,"doug ford looks poised to win next year’s election. here’s how he reversed his political fortunes i keep seeing people say \"del duca is not an inspirational politician. this might be true, but it's not the reason why i am not going to vote for him. i am not going to vote for him because i keep seeing the surveys that that the party sends out to  set their agenda and it's like 

\"choose three of the follow as issues most important to you\". then there is a bunch of generic talking points in which they try to talk about the same issues that they have been touting since the 90's in bland terms which basically say nothing other than the fact that they are a party who have nothing to offer me. in ontario i live in a province in which home ownership is a vanishing dream for my generation because the system has been rigged by developers and real estate agents to put more money in the hands of the few while leaving the rest of us out in the cold, jobs are being shifted to the gig economy and more and more of us have no benefits and probably no chance to retire, the environment is being sold out for highways which are inevitably going to be financial boondoggles which put tax money into the hands of the already wealthy, the price of food is going up, wages for the working class are stagnant, we still have no universal dental or medical (every liberal government has promised this and yet it's 2021 and we still don't have it), and a lot of this is because we keep bouncing back and forth between the same two parties.

i'm not refusing to vote for del duca because he doesn't excite, i'm not voting for the liberal party because their plans don't benefit me and i have no faith that they would actually address these issues if they ever came into government.",liberals
hnh6ozh,2021-12-06T00:48:42.000-08:00,"liberals to introduce bill repealing mandatory minimums for drug offences because the punishment crowd is thinking emotionally, and the fiscal ones rationally, and rationality rarely wins an argument over emotion.",liberals
hnh6r4h,2021-12-06T00:49:05.000-08:00,"liberals to introduce bill repealing mandatory minimums for drug offences you know who pays when we frivolously put people in jail for extended periods of time for things that don't need jail time? taxpayers. it ain't cheap to jail someone either.

single minded people that think like you say are ignorant and needlessly waste their own tax money demanding dumb things like that.",liberals
hnh74cn,2021-12-06T00:51:27.000-08:00,"liberals to introduce bill repealing mandatory minimums for drug offences agreed, but good luck convincing them of that. 

insight made similar arguments about saving government money, but because they were making life easier for drug addicts, they were vilified.",liberals
hnh7chh,2021-12-06T00:52:54.000-08:00,"the future of the liberal party—without justin trudeau this is what i predict will happen, trudeau is very popular among lpc voters because he wins. he will go on until he loses and then freeland will step in. 

i don't think this idea of stepping aside for freeland will happen. if i was freeland, i wouldn't want to step in those shoes and head into the next election. you'll need trudeau there to take the hit (the loss) which would allow you to come in as opposition as a clean slate and then take the next election. 

it's very hard to win an election that way. trudeau will need to keep going until people vote him out and give freeland a blank, clean slate. transferring the current slate is not something trudeau would want to do, and not something freeland wants to take. it's hard to win an election while holding an unclean slate.",liberals
hnh7jgw,2021-12-06T00:54:10.000-08:00,"liberals to introduce bill ending mandatory minimum sentences for drug offences there haven't been mandatory minimums on possession and i too would be opposed to them.  this just gets rid of the mandatory minimums for all types of trafficking / importing.  the article doesn't mention it but this includes mandatory minimums for weapons offences.

the soft on crime approach to me is troubling and we have a revolving door justice system nowadays.

https://www.canada.ca/en/department-justice/news/2021/02/bill-c-22-mandatory-minimum-penalties-to-be-repealed.html",liberals
hnh7kug,2021-12-06T00:54:25.000-08:00,"erin o’toole should tell pierre poilievre to stop tilting at windmills &gt;everything x does good or bad gets put under immense scrutiny because he’s well aware that the average voter isn’t usually very politically involved.

swapped trudeau for x, since my following point doesn't require any specific names.   


the fact is that that ***is their job.*** they are supposed to scrutinize each other over everything, because that's what we hire them to do, among other things. we have them do these things, because we all have other things to do.   


it's part of why politicians are *public servants.*",liberals
hnh7m1f,2021-12-06T00:54:38.000-08:00,"liberals to introduce bill repealing mandatory minimums for drug offences &gt; don't steal from people and you won't have to bear the unfortunate consequences.

not easy when we live within a society that still actively oppresses entire groups of people for being born aboriginal. for some people, not stealing isn't an easy choice since the alternative is even worse. 

&gt; almost never happens. and the police aren't your private security force. they're there to protect the wealthy and the state. they do little for property crimes against the poor.

police often catch thieves but their resources have also been limited by vast overexpansions of their responsibilities so they can't spend a lot of time chasing down low-cost theft or weak leads. 

&gt; some things can't be replaced, and those which can, only increases costs for the law-abiding when premiums go up.

most things can, those that can't are because of sentimental value. they fact you are losing something of sentimental value does not give the right to take a life.

&gt; this also doesn't address the trauma of violation.

and instead gets to traumatize everyone that cared about the thief with the loss of a loved one because someone decided their 15 year old truck was worth a life. also get to traumatize the first responders, and any family of the killer. 

&gt; it's not murder, it's self-protection. i'm stopping you from taking my lawfully owned property, and am unwilling to risk my personal safety to safeguard your criminal ass. don't like the consequences, don't steal. want to steal, don't expect people to have sympathy for you when the consequences come flying your way.

it's not self-protection, your \"self\" does not extend to your stuff. self protection is the defense of yourself from impending harm. these are completely distinct concepts in the law and killing a person to protect things will absolutely result in criminal convictions when your self is not in danger (or you put it in danger to protect your stuff). 

your mindset is exactly what i was talking about. it's a fetishization of murder, looking for a reason to shoot a person because they dared to try to impact your life in any way. murder is an absolute last resort for any person, trying to justify it by saying \"they tried to take my stuff\" is justifying massively disproportionate responses to the crime.",liberals
hnh7o2y,2021-12-06T00:55:00.000-08:00,"liberals to introduce bill ending mandatory minimum sentences for drug offences this gets rid of mandatory minimums for **all** drug offences.  there were no mandatory minimums for personal use and possession and people even being prosecuted for personal use is a rarity.

the war on drugs is indeed a failure.  allowing a massive market of illegal, unregulated drugs to flourish is the worst of both worlds between a drug war and the legalize and regulate approach.

[https://www.canada.ca/en/department-justice/news/2021/02/bill-c-22-mandatory-minimum-penalties-to-be-repealed.html](https://www.canada.ca/en/department-justice/news/2021/02/bill-c-22-mandatory-minimum-penalties-to-be-repealed.html)",liberals
hnh7z62,2021-12-06T00:57:01.000-08:00,liberals to introduce bill repealing mandatory minimums for drug offences [removed],liberals
hnh8bpd,2021-12-06T00:59:16.000-08:00,"liberals to introduce bill repealing mandatory minimums for drug offences if the policy's objective is to limit the lucrative opportunities for organized crime, it's both poorly designed and incredibly ineffective. legalization of most drugs would be *vastly* more effective.",liberals
hnh8et6,2021-12-06T00:59:49.000-08:00,"liberals to introduce bill repealing mandatory minimums for drug offences you're right, fiscal conservatism has been a right wing fantasy for at least the last 20 years.

the closest thing we had were the chretien/martin governments and they were liberals.",liberals
hnh9w8a,2021-12-06T01:09:29.000-08:00,"liberals to introduce bill repealing mandatory minimums for drug offences &gt;not easy when we live within a society that still actively oppresses entire groups of people for being born aboriginal. for some people, not stealing isn't an easy choice since the alternative is even worse. 

that's an argument to improve support systems, not to allow people to steal.

&gt;police often catch thieves but their resources have also been limited by vast overexpansions of their responsibilities so they can't spend a lot of time chasing down low-cost theft or weak leads. 

that's an argument to improve police resources, not to allow people to steal.

&gt;most things can, those that can't are because of sentimental value. they fact you are losing something of sentimental value does not give the right to take a life.

don't steal and you won't have to find out.

&gt;and instead gets to traumatize everyone that cared about the thief with the loss of a loved one because someone decided their 15 year old truck was worth a life. also get to traumatize the first responders, and any family of the killer. 

that's the theif's choice.

&gt;it's not self-protection, your \"self\" does not extend to your stuff. self protection is the defense of yourself from impending harm. these are completely distinct concepts in the law and killing a person to protect things will absolutely result in criminal convictions when your self is not in danger (or you put it in danger to protect your stuff). 

it is me defending my property. it is unconscionable however to ask people to risk their safety to do so, or to permit theft. so don't steal.

you're looking to excuse theft, and the injury and death of victims because you're unwilling to those one of the most simple moral stances imaginable; it's not yours, don't take it.",liberals
hnh9yxl,2021-12-06T01:09:59.000-08:00,"liberals to introduce bill repealing mandatory minimums for drug offences and now we have e ppc, who has a plan on what exactly to stop spending on.",liberals
