gizm0ac,2021-01-11T18:56:55.000-08:00,"question period — période de questions — january 11, 2021 they're the right hand of the person at the top, and the scope of their responsibility really depends on the person they work for.  generally they do problem solving, mediate workplace disputes, and they'll be a 'screen' for incoming stuff.  so an mp or pm's chief of staff would be the person who fields a lot of less important calls and decides what to pass on, and consolidates the cabinet's agenda into something easy to read first thing in the morning.  it keeps things from being a situation where the pm or mp are so busy managing their people and sorting a deluge of people with their own individual crises that they can't get anything else done.

instead of a pm or mp saying \"i need someone to helm this transportation position... who do i pick?\" and spending a day on that, they turn to their chief of staff and if they don't already have two or three names ready, they'll know how to pick some people to present in short order.

it's easy to think of it as a secretary position, but it's actually a *really* powerful position because they, essentially, manage the workplace and immediate circle of the pm or mp, and always have their ear.  most others (even in the pm's office and cabinet) go to katie telford, not trudeau himself, when there's something they want to bring to trudeau's attention.  they'll know most of what the pm or mp does, so they can keep the right people in the loop.",liberals
gizoarf,2021-01-11T19:33:36.000-08:00,"trudeau to make minor cabinet shuffle tomorrow morning seeing as he hasn't removed him yet it can only mean he is handling his department exactly the way trudeau wants him to. it is obvious that trudeau completely agrees with his methods and his ideology when it comes to criminals. how else can trudeau allow someone that supports carding to be in charge of that ministry?

same with bernadette jordan. her handling of native fishing rights has been especially sad, but she is only doing what the leadership in government wants her to do.

the actions of these two ministers obviously align with trudeau's own beliefs.",liberals
gizosuz,2021-01-11T19:41:23.000-08:00,"rigged canadian election? why canada's conservatives can't seem to quit donald trump ###this is a reminder to [read the rules before posting in this subreddit](https://www.reddit.com/r/canadapolitics/wiki/rules-thelongversion).
 
1. **headline titles should be changed only [when the original headline is unclear](https://www.reddit.com/r/canadapolitics/wiki/rules-thelongversion#wiki_1._headline_titles_should_be_changed_only_where_it_improves_clarity.)**
2. **be [respectful](https://www.reddit.com/r/canadapolitics/wiki/rules-thelongversion#wiki_2._be_respectful).**
3. **keep submissions and comments [substantive](https://www.reddit.com/r/canadapolitics/wiki/rules-thelongversion#wiki_3._keep_submissions_and_comments_substantive).**
4. **avoid [direct advocacy](https://www.reddit.com/r/canadapolitics/wiki/rules-thelongversion#wiki_4._avoid_direct_advocacy).**
5. **link submissions must be [about canadian politics and recent](https://www.reddit.com/r/canadapolitics/wiki/rules-thelongversion#wiki_5._link_submissions_must_be_canadian_and_recent).**
6. **post [only one news article per story](https://www.reddit.com/r/canadapolitics/wiki/rules-thelongversion#wiki_6._post_only_one_news_article_per_story).** ([with one exception](https://www.reddit.com/r/canadapolitics/comments/3wkd0n/rule_reminder_and_experimental_changes/))
7. **replies to removed comments or removal notices will be removed** without notice, at the discretion of the moderators.
8. **downvoting posts or comments**, along with urging others to downvote, **[is not allowed](https://www.reddit.com/r/canadapolitics/wiki/downvotes)** in this subreddit. bans will be given on the first offence.
9. **[do not copy &amp; paste the entire content of articles in comments](https://www.reddit.com/r/canadapolitics/wiki/rules-thelongversion#wiki_9._do_not_copy_.26amp.3b_paste_entire_articles_in_the_comments.)**. if you want to read the contents of a paywalled article, please consider supporting the media outlet.

*please [message the moderators](https://www.reddit.com/message/compose?to=%2fr%2fcanadapolitics) if you wish to discuss a removal.* **do not reply to the removal notice in-thread**, *you will not receive a response and your comment will be removed. thanks.*


*i am a bot, and this action was performed automatically. please [contact the moderators of this subreddit](/message/compose/?to=/r/canadapolitics) if you have any questions or concerns.*",conservatives
gizpeiw,2021-01-11T19:50:38.000-08:00,rigged canadian election? why canada's conservatives can't seem to quit donald trump [removed],conservatives
gizrobz,2021-01-11T20:23:45.000-08:00,trudeau to make minor cabinet shuffle tomorrow morning [removed],liberals
gizrran,2021-01-11T20:24:54.000-08:00,"canada could well see an election this year, pm trudeau says for first time want better! leave.",liberals
gpeegfk,2021-03-01T17:48:56.000-08:00,"leger poll - lpc 35%, cpc 28%, ndp 23%, bq 7%, grn 6% i don't see how spending 5 minutes to make a tiktok and potentially attracts tens of thousands of young people isn't worth jagmeet's time. 

i honestly think trudeau would do well to join the ndp in the tiktok/social media game.",liberals
gpeh0nd,2021-03-01T18:31:51.000-08:00,"leger poll - lpc 35%, cpc 28%, ndp 23%, bq 7%, grn 6% when the liberals poll around 20% in alberta, go to 338 and look at the alberta ridings. i define any riding that’s listed as “leaning” (in any direction) or “tossup” as a possible seat. and when the lpc has around 20% of the ab vote, 338 shows the lpc competitive in 8-12 ridings. that doesn’t mean they’re favoured in 8-12 ridings, a lot of those ridings are listed as blue tossups or lean cpc. but they’re all close enough that the liberals could win.



i don’t think the liberals will win 9 seats today. but it wouldn’t take a whole lot for them to get there if they can get close to 2015 levels of support. especially if the ppc and maverick party take even 5% of the vote, that could flip a bunch of close seats in edmonton and calgary.",liberals
gpeh2ol,2021-03-01T18:32:47.000-08:00,"leger poll - lpc 35%, cpc 28%, ndp 23%, bq 7%, grn 6% honestly, 1 seat in ab is a win for the liberals. anything else in ab is gravy.",liberals
gpek1qm,2021-03-01T19:19:47.000-08:00,"what’s the plan, erin o’toole? conservative morale is low as mps await direction, sources say maybe if they actually gave people some reason to vote and support them, they wouldn't be in this mess.

when i look at politics, i look to see what each political party has to offer to me. how am i going to benefit from this?

parties like the conservative party in canada don't do that though. they'd rather spend time making boogeymen out of \"the left\" and saying \"no, you need to vote for us, you are obligated to, because those guys over there are shittier than us.\"

i'm 23 years old, don't own a home, and i'm just getting out of college. you want my vote? give me something to work with here.",conservatives
gpekc3e,2021-03-01T19:24:04.000-08:00,"leger poll - lpc 35%, cpc 28%, ndp 23%, bq 7%, grn 6% i can see that. i would still want the scenario though. the conservatives keep flirting with trumpism and can’t shake the dirty albatros of social conservatism. they deserve an exile until they finally dump the toxic baggage. sadly it’s not gonna happen.",conservatives
gpekj3q,2021-03-01T19:26:57.000-08:00,"leger poll - lpc 35%, cpc 28%, ndp 23%, bq 7%, grn 6% but that’s the point here, isn’t it? the liberals working with the bloc to block (sorry) electoral reform. this is a scenario where the liberals are avoiding the ndp because not wanting to reform.",liberals
gpeknhe,2021-03-01T19:28:44.000-08:00,donor says he raised hundreds of thousands for we in honour of dead son — and they removed his name it’s because they are white. the liberals hate white people.,liberals
gpekxhy,2021-03-01T19:32:50.000-08:00,feds move forward with plan to safeguard economy from national security threats i’d love to see trudeau go to jail for treason.,liberals
hpy2ao8,2021-12-25T03:45:18.000-08:00,"conrad black: on justin trudeau's 50th birthday, the shadow of his father looms large [removed]",liberals
hpy37w5,2021-12-25T03:52:58.000-08:00,"trudeau says china ‘playing’ democracies against each other, urges a ‘united front’ i can’t remember exactly what it’s called but it’s something like the 50 cent army? looking back on that looks like a joke about a rapper but that’s what they’re called i guess lol.",liberals
hpy3k9u,2021-12-25T03:55:53.000-08:00,"john ivison: o'toole needs to show some new year resolution when it comes to caucus dissent yeah and after reading the only thing i could possibly think of was \"turncoat\".

or to phrase this differently:  how can i possibly trust this gentleman?",conservatives
hpy41tr,2021-12-25T04:00:02.000-08:00,prime minister trudeau's message on christmas are you seriously confused at the notion that people are less hostile to a democratically elected leader than an unelected one?,liberals
hpy46sd,2021-12-25T04:01:10.000-08:00,"trudeau says china ‘playing’ democracies against each other, urges a ‘united front’ [removed]",liberals
hpy4xc6,2021-12-25T04:07:23.000-08:00,"trudeau says china ‘playing’ democracies against each other, urges a ‘united front’ democracies of the world are trying to make themselves compatible with a country that opposes democracy. it’s not gonna happen, stop trying to be buddies with someone who wants to overcome you.",liberals
hpy5g4e,2021-12-25T04:11:49.000-08:00,"trudeau says china ‘playing’ democracies against each other, urges a ‘united front’ [removed]",liberals
hpy5lgf,2021-12-25T04:13:07.000-08:00,"prime minister trudeau's message on christmas i know people in their fifties that have worked their fingers to the bone for everything they have and look just as good. 

proper diet and exercise is a hell of a thing.",liberals
hpy5r2k,2021-12-25T04:14:28.000-08:00,"trudeau says china ‘playing’ democracies against each other, urges a ‘united front’ [removed]",liberals
hpy64eg,2021-12-25T04:17:39.000-08:00,"trudeau says china ‘playing’ democracies against each other, urges a ‘united front’ and how is china taking advantage. i would be happy to know...",liberals
hpy6948,2021-12-25T04:18:44.000-08:00,"trudeau says china ‘playing’ democracies against each other, urges a ‘united front’ fuck china. we don’t want good relations with genocidal dictatorships.",liberals
hpy6lyh,2021-12-25T04:21:46.000-08:00,"trudeau says china ‘playing’ democracies against each other, urges a ‘united front’ how does any country take advantage of others? every nation have their own goals to further and they do that by undermining others on the world stage. in the case of china, they want to be at the center on the world stage like they used to historically. the belt and trade network as well as them pressuring member states of foreign unions such as the eu to favour chinese products and workers over domestic ones.",liberals
hpy6ogb,2021-12-25T04:22:22.000-08:00,prime minister trudeau's message on christmas republicans are like this every year.,liberals
hpy6oxr,2021-12-25T04:22:28.000-08:00,"canada tops record immigration goal of 401,000 residents modi is on his way out (which could be years but it's still happening), he's loosing states and making major concessions.

trudeau seems to keep things civil even with leaders he doesn't like. or at least holds his own.",liberals
hpy6vn1,2021-12-25T04:24:07.000-08:00,"trudeau says china ‘playing’ democracies against each other, urges a ‘united front’ [removed]",liberals
hpy6wgn,2021-12-25T04:24:18.000-08:00,prime minister trudeau's message on christmas [deleted],liberals
hpy6whh,2021-12-25T04:24:18.000-08:00,"trudeau says china ‘playing’ democracies against each other, urges a ‘united front’ [removed]",liberals
hpy6whk,2021-12-25T04:24:18.000-08:00,"trudeau says china ‘playing’ democracies against each other, urges a ‘united front’ [removed]",liberals
hpy786z,2021-12-25T04:27:09.000-08:00,"trudeau says china ‘playing’ democracies against each other, urges a ‘united front’ [deleted]",liberals
hpy7e4n,2021-12-25T04:28:36.000-08:00,"trudeau says china ‘playing’ democracies against each other, urges a ‘united front’ [removed]",liberals
hpy7fgc,2021-12-25T04:28:54.000-08:00,"trudeau says china ‘playing’ democracies against each other, urges a ‘united front’ [removed]",liberals
hpy7lh2,2021-12-25T04:30:22.000-08:00,"trudeau says china ‘playing’ democracies against each other, urges a ‘united front’ [removed]",liberals
hpy8413,2021-12-25T04:34:46.000-08:00,[deleted by user] people on r/conservative i can’t believe the liberals wasteful deficit spending. if only we had a conservative government.,liberals
hpy88h0,2021-12-25T04:35:48.000-08:00,"trudeau says china ‘playing’ democracies against each other, urges a ‘united front’ [removed]",liberals
hpy8g8u,2021-12-25T04:37:42.000-08:00,"trudeau says china ‘playing’ democracies against each other, urges a ‘united front’ [removed]",liberals
hpy8o8q,2021-12-25T04:39:37.000-08:00,"trudeau says china ‘playing’ democracies against each other, urges a ‘united front’ [removed]",liberals
hpy8pvq,2021-12-25T04:39:59.000-08:00,"trudeau says china ‘playing’ democracies against each other, urges a ‘united front’ you might be prepared to lose over half of your purchasing power, but i’m not.  by your standards we’d have to stop trading with a good deal of the world.",liberals
hpy96st,2021-12-25T04:44:01.000-08:00,"trudeau says china ‘playing’ democracies against each other, urges a ‘united front’ they are not our biggest ally, they are our de facto overlords. no nation has harmed canada in its history as much as murrica has. we have nothing to gain and a lot to lose by siding with murrica.",liberals
hpy9elp,2021-12-25T04:45:53.000-08:00,"trudeau says china ‘playing’ democracies against each other, urges a ‘united front’ we also ban import/exports or suspend import export of commodies from foreign nations all the time so does usa. their slapping of crippling taxes on softwood lumber is clear evidence of that for eg.",liberals
hpy9hnf,2021-12-25T04:46:37.000-08:00,"trudeau says china ‘playing’ democracies against each other, urges a ‘united front’ no we just want good relationships with democracies that do worse than dictatorships in the international scene and genocide civillians to seize their resources.",liberals
hpy9nwn,2021-12-25T04:48:08.000-08:00,"trudeau says china ‘playing’ democracies against each other, urges a ‘united front’ america doesn't give two flying fucks about democracy, rule of law or freedom outside their own borders either. so why should we side with them again ??",liberals
hpy9sb9,2021-12-25T04:49:12.000-08:00,prime minister trudeau's message on christmas check out and consume some of the youtube comments if you want some negativity for this video lol.,liberals
hpy9uhj,2021-12-25T04:49:42.000-08:00,"trudeau says china ‘playing’ democracies against each other, urges a ‘united front’ [removed]",liberals
hh18b4i,2021-10-17T07:30:55.000-07:00,"aaron wherry: bargain or 'blackmail'? why the liberals might be wise to do a deal with the ndp the we move worked more because the ndp were broke and really couldn't afford an election, tbh, and it worked to break the deadlock by forcing the ndp to go on record that they still supported the government. 

i don't think the liberals should be doing the approaching here, either, it strikes me that it's really on singh and the ndp to propose this sort of agreement, not the other way around. the lpc doesn't need the ndp to pass bills, they can work with any of the other parties in parliament (with the exception of the greens).",liberals
hh1aoip,2021-10-17T07:48:25.000-07:00,"liberals considering whether to extend expiring pandemic supports for businesses, individuals [removed]",liberals
hh1ckul,2021-10-17T08:02:17.000-07:00,"the provinces are chipping away at canada’s constitution. why won’t justin trudeau say anything? paywalled here too, but i know quebec is not the only province using the notwithstanding clause like it's going out of style, ontario's government inserted language in an election spending bill/has threatened to use it elsewhere, and new brunswick threatened to use the notwithstanding clause in a mandatory vaccination bill. quebec is however the most egregious and broad example of a province using the notwithstanding clause to nullify individuals' civil rights, making laws that basically go against the idea that if you're a citizen, you share the same equal rights as other citizens.

that's not a quebec thing. that should concern you no matter what province it might be happening in. the real problem is provinces with conservative governments deciding that the charter is just a piece of paper, and rights can be shredded if they are inconvenient. somehow, conservative governments, in quebec, ontario, and sometimes elsewhere, are backing away from equal rights and the rule of law.",liberals
hh1duse,2021-10-17T08:11:59.000-07:00,the provinces are chipping away at canada’s constitution. why won’t justin trudeau say anything? not sure about other provinces but the reference you are making about quebec doesn’t really make sense looking as it from a conservative/progressive lens.  the political axis in the province are a bit different/less linear.,liberals
hh1enhp,2021-10-17T08:18:03.000-07:00,"the provinces are chipping away at canada’s constitution. why won’t justin trudeau say anything? the issues might be different and the name might not say conservative, but they're an anti-immigrant party that privatizes healthcare and cuts social services. they're widely recognized as right-wing conservative, even in the context of quebec politics.",liberals
hh1epcy,2021-10-17T08:18:25.000-07:00,"trudeau to unveil new cabinet oct. 26, parliament to return nov. 22 [removed]",liberals
hh1f05y,2021-10-17T08:20:42.000-07:00,the provinces are chipping away at canada’s constitution. why won’t justin trudeau say anything? but that argument falls flat when you consider than iterations of the bill you are referencing have been supported by all of quebec’s major parties for the past 15 years. it is not a new thing from the current government only.,liberals
hh1f18n,2021-10-17T08:20:55.000-07:00,"trudeau to unveil new cabinet oct. 26, parliament to return nov. 22 sorry, out to dinner not having to show vax pass is not work, what a crock of shit your whole post is...",liberals
gjpsvjm,2021-01-17T21:03:16.000-08:00,"kenney, moe condemn biden’s plan to scrap keystone xl on day 1 of presidency what a mess. kenney and moe can continue to campaign locally on trudeau not doing enough, all the while knowing full well that if it's on biden's first day to-do list, he's probably not going to budge. 

they'll spin this as something being done *to* them, instead of a enormous error or judgment on their part. i'm not clear on why things didn't actually start moving on this in the us, but suspect strongly that nobody there wanted to roll the dice on building something halfway and then having the rug pulled out from under them.",liberals
gjpvj3t,2021-01-17T21:36:56.000-08:00,"no place for 'far right' in conservative party, leader erin o'toole says yet people like derek sloan remain",conservatives
gjpxaba,2021-01-17T21:57:00.000-08:00,"no place for 'far right' in conservative party, leader erin o'toole says \"o'toole should disavow the far right!\"   

*o'toole disavows far right*  

\"he's just saying that!  he doesn't really mean it!\"",conservatives
gjpyu4v,2021-01-17T22:13:43.000-08:00,"no place for ‘far right’ in conservative party, says erin o’toole i was responding to a comment about the cpc though, not ucp. the federal conservatives are by no means \"doa\" in edmonton or calgary",conservatives
gjpz1fh,2021-01-17T22:15:53.000-08:00,"no place for ‘far right’ in conservative party, says erin o’toole fair enough, i'm being pedantic about the term \"doa\". they're likely to lose a seat or two there, but the majority of seats in the edmonton and calgary cmas are solidly within federal conservative territory",conservatives
hm58mew,2021-11-25T19:39:01.000-08:00,liberals downplay concerns about record-breaking milk prices - national how do you do that but keep enough quebec votes to win leadership?,liberals
hm59axa,2021-11-25T19:48:26.000-08:00,liberals downplay concerns about record-breaking milk prices - national [removed],liberals
hm5aagx,2021-11-25T20:01:33.000-08:00,liberals downplay concerns about record-breaking milk prices - national [removed],liberals
hm5agck,2021-11-25T20:03:41.000-08:00,"liberals downplay concerns about record-breaking milk prices - national &gt;with those things, how can we expect the price to stay cheap?

ok, and here's two questions followed by a rhetorical one:

- how much does a dairy cow cost?
- how much does the quota for a year's milk production from a cow cost? (depends on the province, but you can find it easily via google)
- given the answers to those two questions, what do you think is the larger factor in driving the price of milk?",liberals
hm5alhr,2021-11-25T20:05:32.000-08:00,"liberals say they will allow provinces to ban handguns, citing rise in gun violence so it sounds like you’re just trying to get worked up because i lean more right than left. nice.",liberals
hm5apd7,2021-11-25T20:06:59.000-08:00,"liberals downplay concerns about record-breaking milk prices - national what ridings are involved here? seems like most of rural quebec is already voting bloc or conservative,  so do the liberals really have anything to lose if they take down the cartel?",liberals
hm5au3c,2021-11-25T20:08:37.000-08:00,"liberals say they will allow provinces to ban handguns, citing rise in gun violence [removed]",liberals
hm5auil,2021-11-25T20:08:47.000-08:00,new conservative mp lewis to fight liberal plan to axe charity status for anti-abortion pregnancy centres why would you support the conservative party then?,conservatives
hm5b049,2021-11-25T20:10:51.000-08:00,"liberals say they will allow provinces to ban handguns, citing rise in gun violence depends on the objective.  losing weight? not much. train for an iron man? keep going and eat more.",liberals
hm5b7ld,2021-11-25T20:13:32.000-08:00,"liberals say they will allow provinces to ban handguns, citing rise in gun violence [removed]",liberals
hm5bu7t,2021-11-25T20:21:29.000-08:00,"liberals say they will allow provinces to ban handguns, citing rise in gun violence [deleted]",liberals
hm5c230,2021-11-25T20:24:09.000-08:00,"liberals say they will allow provinces to ban handguns, citing rise in gun violence [deleted]",liberals
hm5clko,2021-11-25T20:30:55.000-08:00,"liberals say they will allow provinces to ban handguns, citing rise in gun violence [deleted]",liberals
hm5dg06,2021-11-25T20:40:57.000-08:00,"liberals say they will allow provinces to ban handguns, citing rise in gun violence [removed]",liberals
hm5dgjb,2021-11-25T20:41:08.000-08:00,"free speech friday — november 26, 2021 [18th century french liberals be like](https://imgur.com/a/ni984ao)",liberals
hm5ds02,2021-11-25T20:44:51.000-08:00,"the conservatives' inflation argument is flawed — but it still might work ok but you've just bought a bad narrative.  what is a supply chain issue?  a demand shock.  what causes a demand shock?  massive inflation and money printing.  you can't say that the inflation is at least in part a cause of the supply chain issues, so it makes zero sense to entirely blame inflation on supply chain issues.  it's a complete tautology.",conservatives
hm5dspe,2021-11-25T20:45:04.000-08:00,"liberals say they will allow provinces to ban handguns, citing rise in gun violence [deleted]",liberals
hm5dwid,2021-11-25T20:46:18.000-08:00,the conservatives' inflation argument is flawed — but it still might work in what respect is this misinformation?  this is economics 101.,conservatives
hm5dwnu,2021-11-25T20:46:21.000-08:00,"liberals say they will allow provinces to ban handguns, citing rise in gun violence it makes sense to spend it where it can help. if it's cost effective to do both then do both. 

these are hypotheticals, so we don't know what the price/effectiveness of one vs the other is. so it's easy to throw out pretend numbers and ask if it's worth it. so the answers is we don't know - which to me is an underlying issue that needs to be addressed. but ultimately, as far as i'm concerned, taking away guns is an option that should be on the table, along with others, and we pick the best set of options from the ones we have available to us.",liberals
