hjim3bh,2021-11-05T15:27:05.000-07:00,google warns liberals' online harms bill 'will result in the blocking of legitimate content' flagged,liberals
hjimrgz,2021-11-05T15:35:04.000-07:00,google warns liberals' online harms bill 'will result in the blocking of legitimate content' oh really even though it a quebec liberal minister steven guilbeault who introduced bill-c10. which the liberals fast tracked in in the trying to get it passed before the election or any senator could read the damn thing with the express support of the ndp and bloc. now that bill c-10 rightfully died the liberals have introduced bill c-36 which they are going to fast track again which will explicitly seek to censor online discourse. which will mean if you make a simple off color tweet/joke the government is going to censor you and have the canadian human rights commission to try to send you to jail. your probably going to assume it’s just bad or evil people that’ll get caught that is until one day it’s you. if you don’t think that this is the government who are mainly mp’s from quebec trying to censor your freedom of speech then you must have your head in the sand.,liberals
hjioioj,2021-11-05T15:56:41.000-07:00,google warns liberals' online harms bill 'will result in the blocking of legitimate content' they don't want to spend the money necessary in order to build the systems to flag all the content,liberals
hjiomhq,2021-11-05T15:58:02.000-07:00,"google warns liberals' online harms bill 'will result in the blocking of legitimate content' i mean, can we get laws passed to not allow spam phone calls? this is an issue we all deal with everyday, and they're definitely harmful to people",liberals
hjipvrs,2021-11-05T16:13:32.000-07:00,ndp and liberals in talks to keep minority government in power liberals arnt in a place for another election either. people are kinda annoyed the last election got called after only 2 years. if another one happens in the next year or 2 it's going to be a blood bath for the liberals.,liberals
hjiq01o,2021-11-05T16:15:03.000-07:00,ndp and liberals in talks to keep minority government in power but o’toole doesn’t...,liberals
hjitdif,2021-11-05T16:57:58.000-07:00,"google warns liberals' online harms bill 'will result in the blocking of legitimate content' the bill includes trying to eliminate child porn, for fuck sake.",liberals
hjiti4x,2021-11-05T16:59:39.000-07:00,"ndp and liberals in talks to keep minority government in power well in comparison to their fellow parties, they are. they very much are.",liberals
hjitkb8,2021-11-05T17:00:28.000-07:00,"ndp and liberals in talks to keep minority government in power i think it'll depend more on how it happens... i.e. if the opposition parties brought the liberals down next month, the liberals would probably be fine. they just can't call one themselves. the strongest reason to do this imo is if trudeau is stepping down say a year from now and they dont want to suddenly have government brought down during the leadership race/they want their new leader to have some time in power.",liberals
hjiucby,2021-11-05T17:10:30.000-07:00,"ndp and liberals in talks to keep minority government in power forcing a election is political suicide, no wants a election right now. only way it would work if it was for a big abuse of power. that doesn't include any past scandals.",liberals
hnxpvml,2021-12-09T10:38:38.000-08:00,"ottawa has no idea if 75 per cent of air arrivals obeyed hotel quarantine rule: ag report - national while a drive-by comment might be satisfying, you have presented no argument that bolsters trudeau liberal government in this case. the fact is that it appears that huge quantities of taxpayer money is not being competently spent. but your comment implies that you are worried about one office calling out the truth.",liberals
hnxu61f,2021-12-09T11:10:02.000-08:00,erin o'toole says bill 21 is a quebec issue while some of his mps take tougher stand meh. another issue the cpc is no different from lpc.,conservatives
hkpqyl8,2021-11-14T21:02:25.000-08:00,"conservative party now says bert chen’s suspension is indefinite, not ‘up to 60 days’ ###this is a reminder to [read the rules before posting in this subreddit](https://www.reddit.com/r/canadapolitics/wiki/rules-thelongversion).
 
1. **headline titles should be changed only [when the original headline is unclear](https://www.reddit.com/r/canadapolitics/wiki/rules-thelongversion#wiki_1._headline_titles_should_be_changed_only_where_it_improves_clarity.)**
2. **be [respectful](https://www.reddit.com/r/canadapolitics/wiki/rules-thelongversion#wiki_2._be_respectful).**
3. **keep submissions and comments [substantive](https://www.reddit.com/r/canadapolitics/wiki/rules-thelongversion#wiki_3._keep_submissions_and_comments_substantive).**
4. **avoid [direct advocacy](https://www.reddit.com/r/canadapolitics/wiki/rules-thelongversion#wiki_4._avoid_direct_advocacy).**
5. **link submissions must be [about canadian politics and recent](https://www.reddit.com/r/canadapolitics/wiki/rules-thelongversion#wiki_5._link_submissions_must_be_canadian_and_recent).**
6. **post [only one news article per story](https://www.reddit.com/r/canadapolitics/wiki/rules-thelongversion#wiki_6._post_only_one_news_article_per_story).** ([with one exception](https://www.reddit.com/r/canadapolitics/comments/3wkd0n/rule_reminder_and_experimental_changes/))
7. **replies to removed comments or removal notices will be removed** without notice, at the discretion of the moderators.
8. **downvoting posts or comments**, along with urging others to downvote, **[is not allowed](https://www.reddit.com/r/canadapolitics/wiki/downvotes)** in this subreddit. bans will be given on the first offence.
9. **[do not copy &amp; paste the entire content of articles in comments](https://www.reddit.com/r/canadapolitics/wiki/rules-thelongversion#wiki_9._do_not_copy_.26amp.3b_paste_entire_articles_in_the_comments.)**. if you want to read the contents of a paywalled article, please consider supporting the media outlet.

*please [message the moderators](https://www.reddit.com/message/compose?to=%2fr%2fcanadapolitics) if you wish to discuss a removal.* **do not reply to the removal notice in-thread**, *you will not receive a response and your comment will be removed. thanks.*


*i am a bot, and this action was performed automatically. please [contact the moderators of this subreddit](/message/compose/?to=/r/canadapolitics) if you have any questions or concerns.*",conservatives
hkpr62e,2021-11-14T21:04:26.000-08:00,trudeau and kenney to reveal an affordable child-care agreement on monday morning [removed],liberals
hkpwgso,2021-11-14T21:52:01.000-08:00,trudeau and kenney to reveal an affordable child-care agreement on monday morning [removed],liberals
hkpx0bs,2021-11-14T21:56:37.000-08:00,trudeau and kenney to reveal an affordable child-care agreement on monday morning they are just stalling so that they can announce it closer to the election.,liberals
hkpy34d,2021-11-14T22:05:40.000-08:00,trudeau and kenney to reveal an affordable child-care agreement on monday morning [removed],liberals
hi3pndk,2021-10-25T21:43:41.000-07:00,"prime minister's mother spoke at event hosted by organization that received federal funding for jobs program [ctv news] &gt;here we go again lol. this isn't surprising though, liberal voters have demonstrated again and again that they do not care about graft or impropriety. not surprising then that the party engages in this unethical behavior once again.

how is this graft or impropriety?  the event never had the government funds allocated to it.  ctv hosted the event as well.  name me one charity that didn't receive some government \"help\".

&gt;“elevate did not receive any federal funding whatsoever for its event think 2030,” elevate general manager lisa zarzeczny said in an email.

honestly, the witch-hunting is causing us to mistrust our msm even more.  god forbid our media to try to kill another non-profit just to get a story on trudeau.",liberals
hi3qdcr,2021-10-25T21:51:03.000-07:00,"innovative research poll: tofino trip more damaging to trudeau than we or blackface \"sure he's a dipshit, but he's *our* dipshit. [2024 conservative leader] is literally trump!\"",liberals
hi3rm25,2021-10-25T22:03:39.000-07:00,"former pm chretien called out over comments on residential schools yeah, he is the main architect of the 'white paper' in the 60s that called for the elimination of indigenous rights, the indian act and anything that would distinguish between and indigenous and non-indigenous person. you still hear this view all the time today. 

but this was universally renounced by indigenous people. it actually contributed to the rise of indigenous activism (the red wave) which resulted in the formation of many indigenous organizations across the country. prior to this there was very few, and this was still a period when the bands had very little control over their programs and resources. the funny thing is that chretien and that white paper (which was under a papa trudeau government) is probably the closest thing in the 20th century to an 'indigenous awakening'. 

for chretien to plead ignorance is a bold face lie: the country forever changed due to his actions and he most definitely heard about irs atrocities and more.",liberals
hi3s8sy,2021-10-25T22:09:52.000-07:00,"discussion thread - cabinet announcement - 26 october 2021 he’s actually retiring as mp within the next six months, according to chantal hebert.

trudeau actually seems to like garneau based on the portfolios that he has given him in the past.",liberals
hi3su7l,2021-10-25T22:15:34.000-07:00,"conservatives, just get your shots already and the arbitor of that is whom?",conservatives
hi3t5a7,2021-10-25T22:18:31.000-07:00,"discussion thread - cabinet announcement - 26 october 2021 is he retiring as an mp because he was planning to retire as an mp, or is he retiring as an mp because trudeau decided to pull the rug out from under him and boot him from cabinet, so he is doing this to save face?",liberals
hi3td5g,2021-10-25T22:20:32.000-07:00,"discussion thread - cabinet announcement - 26 october 2021 almost certain he’s doing it to set himself up for life behind politics.

from all that i’ve heard from some people on the hill, trudeau/pmo are quite happy with garneau in cabinet, so i highly doubt they were planning on removing him completely.

as a matter of fact, i believe that they were actually considering leaving him there until his resignation. might not be the case anymore, though.",liberals
hi3u12u,2021-10-25T22:26:40.000-07:00,"conservatives must take 'soft' pro-life stance on abortion to win back socially conservative base, say mps and campaign life coalition [removed]",conservatives
hi3u2ci,2021-10-25T22:27:00.000-07:00,"conservatives must take 'soft' pro-life stance on abortion to win back socially conservative base, say mps and campaign life coalition [removed]",conservatives
hi3uy48,2021-10-25T22:35:09.000-07:00,a new job for sajjan and some new faces — here's what to expect when trudeau names his next cabinet wilkinson as the environment minister extended the raw sewage dumping agreement. rumour is he will be in charge of natural resources… sounds like the right guy for the job by the way trudeau talks about us “having all the materials” we need for electric car batteries. massive strip-mines here we come!,liberals
hi3vo0k,2021-10-25T22:41:30.000-07:00,"conservatives must take 'soft' pro-life stance on abortion to win back socially conservative base, say mps and campaign life coalition can we just all move on from abortion.  do we not have more pressing issues then rehashing the same old shit.   
if the conservatives want to be relevant again,  have a relevant platform for all canadians.   pandering to religion right will not get them further ahead.",conservatives
hi3vup2,2021-10-25T22:43:08.000-07:00,"apart from the 300k/year immigrants, 500k+ intl students came to canada under trudeaus regime. most of them convert to prs,and later citizenship,but the govt considers only the landed pr holders as \"immigrants\",just to keep the public away from reality. they know they will perpetually vote for them.",liberals
gu87dj6,2021-04-11T16:06:38.000-07:00,"no, the ndp doesn’t have a ‘pathological preoccupation’ with israel here is the issue, the ndp is a party deeply in need of actual policies to win voters. yet despite that, all of time that could have been spent discussing indigenous issues, healthcare, and bill 21 (all of which were in this section), was spent on india's domestic issues and israel. do you not see the issue?

i used to be on an ndp eda, yet i left to join the liberal party. i am the perfect example of someone who they need to win back. if they can't win back someone who is a progressive activist that voted for guy caron in the ndp leadership race, who can they win?

i deeply want the ndp to be a successful party. i think it would be good for the country to have the ndp as a strong opposition. they just waste their time on the most pointless shit. 

that is without even mentioning some of the blatant anti-semitism that was further down the prioritization in this section. abolishing the internationally recognized definition of anti-semitism doesn't hurt israel, it hurts jews. amnesty for someone accused of bombing a synagogue (yes, this was a real policy that didn't make it to a vote because time ran out), is not a good look for the party. 

i think the israel policy is fundamentally flawed for a variety of reasons, but it is a symptom of how the ndp base seems to not want to be successful. i mean, just look at the resolutions passed at the liberal convention compared to the ndp and tell me which ones look more appealing. https://2021.liberal.ca/policy/",liberals
gu8aa7l,2021-04-11T16:50:18.000-07:00,"before liberals get too excited about mark carney, they should remember michael ignatieff it is pretty hard. i went to quebec many times for work and for fun. what i learned is that their experiences are so different from those of anglo canada. 

as you know, there has not been a party led by non-quebecors that won majority or most of quebec seats since lester pearson. liberal especially needs to win a lot of seats in quebec.",liberals
gu8abxk,2021-04-11T16:51:00.000-07:00,"before liberals get too excited about mark carney, they should remember michael ignatieff [removed]",liberals
gu8afi9,2021-04-11T16:52:31.000-07:00,"before liberals get too excited about mark carney, they should remember michael ignatieff that's the cpc for ya. long gone are the bill davis and red tories of the right's more respectable days. and i say that as a leftist.",liberals
gu8aksy,2021-04-11T16:54:48.000-07:00,"before liberals get too excited about mark carney, they should remember michael ignatieff [deleted]",liberals
gu8amz4,2021-04-11T16:55:43.000-07:00,"before liberals get too excited about mark carney, they should remember michael ignatieff i haven't listened to his lectures (thanks for the pointer though, i will!), but i'm reading his book right now and he is decidedly not a proponent of predatory capitalism. that's actually the core message of the book.",liberals
gu8b5bq,2021-04-11T17:03:52.000-07:00,"before liberals get too excited about mark carney, they should remember michael ignatieff well, when liberal had anglophone leaders their electoral performance was always very bad. 

there have only been three anglophone liberal who won governments since confederation, which is alexander mackenzie, mackenzie king, and lester pearson. 

on the other hand, francophone leaders performed so much better, including wilfred laurier, louis st laurent, pierre trudeau, jean chrétien, paul martin, and justin trudeau. there have only been one francophone leader who failed to win any election: stephane dion

this is mainly due to liberal having to win at least 40% of the seats in quebec to have a majority government.",liberals
gu8b8hu,2021-04-11T17:05:19.000-07:00,"jagmeet singh’s push to win over ordinary people the ndp lost me after a few things post layton, but especially with jagmeet.

- the switch from the more western canadian roots with a broad socialism brush, to one that often only focused on the urban subset.

- the whole weir incident.

- the \"he pushed me incident\" in the house of commons.

- a non definitive answer on bill 20 in the 2019 election.

- stating the 2019 election was \"amazing\" after losing half their caucus. aka the ndp \"everything is great\" when the house is burning down in flames.

- jagmeet whole image. he's a well educated lawyer in tailored suits, and flashed them extensively in a magnize when he became party leader. it's polished, and every picture just reeks of posing, often with expensive props. layton had roots in socialism which were more apparent, but also more charisma: while jagmeet just comes across as.. fake.

- the general \"hey it's my idea and the liberals/greens stole it\" . as long as the idea is good and goes forward, that's what i care about. just because you thought about it, doesn't mean it's your exclusive right to it.

and that's kind of where the federal ndp stops for me. they have policies i like, but they just aren't genuine. i grew up in rural sask and the ndp i knew and supported was based off of collective principals. they are there, but there not flashy. it's subtle socialism.

 jagmeet is just, brash and not genuine. its harder and harder to support a party who is more flash then action, and then is constantly suprised they don't get more support. he's not the face of centre left policies in this country that we need. as someone who is centre left, it is difficult to vote for them each and every time since 2011. i'm stuck with the libs; and i'm a miserable voter.",liberals
h6fdtto,2021-07-24T11:18:28.000-07:00,"liberal majority government in ‘doubt’ as lead over conservatives shrinks, poll finds - national | globalnews.ca what is going to break the consistent downward trend we have been seeing for the cpc?",conservatives
h6fermu,2021-07-24T11:27:12.000-07:00,"liberal majority government in ‘doubt’ as lead over conservatives shrinks, poll finds - national | globalnews.ca it has happened before when reform splintered from pc. i don't see alberta going left but it could go further right and/or to a bloc quebecois style independence party.",conservatives
h6fffx7,2021-07-24T11:33:36.000-07:00,"liberal majority government in ‘doubt’ as lead over conservatives shrinks, poll finds - national | globalnews.ca [removed]",conservatives
h71bpmv,2021-07-29T12:33:12.000-07:00,"governor-general will agree to a trudeau request to call a snap election, expert says [removed]",liberals
h71c0kw,2021-07-29T12:35:45.000-07:00,"trudeau in a nutshell. low quality posts or comments (such as memes, or low quality text posts) will be removed. moderator judgement.",liberals
h71clzu,2021-07-29T12:40:47.000-07:00,justin trudeau blasts jagmeet singh’s request that the governor general not agree to an election i find this pretty unlikely he is pretty smart. more likely he understands he cant win using traditional formal political rules and structures.,liberals
h71cn14,2021-07-29T12:41:02.000-07:00,kenney outraged over trudeau's senate appointment as banff mayor karen sorensen appointed as independent [removed],liberals
h71d6mc,2021-07-29T12:45:42.000-07:00,justin trudeau blasts jagmeet singh’s request that the governor general not agree to an election i agree with singh. we have a stabile government and any election is just so the liberals won't have to compromise. why do we want that?,liberals
h71df0h,2021-07-29T12:47:42.000-07:00,justin trudeau blasts jagmeet singh’s request that the governor general not agree to an election can you give some examples? (genuinely curious),liberals
h71eahw,2021-07-29T12:55:21.000-07:00,"governor-general will agree to a trudeau request to call a snap election, expert says [removed]",liberals
h71ef87,2021-07-29T12:56:30.000-07:00,"what 16 months of covid lockdowns have cost us | national post really want to be scared? they calculated that debt servicing on today's interest rates. every point the interest rates go up adds another 13 billion or so to the debt servicing, there's a very real chance that with inflation we'll see 4 or 5 percent interest rates in the next 5 years.  now - that doesn't hit all at once because bonds and such have to roll over from their current rate but it does over time - we could easily be seeing 30 percent of our current budget levels going to debt servicing, and worse many of the provinces have had to borrow pretty hard and are no where near balance either. with the exception of a few like british columbia, the ability to go back to anything near a balanced budget will take many many years and for ontario the debt to gdp level provincially will be through the roof. 

put the two together and the taxpayer will be strained to the extreme just to keep the lights on and pay the basics, even if interest rates go up only one percent. 

we're staring at a very nasty abyss right now. and trudeau is talking about doubling down and spending even more into deficit with no plan whatsoever to return to balance or even reduce the deficit any time soon,",liberals
h71em5n,2021-07-29T12:58:09.000-07:00,"justin trudeau blasts jagmeet singh’s request that the governor general not agree to an election somehow i don't think \"the pandemic is over\" will be a winning argument for any party in the coming election.",liberals
h71emeb,2021-07-29T12:58:13.000-07:00,kenney outraged over trudeau's senate appointment as banff mayor karen sorensen appointed as independent [removed],liberals
h71f2r1,2021-07-29T13:02:08.000-07:00,"fall election likely as trudeau bets big on covid-19 rebound, reopening: sources | global news until after the election",liberals
h71f3wj,2021-07-29T13:02:24.000-07:00,"green party faces tough battle in next election, to the benefit of liberals and ndp; paul may not even win toronto centre, say politicos [deleted]",liberals
h71fyqr,2021-07-29T13:09:47.000-07:00,"kenney outraged over trudeau's senate appointment as banff mayor karen sorensen appointed as independent can i get some good examples of bad bills that passed parliament that would have become law if not for the senate? (genuinely curious).

my thing isn't so much the poor character of some senators; but just the idea of unelected officials having such veto over democratically elected officials. one example of the senate doing a bad job in my opinion is killing jack layton's climate change bill when we really needed it the most. the ndp didn't have time to stack senators, so they don't get to have bills passed? doesn't sound democratic to me.",liberals
h71g34g,2021-07-29T13:10:52.000-07:00,justin trudeau blasts jagmeet singh’s request that the governor general not agree to an election the leader of the ndp campaigned with horgan lol,liberals
h71gexj,2021-07-29T13:13:47.000-07:00,"governor-general will agree to a trudeau request to call a snap election, expert says [deleted]",liberals
h71gf19,2021-07-29T13:13:49.000-07:00,"green party faces tough battle in next election, to the benefit of liberals and ndp; paul may not even win toronto centre, say politicos pretty sure they're joking (?)",liberals
h71gw5r,2021-07-29T13:18:04.000-07:00,"governor-general will agree to a trudeau request to call a snap election, expert says socially distanced with 66% of the population fully vaccinated (as of today, never mind a month from now), with everyone wearing masks.",liberals
h71hrju,2021-07-29T13:25:50.000-07:00,kenney outraged over trudeau's senate appointment as banff mayor karen sorensen appointed as independent the senate is a anti-democratic institution to safe guard against non-establishment party from making creating policy. and thats the favourable read on it because it is used as a patronage system to reward party loyalists with a life long paycheck and few responsibilities.,liberals
h71ig93,2021-07-29T13:31:56.000-07:00,"green party faces tough battle in next election, to the benefit of liberals and ndp; paul may not even win toronto centre, say politicos [removed]",liberals
h71iieb,2021-07-29T13:32:28.000-07:00,justin trudeau blasts jagmeet singh’s request that the governor general not agree to an election [removed],liberals
gwrj0u4,2021-05-02T19:55:01.000-07:00,liberals and ndp block debate on updated charter of rights and freedoms review of bill c-10 [removed],liberals
gwrkw4g,2021-05-02T20:18:50.000-07:00,"338canada: what is left of the orange wave in quebec? not much. that was a history making moment, for sure. in a matter of seconds trudeau reversed his and mulcair's political fortunes.",liberals
gwrkwff,2021-05-02T20:18:57.000-07:00,a harper dynasty and the end of the liberals? how the 2011 election didn’t change everything *[exhales in legal cannabis]*,liberals
h5o57h0,2021-07-18T06:08:46.000-07:00,"nova scotia ndp promises major social supports if they form government - leader gary burrill says rent control, $15/hr minimum wage, sick pay all to be immediate priorities &gt;	if there was ever a time for an orange surge it’s now.

not really. 

rankin is pretty orange as liberals go anyway. same goes for houston. it’s ns, after all.

liberals are seen as having done a good job with covid and they have the strongest brand in ns. i’d be surprised if they didn’t walk away with a majority.",liberals
h5o593w,2021-07-18T06:09:05.000-07:00,"opinion | trudeau’s liberals would promise us the moon to secure a majority. just don’t expect them to deliver you realize that being in a new tax bracket doesn't mean they take home less money, right? please tell me you at least understand the basics of how progressive taxation works instead of incorrectly balking about it.",liberals
