hps1jyo,2021-12-23T13:54:59.000-08:00,"ledger poll - ndp 43, upc 32, two-thirds of albertans feel kenney deserves a leadership review what’s gone so wrong with the united conservative party? anyone wanna explain to an interested non-albertan?",conservatives
hps204g,2021-12-23T13:59:47.000-08:00,[deleted by user] the progressive conservative party wasn’t very economically liberal before the 1970s and 1980s. it had a more communitarian approach to economics.,conservatives
hps3lj6,2021-12-23T14:16:42.000-08:00,doug ford’s booster rollout is ‘hunger games’ all over again. there is a better way conservatives always deliver less than what is required in a crisis because they want to condition us to expect less from the government. it's what they do.,conservatives
hps4tcn,2021-12-23T14:30:15.000-08:00,"kenney's wuhan bat soup comment draws criticism, premier's office claims 'scientific theory' far from racist fair enough. i should have said conservatives instead of ucp. but ucp's components, pc and wildrose were each quite popular on their own. ndp won the 2015 election due to the vote splitting on the right. in the 2015 election, pc and wildrose cumulatively got 52% of the votes, while ndp got 41%, and that's after the \"look in the mirror\" fiasco shortly before the election date.",conservatives
hps5n35,2021-12-23T14:39:42.000-08:00,"kenney's wuhan bat soup comment draws criticism, premier's office claims 'scientific theory' far from racist the pcs were much more like the federal liberals than they were the current ucp. they were corporatist centrists who took a hands-off approach on social issues, and very few of them are left in the ucp. they won so many consecutive elections not because the province is particularly conservative, but because the pcs were right in the middle of the road between the wild rose and the ndp. now that the ucp exists, the centrists have fled to the ndp, which has become the moderate party; the core of the ucp is wild rose, particularly after kenney's tenure and the shedding of anyone even remotely moderate.",liberals
hl2eyxx,2021-11-17T09:52:27.000-08:00,"it’s not the policies – erin o’toole lacks charisma and appeal as a political leader \"he is a likeable guy, speaks well and is a true everyperson canadian\"

he isn't any of those things, if he was at least he'd have a edge over trudeau.",liberals
hl2fukm,2021-11-17T09:59:07.000-08:00,"conservative infighting costing the party nanos says, as o'toole support drops post-campaign huh? harper was well known for vetting people asking questions, taking three slow ball questions and then calling it a day.",conservatives
hl2guoi,2021-11-17T10:06:37.000-08:00,"conservative infighting costing the party nanos says, as o'toole support drops post-campaign scheer followed the harper model of repeating non-answers:

example 1: mulcair questioning harper on the duffy scandal [https://youtu.be/ltai4wo83za](https://youtu.be/ltai4wo83za)

example 2: andrew scheer on abortion: [https://youtu.be/i2rjk2gx-em](https://youtu.be/i2rjk2gx-em)",conservatives
hl2ifk6,2021-11-17T10:18:27.000-08:00,"conservative infighting costing the party nanos says, as o'toole support drops post-campaign no. he just offered them all senate seats and other patronage appointments  if they bagged enough cash for his campaign warchest. nothing makes potential critics happier than a job for life.",conservatives
hl2l69e,2021-11-17T10:39:00.000-08:00,"trudeau arrives in u.s. with last-minute warning for democrats about electric vehicle tax credit um, because we're a hell of a lot smaller than the us?",liberals
hl2l7g3,2021-11-17T10:39:16.000-08:00,"canada’s wealthy elites long had a soft spot for fascism i see you only got through the first part of the article? 

lots more in there if you can bring yourself to scroll down.

it shouldn't be a surprise though - elites everywhere generally like fascism, because it exists to support the elites. also a lot of powerful people really like the idea of being able to penalize, jail, torture or execute any inconvenient journalists, academics or protesters who might bother them.

why do you think western goverments are always so cozy with military dictatorships? pinochet deserved a face full of spit and a short drop from a gallows, but trudeau sr. still treated him with courtesy and respect.",liberals
hl2lyxs,2021-11-17T10:45:21.000-08:00,"it’s not the policies – erin o’toole lacks charisma and appeal as a political leader this is spot on for me. like even if you liked what o'toole was proposing, it was impossible to say if he would actually follow through or if the party would take him a different direction (see the vote on climate change, the vaccine divide etc.).",conservatives
hl2ml82,2021-11-17T10:50:04.000-08:00,"erin o’toole enlists canada proud founder amid challenge to his leadership this just shows how big of a bullet we dodged by choosing not to gamble on which side of o'toole would ultimately show itself if he became pm. this action shows that the \"true blue\" o'toole would have won out, because if he wanted to shed the label that vaulted him to the leadership, he would have blocked ballingall's number, not had him on fucking speed dial.

but hey, if hamish marshall can lose his spot in the cpc's inner circle and go crawling back to rebel-land, there is hope that ballingall will lose his too",conservatives
h8y7dj2,2021-08-14T06:12:52.000-07:00,conservatives launch attack ad called ‘dumb’ by their own party members which is funny because freeland is not remotely left-wing and could easily pass as a socially moderate tory.,conservatives
h8y7rw2,2021-08-14T06:15:58.000-07:00,"conservatives launch attack ad called ‘dumb’ by their own party members conservative legend, corporate executive, and political campaign mastermind john tory, everyone",conservatives
h8y80ec,2021-08-14T06:17:47.000-07:00,conservatives launch attack ad called ‘dumb’ by their own party members [removed],conservatives
h8y8fjv,2021-08-14T06:20:58.000-07:00,"conservatives launch attack ad called ‘dumb’ by their own party members wow, i'd completely forgotten that john tory was the pc campaign director at that time. that guy has been connected to seemingly everything politically in the past 30 years.",conservatives
h8y8l66,2021-08-14T06:22:10.000-07:00,"ivison: trudeau's about to call an election with no purpose — other than to gain more power &gt;naw pal, that's a demagogue you just described.

let me clarify. our representative democracy is at its healthiest when the government and the politicians in it are those whom the people want to be there. of course politicians often have to enact policy that the people don't want, and that's fine. but again, i have no idea how you think it's anti-democratic for the current government to seek a new mandate from the people. if the people like the government they have, they'll vote it back in. i have no idea what the issue people have with this election, unless they are partisans who are pretending to have a principled stance against calling an election, the most basic and fundamental democratic function we have.

asking the democratic process to stop because you might get an outcome you don't want (in this case, a minority government might become a majority) is as undemocratic as it gets.",liberals
h8y8rd6,2021-08-14T06:23:29.000-07:00,ivison: trudeau's about to call an election with no purpose — other than to gain more power [removed],liberals
h8y9ezb,2021-08-14T06:28:27.000-07:00,is justin trudeau demonizing jason kenney because he can’t go after doug ford? why are deficits bad?,liberals
h8y9kd8,2021-08-14T06:29:35.000-07:00,"how jagmeet singh and the ndp can stunt the liberals’ majority hopes singh wasn't leader at that convention, and she did speak",liberals
h8ya1q3,2021-08-14T06:33:10.000-07:00,"conservatives launch attack ad called ‘dumb’ by their own party members it's not made up but it's not the complete truth either. 

[harper pledges to boost military presence in cities. [cbc news · posted: dec 28, 2005]](https://www.cbc.ca/news/canada/harper-pledges-to-boost-military-presence-in-cities-1.556770)

&gt;conservative leader stephen harper was back on the campaign trail this week, **promising to beef up military presence in major cities to respond to emergencies.**

&gt;if he's elected jan. 23, harper said, territorial battalions made up of 100 regular troops and 400 or more reservists would be stationed in vancouver, calgary, regina, winnipeg, the toronto area and other major metropolitan areas.

&gt;**harper also announced he would:**

* &gt;increase pacific navy personnel levels by about 500.

* &gt;purchase a new replenishment ship and new transport ship and upgrade existing frigates and submarines.

* &gt;restore a regular army presence in british columbia with a new rapid reaction army battalion of 650 regular force personnel.

* &gt;harper has promised to increase defence spending by $5.3 billion more than is planned to be spent from 2006-2011.",conservatives
h8ya81z,2021-08-14T06:34:30.000-07:00,conservatives launch attack ad called ‘dumb’ by their own party members [deleted],conservatives
h8yagvl,2021-08-14T06:36:21.000-07:00,conservatives launch attack ad called ‘dumb’ by their own party members [deleted],conservatives
h8yal4d,2021-08-14T06:37:16.000-07:00,conservatives launch attack ad called ‘dumb’ by their own party members if so would freeland promise not to cut her toenails in parliament?,conservatives
h8yao67,2021-08-14T06:37:54.000-07:00,"federal government to require vaccinations for all federal public servants, air and train passengers | cbc news &gt; decry it - send the vaxxed skittering to the liberals, results in an even larger majority.

you're assuming that being vaccinated means you support this policy.",liberals
h8yat1b,2021-08-14T06:38:56.000-07:00,conservatives launch attack ad called ‘dumb’ by their own party members [removed],conservatives
h8yb718,2021-08-14T06:41:55.000-07:00,conservatives launch attack ad called ‘dumb’ by their own party members [removed],conservatives
h8ybii3,2021-08-14T06:44:22.000-07:00,conservatives launch attack ad called ‘dumb’ by their own party members someone had to pay for the scheer family,conservatives
h8yc459,2021-08-14T06:48:55.000-07:00,"how jagmeet singh and the ndp can stunt the liberals’ majority hopes i mean, i ignore the bloc simply because they don’t field a candidate in my riding. but they are definitely the decision makers depending on their campaign. it’ll be interesting to watch.",liberals
h8yccv3,2021-08-14T06:50:41.000-07:00,conservatives launch attack ad called ‘dumb’ by their own party members [removed],conservatives
h8yceos,2021-08-14T06:51:03.000-07:00,conservatives launch attack ad called ‘dumb’ by their own party members we thought it was a spoof as well.,conservatives
h8ycf1u,2021-08-14T06:51:07.000-07:00,is justin trudeau demonizing jason kenney because he can’t go after doug ford? [removed],liberals
h8ycn9r,2021-08-14T06:52:45.000-07:00,"conservatives launch attack ad called ‘dumb’ by their own party members i love how this conservative ad is so bad that it's a low-key promotion for the liberal ad, which dropped at the same time:

https://twitter.com/liberal_party/status/1426515795308318730",conservatives
h8ydt0w,2021-08-14T07:01:29.000-07:00,"conservatives launch attack ad called ‘dumb’ by their own party members i can not believe this is a real ad put out by a major political party. this is the funniest thing i've seen in a very long time, but not for any of the intended reasons. what a mind boggling decision.",conservatives
h8ye2y4,2021-08-14T07:03:35.000-07:00,"conservatives launch attack ad called ‘dumb’ by their own party members &gt; my favourite thing about the cpc is how at the same time pmjt is an evil genius bent on destroying canada and an absolute idiot who bumbles through everything.

\"the followers must feel humiliated by the ostentatious wealth and force of their enemies... however, the followers must be convinced that they can overwhelm the enemies. thus, by a continuous shifting of rhetorical focus, the enemies are at the same time too strong and too weak. fascist governments are condemned to lose wars because they are constitutionally incapable of objectively evaluating the force of the enemy\" - umberto eco, ur-fascism 

the modern conservative movement internationally has been shaped by and absorbed the tactics pioneered by fascist propagandists of the early 20th century. they have learned that one of the best ways to attract a certain type of voters is to cast their enemies as weak, effiminate and lazy in order to create a \"real men are self reliant and vote conservative\", while also casting them as ruthless and effective because if they don't, victory would be trivial and there would be no cause to get up in arms.",conservatives
h8yefy2,2021-08-14T07:06:19.000-07:00,"conservatives launch attack ad called ‘dumb’ by their own party members &gt;another funny [thread](https://twitter.com/hawkinsmoon/status/1426306629910343685?s=20) as well.

dunno if atchinson is a good mp or not, but his reply was a bit knee-jerky.",conservatives
h8yeteq,2021-08-14T07:09:12.000-07:00,"conservatives launch attack ad called ‘dumb’ by their own party members as long as the housing on this farm is affordable, i am willing to hear his plan.",conservatives
h8v5mj4,2021-08-13T12:37:36.000-07:00,ivison: trudeau's about to call an election with no purpose — other than to gain more power i mean what's to complain about with this concept? the incumbent government is going to bank on the public being happy with the job they're doing? how *unfair.*,liberals
h8v5uq4,2021-08-13T12:39:30.000-07:00,"canadian special forces ready to evacuate embassy after kandahar falls to the taliban &gt;it's a terrible tragedy, really.  the biggest victims of the resurgence of the taliban will be afghani women, children and lgbtq people.

lets not airbrush history here: afghanistan had a communist party that wanted to do things like industrialize the country, educate women, build roads, increase secularism - all things liberals say they care about.  the us decided to fund the most regressive and fanatical elements in afghan society to weaken the ussr.

now here we are.  


the problem isn't the afghan people or even islam: imagine what would happen in canada if foreign power decided to give weapons and endless resources to the most fanatical elements of our society, now multiply that x10 for a country that already had a very low level of literacy and human development.",liberals
h8v6iwu,2021-08-13T12:45:08.000-07:00,"[deleted by user] i fully agree, then the cpc released their latest social media hivemind project today..

lord tunderin' jesus!

the liberals need to fear the ndp more than the cpc.",liberals
h8v7ahe,2021-08-13T12:51:38.000-07:00,"ivison: trudeau's about to call an election with no purpose — other than to gain more power &gt;is all the outrage the result tribalism(in the vain of us political division)?

yes.

and frankly, much of it *because* of the us. criticize the liberal party and/or jt all you want, but the minute you bring maga/alex jones/tucker carlson/ben shapiro/wrxit into the mix you can kindly fuck right off.",liberals
h8v7bf4,2021-08-13T12:51:51.000-07:00,"ivison: trudeau's about to call an election with no purpose — other than to gain more power i saw that you mentioned ben shapiro. in case some of you don't know, ben shapiro is a grifter and a hack. if you find anything he's said compelling, you should keep in mind he also says things like this:

&gt;the palestinian people, who dress their toddlers in bomb belts and then take family snapshots.


*****

^(i'm a bot. my purpose is to counteract online radicalization. you can summon me by tagging thebenshapirobot. options: dumb takes, climate, covid, novel, etc.)

[^feedback: ^/r/authoritarianmoment](https://np.reddit.com/r/authoritarianmoment) ^| [^more ^info](https://np.reddit.com/r/authoritarianmoment/wiki/index) ^| [^opt ^out](https://np.reddit.com/r/authoritarianmoment/comments/olk6r2/click_here_to_optout_of_uthebenshapirobot/)",liberals
h8v7nkn,2021-08-13T12:54:45.000-07:00,"the seats to watch in bc i don’t actually think it is realistic a scenario. individual candidates matter but national campaigns i think matter more. 

if the liberals win langley and mission, then they are certainly going to keep west van sea to sky and will get back van granville.",liberals
h8v8lea,2021-08-13T13:02:43.000-07:00,"opinion: here are the issues that should be debated this federal election, but probably won’t first, i object to the notion that raising children isn't \"work\".  i think most canadians -- including conservatives -- know that raising children is a great deal of work, so the notion that conservatives wouldn't want to support parents because they're \"not working\" seems specious at best.

second, the choice isn't just between daycare and having a stay-at-home parent.  some people have grandparents or aunts/uncles providing childcare; some people have informal arrangements with neighbours; some parents arrange their work hours (often with one or both working part time) to avoid having both parents working at once.

finally, if we consider families as an economic unit -- the way we do for all sorts of subsidies, although oddly enough not for income taxes -- having a stay-at-home parent and a working-outside-the-home parent may be the outcome which yields the highest economic productivity.  if me staying home allows my wife to earn more money, i'm making an indirect economic contribution even if i'm not making a direct financial one.",conservatives
h8v8t9f,2021-08-13T13:04:32.000-07:00,erin o’toole seeks intervenor status in winnipeg virus lab case election time for conservatives. bring out the stephen harper smear and fear game. i’m a conservative and i absolutely hate that about our party.,conservatives
h8v99af,2021-08-13T13:08:24.000-07:00,"canadian special forces ready to evacuate embassy after kandahar falls to the taliban this is so typical of liberals, completely and total ignorance of history and the historical context of present-day conflicts.  it's like you people learn history from the economist and the opinion pages of the globe.

no, it's a stupid comparison because the roman empire doesn't exist, whereas the united kingdom and global imperial capitalism *still exist today*, so you can draw a line to conflicts that exist today.

would it kill you to *think?*",liberals
h8v9ao2,2021-08-13T13:08:45.000-07:00,i'm disappointed with erin o'toole you have to be brain dead to not realize that nearly every canadian politician is connected to the world economic forum in some way or other. it's not a closed secret. they serve at the behest of the global community. not us.,conservatives
h8v9pcp,2021-08-13T13:12:16.000-07:00,ivison: trudeau's about to call an election with no purpose — other than to gain more power [removed],liberals
h8v9sgh,2021-08-13T13:13:02.000-07:00,i'm disappointed with erin o'toole holy fuck. shut the fuck up,conservatives
h8v9t83,2021-08-13T13:13:13.000-07:00,i'm disappointed with erin o'toole [deleted],conservatives
h8va2u4,2021-08-13T13:15:30.000-07:00,i'm disappointed with erin o'toole [deleted],conservatives
h8va9zk,2021-08-13T13:17:14.000-07:00,"i'm disappointed with erin o'toole why he hasn't been ban from the sub is beyond me. it's all negative bullshit, never produces meaningful conversation. 

it's very obviously a troll account.",conservatives
h8vae9l,2021-08-13T13:18:16.000-07:00,"i'm disappointed with erin o'toole i can understand a socon voting him in as his 2nd or 3rd choice, i can understand a pc guy putting him 2nd behind mackay, but i'll never understand an o'toole 1st ballot vote. this guy had \"will lose in the general\" written all over him. how shit do you have to be as a candidate to get less seats than fucking andrew scheer.

and drop pierre polièvre will you? the guy has no appeal and has skeletons in his closet. the guy is an attack dog, that's his only purpose.",conservatives
h8vage5,2021-08-13T13:18:48.000-07:00,i'm disappointed with erin o'toole [deleted],conservatives
h8vagoq,2021-08-13T13:18:52.000-07:00,"i'm disappointed with erin o'toole i think that description represents scheer, not harper.",conservatives
h8vasgc,2021-08-13T13:21:46.000-07:00,"[deleted by user] when the decision was made it was looking real good for the liberals, they just proceeded to sit on it for however many months",liberals
h8vb14q,2021-08-13T13:23:56.000-07:00,"ivison: trudeau's about to call an election with no purpose — other than to gain more power i think they do have a plan. the plan is to expand the economy. they’ve increased immigration to up the skills and tax base, upped child benefits to encourage people to have families and help keep both parents working, invested in badly needed infrastructure, pushed forward on green energy investments, etc. so they are actually implementing the plan they campaigned on in 2015.

i’m not a huge jt fan and didn’t vote for him but not sure what else you think the liberals should be doing. we’re already a lot better off than other g7 countries.",liberals
h8vb69j,2021-08-13T13:25:14.000-07:00,"i'm disappointed with erin o'toole okay, so who's best to take over the party? i'd rather see harper back in all honesty but we both know that's never happening",conservatives
h8vc18w,2021-08-13T13:32:58.000-07:00,[deleted by user] it never ceases to amaze me how stupid these poll analysts can be. ups and downs in single polls mean nothing. the liberals have fluctuated between 32 and 38% for a year now.,liberals
h8vc4kc,2021-08-13T13:33:47.000-07:00,"[deleted by user] &gt;i don't see how it's the liberals fault for the fourth wave

it's not. but we and snc are the liberals fault... i don't see how the other parties would do a worst job of handling covid. if anything without the ndp holding weight the liberals would do a worst job handling the pandemic than they are today. 

&gt;since it's the provinces that decide to loosen restriction.

the provinces control the weather? is it a coincidence that every wave always starts on the fall and ends in the spring?",liberals
h8vcdmx,2021-08-13T13:36:04.000-07:00,[deleted by user] covid and a 4th wave wasn't on people's minds a few months ago. now it is. they purposefully waited for signs of a first wave to call an election as then there is greater appeal to authority giving trudeau a better chance at a majority.,liberals
h14gor4,2021-06-08T16:25:54.000-07:00,"conservative mps opposed a motion to condemn islamophobia in 2017. after the london hate crime, advocates say their condolences ring hollow i'm a bit skeptical they're near-identical, and i'm not sure which way the parties voted on each of those. but does it even matter?

the government's response to the mosque shooting was a vague statement and no tangible action. 4 years later, we have another attack specifically targeting muslims, and the star looks back at this inaction and shifts blame to the conservatives? come on.",conservatives
h14gsq1,2021-06-08T16:27:20.000-07:00,"conservative mps opposed a motion to condemn islamophobia in 2017. after the london hate crime, advocates say their condolences ring hollow m-103 was purely political theatre. i opposed it on grounds of freedom of expression, which only the conservative party seems to support anymore. it had nothing to do with this senseless act of terror. to conflate speech with violence is to trivialize the real, actualized violence that destroyed the lives of an innocent family. it is a shameful display of sophistry, and i have zero respect for it.",conservatives
h14gtie,2021-06-08T16:27:38.000-07:00,"trudeau mum on calls to abandon appeals of compensation for first nations kids yeah, obviously... the point is the cost is the fault of the governments own negligence, not that of the victims, so the high cost should not be held against the victims.",liberals
h14gu4y,2021-06-08T16:27:52.000-07:00,"‘this is a terrorist attack’: trudeau condemns tragedy in london, ont. that left 4 dead worth pointing out that it wasn’t “terrorism.” it was a grotesque, violent act that had tragic consequences, but it wasn’t terrorism. this is just one more example of politicians telling people what they want to hear, and using a dramatic word like terrorism makes those people happy because it feels good to say and hear. when we’ve suffered a terrible tragedy, we’re angry. we want to use the angriest language we can to describe our pain, even if it isn’t accurate.

it’s no different than the attack on the capitol in january. everyone called it a coup because that was the most dramatic word they could think of to describe a horrible situation, even though it wasn’t technically accurate. unfathomably terrible day. not a coup.

does anyone want to hazard a guess as to why the pm is swooping in this hard and fast with such dramatic language, making sure he’s at the front of the line of people to be as dramatic about this incident as possible? sure killed the residential school story, didn’t it? the one that was in operation while he father was pm? the one he insists is the *church’s* responsibility, not the canadian government’s?

look, this was an awful thing to happen. but we need to stop buying into hysteria when stuff like this occurs. incidents of violence happen every single day in this country. some are motivated by race. some aren’t. some result in death. some don’t. some get a lot of media coverage. some you never hear about. but word of warning: beware politicians who are eager to play up hysteria when stuff like this happens. there is almost *always* an ulterior motive.",liberals
