gkilens,2021-01-23T16:32:15.000-08:00,opinion: has kenney's 'blame trudeau' strategy finally run out of gas? [removed],liberals
gkillcq,2021-01-23T16:33:34.000-08:00,"opinion: has kenney's 'blame trudeau' strategy finally run out of gas?  doesn't underwrite bad bets by provincial premiers   


unless it's quebec and than the rules don't apply (and yes the pcs are the same)",liberals
gkilshl,2021-01-23T16:34:56.000-08:00,"opinion: has kenney's 'blame trudeau' strategy finally run out of gas? &gt; it goes explicitly counter to canada’s climate change objectives

oh please canada's climate change goal are a joke. the liberals are super happy to issue an exemption if it means jobs (bc and quebec)",liberals
gkivcmu,2021-01-23T17:35:33.000-08:00,"opinion: has kenney's 'blame trudeau' strategy finally run out of gas? pretty much anyone who doesn’t let them put pipelines wherever they want to. they *despised* bc for about a year, saying they wouldn’t come here fir vacations anymore (they lied) like the money they spent here on vacation is the only thing keeping this province afloat (it isn’t, and as someone who lives in the southeast touristy part of b.c. i would love a reduction in property prices that would accompany them selling their properties).",liberals
gkivknh,2021-01-23T17:36:59.000-08:00,opinion: has kenney's 'blame trudeau' strategy finally run out of gas? it was a running joke when i was there in 2006....,liberals
gkiwb8n,2021-01-23T17:42:31.000-08:00,"mp marilyn gladu supports church freedom on ‘conversion therapy’ bill - the sarnia journal &gt; until these people are removed from the conservative party, erin o’toole cannot claim he speaks for all canadians.

this is a truly ridiculous statement, triplejayye. 

you are unabashedly pulling something on par with a \"[no true scotsman](https://en.wikipedia.org/wiki/no_true_scotsman)\" standard here. 

literally no one can fully speak for all canadians. if o'toole says, \"screw you social conservatives!\", he is making a very intentional choice to not speak for those canadians who are social conservatives. yes, they do exist. yes, their values are be at odds with certain other canadians. and yes, it's okay that social conservatives are represented within canadian conservatism.",conservatives
gkiwkzk,2021-01-23T17:44:37.000-08:00,opinion: has kenney's 'blame trudeau' strategy finally run out of gas? [removed],liberals
gkix6yw,2021-01-23T17:49:47.000-08:00,"mp marilyn gladu supports church freedom on ‘conversion therapy’ bill - the sarnia journal &gt; no, the church may not have permission to torture children.

could you clarify where you're getting this from?

from what i gather, pretty much everyone including gladu is against coercive conversion practices involving those unable to give their own consent. however the bill also revokes the ability of anyone else to voluntarily consent to such. additionally, there have been concerns about how such a law could be used to attempt to criminalize pastoral discourse:

&gt; gladu said supporters of the petition want the government to narrow the definition of conversion therapy so it doesn’t exclude pastoral care and voluntarily sought counselling and prayer.

&gt; “this petition came forward from members of the faith community in sarnia-lambton who agree that no one should be forced to receive conversion therapy, but were concerned that the overly broad definition of conversion therapy would infringe upon their rights of religious freedom and freedom of speech,” she told the journal.

&gt; the government of canada website says the bill would not criminalize private conversations involving teachers, faith leaders and school and pastoral counsellors. gladu wants that included in the legislation.

&gt; “the liberals refused to amend the definition of conversion therapy to protect the freedoms of others, and the bill is currently in the senate for debate,” she said.

could you explain to me why the government should *not* amend the bill to enshrine this as a legal guarantee?",liberals
h8sztxw,2021-08-13T03:15:20.000-07:00,"canadian party brands have shifted significantly since 2019 &gt; it is increasingly catering to insane, \"trump-style\" politics and focusing on the religious right base.

this is completely false and please stop spreading this baseless liberal talking point. o'toole has done everything to make the party more moderate and has stood up to trumpism. 

o'toole has brought the party forward on abortion rights, accepted the carbon levy, kicked out mps that spread misinformation, encourages everyone to get vaccinated, blocked all attempts by the religious right to introduce abortion motions at the policy convention and stood up to anyone who is a climate denier. this is so false and it is so tiring seeing the same incorrect lines being parroted here. have you not been following canadian politics since 2019?",conservatives
h8szuqr,2021-08-13T03:15:28.000-07:00,ivison: trudeau's about to call an election with no purpose — other than to gain more power lets see now that the feds just announced that all federally regulated employees need to be double vaxxed.. and also air/train travellers.,liberals
h8szwtz,2021-08-13T03:15:52.000-07:00,ivison: trudeau's about to call an election with no purpose — other than to gain more power thank you!   i came here to say... like... what other purpose do they imagine elections have to a politician or party other than to compete for power?  that's kindof the whole point!,liberals
h8t01wi,2021-08-13T03:16:47.000-07:00,"prime minister justin trudeau is planning to call a snap election for sept 20 - sources | the globe &amp; mail no because that would be a chance to defeat them. the people mad about the election are mad because their party is going to lose, the opposition to the election seems intensely partisan.

it doesn’t matter who is in power it’s a minority the pm can call an election. i’d be comfortable with the cpc doing the same thing if they were in power rn.

the liberals still have to get the votes to win…..",liberals
h8t04jr,2021-08-13T03:17:16.000-07:00,"ivison: trudeau's about to call an election with no purpose — other than to gain more power whatever, liberals and those who want the liberals to take more power will be incentivized to downplay the risks.   and those against it will be incentivized to play up the risks. 

citing previous elections or school openings are not compelling to me, because schools host the most resilient of the population, and there’s likely no data from previous elections that can be useful here. 

the “fog of war” prevents us from having a clear understanding of what is safe and what isn’t. 

but what we know is that delta spreads even among the vaccinated, that we’re at the start of a delta surge, and that the elderly vaccinated get the least protections of vaccines of any age groups, and that the elderly vote more than the young. 

and if it turns out that the elderly are the least likely to employ novel voting methods, the probabilities are on the side of the election being a forum for at least one elderly contracting and subsequently dying of covid. 

so the question comes down to how many deaths would you agree are acceptable collateral damage for holding this election, since it seems very clear that the number of dead will be greater than zero.",liberals
h8t078j,2021-08-13T03:17:45.000-07:00,canadian party brands have shifted significantly since 2019 if it's a vocal majority than how did a mdoerate like o'toole and a moderate like mackay come in 1st and 2nd place? this is simply not true and you are actively harming the canadian political discourse by pretending it is.,conservatives
h8t08q7,2021-08-13T03:18:01.000-07:00,"platform crunch: ndp releases commitments ahead of anticipated federal election call the liberals dropping the red book in '93 absolutely demolished the tories who were planning a planck a week approach.

every strategy can be risky.",liberals
h8t0x08,2021-08-13T03:22:26.000-07:00,canadian party brands have shifted significantly since 2019 and the current leader of the liberal party wore black face more times than he can count? so what?,liberals
h8t15cg,2021-08-13T03:23:58.000-07:00,"canadian party brands have shifted significantly since 2019 did you see who they were running against?  a full on racist trumper and a religious fanatic!  o'toole only won because the super right wing 1st round voters for lewis and sloan all went to o'toole, as the less \"progressive\" of the two front runners.  i'm talking about the more recent policy convention where o'toole tried to talk up the cpc's environmental policy, but was met with a party base that voted to confirm that \"global warming isn't real\" by 59% right in his face!  expect to see this brought up quite a bit in the next few weeks.  of course o'toole can fight this liberal attack by talking up his own carbon tax to his core oil &amp; gas alberta base!  edit:  how am i hurting discourse by telling the truth?",conservatives
h8t15e1,2021-08-13T03:23:59.000-07:00,prime minister justin trudeau is planning to call a snap election for sept 20 - sources | the globe &amp; mail even the most right wing pollster i could find put liberals in majority territory still.,liberals
h8t190n,2021-08-13T03:24:40.000-07:00,"ivison: trudeau's about to call an election with no purpose — other than to gain more power for whatever reason, i never really connected that blair and corbyn led/lead the same party. the two are so differently presented, it's hard to grasp.",liberals
h8t1ful,2021-08-13T03:25:56.000-07:00,"federal government to require vaccinations for all federal public servants, air and train passengers | cbc news love it! about time this happens, if this was polio or smallpox there would be no debate, everyone gets vaccinated or your freedoms are limited by your poor choices for society as a whole.

good job trudeau and the liberals, i can’t wait for a majority government so they can continue to grow the middle class and help those that want to join it!",liberals
h8t1wpr,2021-08-13T03:29:00.000-07:00,"prime minister justin trudeau is planning to call a snap election for sept 20 - sources | the globe &amp; mail those polls are kinda dumb because the actual election polls predicting results clearly show that isn’t true. how do the liberals lead in every poll i can find by a good margin yet i see daily news stories about how no wants an election from specifically political subs that have communities that dislike trudeau heavily……

literally multiple posts a day every day about how people don’t want an election and all these polls. yet the actual results polling which is being continually redone isnt changing…..  hmmmm.

i don’t know why people that want to defeat trudeau don’t want an election rn, that literally makes no sense….

oh unless they know they will lost that would be the one and only reason people wouldn’t want an election rn it’s pretty transparent.",liberals
h8t2cmw,2021-08-13T03:31:54.000-07:00,"canadian party brands have shifted significantly since 2019 i have, and i feel o'toole has completely and utterly failed to reign these looneys in compared to how harper managed too. 

there is more religious noise, more conversion therapy noise, more anti-science rhetoric coming out of the cpc than i have ever seen in the past. o'toole doesn't endorse it, but the sheer number of inane comments by mp's the last couple years has just soured me on the entire party. 

&amp;#x200b;

as an aside, the lpc and ndp are equally cancerous in my opinion, in their own unique and terrible ways.",conservatives
h8t2lsr,2021-08-13T03:33:36.000-07:00,ivison: trudeau's about to call an election with no purpose — other than to gain more power [removed],liberals
h8t2pzm,2021-08-13T03:34:22.000-07:00,"federal government to require vaccinations for all federal public servants, air and train passengers | cbc news love it. late but as they better late than never. singh will be onside all he has to is look at horwarth’s flip flop. this does cause some political problems for the tories though. they will split probably. i have been very disappointed in trudeau and remain so. however, this is an example of a good political move for the libs also being good policy.",liberals
h8t3qdn,2021-08-13T03:41:03.000-07:00,"federal government to require vaccinations for all federal public servants, air and train passengers | cbc news smart to open this up right before the writ, puts o'toole in a spot where he either has to support this and risk losing libertarian/anti-vax voters to the ppc or maverick party, voters he's already on shaky ground with, including some members of his caucus (see the comments from the mp for fort mac) 

or find a way to thread the needle and disagree with this mandate but still make it sound like he's pro-vax, potentially alienating the pro-vax part of his base, including many in the business community who want covid to finally be over.",conservatives
h8t3tmv,2021-08-13T03:41:38.000-07:00,"ivison: trudeau's about to call an election with no purpose — other than to gain more power i didn't deny that postal workers are getting covid. the point is that you can't use covid as an excuse against mail-in voting unless you have evidence that postal workers are being dis-proportionally affected. many work places have shut down during the pandemic. just because one sorting center shut down doesn't mean mail in voting is dangerous.

frankly, this just seems like misplaced rage for the ndp doing so poorly. the ndp forced elections before in minority governments anyway. if the ndp weren't being such assholes over the past 2 years and didn't brick wall parliament with witch hunts, we wouldn't need to have an election. the opposition has forced this election on us.",liberals
h8t3yz1,2021-08-13T03:42:37.000-07:00,prime minister justin trudeau is planning to call a snap election for sept 20 - sources | the globe &amp; mail what march to theres left has the cpc seriously started?,liberals
h8t3z1f,2021-08-13T03:42:38.000-07:00,ivison: trudeau's about to call an election with no purpose — other than to gain more power removed for rule 2; you have used a term that is on our [list of prohibited insults](https://www.reddit.com/r/canadapolitics/wiki/insults).,liberals
h8t4b7i,2021-08-13T03:44:53.000-07:00,ivison: trudeau's about to call an election with no purpose — other than to gain more power removed for rule 3.,liberals
h8t4c83,2021-08-13T03:45:03.000-07:00,prime minister justin trudeau is planning to call a snap election for sept 20 - sources | the globe &amp; mail and what’s wrong with this how? seriously people keep saying this as if it’s a negative when it’s a simple preservation about what any political leader would want to do.,liberals
h8t4d7n,2021-08-13T03:45:14.000-07:00,ivison: trudeau's about to call an election with no purpose — other than to gain more power [removed],liberals
h8t4geh,2021-08-13T03:45:49.000-07:00,"ivison: trudeau's about to call an election with no purpose — other than to gain more power the only way to not put up with it is to get involved in politics and try to change it from the inside.

the problem with politics is the people that want to be in politics shouldn't be, and the people that should don't want to. it has become about power rather than governance.",liberals
h8t4nsa,2021-08-13T03:47:10.000-07:00,ivison: trudeau's about to call an election with no purpose — other than to gain more power [removed],liberals
h8t5mtq,2021-08-13T03:53:40.000-07:00,ivison: trudeau's about to call an election with no purpose — other than to gain more power he almost certainly knows better. he just knows who foots the bill for him to raise a stink.,liberals
h8t5ng1,2021-08-13T03:53:47.000-07:00,ivison: trudeau's about to call an election with no purpose — other than to gain more power [removed],liberals
h8t5u3q,2021-08-13T03:55:01.000-07:00,"ivison: trudeau's about to call an election with no purpose — other than to gain more power please [message the moderators](/message/compose?to=%2fr%2fcanadapolitics) in order to discuss or dispute moderation actions -- in-thread replies will be removed.  this both avoids clutter and helps receive a prompt and considered response, since your message will be seen by all moderators rather than just ones viewing [this particular thread](https://www.reddit.com/r/canadapolitics/comments/p3m4qy/-/h8t5ng1/?context=3).

\\--  
/u/joe_canadian",liberals
h8t6cnc,2021-08-13T03:58:28.000-07:00,"ivison: trudeau's about to call an election with no purpose — other than to gain more power \"frankly, this just seems like misplaced rage for the ndp doing so poorly. the ndp forced elections before in minority governments anyway. if the ndp weren't being such assholes over the past 2 years and didn't brick wall parliament with witch hunts, we wouldn't need to have an election. the opposition has forced this election on us.\" where's the non confidence vote to back up that claim, or right there isn't",liberals
h8t6e45,2021-08-13T03:58:44.000-07:00,ivison: trudeau's about to call an election with no purpose — other than to gain more power [removed],liberals
h8t6jrb,2021-08-13T03:59:48.000-07:00,"fall federal election likely, whether canadians like it or not so when it’s called that means trudeau will be voted out so no biggie right?",liberals
h8t6ucj,2021-08-13T04:01:45.000-07:00,"rising ndp support more of a ‘serious threat’ to a liberal majority than conservatives, say some pollsters | the hill times [deleted]",conservatives
h8t72np,2021-08-13T04:03:20.000-07:00,ivison: trudeau's about to call an election with no purpose — other than to gain more power [removed],liberals
h2bzkss,2021-06-19T01:38:49.000-07:00,moderna founder says canada needs to build a biotech hub to avoid 'getting caught with its pants down next time' wow! this is why we need to keep our politicians more accountable. it's a bit odd to criticize trudeau for not doing enough to make vaccines at home while being part of the party that dismantled a national vaccine centre!,liberals
h2c1cj3,2021-06-19T01:54:15.000-07:00,"toronto star sucking up to the ontario liberals. ###this is a reminder to [read the rules before posting in this subreddit](https://www.reddit.com/r/canadapolitics/wiki/rules-thelongversion).
 
1. **headline titles should be changed only [when the original headline is unclear](https://www.reddit.com/r/canadapolitics/wiki/rules-thelongversion#wiki_1._headline_titles_should_be_changed_only_where_it_improves_clarity.)**
2. **be [respectful](https://www.reddit.com/r/canadapolitics/wiki/rules-thelongversion#wiki_2._be_respectful).**
3. **keep submissions and comments [substantive](https://www.reddit.com/r/canadapolitics/wiki/rules-thelongversion#wiki_3._keep_submissions_and_comments_substantive).**
4. **avoid [direct advocacy](https://www.reddit.com/r/canadapolitics/wiki/rules-thelongversion#wiki_4._avoid_direct_advocacy).**
5. **link submissions must be [about canadian politics and recent](https://www.reddit.com/r/canadapolitics/wiki/rules-thelongversion#wiki_5._link_submissions_must_be_canadian_and_recent).**
6. **post [only one news article per story](https://www.reddit.com/r/canadapolitics/wiki/rules-thelongversion#wiki_6._post_only_one_news_article_per_story).** ([with one exception](https://www.reddit.com/r/canadapolitics/comments/3wkd0n/rule_reminder_and_experimental_changes/))
7. **replies to removed comments or removal notices will be removed** without notice, at the discretion of the moderators.
8. **downvoting posts or comments**, along with urging others to downvote, **[is not allowed](https://www.reddit.com/r/canadapolitics/wiki/downvotes)** in this subreddit. bans will be given on the first offence.
9. **[do not copy &amp; paste the entire content of articles in comments](https://www.reddit.com/r/canadapolitics/wiki/rules-thelongversion#wiki_9._do_not_copy_.26amp.3b_paste_entire_articles_in_the_comments.)**. if you want to read the contents of a paywalled article, please consider supporting the media outlet.

*please [message the moderators](https://www.reddit.com/message/compose?to=%2fr%2fcanadapolitics) if you wish to discuss a removal.* **do not reply to the removal notice in-thread**, *you will not receive a response and your comment will be removed. thanks.*


*i am a bot, and this action was performed automatically. please [contact the moderators of this subreddit](/message/compose/?to=/r/canadapolitics) if you have any questions or concerns.*",liberals
h2c22hc,2021-06-19T02:00:28.000-07:00,"‘i am not a token:’ freeland fires back at paul’s accusation she is trudeau’s ‘female shield’ ###this is a reminder to [read the rules before posting in this subreddit](https://www.reddit.com/r/canadapolitics/wiki/rules-thelongversion).
 
1. **headline titles should be changed only [when the original headline is unclear](https://www.reddit.com/r/canadapolitics/wiki/rules-thelongversion#wiki_1._headline_titles_should_be_changed_only_where_it_improves_clarity.)**
2. **be [respectful](https://www.reddit.com/r/canadapolitics/wiki/rules-thelongversion#wiki_2._be_respectful).**
3. **keep submissions and comments [substantive](https://www.reddit.com/r/canadapolitics/wiki/rules-thelongversion#wiki_3._keep_submissions_and_comments_substantive).**
4. **avoid [direct advocacy](https://www.reddit.com/r/canadapolitics/wiki/rules-thelongversion#wiki_4._avoid_direct_advocacy).**
5. **link submissions must be [about canadian politics and recent](https://www.reddit.com/r/canadapolitics/wiki/rules-thelongversion#wiki_5._link_submissions_must_be_canadian_and_recent).**
6. **post [only one news article per story](https://www.reddit.com/r/canadapolitics/wiki/rules-thelongversion#wiki_6._post_only_one_news_article_per_story).** ([with one exception](https://www.reddit.com/r/canadapolitics/comments/3wkd0n/rule_reminder_and_experimental_changes/))
7. **replies to removed comments or removal notices will be removed** without notice, at the discretion of the moderators.
8. **downvoting posts or comments**, along with urging others to downvote, **[is not allowed](https://www.reddit.com/r/canadapolitics/wiki/downvotes)** in this subreddit. bans will be given on the first offence.
9. **[do not copy &amp; paste the entire content of articles in comments](https://www.reddit.com/r/canadapolitics/wiki/rules-thelongversion#wiki_9._do_not_copy_.26amp.3b_paste_entire_articles_in_the_comments.)**. if you want to read the contents of a paywalled article, please consider supporting the media outlet.

*please [message the moderators](https://www.reddit.com/message/compose?to=%2fr%2fcanadapolitics) if you wish to discuss a removal.* **do not reply to the removal notice in-thread**, *you will not receive a response and your comment will be removed. thanks.*


*i am a bot, and this action was performed automatically. please [contact the moderators of this subreddit](/message/compose/?to=/r/canadapolitics) if you have any questions or concerns.*",liberals
h2c31c7,2021-06-19T02:08:43.000-07:00,toronto star sucking up to the ontario liberals. removed; rule 1,liberals
h2c3ddc,2021-06-19T02:11:36.000-07:00,"toronto star sucking up to the ontario liberals. sure doesn't sound like \"sucking up\" to me. if not attacking them and not verging on libel is what you define as sucking up, you need to re-evaluate your definition.
all the article says is that they have a very faint hope of getting elected.
there is truth in the statement that ford is in way over his head though.",liberals
h2c3pu5,2021-06-19T02:14:38.000-07:00,‘i am not a token:’ freeland fires back at paul’s accusation she is trudeau’s ‘female shield’ [removed],liberals
h2c5l8l,2021-06-19T02:30:44.000-07:00,‘i am not a token:’ freeland fires back at paul’s accusation she is trudeau’s ‘female shield’ [removed],liberals
h2c5wej,2021-06-19T02:33:23.000-07:00,trudeau says that canada is set to receive 68 million covid-19 doses by the end of july the issue is that there are a small number of producing countries of the vaccines all across the world and the usa was the only one not shipping out doses to other nations and were holding onto the patent protection and not allowing other countries to tool up and produce them domestically.,liberals
h7qkl36,2021-08-04T09:06:54.000-07:00,"opinion: there’s a law against snap elections – and the governor-general is supposed to enforce it the worst part about coyne and singh’s argument is that even if the gg refused the advice - by convention it would force the pm to resign.

without another viable government it would cause an election anyway. it’s all just so silly and comes across as a pathetic last minute attempt to stop the liberals from obtaining a majority.",liberals
h7qkxoq,2021-08-04T09:09:40.000-07:00,chris selley: liberals' fourth wave election push looks crazier by the day i think that journalism as a whole has really been on a decline these last few decades.,liberals
