gtccnge,2021-04-03T22:52:43.000-07:00,government of canada takes further action with domestic and us partners to combat illicit firearms i will be if he scraps going after the legal gun owners who aren't responsible for this shit as well. then trudeau and the gun community are square.,liberals
gtch5nr,2021-04-03T23:42:23.000-07:00,"cra has found 35 cases of tax dodging in the panama papers leak, 5 years later trudeau invested big into the cra in the last two years. saying they won't do it is just factually untrue because they already have.",liberals
gsbniuc,2021-03-26T05:01:21.000-07:00,"ontario poll (léger) — pc 38%, ndp 28%, lib 23% indeed. it's important to remember that the tories created institutions like tvontario in the 1970s while the liberals attacked them for expanding government.",liberals
gsbnxlh,2021-03-26T05:04:19.000-07:00,"ontario poll (léger) — pc 38%, ndp 28%, lib 23% exactly.  the liberals had their ass handed to them almost 100% based on the public's dislike of their previous leader(s), and yet they selected a flunky from the previous administration as the new one? wtf were they thinking?",liberals
gsbo72m,2021-03-26T05:06:09.000-07:00,"liberal ministers will tell staff to disobey any commons committee summons: government house leader harper's ministers did testify so it was unnecessary to call staff. so that is a bit of a different situation for the reason to call staff.

the liberals had transparency as their election platform and party policy.

and failed to keep it.

https://www.thestar.com/opinion/editorials/2017/03/23/justin-trudeaus-promise-of-transparency-is-starting-to-look-empty-editorial.html

still, you are right on one point that you did mention...harper himself was called to testify, but reasoned he did not have to.

which is very damning for trudeau currently. trudeau stated harper had a moral obligation to testify. but denies he has to. so was trudeau lying then? or is he lying now?

https://www.cbc.ca/news/politics/trudeau-challenges-harper-to-testify-under-oath-1.2252951",liberals
gsbp66t,2021-03-26T05:12:40.000-07:00,"liberal ministers will tell staff to disobey any commons committee summons: government house leader nobody is suggesting that trudeau is innocent here.  but whataboutism isn't a winning argument with voters.  just makes both parties look equally bad.

the better play is to tell voters that you will do better and show them specific policy on how you plan to do that.  then dare the other guy to live up to what he pledged the last time.",liberals
gsbp8fc,2021-03-26T05:13:04.000-07:00,"no, quebec is not canada’s alabama while his views maybe fit your biases, sweeping generalizations about an entire nation and a minority culture is one huge thing that english canadians like yourself never seem to really get.

he's « against systemic racism », so every thing else he says gets a pass, since so much of you share his opinion... even though he represents the same kind of prejudice he claims to fight. 

there was nothing effective about it in bringing attention to québec's racism in québec. 

on one hand, english canadians are now comfortably flattered of how much more civilized they are, a sentiment so evidently put in your third paragraph and in of attaran's last tweet where he claims québec is unique in it's racism, and a sentiment shared by english canadians for centuries. it's not a new thing, and it's not something english canadians seem to want to fight. 

on the other hand, it only distracted québécois from their own racism problems to witness another proof of how francophobia is still so much popular in a country that always touts its progressiveness (while still massively voting for the conservatives). 

québec has huge racism problems. there's not enough being done to fight against it, and its institution are problematic. but singling out québec is another xenophobic tradition used to be blind to your own problems.

if québec's government says something racist, or some institution does something racist, criticize it. it's the only right thing to do.

but the end doesn't justify the means. 

and to combat racism with prejudice is just never okay.",conservatives
gsbpfgi,2021-03-26T05:14:20.000-07:00,"ontario poll (léger) — pc 38%, ndp 28%, lib 23% obligatory comment about how antiquated fptp is. also, a coalition government in ontario might actually work if the current liberals can remove their heads from their collective asses.",liberals
gsbpigz,2021-03-26T05:14:53.000-07:00,"ontario poll (léger) — pc 38%, ndp 28%, lib 23% &gt;the olp can he described as centre or centre - left, instituting a new pharmacare plan for seniors/students, raising the minimum wage, and increasing student grants and loans for universities were clearly progressive reforms and i'd say would bump any centrist corporate policies they implemented to at least an overall centre - left position.

i just want to mention that all those programs that the liberal party introduced only came at the very end of their reign. before that they were stanchly centrist if not centre right.

for example under mcguinty the liberals implemented these right wing policies:

* cut corporate taxes
* froze the minimum wage
* delisted eye care from ohip
* privatized parts of the hydro system
* continued the privatization of the harris era (air ambulance, drivetest, mto road maintenance, etc.)
* cut spending significantly after the recession to control spending (for example they wanted to gut tvo's budget by 50%)
* continued underfunding the mto and the healthcare system
* allowed tuition rates to get out of control

their more left wing policies were:

* increased public school funding
* something else here i'm sure

wynne was a major departure from this since she instituted a bunch of left wing policies that you mentioned but only right before the election to suck up ndp votes. i fully expect the lpo under del duca to return to the mcguinty era.",liberals
gsbq6yi,2021-03-26T05:19:20.000-07:00,"liberals urge opposition leaders to speed up bill ensuring safe election during pandemic ###this is a reminder to [read the rules before posting in this subreddit](https://www.reddit.com/r/canadapolitics/wiki/rules-thelongversion).
 
1. **headline titles should be changed only [when the original headline is unclear](https://www.reddit.com/r/canadapolitics/wiki/rules-thelongversion#wiki_1._headline_titles_should_be_changed_only_where_it_improves_clarity.)**
2. **be [respectful](https://www.reddit.com/r/canadapolitics/wiki/rules-thelongversion#wiki_2._be_respectful).**
3. **keep submissions and comments [substantive](https://www.reddit.com/r/canadapolitics/wiki/rules-thelongversion#wiki_3._keep_submissions_and_comments_substantive).**
4. **avoid [direct advocacy](https://www.reddit.com/r/canadapolitics/wiki/rules-thelongversion#wiki_4._avoid_direct_advocacy).**
5. **link submissions must be [about canadian politics and recent](https://www.reddit.com/r/canadapolitics/wiki/rules-thelongversion#wiki_5._link_submissions_must_be_canadian_and_recent).**
6. **post [only one news article per story](https://www.reddit.com/r/canadapolitics/wiki/rules-thelongversion#wiki_6._post_only_one_news_article_per_story).** ([with one exception](https://www.reddit.com/r/canadapolitics/comments/3wkd0n/rule_reminder_and_experimental_changes/))
7. **replies to removed comments or removal notices will be removed** without notice, at the discretion of the moderators.
8. **downvoting posts or comments**, along with urging others to downvote, **[is not allowed](https://www.reddit.com/r/canadapolitics/wiki/downvotes)** in this subreddit. bans will be given on the first offence.
9. **[do not copy &amp; paste the entire content of articles in comments](https://www.reddit.com/r/canadapolitics/wiki/rules-thelongversion#wiki_9._do_not_copy_.26amp.3b_paste_entire_articles_in_the_comments.)**. if you want to read the contents of a paywalled article, please consider supporting the media outlet.

*please [message the moderators](https://www.reddit.com/message/compose?to=%2fr%2fcanadapolitics) if you wish to discuss a removal.* **do not reply to the removal notice in-thread**, *you will not receive a response and your comment will be removed. thanks.*


*i am a bot, and this action was performed automatically. please [contact the moderators of this subreddit](/message/compose/?to=/r/canadapolitics) if you have any questions or concerns.*",liberals
gsbqm9n,2021-03-26T05:21:56.000-07:00,"ontario poll (léger) — pc 38%, ndp 28%, lib 23% exactly this. lots of ndpers especially online think if all liberals would just vote ndp they can stop ford. it’s much more complicated than that.  especially when you looks at 905, and outside toronto downtown. many of them including me are centrist and would consider pc before ndp. 

liberal =/= left.",liberals
gsbrogl,2021-03-26T05:28:34.000-07:00,"supreme court rules that canada’s carbon price is constitutional &gt;a cabinet minister does not have to represent their riding and constituents. an mp does, a minister does not. 

all of harper's ministers were mps or senators, they *all* had to represent their constituents. being a minister doesn't just mean you stop representing your constituents. because as you said an mp *does* have to represent their constituents. 
are you seriously saying that pm trudeau, for example, does not have to represent his riding of papineau? what an absurd argument to make and it's an argument based in disenfranchisement at that. 

&gt;he tried to put me behind bars

if you broke the law when a given action was illegal that was *your* choice to make. 

&gt;minority of canadians that still hold \"conservative\" \"values\" can thank him.

well a plurality of canadians voted conservative in the last election and that's all you need in canada.",liberals
gsbs9mg,2021-03-26T05:32:12.000-07:00,"most canadians in favour of hotel-quarantine rules: mainstreet poll yes the pm said that international travel restrictions were extraordinarily effective in early january. after all the politicians were caught travelling, they had to pander to the public and institute this policy. 

“trudeau insisted that canada's mandatory 14-day quarantine for those crossing into canada has been \"extraordinarily effective.\" - jan 15, 2021 [article](https://www.cbc.ca/news/politics/trudeau-flight-ban-possible-1.5874905)",liberals
gsbsmz4,2021-03-26T05:34:32.000-07:00,liberals urge opposition leaders to speed up bill ensuring safe election during pandemic [removed],liberals
gsbson0,2021-03-26T05:34:49.000-07:00,"ontario poll (léger) — pc 38%, ndp 28%, lib 23% you're not wrong overall the average voter i feel saw the liberals as somewhat left leaning regardless and wanted to vote for something new i.e the pc's.

the ndp while bolstered still didn't have enough people voting for it probably because they felt rhe ndp was just the liberals on steroids or that the ndp is just a third party with less cred.

you're right overall that the liberals weren't necessarily the progressive or left leaning party.",liberals
gsbu3xj,2021-03-26T05:43:43.000-07:00,"ontario poll (léger) — pc 38%, ndp 28%, lib 23% thank you :)

and yeah i do see where you're coming from. the traditional idea in canadian politics is that the liberals are left and spend and the pcs are right and don't spend. however, when you look at the history of each party you start to notice the actual answer is more nuanced. 

as for the ndp i hope that they can win given the terrible competition but even i am doubtful. as much as i want an ndp government, ontario prefers to be screwed by the evils we know over the ones we don't. after rae ontario has been hard for the ndp to break into. it's starting to wain now but it's still a huge obstacle. horwath is an ok leader but the ndp need someone who's excellent. imo that would have been singh, he would have flipped all of brampton, parts of mississauga, and the gta while keeping what the ndp has now (save essex). if horwath wants to do the same then she needs to really pull the punches and hope that ford and del duca stumble.",liberals
hdmy96c,2021-09-20T06:49:20.000-07:00,"[deleted by user] you downers will be in for a surprise, o'toole will be pm tommorow",conservatives
hdmycxx,2021-09-20T06:50:03.000-07:00,lilley: another blackface photo embarrassing to trudeau but not his voters [removed],liberals
hdmyh09,2021-09-20T06:50:49.000-07:00,"lilley: another blackface photo embarrassing to trudeau but not his voters i dont agree with the premise that abstaining from dressing up as a person of color would make someone socially conscious. if you are correct in your statement however, that is a condemnation on our society or people being tactfully disingenuous (i think its the latter). he should apologize (and he did) but only because people like you exist in some type of capacity that have demonized innocent behavior. its like you set a trap. if he doubles down and says it wasnt racially charged and that he did nothing wrong, hes a tone deaf racist. if he apologizes, then the same people who hold your opinion will use his apology as proof that he has something to be sorry for and is therefore a racist. there is nothing wrong with anyone, political leader or otherwise dressing up as a person of another race.",liberals
hdmyh2d,2021-09-20T06:50:50.000-07:00,"election 2021 - general discussion this is wishful thinking. 

if trudeau wins this election he absolutely isn't going anywhere.",liberals
hdmyh80,2021-09-20T06:50:52.000-07:00,"election 2021 - general discussion [this one is always fun to watch.](https://338canada.com/47003e.htm)

huge rural/wilderness riding with one of the lowest population densities in the country, and almost always polling as a three-way tie leading up to the election.

i wouldn't compare it to a swing state because in the grand scheme of things it doesn't matter and nobody bothers campaigning there, but the challenges of polling a riding like this combined with the ppc appealing to rural conservatives this time around might make for a surprising outcome.

note: i'm biased because i lived there as a kid so it's probably way less fun to watch than i think it is",conservatives
hdmyhmn,2021-09-20T06:50:57.000-07:00,"[deleted by user] if you admit that a candidate that is slightly conservative socially cant run for the conservative party. you are just getting rid of your most loyal supporters who make up  at least 1/4 of the party.

&amp;#x200b;

i wish the cons would stop playing around and if they want to be progressive, and do not want to mess with social conservatism, then let them go ahead and admit that. but the game they are playing now is annoying as heck.

&amp;#x200b;

what the heck are you? a party for pink tories? for moderate blue tories? for all tories?",conservatives
hdmyn68,2021-09-20T06:51:59.000-07:00,"election 2021 - general discussion again, i'd be weary of extrapolating trends from atlantic canada to other regions. atlantic canada has a lot of hyper-local races, which is a different dynamic from almost every other region of the country. the most interesting thing from atlantic canada tonight will probably be to see how strong the ppc performs in nb which will give a preview to how strong they may be in ontario. other than that the only other questions are how well the conservatives perform in rural ns and the ndp in metro halifax.",conservatives
hdmyo7q,2021-09-20T06:52:11.000-07:00,erin o’toole dodges questions as conservatives roll through the 905 [deleted],conservatives
hdmz2yg,2021-09-20T06:55:00.000-07:00,"lilley: another blackface photo embarrassing to trudeau but not his voters i’m completely fine with that position if that’s where you come down…..as long as you agree that the substantial number of other politicians that were forced into resignation purely because a picture of them in black face appeared should be reinstated and that that particular pattern of cancel culture is toxic. 

i don’t care where we come down on the matter as a society, all i want is consistency.",liberals
hdmz7u0,2021-09-20T06:55:55.000-07:00,"lilley: another blackface photo embarrassing to trudeau but not his voters this post is simply another manifestation of what is wrong with politics and electioneering in canada. it manifests the worst in our politicians and hence condones the same in the population. it's not a new phenomenon, but think about the timing of this particular post and the motive of the poster. almost as if they were a political operative: 'lets bring this up again to see if we can squeeze some more mileage.'",liberals
hdmz9hu,2021-09-20T06:56:14.000-07:00,lilley: another blackface photo embarrassing to trudeau but not his voters [removed],liberals
hdmzcor,2021-09-20T06:56:51.000-07:00,lilley: another blackface photo embarrassing to trudeau but not his voters yeah im on board with that for sure.,liberals
hdmzmqs,2021-09-20T06:58:45.000-07:00,"election 2021 - general discussion yeah makes sense, i expect slightly lower turnout which i hear hurts liberals but also helps incumbents so who knows!",liberals
hdmzoff,2021-09-20T06:59:05.000-07:00,election 2021 - general discussion his campaign manager (i think) said that if they keep the liberals to a minority it is a 'win' in their books.,liberals
hdmzpud,2021-09-20T06:59:20.000-07:00,"lilley: another blackface photo embarrassing to trudeau but not his voters holy crap we reached basic compromise and common understanding on reddit, i didn’t know that was possible, congrats! haha",liberals
hdmzqs0,2021-09-20T06:59:31.000-07:00,"discussion thread - the 44th canadian general election question from a new(ish) canadian: why do we only ever see party leaders in campaigns? surely it would have boosted the liberals to have some more of their star candidates and competent ministers (anita anand, freeland, et al) on the national stage to boost trudeau’s cred? in other western democracies we tend to see lots of ministers and other well known faces appearing in the media to sing their party’s praises, so why not here?",liberals
hdn04ks,2021-09-20T07:02:10.000-07:00,discussion thread - the 44th canadian general election and for erin o'toole's final act: pretending to still be the leader of the conservative party of canada,conservatives
hdn0918,2021-09-20T07:03:02.000-07:00,"lilley: another blackface photo embarrassing to trudeau but not his voters …..lol that’s transference if i’ve ever heard of it. i posted it because it got published 3 hours ago and i figured it would foster some good discussion on election day. 

you can question canada strong or sun news motives and i would get that, but questioning the ethical position of another community member for participating in the community is a goofy position.

i would argue what’s wrong with canadian politics today far more has to do with why different people get to play by different sets of rules because of their ideological background",liberals
hdn0m0y,2021-09-20T07:05:33.000-07:00,"canada votes: polls open as trudeau faces election battle ###this is a reminder to [read the rules before posting in this subreddit](https://www.reddit.com/r/canadapolitics/wiki/rules-thelongversion).
 
1. **headline titles should be changed only [when the original headline is unclear](https://www.reddit.com/r/canadapolitics/wiki/rules-thelongversion#wiki_1._headline_titles_should_be_changed_only_where_it_improves_clarity.)**
2. **be [respectful](https://www.reddit.com/r/canadapolitics/wiki/rules-thelongversion#wiki_2._be_respectful).**
3. **keep submissions and comments [substantive](https://www.reddit.com/r/canadapolitics/wiki/rules-thelongversion#wiki_3._keep_submissions_and_comments_substantive).**
4. **avoid [direct advocacy](https://www.reddit.com/r/canadapolitics/wiki/rules-thelongversion#wiki_4._avoid_direct_advocacy).**
5. **link submissions must be [about canadian politics and recent](https://www.reddit.com/r/canadapolitics/wiki/rules-thelongversion#wiki_5._link_submissions_must_be_canadian_and_recent).**
6. **post [only one news article per story](https://www.reddit.com/r/canadapolitics/wiki/rules-thelongversion#wiki_6._post_only_one_news_article_per_story).** ([with one exception](https://www.reddit.com/r/canadapolitics/comments/3wkd0n/rule_reminder_and_experimental_changes/))
7. **replies to removed comments or removal notices will be removed** without notice, at the discretion of the moderators.
8. **downvoting posts or comments**, along with urging others to downvote, **[is not allowed](https://www.reddit.com/r/canadapolitics/wiki/downvotes)** in this subreddit. bans will be given on the first offence.
9. **[do not copy &amp; paste the entire content of articles in comments](https://www.reddit.com/r/canadapolitics/wiki/rules-thelongversion#wiki_9._do_not_copy_.26amp.3b_paste_entire_articles_in_the_comments.)**. if you want to read the contents of a paywalled article, please consider supporting the media outlet.

*please [message the moderators](https://www.reddit.com/message/compose?to=%2fr%2fcanadapolitics) if you wish to discuss a removal.* **do not reply to the removal notice in-thread**, *you will not receive a response and your comment will be removed. thanks.*


*i am a bot, and this action was performed automatically. please [contact the moderators of this subreddit](/message/compose/?to=/r/canadapolitics) if you have any questions or concerns.*",liberals
hdn159b,2021-09-20T07:09:22.000-07:00,"lilley: another blackface photo embarrassing to trudeau but not his voters &gt; justin trudeau appears to be literally the only politician in history that has ever gotten off free and clear with black face

ralph northam, gov. of virginia? straight up ignored calls to step down, and would be running (and winning) again if it were not for term limits. your question feels slightly concern-troll-y.",liberals
hdn15xf,2021-09-20T07:09:30.000-07:00,"the /r/canadapolitics 44th canadian general election prediction contest sharing a much more bullish prediction than the thread consensus: lpc 166, cpc 114, ndp 27, bloc 28, gpc 3, ppc 0.

if the liberals do win (which i think they will, though the tories have a good chance) it will mean that turnout was good where it mattered and it will be by a large-ish margin imo",liberals
hdn19hi,2021-09-20T07:10:12.000-07:00,election 2021 - general discussion if the conservatives lose seats does erin o’toole step down?,conservatives
hdn1fc9,2021-09-20T07:11:21.000-07:00,lilley: another blackface photo embarrassing to trudeau but not his voters [removed],liberals
hdn1h6z,2021-09-20T07:11:44.000-07:00,the /r/canadapolitics 44th canadian general election prediction contest not possible.. unless you consider a liberal minority a defeat for the liberals...,liberals
hdn1h7b,2021-09-20T07:11:44.000-07:00,can we ban the lppc shills already? vote the way i want or you get censored! calm down trudeau.,liberals
hdn1naj,2021-09-20T07:12:56.000-07:00,lilley: another blackface photo embarrassing to trudeau but not his voters [removed],liberals
hdn1w2b,2021-09-20T07:14:41.000-07:00,"discussion thread - the 44th canadian general election the thing is that the polls in nova scotia weren't really wrong, the end result was within the margin of error for the last couple polls conducted during the campaign.  


and that's not even getting into the abysmal campaign the ns liberals ran.",liberals
hdn1ym8,2021-09-20T07:15:13.000-07:00,the /r/canadapolitics 44th canadian general election prediction contest that's only tenuous is you think yfb or singh will want to be seen as either making o'toole the pm or plunging us into another election that they both claim not to want...,conservatives
hdn2749,2021-09-20T07:16:54.000-07:00,discussion thread - the 44th canadian general election if we assume that the conservatives need to get to 37 or so to win a majority (is that right?) then it would be a much bigger polling error than the nova scotia campaign.,conservatives
hdn2ahm,2021-09-20T07:17:34.000-07:00,"discussion thread - the 44th canadian general election while we're waiting, name a policy/idea that you like from the opposing party that yours doesn't have.

for me, as i've mentioned before as a ndp/liberal voter, i think the conservatives have a fantastic arctic policy which is totally ignored by my home two parties.

it's going to literally be canada's #1 geopolitical issue over the next century and deserves more attention.

what's yours?",conservatives
hdn2lwu,2021-09-20T07:19:50.000-07:00,"discussion thread - the 44th canadian general election &gt;	polling: we can look to nova scotia recently for yet another example of conservative poll number being hidden.

i hear this over and over again but the polls in nova scotia were *not* wrong. there were very few provincial ns polls to begin with, and the ones that existed showed a gradual liberal decline until the very last poll right before election day, which showed a statistical tie between liberal and pc. if you search through this sub you might even be able to find that exact poll. the final result was well within what that poll predicted, the pcs had a very efficient vote which allowed them to win a majority.

edit: for reference, the pcs won 38.59% and the liberals won 36.82%. 1.77% gap, very reasonable when you look at the polling trend lines.",liberals
hdn2shm,2021-09-20T07:21:09.000-07:00,"discussion thread - the 44th canadian general election &gt;if they're claiming holding the lpc to a minority is a win

does somebody have a source for this?  the cpc just claimed today that holding the liberals to a minority is a win?

i would like to see a source for this.  thanks!",liberals
