hghzmdv,2021-10-13T02:20:57.000-07:00,"chinese-canadian tories urge o'toole to resign, saying tough-on-china platform alienated voters china's demographics will keep them from being the super power everyone thinks they are becoming. they will still be a big economy but they won't be the sole world super power after american decline over the next 100 years. they have too many issues both internally and externally and their belt and road initiative won't be enough to counteract what coming for them.

on top of that they are an authoritarian regime that is the closest thing we have to fascism on the planet right now. i would rather be poor than be a trading partner with them. i think it's clear; the path we should take is to stay away from china as much as possible.",conservatives
hghzqzx,2021-10-13T02:21:49.000-07:00,"chinese-canadian tories urge o'toole to resign, saying tough-on-china platform alienated voters you are clearly in a super minority

(no offense intended, just pointing out a fact)",conservatives
hgi0mey,2021-10-13T02:27:35.000-07:00,"chinese-canadian tories urge o'toole to resign, saying tough-on-china platform alienated voters there are reports of forced labour in china but that is the exception, not the rule.  

by all measures, the lives of the median chinese person has improved dramatically.  having some sort of wage is objectively better than having no wage at all, and wages have dramatically improved.",conservatives
hgi0vj8,2021-10-13T02:29:16.000-07:00,"premiers’ performance: leader approval plummets in most provinces; moe, higgs suffer dramatic slides - angus reid poll &gt;so its the media fault why trudeau did not get a majority?

conservative media, as in the vast majority of speakers in canada, worked 24hrs a day for the entirety of the campaign to prevent a lpc majority.

kurl's \"moderation\" was part of that effort. it's willful blindness to not see what happened for what it so obviously was.",liberals
hgi16rt,2021-10-13T02:31:21.000-07:00,"chinese-canadian tories urge o'toole to resign, saying tough-on-china platform alienated voters china's birthrate is very low, much lower than ours. and they don't net gain from immigration either.",conservatives
hgi1da7,2021-10-13T02:32:36.000-07:00,"premiers’ performance: leader approval plummets in most provinces; moe, higgs suffer dramatic slides - angus reid poll &gt;the thing that is stopping trudeau from getting majorities or more then a third of the vote is himself ironically.

trudeau is more popular than the lpc. his personal approval is above the vote preference for the party.

you're making up a narrative counter to the given information. why?",liberals
hgi1fh9,2021-10-13T02:33:01.000-07:00,"chinese-canadian tories urge o'toole to resign, saying tough-on-china platform alienated voters this is possibly the most generous interpretation of china's activities imaginable",conservatives
hgi23my,2021-10-13T02:37:31.000-07:00,"chinese-canadian tories urge o'toole to resign, saying tough-on-china platform alienated voters i do agree that there's merit in how a political party treats certain communities and that in turn reflects how said communities vote, but you can't entirely write off foreign policy like that. the whole ordeal with the ccp basically retaliating against us by kidnapping the michaels is serious and recent business and was in the news frequently, and there's also the treatment of the uyghur people to consider, among other things the ccp is doing. things are very uneasy right now and not everyone is content to simply let it be. it becomes a balance issue of foreign/domestic and a bit of a knot for some voters to untangle.",conservatives
hgi2v6a,2021-10-13T02:42:41.000-07:00,"chinese-canadian tories urge o'toole to resign, saying tough-on-china platform alienated voters no one is arguing in good faith because no one is able to point to any specific 'socialist' policy china has enacted, even after repeated requests, just vague platitudes like \"lifted millions from poverty\" or \"safrifices\"

and best of all, any criticism of ccp is taken as some ardent defense of laissez-fair capitalism lol kinda strange",conservatives
hgi32cg,2021-10-13T02:44:00.000-07:00,legal talks are dragging out annamie paul's departure from green leadership you are technically right. leftists tend to use “centrist/neoliberal” interchangeabley because we never decided on a better name for the what hilary clinton or trudeau are: economic centre-rightists who use some social justice rhetoric.,liberals
hgi3dl6,2021-10-13T02:46:04.000-07:00,"chinese-canadian tories urge o'toole to resign, saying tough-on-china platform alienated voters the cpc being tough on china was the one thing i think they do better than the other parties. almost voted for them based off their stance against china. fuck the ccp",conservatives
hgi467x,2021-10-13T02:51:20.000-07:00,"chinese-canadian tories urge o'toole to resign, saying tough-on-china platform alienated voters we shouldnt care if it alienates voter, we should stick to our values of anti communism",conservatives
hgi4v4b,2021-10-13T02:55:58.000-07:00,"tom mulcair: freeland positioning herself to take over as liberal leader all those people had pretty substantial careers in politics prior and actually did stuff. (how you get those achievements is a bit of luck and a ton of hard work) you can become successful in politics without doing stuff outside it, but you need to actually be competent/get stuff done and be strong on policy to rise the ranks. 

trudeau without his name maybe with some luck could have won the nomination and got elected, but he's not a wonk and would inevitably be a back bencher.",liberals
hgi52sf,2021-10-13T02:57:22.000-07:00,"chinese-canadian tories urge o'toole to resign, saying tough-on-china platform alienated voters i'm chinese canadian from hong kong and i want canada be tough on china and that's why i voted cpc. that \"chinese canadian tory\" is probably ccp spy. cpc should kick him out",conservatives
hgi57pd,2021-10-13T02:58:16.000-07:00,"u.s and them — october 13, 2021 [https://www.wsj.com/articles/democrats-debate-eligibility-for-spending-bills-new-social-programs-as-pelosi-sees-decisions-soon-11634064666](https://www.wsj.com/articles/democrats-debate-eligibility-for-spending-bills-new-social-programs-as-pelosi-sees-decisions-soon-11634064666)  


american centrists are just conservatives. means tested programs do not benefit society.",conservatives
guu5m4z,2021-04-16T21:51:15.000-07:00,"abacus data | ontario pcs and liberals tied as frustration over vaccine rollout and 3rd wave rises ###this is a reminder to [read the rules before posting in this subreddit](https://www.reddit.com/r/canadapolitics/wiki/rules-thelongversion).
 
1. **headline titles should be changed only [when the original headline is unclear](https://www.reddit.com/r/canadapolitics/wiki/rules-thelongversion#wiki_1._headline_titles_should_be_changed_only_where_it_improves_clarity.)**
2. **be [respectful](https://www.reddit.com/r/canadapolitics/wiki/rules-thelongversion#wiki_2._be_respectful).**
3. **keep submissions and comments [substantive](https://www.reddit.com/r/canadapolitics/wiki/rules-thelongversion#wiki_3._keep_submissions_and_comments_substantive).**
4. **avoid [direct advocacy](https://www.reddit.com/r/canadapolitics/wiki/rules-thelongversion#wiki_4._avoid_direct_advocacy).**
5. **link submissions must be [about canadian politics and recent](https://www.reddit.com/r/canadapolitics/wiki/rules-thelongversion#wiki_5._link_submissions_must_be_canadian_and_recent).**
6. **post [only one news article per story](https://www.reddit.com/r/canadapolitics/wiki/rules-thelongversion#wiki_6._post_only_one_news_article_per_story).** ([with one exception](https://www.reddit.com/r/canadapolitics/comments/3wkd0n/rule_reminder_and_experimental_changes/))
7. **replies to removed comments or removal notices will be removed** without notice, at the discretion of the moderators.
8. **downvoting posts or comments**, along with urging others to downvote, **[is not allowed](https://www.reddit.com/r/canadapolitics/wiki/downvotes)** in this subreddit. bans will be given on the first offence.
9. **[do not copy &amp; paste the entire content of articles in comments](https://www.reddit.com/r/canadapolitics/wiki/rules-thelongversion#wiki_9._do_not_copy_.26amp.3b_paste_entire_articles_in_the_comments.)**. if you want to read the contents of a paywalled article, please consider supporting the media outlet.

*please [message the moderators](https://www.reddit.com/message/compose?to=%2fr%2fcanadapolitics) if you wish to discuss a removal.* **do not reply to the removal notice in-thread**, *you will not receive a response and your comment will be removed. thanks.*


*i am a bot, and this action was performed automatically. please [contact the moderators of this subreddit](/message/compose/?to=/r/canadapolitics) if you have any questions or concerns.*",liberals
guu5ncw,2021-04-16T21:51:30.000-07:00,"how did it come to this? politicians have ignored the core facts of covid-19 and the main strategies that will fight the pandemic everyone is blaming the government of ontario, which is a fair criticism. but the real culprit was human congregating for christmas and easter. 14 days after christmas was the second wave and now we are 14 days after easter in the third wave. religious freedoms need to be curbed during a pandemic. just a thought, if the house votes everyday to declare a pandemic, freedoms can be restricted. second, trudeau let in 30 planes with covid from india already. why are we not shut down 100 percent. no planes. canadians who leave do not have the right to return durning a pandemic. it's been a year. if you are coming back now for the first time since march 14 2020, then fine. but everyone else, nope.",liberals
guu6kr4,2021-04-16T21:58:14.000-07:00,abacus data | ontario pcs and liberals tied as frustration over vaccine rollout and 3rd wave rises such a huge crash from the expected 40-42 range for the opcs. is this because of campaign being conservative-tilted or a genuine shift of support?,liberals
guu6uys,2021-04-16T22:00:12.000-07:00,"‘a massive blow to his integrity and credibility’: conservatives blindsided by erin o’toole’s carbon pricing plan the carbon tax is a fundamentally conservative proposition. like gst/vat - simple, universal, flat, and targeted at bads not goods. that the harperites who destroyed the pcs do not like it tells us much.",conservatives
guu9byx,2021-04-16T22:17:30.000-07:00,liberals try to block former trudeau adviser's summons in military misconduct probe [removed],liberals
h6kox9s,2021-07-25T21:12:49.000-07:00,"[deleted by user] this. also, trudeau will eventually take heat for his economic policies when things eventually hit the fan, which has already started.",liberals
h6kpdjd,2021-07-25T21:18:41.000-07:00,"[deleted by user] a third of your list is something even most conservative in this country don’t want. traditional values is just code for “i wish gay people didn’t exist” — sorry, if my conservative party ever supported that i’d rather go 100 years without winning that bending the knee to ideologues.",conservatives
h6kpvk2,2021-07-25T21:25:01.000-07:00,338 canada update: lpc 164 (35.1) cpc 106 (28.5) ndp 37 (19.9) bq 29 (7.1) gpc 1 (5.8) ppc 0 (2.5) canadian politics is disappointingly factional and partisan... all parties are trying to make the other parties look bad at the expense of good policy decisions... the liberals are just as guilty of this.,liberals
h6ks2yj,2021-07-25T21:51:51.000-07:00,"maxime bernier visits southern alberta during tour for people’s party of canada not me i can't stomach voting cpc again, they have turned into liberal 2.0. i don't care if we lose this one we need to show the cpc they need to adapt and change or die and become something else. i'm ppc this time and so is a lot of conservatives i know.",conservatives
h6ks6bz,2021-07-25T21:52:57.000-07:00,maxime bernier visits southern alberta during tour for people’s party of canada has that ever been said in canada? we have a highly accountable system here. or is this just another bash conservatives for whatever you can think of comment?,conservatives
h6ksgyw,2021-07-25T21:56:22.000-07:00,338 canada update: lpc 164 (35.1) cpc 106 (28.5) ndp 37 (19.9) bq 29 (7.1) gpc 1 (5.8) ppc 0 (2.5) what are you taking about? what voting record shows the liberals and cpc are the same? these last 6 years have shown a very different story.,liberals
h6ktmeo,2021-07-25T22:09:14.000-07:00,"338 canada update: lpc 164 (35.1) cpc 106 (28.5) ndp 37 (19.9) bq 29 (7.1) gpc 1 (5.8) ppc 0 (2.5) the current iteration of the liberal party is the most progressive government we’ve ever had.

the ndp does not control progressivism, it is not a gatekeeper.",liberals
hnii0xu,2021-12-06T05:55:44.000-08:00,the future of the liberal party—without justin trudeau i don’t think jt will lose then hand over the reigns. he will do what daddy did. walk in the snow and leave politics. currently he is setting freeland up to take over. imo,liberals
hnii4oi,2021-12-06T05:56:25.000-08:00,"liberals to introduce bill repealing mandatory minimums for drug offences except you literally never would, unless you're buying in absolutely insane quantities. and also, being high is not an aggravating factor. the law is right here:

[https://www.ppsc-sppc.gc.ca/eng/pub/fpsd-sfpg/fps-sfp/tpd/p6/ch02.html#section\\_1](https://www.ppsc-sppc.gc.ca/eng/pub/fpsd-sfpg/fps-sfp/tpd/p6/ch02.html#section_1)

aggravating factors (both lists, a and b):

&gt;for the benefit of, at the direction of, or in association with a criminal organization;  
&gt;  
&gt;involving use or threat of violence;  
&gt;  
&gt;involving use or threat of use of weapons;  
&gt;  
&gt;by someone who was previously convicted of a designated drug offence or had served a term of imprisonment for a designated substance offence within the previous ten years;  
&gt;  
&gt;through the abuse of authority or position or by abusing access to restricted area to commit the offence of importation/exportation and possession to export.  
&gt;  
&gt;in or near a school, on or near school grounds, or in or near an area normally frequented by persons under the age of 18;  
&gt;  
&gt;in a prison;  
&gt;  
&gt;using the services of, or involving, a person under 18;  
&gt;  
&gt;in relation to a youth (e.g. selling to a youth).

also notice that schedule ii (weed) has the following note on the trafficking and possession for the purpose of trafficking offenses:

&gt;offence would have to involve more than 3 kg of cannabis marihuana or cannabis resin

do you seriously regularly buy in kilo amounts, for personal use?",liberals
hnijjws,2021-12-06T06:05:53.000-08:00,"berlin voted to seize homes from corporate landowners. should toronto do the same to make cheaper housing? \"massive\" is your word, not mine. we are currently pursuing a strategy of aggressive population growth [championed by bay street liberals](https://globalnews.ca/news/3020783/influential-liberal-advisers-want-canadian-population-to-triple-by-2100/). i'm simply suggesting we should calibrate our targets to focus on population *maintenance*, at least until we get a handle on this thing. the reality is that even radically laissez faire zoning reforms of the sort that would command little popular support outside brad lamb's wet dreams would take years to make an impact. to repurpose a phrase we've all become well acquainted with over the last 2 years, i think we should be looking for ways to 'flatten the curve' of price increases in the meantime.   

imagine you're on a sinking ship. there's a valve you can tighten that will immediately slow the rate at which you are taking on water. you can't altogether stop the water, so you're also going to need to figure out a system to bail it out. but surely that doesn't mean you shouldn't *also* turn the valve? like, asap? all the more so if you have a shortage of buckets, and the passengers and crew can't agree on whose problem that is or how best to solve it—in no small part because some are in the bucket business and see the rising waters as an investment opportunity.",liberals
hnik8fz,2021-12-06T06:10:26.000-08:00,"the future of the liberal party—without justin trudeau the liberals are known for going for whomever can win as leader, but they're also known for having the sharpest knives when it comes to infighting ahead of a perceived leadership race. we'll see.",liberals
hnikz9r,2021-12-06T06:15:26.000-08:00,liberals to introduce bill repealing mandatory minimums for drug offences protection of property =/= personal protection,liberals
hnimn7m,2021-12-06T06:26:42.000-08:00,liberals to introduce bill repealing mandatory minimums for drug offences [removed],liberals
hnin85o,2021-12-06T06:30:40.000-08:00,liberals to introduce bill repealing mandatory minimums for drug offences [removed],liberals
hcxfil3,2021-09-14T18:38:32.000-07:00,"politics, polls, and punditry - wednesday, september 15, 2021 i'm not sure why people in this discussion, esp those with liberal flairs, are so over confident.

i think it's unwise to get complacent and assume things are settled. i hope this isn't how trudeau and the actual liberal campaign are acting. it'd be better to hustle and campaign as if they're going to lose imo.",liberals
hcxfrz6,2021-09-14T18:42:29.000-07:00,"erin o’toole says the liberals’ carbon price won’t automatically get scrapped if he is prime minister im reasonably sure that when given two choices for a \"centre\" party most would just vote liberal.

although eventually people will get tired enough of the liberals to want a change in government, but i'm not sure if we're quite there yet.",liberals
hcxg15l,2021-09-14T18:46:22.000-07:00,"politics, polls, and punditry - wednesday, september 15, 2021 people keep on comparing o'toole to elmer fudd also.",conservatives
hcxgvyz,2021-09-14T18:59:50.000-07:00,'he went after my family': trudeau defends his response to protester [removed],liberals
hcxhql5,2021-09-14T19:13:07.000-07:00,erin o’toole says the liberals’ carbon price won’t automatically get scrapped if he is prime minister [removed],liberals
hcxinpp,2021-09-14T19:27:19.000-07:00,erin o’toole says the liberals’ carbon price won’t automatically get scrapped if he is prime minister [removed],liberals
hcxj9bm,2021-09-14T19:36:21.000-07:00,erin o’toole says the liberals’ carbon price won’t automatically get scrapped if he is prime minister [removed],liberals
hcxl15u,2021-09-14T20:02:34.000-07:00,canada election: singh says trudeau ‘shouldn’t have been joking’ about heckler protesting at hospital | watch news videos online [removed],liberals
hcxli6o,2021-09-14T20:09:19.000-07:00,"politics, polls, and punditry - wednesday, september 15, 2021 just becomes some rando on twitter says he hears about conservative party internals doesnt make it true.",conservatives
hcxlz8v,2021-09-14T20:15:54.000-07:00,"politics, polls, and punditry - wednesday, september 15, 2021 i’m definitely not confident. even if the liberals are ahead by a point or two (which may change today) that’s still a small polling error away from a defeat.",liberals
hcxmes8,2021-09-14T20:21:45.000-07:00,"politics, polls, and punditry - wednesday, september 15, 2021 mainstreet is up on the wiki. 

- lpc 31.4
- cpc 31.4
- ndp 17.5
- grn 3.3
- ppc 8.7
- bq 7
- other .6

https://archive.md/oatyr

i don’t know if the seat projection on there is accurate or a hold over from the last poll. if it’s accurate the regionals aren’t terrible for the liberals as the top line change.",liberals
hcxn4w1,2021-09-14T20:31:36.000-07:00,"politics, polls, and punditry - wednesday, september 15, 2021 looks like unions aren't buying o'tooles lies about being their allies.

https://www.msn.com/en-ca/news/federal-election-2021/unions-reject-otooles-worker-friendly-pitch-campaign-to-prevent-conservative-win/ar-aaosxao?ocid=xboxntp",conservatives
hechbn2,2021-09-25T23:52:50.000-07:00,"mp-elect kevin vuong rejects calls to resign, says he will continue as an independent &gt; she left herself

is this true? i thought trudeau kicked her out because he didn't get what he wanted from her.",liberals
heci49a,2021-09-25T23:59:09.000-07:00,prime minister justin trudeau urged to appoint female defence minister who?,liberals
heciktl,2021-09-26T00:02:40.000-07:00,"ppc vote by riding map &gt;	there's nothing petty in what i said. 

…

&gt;	it's just a shame that all of canada has to wait because of either your slow learning curve or arrogance. or both.

that’s the definition of pettiness.

&gt;conservatives in canada, the conservative party, needs to be a moderate party.

if that’s your opinion, get ready to rant every election cycle about the ppc splitting the vote, because if the cpc continues being the lpc-lite party, the ppc will get my vote and they’ll continue getting 15% of the vote every single election.",conservatives
hecisbo,2021-09-26T00:04:13.000-07:00,"majority of canadians say trudeau should resign following election, believe country more divided than ever: poll at this rate max will be long dead before he gains power and sadly it's a party of one, no-one with political experience will touch max's personality cult with a 10 foot pole. [this](https://en.wikipedia.org/wiki/beauce_(electoral_district)) is all you need to know about his popularity among those who know him.",liberals
heckqgx,2021-09-26T00:19:12.000-07:00,"prime minister justin trudeau urged to appoint female defence minister perhaps the problem is having an army colonel in the role of defence minister. add that to six years of middling service as the minister, you have a man very much wrapped up in the system and no doubt blinded by it. an outsider (yes, perhaps even a woman) might have fresh eyes and viewpoints.",liberals
hecl2vy,2021-09-26T00:21:49.000-07:00,prime minister justin trudeau urged to appoint female defence minister what?,liberals
hecl65g,2021-09-26T00:22:31.000-07:00,"majority of canadians say trudeau should resign following election, believe country more divided than ever: poll how many liberals want him to resign? it’s great that canadians want him gone, but they’re not the ones who choose. and plurality still voted for turdy via seats.",liberals
hecla0m,2021-09-26T00:23:21.000-07:00,"majority of canadians say trudeau should resign following election, believe country more divided than ever: poll yet you were saying before the election how many seats you were going to get, stop blowing smoke up your ass",liberals
heclfvx,2021-09-26T00:24:36.000-07:00,"the crimes of china collaboration with chinese scientists is a 2-way spying street. the west has a chance to get to the bottom of origin of covid solely because of american collaboration with chinese labs. we should keep doing it, but we should be winning, not losing.

you see, what frightens me in today's canadian mentality is that 'working very hard' is considered an automatic win regardless of the outcome. just listen to trudeau &amp; freeland. all their speeches are like 'we worked very hard, we deserve participation medals'",liberals
heclqfr,2021-09-26T00:26:48.000-07:00,"mp-elect kevin vuong rejects calls to resign, says he will continue as an independent i mean that’s the reason the liberal party gave for disavowing him. i don’t think anyone really believes that if he’d lied about a drug possession or dui charge (that was revoked) that they would’ve kicked him out of caucus.",liberals
hecmjfz,2021-09-26T00:32:50.000-07:00,"majority of canadians say trudeau should resign following election, believe country more divided than ever: poll i wonder if the question asked was do you think the country is divided due to the election or is it due to other factors?
not sure what this poll is trying to say. if you asked the same questions before an election was called, i think the results would be the same. alberta and saskatchewan being concerned about pipelines didn't just show up after the election, it has been going on for decades.",liberals
heco1sd,2021-09-26T00:44:06.000-07:00,"erin o’toole has an authenticity problem. will that cost him his leadership? the problem with the cpc is that they can't shift. they were already the furthest right major party by a long shot. going to the centre doesn't work because centrists a) have more options and b) don't trust it when the leader says \"we've changed\" but most of the mp base is still the same because they've been voted in over and over and they're busy spewing racist shit while he's playing mr. progressive during election season. doubly so whe his stances now are so different from his stances 12 months ago.

you can shift ideology but you also need trust and the cpc has a terrible track record for trust. they literally destroyed the pc party and killed progressive conservatism in this country in order to unite the right so they could win power. and even that only worked because the liberals and bloc completely collapsed simultaneously.",liberals
