hq148bs,2021-12-25T23:07:19.000-08:00,"trudeau says china ‘playing’ democracies against each other, urges a ‘united front’ [removed]",liberals
hq158ut,2021-12-25T23:16:19.000-08:00,"trudeau says china ‘playing’ democracies against each other, urges a ‘united front’ does the fact that they’re one of our oldest and closest allies mean we can’t hold them to account? i’m definitely not saying we should align with china, but we need to start taking a harder stance on foreign policy with our neighbours to the south as well.",liberals
hq16e56,2021-12-25T23:26:01.000-08:00,"fact check-clip of canadian prime minister justin trudeau speaking about his opposition to ‘notwithstanding clause’ taken out of context &gt;  i check the source account and its just your run of the mill semi-popular car rant conservative that seems to only posts this misleading type of stuff.

so pierre poilievre then?",liberals
hq19yj7,2021-12-25T23:54:44.000-08:00,fact check-clip of canadian prime minister justin trudeau speaking about his opposition to ‘notwithstanding clause’ taken out of context [removed],liberals
hq19ze0,2021-12-25T23:54:55.000-08:00,fact check-clip of canadian prime minister justin trudeau speaking about his opposition to ‘notwithstanding clause’ taken out of context [removed],liberals
hq1ag5w,2021-12-25T23:58:35.000-08:00,fact check-clip of canadian prime minister justin trudeau speaking about his opposition to ‘notwithstanding clause’ taken out of context [removed],liberals
h2iwk3w,2021-06-20T21:04:27.000-07:00,"canada says border won't fully reopen until 75% vaccination rate honestly, being safe is better. i’m glad the liberals are taking a slow approach to border reopening, because i personally find it more thoughtful of our population as a whole to patiently wait until enough of us are vaccinated before we reopen our risky border. i get it free trade and travel, but sometimes the economy has to suffer if people want to survive, be it environmental, social or health related problems.",liberals
h2ix3mt,2021-06-20T21:12:11.000-07:00,liberals to table last-minute bill to create disability benefit the liberals have kept the vast majority of their election promises since 2015. people only bellyache about electoral reform - which it turns out was not a deal breaker really.,liberals
h2ixs8s,2021-06-20T21:21:40.000-07:00,liberals to table last-minute bill to create disability benefit [deleted],liberals
h2izmdz,2021-06-20T21:45:53.000-07:00,liberals to table last-minute bill to create disability benefit [removed],liberals
h2j1vax,2021-06-20T22:12:51.000-07:00,"np view: green infighting exposes justin trudeau's hypocrisy on israel she will win re-election in fredericton as a liberal, easily. i'm not a green but i don't approve of her defection. however, if she sincerely believed that her own party was going to undermine her re-election campaign, her desire to seek political shelter with the liberals becomes more understandable. all signs point to the green leader's office actively trying to push atwin out...or at least being happy to see her leave.

it is alleged that paul told atwin at the meeting on the 26th \"i got your messages, i just didn't want to talk to you.\" if that's true, that should be an absolute disqualifier. you can't run a major party like that, let alone a minor party clinging desperately to what little elected representation it has. ffs you can't run a bakery like that.",liberals
h2j2pyo,2021-06-20T22:22:51.000-07:00,liberals to table last-minute bill to create disability benefit [deleted],liberals
h2j3ool,2021-06-20T22:33:45.000-07:00,"trudeau government plays politics with pardon reform if they didn’t plan on campaigning on it, they would have lowered the cost of a record suspension years ago, it’s not part of the legislation or dependent on anything in it, but is something that they’re promising to bring in along side of the bill. it’s something the minister can do at any time and was promised in the last parliament too, instead they did a study on it which again said it should be lowered or even eliminated. there’s no real reason for it being held up other than they want to make a show of it.",liberals
hfgwqwo,2021-10-04T22:04:19.000-07:00,conservative caucus to vote on whether to enact power to remove o'toole yeah too bad otoole is only 1 vote,conservatives
hfgwszr,2021-10-04T22:04:54.000-07:00,"ndp to request recount in toronto's davenport riding, where liberals won by 76 votes [removed]",liberals
hfgyiz4,2021-10-04T22:22:01.000-07:00,"as tories review election loss, weak support in immigrant communities a crucial issue: of the 41 ridings in canada where more than half the population is racialized, the conservatives won just one in the 2021 election &gt;i find it interesting to look at the ndp's fall and sometimes non-existence in many of those ridings. like they're lucky to crack 10% in places like markham or vaughan or richmond hill. literally no seats in the gta.

bob rae.

longer answer - robert rae.

... plus markham/richmond hill/vaughan has a lot of homeowners, many of whom are upper-middle class, non-union, tax hike adverse white collar professionals - not a natural fit for the ndp. many see themselves as the people who would be on the hook to pay for ndp social programs. not to mention, older first gen immigrants have perhaps the opposite of progressive values; heck many of them are probably more conservative than the conservatives.",conservatives
hfgzr5p,2021-10-04T22:33:56.000-07:00,"conservative caucus to vote on whether to enact power to remove o'toole all of the people you mentioned were pcs, and the modern cpc does very little to resemble the pc party of old.",conservatives
hfh00c4,2021-10-04T22:36:15.000-07:00,"conservative caucus to vote on whether to enact power to remove o'toole you can’t assume that all of the ppc voters would have gone conservative though. the data suggests it was a mix bag group of people from all parties that were largely single issue voters this election (anti-vax). 

they lost because they don’t have any credibility as a moderate party. o’toole may be a moderate himself, but that doesn’t really matter if he can’t get his party to support his positions.",conservatives
hfh05h6,2021-10-04T22:37:35.000-07:00,"as tories review election loss, weak support in immigrant communities a crucial issue: of the 41 ridings in canada where more than half the population is racialized, the conservatives won just one in the 2021 election what is a win? a majority? they don't need a majority, they need to form government.  they can form government and still not have a majority.

perhaps if they showed canadians they could work together with others they could have scored more points.",conservatives
hfh0cy6,2021-10-04T22:39:27.000-07:00,justin ling : how close did the liberals come to losing? [removed],liberals
hfh0di1,2021-10-04T22:39:35.000-07:00,"conservative caucus to vote on whether to enact power to remove o'toole i think the most important thing of a party leader should be that they are responsinle to their members. it is more imoortant that the leader be what the conservative members want, than a bunch of voters.

and o'toole got elecred based on a bunch of promises to his socon base that he immediately turned face on. seems like a good reason to kick him.",conservatives
hfh0vj1,2021-10-04T22:44:06.000-07:00,"conservative caucus to vote on whether to enact power to remove o'toole on a related note, i honestly wonder how it would work out if the conservatives split into two parties that don't compete against each other in their respective areas and then work together after the election, like in australia.",conservatives
hfh0w2m,2021-10-04T22:44:14.000-07:00,"conservative leader erin o'toole faces first caucus meeting after election loss ###this is a reminder to [read the rules before posting in this subreddit](https://www.reddit.com/r/canadapolitics/wiki/rules-thelongversion).
 
1. **headline titles should be changed only [when the original headline is unclear](https://www.reddit.com/r/canadapolitics/wiki/rules-thelongversion#wiki_1._headline_titles_should_be_changed_only_where_it_improves_clarity.)**
2. **be [respectful](https://www.reddit.com/r/canadapolitics/wiki/rules-thelongversion#wiki_2._be_respectful).**
3. **keep submissions and comments [substantive](https://www.reddit.com/r/canadapolitics/wiki/rules-thelongversion#wiki_3._keep_submissions_and_comments_substantive).**
4. **avoid [direct advocacy](https://www.reddit.com/r/canadapolitics/wiki/rules-thelongversion#wiki_4._avoid_direct_advocacy).**
5. **link submissions must be [about canadian politics and recent](https://www.reddit.com/r/canadapolitics/wiki/rules-thelongversion#wiki_5._link_submissions_must_be_canadian_and_recent).**
6. **post [only one news article per story](https://www.reddit.com/r/canadapolitics/wiki/rules-thelongversion#wiki_6._post_only_one_news_article_per_story).** ([with one exception](https://www.reddit.com/r/canadapolitics/comments/3wkd0n/rule_reminder_and_experimental_changes/))
7. **replies to removed comments or removal notices will be removed** without notice, at the discretion of the moderators.
8. **downvoting posts or comments**, along with urging others to downvote, **[is not allowed](https://www.reddit.com/r/canadapolitics/wiki/downvotes)** in this subreddit. bans will be given on the first offence.
9. **[do not copy &amp; paste the entire content of articles in comments](https://www.reddit.com/r/canadapolitics/wiki/rules-thelongversion#wiki_9._do_not_copy_.26amp.3b_paste_entire_articles_in_the_comments.)**. if you want to read the contents of a paywalled article, please consider supporting the media outlet.

*please [message the moderators](https://www.reddit.com/message/compose?to=%2fr%2fcanadapolitics) if you wish to discuss a removal.* **do not reply to the removal notice in-thread**, *you will not receive a response and your comment will be removed. thanks.*


*i am a bot, and this action was performed automatically. please [contact the moderators of this subreddit](/message/compose/?to=/r/canadapolitics) if you have any questions or concerns.*",conservatives
hfh115q,2021-10-04T22:45:31.000-07:00,"jason kenney’s approval plummets amid covid-19 turmoil: kenney -55, notley +3 (thinkhq) &gt; if someone wants to tell me how these head to head approvals aren’t absolutely devastating for the ucp beyond “hurr durr alberta durr” i’m all ears, but this like landslide defeat territory to me.

honestly, the only way it works out that way is if covid goes away and things get back to normal very, very quickly.  voters here have short memories, but covid is giving a lot of people strong memories that won't fade quickly.

the typical conservative lifecycle in alberta involves doing the unpopular stuff (think education and health cuts) in years 1 and 2, softening up in year 3, then outright bribing voters (think infrastructure projects in key ridings, funding announcements that appeal to key demographics, etc) begins in year 4, after the re-election the cycle repeats.  i know i'm grossly oversimplifying, but in broad strokes this is roughly how it plays out.

covid is throwing a real wrench into that lifecycle.  we're now about a year and a half away from the next election - kenney should be softening up and getting ready to start bribing voters.  unfortunately, dealing with covid requires tough decisions that will anger his base, but a conservative shouldn't anger the base during the softening up and bribery years of the lifecycle because they might remember and not vote (or worse, vote for a different conservative party).

of course, i give myself better-than-even odds of being completely wrong.  kenney may be doing everything wrong when it comes to governing, but he's a master at winning elections.  if anybody can manage a win after these polling numbers it's kenney.",conservatives
hfh193s,2021-10-04T22:47:30.000-07:00,"as tories review election loss, weak support in immigrant communities a crucial issue: of the 41 ridings in canada where more than half the population is racialized, the conservatives won just one in the 2021 election yeah, i don't see how anyone expects any other result from these communities when the cpc spends a good chunk of it's time and effort dog whistling about immigrants and scapegoating immigration for various issues facing the country.",conservatives
hfh1ea7,2021-10-04T22:48:49.000-07:00,conservative caucus to vote on whether to enact power to remove o'toole [removed],conservatives
hfh1g5g,2021-10-04T22:49:16.000-07:00,"as tories review election loss, weak support in immigrant communities a crucial issue: of the 41 ridings in canada where more than half the population is racialized, the conservatives won just one in the 2021 election massive lol because i genuinely thought he was based on exactly that.",conservatives
hfh2bx4,2021-10-04T22:56:55.000-07:00,conservative caucus to vote on whether to enact power to remove o'toole [removed],conservatives
hfh2hle,2021-10-04T22:58:17.000-07:00,"as tories review election loss, weak support in immigrant communities a crucial issue: of the 41 ridings in canada where more than half the population is racialized, the conservatives won just one in the 2021 election the ontario pcs virtually swept the 905, and also won many diverse ridings in places like etobicoke and scarborough. jane &amp; finch voted for rob ford and doug ford as mayor. the pcs didn't win there in 2018, but they did run a strong second gaining 19 points in humber river black creek. patrick brown won election as mayor of brampton, 5 seconds after being forced to resign as ontario pc leader over a sexual harassment scandal. 

i'm not sure why, but there are some conservatives who have done well in more diverse parts of canada.",conservatives
hfh2xup,2021-10-04T23:02:09.000-07:00,"tofino trip may only hasten trudeau’s departure you are both right actually. in some parts of canada it's a little of a, in some parts a little of b.",liberals
hfh3gvc,2021-10-04T23:06:36.000-07:00,conservative caucus to vote on whether to enact power to remove o'toole if that were to happen i might actually vote for the conservatives,conservatives
hfh419q,2021-10-04T23:11:13.000-07:00,"conservative caucus to vote on whether to enact power to remove o'toole at least in my portion of ontario, he lost votes because of his vaccine stance (suggesting everyone get vaccines; do not state whether his caucus has been vaccinated; sounding like the pandemic isn't really a concern) and also because his leadership campaign was harder right than his more centrist election campaign.  no one knew which side was going to be true. a number of tory voters stayed home or voted for candidates that \"weren't going to win\" in my riding. 

as a note, i remember eric grenier quoting someone stating that 28% of the ppc vote was former conservative voters.  there was a small percentage of green, smaller of ndp and liberal but the vast majority were people who hadn't voted before.",conservatives
hfh47qo,2021-10-04T23:12:42.000-07:00,"liberals’ electric-vehicle ambitions require mandate: study the nice thing about ev adoption is that other technologies and economic viability align nicely to ease the transition. 

if we adopt more decentralized energy storage along with ev's, the power grids can already handle the full adoption of electric vehicles, 

the critical thing most people miss is that the mass adoption of evs also comes with the drastic drop in energy storage prices.

stationary batteries deployed at large destination charging locations can drastically offset grid loads during peak times. 

off-peak charging done at homes and businesses can already be handled by grids, now or with minor updates.

power production overall needs to increase drastically, but the grid is not woefully unequipped for the coming ev boom if we deploy batteries along with charging stations.

the cost difference in energy between peak and off-peak has been proven to pay for the batteries in some places place already. canada has relatively cheap electricity and energy prices so the economic incentive isn't quite here yet, but as demand rises and storage prices fall we will adopt storage quickly.

add in the fact that solar and wind energy prices are falling faster than even the most optimistic estimates from a few years. the cost difference between on-peak and off-peak will just get bigger as these low-cost but variable power sources come online.

the mass adoption of ev's will feed the adoption of stationary battery storage which will enable the wider adoption of solar and wind. at current prices, these technologies are prime adoption.",liberals
h79bibl,2021-07-31T10:03:12.000-07:00,"justin trudeau said ottawa would ban conversion therapy. cities across canada aren’t waiting for him to keep that promise there is no win here, municipalities are acting because the federal government failed to. i can't help but think you're intentionally missing the point of the article here.",liberals
h79cprz,2021-07-31T10:14:02.000-07:00,justin trudeau said ottawa would ban conversion therapy. cities across canada aren’t waiting for him to keep that promise [removed],liberals
h79dbos,2021-07-31T10:19:32.000-07:00,"opinion: oh, the feds are talking about abortion? an election really must be imminent &gt;most importantly... trudeau got a haircut and a shave so he doesn't look like a homeless bum living under the overpass anymore.

i really liked his beard... but yeah big indicator i think. haven't we not had a bearded pm win in a really really long time?",liberals
h79dt3c,2021-07-31T10:23:47.000-07:00,"stephen harper says canada's pandemic spending has been \"overkill\" in podcast appearance | cbc news &gt;lots of backtracking and “joking” going on.

backtracking by you perhaps :)  harper didn't sell the wheat board to the saudis. we've established that was an untrue statement on your part. you're trying to back track on your statement. 

as to the joking - well, everyone's laughing at you if that's what you mean :) you're hilarious :)

harper was the best fiscal prime minister we've ever had, it's demonstrably true. it's fact, no religion required. 

the worst used to be pierre trudeau. but his son has outdone him (you know, mr budgets balance themsevles) who has now borrowed in 7 years close to 2 times as much money as was borrowed in the entire 150 years previously combined, and has a structural defict larger that most provincial budgets, and that part was true before covid. 

so now the worst is trudeau v2, followed by trudeau v1. 

but harper was the best and your utter failure to produce truthful reasons to the contrary certainly speaks to that. 

back to your echo chamber, troll.",liberals
h79erl0,2021-07-31T10:32:19.000-07:00,atlantic canada 'taken for granted' says conservative leader erin o'toole [deleted],conservatives
h79eznw,2021-07-31T10:34:22.000-07:00,"justin trudeau said ottawa would ban conversion therapy. cities across canada aren’t waiting for him to keep that promise ok well let’s use hope, as the article does, over win if that’s a sticking point for you...to me the main point is hope. 

fair enough you can think i don’t get it and i can continue to think the article doesn’t properly capture/convey it.

thanks for taking the time to share your thoughts.",liberals
h79f8qs,2021-07-31T10:36:37.000-07:00,atlantic canada 'taken for granted' says conservative leader erin o'toole [removed],conservatives
h79h2vm,2021-07-31T10:53:27.000-07:00,"no, it’s not the governor general’s place to deny an election call he's just grandstanding to demonstrate his willingness to continue working with the liberals to maintain a stable government.",liberals
h79h9oa,2021-07-31T10:55:15.000-07:00,erin o'toole says he'd let new brunswick decide how to fund abortions i heard rex murphy describe the cpc as a rudderless institution and i couldn't agree more. and for everyone who on the left thinking this is amazing - it's not. competition drives anything in this world and if you have incompetent right wing politics you will quickly find the same thing on the left. i personally think we are already seeing this.,conservatives
h79hfkw,2021-07-31T10:56:47.000-07:00,"ndp has wide lead on ucp, but many albertans aren’t committed: poll i think it was definitely stupid to slash royalty rates for oil sands bitumen during the klein years while selling off most state investment in the sector. especially after the government spent a fortune over decades developing the basic technology for things like bitumen separation and other risky, long term inventions private capital would never have done on the time scale required.

the result is that alberta got a pitiful share of resource rent during the bitumen booms - a very large share of the value of each barrel went to private capital. because the resource is so capital intensive, this meant that a very small share of the resource value went to either labor or taxpayers. it looked like a good deal because in a record high price environment with constantly rising production, absolute value of income, employment, tax revenue, etc. grew. but this financial illusion required constantly increasing production to keep the whole show humming along, at the same time that climate change made it obvious that the province would need to maximize long term revenue before winding down the industry.

this was, simply put, extremely stupid and short sighted. it created a situation where the province had to essentially rubber stamp as much new production as possible to keep wages high, jobs growing, and government coffers full, without any serious consideration of long term demand, north american refinery capacity, or future climate policy. and, unlike a country like norway, when the price crashed (and in a raw resource economy, the price always crashes eventually), the province had nothing to show for it. it had stopped making payments into the heritage fund, it had no savings, its workers had gained only a pittance of the value of the resource. it was extremely poor financial planning, and as far as i can tell it was largely ideologically driven.

alberta gave the resource away for free and broke every rule of sensible financial planning for a resource export economy. and now they are truly screwed, and the only thing the conservatives can do is wind people up about us foundations or leo dicaprio or whatever the dog and pony show is this week, and hope no one comes to their senses and blames them for the mess they created. it's an absolute catastrophe.",conservatives
h79hjny,2021-07-31T10:57:50.000-07:00,"atlantic canada 'taken for granted' says conservative leader erin o'toole this isn't even the most tone deaf thing the tories have done this year. voting against recognizing climate change (even before lytton became the hottest place on earth then burned to the ground this summer) and o'toole's comments about being the \"only one running to be prime minister that’s actually proud of [canada]\" immediately come to mind.",conservatives
h79hyow,2021-07-31T11:01:40.000-07:00,"no, it’s not the governor general’s place to deny an election call it's the third option that went over your head: that singh knows perfectly well that his proposal to the gg isn't going anywhere, but it creates a news cycle that makes the media start asking trudeau critical questions about the election instead of reporting on government pre-election spending goodies.",liberals
h79i3lh,2021-07-31T11:02:56.000-07:00,canada's troubled efforts to resettle afghan military interpreters 'insulting' to veterans: o'toole even a broken clock is right twice a day. o'toole is right. the government has been absolutely terrible on this issue.,conservatives
h79ixp3,2021-07-31T11:10:38.000-07:00,"atlantic canada 'taken for granted' says conservative leader erin o'toole the cpc will never repair relations with atlantic canada.

their new leadership election rules essentially give more voting power to ridings with higher vote totals (aka the prairies). this assures that the cpc will have prairie or far right leadership from here on out. 

the funny thing is, one of the deals for the merger of the alliance and progressives, was that all ridings have equal leadership voting power. with that gone, the progressive wing of the party is dead and cannot take back control.",conservatives
h79iyht,2021-07-31T11:10:51.000-07:00,"justin trudeau said ottawa would ban conversion therapy. cities across canada aren’t waiting for him to keep that promise i don't necessarily dispute your point, but given the forum the political critique is perhaps more apropos than a detailed journalistic one. appreciated the discussion, cheers.",liberals
h42ljg1,2021-07-04T08:48:20.000-07:00,"politicians could’ve worked ‘better’ on conversion therapy ban, says 1st openly gay tory mp where do fiscal conservatives go then? from what i see, the cpc is actually getting more progressive on all sorts of issues but it's slow. it's a fine balance making sure you don't move too quickly and cause a total split.",conservatives
h42lxee,2021-07-04T08:52:01.000-07:00,"politicians could’ve worked ‘better’ on conversion therapy ban, says 1st openly gay tory mp you don't think the alt right should be noted as being different than other conservatives?",conservatives
h42meqi,2021-07-04T08:56:35.000-07:00,"politicians could’ve worked ‘better’ on conversion therapy ban, says 1st openly gay tory mp yes but im saying the left likes to generalize all conservatives as alt right even though barely any are that. thats why conservative commentators usually say that left and liberal is different. the left doesn't make the distinction for the right.",conservatives
