gzkpum7,2021-05-26T09:22:58.000-07:00,"trudeau did not break federal ethics rules in we charity scandal — but morneau did his and his family's pre-existing history, relationship, and ties to we charity means there is a bias, as much as anyone wants to pretend doesn't exist, it's there, even subconsciously. making a decision while biased is why this is a conflict of interest. it's undeniable. the history of connections *is* the evidence. let's not pretend otherwise.

the ethics commissioner cleared the pm of violating a behavioral code of conduct that has a basis in ethics, but these standards falls short of the universal understanding of ethics by which most professionals abide. the commissioner's report frames the situation as if the pm's connections didn't exist although they do. it may be true that this new contract would not have benefited the pm's family further, but it turns a blind eye on the past. this is why this absolution is a complete farce.",liberals
gzkqkj2,2021-05-26T09:28:49.000-07:00,"it has been nearly a year since trudeau said the blood ban could be eliminated 'very soon.' what happened? i think the real issue is that canadian blood services is supposed to be quasi-independent. the liberals have been trying to nudge cbs to get rid of the ban for years, but cbs actually really wants to keep it, so they're stalling . the liberals could strong arm  cbs into getting rid of the ban, but that could lead to a messy legal fight with cbs over jurisdiction. in other words, getting rid of the ban would be pain in the ass, and the liberals don't care enough to put in the effort.",liberals
gzkqlyu,2021-05-26T09:29:09.000-07:00,"léger: lpc 34%, cpc 30%, ndp 19%, bq 7%, gpc 7% unpopular opinion - the green party has fucked itself by taking a hard left turn.  it's like the old saying about the ndp when it tries to moderate itself.  when given the choice between the liberals and a mild version of the ndp, people vote for the real liberals.  imho, when given the choice between a left wing green party and the ndp, they will vote for the real socialists.  the greens used to occupy a unique niche, a mix of policies that couldn't be pinned down as exclusively right or left wing.  now, they're just fishing in the same pool as the ndp, bloc and, to a lesser extent, the liberals.",liberals
gzkqowq,2021-05-26T09:29:49.000-07:00,"trudeau did not break federal ethics rules in we charity scandal — but morneau did &gt;his and his family's pre-existing history, relationship, and ties to we charity means there is a bias, as much as anyone wants to pretend doesn't exist, it's there, even subconsciously. making a decision while biased is why this is a conflict of interest. it's undeniable. the history of connections is the evidence. let's not pretend otherwise.

that isn't what a conflict of interest means though.  a conflict of interest means there are competing interests.  he needs to be pursuing an interest that is in conflict with his role.

evidence is that he actually did the opposite of that.

&gt;the ethics commissioner cleared the pm of violating a behavioral code of conduct that has a basis in ethics, but these standards falls short of the universal understanding of ethics by which most professionals abide. the commissioner's report frames the situation as if the pm's connections didn't exist although they do. it may be true that this new contract would not have benefited the pm's family further, but it turns a blind eye on the past. this is why this absolution is a complete farce.

no, it doesn't turn a blind eye.  if trudeau was taking the charge pushing towards we, that would be different and his past would be called into question.  if he brought up the idea of we, his past would be called into question.  if people brought up problems with we and he dismissed them, his past would be called into question.

but the only person where there is a record of them suggesting they move away from we *is* trudeau.  there is no evidence that his interests lied in helping we.  you are describing a *perception* of conflict of interest.  you cannot accuse someone of having an interest that goes opposite to your actions.",liberals
gzks17a,2021-05-26T09:40:43.000-07:00,"renters under pressure in canada’s active home resale market as owners look to cash in for everyone who argues that this isn't a problem exacerbated by the federal liberals, here's freeland as an opposition mp emphatically arguing that the federal government is failing canadians because prices rose 60% in 15 years. now that she's in government and prices rose 30-40% in a year.... silence.

https://youtu.be/q4_53iaznae",liberals
gzkurtm,2021-05-26T10:02:34.000-07:00,"léger: lpc 34%, cpc 30%, ndp 19%, bq 7%, gpc 7% i don’t know, balanced budgets seems to be less of a concern for conservatives these days. hell, doug ford got elected in ontario with absolutely no platform. literally. he just said a bunch of things he wanted to try to do at his campaign stops. 

as for o’toole, he tries to put on a “for the people” persona. but he was adamantly against changing the national anthem to include all genders in it. he hated the idea of changing the anthem to include women so much he wrote a three part op ed in huffington post against the change. seems like he has a lot of time on his hands to disenfranchise certain portions of the population.",conservatives
hlf94lu,2021-11-20T04:03:44.000-08:00,"opinion: canada’s conservatives self-destruct, again – and maybe that’s for the best [removed]",conservatives
hlf9xp1,2021-11-20T04:09:52.000-08:00,"court appeal to decide whether three parts of harper government’s sex work legislation are unconstitutional imagine a world where trudeau ignores the 2020+ dumpster fire and swings back to focusing on the real problems like rolling back a previous government's legislation around sex work. 

am i supposed to be outraged that it's not happening?",liberals
hlfachi,2021-11-20T04:13:01.000-08:00,"justin trudeau has a problem in washington. here’s why joe biden isn’t listening if all of canada was another us state, it wouldn't even be the top in population, lol",liberals
hlfapk0,2021-11-20T04:15:47.000-08:00,"no one knows how $80 billion in climate financing was spent in 2019 &gt; how come i haven't heard a single person run the actual numbers of col increases with respect to carbon taxes? 

this has been done repeatedly.  if you aren't hearing it or seeing it, you really aren't looking for it.

&gt;i don't think the rebate is substantial compared to the col increases.

again, for the vast majority of tax filers, the rebate was equal to or more than was paid in carbon tax.

&gt;i am open to change my mind about it but i haven't heard convincing arguments about how the carbon tax is the most effective approach. 

it probably isn't the most effective approach. i mean, an authoritarian government just mandating and implementing the change that needs to happen is probably far more effective - but that isn't really desirable for the vast majority of democratic countries. instead, the conservatives came up with the \"market-driven approach\" that is the carbon tax - yes, it was initially a conservative plan that was proposed as an alternative to government imposed change.

as to evidence for the efficacy of carbon taxes at reducing consumption, it's a relatively new area of study (as we haven't had carbon taxes for very long), but the current research seems to support that it is effective:

* [carbon pricing efficacy: cross-country evidence](https://link.springer.com/article/10.1007/s10640-020-00436-x)

* [carbon taxes could make significant dent in climate change, study finds](https://news.mit.edu/2018/carbon-taxes-could-make-significant-dent-climate-change-0406)",conservatives
hlfatbb,2021-11-20T04:16:35.000-08:00,"opinion: canada’s conservatives self-destruct, again – and maybe that’s for the best [removed]",conservatives
hlfbcfj,2021-11-20T04:20:27.000-08:00,"justin trudeau has a problem in washington. here’s why joe biden isn’t listening wouldn’t even be the second largest state either.



edit: nevermind, it actually would be the second largest state. texas is much smaller than i thought.",liberals
hlfbt9a,2021-11-20T04:23:55.000-08:00,justin trudeau has a problem in washington. here’s why joe biden isn’t listening or by economic strength. entire canada is like another texas.,liberals
hlfcmzk,2021-11-20T04:30:09.000-08:00,"court appeal to decide whether three parts of harper government’s sex work legislation are unconstitutional &gt; and has taken no steps to repeal or amend it.

regardless of what he thinks about the fairness of the current legislation, it is a political minefield and he knows it. even the different camps within his own party would be at each other's throats over this, and that is before the other parties and various interest groups weighed in.

no politicians have unlimited political capital, and trudeau, his advisors, and other ministers have made a decision, perhaps consciously, perhaps just tacitly, to ignore it and focus on things like universal childcare which get buy-in from all his factions, other parties, and a good chunk of the public.

a comparison would be harper shutting down any discussion of reopening abortion debates. regardless of what he thought personally, he knew it would be a messy scene no matter what and moved on.",liberals
hlfcugh,2021-11-20T04:31:42.000-08:00,"o’toole says conservatives need to stay the course amid public challenge to his leadership i'm having a hard time believing that the climate-related points in there would be supported by the list of folks who voted against admitting climate change is even real. and if that's such an obvious farce, why should i believe the rest of it isn't just empty words, too?",conservatives
hlfdoky,2021-11-20T04:37:52.000-08:00,justin trudeau has a problem in washington. here’s why joe biden isn’t listening so fourth highest in the states by gdp?,liberals
hlfeuu9,2021-11-20T04:46:40.000-08:00,"o’toole says conservatives need to stay the course amid public challenge to his leadership maybe the course of having the party vote to agree that human-caused climate change isn’t real, then pretending that they have some sort of plan to stop this thing they said they thought wasn’t real.


the problem is that a very large swath of cpc voters are angry ignorant extremists, and the party knows they can’t win an election without them, so they are afraid to say anything that will make them seem like they are not extremists too.",conservatives
hlfey4e,2021-11-20T04:47:21.000-08:00,"the liberals aren’t to blame for inflation, but they are piling wood on the fire canada's inflation rate (annualized) is something clearly under 5% (4.7% in august, 21). the usa's current inflation rate is something clearly over 6% (6.2% in november/21).

both are bad, but theirs is about 1/3 higher than ours.",liberals
hlffvaa,2021-11-20T04:54:14.000-08:00,"justin trudeau has a problem in washington. here’s why joe biden isn’t listening yep, just behind ny and ahead of fl.

if you wanna go into comparable sizes, then ontario is just above ohio and below penn, while quebec is lower than arizona and just above wisconsin...

canada has a tiny economy and most canadians think we're an economic power lol",liberals
gwvi5tx,2021-05-03T15:28:20.000-07:00,"mark carney’s potential run for office has liberals talking counterpoint: central bank independence is a central tenet of modern macroeconomics, and it is practically impossible to imagine that mark carney the politician would have no influence over the central bank.",liberals
gwviy0i,2021-05-03T15:38:10.000-07:00,"feds take charge of environmental assessment for controversial highway 413 obviously they don’t want it, but they don’t want to be the reason it gets cancelled either. so they are banking on the provincial government changing and canceling it for them. 

but, if opc wins again, the liberals might be forced to just back away, as it wouldn’t politically favourable.",liberals
gwvjlmz,2021-05-03T15:46:36.000-07:00,liberals shut down debate on bill c-10 amendment allowing regulation of social media content [removed],liberals
gwvkrwq,2021-05-03T16:02:10.000-07:00,"canada to ban international students confirmed by justin trudeau ###this is a reminder to [read the rules before posting in this subreddit](https://www.reddit.com/r/canadapolitics/wiki/rules-thelongversion).
 
1. **headline titles should be changed only [when the original headline is unclear](https://www.reddit.com/r/canadapolitics/wiki/rules-thelongversion#wiki_1._headline_titles_should_be_changed_only_where_it_improves_clarity.)**
2. **be [respectful](https://www.reddit.com/r/canadapolitics/wiki/rules-thelongversion#wiki_2._be_respectful).**
3. **keep submissions and comments [substantive](https://www.reddit.com/r/canadapolitics/wiki/rules-thelongversion#wiki_3._keep_submissions_and_comments_substantive).**
4. **avoid [direct advocacy](https://www.reddit.com/r/canadapolitics/wiki/rules-thelongversion#wiki_4._avoid_direct_advocacy).**
5. **link submissions must be [about canadian politics and recent](https://www.reddit.com/r/canadapolitics/wiki/rules-thelongversion#wiki_5._link_submissions_must_be_canadian_and_recent).**
6. **post [only one news article per story](https://www.reddit.com/r/canadapolitics/wiki/rules-thelongversion#wiki_6._post_only_one_news_article_per_story).** ([with one exception](https://www.reddit.com/r/canadapolitics/comments/3wkd0n/rule_reminder_and_experimental_changes/))
7. **replies to removed comments or removal notices will be removed** without notice, at the discretion of the moderators.
8. **downvoting posts or comments**, along with urging others to downvote, **[is not allowed](https://www.reddit.com/r/canadapolitics/wiki/downvotes)** in this subreddit. bans will be given on the first offence.
9. **[do not copy &amp; paste the entire content of articles in comments](https://www.reddit.com/r/canadapolitics/wiki/rules-thelongversion#wiki_9._do_not_copy_.26amp.3b_paste_entire_articles_in_the_comments.)**. if you want to read the contents of a paywalled article, please consider supporting the media outlet.

*please [message the moderators](https://www.reddit.com/message/compose?to=%2fr%2fcanadapolitics) if you wish to discuss a removal.* **do not reply to the removal notice in-thread**, *you will not receive a response and your comment will be removed. thanks.*


*i am a bot, and this action was performed automatically. please [contact the moderators of this subreddit](/message/compose/?to=/r/canadapolitics) if you have any questions or concerns.*",liberals
gwvl9iw,2021-05-03T16:08:42.000-07:00,canada to ban international students confirmed by justin trudeau [removed],liberals
hjgqpnx,2021-11-05T06:49:13.000-07:00,"google warns liberals' online harms bill 'will result in the blocking of legitimate content' &gt; if google is scared of this law that's a good sign. these companies dont care about you.

that seems like a non-sequitor. the vast vast majority of canada doesn't care about you or i either. we are anonymous statistics to 99.99% of people. it doesn't imply that if they are concerned about a law, that we should automatically be for it.",liberals
hjgre35,2021-11-05T06:53:29.000-07:00,"google warns liberals' online harms bill 'will result in the blocking of legitimate content' &gt; would sometimes contain subliminal messages and were developed by psychologists, the government made that illegal. 

source for

1: it being illegal

and 

2: subliminal advertising actually being effective?

i was always under the impression was that the impact it had was not statistically significant. so if it is illegal, that actually says more about how the government can over-react to emotion rather than actual data.",liberals
hjgriyj,2021-11-05T06:54:23.000-07:00,google warns liberals' online harms bill 'will result in the blocking of legitimate content' [removed],liberals
hjgrt3s,2021-11-05T06:56:11.000-07:00,"google warns liberals' online harms bill 'will result in the blocking of legitimate content' &gt; now there’s enough less critical thinking people out there who continue to push the laisez faire attitude that free enterprise will look out for us and is all we need.

is this one of the \"issues being allowed to fester\"? is that issue something that you think this bill should target? if so, you see how i'm skeptical of this being much more than a political power play - using government power to restrict certain ideas.",liberals
hjgsjel,2021-11-05T07:00:50.000-07:00,google warns liberals' online harms bill 'will result in the blocking of legitimate content' and will you feel the same when a government you don't agree with gains power and uses this bill for their own purposes?,liberals
hjgst39,2021-11-05T07:02:33.000-07:00,google warns liberals' online harms bill 'will result in the blocking of legitimate content' nature is a reputable biology journal. i presume the person can't read science papers and exaggerate the results.,liberals
hjgtdjw,2021-11-05T07:06:10.000-07:00,"google warns liberals' online harms bill 'will result in the blocking of legitimate content' &gt; but i am very concerned about what i hear from many people whose opinions are formed online regarding vaccines, political ideology, eugenics, minorities rights, reconciliation etc.

whose opinion *isn't* formed online? it seems like you're confusing p(online | \"bad opinion\") with p( \"bad opinion\" | online). they're not the same thing. i assure you that throughout history there were some crazy opinions out there. the internet hasn't changed that - except perhaps to put you more in touch with those people and make you more aware of them.

i'll also note that some of your examples seem to be...differences in political opinion. that isn't \"disinformation\". that's just people who disagree with you.",liberals
hjgtp2a,2021-11-05T07:08:20.000-07:00,"in ‘a direct challenge’ to o’toole’s leadership, 15 to 30 tory mps and senators starting new caucus to speak up for anti-vaxxers losing jobs i totally agree, but i sort of feel o'toole is damned if he does and damned if he doesn't.  if he stands up to the anti-vaxxers, he essentially loses the \"freedom caucus\" and the extreme right/fundamentalist portion of the conservative party.

if he doesn't stand up to the anti-vaxxers, he completely loses any credibility as the \"rational face who believes in science leading the crazy people.\"

the main problem is that the conservative party has refused to accept that the world has changed around them. they are still more-or-less trying to sell the same bullshit they've been peddling for 40 years - less tax, privatize, the wealth will trickle down, and people are not really buying it anymore.  they have had internal white papers leaked that directly acknowledge \"our message does not attract young voters\" and \"our voters are old and dying out\", but rather than adapt to the new political climate they find themselves in, they have doubled down on their ideology and scrambled to accommodate further and further right-leaning individuals.

truly progressive conservatism has been sacrificed to appease the reformers and the christian far-right for decades now because neither group really has a chance at forming government if the vote is divided between them.",conservatives
hjgtyr4,2021-11-05T07:10:05.000-07:00,"google warns liberals' online harms bill 'will result in the blocking of legitimate content' why are we legislating something that is technologically impossible today? of course we should work on it, but we’re not there yet and our politicians seem to have a poor grasp on the technology.",liberals
hjgubht,2021-11-05T07:12:23.000-07:00,"google warns liberals' online harms bill 'will result in the blocking of legitimate content' this whole thing is fucking ridiculous, technically improbable, and stupidly invasive. i'm just going to automate a flagging system for every single post i can access on every platform until law enforcement is so overwhelmed with nonsense that they are paralyzed and cry to the government to stop this bullshit. i can't wait to flag every single one of you motherfuckers.",liberals
hjguipy,2021-11-05T07:13:41.000-07:00,"google warns liberals' online harms bill 'will result in the blocking of legitimate content' the problem is that now the government (or worse, the angry mob) is deciding what's true and what's false, and this is very dangerous territory for an allegedly free country, no matter how stupid the trumpists and vaxholes are.",liberals
hjguqau,2021-11-05T07:15:04.000-07:00,google warns liberals' online harms bill 'will result in the blocking of legitimate content' [removed],liberals
hjguqze,2021-11-05T07:15:12.000-07:00,"google warns liberals' online harms bill 'will result in the blocking of legitimate content' i don't understand your perspective. you think they're lying on the actual content of the bill? what do you think they are lying about?

the bill is right there in plain text, go read it. everything they say is in it, is.",liberals
hjgvvw4,2021-11-05T07:22:23.000-07:00,"google warns liberals' online harms bill 'will result in the blocking of legitimate content' this bill has nothing to do with corporations or antitrust. it will affect reddit and other small sites just as much as google, in fact moreso.",liberals
hjgx7c1,2021-11-05T07:30:49.000-07:00,google warns liberals' online harms bill 'will result in the blocking of legitimate content' this is very short sighted thinking.,liberals
hjgxlbw,2021-11-05T07:33:21.000-07:00,"flags on federal buildings to be raised before and after remembrance day how?  to any of that, how? trudeau said months ago that he was going to wait for feedback from first nations groups before raising the flag.  in the mean time we've had conversations about everything from what this gesture means, how we can recognize multiple bad things with symbolic gestures, and what reconciliation means. 

so how is this result different from the one they intended when the flags were first lowered?",liberals
hjgysi6,2021-11-05T07:41:02.000-07:00,"erin o’toole has been treed by his own party, and he can’t come down to talk pr would leave them in the wilderness unless the liberals or ndp chose to form a coalition with the cpc instead of each other. there aren’t enough rightwing voters in the country for them to form government with pr.

on the other hand, if there is a split than rightwing parties will support pr.",liberals
h0d70md,2021-06-02T07:52:10.000-07:00,"who was a worse pm? pt. 2 statistically, the bulk majority of this subreddit wasn’t even alive when mulroney was in office. it doesn’t surprise me that people are saying trudeau is worse, but i 100% agree that mulroney did more damage. 

30 years from now, i think trudeau will just be remembered as another shitty pm just like his father before him, but mulroney nearly split this country apart. his actions directly resulted in the creation of a parasitic province that milks billions of dollars from the west every year, while also holding them politically hostage. and this will likely never change without major reform.",liberals
h0d7fhq,2021-06-02T07:55:15.000-07:00,"how does justin trudeau maintain his position as pm after all the rhetoric he has pushed? my girlfriend thinks he is presentable and articulate. that’s about where most canadians end their voting decision.

it’s all based on feelings.",liberals
h0d8bg3,2021-06-02T08:02:04.000-07:00,"doug ford's pcs enter final year before election in the lead, but vulnerable &gt;stands now it seems like mostly a two-horse race between olp and ocp 

really? looking at [338 averages](https://338canada.com/ontario/) it very much looks like a three way race to me. the pcs have a narrow lead, with the ndp and olp roughly tied. the pcs would likely win if the election was held today, but it wouldn't take much movement for either the ndp or liberals to win.",liberals
h0d9g97,2021-06-02T08:10:44.000-07:00,"how the tories can gain traction after the cpc leadership race, in which all the contenders pledged to scrap the federal carbon tax, i was very concerned that it would take another election defeat before the cpc changed course. so i'm glad that o'toole has done a u-turn. (i'm still somewhat concerned that he may eventually get replaced by a climate hard-liner, as happened with doug ford replacing patrick brown.)",conservatives
h0dbd02,2021-06-02T08:25:42.000-07:00,"conservatives call on feds to end blood deferral for gay men do you think religious beliefs *are* just a simple choice, then, and shouldn't be constitutionally protected? i'm not sure what you're arguing for here.

just to be clear: i'm not religious and i think conversion \"therapy\" is a useless and harmful practice, and subjecting a child or non-consenting person to it should be illegal. but if a willing adult wants counseling from their religious leader about something they believe is a sin, i don't see why that's any of the government's business. i made my initial comment because the recent trend of people trying to shut down discussion by declaring \"\\[x\\] is a human right!\" annoys me.",conservatives
h0dclaj,2021-06-02T08:35:35.000-07:00,representatives of chinese dissident groups reject trudeau's comments on racism [removed],liberals
