hecp26j,2021-09-26T00:51:37.000-07:00,"prime minister justin trudeau urged to appoint female defence minister it's a little more nuanced in this case than just blindly adding diversity. a huge problem with the caf has been the culture of harassment and sexual assault against women, in fact that seems to be the biggest scandal facing the department of defense. the idea is that a woman, who might have personal experience with this kind of shit, would be more suited to deal with these sensitive issues.

karen mccrimmon would have been great. veteran and an all-around great mp from the ottawa area. sadly, she retired before the election and i dont know who would be a good replacement.

sajjan does need to go though, whether a man or woman replaces him, sajjan has handled his file poorly and trudeau needs to stop being so forgiving of ministers who bungle files...like keeping bernadette jordan despite her awful handling of fisheries, to the point that her constituents kicked her out",liberals
hliiswb,2021-11-20T22:49:41.000-08:00,"why the local election campaign is making a comeback as the article mentions - big data is key in politics these days.

the cpc used to have an advantage in this area for many years while they were in government. once trudeau, and more specifically katie telford, came along, the lpc took massive leaps in the data game (liberalist) and the cpc slowly started to neglect their data software (cims).

this really shows in those close ridings - where accurate data used properly can give you that tiny advantage to win over enough voters to claim the victory.

it’s one of the aspects of politics in the 21st century that i very much enjoy.",liberals
hlijugp,2021-11-20T22:57:37.000-08:00,maxime bernier mocking o'toole's support of a charity for woman who have suffered from domestic violence. he's not attacking conservatives he's attacking a liberal who couped the cpc and took control over it,conservatives
hliohmy,2021-11-20T23:31:51.000-08:00,maxime bernier mocking o'toole's support of a charity for woman who have suffered from domestic violence. damn.  he shoots he scores.,conservatives
hliopum,2021-11-20T23:33:30.000-08:00,"maxime bernier mocking o'toole's support of a charity for woman who have suffered from domestic violence. way to keep it classy, maxime.  why not go for the title and pick on disabled veterans next?",conservatives
h7r6aob,2021-08-04T11:57:54.000-07:00,"do you identify more with your country or your province? as a fellow albertan, i really felt the sting after the 2019 election, but i think it was the 2015 election that really did me in. when trudeau came out and said there's no such thing as canadian culture that was the end of it for me. i have this awesome 2014 winter olympics jacket that i used to love to wear, but i can't even look at it anymore.

i wouldn't say that my affinity for alberta changed all that much. i've always been very proud to be albertan and western, but what happened is as my feelings for canada died away, my sense of patriotism was taken up by my province and region.",liberals
h7r6krk,2021-08-04T12:00:09.000-07:00,"chris selley: liberals' fourth wave election push looks crazier by the day actually, i said you were using \"conspiracy theory\" level thinking. 

it's no different than jfk or 9/11 conspiracy theories where an ulterior government motive is inferred and spuriously connected to facts of the matter.   


that's \"conspiracy theory\" level thinking. that's what you're doing here, because there is no evidence of government manipulation, you've just made that up from whole cloth. 


&gt; what happened is what happened and it can't just be scrubbed away that easily.

you have no idea what happened. 


it's dishonest for you to say otherwise.",liberals
h7r6lo9,2021-08-04T12:00:20.000-07:00,lack of strong rival may hurt canada's trudeau in election shhh.. facts,liberals
h7r6mza,2021-08-04T12:00:37.000-07:00,ottawa denies alberta's request to let people carry pepper spray for self-defence you're being played like a fiddle by a desperate provincial conservative party staring down an election. i hope you can at least recognize why we're suddenly talking about the right of canadians to bear mace(lol) when it has *never* been a notable issue.,conservatives
h7r6wno,2021-08-04T12:02:46.000-07:00,"the secret to a successful growth agenda? don't talk about it | the hub well i hope this growth-focused party appears soon because the progressive conservative party, if it was growth-focused, has no idea what it's doing.",conservatives
h7r8n8o,2021-08-04T12:16:57.000-07:00,lack of strong rival may hurt canada's trudeau in election [removed],liberals
h7r9cv0,2021-08-04T12:22:49.000-07:00,"chris selley: liberals' fourth wave election push looks crazier by the day ... i know that reported covid numbers dissipated for the election, and then skyrocketed afterwards. if you believe in coincidences that's your thing. i don't.",liberals
h7rbl3l,2021-08-04T12:41:40.000-07:00,lack of strong rival may hurt canada's trudeau in election what? trudeau is still well-liked by a lot of canadians.,liberals
h7rcc0t,2021-08-04T12:48:10.000-07:00,"ottawa denies alberta's request to let people carry pepper spray for self-defence &gt; it's about whether or not someone has a right to self defense and the liberals have been very clear that they'd rather have a woman be raped than have a non lethal means of defending herself.

i understand your point but obvious counterpoint is that normalizing pepper spray will mean assailants and attackers will almost certainly be guaranteed to have pepper spray and *everyone* will be forced to carry their own and also constantly be wary",liberals
h7rcnef,2021-08-04T12:50:50.000-07:00,lack of strong rival may hurt canada's trudeau in election where are you getting this 1% from?  the only one i can see in the article is 1% said they were too lazy to vote.  honest questing because im not sure which survey this is and im on the ledger site to read for myself.,liberals
h7rd09e,2021-08-04T12:53:57.000-07:00,"canada's moral panic no, there are no laws against misinformation. if trudeau has his way there soon will be but it will only apply to misinformation they don't like. also information they don't like. 

but yes - this is mostly media manipulation. it used to be \"if it bleeds it leads\". but there's been insufficient bleeding. where as once newspapers were content to publish a handful of stories once a day 6 days a week to be profitable,  they now need people clicking on 'the latest' dozens of times a day, 24 hours a day 7 days a week.  for that - they've got to 'create' news stories and feed them for as long as the cycle holds. 

so now it's \"we fix till they clicks\". alter, dress up, twist, edit, falsify until it's interesting and shocking. there's dozens of examples especially from the states where the story was actually deliberately altered. only the most shocking terms are used.  in fact it was the first nations who told reporters to stop using the term 'mass graves' as it was misleading. 

this was nothing from the start. everyone knew the gravesite was there. the first nations knew about it when the school was decomissioned but didn't ask to come care for it or for the bodies to be returned or anything. now the bodies have been 'discovered' - right where we knew they were all along. bodies of kids who died of natural causes at about the same rate as they would have at the reserves. 

yet somehow we're not outraged in the slighest over the fact that first nations kids were genuinely used for horrific medical experiments in the 40's and 50's in saskatchewan with the full knowlege of the gov't. guess it doesn't have the same 'scale' as it was only a few schools.",liberals
gxgxoku,2021-05-08T15:44:30.000-07:00,"trudeau should join biden in rejecting suffocating ‘trickle-down’ economics literally the entire gta has been priced out. houses in burlington are on average $1 million, with even hamilton close behind at $750,000. both of those cities increased by $200,000 from the previous year. it is a death spiral that will pop.",liberals
gxgxvqq,2021-05-08T15:47:04.000-07:00,trudeau should join biden in rejecting suffocating ‘trickle-down’ economics the solution is still to build more in higher densities.,liberals
gxgy97x,2021-05-08T15:51:51.000-07:00,"trudeau should join biden in rejecting suffocating ‘trickle-down’ economics so what, land leeches can snag them to flip them or rent them out? nobody has fucking money my dude, who is capable of comfortably buying a house at like $40,000-60,000/yr income, when it’s valued at $700,000-1,000,000(or more)? 

it’s not supply, it’s the lack of competition among prospective first time home buyers. of course a house that doubled in value in 2 years is gonna sell in a week, because it has to do the same in 2 years right??? no it’s gonna pop and countless thousands to millions of canadians will be rendered destitute seemingly overnight. people aren’t buying these houses to live in, they’re buying them to get a free ticket to earlier retirement.",liberals
gxgzf0n,2021-05-08T16:07:25.000-07:00,"trudeau should join biden in rejecting suffocating ‘trickle-down’ economics if prices are going up the mechanism can make it worse but there is a clear demand to live in the center of cities and a clear zoning issues making that hard. if demand met supply the prices would only go up with inflation regardless of the mechanics of sales. the absurd mechanics are a symptom of a difference in demand and supply. do you think anyone would tolerate it if there wasn't any demand.

&gt; people aren’t buying these houses to live in, they’re buying them to get a free ticket to earlier retirement.

if that were true, then they'd be empty. but vacancy taxes raised almost no money because it wasn't the case. speculation isn't good for something like homes but fundamentally it exists because there is strong demand and limited supply. if supply met the demand the other nonsense would be much more difficult. if you want to see a market that hit that equilibrium, check out tokyo. homes are not seen as a investment and despite strong demand for people piling into tokyo and one of the reasons is the municipality makes it very easily to build. nimby lobbies are never consulted and can't force a development to stop. the city planners just set general guidelines and evaluate if the developer met them, including earth quake proofing. 

it always circles back to supply and demand. all the shenanigans and boomers with 4 investment properties is because of the shortfall in supply guaranteeing them a profit. you can't have these issues if supply matched demand. if you demand some ridiculous blind bid system, they'll just move into the new development without that. shenanigans only possible because demand is high and supply is low.

i'm not sure why so many refuse to believe it's a supply issue when the pricing heavily implies this is the case.",liberals
gxh0f9z,2021-05-08T16:21:22.000-07:00,"trudeau should join biden in rejecting suffocating ‘trickle-down’ economics you’re right that anti-abortion policies aren’t in rural people’s’ interests, but it id most definitely what they want. like, it’s surreal driving through some of those areas and seeing what signs are posted",liberals
gxh1ske,2021-05-08T16:40:39.000-07:00,"canada’s mining industry is spreading havoc around the world — with justin trudeau’s support &gt;that probably has more to do with american's pretending to be canadians,  especially when you consider that those same people you claim to not like us keep moving up here to live.

i swear our entire national identity is \"not american\". i'm afraid this wild stab in the dark isn't accurate - the phenomenon i'm talking about has nothing to do with the personality of tourists and everything to do with the history of our government and our industry. i have spoken directly to indigenous folks in guatemala who have had their land and their livelihood ruined by canadian mining companies.

&gt;believe it or not, there are plenty of people down there who appreciate the economic windfall that occurs when you have major industry in an area.

oh gee i wonder who those people are.",liberals
gxh2srb,2021-05-08T16:54:56.000-07:00,"trudeau should join biden in rejecting suffocating ‘trickle-down’ economics you're going to accuse me of 'gaslighting' and then simultaneously, apparently deliberately, conflate the global total with canada?

by the way, 'rough estimates based on crude calculations ' means they're making it up, it's bullshit.",liberals
gxh378r,2021-05-08T17:00:52.000-07:00,"trudeau should join biden in rejecting suffocating ‘trickle-down’ economics it's also perfectly legal, and designed to work that way, those loopholes were out there deliberately by our own government for a reason.

taxes do not increase wages, that is an *insane* belief.

no government program is going to increase income for regular people, that's not how any of this works unless it's a direct wealth transfer.

1. the cost of living has objectively not outstripped earnings.

2. the government cannot control the cost of living or your wages.

3. planned economies never work comrade.",liberals
gxh3gls,2021-05-08T17:04:38.000-07:00,"trudeau should join biden in rejecting suffocating ‘trickle-down’ economics yes, the cost of housing is included, it is perhaps the most important factor - why wouldn't it be included?

the chapwood index is absurd, and no one takes it seriously.",liberals
h1laasp,2021-06-12T14:54:33.000-07:00,"the inside story of how the liberals lured a green mp and raised justin trudeau’s election hopes &gt;i think my broader point is really that voting records are not really a reflection of the quality of an mp.

man i literally already said “what does voting the party line or not have to do with being a good mp?” you’re preaching to the choir here bud.

i do agree that the ndp put themselves on a pedestal. but so does every other party. i still think their mps are generally more in politics for helping people than the mps from other parties are even if i have my policy differences with the ndp and i think their organization is weak and incompetent.",liberals
h1lb1kw,2021-06-12T15:03:44.000-07:00,"atwin blames her departure from green party on leader my experience these days is when progressives talk about 'socialism' what they're really talking about is social democracy, and when conservatives talk about socialism what they're really talking about is anything left of conservative.",conservatives
h1lboc8,2021-06-12T15:11:26.000-07:00,trudeau calls for concerted g7 approach to china: source [removed],liberals
h1lc5dq,2021-06-12T15:17:14.000-07:00,"the inside story of how the liberals lured a green mp and raised justin trudeau’s election hopes in my defense, i came into this conversation 3 beers deep and haven't improved my standing since ;) but fine and fair enough about the ndp, i see your points and fully agree that the limitations of governance does weaken the position of the ndp. maybe that's why they get to me so much. the few instances they have of governance have convinced me they would be more or less the same as the liberals, but at least the liberals aren't so preachy about it.",liberals
h1ldep4,2021-06-12T15:32:04.000-07:00,"chris selley: there is no principle that ottawa won't readily abandon simply to appease quebec the legislation isn't even news btw.

this current news cycle seems desperate.

so... incoming election?

it will be a lib majority.  eot has been quite ineffective.  so has jag.  and now the greens have folded too.

trudeau kept a government despite way more active opposition, far bigger scandals in snc and years-late blackface.  so why would this complete non-story in any way affect him?

i mean, you're kidding right?  probably.",liberals
h642wsq,2021-07-21T20:54:58.000-07:00,"former dartmouth south candidate says liberals dropped her over 'boudoir' photos - 'when i was told to step down, i was asked to blame myself,' robyn ingraham says in social media post not only is there nothing wrong with what she did, the way the liberal party told her to quit is kind of disturbing.

&gt;\"when i was told to step down, i was asked to blame myself.....but ingraham said the liberal party had offered her two prewritten statements to choose from, which she then posted to her own social media accounts that saturday.

so not only did they ask her to lie, they went ahead and wrote the lies up for her. i guess this party only supports women's rights when they agree with them. 

there are two types of people in this world, those who view porn and those who lie and say they don't. the same people telling her she can't represent the party for some photos showing off her tattoos, and are judging her for what she did are the same people that view pornography themselves.",liberals
h643ur3,2021-07-21T21:07:10.000-07:00,"canadians see ndp's singh as a better pm than tories' o'toole, leger survey suggests [removed]",conservatives
h644aem,2021-07-21T21:12:42.000-07:00,liberals promise to boost number of parents and grandparents sponsored to canada [deleted],liberals
h645q1q,2021-07-21T21:30:18.000-07:00,"former dartmouth south candidate says liberals dropped her over 'boudoir' photos - 'when i was told to step down, i was asked to blame myself,' robyn ingraham says in social media post i'm getting flashbacks to kim campbell.

i'm thinking ingraham probably showed more skin than campbell, but the principle is the same. a woman in politics, is being shamed for expressing her sexuality. even worse for the ns liberals, is that they were told about this in advance, but only just now, dropped ingraham over a non-scandal.

i'm also annoyed by the fact that she initially went a long with their lie, rather than standing her ground and insisting on being fired.

the truly sad thing, is that come voting day, this won't even be a memory, and the next candidate with lewds on the internet will likely see themselves coerced out of politics.",liberals
h647jpc,2021-07-21T21:51:02.000-07:00,"former dartmouth south candidate says liberals dropped her over 'boudoir' photos - 'when i was told to step down, i was asked to blame myself,' robyn ingraham says in social media post if it was such a problem i don't know why they even let her become acclaimed in the first place. was it that hard for them to find a candidate in dartmouth south? this was a very winnable seat and i don't know if that's the case anymore for the nova scotia liberals. 

absolutely awful if what she's saying is true, but i hate to say that i'm not altogether surprised. this shouldn't be a major issue, not nowadays. i'm sure there's a bunch of crooked old nans who have their thumb on portions of the party and like to exert it when they think somethings wrong, but this makes the nova scotia liberals look really unprofessional and out of touch with a large portion of younger voters. shame on the nova scotia liberals for reacting so poorly to a situation they were well aware of would happen.",liberals
h647rcu,2021-07-21T21:53:21.000-07:00,"former dartmouth south candidate says liberals dropped her over 'boudoir' photos - 'when i was told to step down, i was asked to blame myself,' robyn ingraham says in social media post [removed]",liberals
h648pz8,2021-07-21T22:03:53.000-07:00,"former dartmouth south candidate says liberals dropped her over 'boudoir' photos - 'when i was told to step down, i was asked to blame myself,' robyn ingraham says in social media post [removed]",liberals
ho7h7zb,2021-12-11T12:09:50.000-08:00,"no matter how far o'toole shifts to the left, people will still find an excuse to not vote conservative (r/ontario thread in this image) “as long as there is diversity of opinion in the conservative party, i’ll keep voting liberal”.

many liberal voters are most ignorant narcissists you’ll ever run into.

remember you can’t argue with someone who thinks their opinions are fact, their policies are salvation and their leaders are beyond criticism.",conservatives
ho7hfla,2021-12-11T12:11:41.000-08:00,"o’toole’s plummeting popularity shows cpc must move on isn't it just logical though for a conservative party to actually be conservative? let them be conservative and let the voting populace then decide. if it means they will get less seats next time, that's exactly why we have a democracy.",conservatives
glgp21a,2021-01-30T16:41:35.000-08:00,"strategists say erin o'toole must weigh if jason kenney is an asset or a liability &gt; ah, always code for tax breaks for the rich.

i know where you are coming from here:  often times the extent of the simplification that is on offer is to reduce the number of tax brackets by eliminating the top one or two brackets.  that isn't the kind of simplification that interests me, or you it seems.

but once in a while there are plans to genuinely simplify the tax system while still maintaining the progressive nature of the existing system.  i believe that this second simplification is what the other comment is aiming for.",conservatives
glgpa5x,2021-01-30T16:45:02.000-08:00,sean speer: the struggle for the moral foundations of the conservative party i don't get why recreating the old pc party wouldn't be successful again.  thoughts?,conservatives
glgpfo4,2021-01-30T16:47:24.000-08:00,strategists say erin o'toole must weigh if jason kenney is an asset or a liability [removed],conservatives
glgpn8o,2021-01-30T16:50:41.000-08:00,"sean speer: the struggle for the moral foundations of the conservative party &gt; these polling numbers must be disappointing: they’re a considerable distance from the level of support that the party ultimately needs to win an election. the conservative party remains in an elusive search for roughly a million or 1.5 million more votes, mainly concentrated in central canada.

&gt; this persistent voter gap, which was expressed in the 2015 and 2019 election outcomes, and probably even before then, has led to renewed questions about the arguments and ideas that should animate conservative politics. there’s a subtle yet important intraparty debate happening about what conservatives ought to be saying and doing to reach these incremental voters and break out of the electoral trap that keeps them mired in opposition.

it is true that one way of looking at this problem is to try to identify how to acquire about 1.5 million voters.

an alternative way to get the cpc vote share back up to the high 30s is to attempt to get current lpc voters to either stay home, or to switch alleigance to the ndp.  it worked before, back in 2011.",conservatives
glgq0ps,2021-01-30T16:56:25.000-08:00,"sean speer: the struggle for the moral foundations of the conservative party depends what their platform is, really. i think the general thinking in the cpc is that the old pc party won't include social conservatives, and most of the time that will mean that they're not viable.",conservatives
glgrdrl,2021-01-30T17:18:12.000-08:00,"manitoba ndp's wab kinew gets 93% support in leadership review conservatives play on a different difficulty level. something about liberal capitalist societies causes progressives to be held to unrealistically ideal standards while conservatives are allowed to be liars and cheats and corrupt and get the benefit of the doubt.

its probably because deep down the progressive goals are hostile and the conservative ones amenable to the status quo so its just the biases that play into the uneven way people evaluate politicians.",conservatives
glgs9y2,2021-01-30T17:32:45.000-08:00,"strategists say erin o'toole must weigh if jason kenney is an asset or a liability if the idea was to have a smart strategy, then the platform might be smart as well. 

but it’s not.",conservatives
glgsk8m,2021-01-30T17:37:22.000-08:00,"strategists say erin o'toole must weigh if jason kenney is an asset or a liability i, for one, am surprised that a fossil fuel lobbyist like kenney would sign over more land for the industry to rape and pillage. 

who could have possibly predicted he would do that?

it’s completely opposite the kind of person i would’ve guessed him to be. 

it’s so hard to really see the true nature of a public figure these days.

i feel for people who turned off their brains and closed their eyes when they voted, when the put stickers on their trucks, when they ignored the entire global oil economy, when they were suckered in by such an obvious lying asshole. 

it’s so hard to know the truth.",conservatives
ho325sw,2021-12-10T13:01:07.000-08:00,ontario premier doug ford invites justin trudeau to summit on housing affordability | globalnews.ca [removed],liberals
ho35230,2021-12-10T13:27:59.000-08:00,"[deleted by user] &gt;\"minority governments only last two years.\"

- justin trudeau",liberals
ho36hie,2021-12-10T13:41:55.000-08:00,"tories' war against independent boundary commissions is spurious even if it's \"just\" to scare up donations, they're convincing their party faithful / base that they're victims of having redistricting used against them. which means they've got people primed to believe that turnabout is fair play if/when the conservatives are in power the next time boundaries need to be redrawn. i guess we have to hope the people in control of the party at that time don't forget they made it all up.",conservatives
hfns7uc,2021-10-06T08:33:01.000-07:00,"trudeau says tofino vacation was a ‘mistake’ not sure what point you think you are making here.

elected officials at all levels of government participate in events that aren't days off all the time.",liberals
