hpf3i24,2021-12-20T20:53:29.000-08:00,"pent-up tory frustration leads to ‘bloodbath’ on the caucus floor and not just that he proverbially shot anyone who opened their mouth and made a scene. then you get scheer who pretty much was a card-carrying american trying to inject gop policies into the country but did not have a clue how to not yell \"anything but that\" when the government did something. now you have o'toole who is trying to keep the angry socons happy along with the rabid anti-vaxxers/maskers, then toss on the climate change deniers while trying to yank the party back to the center and make it look realistic. i kinda don't blame the guy for having issues but i will say i think he is correct in that if the cpc stays where it has been for the past 30 years (going back to reform/alliance days) the party will never win office for any duration of time.",conservatives
hpf4m0s,2021-12-20T21:04:42.000-08:00,pm trudeau hopes 2022 will be the year canada can leave the pandemic behind [removed],liberals
hpf8d92,2021-12-20T21:39:41.000-08:00,"federal liberals slash criminal pardon application fee to $50 as of new year ###this is a reminder to [read the rules before posting in this subreddit](https://www.reddit.com/r/canadapolitics/wiki/rules-thelongversion).
 
1. **headline titles should be changed only [when the original headline is unclear](https://www.reddit.com/r/canadapolitics/wiki/rules-thelongversion#wiki_1._headline_titles_should_be_changed_only_where_it_improves_clarity.)**
2. **be [respectful](https://www.reddit.com/r/canadapolitics/wiki/rules-thelongversion#wiki_2._be_respectful).**
3. **keep submissions and comments [substantive](https://www.reddit.com/r/canadapolitics/wiki/rules-thelongversion#wiki_3._keep_submissions_and_comments_substantive).**
4. **avoid [direct advocacy](https://www.reddit.com/r/canadapolitics/wiki/rules-thelongversion#wiki_4._avoid_direct_advocacy).**
5. **link submissions must be [about canadian politics and recent](https://www.reddit.com/r/canadapolitics/wiki/rules-thelongversion#wiki_5._link_submissions_must_be_canadian_and_recent).**
6. **post [only one news article per story](https://www.reddit.com/r/canadapolitics/wiki/rules-thelongversion#wiki_6._post_only_one_news_article_per_story).** ([with one exception](https://www.reddit.com/r/canadapolitics/comments/3wkd0n/rule_reminder_and_experimental_changes/))
7. **replies to removed comments or removal notices will be removed** without notice, at the discretion of the moderators.
8. **downvoting posts or comments**, along with urging others to downvote, **[is not allowed](https://www.reddit.com/r/canadapolitics/wiki/downvotes)** in this subreddit. bans will be given on the first offence.
9. **[do not copy &amp; paste the entire content of articles in comments](https://www.reddit.com/r/canadapolitics/wiki/rules-thelongversion#wiki_9._do_not_copy_.26amp.3b_paste_entire_articles_in_the_comments.)**. if you want to read the contents of a paywalled article, please consider supporting the media outlet.

*please [message the moderators](https://www.reddit.com/message/compose?to=%2fr%2fcanadapolitics) if you wish to discuss a removal.* **do not reply to the removal notice in-thread**, *you will not receive a response and your comment will be removed. thanks.*


*i am a bot, and this action was performed automatically. please [contact the moderators of this subreddit](/message/compose/?to=/r/canadapolitics) if you have any questions or concerns.*",liberals
hpfa7u6,2021-12-20T21:55:27.000-08:00,"as americans become more polarized politically, canadians are converging toward the centre, poll finds i’m not trying to “disprove it.” they said we set an example for progressivism. i’m highlighting a really important area where we are failing heavily and where the liberals are not sufficiently progressive. saying “yeah, but we’re still progressive overall” doesn’t mean that we’re progressive enough.",liberals
h42ddnq,2021-07-04T07:34:18.000-07:00,trudeau not committing to timeline for independent military sexual misconduct system [removed],liberals
h42dkip,2021-07-04T07:35:58.000-07:00,"canadians want governments working harder on indigenous reconciliation: usask researcher fact is that the most effective aspect of the atlantic canadian strategy has been to reduce cross pollination of the virus by restricting border traffic (which is a charter violation if it weren’t for the “reasonable” clause of section one), and only provinces with choke points that can institute a policy like that even had it as an option.

but the existence of those natural boundaries without a mechanism to utilize them in crisis would be a shame.

there’s no reason a unitary federal government couldn’t make use of those natural boundaries though. i suspect if the federal government had full jurisdiction, stricter internal measures would have been adopted earlier and the virus would have been controlled better nationally - although it still kept managing to slip through the cracks internationally. it took way too long to institute the half measure that was the short term hotel quarantine.

however: let me put this hypothetical out there as a reason for the continued existence of provincial governments. would a scheer government, without provincial governing opposition, have been better or worse nationally? in particular for those places that weathered the storm well?

the answer is an overwhelming no.

uneducated stephen harper would have followed the playbook of “if scientists say something that hurts the economy, even if they are right we should be shutting them out of politics”.",conservatives
h42escr,2021-07-04T07:46:38.000-07:00,"politicians could’ve worked ‘better’ on conversion therapy ban, says 1st openly gay tory mp yep. he's one of very few conservatives i'd vote for. in fact i did vote for him when he ran for leader.",conservatives
h42ficb,2021-07-04T07:53:05.000-07:00,"politicians could’ve worked ‘better’ on conversion therapy ban, says 1st openly gay tory mp how are they working \"very hard\" to oppose it? their leadership supports the conversion therapy ban. and even though only 42% of them voted in favor of the ban that's still enough support that combined with opposition parties (even if tories had a hypothetical majority) would ensure such a ban takes place. 

all the tories are doing is letting the social conservatives in their party speak their mind rather than censoring them. they are otherwise working in favor in lgbt rights. they're working to reform their party. ambrose marched in gay pride parade as intern leader, scheer was a dud but o'toole is pro gay rights.",conservatives
h42fszi,2021-07-04T07:55:45.000-07:00,"i’m extremely nervous i’m not really sure, i’m not religious and i think issues like abortion and immigration are stupid hills to die on. i just hate seeing our entire country cheering for more taxes and more “woke” culture and wish that our government would do stuff for the average person about stuff like the artificially increased cost of gas/living, housing prices skyrocketing and cell phone companies absolutely hosing us. i have seen no benefit from the liberals in power and it feels like i am just viewed as a form of income for the government and nothing more.",liberals
h42gjrh,2021-07-04T08:02:27.000-07:00,"politicians could’ve worked ‘better’ on conversion therapy ban, says 1st openly gay tory mp &gt;when is this guy going to realize he belongs to the wrong party.

if you can't beat them join them. clearly he feels better represented by the conservatives on other views than the other parties. you can't paint people in this black and white view of left vs right.

all major parties in canada are a coalition of views as was necessary to win elections in fptp.

the conservatives are a merger of the reformist and the progressive conservatives. it's a joint venture of fiscal conservatives and social conservatives, the center-right and the right. much as the ndp is a joint venture of social democrats and democratic socialists, the center-left and the left.",conservatives
h42gqbe,2021-07-04T08:04:06.000-07:00,"politicians could’ve worked ‘better’ on conversion therapy ban, says 1st openly gay tory mp he is the cpc and he is the caucus, just as much as each and every individual cpc member is. he is of the same value, his words of the same weight.

you explicitly said, \"when is this guy going to realize he belongs to the *wrong party*\". as if it's somehow his fault. as if he should find and join the *correct party*.

no one party is the exclusive or ultimate voice for lgbtq2s+ issues. right now, the conservatives are openly fighting for lgbtq2s+ rights, and this man wishes to be a part of their party. and clearly, considering he is a sitting fucking member of their caucus, he's welcome.",conservatives
h42grfe,2021-07-04T08:04:23.000-07:00,"politicians could’ve worked ‘better’ on conversion therapy ban, says 1st openly gay tory mp well this mp is advocating/representing one the most marginalized communities there is.... a gay conservatives.",conservatives
h42ia36,2021-07-04T08:18:06.000-07:00,"politicians could’ve worked ‘better’ on conversion therapy ban, says 1st openly gay tory mp &gt; right now, the conservatives are openly fighting for lgbtq2s+ rights

...?",conservatives
h42ji9q,2021-07-04T08:29:18.000-07:00,"politicians could’ve worked ‘better’ on conversion therapy ban, says 1st openly gay tory mp &gt; all the tories are doing is letting the social conservatives in their party speak their mind rather than censoring them.

yes, and therein lies the issue.

it puts lgbt equality on the list of topics that are still considered acceptable discourse, issues that are still up for debate. as much as people love to furiously crank off to this idealized, \"anything goes\" form of free speech, we as a society have pretty clearly decided there are some topics that are utterly unacceptable to have debates on and should be shut down at the first opportunity. i dare say you wouldn't see \"well, they're just speaking their mind :)\" if the topic in question were, say, \"i think canada should do a genocide, just like, for funsies\". that's obviously a rather extreme example, but there's extremely good reasons why many people refuse to even entertain the idea of a leader who thinks whether or not they're human is a topic that should be up for discussion.",conservatives
h42jx2a,2021-07-04T08:33:05.000-07:00,"senator proposes plan to get conversion therapy bill passed this summer | cbc news literally two comments above is a breakdown of how the party voted - a majority of mps voted against the bill. 

i agree o'toole would whip in favour of the bill if the cpc whipped on bills where social conservatives are put of step with the rest of the country, though. but that would probably make the cpc explode.",conservatives
h42k0sk,2021-07-04T08:34:03.000-07:00,"338canada: the conservatives keep falling behind they all had potential, some more than others. the conservatives just seem to struggle to know when to let things settle and work on another issue while you wait for more info and when to really dig in. 

my guess is the cpc focus too much on how issues radiate with their base  and less what canadians as a whole feel. thus folks see things as exactly as you say - the boy who cried wolf.",conservatives
h42k0y0,2021-07-04T08:34:05.000-07:00,"338canada: the conservatives keep falling behind they all had potential, some more than others. the conservatives just seem to struggle to know when to let things settle and work on another issue while you wait for more info and when to really dig in. 

my guess is the cpc focus too much on how issues radiate with their base  and less what canadians as a whole feel. thus folks see things as exactly as you say - the boy who cried wolf.",conservatives
h42k780,2021-07-04T08:35:43.000-07:00,"senator proposes plan to get conversion therapy bill passed this summer | cbc news a majority of the mps *didn't*. i've always disagreed with the cpc position of acting like they could \"neutrally\" ally with people who hate us and still act like the party isn't anti-lgbt, but there was a time that i still thought that social conservative policies were minority positions in the party. then we had the abortion vote, and the conversion therapy vote, and o'toole's failed climate change vote.

he's not leading his party.",conservatives
h42kcdb,2021-07-04T08:37:05.000-07:00,"politicians could’ve worked ‘better’ on conversion therapy ban, says 1st openly gay tory mp the members who voted against that bill have made it clear that their votes weren't about \"torturing children\". they were objecting to the loose wording of the bill, which is a whole separate issue.

the liberals would like to play it up as being homophobic, obviously. but really, they're just concerned about parents' rights to parent.",liberals
h42kofc,2021-07-04T08:40:14.000-07:00,"politicians could’ve worked ‘better’ on conversion therapy ban, says 1st openly gay tory mp the members who voted against that bill have made it clear that their votes weren't about \"torturing children\". they were objecting to the loose wording of the bill, which is a whole separate issue.

the liberals would like to play it up as being homophobic, obviously. but really, they're just concerned about parents' rights to parent.",liberals
h42l57p,2021-07-04T08:44:38.000-07:00,"politicians could’ve worked ‘better’ on conversion therapy ban, says 1st openly gay tory mp &gt; how are they working \"very hard\" to oppose it?


when it comes to the federal vote on bills pertaining to lgbtq rights the record is unambiguous. conservative parties have *consistently* opposed bills that support and/or enshrine lgbtq persons with the same rights, freedoms and protections as their fellow canadians.


bill c-33, majority opposed by conservatives, affirmed by all other parties. 


bill c-38, majority opposed by conservatives, affirmed by all other parties. 


bill c-250, majority opposed by conservatives, affirmed by all other parties. 


bill c-16, majority opposed by conservatives, affirmed by all other parties.


bill c-6, majority opposed by conservatives, affirmed by all other parties.


let me be clear, ***all*** attempts to ratify lgbtq persons with the same rights, freedoms and protections as the rest of canadians have been opposed by conservative parties. that record speaks for itself. 



[conservative voters are consistently polled as less tolerant over a spectrum of lgbtq issues](https://public.tableau.com/profile/tim.renshaw#!/vizhome/lgbtpart2/story1). this is about as banal of a fact as we get, anti-lgbtq persons are more likely to support the conservative party and there's a reason for that.  


[candidates and veteran mps are among the conservatives who have spoken against the right and freedoms of lgbtq canadians](https://pressprogress.ca/8-conservative-candidates-who-made-disturbing-homophobic-statements-and-promoted-anti-lgbtq-hate/).      


when it comes to anti-lgbtq statements we can rely on one party (the cpc) above all others, to produce candidates and members of parliament who take vocal stances against their fellow canadians. 


again, it is an utterly banal fact that federal and provincial conservative parties are routinely and consistently the majority opposition to lgbtq rights and freedoms. this is not a controversial statement, it is a factual one.



o'toole can say he's \"pro gay rights\" until he's blue in the face. is he attending pride parades? nope. he can't even make the most basic of meaningless pandering moves. he certainly cannot whip the party into showing support where it means something, the vote. 


**the cpc is not pro lgbt, they are anti-lgbt.** the record is factual and quite frankly speaks for itself.",conservatives
h6q8ykx,2021-07-27T03:21:55.000-07:00,"trudeau says ottawa withholding ‘millions of dollars’ from n.b. over abortion access they should make that 100's of millions, that would get some change pretty quick and would honestly be an easy win for them. more importantly it's 2021, and all women and people with a uterus should have easy access to important healthcare services. new brunswick women/trans people have to travel to another province to have an abortion, it is ridiculous and should be stopped immediately. put in another way, 51% of the entire population of that province are actively having their charter rights violated",liberals
h6q8zc9,2021-07-27T03:22:04.000-07:00,trudeau ‘deeply disappointed’ after habs draft logan mailloux despite sexual image charge [removed],liberals
h6q8zfa,2021-07-27T03:22:05.000-07:00,trudeau joins chorus blasting montreal canadiens for drafting player who violated woman's consent [removed],liberals
h6q90u1,2021-07-27T03:22:22.000-07:00,"n.s. progressive conservatives promise publicly-funded universal mental health care if elected i certainly don’t know the history here, but this is a striking idea. imagine a canada where this is covered… and pharmacare… and dental and vision…",conservatives
h6q9d39,2021-07-27T03:24:50.000-07:00,trudeau ‘deeply disappointed’ after habs draft logan mailloux despite sexual image charge pretty sure the players are more concerned about being drafted and not how many stories are written about it.,liberals
h6q9iic,2021-07-27T03:25:54.000-07:00,"trudeau ‘deeply disappointed’ after habs draft logan mailloux despite sexual image charge &gt;with a long record of inclusivity and social justice

how does a 17-year old hockey player to that? 

did trudeau 2.0 accomplish all that by the time that he was 18? or was it instead the case that he committed his transgressions when much older than that, and he was granted decades thereafter to clean up his sh\\*t and to try to put this odious stuff behind him?",liberals
h6q9mw0,2021-07-27T03:26:46.000-07:00,trudeau joins chorus blasting montreal canadiens for drafting player who violated woman's consent [removed],liberals
h6q9r6y,2021-07-27T03:27:36.000-07:00,trudeau ‘deeply disappointed’ after habs draft logan mailloux despite sexual image charge [removed],liberals
h6q9ro1,2021-07-27T03:27:42.000-07:00,trudeau joins chorus blasting montreal canadiens for drafting player who violated woman's consent rule 6,liberals
h6q9rr9,2021-07-27T03:27:43.000-07:00,"n.s. progressive conservatives promise publicly-funded universal mental health care if elected &gt;imagine a canada where this is covered… and pharmacare… and dental

don't forget eye care! i really liked the federal ndp's \"head to toe\" expression. it really should all be covered, the current exceptions don't make sense.",conservatives
h6q9yr7,2021-07-27T03:29:06.000-07:00,trudeau ‘deeply disappointed’ after habs draft logan mailloux despite sexual image charge [removed],liberals
h6qa5ut,2021-07-27T03:30:29.000-07:00,"trudeau says ottawa withholding ‘millions of dollars’ from n.b. over abortion access i completely agree however a significant cut to provincial health funding during a global pandemic is a really *really* bad idea.  

new brunswick is going green  this saturday signalling the end of the pandemic so the gears can really be put to higgs now.",liberals
h6qa6fm,2021-07-27T03:30:36.000-07:00,trudeau ‘deeply disappointed’ after habs draft logan mailloux despite sexual image charge [removed],liberals
h6qaa79,2021-07-27T03:31:21.000-07:00,trudeau ‘deeply disappointed’ after habs draft logan mailloux despite sexual image charge rule 2,liberals
h6qaei2,2021-07-27T03:32:13.000-07:00,trudeau ‘deeply disappointed’ after habs draft logan mailloux despite sexual image charge rule 3,liberals
h6qat2q,2021-07-27T03:35:07.000-07:00,trudeau ‘deeply disappointed’ after habs draft logan mailloux despite sexual image charge [removed],liberals
h6qat52,2021-07-27T03:35:08.000-07:00,"n.s. progressive conservatives promise publicly-funded universal mental health care if elected that would be great. but how are they paying for it? i'm not from ns anymore but i've heard complaints about healthcare as it is. again, great idea, just wonder how it would work.",conservatives
h6qaw77,2021-07-27T03:35:44.000-07:00,"trudeau says ottawa withholding ‘millions of dollars’ from n.b. over abortion access &gt; new brunswick women/trans people have to travel to another 
&gt; province to have an abortion

new brunswick offers abortions at three of its hospitals. why would anyone seeking one have to leave the province?",liberals
h6qaz5l,2021-07-27T03:36:20.000-07:00,"n.s. progressive conservatives promise publicly-funded universal mental health care if elected amen. vision is so bizarre. i have no idea what blackmail luxotica must hold over every nato country, but they way we let them fleece our citizens on glasses is insane.",conservatives
h6qb08e,2021-07-27T03:36:32.000-07:00,"338 canada update: lpc 164 (35.1) cpc 106 (28.5) ndp 37 (19.9) bq 29 (7.1) gpc 1 (5.8) ppc 0 (2.5) when trudeau was first elected in 2015 bc and toronto already had a housing crisis. wasn't a priority for the feds and nothing happened. now after two terms we have a canada wide housing crisis and still really timid non-action from the feds. 

they don't care about this issue and everything from them is pretty much performative stuff, or stuff purely geared toward keeping people from becoming homeless.

there's clearly no real interest in making housing more affordable for renters or first time home buyers.  


if you want housing to become more affordable, this incumbent government is not the one to support.",liberals
h6qbbut,2021-07-27T03:38:49.000-07:00,only half of one per cent of new covid-19 cases are in fully vaccinated: trudeau [removed],liberals
h6qbeht,2021-07-27T03:39:20.000-07:00,"trudeau ‘deeply disappointed’ after habs draft logan mailloux despite sexual image charge it is a sex crime - a criminal act that is for a sexual purpose or that affects the sexual integrity of the victim. 

what you are defining is a sexual assault.

edit: removed double post below this one - keeps happening on my new phone today.",liberals
h6qbfwf,2021-07-27T03:39:37.000-07:00,trudeau ‘deeply disappointed’ after habs draft logan mailloux despite sexual image charge [deleted],liberals
h6qbg3e,2021-07-27T03:39:39.000-07:00,"only half of one per cent of new covid-19 cases are in fully vaccinated: trudeau there's no reason we can't do a lockdown just for unvaccinated people though. instead of making restaurants, barbers, spas and the like shut down completely, just restrict access to vaccinated people only. heck, do the same with everything except essential stores, like grocery stores.",liberals
h6qbtir,2021-07-27T03:42:19.000-07:00,trudeau says ottawa withholding ‘millions of dollars’ from n.b. over abortion access where is abortion in the charter?,liberals
h6qbx9a,2021-07-27T03:43:03.000-07:00,"trudeau ‘deeply disappointed’ after habs draft logan mailloux despite sexual image charge &gt; or assault them

spreading such photos is assault.",liberals
h6qc37m,2021-07-27T03:44:14.000-07:00,trudeau ‘deeply disappointed’ after habs draft logan mailloux despite sexual image charge [removed],liberals
h6qc6of,2021-07-27T03:44:56.000-07:00,"only half of one per cent of new covid-19 cases are in fully vaccinated: trudeau &gt; hopefully hospitals choose to triage and treat the vaccinated first should it come down to it in the winter.

since that would be completely unethical, no, they won't. unvaccinated people clogging up hospitals will affect everybody.",liberals
h6qcd0p,2021-07-27T03:46:12.000-07:00,"trudeau ‘deeply disappointed’ after habs draft logan mailloux despite sexual image charge yeah let's not down play how humiliating, demonizing, and shaming it is for the victim... and the fact that it's a crime.",liberals
h6qce75,2021-07-27T03:46:26.000-07:00,"only half of one per cent of new covid-19 cases are in fully vaccinated: trudeau they're not the only ones in hospital. and since you clearly weren't paying attention, hospitals in several provinces were being overrun in the third wave despite older people already being vaccinated.",liberals
h6qchnk,2021-07-27T03:47:07.000-07:00,"trudeau ‘deeply disappointed’ after habs draft logan mailloux despite sexual image charge that's kind of the point. trudeau has had time to grow, mailloux hasn't. so let's not pretend trudeau has o ground to speak here.",liberals
h6qckn4,2021-07-27T03:47:43.000-07:00,"only half of one per cent of new covid-19 cases are in fully vaccinated: trudeau why? triage is a thing in healthcare. 


i’m not saying leave them to freeze in the cold if the hospital is empty, but if they start clogging up, given what we know about vax/unvaxxed people in the severity of their complications and the length of treatment thats typical, it seems like a fair triage line to draw. 

besides, they made their call and gambled that their immune systems could handle it. if they can’t, shame but shit happens.",liberals
h6qcl6p,2021-07-27T03:47:49.000-07:00,"trudeau says ottawa withholding ‘millions of dollars’ from n.b. over abortion access &gt; the prime minister initially said ottawa was holding back millions of dollars in health-care transfers to new brunswick, but a spokesperson from the prime minister's office said after the news conference that **the correct figure is $140,216**.

so entirely symbolic with no teeth behind it. better than nothing i suppose, the headlines should generate a bit of pressure on the nb government.

edit: source - https://www.ctvnews.ca/politics/trudeau-says-ottawa-withholding-health-care-transfers-to-n-b-over-abortion-access-1.5524841",liberals
