h9a1lu3,2021-08-16T21:49:34.000-07:00,"nova scotia provincial poll (forum) - lib 39% (25 seats), pc 36% (22 seats), ndp 21% (8 seats) the ns pcs are still progressive, which sets them apart from conservatives in other parts of the country.

but they still have a candidate who gleefully fantasizes about murdering cyclists in her \"trucks\" (yes, plural) who then posts about it on facebook, doubles down when gets called out for it, and tim houston (the leader of the party) hasn't really said much about it. some vague comment about it being inappropriate, but someone like that should be removed as a candidate.",conservatives
h9a1q1m,2021-08-16T21:50:43.000-07:00,"the poll thread - tuesday, august 17, 2021 direct link to the pdf [here](https://2g2ckk18vixp3neolz4b6605-wpengine.netdna-ssl.com/wp-content/uploads/2021/08/legers-north-american-tracker-august-16th-2021.pdf)

regionals are:

**atl**: lpc 41, cpc 27, ndp 22, gpc 7, ppc 2, oth 1

**qc**: lpc 37, bq 30, cpc 15, ndp 12, gpc 4, ppc 2, oth 1

**on**: lpc 37, cpc 32, ndp 23, gpc 4, ppc 3, oth 1

**mb/sk**: cpc 42, lpc 32, ndp 24, gpc 4, ppc 2, oth 0

**ab**: cpc 47, lpc 24, ndp 17, gpc 3, ppc 4, oth 5

**bc**: lpc 38, cpc 29, ndp 22, gpc 8, ppc 2, oth 1

so they show a bigger overall lead for the liberals than mainstreet does, but they also show ontario being a lot closer, and quebec a bit closer, which hurts the lpc majority chances.",liberals
h9a1vo8,2021-08-16T21:52:18.000-07:00,"tom mulcair: trudeau has bet everything on securing a majority yeah and the us was also the worlds largest vaccine manufacturer that kept all vaccines in the country. 

we didn’t have that capability.",liberals
h9a29ju,2021-08-16T21:56:07.000-07:00,"the poll thread - tuesday, august 17, 2021 they take into account regional numbers, which is a pretty important benefit over just looking at toplines. 

if you were just looking at top lines, you would have thought the liberals were likely to lose the 2019 election. looking at aggregators, you wouldn't think that (because feeding regional numbers into their models meant the inefficiency of the conservative vote was taken into account).",liberals
h9a2r4s,2021-08-16T22:00:47.000-07:00,"the poll thread - tuesday, august 17, 2021 to be fair, if you compare this to previous leger polls, it's not a loss in support or lead. 

that being said, if leger has been right all along about the liberals having a moderate lead and not being way ahead in either ontario or quebec, the majority will be a tough get.",liberals
h9a2u3j,2021-08-16T22:01:35.000-07:00,"trudeau vows to extend business supports to march, as o’toole proposes scrapping liberal child-care plan in platform release c-48 might. at the very least, it would be very messy to try and would result in years and years of challenges, legal and otherwise. many of the north coast fn are very good at taking the government to court now.

the americans super don't want this to turn into a mess either. the alaska shipping has avoided canadian waters for decades now, voluntarily. the only reason c-48 matters at all is that it prevents another project from going into kitimat or prince rupert or something.

i don't know that the country is ready for the fight that would cause again. c-48 has no major effect as it stands. there is no transit oil traffic to prince rupert or kitimat or other ports on the north bc coast (there's regional delivery, but that's not what c-48 covers). there's no transit of takers in the inside passage, never really has been or planned to be, even with tmx.",liberals
h9a2yf3,2021-08-16T22:02:45.000-07:00,"chris selley: afghanistan's catastrophe could be a political disaster for the liberals ###this is a reminder to [read the rules before posting in this subreddit](https://www.reddit.com/r/canadapolitics/wiki/rules-thelongversion).
 
1. **headline titles should be changed only [when the original headline is unclear](https://www.reddit.com/r/canadapolitics/wiki/rules-thelongversion#wiki_1._headline_titles_should_be_changed_only_where_it_improves_clarity.)**
2. **be [respectful](https://www.reddit.com/r/canadapolitics/wiki/rules-thelongversion#wiki_2._be_respectful).**
3. **keep submissions and comments [substantive](https://www.reddit.com/r/canadapolitics/wiki/rules-thelongversion#wiki_3._keep_submissions_and_comments_substantive).**
4. **avoid [direct advocacy](https://www.reddit.com/r/canadapolitics/wiki/rules-thelongversion#wiki_4._avoid_direct_advocacy).**
5. **link submissions must be [about canadian politics and recent](https://www.reddit.com/r/canadapolitics/wiki/rules-thelongversion#wiki_5._link_submissions_must_be_canadian_and_recent).**
6. **post [only one news article per story](https://www.reddit.com/r/canadapolitics/wiki/rules-thelongversion#wiki_6._post_only_one_news_article_per_story).** ([with one exception](https://www.reddit.com/r/canadapolitics/comments/3wkd0n/rule_reminder_and_experimental_changes/))
7. **replies to removed comments or removal notices will be removed** without notice, at the discretion of the moderators.
8. **downvoting posts or comments**, along with urging others to downvote, **[is not allowed](https://www.reddit.com/r/canadapolitics/wiki/downvotes)** in this subreddit. bans will be given on the first offence.
9. **[do not copy &amp; paste the entire content of articles in comments](https://www.reddit.com/r/canadapolitics/wiki/rules-thelongversion#wiki_9._do_not_copy_.26amp.3b_paste_entire_articles_in_the_comments.)**. if you want to read the contents of a paywalled article, please consider supporting the media outlet.

*please [message the moderators](https://www.reddit.com/message/compose?to=%2fr%2fcanadapolitics) if you wish to discuss a removal.* **do not reply to the removal notice in-thread**, *you will not receive a response and your comment will be removed. thanks.*


*i am a bot, and this action was performed automatically. please [contact the moderators of this subreddit](/message/compose/?to=/r/canadapolitics) if you have any questions or concerns.*",liberals
h9a2yv1,2021-08-16T22:02:52.000-07:00,chris selley: afghanistan's catastrophe could be a political disaster for the liberals [removed],liberals
h9a32pe,2021-08-16T22:03:54.000-07:00,"trudeau vows to extend business supports to march, as o’toole proposes scrapping liberal child-care plan in platform release harper specifically excluded the bc coastal fns from consultation during eng. they are the group that won the supreme court challenge that said the project could not go ahead until they had been meaningfully consulted. at that point the project was dropped.",liberals
h9a359g,2021-08-16T22:04:35.000-07:00,"which conservative parties are you a member of? &gt;i also didn't like scheer because i thought he was going too left

this is one i don’t hear too often. scheer’s the furthest right we’ve had as a leader of a national conservative party since stockwell day… though i guess that’s actually not saying much because there’s only been a couple leaders between day and scheer despite being 20 years apart lol.",conservatives
h9a35zp,2021-08-16T22:04:46.000-07:00,"which conservative parties are you a member of? yeah if they can maintain consistency, then bernier may have a shot being in the debates. they are kind of at a disadvantage though since a lot of pollsters don't even ask about the ppc. that's why i think the polling criteria is kind of subjective/arbitrary.

and ah ok, fair enough. yeah, i live in a conservative safe seat as well which is why i knew voting for the ppc last time was going to be a protest vote. so go for it. 

i'm going to be voting new blue or libertarian next spring in the provincial election myself since i want to send a message to the pcs to stop being liberals. however, i'm doing this since i know ford will probably still win and he is the best of bad options; i don't need to be as strategic.",liberals
h9a3jhx,2021-08-16T22:08:22.000-07:00,"trudeau vows to extend business supports to march, as o’toole proposes scrapping liberal child-care plan in platform release [removed]",liberals
h9a3ohs,2021-08-16T22:09:42.000-07:00,canada pm trudeau is planning to call snap election for sept 20 -sources i'm disgusted that he is purposely calling an election in the middle of a pandemic.  we might be a fourth wave in sept.,liberals
h9a3px0,2021-08-16T22:10:04.000-07:00,chris selley: afghanistan's catastrophe could be a political disaster for the liberals [removed],liberals
h9a3wop,2021-08-16T22:11:53.000-07:00,"which conservative parties are you a member of? yeah, which basically tells you where my views were at two years ago lol. tbh though, i always found him to be rightwing only because he was socially conservative (which i'm not - or at least i don't think i am unless you count anti-wokeness as socon). i'm more libertarian and was flirting with nationalism at the time. i also thought he didn't have a backbone when it came to cultural issues, and i was heavily embroiled in the culture war at the time. now i'm a lot more moderate since my views have changed, and i have different priorities.

i also just thought scheer was \"meh\" and that bernier had more of a personality. and i thought the ppc was going to make some headway, which they never did and probably never will. scheer also barely had a platform, especially compared to o'toole's that just came out.

in retrospect, i misjudged, especially looking at his platform now (the cliff notes on wikipedia). i thought bernier had more to offer, and was more innovative but if scheer ran on the exact same platform this time, i would probably vote conservative.",conservatives
h9a4ass,2021-08-16T22:15:38.000-07:00,"the poll thread - tuesday, august 17, 2021 [new ipsos](https://www.ipsos.com/en-ca/news-polls/out-of-the-starting-blocks-more-of-the-same)

top line:

lpc 36, cpc 31, ndp 20, bq 6, gpc 5

those numbers in the 338 simulator give a the liberals a majority - just. 177/ 111/33/19/2

***

regionals:

**on**: lpc 40, cpc 31, ndp 23, gpc 3, oth 3

**qc**: lpc 39, bq 28, cpc 17, ndp 12, gpc 4

**bc**: lpc 37, cpc 32, ndp 20, gpc 1, oth 1

**ab**: cpc 53, ndp 20, lpc 19, gpc 5, oth 3

**sk/mb**: cpc 46, ndp 24, lpc 23, gpc 6, oth 1

**atl**: lpc 49, cpc 21, ndp 18, gpc 9, oth 3

those regionals seem fairly good for the liberals to me, but ipsos believes it would result in another minority.",liberals
h9a4f8g,2021-08-16T22:16:49.000-07:00,chris selley: afghanistan's catastrophe could be a political disaster for the liberals [removed],liberals
h9a4gjr,2021-08-16T22:17:09.000-07:00,chris selley: afghanistan's catastrophe could be a political disaster for the liberals [removed],liberals
h9a4kro,2021-08-16T22:18:15.000-07:00,'recoil effect': new nanos polling shows liberals may be out of majority territory | ctv news of course not.  but to pretend that they don't matter and dismiss them as being an 'insignificant' part of the population is pretty stupid. i'm sure you'd agree.,liberals
h7qqz5b,2021-08-04T09:57:12.000-07:00,"trudeau souvenir! in before the ban, but if you actually cared about racial injustice as this supposed blackface proports, you wouldn't use the image of it for political gain.",liberals
h7qr96x,2021-08-04T09:59:26.000-07:00,"lack of strong rival may hurt canada's trudeau in election if a lot of cpc seats flip to ndp and liberals still get a minority, that would make a big difference in parliamentary committees and the tone of parliament generally.

i think though, once the right wing outrage machine starts firing on all cylinders, with more money to spend and all major newspapers owned by their \"side\", that cpc prospects will rise enough for abc strategic voting to kick in",liberals
h7qshtb,2021-08-04T10:09:16.000-07:00,"anyone else concerned with vote splitting among the cpc and ppc? seems you didn't get the memo, the court case is still on-going and i support even more court challenges against lock down measures.   
[https://winnipeg.ctvnews.ca/maxime-bernier-s-court-case-pushed-back-in-manitoba-1.5525217](https://winnipeg.ctvnews.ca/maxime-bernier-s-court-case-pushed-back-in-manitoba-1.5525217)  


political activism in general doesn't require you to be in provincial politics, and bernier has made it pretty evident that though he respects provincial autonomy, he would use whatever measures possible to punish provinces who infringe on your freedoms if he was p.m  


i'm more certain of his moral compass than other conservatives right now.",conservatives
h7qskoa,2021-08-04T10:09:54.000-07:00,"the secret to a successful growth agenda? don't talk about it | the hub i like this article and the ideas in it, but i’m not sure if the federal government has the power to accomplish the goals set out if the conservative party truly wanted to go this route. that’s one problem (and benefit!) of the canadian federation, power is devolved among many actors.

housing, for instance, is largely a provincial issue. the feds can, as rightly pointed out, make infrastructure funding contingent on zoning reform, but what happens if the municipalities don’t agree? then we’re out of new infrastructure and new housing. unfortunately for ontario the current conservative government is run by a bunch of incompetent clowns who wouldn’t be qualified to run a lemonade stand. i’d love to see them act on housing, if they ever learn what they’re doing.",conservatives
h7qtspo,2021-08-04T10:19:24.000-07:00,"lack of strong rival may hurt canada's trudeau in election [43% of liberal voters voted strategically in the past election](https://www.cbc.ca/news/politics/poll-strategic-voting-1.5339692). unless the liberals can effectively conjure up the conservative boogeyman once more (which i fully expect they will through the tried-and-true strategy of leaking convenient \"internals\" to the media) i suspect we'll see the ndp make gains in regions liberals dominate and result in some surprises. 
the trick for the ndp is to run on a campaign of keeping the liberals honest, while not attracting too much attention to spook swing lpc-ndp voters.",liberals
h7quen3,2021-08-04T10:24:13.000-07:00,chris selley: liberals' fourth wave election push looks crazier by the day i understand that it looks bad when numbers are adjusted for an election.  but nah i'm not buying that it was just a coincidence.  not a chance.,liberals
h7qv1no,2021-08-04T10:29:11.000-07:00,"trudeau souvenir! maybe i think differently, but i don't see this as racial injustice. i see this as a costume which is what it is. i don't have anything to gain from this what so ever but i just find it's parody of maga funny.",liberals
h7qv6pq,2021-08-04T10:30:19.000-07:00,"chris selley: liberals' fourth wave election push looks crazier by the day it's not the events. it's the parties and people getting wasted all week. if we can't control syphilis during stampede, how can we control covid?",liberals
h7qv9bl,2021-08-04T10:30:55.000-07:00,trudeau souvenir! removed for rule 3.,liberals
h7qvah0,2021-08-04T10:31:09.000-07:00,"lack of strong rival may hurt canada's trudeau in election i suspect you’re wrong. ndp numbers may be up slightly - but liberal numbers are up way more than 2019.

and for whatever reason new democrats have convinced themselves that no one actually likes the liberal party and that they only vote for it out of fear.

this is far from true, but i’m glad for ndpers to continue believing it.",liberals
h7qvnye,2021-08-04T10:34:07.000-07:00,"chris selley: liberals' fourth wave election push looks crazier by the day it's an editorial, which have never pretended to be objective.

and lots of journalism has never had the pretense it was objective anyways.",liberals
h7qwmjc,2021-08-04T10:41:43.000-07:00,ethics watchdog says trudeau didn’t further interests of lifelong friend pitfield removed for rule 3.,liberals
gjahlgo,2021-01-14T08:32:15.000-08:00,"kenney disagrees with o'toole, supports vaccination of elderly inmates [deleted]",conservatives
gjai659,2021-01-14T08:37:15.000-08:00,"canada's trudeau wants to serve for 'number of more years,' rules out vaccine passports oh, for sure international travel will be a different thing. but i mean, the idea of proving you've been immunized in order to see a movie or go to work/school - that will not happen in alberta.

i assume it's possible to get some paperwork that shows you've been immunized for travel.",liberals
gjail07,2021-01-14T08:40:48.000-08:00,"canada's trudeau wants to serve for 'number of more years,' rules out vaccine passports i don't really think that's going to happen in most of canada. i doubt there's much appetite for that. still i think they'll end up giving you something from most provinces saying you've been vaccinated.",liberals
gjaincp,2021-01-14T08:41:22.000-08:00,"kenney disagrees with o'toole, supports vaccination of elderly inmates [removed]",conservatives
gjaj8rn,2021-01-14T08:46:22.000-08:00,"kenney disagrees with o'toole, supports vaccination of elderly inmates personally i feel there are very few informed centrists out there. most people who describe themselves as such just aren't that engaged in politics outside of perhaps their key issues, and they want to be able to appeal to and get along with everyone, so being a \"centrist\" sounds good.

there are exceptions to that with people who legitimately hold positions that come from conflicting points of view, but i think that's rare. most people who are engaged in politics and have built an internal moral framework that their politics are based on and that they are aware of are not going to be 'centrist'.",conservatives
gjajuq8,2021-01-14T08:51:35.000-08:00,"conservatives must reject trumpism and address voter anger rather than stoking it, says strategist good luck trying to have a reasonable position here!",conservatives
gjajy3h,2021-01-14T08:52:23.000-08:00,"conservatives must reject trumpism and address voter anger rather than stoking it, says strategist [removed]",conservatives
gjak3s5,2021-01-14T08:53:44.000-08:00,"opinion: as canadian mps, we know our opponents are not our enemies. let's not become the u.s. &gt; there are many reasons to have 'quotas' to reverse obvious systemic racism,


no. you call it systemic racism but what if that old white man you dont like and want de-platformed for another person is actually the best person for the job.

the economy doesn't like wokeness. thats been proven time and time again.

&gt;because i am specifically not talking about policy differences, but a high-level rejection of science and obvious truth about many subjects, that some right-wing people espouse

left does exactly the same just way more deeper and complex.

&gt; those people, in so far as they are willing to organize and try to overthrow our society based on those ideas, should not be tolerated.

tell you what. i'll happily want those people thrown out too if you will happily throw out all the woke people and diversity/feminist hires too. that means trudeaus gotta go and christia freeland too.",liberals
gjal1ml,2021-01-14T09:01:46.000-08:00,"conservatives must reject trumpism and address voter anger rather than stoking it, says strategist [removed]",conservatives
gjalulu,2021-01-14T09:08:48.000-08:00,"canada's trudeau wants to serve for 'number of more years,' rules out vaccine passports agreed.",liberals
gjam0q5,2021-01-14T09:10:18.000-08:00,"conservatives must reject trumpism and address voter anger rather than stoking it, says strategist &gt;this is nonsensical. the point of an opposition party is to criticize the ruling party and convince voters that the ruling party is doing an horrible job at it.

that’s not at all the point of an opposition party. the point of an opposition party is to demonstrate to voters how they would do better - to criticise *with suggestions and alternatives* for voters to see how they would act in the same position, and try to win the chance to form government at the next opportunity. and in a minority situation, the opposition should also be proposing concrete and specific changes and improvement to legislation in order to win concessions from a government that needs support. 

an opposition party who fails to do this and who only criticises only demonstrates that they can oppose, and will remain the opposition. an opposition which criticises but also *proposes* demonstrates they would be a good governing party. 

the accusation is that the cpc is doing the former, not the later.",conservatives
gjamc3c,2021-01-14T09:13:07.000-08:00,"kenney disagrees with o'toole, supports vaccination of elderly inmates you're right, but it became increasingly clear who he really was at the end of his mandate.",conservatives
gjamg2c,2021-01-14T09:14:06.000-08:00,"canada's trudeau wants to serve for 'number of more years,' rules out vaccine passports having a negative covid test will still be required to fly, both on departure and landing. and from a transportation safety standpoint, that is the beginning and end of the conversation. 

from a public health perspective it is definitely more complex and that will evolve over time. 

but this point really needs to be hammered home with those flirting with the idea of a vaccine passport: one can still \"catch\" the virus post-vaccination albeit with lesser symptoms and transmissability. 

public health authorities have done a poor job of communicating this to the public so i don't entirely blame you for having unrealistic dreams regarding this.",liberals
gjamot1,2021-01-14T09:16:12.000-08:00,"canada's trudeau wants to serve for 'number of more years,' rules out vaccine passports there already is a \"vaccination passport\", it's called an icvp and you need one for some countries, usually for yellow fever vaccines. in canada they are mostly issued by private travel medicine clinics.",liberals
gjamq2b,2021-01-14T09:16:31.000-08:00,"canada's trudeau wants to serve for 'number of more years,' rules out vaccine passports it will be more important to demonstrate a negative covid test than proof of vaccination, as one can still catch and transmit the virus albeit at a lesser rate post-vaccination.",liberals
gjamsrz,2021-01-14T09:17:11.000-08:00,"conservatives must reject trumpism and address voter anger rather than stoking it, says strategist they know they have a problem. thing is their base (donors) are these nut bags. alienate them and the funding dries up",conservatives
gjan72z,2021-01-14T09:20:43.000-08:00,"canada's trudeau wants to serve for 'number of more years,' rules out vaccine passports in bc they have just made it mandatory for children to submit their vaccination status, but that really doesn't mean a whole lot. it doesn't mean the children have to be vaccinated, and it doesn't mean the school or province can/does do anything about the kids that aren't. 

as far as i'm aware the whole point of it is to facilitate public health narrowing down the kids that might be more susceptible if there are breakouts (at the time it was measles that was the concern). 

from what i've heard from the higher ups is that its highly unlikely that it will ever be mandatory to be vaccinated. its just not something that they can... mandate. 

so, while i can 100% see having covid immunization to leave the country (and i think they should enforce that), it wouldn't be much different than having to provide proof of vaccinations for other things that other countries do demand for entrance. i'd be so all over making it mandatory (and covered) for all common vaccine preventable diseases to leave the country. i think that if people don't want to vaccinate then they should under no circumstances be going to other countries.",liberals
gjanmzz,2021-01-14T09:24:37.000-08:00,"kenney disagrees with o'toole, supports vaccination of elderly inmates [deleted]",conservatives
gjann6a,2021-01-14T09:24:39.000-08:00,"kenney disagrees with o'toole, supports vaccination of elderly inmates decrease not eliminate is key in your statement, especially in regard to vulnerable populations.",conservatives
gjao919,2021-01-14T09:29:55.000-08:00,"kenney disagrees with o'toole, supports vaccination of elderly inmates [deleted]",conservatives
gjaoct7,2021-01-14T09:30:50.000-08:00,"opinion: as canadian mps, we know our opponents are not our enemies. let's not become the u.s. nah you don't get to just disavow him. that's your party, that's your base. i've seen lots of folks in alberta calling for the death of trudeau.

the cpc has some real problems right now, burying your head in the sand gets us nowhere.",liberals
gjaoo8h,2021-01-14T09:33:36.000-08:00,"kenney disagrees with o'toole, supports vaccination of elderly inmates [deleted]",conservatives
h7u87yd,2021-08-05T04:35:50.000-07:00,trudeau is far ahead of his rivals in the polls. why that might hurt him in an election that only lasts as long as they don't start beleiveing that they are a lot smarter than they really are.,liberals
h7u8ocy,2021-08-05T04:38:52.000-07:00,"trudeau is far ahead of his rivals in the polls. why that might hurt him in an election or the reason that people aren't going to vote cpc, ndp or green is because those parties have all been relatively driven into the ground.  that would correlate with why the polls are currently skewed for the libs.",liberals
h7u8zyb,2021-08-05T04:41:01.000-07:00,trudeau is far ahead of his rivals in the polls. why that might hurt him in an election [deleted],liberals
h7u935l,2021-08-05T04:41:37.000-07:00,"quebec to introduce vaccine passport system, premier legault says it'll be interesting to see what if any positive effect these soft-vaccine mandates will have. seemed not to long ago that canada was racing ahead with our vaccine rates. stalling in the 70s/60s is worrying with the fourth wave coming.

frankly trudeau's needed to implement that mandate for federal workers yesterday.",liberals
