h1dngnr,2021-06-10T17:38:57.000-07:00,opinion: trudeau will fight discrimination against muslims – so long as they don’t live in quebec a small note but it hasn't been ruled as a terrorist attack yet and from what i've read so probably won't be.  will probably be listed as a hate crime but. mostly seems to come down to mental illness,liberals
h1dooy6,2021-06-10T17:57:12.000-07:00,"green party mp jenica atwin crossing the floor to join liberals that’s what i’m saying, they have barely made any progress, they finally get an mp far from the west coast, and a decent one at that, and just let her walk over a disagreement",liberals
h1dou7q,2021-06-10T17:59:23.000-07:00,green party mp jenica atwin crossing the floor to join liberals [removed],liberals
h1dp1vf,2021-06-10T18:02:37.000-07:00,opinion: trudeau will fight discrimination against muslims – so long as they don’t live in quebec [removed],liberals
h1dpsrz,2021-06-10T18:14:17.000-07:00,"opinion: trudeau will fight discrimination against muslims – so long as they don’t live in quebec modern quebec society is very irreligious, but i really don't see what that has to do with what the motives of bill 21 might be. this isn't the crusades, you don't need to be christian to discriminate against muslims!",liberals
h1dqvpn,2021-06-10T18:31:09.000-07:00,"opinion: trudeau will fight discrimination against muslims – so long as they don’t live in quebec i don't interpret that statement that way.  i interpret that as:

\"our federal leaders won't denounce systemic racism in quebec, therefore the denunciation of this racist attack rings hollow.\"

i can't make the connection that you're making between what's written there and \\*blaming\\* quebec for this.  this is an attack on the politicians, not quebec imo.

the sun is also junk.",liberals
h1dr3b6,2021-06-10T18:34:28.000-07:00,sabrina maddeaux: the trudeau liberals shrugging at we ethics report proves the rot runs deep [removed],liberals
h1dro9y,2021-06-10T18:43:28.000-07:00,"opinion: trudeau will fight discrimination against muslims – so long as they don’t live in quebec &gt; is it islamaphobic for turkey to do so and uphold most of these laws to this day?

in turkey it isn't white christians doing it to a muslim minority. and of course in turkey they have their own history of oppressing an ethnic minority or two so you know....",liberals
h1dsbom,2021-06-10T18:53:27.000-07:00,"opinion: trudeau will fight discrimination against muslims – so long as they don’t live in quebec i've been baptised as a catholic even tho im not religious at all. yet i count as a \"christian\" in this statistic. 

in other word, these numbers means nothing.

\"quebec is overwhelmingly religious\" yet churches are empty, the ancient mayor of saguenay gets ridiculed in the whole privince for imposing a prayer at his mayor's office, the tax exemption of the church was removed, mariage rate is among the lowest in the country, quebeckers are overwhelmingly pro abortion and pro gay mariage.

yea.... suuuuper religious.",liberals
h1dsdwl,2021-06-10T18:54:27.000-07:00,opinion: trudeau will fight discrimination against muslims – so long as they don’t live in quebec only on paper. we all got baptised and many of us got our first communion in elementary school. then we grow up and realise it's all bs. but when it's time for the census many put catholic because they technicly have their first communion. noboby under 50 believes in jesus or has a bible or goes to church,liberals
h1dthg3,2021-06-10T19:12:02.000-07:00,"as canadians seek to confront anti-muslim bias, quebec's bill 21 is under scrutiny once again \\&gt; i'll paraphrase your first response as that you think religion has little negative effects on societies around the world and in fact is a progressive force here in north america. we will just have to disagree here.

it's not something you can disagree on unless you wish to deny historical facts. the ccf (forerunner of the ndp) was a [christian socialist party](https://en.wikipedia.org/wiki/j._s._woodsworth)that advanced the rights of the poor, as were the christian socialist and christian democrat parties that set up the scandinavian model in places like sweden and norway; christian socialism led the way on forcing the state to accept gay marriage. compare that the anti-religious atheistic, homphobic  socialism of stalin, mao,  ho chi minh, and pol pot. it's pretty clear which one is the progressive force in the world.

\\&gt; is prejudice against strict moral ideas, such as those of the major religions, unacceptably intolerant?

it is when it leads to people running over muslims in the street.

\\&gt; do you think your comments reflect an anti-conservative prejudice?

no. conservatives always oppose progressive policies and are the last to accept them, whether they are religious or not. again, that's just a fact.

\\&gt; would you also judge that person's actions completely independently of the symbols they are choosing to display as a uniformed canadian public employee as you said you would for a judge wearing a crucifix?

yes. i'm not an anti-christian bigot. i would not judge them differently if they were gay or black either. would you?",conservatives
h1dtr7y,2021-06-10T19:16:21.000-07:00,"opinion: trudeau will fight discrimination against muslims – so long as they don’t live in quebec &gt;residential schools? even if done at the direction of the government of canada and by protestants and anglophones as well... it's all the fault of french-canadian catholics if you ask english canada. english-canadian and protestant hands are somehow clean of the sin of genocide: it's all on us

i have yet to see anybody or any news outlet blaming french canadians for this... all of the criticism is ultimately directed at the government of canada -- at the state, the nation. the catholic church too, but let's not forget that: 

a) they're christianity's and probably the entire world's biggest organized religion with blood already all over their hands 
and 
b) that lots of anglo-canadians are also catholic; it's not at all uncommon for people with german, irish, scottish, or italian background -- all of which are some of the biggest ethnic groups in the country still today.

not sure what headlines you've been reading, but again, i've yet to see a single one specifically directed at quebec and/or french-canadians. all i've seen are either directed at the church, or the nation, and by far and large they're directed at the latter. but maybe you're one of those quebecois who lives with a persecution complex.",liberals
hn6n6di,2021-12-03T19:18:57.000-08:00,"canadian news media is dominated by corporate lobbyists you are the one who made the claim.  you are the one who has to back it up.

you can't, and instead of admitting it you pull the standard conservative line of \"do your own research\".

cbc talks about issues that are considered socially progressive.  it talks about climate change, changing gender roles, poor treatment of first nations , sexual identity. that does not make them politically biased.  just because conservatives would rather pretend that trans people don't exist and climate change isn't real, does not make the cbc politically biased because they address these issues.",conservatives
hg388lq,2021-10-09T20:34:37.000-07:00,opinion | canada’s conservatives seem determined to double down on erin o’toole’s failed strategy sheer won because bernier is called mad max for a reason.,conservatives
hg38rrd,2021-10-09T20:42:06.000-07:00,opinion | canada’s conservatives seem determined to double down on erin o’toole’s failed strategy [removed],conservatives
hg39tbj,2021-10-09T20:56:34.000-07:00,opinion | canada’s conservatives seem determined to double down on erin o’toole’s failed strategy o'toole had me half sold. the problem is that i didn't believe for a second that his party was behind him on most of those issues.,conservatives
hg3akuj,2021-10-09T21:07:02.000-07:00,"conservatives still considering position on federal vaccine policy, mp says if you want to walk away from your job or public social life it very much still isn’t mandatory and won’t be.",conservatives
hg3caij,2021-10-09T21:29:39.000-07:00,"fake, woke &amp; authoritarian: why does canada continue to take the insultingly insincere justin trudeau seriously? if this idiot is “woke” i for one don’t want to ever be.",liberals
hg3ddxt,2021-10-09T21:43:05.000-07:00,opinion | canada’s conservatives seem determined to double down on erin o’toole’s failed strategy i don’t get it. they improved in this election and we’re better received than in the last two. most reasonable politicians would try to build off that success.,conservatives
hlvwcu6,2021-11-23T18:28:26.000-08:00,"liberals promise to control pandemic, fight climate change and rebuild economy in throne speech politicians making another promise...",liberals
hlvxgum,2021-11-23T18:43:26.000-08:00,rex murphy: trudeau and biden double down on efforts to destroy our economy who are the globalist puppet masters?,liberals
hlvy5lz,2021-11-23T18:52:41.000-08:00,liberals want return of hybrid parliament and strict limits on commons vaccine exemptions [removed],liberals
hlvzjhy,2021-11-23T19:10:57.000-08:00,liberals want return of hybrid parliament and strict limits on commons vaccine exemptions [removed],liberals
hlvzyo9,2021-11-23T19:16:26.000-08:00,"opposition parties demand trudeau government release secret documents on fired winnipeg scientists ###this is a reminder to [read the rules before posting in this subreddit](https://www.reddit.com/r/canadapolitics/wiki/rules-thelongversion).
 
1. **headline titles should be changed only [when the original headline is unclear](https://www.reddit.com/r/canadapolitics/wiki/rules-thelongversion#wiki_1._headline_titles_should_be_changed_only_where_it_improves_clarity.)**
2. **be [respectful](https://www.reddit.com/r/canadapolitics/wiki/rules-thelongversion#wiki_2._be_respectful).**
3. **keep submissions and comments [substantive](https://www.reddit.com/r/canadapolitics/wiki/rules-thelongversion#wiki_3._keep_submissions_and_comments_substantive).**
4. **avoid [direct advocacy](https://www.reddit.com/r/canadapolitics/wiki/rules-thelongversion#wiki_4._avoid_direct_advocacy).**
5. **link submissions must be [about canadian politics and recent](https://www.reddit.com/r/canadapolitics/wiki/rules-thelongversion#wiki_5._link_submissions_must_be_canadian_and_recent).**
6. **post [only one news article per story](https://www.reddit.com/r/canadapolitics/wiki/rules-thelongversion#wiki_6._post_only_one_news_article_per_story).** ([with one exception](https://www.reddit.com/r/canadapolitics/comments/3wkd0n/rule_reminder_and_experimental_changes/))
7. **replies to removed comments or removal notices will be removed** without notice, at the discretion of the moderators.
8. **downvoting posts or comments**, along with urging others to downvote, **[is not allowed](https://www.reddit.com/r/canadapolitics/wiki/downvotes)** in this subreddit. bans will be given on the first offence.
9. **[do not copy &amp; paste the entire content of articles in comments](https://www.reddit.com/r/canadapolitics/wiki/rules-thelongversion#wiki_9._do_not_copy_.26amp.3b_paste_entire_articles_in_the_comments.)**. if you want to read the contents of a paywalled article, please consider supporting the media outlet.

*please [message the moderators](https://www.reddit.com/message/compose?to=%2fr%2fcanadapolitics) if you wish to discuss a removal.* **do not reply to the removal notice in-thread**, *you will not receive a response and your comment will be removed. thanks.*


*i am a bot, and this action was performed automatically. please [contact the moderators of this subreddit](/message/compose/?to=/r/canadapolitics) if you have any questions or concerns.*",liberals
hlw077t,2021-11-23T19:19:23.000-08:00,liberals want return of hybrid parliament and strict limits on commons vaccine exemptions a study by nation academy of science in usa put mask use at 79% affective in stopping covid. mask use and how you wear it is extremely important in it’s ability to reducing transmission,liberals
hlw1nne,2021-11-23T19:37:12.000-08:00,erin o’toole’s tories make justin trudeau’s life easy [removed],liberals
hlw2hbf,2021-11-23T19:47:02.000-08:00,liberals want return of hybrid parliament and strict limits on commons vaccine exemptions rule 3,liberals
gutjpt3,2021-04-16T18:25:25.000-07:00,"peel police officer accuses global news journalist of agitating anti-mask protesters, hugs attendees common misconception. 

that isn't true. 

the charter is called the charter. there is a different document called the bill of rights. it had quasi-constitutional authority, but was only a statute and could have been undone by a simple majority of parliament, which is why the government of pierre trudeau decided to amend the constitution.",liberals
gutk1df,2021-04-16T18:29:54.000-07:00,"how did it come to this? politicians have ignored the core facts of covid-19 and the main strategies that will fight the pandemic if justin trudeau opened his budget on monday with an announcement promising paid sick leave so that provinces can shut down properly for 4-6 weeks, he would win re-election in a heartbeat.

instead his government has sliced away at the programs that would keep vulnerable, sick people away from work, as it focuses on a possible election campaign in may/june. i hope they have trouble sleeping at night, because they should.",liberals
gutt0c8,2021-04-16T20:11:44.000-07:00,"ontario gives police authority to stop people, vehicles, ask purpose of travel they were warned this is how doug would be during a global pandemic nobody seen coming? sounds like you just want to bash ford. if there's blood on peoples hands for voting for ford then whoever's voted for trudeau must have skeletons in their closet.",liberals
hh7geza,2021-10-18T17:13:21.000-07:00,it’s irresponsible for justin trudeau to equate the far right and far left in canada [removed],liberals
hh7gont,2021-10-18T17:17:21.000-07:00,"it’s irresponsible for justin trudeau to equate the far right and far left in canada &gt; you don’t get to make that choice as much as individuals on the far right don’t get to disassociate themselves from fascism.

if you're on the far right but you're not a fascist and don't truck with fascists then you can disassociate yourself from them. 

your argument seems to reek of a sort of painting everyone on any pole with one brush and as long as you find anyone being that way you get to say that they're all somehow guilty by association with it. 

strangely i doubt you'd say that about being a zionist. zionists who abhor the kinds of things done by say the likud party and the zany out of their minds settlers i assume in your mind get to separate themselves from the bastards who are also zionists. and that's a far more specific ideological view point than say being just on the \"far left\" which is a fucking huge landscape of ideas.",liberals
hh7gv1g,2021-10-18T17:19:59.000-07:00,"it’s irresponsible for justin trudeau to equate the far right and far left in canada why do you insist the far left has to be crazy? because you're trained by moderate media messaging that being too \"far\" from the centre is dangerous and crazy?

&gt;or people who are anti-government but on the socialist side of authoritarianism rather than the right wing anti-government authoritarianism.

i just get the feeling that you don't know much about the left other than horror stories about the bolsheviks or whatever. there are so many non violent and anti authoritarian leftists who are very very far to the left who probably literally couldn't find a place in the way you organize things in your mind. 

you don't know what you don't know and its tragic to read the words that come from that.",liberals
hh7h75p,2021-10-18T17:25:04.000-07:00,"it’s irresponsible for justin trudeau to equate the far right and far left in canada citation please for a proper political philosophy source that describes \"far\" as being this? because there are a lot of far left wing people who are strictly non violent. 

https://en.wikipedia.org/wiki/far-left_politics

read that and i don't think you'll find your definition in there, except insofar as it illustrates how the media plays a key role in denigrating the entire notion of the far left through playing it up as purely violent and extreme.",liberals
hh7hcw2,2021-10-18T17:27:29.000-07:00,"it’s irresponsible for justin trudeau to equate the far right and far left in canada &gt; why are islamic terrorists far left? because they tend to be anti-capitalist and anti-globalism.

anti capitalism doesn't inherently make you left wing. its what you'd replace capitalism with and why you're against capitalism that makes you far left.

if you try to define another person's ideology purely by saying they are that because they're against this then you will fail to accurately describe anyone because you'll end up with too many shared ideas between totally incompatible beliefs.

fascists share opposition to liberal democracy with far leftists, but they neither want to change it into the same thing nor oppose it for the same reasons.",liberals
hh7kq66,2021-10-18T18:19:23.000-07:00,"does canada still need a green party? i don’t understand this eagerness to snuff out the green party, if there’s a party we really don’t need anymore it’s the conservative party, with all it’s regressive views and toxic behavior.",conservatives
hh7l7zv,2021-10-18T18:26:59.000-07:00,"it’s irresponsible for justin trudeau to equate the far right and far left in canada regardless of that point, you can't equate people advocating for the deportation and blockage of immigrants into the country and the ignorance of historical intolerance, to people advocating for universal basic income and higher taxes on the extremely wealthy. calling that equation irresponsible is a gross understatement. 

and we're already in the same position poitically as the us, it's ridiculous to act like we aren't. 

regardless of whether you feel you're on the left or right, don't try to excuse the massive differences between the policies that these different parties advocate for. they are not the same, and shouldn't be treated as such. it's not about abiding criticism at the end of the day, it's about owning up to fact. and neither major party is willing to do that, as is made clear by trudeau's \"slip up\" here.",liberals
hh7mkuw,2021-10-18T18:47:42.000-07:00,"does canada still need a green party? i didn't say nothing is being done. i'm saying there's no way the infrastructure will be in place by 2035 to make canada ice free.

the liberals have run hundreds of billions in deficits and worked on legislation for their own self-interests and to suppress free speech rather than do much of anything to increase electrical capacity, grid capacity, \"green\" electrical production, or build charging points. 

yes, there's been $280 million (with an m, not a b as in the deficits) earmarked over 5 years of funding charging point infrastructure but that won't even be enough to install the infrastructure for fleet vehicles.

it's definitely more of a provincial/municipal matter but canadians can't afford tax increases at all levels of government while also being expected to pay more for utilities.

the solution that could have been implemented over the last 5 years was emission standards. not just floating out some 'promise' for 15 years from now to try and appear as though they're actually doing something (aka virtue signaling).",liberals
hkpcw3p,2021-11-14T18:10:58.000-08:00,"justin trudeau calls for clearing cyberspace of hate, disinformation at internet panel i would agree of the senate was properly formed in canada. it's just a rubber stamp now",liberals
hkphyqm,2021-11-14T19:21:30.000-08:00,trudeau and kenney to reveal an affordable child-care agreement on monday morning [removed],liberals
hbshav0,2021-09-05T19:30:53.000-07:00,voters should look carefully before swapping trudeau for o’toole [deleted],liberals
hbshq61,2021-09-05T19:37:10.000-07:00,"the poll thread - monday, september 6, 2021 thing is, if you were paying attention to o'toole you notice he's basically throwing things at the wall to see what sticks. he tried to sell himself as much more conservative before the election, now all of a sudden he's a moderate? 

don't get me wrong, it's politics, people say whatever they think will get them elected. but it seems more blatant in o'toole's case.",conservatives
hbsi018,2021-09-05T19:41:22.000-07:00,trudeau says he's 'pretty frustrated' by the raj saini scandal [removed],liberals
hbsikzg,2021-09-05T19:50:09.000-07:00,"voters should look carefully before swapping trudeau for o’toole i'm in the maritimes bro, it's self preservation at this point.",liberals
hbsis91,2021-09-05T19:53:12.000-07:00,voters should look carefully before swapping trudeau for o’toole [removed],liberals
hbsiz8t,2021-09-05T19:56:10.000-07:00,trudeau says he's 'pretty frustrated' by the raj saini scandal [removed],liberals
hbsj9dk,2021-09-05T20:00:23.000-07:00,"o'toole reverses course on guns, says he will keep liberal ban in place what's the subreddit?",conservatives
hbsk239,2021-09-05T20:12:10.000-07:00,"o'toole reverses course on guns, says he will keep liberal ban in place i don't think so, ppc has zero chance of doing anything. they can get one seat max.

with the liberal promising more restrictions it will be abl",conservatives
hbsk7jo,2021-09-05T20:14:25.000-07:00,"[deleted by user] horseshit.  vote splitting is an excuse used by whoever didn't win the election, nothing more.

the ppc is looking at single digits in the early opinion polls, and are projected to win fewer seats than the greens in the house.  if the conservatives lose, and they might, it will be because they failed to gather the support of the swing-voters.  it will not be because their support was co-opted by a radical faction.

there simply are not enough hard-right conservative voters in canada to win a federal election.  only the centrist swing voters hold that kind of power.",conservatives
hbslx7o,2021-09-05T20:39:19.000-07:00,voters should look carefully before swapping trudeau for o’toole they also won the popular vote in 2019.,liberals
hbsmdgt,2021-09-05T20:45:44.000-07:00,voters should look carefully before swapping trudeau for o’toole [removed],liberals
hbsmnm2,2021-09-05T20:49:39.000-07:00,voters should look carefully before swapping trudeau for o’toole [deleted],liberals
hbsmx07,2021-09-05T20:53:17.000-07:00,"the poll thread - monday, september 6, 2021 if the bloc were to threaten the liberals chances of forming government again i think federalist supporters from other parties like the ndp would join forces to block the bloc. i don't think we will ever reach that point in this election because the bloc's ceiling is much lower in this election compared to 2019 in terms of seats and vote share in quebec. they are not going to be much of a threat to the liberals in this election.",liberals
hbsmx3i,2021-09-05T20:53:19.000-07:00,"o'toole reverses course on guns, says he will keep liberal ban in place [removed]",conservatives
hbsnaav,2021-09-05T20:58:26.000-07:00,singh not critical of trudeau’s handling of 2 michaels detained in china [removed],liberals
hbsnk4a,2021-09-05T21:02:09.000-07:00,"voters should look carefully before swapping trudeau for o’toole i don't know about other people, but personally, i'm through with strategic voting. i got burned hard with the promise of electoral reform. 

though they may not win in my riding, i'm voting ndp",liberals
hbso1oh,2021-09-05T21:08:42.000-07:00,trudeau says he's 'pretty frustrated' by the raj saini scandal [removed],liberals
hbso6v3,2021-09-05T21:10:39.000-07:00,"o'toole vows to raise penalties for gun crimes check again and try to follow along, the ban will be upheld on \"assault style weapons\". we all know what were talking about argue semantics amongst yourselves.",conservatives
hbsoeil,2021-09-05T21:13:26.000-07:00,voters should look carefully before swapping trudeau for o’toole [removed],liberals
hbsol9g,2021-09-05T21:16:00.000-07:00,voters should look carefully before swapping trudeau for o’toole in my riding there aren’t any liberal or ndps running. one lone wolf green and 3 far right candidates. gotta get outta alberta.,liberals
hmieimj,2021-11-28T16:37:49.000-08:00,"boosting gender parity: ontario liberals create women-only candidate ridings &gt;simply declaring a riding nomination to be “for women only” does not necessarily mean the best candidate won’t be chosen.

sure it does, because if a woman in that riding was the best candidate, it wouldn't have been necessary to make the riding \"women only\" instead of \"best candidate wins\". the whole premise of the policy is that the women chosen will not be the best.",liberals
hkz1f7i,2021-11-16T18:38:20.000-08:00,senator denise batters kicked out of the conservative caucus i feel like break in party discipline like that would be about the end for o'toole.,conservatives
hkz4962,2021-11-16T19:16:15.000-08:00,"senator denise batters kicked out of the conservative caucus for all the things i could criticize o'toole for his strength in leadership isn't one of them. he's leading his party in a direction he believes will win them elections, whether they like it or not. and he's probably on the right path.",conservatives
