hfxn91g,2021-10-08T12:35:57.000-07:00,"jagmeet singh says ndp prepared to withhold votes in parliament the federal liberals are pragmatic, and will do anything to stay in power. they can promise the moon, not deliver and still get power because people, by and large, are uninformed simpletons when it comes to politics.

the federal ndp are principled, which keeps them out of power. \"tax the rich: sounds great, but what's the nitty-gritty?

the ndp that win provincially (bc, ab) ditch some principle for pragmatism, which works to gain power.",liberals
hfxraw8,2021-10-08T13:09:58.000-07:00,doug ford defends decision to let unvaccinated mpps sit as progressive conservatives removed for rule 3.,conservatives
hfxs74t,2021-10-08T13:17:52.000-07:00,opinion: don’t be surprised if both trudeau and trump run again [removed],liberals
hgaefas,2021-10-11T09:25:51.000-07:00,"justin trudeau needs to bring in new faces to revive a faded cabinet mccrimmon was indeed a great loss, though apparently she has cancer (from what i've been told) so it's understandable.",liberals
hgaehi4,2021-10-11T09:26:23.000-07:00,"trudeau's 'durable' brand will survive his 'tone deaf' tofino vacation, say public opinion analysts [removed]",liberals
hgaepbl,2021-10-11T09:28:10.000-07:00,"trudeau's 'durable' brand will survive his 'tone deaf' tofino vacation, say public opinion analysts although it was clearly tone deaf, i spent the day cleaning my garage so i don't exactly judge him.",liberals
hgai47k,2021-10-11T09:56:28.000-07:00,"trudeau's 'durable' brand will survive his 'tone deaf' tofino vacation, say public opinion analysts i agree it doesn't sound like kinsella himself, just wanted to demonstrate what a useless description it is to assess someone's credibility.

if it's all the hill could get to publish it looks like opinion hunting with a predetermined goal, not natural canvassing.",liberals
hgaj9yd,2021-10-11T10:05:46.000-07:00,new democrats didn't break through in the federal election. now they need to figure out why that’s quite an accusation without any evidence - what are you basing this on? was the ndp prevented from placing ads with the cbc? do you have figures for how many ads the ndp and liberals placed with different media organizations? or with social media sites?,liberals
gi3objf,2021-01-04T04:06:08.000-08:00,identity politics risk trapping trudeau in quebec the star has been bought by right wingers,liberals
gi3or2b,2021-01-04T04:09:27.000-08:00,identity politics risk trapping trudeau in quebec oh fair enough.  has it changed their editorial direction?,liberals
gi3ppg9,2021-01-04T04:16:53.000-08:00,identity politics risk trapping trudeau in quebec i’m not sure,liberals
gi3qwqj,2021-01-04T04:26:11.000-08:00,"identity politics risk trapping trudeau in quebec not really imo. i'm pretty left leaning and i like the star. although i also don't really dislike the publications people consider right leaning either, aside from the sun because i find they print pieces that are very emotional with few facts.

that being said, i posted this article because i thought it would be of interest to people to discuss, not because i agree with it.",liberals
gi3r8fs,2021-01-04T04:28:42.000-08:00,identity politics risk trapping trudeau in quebec [removed],liberals
hna6ba0,2021-12-04T11:49:54.000-08:00,trudeau's new law to protect health care workers will make no real difference unfortunately trudeau doesn't make much of a difference as he's just a happy camper exactly where everything is. really wish ndp pulled an upset,liberals
hna7moy,2021-12-04T12:00:39.000-08:00,"trudeau's new law to protect health care workers will make no real difference that's okay. it wasn't really designed to. like the so-called assault weapons list it was designed to serve a political goal, not a practical one. now they can claim they did something.",liberals
hmbtqi5,2021-11-27T06:35:06.000-08:00,"boosting gender parity: ontario liberals create women-only candidate ridings ###this is a reminder to [read the rules before posting in this subreddit](https://www.reddit.com/r/canadapolitics/wiki/rules-thelongversion).
 
1. **headline titles should be changed only [when the original headline is unclear](https://www.reddit.com/r/canadapolitics/wiki/rules-thelongversion#wiki_1._headline_titles_should_be_changed_only_where_it_improves_clarity.)**
2. **be [respectful](https://www.reddit.com/r/canadapolitics/wiki/rules-thelongversion#wiki_2._be_respectful).**
3. **keep submissions and comments [substantive](https://www.reddit.com/r/canadapolitics/wiki/rules-thelongversion#wiki_3._keep_submissions_and_comments_substantive).**
4. **avoid [direct advocacy](https://www.reddit.com/r/canadapolitics/wiki/rules-thelongversion#wiki_4._avoid_direct_advocacy).**
5. **link submissions must be [about canadian politics and recent](https://www.reddit.com/r/canadapolitics/wiki/rules-thelongversion#wiki_5._link_submissions_must_be_canadian_and_recent).**
6. **post [only one news article per story](https://www.reddit.com/r/canadapolitics/wiki/rules-thelongversion#wiki_6._post_only_one_news_article_per_story).** ([with one exception](https://www.reddit.com/r/canadapolitics/comments/3wkd0n/rule_reminder_and_experimental_changes/))
7. **replies to removed comments or removal notices will be removed** without notice, at the discretion of the moderators.
8. **downvoting posts or comments**, along with urging others to downvote, **[is not allowed](https://www.reddit.com/r/canadapolitics/wiki/downvotes)** in this subreddit. bans will be given on the first offence.
9. **[do not copy &amp; paste the entire content of articles in comments](https://www.reddit.com/r/canadapolitics/wiki/rules-thelongversion#wiki_9._do_not_copy_.26amp.3b_paste_entire_articles_in_the_comments.)**. if you want to read the contents of a paywalled article, please consider supporting the media outlet.

*please [message the moderators](https://www.reddit.com/message/compose?to=%2fr%2fcanadapolitics) if you wish to discuss a removal.* **do not reply to the removal notice in-thread**, *you will not receive a response and your comment will be removed. thanks.*


*i am a bot, and this action was performed automatically. please [contact the moderators of this subreddit](/message/compose/?to=/r/canadapolitics) if you have any questions or concerns.*",liberals
hmbudpg,2021-11-27T06:39:52.000-08:00,boosting gender parity: ontario liberals create women-only candidate ridings [removed],liberals
hmbuo94,2021-11-27T06:42:04.000-08:00,a 20-year spike in inflation could put the bite on the trudeau liberals [removed],liberals
hmbvoql,2021-11-27T06:49:36.000-08:00,"boosting gender parity: ontario liberals create women-only candidate ridings while i genuinely support gender parity in many areas, this is extremely self-defeating and limiting.  if only because let's suppose a male candidate who has been a pillar in a community who has championed the advancement of women and minorities is now disqualified? this is literally fuelling support for the second-most popular candidate/party.  this is a case of not reading the room. voters are going to wonder, \"is the liberal party pushing the best candidate or the best female candidate?\" and because of that, they'll lose votes across ontario, which may bleed into loss of support at the federal level.  with the trudeau government having a minority government, this is a terrible move, and won't achieve long-term political goals.  

i'm okay with gender-parity cabinets, and filling leadership roles with more women, but this is going to blow up in the liberals faces.  on the upside, the ndp may end up as opposition or a minority government.",liberals
hmbwyuq,2021-11-27T06:59:09.000-08:00,a 20-year spike in inflation could put the bite on the trudeau liberals [removed],liberals
hmbxx7e,2021-11-27T07:06:20.000-08:00,boosting gender parity: ontario liberals create women-only candidate ridings [removed],liberals
hq6nn0s,2021-12-27T03:52:35.000-08:00,"jordan peterson interviewed preston manning and pierre poilievre will be appearing on his show soon.....yet erin o'toole declined o'toole's entire strategy is pandering to the left, and a lot of people on the left don't like jordan peterson.",conservatives
hq6nw5r,2021-12-27T03:54:18.000-08:00,"experts concerned about hospital capacity as omicron spread continues in canada my fb feed is full of comments like this.  why hasn’t trudeau done ford’s job for him?  we’ve got a patchwork system in ontario where what county/region you live in is the prime determiner in quality of pandemic planning, resources, information, etc.",liberals
hq6qb3t,2021-12-27T04:10:51.000-08:00,"prime minister trudeau's message on christmas i just mean i am not surprised more people are critical of a hereditary monarch than an elected official, which would include all 300 of those mp's. no disrespect to the queen as a person, i respect her joining the ats in wwii, but i am not personally fond of the monarchy itself (mind you i'd save my negative comments for andrew).",liberals
hq6rop1,2021-12-27T04:20:18.000-08:00,"conrad black: on justin trudeau's 50th birthday, the shadow of his father looms large i mean... conrad black editorial in the national post. that's like the fox news comments section of \"legitimate journalism.\"",liberals
hq6tr9q,2021-12-27T04:34:35.000-08:00,jordan peterson interviewed preston manning and pierre poilievre will be appearing on his show soon.....yet erin o'toole declined yes i wasn't denying that. what i meant is that there wouldn't be any cooperation if a real right wing party was in power.,conservatives
h0f8jw4,2021-06-02T20:26:18.000-07:00,representatives of chinese dissident groups reject trudeau's comments on racism [removed],liberals
h0fa47w,2021-06-02T20:46:35.000-07:00,"green, ndp leaders slam liberals' 'failed approach' on climate goals [removed]",liberals
h0fbnvp,2021-06-02T21:05:47.000-07:00,"why i will always feel like a second-class citizen in canada: my piece as a first-gen immigrant from pakistan a lot of woe is me and whining in this however the point about the travel ban is a good one.  why trudeau went from a free for all to a complete ban is strange.  why not set up a proper quarantine where people were monitored and ensure they weren’t bringing a new variant into the country?    

the rest of this article isn’t worth the time to read it.",liberals
h0fbrz3,2021-06-02T21:07:08.000-07:00,"adam zivo: trudeau's canadian emergency student benefit squandered $1.6 billion on the well-off &gt;the result was mind-numbing amounts of waste. last year, the fraser institute estimated that $1.6 billion in cesb funds was allocated to students between the ages of 18-24 “living in families with more than $100,000 in household income.” that amounts to over half of the program’s final cost of $2.9 billion.

the average income in canada for one person is 51k... to suggest that $100,000 household income is \"well-off\" is really sus; especially in big urban centers like gtha or vancouver or montreal (where the majority of the population resides)

this isn't the 1980s.. but anyhow.. i question anything the fraser institute pushes out...",liberals
hpncl2j,2021-12-22T13:08:48.000-08:00,"anyone else find it weird and interesting that stephen harper endorsed andrew scheer but not erin o'toole? erin o'toole is a moderate (though he campaigned differently in 2020), which is not really the same cloth as harper. why would he endorse someone with very different political mindset as him? not to forget that harper's endorsement on scheer also caused a lot of negative coverage in 2019 election.",conservatives
hpni93g,2021-12-22T14:07:03.000-08:00,"'we're a careful country': freeland contrasts omicron responses of canada, u.s. are we though?

at the beginning of this crisis, and since, the initial reaction of the liberals was to cite racism when being asked to close borders and also to make a deal with a chinese communist party controlled company to produce a vaccine. that doesn’t seem very careful at all.",liberals
hpnj6qy,2021-12-22T14:17:12.000-08:00,anyone else find it weird and interesting that stephen harper endorsed andrew scheer but not erin o'toole? [deleted],conservatives
hpnj8hk,2021-12-22T14:17:44.000-08:00,anyone else find it weird and interesting that stephen harper endorsed andrew scheer but not erin o'toole? [deleted],conservatives
hpnjjl8,2021-12-22T14:21:06.000-08:00,"conservatives boycott security committee over refusal to release docs on fired scientists if the above law nullifies the parliamentary privilege of speaking in the house, it also nullifies the privilege by which the house can demand documents. they come from the same authority.

cpc mps have access to the documents. why don't they do what they were asking the head of phac to do?",conservatives
hbjln2c,2021-09-03T17:18:25.000-07:00,"conservatives would repeal ban on guns used in école polytechnique, nova scotia mass shootings \\&gt; i'm curious why you are focusing on one specific item used during one specific crime that happened when most of us were children?

the fact is it goes beyond this one case. itcomes up here because it was discussed in the french debates, and the polytechnique was the worst of several mass shooting carried out by legal gun owners. the ruger 15 has caused quite a bit of havoc across the world:

*  anders brevik shot over 60 teenagers with it in norway. 
* last years nova scotia shotings were carried out with a ruger 14

it comes up a gain and again. 

unfortunately, these fact are suppressed by the conservative media and the left-wing media is too worried checking in on everybody's feelings to deal in hard facts, so i don't blame you for being misinformed you are about this assault weapon.  this ducment shed some light n why it keeps on being used by mass shooters: [http://polysesouvient.ca/documents/docu\\_19\\_10\\_14\\_rugermini14\\_dossier.pdf](http://polysesouvient.ca/documents/docu_19_10_14_rugermini14_dossier.pdf)

it';s basically designed for mass shootings. it's small, so it can be used at short range and pointed from target to target and can easily be hidden in a ternch coat. it's semi automatic, and a trained shooter can firs 2 or 3 round per second. the magazines can be changed quickly with practice (mass shooters go to gun ranges a lot), and even in canada you can remove a small pin from the magazine and fire 30 rounds at a time.

 \\&gt; to do this we need mental health and government systems that are trusted by canadian gun owners. gun owners need to feel safe to come forward to say \"i own a gun and i need mental help\", and they need to have a system that's ready to provide them with competent help when they ask for it.

you see we already have proof that doesn't work. alexandre bissonnette was already under the care of a psychiatrists for years and heavly medicated to control anxiety. yet he was able to purchase a cache of weapons  and joina gun club to get very good at shooting before carrying out his planned attack on the mosque. 

what we really need is mandatory, trict  mental health checks (paid for by the gn owners) before thjey purchase guns and annual mental health checks once they own them. gun owners want their guns more than anybody else and the expreience with alexandre bissonnete.

\\&gt; there are several components used to make explosives being sold in canadian tire and home depot without any kind of registration or control, yet we don't have people blowing others up all the time.

well again you have to inform yourself here. when right-wing militia terrorists carrie out the  oklahoma city bombings in 1993, they  used huge amounts of ammomnium nitrate, a fertilizer used by farmers, from an agricultural coop. as a result, in the u.s. and canada, we responded rationally and banned the sale to anyone but farmers, who need to prove how they are going to use every ounce. 

did the farmers compain about their \"right\" to buy fertilizers? did fertilizer manufacturer bay lobbiest billions of dollars to lobbby the governemnt so they could sell it to anybopdy like before? no. the followed common sense an went along with it. 

why oh why can gun owners and manufacturers not take the same common sense attitude tow\\\\ards assault rifles as problematic as the ar-15 and ruger-14?   clearly itys use needs to be restricted to people who need it like police and security guards? they shoul;d not be used as recreational toys.",conservatives
hbjltzb,2021-09-03T17:21:03.000-07:00,"conservatives would repeal ban on guns used in école polytechnique, nova scotia mass shootings [removed]",conservatives
hbjm67w,2021-09-03T17:25:46.000-07:00,"the poll thread - saturday, september 4, 2021 saguenay is in no way representative of the province. saguenay has always been more conservative, also the capital.if you listen to the cogeco medias all over the province, you will realize most if not all think o'toole lost, even in the rest of the country, except for the conservative medias, they think he lost.",conservatives
hbjmbbv,2021-09-03T17:27:47.000-07:00,"conservatives would repeal ban on guns used in école polytechnique, nova scotia mass shootings &gt;which is illegal to own in canada. 

like the guy in another thread pinted out, you can use a shoelace to rig up a ruger 14 to fire 10 round a second like a fully automatic weapon. the manufacturer still refuses to correct this defect. it should be banned.",conservatives
hbjmes5,2021-09-03T17:29:09.000-07:00,o'toole vows to raise penalties for gun crimes [removed],conservatives
hbjmlk8,2021-09-03T17:31:45.000-07:00,"conservatives would repeal ban on guns used in école polytechnique, nova scotia mass shootings [removed]",conservatives
hbjmumo,2021-09-03T17:35:17.000-07:00,blanchet challenges o'toole to repeat things in english following the tva french debate [removed],conservatives
hbjn03g,2021-09-03T17:37:24.000-07:00,"conservatives would repeal ban on guns used in école polytechnique, nova scotia mass shootings thats actually not what i said - please do not mischaracterize what i say.

[i never once said you could do it with the mini-14.](https://www.reddit.com/r/canadapolitics/comments/phjge1/conservatives_would_repeal_ban_on_guns_used_in/hbjbn4x/)

i said the rcmp could classify a shoelace as an illegal prohibited modification to all and any firearms if they are found in your gun bag in reference to bumpfire stocks depending on what they could determine to be the intention of it as it could be seen as a firing mechanism modification, and that is illegal unless under specific instances and classification.

also the firing rate on the mini-14 is .6 rounds a second on average - not 10, and it is not at all like fully automatic.  again, please stop spreading misinformation you clearly are not informed about.",conservatives
hbjn2wl,2021-09-03T17:38:31.000-07:00,"conservatives would repeal ban on guns used in école polytechnique, nova scotia mass shootings any firearm can kill massacre 14 people in the same time that asswipe did it. ….any firearm",conservatives
hbjn5tm,2021-09-03T17:39:42.000-07:00,"conservatives would repeal ban on guns used in école polytechnique, nova scotia mass shootings &gt;literally any semi automatic firearm can fire that fast

which is why they should be banned. 

here's a good summary about the ar-15, another problematic assault weapon that is banned. killers like it because it can rip through organs with impunity. the gun trainer here is honest and just flat out calls it a military weapon:

https://youtu.be/iyjjwpvl9j0

&amp;#x200b;

&gt;also all semi auto rifles are limited to 5 rounds in canada.

the magazines actually can hold 30 rounds. the manufacturer puts in small pin to restrict it to 6, but that pin is easily removed. yes, it;s illegal, but mass shooters don;t worry about that, and lets face it, if people at the gun range want to blast away at a target for fun, no good-ol-boy is going to say anything.",conservatives
hbjnbed,2021-09-03T17:41:55.000-07:00,"conservatives would repeal ban on guns used in école polytechnique, nova scotia mass shootings so you're denying the manufaxturing is selling as a tactical weapon? unbelievable. it's right in the title of the video, and the guy describes how he used it as part fo a swat team. all you have to do is watch the video.  gun owners get in extreme denial when presented with irrefutable facts.",conservatives
hbjnbgu,2021-09-03T17:41:57.000-07:00,"conservatives would repeal ban on guns used in école polytechnique, nova scotia mass shootings [removed]",conservatives
hbjnfvx,2021-09-03T17:43:45.000-07:00,"conservatives would repeal ban on guns used in école polytechnique, nova scotia mass shootings [removed]",conservatives
hbjnijv,2021-09-03T17:44:50.000-07:00,"conservatives would repeal ban on guns used in école polytechnique, nova scotia mass shootings \\&gt; that’s not a machine gun.

didn;t say it was. i'm saying it;'s firing like one. it would kill just as many people if it was carried into a school.",conservatives
hbjnnxf,2021-09-03T17:47:01.000-07:00,"conservatives would repeal ban on guns used in école polytechnique, nova scotia mass shootings [removed]",conservatives
hbjnoxn,2021-09-03T17:47:25.000-07:00,trudeau sidesteps question on home flipping vancouver liberal candidate not really how questions work.,liberals
hbjnxc3,2021-09-03T17:50:52.000-07:00,"conservatives would repeal ban on guns used in école polytechnique, nova scotia mass shootings [removed]",conservatives
hbjny6b,2021-09-03T17:51:11.000-07:00,"conservatives would repeal ban on guns used in école polytechnique, nova scotia mass shootings [removed]",conservatives
hbjo57q,2021-09-03T17:54:02.000-07:00,"conservatives would repeal ban on guns used in école polytechnique, nova scotia mass shootings still say that the gun is the problem here, not the shoelace. manufacturers should design the guns so bumpstocks are impossible. 

\\&gt; also the firing rate on the mini-14 is .6 rounds a second on average - not 10,

again, this is not .6 rounds per second, so you're not paying attention to the real danger

[https://youtu.be/xatsah6gqoc](https://youtu.be/xatsah6gqoc)",conservatives
hbjo8kp,2021-09-03T17:55:27.000-07:00,o'toole vows to raise penalties for gun crimes [removed],conservatives
hbjoi01,2021-09-03T17:59:18.000-07:00,report this video for misleading title. global news is sabotaging conservatives with this misleading video. get this video removed before this misinformation reaches to more pople [deleted],conservatives
hbjol3c,2021-09-03T18:00:32.000-07:00,"conservatives would repeal ban on guns used in école polytechnique, nova scotia mass shootings yeah, that's it exactly. that sentence really threw me. if they'd said gun *control* advocates need to be truthful about the dangers they pose, it would definitely not have read like some kind of call to arms. this sounded far more like a movie style 'me? dangerous? i'll show you the meaning of dangerous,' at least to me.

i guess i'm still not sure how the rcmp is a gun advocate, but at least i know now that i *was* just reading it wrong.",conservatives
hbjosx8,2021-09-03T18:03:39.000-07:00,report this video for misleading title. global news is sabotaging conservatives with this misleading video. get this video removed before this misinformation reaches to more pople cbc is certainly up there.,conservatives
hbjow1g,2021-09-03T18:04:53.000-07:00,"conservatives would repeal ban on guns used in école polytechnique, nova scotia mass shootings that is not the correct and authorized to fire the rifle.  in fact if a range officer saw you doing that on the range you would have the authorities called, as you are not in control of the rifle - and as such the cfo would have a word with you because you have a higher chance of shooting yourself in the foot then the target infront of you.

secondly that is very much a video from the united states involving an american mini-14 which we do not know if it has a hair trigger or modified firing mechanisms which are allowed there but not here - not one for the canadian market which almost every manufacturer specifications say that the firing rate is .6/second - or 40 a minute.  that magazine capacity would also be illegal in canada.

please i would once again suggest you inform yourself about canadian firearm rules and regulations.",conservatives
hbjoxts,2021-09-03T18:05:36.000-07:00,"conservatives would repeal ban on guns used in école polytechnique, nova scotia mass shootings &gt; they could gun down even more caribou if machine guns and uzis were legal for hunting

machineguns and uzis haven't been legal to *own* letalone *hunt with* in canada since 1977. there's also no real use case for using full auto when hunting, as you'd just be spoiling meat/hide. they should be legal for use on shooting ranges, however.",conservatives
hbjp592,2021-09-03T18:08:38.000-07:00,"conservatives would repeal ban on guns used in école polytechnique, nova scotia mass shootings [removed]",conservatives
hbjp7e2,2021-09-03T18:09:29.000-07:00,"conservatives would repeal ban on guns used in école polytechnique, nova scotia mass shootings 38 here. the firearms law changes around then didn't make sense when i was a child, watching adults reactions to it, and they don't make sense now when i have more firsthand knowledge of the subject.

less so, honestly, as despite them, shootings still happen. more than before those laws. and in spite of them, with most guns used for such being illegally owned.",conservatives
