h6ri22t,2021-07-27T08:54:36.000-07:00,"n.s. progressive conservatives promise publicly-funded universal mental health care if elected this is true but the people of quebec get things like affordable university and child care whereas ns gets... not sure, someone help me out here

part of the problem is an aging population with young people leaving and old people moving there for retirement after selling their houses in the gta/ab and buying cheaper places in rural ns or even halifax which helps them bump up that retirement nest egg. but to be fair, this is a problem a lot of atlantic canada is facing.",conservatives
h6ri4lj,2021-07-27T08:55:10.000-07:00,"trudeau says ottawa withholding ‘millions of dollars’ from n.b. over abortion access &gt;the supreme court of canada has ruled on this exact subject, unsurprisingly.

the supreme court ruled on whether s. 251(4) violated the *charter*. only wilson, j. would have found a specific *charter* right to abortion. *morgentaler* is of little assistance in answering the more important question of how far parliament go could in restricting abortion (nobody on the court, including justice wilson, doubted that parliament *can* restrict abortion without violating the *charter*).",liberals
h6ri7wc,2021-07-27T08:55:53.000-07:00,"many people claiming to be indigenous do not share our collective experience | cbc news it's bizarre how often i see people praising the white paper in this sub. like, even if you think an assimilationist approach to canada's indigenous peoples is appropriate, aboriginal title has been recognized in law for almost 50 years now making the policies espoused by trudeau and chretien in '69 literally impossible to implement.",liberals
h6ri9ul,2021-07-27T08:56:19.000-07:00,trudeau says ottawa withholding ‘millions of dollars’ from n.b. over abortion access [removed],liberals
h6rigmd,2021-07-27T08:57:47.000-07:00,only half of one per cent of new covid-19 cases are in fully vaccinated: trudeau and all non-essential businesses will be required to do that? ones that don’t get shut down?,liberals
h6riksv,2021-07-27T08:58:42.000-07:00,trudeau ‘deeply disappointed’ after habs draft logan mailloux despite sexual image charge [removed],liberals
h6rikxt,2021-07-27T08:58:44.000-07:00,trudeau says ottawa withholding ‘millions of dollars’ from n.b. over abortion access because it isn't true... nb has abortion clinics in moncton and bathurst... the question is whether a private clinic should be funded by the provincial government in fredericton...,liberals
h6rimqj,2021-07-27T08:59:07.000-07:00,"only half of one per cent of new covid-19 cases are in fully vaccinated: trudeau yep but it's a good tradeoff when you think about it. non essential buisnesses will stay open for vaccinated customers meaning that the economic impact would be minimal considering the vast majority of the population is vaccinated.

i don't know what other provinces are planning but this is quebec's plan.",liberals
h6rinro,2021-07-27T08:59:21.000-07:00,only half of one per cent of new covid-19 cases are in fully vaccinated: trudeau [removed],liberals
h6riobj,2021-07-27T08:59:28.000-07:00,only half of one per cent of new covid-19 cases are in fully vaccinated: trudeau [removed],liberals
h6ritop,2021-07-27T09:00:38.000-07:00,trudeau ‘deeply disappointed’ after habs draft logan mailloux despite sexual image charge [deleted],liberals
h6riwuu,2021-07-27T09:01:20.000-07:00,trudeau says ottawa withholding ‘millions of dollars’ from n.b. over abortion access [removed],liberals
h6rix3n,2021-07-27T09:01:23.000-07:00,"only half of one per cent of new covid-19 cases are in fully vaccinated: trudeau interesting, thanks for informing me",liberals
h6rj05i,2021-07-27T09:02:03.000-07:00,only half of one per cent of new covid-19 cases are in fully vaccinated: trudeau no problem,liberals
h6rj3if,2021-07-27T09:02:47.000-07:00,only half of one per cent of new covid-19 cases are in fully vaccinated: trudeau [removed],liberals
h6rj3mm,2021-07-27T09:02:49.000-07:00,"trudeau says ottawa withholding ‘millions of dollars’ from n.b. over abortion access in the first place, that's not from \"the decision\" - that's the concurring opinion of two justices. literally the only thing \"the court\" said was that s. 251(4) was unconstitutional and of no force or effect. the court didn't agree on anything else. 

second, that only means that s. 251(4) engaged the right to liberty - as does *every* law the violation of which is punishable by imprisonment. that doesn't mean it's unconstitutional - a law which infringes on the right to liberty only violates s.7 if it does so in a manner that violates a principle of fundamental justice. 

per your other comment-

&gt;the court ruled that a ban on abortion was unconstitutional because such a law violates the security of person section of the charter of rights and freedoms. 

the court did not rule that \"a ban on abortion was unconstitutional\" because the court was not considering a law which banned abortion. the court was considering a law which required that certain types of abortions be approved by a particular process ('therapeutic abortion committees'). maybe read the case yourself before you go around lecturing other people about not having read it. 

&amp;#x200b;

\\[i'm certainly not suggesting that the court might have upheld a complete ban, but that is *not* the question facing the court\\]",liberals
h6rj8gq,2021-07-27T09:03:53.000-07:00,trudeau says ottawa withholding ‘millions of dollars’ from n.b. over abortion access [removed],liberals
h6rjb2c,2021-07-27T09:04:27.000-07:00,trudeau ‘deeply disappointed’ after habs draft logan mailloux despite sexual image charge [removed],liberals
h6rjce2,2021-07-27T09:04:45.000-07:00,bernier lawyer makes case for why defamation suit against warren kinsella should proceed kinsella is such a dick but also amusing with his intense hatred of trudeau. he absolutely loathes jt. bernier let me down hard by going off the deep end so i don’t care about him.,liberals
h6rjdzs,2021-07-27T09:05:06.000-07:00,"only half of one per cent of new covid-19 cases are in fully vaccinated: trudeau &gt;the outbreak of the delta variant in the u.s. is now so serious that public health officials want even fully vaccinated people to wear a face mask indoors if they live in an area dealing with a significant spike in cases.

&gt;while the vast majority of the viral transmission in the u.s. is happening among the unvaccinated, those rare \"breakthrough\" cases among fully vaccinated people can result in a comparable level of transmissibility, cdc director dr. rochelle walensky told a news conference tuesday.

&gt;\"in rare occasions, some vaccinated people infected with the delta variant after vaccination may be contagious and spread the virus to others,\" walensky warned.

&gt;\"in areas with substantial and high transmission, cdc recommends fully vaccinated people wear masks in public indoor settings to help prevent the spread of the delta variants and protect others.\"

&gt;**walensky also warned that authorities believe that if vaccination rates don't improve significantly, the u.s. may be \"just a few mutations away\" from a highly infectious variant that could evade the vaccines entirely.**

this is the worst case scenario and the more people that allow the virus to replicate the greater the chance this happens.",liberals
h6rjeum,2021-07-27T09:05:17.000-07:00,trudeau says ottawa withholding ‘millions of dollars’ from n.b. over abortion access [removed],liberals
h6rji9e,2021-07-27T09:06:02.000-07:00,trudeau says ottawa withholding ‘millions of dollars’ from n.b. over abortion access why don't you go direct your anger at the nova scotia liberals than as there are no abortions provided in cape breton and so people have to go to halifax which is way further than fredericton to moncton. justin is not doing this out of principle he is doing this as he is trying to pick a fight with a conservative government out of pure politics. thing is this may backfire against him and cost him up to 3 seats in the nb anglophone ridings as blaine higgs is more popular than he is in the province...,liberals
h6rjihw,2021-07-27T09:06:06.000-07:00,"trudeau says ottawa withholding ‘millions of dollars’ from n.b. over abortion access i'd suggest that the reasons provided for striking down the section offer considerable guidance on the subject. 

however, the original question was about what s.7 has to do with abortion. i simply suggest that the morgentaler decision describes in detail how s.7 considerations apply to abortion access.",liberals
h9zpa3x,2021-08-22T13:33:23.000-07:00,"twitter marks justin trudeau’s social media post attacking erin o’toole as ‘manipulated media’ it isnt about whether or not the public system can do something, clearly they can but it doesnt mean it is ideal to do so in every single case.

in my opinion we should take an evidence based approach and copy the system which demonstrably works the best instead of taking an idealogical approach as to which system is perceived as the most equitable.",liberals
h9zpc4f,2021-08-22T13:33:54.000-07:00,"maverick party hopes to make election headway in alberta all i see is conservatives winning those 28 seats by 30 points instead of 40.

i have to rant a little though as i just wish there was an ndp of the right. this big tent bullshit is so annoying and tries to fit too many people under it. 

since their merger the conservatives have managed 2 minorities and 1 majority that was booted after 1 term when it seems canadians felt like they made a huge mistake giving them the 1 majority. 

o'toole seems to be swinging left to try and gets votes while many of his party supporters and mp's that will be sitting with him are very much far right.

the party even recently lost 2 members in sloan and bernier for not being far enough to the right.

that does not seem to indicate a healthy party that can actually lead a country.",conservatives
h9zpgar,2021-08-22T13:34:59.000-07:00,twitter marks justin trudeau’s social media post attacking erin o’toole as ‘manipulated media’ shhhhhhhh he might hear you digging his own grave as he became the harper himself,liberals
h9zpjte,2021-08-22T13:35:54.000-07:00,twitter marks justin trudeau’s social media post attacking erin o’toole as ‘manipulated media’ i have a more fundamental question. who gave an unaccountable corporate entity the authority to play truth police and election monitor? leave the partisanship aside for a moment and think on how absurd this entire thing is.,liberals
h9zpog6,2021-08-22T13:37:08.000-07:00,"twitter marks justin trudeau’s social media post attacking erin o’toole as ‘manipulated media’ false. the first sentence talks about how keeping the access to universal health care is paramount. if this was kept in changes perspective of the message (even if only slightly). 

you’re argument is that they are “shortening it”. it is a single sentence that is removed to make it look like his answer was a simple yes… with no other context when he provides one immediately before prior to the yes. so basically the definition of manipulation.",liberals
h9zpsuy,2021-08-22T13:38:17.000-07:00,o'toole acknowledges some conservatives 'frustrated' over carbon pricing plan everyone knows that a carbon tax is the rights answer and no one trusts the conservative until such a tax is ‘baked’ in.  none of this funny money bs.,conservatives
h9zpva5,2021-08-22T13:38:56.000-07:00,338canada: the liberals stumble out of the gate in week one [removed],liberals
h9zq5nb,2021-08-22T13:41:40.000-07:00,"twitter marks justin trudeau’s social media post attacking erin o’toole as ‘manipulated media’ so why didn’t they leave the first part of his answer in? 

come on.  we all know why this was done and it was to try and make o’toole look as bad as possible. to manipulate how you view his position on this.",liberals
h9zq7k1,2021-08-22T13:42:10.000-07:00,"the maverick party wants in — sort of my what an interesting year 2020 would have been if covid hadn't come in and ruined anything. people's blood was boiling out here. if things had continued on that course, we would surely have ended the liberals and a much richer and angrier west would have been ready to contest that election. who knows what could have happened.",liberals
h9zq7pm,2021-08-22T13:42:13.000-07:00,"twitter marks justin trudeau’s social media post attacking erin o’toole as ‘manipulated media’ 
&gt;australia and most european countries use a universal system with hybrid delivery and they consistently outperform our system

[according to doctor danielle martin a study by duckett et all found that the private system in australia extended wait times.](https://youtu.be/iyof6hxgx6m?t=1m00s). our current system is not perfect because we need to defense our social security net against the cpc neoliberals.",liberals
h9zq9e9,2021-08-22T13:42:40.000-07:00,"the poll thread - sunday, august 22, 2021 quito maggi just said on twitter that the top line for tomorrow is similar but interesting regionals. 

unrelated, but looking at the news coverage today and just reading the general vibe on social  media, i’d bet on the liberals at least losing seats. everything about their roll out is kind of botched.

things can change but there is a big trust gap. the question of why they are calling the election has not been answered really at all.",liberals
h9zqfb4,2021-08-22T13:44:13.000-07:00,338canada: the liberals stumble out of the gate in week one just to be clear i meant the cpc is the tortoise and the lpc is the hare.,liberals
h9zqo1d,2021-08-22T13:46:31.000-07:00,"treat drug addiction as health, not criminal issue, o'toole says in plan to tackle opioid crisis &gt; i'm noticing a real trend - the announcements sound very liberal - but the actual plans are actually a little more conservative. conservatives have long held that we shouldn't give free drugs and safe injection sites, we should focus on treatment and getting people off drugs.  
    
not necessarily, i remember harper had a \"tough on crime\" approach that included mandatory minimums for things like possession.  this is a move towards the centre by o'toole.  
   
public policy has really shifted towards rehab (at least in canada)  in the last 10 years though so you can't blame him for being out of date on that one.  the usa is still incarcerating people for cannabis possession in some states.",conservatives
h9zqra7,2021-08-22T13:47:22.000-07:00,twitter marks justin trudeau’s social media post attacking erin o’toole as ‘manipulated media’ do you think governments like the ucp will actually put the strict regulations that eu countries have in place though? especially when we’re right beside the  us?,liberals
h9zqw56,2021-08-22T13:48:40.000-07:00,"o'toole acknowledges some conservatives 'frustrated' over carbon pricing plan the system is burn more, earn more

how does it help forcing someone to buy for example a mountain bike, not because they really want it, but because it's the best opportunity you can use what are best described as *awards points* for fuel consumption.

it's not like there are many canadians driving their car so every second month they can uninsure it and use last months *reward miles* for a bus pass.",conservatives
h9zr15d,2021-08-22T13:49:58.000-07:00,twitter marks justin trudeau’s social media post attacking erin o’toole as ‘manipulated media’ [removed],liberals
h9zr6jp,2021-08-22T13:51:23.000-07:00,"conservatives' housing plan includes a two-year trial ban on foreign buyers i totally agree. so being an appreciation game, the owner realizes a profit when they sell. the rent covers the cost of ownership, give or take. why should the renter pay for the increase in value of the property that the owner will later realize as a profit?",conservatives
h9zrdoe,2021-08-22T13:53:20.000-07:00,"o'toole acknowledges some conservatives 'frustrated' over carbon pricing plan people will use it the way that is most convenient. some may use it for things that help. others will just use it to get a mountain bike or put solar panels on their rv. 

the bus pass for example can't be sustained from riding the bus as you're not filling up your green account by doing low carbon activities. so this will be families paying for the bus passes they already are getting. not helping people switch.",conservatives
h9zrfex,2021-08-22T13:53:49.000-07:00,twitter marks justin trudeau’s social media post attacking erin o’toole as ‘manipulated media’ [removed],liberals
h9zrh2n,2021-08-22T13:54:16.000-07:00,"338canada: the liberals stumble out of the gate in week one you hit the nail on the head. 
the biggest losers are canadians in this election in the sense it reinforces the fact that party politics comes before national interests.",liberals
h9zri7f,2021-08-22T13:54:34.000-07:00,"as a fiscally moderate, social progressive, how does the conservative party intend to appeal to me and why should i support them given i’m in a relationship with a trans woman who is scared shitless of them? and what about that makes him a degenerate?",conservatives
h9zrn8f,2021-08-22T13:55:59.000-07:00,"twitter marks justin trudeau’s social media post attacking erin o’toole as ‘manipulated media’ a heavily edited video that leaves out very very important context and quotes.

this is an edit video. this is pathetic from the federal liberals.",liberals
h9zrt94,2021-08-22T13:57:37.000-07:00,"338canada: the liberals stumble out of the gate in week one in fairness, parties usually don’t put out full platforms this early. the opposition parties out theirs out way earlier than normal. i agree that they should pivot and put theirs out too.",liberals
h9zrwab,2021-08-22T13:58:26.000-07:00,"as a fiscally moderate, social progressive, how does the conservative party intend to appeal to me and why should i support them given i’m in a relationship with a trans woman who is scared shitless of them? he's in a relationship with a trans women",conservatives
h9zs1ge,2021-08-22T13:59:49.000-07:00,"338canada: the liberals stumble out of the gate in week one do people really think that is even something the federal govt can fix? 

i’d bet my life savings that any fed party will not do anything to materially affect the housing market.",liberals
h9zs3u8,2021-08-22T14:00:27.000-07:00,338canada: the liberals stumble out of the gate in week one did you ask them if they were going to vote based on that?,liberals
h9zs9t8,2021-08-22T14:02:04.000-07:00,liberals go after ndp leader jagmeet singh in announcement on protecting old-growth forests most of the federally regulated industries are unionized so the 10 sick days won't mean anything because they already have them or more. as for the provinces unless there is some funding agreement they won't be lifting a finger.,liberals
h9zsbb2,2021-08-22T14:02:29.000-07:00,"338canada: the liberals stumble out of the gate in week one are we sure that is actually factually true? people have more savings now than they did before, right? i’m sure i saw a news article about that.",liberals
h9zsftv,2021-08-22T14:03:42.000-07:00,"twitter marks justin trudeau’s social media post attacking erin o’toole as ‘manipulated media’ https://torontosun.com/2017/02/16/canada-has-worst-erreferral-wait-times-in-11-developed-countries-report

yet our wait times rank as the worst. the countries with the best wait times (germany, france and the netherlands) all use hybrid delivery of healthcare not single payer.

&gt;	our current system is not perfect because we need to defense our social security net against the cpc neoliberals.

keep making excuses for the broken nature of our healthcare system. the liberals have had for more majority governments then the cpc. in fact health care starved under the chrétien government who cut transfers, it was the harper government who increased them.

https://www.theglobeandmail.com/news/national/chretien-rejects-health-care-pleas-from-provinces/article1038283/",liberals
h9zsn9j,2021-08-22T14:05:41.000-07:00,"338canada: the liberals stumble out of the gate in week one they had full control to decide when the election would be held! they’re asking canadians to return to the polls after two years for… what? 

sure “parties usually don’t put out full platforms this early” but you should if you call an extremely short election, in difficult circumstances, with most canadians unsure why we’re having one. i don’t care what parties usually do, in these circumstances what the liberals should have done is have a platform and vision they could articulate from day one.",liberals
h9zspmb,2021-08-22T14:06:20.000-07:00,liberals go after ndp leader jagmeet singh in announcement on protecting old-growth forests [removed],liberals
h9zsssm,2021-08-22T14:07:11.000-07:00,twitter marks justin trudeau’s social media post attacking erin o’toole as ‘manipulated media’ [removed],liberals
h9zsusx,2021-08-22T14:07:44.000-07:00,4 lessons trudeau using from john horgan's snap covid election victory [deleted],liberals
h9zsvm1,2021-08-22T14:07:57.000-07:00,twitter marks justin trudeau’s social media post attacking erin o’toole as ‘manipulated media’ [removed],liberals
h9zsxrz,2021-08-22T14:08:33.000-07:00,338canada: the liberals stumble out of the gate in week one every party knew when the last election was held and none put it out early. it’s a political tactic but hardly nefarious. you will see their platform before debates and long before you will vote.,liberals
h9zt7eh,2021-08-22T14:11:13.000-07:00,"twitter marks justin trudeau’s social media post attacking erin o’toole as ‘manipulated media’ i'm essentially a liberal partisan, although disagree with them on this issue because i don't think some version of a two tier is necessarily bad.  

but i don't see why this was \"manipulated\".  to me that suggests a cut that changes the meaning of a speech to mean something else.  this wasn't that.  . .",liberals
h9ztbg6,2021-08-22T14:12:20.000-07:00,twitter marks justin trudeau’s social media post attacking erin o’toole as ‘manipulated media’ [removed],liberals
h9ztfzz,2021-08-22T14:13:36.000-07:00,"twitter marks justin trudeau’s social media post attacking erin o’toole as ‘manipulated media’ ucp, probably not. alberta ndp, yes.

but outside the oddity that is alberta and maybe saskatchewan,  i think the rest of the provinces could handle it, even ontario under ford.",liberals
h9zth4f,2021-08-22T14:13:54.000-07:00,"as a fiscally moderate, social progressive, how does the conservative party intend to appeal to me and why should i support them given i’m in a relationship with a trans woman who is scared shitless of them? well yes. but why exactly does that make him a degenerate. i mean trans women need love too, right?",conservatives
h9ztp4p,2021-08-22T14:16:11.000-07:00,"the poll thread - sunday, august 22, 2021 fournier himself uses the projected average. i don't exactly know what's the difference between the projected ahead and projected average but the projected average is used for call making more. 

https://www.macleans.ca/politics/ottawa/338canada-the-liberals-stumble-out-of-the-gate-in-week-one/

in his latest write-up, he says the liberals are at 156 seats. he did not use the projected ahead number.",liberals
h9ztv0o,2021-08-22T14:17:51.000-07:00,"338canada: the liberals stumble out of the gate in week one it’s been less than a week lol. it’s common to releas your full platform about 2 weeks before election day, give or take. the liberals have been constantly dropping policy points throughout the start of this campaign. and they’ll drop their full platform in september, when people are actually paying attention.",liberals
h9ztyty,2021-08-22T14:18:56.000-07:00,twitter marks justin trudeau’s social media post attacking erin o’toole as ‘manipulated media’ it appears the english version is now flagged as well.,liberals
h9zu1o8,2021-08-22T14:19:43.000-07:00,"338canada: the liberals stumble out of the gate in week one it’s undemocratic or stupid to not release a platform 6 days into a campaign? how does that make any sense? did you hate on every single party in every single election for your entire life? i mean, the vast majority/all historical elections did not have parties releasing their platforms in the first 6 days of the campaign. it’s just people looking for excuses to hate on trudeau. some people live to hate on trudeau. it’s what drives them. it’s what gets them up in the morning. it’s their life’s purpose to find any excuse to complain about trudeau.",liberals
h9zu80e,2021-08-22T14:21:28.000-07:00,"338canada: the liberals stumble out of the gate in week one it’s not an “extremely short election”. most campaigns are 36 days, give or take. the max campaign length is 50 days anyway, literally 2 more weeks. doesn’t make much of a difference. you’re being deliberately disingenuous if you’re saying that a 36 day election is extremely short, but a 37-50 day campaign is nice and long. people are just looking for any excuse to hate on trudeau.",liberals
