h9rpjqj,2021-08-20T18:53:02.000-07:00,"conservative opposition to mandatory vaccinations is irresponsible and dangerous, says trudeau you're protected until a variant that does work effectively with the vaccine comes out due to selfish unvaccinated individuals who choose not to get the vaccine.

you're protected..but those who medically cannot receive the vaccine can't due to those who (again..selfishly ) choose not to get the vaccine.

you're protected but the children who... get the point yet?",liberals
h9rprmu,2021-08-20T18:56:20.000-07:00,"conservative opposition to mandatory vaccinations is irresponsible and dangerous, says trudeau yup.

nut jobs come in all politicial stripes.

but only right wing political parties choose to make it a core political platform.",liberals
h9rq4bl,2021-08-20T19:01:36.000-07:00,"trudeau’s most dangerous challenger ndp proposes, liberals disposes. i'm waiting on liberals platform but based on the previous election, i've always found the liberals have a more detailed implementation plan.",liberals
h9rq56f,2021-08-20T19:01:59.000-07:00,trudeau to o’toole: pro-choice does not mean the freedom of doctors to choose [removed],liberals
h9rqdr1,2021-08-20T19:05:29.000-07:00,"as a fiscally moderate, social progressive, how does the conservative party intend to appeal to me and why should i support them given i’m in a relationship with a trans woman who is scared shitless of them? we had respect on the international stage with trump  showed that the us is back and we're tired of being pushed around",conservatives
h9rqgb5,2021-08-20T19:06:33.000-07:00,trudeau to o’toole: pro-choice does not mean the freedom of doctors to choose [removed],liberals
h9rqk8m,2021-08-20T19:08:11.000-07:00,trudeau to o’toole: pro-choice does not mean the freedom of doctors to choose [removed],liberals
h9rqur3,2021-08-20T19:12:38.000-07:00,trudeau to o’toole: pro-choice does not mean the freedom of doctors to choose [removed],liberals
h9rriec,2021-08-20T19:22:22.000-07:00,"conservatives call for ethics probe of liberal mp&amp;#x27;s 2017 italy trip ###this is a reminder to [read the rules before posting in this subreddit](https://www.reddit.com/r/canadapolitics/wiki/rules-thelongversion).
 
1. **headline titles should be changed only [when the original headline is unclear](https://www.reddit.com/r/canadapolitics/wiki/rules-thelongversion#wiki_1._headline_titles_should_be_changed_only_where_it_improves_clarity.)**
2. **be [respectful](https://www.reddit.com/r/canadapolitics/wiki/rules-thelongversion#wiki_2._be_respectful).**
3. **keep submissions and comments [substantive](https://www.reddit.com/r/canadapolitics/wiki/rules-thelongversion#wiki_3._keep_submissions_and_comments_substantive).**
4. **avoid [direct advocacy](https://www.reddit.com/r/canadapolitics/wiki/rules-thelongversion#wiki_4._avoid_direct_advocacy).**
5. **link submissions must be [about canadian politics and recent](https://www.reddit.com/r/canadapolitics/wiki/rules-thelongversion#wiki_5._link_submissions_must_be_canadian_and_recent).**
6. **post [only one news article per story](https://www.reddit.com/r/canadapolitics/wiki/rules-thelongversion#wiki_6._post_only_one_news_article_per_story).** ([with one exception](https://www.reddit.com/r/canadapolitics/comments/3wkd0n/rule_reminder_and_experimental_changes/))
7. **replies to removed comments or removal notices will be removed** without notice, at the discretion of the moderators.
8. **downvoting posts or comments**, along with urging others to downvote, **[is not allowed](https://www.reddit.com/r/canadapolitics/wiki/downvotes)** in this subreddit. bans will be given on the first offence.
9. **[do not copy &amp; paste the entire content of articles in comments](https://www.reddit.com/r/canadapolitics/wiki/rules-thelongversion#wiki_9._do_not_copy_.26amp.3b_paste_entire_articles_in_the_comments.)**. if you want to read the contents of a paywalled article, please consider supporting the media outlet.

*please [message the moderators](https://www.reddit.com/message/compose?to=%2fr%2fcanadapolitics) if you wish to discuss a removal.* **do not reply to the removal notice in-thread**, *you will not receive a response and your comment will be removed. thanks.*


*i am a bot, and this action was performed automatically. please [contact the moderators of this subreddit](/message/compose/?to=/r/canadapolitics) if you have any questions or concerns.*",conservatives
h9rsi6d,2021-08-20T19:37:14.000-07:00,"opinion: in a campaign about nothing, liberals struggle to find a wedge issue both are marching steadily into the end of the world. if you had to choose between those two i guess you'd have to go with the prettier face.",liberals
h9rsnt9,2021-08-20T19:39:36.000-07:00,"opinion: in a campaign about nothing, liberals struggle to find a wedge issue at one point not too long ago, vancouver was the only place in bc that didn't level off - because of a lot of measures beyond the vacancy tax as well. i don't expect much changed since. basically 1. the measures worked and 2. vancouver is too far gone to be saved by them.",liberals
h9rt6ke,2021-08-20T19:47:20.000-07:00,trudeau to o’toole: pro-choice does not mean the freedom of doctors to choose [removed],liberals
h9rtaoi,2021-08-20T19:48:57.000-07:00,trudeau to o’toole: pro-choice does not mean the freedom of doctors to choose [removed],liberals
h9rtece,2021-08-20T19:50:24.000-07:00,"trudeau to o’toole: pro-choice does not mean the freedom of doctors to choose because if you can't do your job, then we don't want you in that position to begin with.",liberals
h9rtxbw,2021-08-20T19:58:07.000-07:00,conservatives' housing plan includes a two-year trial ban on foreign buyers [removed],conservatives
h9rtygg,2021-08-20T19:58:34.000-07:00,"the word ‘racism’ doesn’t appear anywhere in the conservative party’s campaign platform ###this is a reminder to [read the rules before posting in this subreddit](https://www.reddit.com/r/canadapolitics/wiki/rules-thelongversion).
 
1. **headline titles should be changed only [when the original headline is unclear](https://www.reddit.com/r/canadapolitics/wiki/rules-thelongversion#wiki_1._headline_titles_should_be_changed_only_where_it_improves_clarity.)**
2. **be [respectful](https://www.reddit.com/r/canadapolitics/wiki/rules-thelongversion#wiki_2._be_respectful).**
3. **keep submissions and comments [substantive](https://www.reddit.com/r/canadapolitics/wiki/rules-thelongversion#wiki_3._keep_submissions_and_comments_substantive).**
4. **avoid [direct advocacy](https://www.reddit.com/r/canadapolitics/wiki/rules-thelongversion#wiki_4._avoid_direct_advocacy).**
5. **link submissions must be [about canadian politics and recent](https://www.reddit.com/r/canadapolitics/wiki/rules-thelongversion#wiki_5._link_submissions_must_be_canadian_and_recent).**
6. **post [only one news article per story](https://www.reddit.com/r/canadapolitics/wiki/rules-thelongversion#wiki_6._post_only_one_news_article_per_story).** ([with one exception](https://www.reddit.com/r/canadapolitics/comments/3wkd0n/rule_reminder_and_experimental_changes/))
7. **replies to removed comments or removal notices will be removed** without notice, at the discretion of the moderators.
8. **downvoting posts or comments**, along with urging others to downvote, **[is not allowed](https://www.reddit.com/r/canadapolitics/wiki/downvotes)** in this subreddit. bans will be given on the first offence.
9. **[do not copy &amp; paste the entire content of articles in comments](https://www.reddit.com/r/canadapolitics/wiki/rules-thelongversion#wiki_9._do_not_copy_.26amp.3b_paste_entire_articles_in_the_comments.)**. if you want to read the contents of a paywalled article, please consider supporting the media outlet.

*please [message the moderators](https://www.reddit.com/message/compose?to=%2fr%2fcanadapolitics) if you wish to discuss a removal.* **do not reply to the removal notice in-thread**, *you will not receive a response and your comment will be removed. thanks.*


*i am a bot, and this action was performed automatically. please [contact the moderators of this subreddit](/message/compose/?to=/r/canadapolitics) if you have any questions or concerns.*",conservatives
h9rubg6,2021-08-20T20:03:54.000-07:00,‘i’m not justin trudeau. i’ve lived a different life’: jagmeet singh slams the liberal leader’s record on indigenous reconciliation [removed],liberals
h9rudy8,2021-08-20T20:04:53.000-07:00,"trudeau to o’toole: pro-choice does not mean the freedom of doctors to choose it's not really any different from now, but what they need to say is that, should a doctor wish to not do this, then they *legally* should be required to refer the person to someone who is. you don't get to be a doctor who is not okay with performing it, then also deny the rights of someone else to do so.

most people in life don't get the luxury to choose whether or not they can do what is effectively part of their job, and if you aren't \"qualified\" then you're referred to someone who is. it's a pretty easy thing to understand regardless of your beliefs.",liberals
h9rue6e,2021-08-20T20:05:00.000-07:00,"opinion: in a campaign about nothing, liberals struggle to find a wedge issue the liberals blamed harper for it so clearly it is something the prime minister has control over, at least according to the lpc.

&gt;\"when will this government quit electioneering and fear-mongering, and table a budget that addresses canada's cooling economy and overheated housing market?\" - [freeland, 2015.](https://www.youtube.com/watch?v=q4_53iaznae)",liberals
h9rupjm,2021-08-20T20:09:42.000-07:00,trudeau to o’toole: pro-choice does not mean the freedom of doctors to choose [removed],liberals
h9rv7f5,2021-08-20T20:17:05.000-07:00,trudeau to o’toole: pro-choice does not mean the freedom of doctors to choose well you'll love the fact that the cpc has been pushing for that for years.,liberals
h9rvawu,2021-08-20T20:18:30.000-07:00,trudeau to o’toole: pro-choice does not mean the freedom of doctors to choose [removed],liberals
h90drij,2021-08-14T18:32:44.000-07:00,is justin trudeau demonizing jason kenney because he can’t go after doug ford? [removed],liberals
h90e1ct,2021-08-14T18:36:49.000-07:00,"conservatives launch attack ad called ‘dumb’ by their own party members they are gonna regret passing on leslyn lewis as leader of the party….. she could have cornered jt on his shallow identitarianism, corruption and broken promises.  oh well",conservatives
h90fbnw,2021-08-14T18:55:58.000-07:00,conservatives email supporters in search of candidates ahead of federal election call [removed],conservatives
h90gdck,2021-08-14T19:11:53.000-07:00,"large crowd marches in montreal to protest against quebec's vaccination passport from the looks of it, the conservatives have adopted their current stance because they know they're not going to form government. so they're instead trying to please their base and ensure they don't dip below 25%",conservatives
h90hejj,2021-08-14T19:27:35.000-07:00,"ivison: trudeau's about to call an election with no purpose — other than to gain more power erin doesn’t support mandatory vaccinations for conservative candidates. he only recently kicked out one candidate for antivax views. he is opposed to prisoners receiving vaccinations before everyone else. this callous tough on crime attitude disproportionately hurts indigenous people who are in prison. i wish empathy-impaired politicians would not cater to those of low intelligence and who are full of hatred and racism. erin would let new brunswick choose how to fund abortions, so he is not really pro choice. to be fair, trudeau is also not pro choice, as he did nothing to tie transfer payments to abortion funding.",liberals
h90iepf,2021-08-14T19:42:47.000-07:00,thoughts on o'toole who's the current running candidate ?,conservatives
h90iv48,2021-08-14T19:49:32.000-07:00,conservatives launch attack ad called ‘dumb’ by their own party members [deleted],conservatives
h90iwi5,2021-08-14T19:50:04.000-07:00,conservatives launch attack ad called ‘dumb’ by their own party members [removed],conservatives
h90jhwo,2021-08-14T19:58:35.000-07:00,conservatives launch attack ad called ‘dumb’ by their own party members [removed],conservatives
h90lf7v,2021-08-14T20:26:15.000-07:00,is justin trudeau demonizing jason kenney because he can’t go after doug ford? [removed],liberals
gu8is3g,2021-04-11T19:13:54.000-07:00,"jagmeet singh's convention speech: 'some of us are in leaky lifeboats, while others are in luxury yachts' [full transcript] point being he is also one of the rich and elite.  unfortunately that is the way the world works.  he is spinning it and trying to use it to his advantage.   all the meanwhile the country is being stripped of its wealth, economy and anyone that could do anything about it is leaving the country and or trying to protect themselves and there wealth. fact of the matter is all of the other parties should be working together to try and remove the corrupt liberals.  however they all know now that the liberals are going to be removed next election and are trying to position themselves to grab power.  just remember that the ndp sided and enabled the liberals to maintain power.  ndp and singh are trying to transform canada.   how about we just try and do what’s best for all canadian citizens and focus on our economy, unemployment, and most importantly maintaining our rights and freedoms and strengthening our democracy.",liberals
gu8j60o,2021-04-11T19:20:35.000-07:00,"singh survives leadership review as 87 per cent of delegates vote against holding a race i searched uses of this term and found  horwath and scheer described as \"surviving\" leadership reviews. for horwath, 77%; scheer, percentage undisclosed and the vote was whether to open a leadership review not an actual review. also stray references to australian pms and even facebook's zuck surviving leadership reviews.

it seems the term is abused for sensationalism but in a nonpartisan way.",conservatives
hdxowhs,2021-09-22T16:29:29.000-07:00,"‘erin led us to this loss’: o’toole faces tough fight to save his leadership, conservative insiders say pro-tip: if cpc wants socially progressive and fiscal conservative's support, then be actually socially progressive. for example, sponsor legislations that aim to benefit lgbtqs, do not pander to social conservative voters in leadership race,  march in pride parade, actually reach out to and join minority communities, publicly state the party's support of climate action and gun control, etc. firmly shut the door to your party for social conservatives and then we can talk about cpc being an acceptable choice for socially progressives.",conservatives
hdxpa9v,2021-09-22T16:34:35.000-07:00,for everyone who voted ppc thank for re-electing trudeau you cite cdc studies regularly. you only find them to be credible when it suits you?,liberals
hdxq63r,2021-09-22T16:46:30.000-07:00,"the ppc got more than 800,000 votes, and that should worry all of us i mean apparently the liberal party is incapable of vetting burglars and sexual predators so does that make the lpc the \"rapist party\"?",liberals
hdxq8wl,2021-09-22T16:47:33.000-07:00,"election 2021: the final ridings he should join the liberal party.

it’s what i’m going to encourage my local ndp candidate to do. it doesn’t matter how good a candidate you, you can’t do shit for people if you’re in a party of losers who dance on stage after coming fourth and winning 1 seat. 

imagine what a great candidate with a proper campaign infrastructure behind them can do. michael couteau in don valley east is a great example.",liberals
hdxqncz,2021-09-22T16:52:55.000-07:00,"you might not love trudeau, but he is not to blame for canada's national discord justin didn't cause the division, in a few ways he's poured fuel on it, but covid has done most of the work in radicalizing people. 

but man does this article reveal that the author simply wants to live in the us. the us has different issues and while some of them show up in canada many don't and most don't show up to the same degree or intensity. others, like housing, show up far worse.

if you want to talk about political divides, maybe seeing things as a morality play between trump and obama is not a healthy lens to have in a completely separate country.",liberals
hdxr8zo,2021-09-22T17:01:10.000-07:00,"stephen maher: canada has shifted to the left well they would never win an election then, would they, because like it or not the electorate does not have an antagonist relationship with capitalism and has only recently begun to question the massive wealth of billionaires. 

trudeau is centre-left, he is not chretien. if trudeau was a neoliberal the neoliberal press wouldnt be so desperate to get rid of him - running headlines that he is ‘destroying the economy’ since he came into office. 

leftism is not the same thing as being on the ‘left’.",liberals
hdxrjsf,2021-09-22T17:05:16.000-07:00,"some advice for justin trudeau, inspired by bill davis: if the prime minister learns from the former premier’s example, he could find a road back to majority government [removed]",liberals
hdxt4dw,2021-09-22T17:27:51.000-07:00,"opinion: if anyone should be stepping down, it’s the likeable jagmeet singh an ndp leader that is pushing for more federal powers and has too often insisted that trudeau can easily ignore provincial jurisdiction, and suggests sending the army into provinces whether they like it or not is not going to do well in quebec lol",liberals
hdxtoyq,2021-09-22T17:36:21.000-07:00,"opinion: if anyone should be stepping down, it’s the likeable jagmeet singh being from quebec helps, and the religious attire does not, but beyond that singh appears to want to centralize power - trudeau tried to respect provincial jurisdiction within reason, but also likes federal programs, and the cpc is all for letting provinces do what they want. that’s why legault said the cpc was good for quebec.",liberals
hdxv5df,2021-09-22T17:58:25.000-07:00,"opinion: if anyone should be stepping down, it’s the likeable jagmeet singh i wholeheartedly disagree. if they are already disillusioned with trudeau why does singh need to demonize him even more? present a positive alternative to trudeau and they will flock to you. layton campaigned on optimism and hope for the future, and it worked. 

and singh's incessant attack ads aimed solely at trudeau earned him the ire of abc strategic voters, which is, y'know, the votes he needs to actually earn some seats. 

singh has a ton of charisma (just look at his numbers in the previous election and how they went sky-high once he was able to campaign and let the public get to know him) and was leading in leadership approval, but instead of leaning into that and playing up his own positives and embracing the role of the heir apparent, the *right guy to lead the country*, he tried to drag trudeau down, and so ended up back at the bottom in a mud wrestling match with the other two guys. 


it was incredibly stupid strategy and it cost the ndp.",liberals
hdxw7lc,2021-09-22T18:15:05.000-07:00,"enough already with the demonization of cbc’s rosemary barton cbc is not a political party making your point obviously politicized and bizarrely argumentative. as your o’toole analogy is based on cbc being a political entity. 

 one simply was to read the the judges decision to discover this was about copyright and nothing more   but no... neither of the two redditors retorting is willing to do that. because by doing so, maligns a long held conservative party rallying call to defund the cbc. 

adieu to you as well.",conservatives
h6cc0g1,2021-07-23T17:08:38.000-07:00,"federal polling (ekos) - lpc 35.2%, cpc 27.7%, ndp 18.5%, bq 5.6%, gpc 5.2%, ppc 4.5% yeg-griesbach/centre/millwoods are in play. vote splitting affects all three, but could see griesbach ndp and centre lpc.

calgary is a different ballgame, possibly yyc-skyview/centre in play. the trudeau brand remains incredibly toxic in alberta, so i don't think there will be much at play here.

this would make 6 non cpc seats, which is ok, but outside of strathcona there are no solid beach heads for lpc or ndp, they may get in based off unpopular cpc and ucp depending on the election.

griesbach has the demographics to be another solid ndp seat, but it will take more time to build the local association.",liberals
h6cfiop,2021-07-23T18:01:06.000-07:00,"federal poll (innovative) - lpc 41%, cpc 27%, ndp 17%, bq 5%, grn 4%, ppc 3%, mav 1% uhhhhhh no? i'm talking about a minority, not a coalition. coalition's are extremely rare in canada, but minority governments happen all the time. we're governed by one right now! as long as the government has the support of a majority of mp's, they continue to govern.



if the hypothetical seat results were



.

cpc: 140


liberal: 135


ndp: 35


bloc: 26


green: 2



.


then we wouldn't have a cpc minority. justin trudeau gets the first chance to govern, as he's leading the incumbent government. so the liberals could ask the ndp for support to govern, as their combined seats give them a majority of the house of commons. if the ndp agreed, the liberals would rule as a minority government with either a supply and confidence agreement, or the current set up, which is support on a case by case basis. a coalition is also possible, but those are extremely rare, and a minority via case by case support or supply and confidence is far more likely.",liberals
h6chv7j,2021-07-23T18:37:23.000-07:00,"erin o'toole draws fire from party insiders, his own mps over staff member who works for social conservatives imagine wanting harper back! the nerve of this guy lol",conservatives
h6ci02f,2021-07-23T18:39:34.000-07:00,"erin o'toole draws fire from party insiders, his own mps over staff member who works for social conservatives someone who’s more of a trump supporter than tool, harper’s even says it straight up unlike him.",conservatives
h6cimzz,2021-07-23T18:49:41.000-07:00,pierre trudeau ahead of harper as best recent pm for canadians [deleted],liberals
h6ciu77,2021-07-23T18:52:52.000-07:00,"pierre trudeau ahead of harper as best recent pm for canadians these are matters of opinions, not matters of fact. he is indeed mythologized.",liberals
hfycpdu,2021-10-08T16:48:36.000-07:00,the liberals promised to make housing more affordable. what if their policies do the opposite? 2016 to 2019 saw flat housing price growth.,liberals
hfyga33,2021-10-08T17:34:06.000-07:00,"‘not interested in apologies,’ first nation demands ‘institutional and widespread change’ from justin trudeau the media never seems to entertain the idea that first nations politicians are as adept as any at manipulating them, or else they're scared to raise the notion. listen to the pundits from big cities wax indignant on their behalf, taking them absolutely at face value. 

they would never do that about anything that was said by just about anyone else in politics.",liberals
hfyh4mn,2021-10-08T17:45:23.000-07:00,conservative caucus to vote on whether to enact power to remove o'toole oh yeah so dead! it’s not like the cpc is the official opposition.,conservatives
hfyhpmy,2021-10-08T17:53:11.000-07:00,"brace yourself — gas prices are hitting records as global energy crisis arrives in canada sadly for the worthless cpc they won't even be able to say a single thing when the recession hits  because they have adopted every single policy of the liberals so they would be criticizing themselves

hope the virtue signaling about  the carbon tax  was worth it enjoy christmas without power or presents this year 

i really hope that o'fool remains leader now it would mirror what happened in new zealand the government shitting the bed but the worthless cons are like a chicken with it's head chopped off so  the libertarian populist party act ( ppc ) rises and takes votes from both",liberals
h3s3qbu,2021-07-01T17:41:49.000-07:00,trudeau tells canadians to ‘be honest’ about our past in canada day statement also i don't know if it's just me but the maple leaf for an updoot and downward arrow for a downvote is also sickening.,liberals
h3s3qxn,2021-07-01T17:42:03.000-07:00,"what does it take for a trudeau cabinet minister to lose his or her job? no to mention neither of them were actually dismissed from cabinet, they voluntarily resigned.",liberals
h3s4176,2021-07-01T17:46:06.000-07:00,"mark carney would add 'credibility' to liberals in next federal election: nanos if that's true, that's one of the dumbest examples of putting politics above governance i can think of. why have the former head of the boc and bank of england who helped bring canada out of a deep recession and is clearly an expert in finance at the highest level be the minister of finance, when you could have a former writer?",liberals
h3s4569,2021-07-01T17:47:39.000-07:00,"trudeau tells canadians to ‘be honest’ about our past in canada day statement absolutely correct. but i implore you to to see what the treaties were signed for and what is being done. 

spoiler alert its not being treated as such.",liberals
h3s4nb4,2021-07-01T17:54:46.000-07:00,burning churches is 'unacceptable' way to respond to unmarked indigenous graves: trudeau [removed],liberals
h3s53yt,2021-07-01T18:01:12.000-07:00,burning churches is 'unacceptable' way to respond to unmarked indigenous graves: trudeau [removed],liberals
h3s67ay,2021-07-01T18:16:53.000-07:00,burning churches is 'unacceptable' way to respond to unmarked indigenous graves: trudeau [removed],liberals
h3sb47w,2021-07-01T19:29:00.000-07:00,what does it take for a trudeau cabinet minister to lose his or her job? [removed],liberals
