hbjj8gj,2021-09-03T16:45:07.000-07:00,"conservatives would repeal ban on guns used in école polytechnique, nova scotia mass shootings beowulf mags are still a grey area despite the firearms community asking for clarification. might need to check this one because it has been prohibited then legalized then informally prohibited them grey zoned several times and i stopped keeping up. even the comments in the forum post below people don’t know if they possess a prohibited weapon or just a random legal magazine because our gun laws are such a mess

https://www.canadiangunnutz.com/forum/showthread.php/1823982-why-are-lar-15-magazines-ok-but-not-beowulf

also bullpups are legal, an r870 shotgun is legal, turning your r870 into a bullpup is very very illegal you naughty boy!

$300 and you too can have a low rent ksg if the government will allow it!

https://www.bullpuparmory.com/bu870_bullpup_shotgun_kit_p/bpu-870.htm",conservatives
hbjjiy2,2021-09-03T16:49:05.000-07:00,"blanchet challenges o'toole to repeat things in english following the tva french debate it looked to me like blanchet was just flabbergasted that o'toole was not explaining anything at all and just saying \"on a un plan\" over and over. even if someone wasn't a threat, i'd still call them out on it because that claim is so vapid.",conservatives
hbjjwpj,2021-09-03T16:54:21.000-07:00,"conservatives would repeal ban on guns used in école polytechnique, nova scotia mass shootings cherry on top, from the rcmp’s data the types of firearms that were banned are rarely if ever used in gun crime in canada. it is usually illegally obtained pistols which are used most frequently, not $2000+ ar builds with $600 dollar optics that some guy used a license to buy and registered his name to as you are required to do with all restricted firearms.

https://www150.statcan.gc.ca/t1/tbl1/en/tv.action?pid=3510007201

also on this chart keep in mind the “fully automatic” row is already super duper illegal to own. “sawed off” rifles and shotguns are also very illegal.",conservatives
hbjk118,2021-09-03T16:55:58.000-07:00,"the future of cbc/radio-canada is at stake in this election did you read the analysis?

it’s no surprise that post-chretien, kinsella didn’t find a welcome spot among the martin liberals.  that doesn’t mean he’s not a lifelong liberal.

further, the ins-and-outs of that story are hardly settled just because some guy at canadaland says so.

maybe there was nothing there.  or maybe there was nothing that could go to print.

anyway, still waiting....",liberals
hbjkibl,2021-09-03T17:02:34.000-07:00,blanchet challenges o'toole to repeat things in english following the tva french debate [deleted],conservatives
hbjl0mr,2021-09-03T17:09:38.000-07:00,"o'toole vows to raise penalties for gun crimes the drug trafficker had to go into the bank to get his electronic transfer? would you mind explaining this?

i've always just accepted them electronically, on my phone. i've never had to go into the bank to have it transferred into my account.",conservatives
hbjl9jt,2021-09-03T17:13:03.000-07:00,"canada federal election: how much trouble is trudeau in? &gt;	the rest of the world is more conservative then canada 

cuba would beg to differ",liberals
hbjlenx,2021-09-03T17:15:06.000-07:00,o'toole vows to raise penalties for gun crimes so what if suicides ar counted? a gun in the house still increases the chances of suicide.,conservatives
hdowc38,2021-09-20T16:54:38.000-07:00,election 2021: post-game discussion she didn't help the liberals gain seats in richmond and york region though.,liberals
hdowdnm,2021-09-20T16:55:15.000-07:00,cbc projects liberal victory yeah i think so too. i think if covid wasn’t a thing we could easily be looking at a cpc minority now. trudeau wedged covid well against the cpc.,liberals
hdowfxe,2021-09-20T16:56:08.000-07:00,"election 2021: post-game discussion alternatively...the ndp are at a crossroads.  they can either continue to plow toward a median voter appeal where they're basically flirting with potential lib-ndp swing voters (which seem more and more rare).  caps them at this sort of result, where they can swing a handful of votes depending on the margins in a few ridings.

or they can actually grow a backbone and strive to establish themselves as a true \"governing option\" to the left of the liberals.


i can't speak for others.  but i felt bad, voting ndp this election.  i don't support what they did, or what the party stood for in this election.  it was just a...\"least bad\" vote.  

there is a wave of disillusioned voters, especially toward the younger end of the scale...who seem to be on their last legs in terms of ndp support.  it's starting to really show through even within the party dynamics and candidates where you can draw lines through the ndp between the \"radical progressives\" and the \"incrementalists\".  i don't know how much longer you can hold together a coalition like that, without striving for more than \"holding a balance of power hammer\" in a minority liberal government.",liberals
hdowgpo,2021-09-20T16:56:27.000-07:00,"election 2021: post-game discussion yeah but take a look at the rest of calgary, the liberals barely won in skyview but there's a massive gap in every other riding. it's only edmonton that has a few close ones",liberals
hdowjrd,2021-09-20T16:57:37.000-07:00,election 2021: post-game discussion any idea how the mail-in ballots should go? i understand the liberals should do well; any idea how the ndp will do?,liberals
hdowl9r,2021-09-20T16:58:13.000-07:00,election 2021: post-game discussion there was some absolutely insane vote efficiency for the liberals in the gta and gva.,liberals
hdowmrc,2021-09-20T16:58:48.000-07:00,"election 2021: post-game discussion the whole strategy of o'toole was \"let's go to the center and make gains in the gta\" and he's currently losing seats...",conservatives
hdownex,2021-09-20T16:59:04.000-07:00,election 2021: post-game discussion some other pollster had burnaby north - seymour as the majority tipping point. liberals are up there by 10%,liberals
hdowrc0,2021-09-20T17:00:37.000-07:00,"election 2021: post-game discussion there inefficient vote got worse because of worse margins in greater vancouver and york region. there vote dropped like 10 or more percent in some ridings in these regions. they lost vancouver south in a surprise landslide, richmond center and richmond stevenson east are likely going to both flip to the liberals by a comfortable margin, they lost aoh and markham unionville in york region and the liberals margin in almost every riding in york region increased dramatically.",liberals
hdowrub,2021-09-20T17:00:50.000-07:00,"election 2021: post-game discussion young people not voting has always effected parties but the ndp have had far better showings since 2000. a big issue personally seems to be the ndp are liked by many loved by few. many liberals \"love jagmeet\" and say they would like to see him as pm but they still vote lpc for a variety of reasons. this is frustrating because the only poll that matters is the election results and since my first comment it's looking like the ndp will finish with 25 seats. +1 since 2019. that is pretty abysmal in my books. there are some close races and positives to look at but my big concern for the ndp is the lack of compelling candidates and ridings for the east. ontario, quebec and atlantic canada need to be far more important for the ndp going forward. it is embarrassing to leave tonight with a single ndp mp from east of ontario.",liberals
hdowvio,2021-09-20T17:02:18.000-07:00,"full transcript: justin trudeau says canadians have chosen 'a progressive plan' in victory speech ###this is a reminder to [read the rules before posting in this subreddit](https://www.reddit.com/r/canadapolitics/wiki/rules-thelongversion).
 
1. **headline titles should be changed only [when the original headline is unclear](https://www.reddit.com/r/canadapolitics/wiki/rules-thelongversion#wiki_1._headline_titles_should_be_changed_only_where_it_improves_clarity.)**
2. **be [respectful](https://www.reddit.com/r/canadapolitics/wiki/rules-thelongversion#wiki_2._be_respectful).**
3. **keep submissions and comments [substantive](https://www.reddit.com/r/canadapolitics/wiki/rules-thelongversion#wiki_3._keep_submissions_and_comments_substantive).**
4. **avoid [direct advocacy](https://www.reddit.com/r/canadapolitics/wiki/rules-thelongversion#wiki_4._avoid_direct_advocacy).**
5. **link submissions must be [about canadian politics and recent](https://www.reddit.com/r/canadapolitics/wiki/rules-thelongversion#wiki_5._link_submissions_must_be_canadian_and_recent).**
6. **post [only one news article per story](https://www.reddit.com/r/canadapolitics/wiki/rules-thelongversion#wiki_6._post_only_one_news_article_per_story).** ([with one exception](https://www.reddit.com/r/canadapolitics/comments/3wkd0n/rule_reminder_and_experimental_changes/))
7. **replies to removed comments or removal notices will be removed** without notice, at the discretion of the moderators.
8. **downvoting posts or comments**, along with urging others to downvote, **[is not allowed](https://www.reddit.com/r/canadapolitics/wiki/downvotes)** in this subreddit. bans will be given on the first offence.
9. **[do not copy &amp; paste the entire content of articles in comments](https://www.reddit.com/r/canadapolitics/wiki/rules-thelongversion#wiki_9._do_not_copy_.26amp.3b_paste_entire_articles_in_the_comments.)**. if you want to read the contents of a paywalled article, please consider supporting the media outlet.

*please [message the moderators](https://www.reddit.com/message/compose?to=%2fr%2fcanadapolitics) if you wish to discuss a removal.* **do not reply to the removal notice in-thread**, *you will not receive a response and your comment will be removed. thanks.*


*i am a bot, and this action was performed automatically. please [contact the moderators of this subreddit](/message/compose/?to=/r/canadapolitics) if you have any questions or concerns.*",liberals
hdowz7a,2021-09-20T17:03:46.000-07:00,"election 2021: post-game discussion when it comes down to it, a lot of people just don't understand how our system works well enough to make strategic voting decisions. for example, i've had people living in hamilton centre tell me they'd vote ndp, but they need to vote liberal to block the conservatives... in a riding the ndp has dominated literally as long as it's existed in its current form. it's incredibly frustrating, but with how lacking civics education is in this country it's also not entirely surprising that many people have no idea how votes actually translate into seats under our electoral system.",conservatives
hdowzv5,2021-09-20T17:04:02.000-07:00,"cbc projects liberal victory i'm going to be totally honest with you and say i don't even remotely have it off hand. someone posted it on this sub a week or two ago when this similar discussion came up which is where i learned about it as well. my general understanding is they explored it, it was going to be ranked ballot, the cpc fought hard against it and ndp said they would only think about backing it if it went to referendum. trudeau likely knew that would fail and so tried to talk himself out of it. i voted lib 3 elections ago. his atrocious handling of this topic easily lost my vote over the last 2 elections. so i can at least relate to your apprehensiveness. sorry i don't have a better source other than my garbage memory.",liberals
hdox72x,2021-09-20T17:06:53.000-07:00,election 2021: post-game discussion who would replace o'toole? that's the real question for me.,conservatives
hdoxbls,2021-09-20T17:08:44.000-07:00,election 2021: post-game discussion yeah. if the liberals won 45 seats in quebec instead of 33-34 they would have gotten a majority.,liberals
hdoxf37,2021-09-20T17:10:10.000-07:00,"election 2021: post-game discussion yeah it's so weird. the liberals sweeping richmond and delta.

incredible vote efficiency.

man i hate fptp",liberals
hdoxg57,2021-09-20T17:10:36.000-07:00,"election 2021: post-game discussion if all the polling data regarding mail in ballots is accurate (that they’re much more likely to go liberal/ndp), it’s almost guaranteed the cpc are going to finish under 120. 

edmonton centre, sault ste marie and kitchener-conestoga would stay liberal, and there’s a very good chance the liberals flip charleswood-st james-assiniboia-headingley",liberals
hdoxhrj,2021-09-20T17:11:15.000-07:00,election 2021: post-game discussion after tonight no party will want to have another election anytime soon especially the conservatives and ndp.,conservatives
hdoxir3,2021-09-20T17:11:41.000-07:00,"cpc candidate defeats cabinet minister maryam monsef i don’t think so. i think her citizenship is protected as long as the liberals remain in power. the matter won’t be pursued even though others without political connections have been deported due to the same cause. an attempt should be made to revoke once the government changes.

that said, i suspect that she may be parked in the senate or elsewhere.",liberals
hdoxn6n,2021-09-20T17:13:32.000-07:00,full transcript: justin trudeau says canadians have chosen 'a progressive plan' in victory speech [removed],liberals
hdoxpi2,2021-09-20T17:14:31.000-07:00,"election 2021: post-game discussion o'toole will not get fired out of a canon and into the sun, but i can't see him winning leadership. i also can't see anyone who could win the leadership and win the national election.

i like chong, but after o'toole are the cpc really going to elect another centre-right tory?",conservatives
hdoxvef,2021-09-20T17:16:54.000-07:00,"election 2021: post-game discussion trudeau is a bit of a mixed bag on climate action, but he'll push for climate action at international forums right? thinking about what's in this result for me as a non canadian",liberals
hdoy5yl,2021-09-20T17:21:14.000-07:00,"election 2021: post-game discussion markham-unionville too, which is ontario's richmond centre in terms of demographics.

there's been a lot of anti-trudeau sentiment amongst the hong kong and chinese community the past two years, as he was either seen as not being strong enough against china for the hong kongers, or being strung along by the us for the more recent chinese immigrants.

i say this as i'm originally from hong kong, and around/in touch with a lot of mainlanders too.",liberals
hdoy8nr,2021-09-20T17:22:26.000-07:00,election 2021: post-game discussion o'toole compared to scheer had a massive swing against in parts of greater vancouver and york region compared to 2019. i don't think the greens or ppc had anything to do with the swings in some of the seats in these regions.,conservatives
hdoy9d1,2021-09-20T17:22:44.000-07:00,election 2021: post-game discussion trudeau must really hate angus reid now,liberals
hdoycdk,2021-09-20T17:24:00.000-07:00,"election 2021: post-game discussion yeah, my friend convinced his dad to vote ndp instead of \"strategically\" voting conservative here against the liberals. 

we really need to do a better job teaching how government works in this country.",liberals
hdoydy2,2021-09-20T17:24:40.000-07:00,"election 2021: post-game discussion i would think that they need to stick with the plan but flesh out the platform.  that the ndp didn't have a leading environmental plan that they could point to with the 5 w's hurt sing in the debate.  they need more than just catchy lines.  solid details when asked would go a long way to countering the narrative that they can promise anything because they know they don't have to follow through.  if you want to make government then you need to show you have a plan on how to do it.

sing did a very good job over the last few years winning canadians over that he is more than just a minority virtue signal pick, but a real and genuine guy.  that he is viewed as most likeable among the leaders is the foundation they need moving forward.  i also think he needs more time with a debate coach and really prep for next year.

trudeau, as much as people may dislike him, is a giant on the debate stage.  super hard to put him off his game as is evidenced by even the random encounters he has with people on the streets.  keep in mind that when he was first elected he did that cross country town hall and that made for plenty of sound bites of him handling protestors like a pro.  but as time has gone on he has to stand on his record rather than platitudes.  that means every election he is more open to a fair attack.  to me that makes for an opening for a repeat of jacks performance in 2008.  now i am not saying that sing should be jack, but he should be ready and willing to demonstrate with facts why the other leaders are not up to the task.",liberals
hdoysop,2021-09-20T17:30:57.000-07:00,"election 2021: post-game discussion on the contrary, some mainland china immigrants might have thought o'toole would be too harmful to canada-china relations. not necessarily even out of any love for the ccp, but just things like \"pm o'toole might get into some diplomatic war with china that makes it harder for me to fly home to see my family or vice versa\", etc.",conservatives
hdoyw3l,2021-09-20T17:32:25.000-07:00,cbc projects liberal victory yeah the 'left' only really supports trudeau if you use the right wing's definition of the 'left'.,liberals
hdoyzf9,2021-09-20T17:33:51.000-07:00,5 things conservatives needs to do asap half of your plan contradicts the other half,conservatives
hdoz13l,2021-09-20T17:34:32.000-07:00,5 things conservatives needs to do asap care to explain?,conservatives
hdoz13t,2021-09-20T17:34:32.000-07:00,full transcript: justin trudeau says canadians have chosen 'a progressive plan' in victory speech [removed],liberals
hdozbhi,2021-09-20T17:39:01.000-07:00,5 things conservatives needs to do asap you want to make pierre the leader and attract moderates? you don’t want to chase progressives when they make up the majority of the electorate in area like toronto? you want an actual conservative plan with conservative values whilst trying to court visible minorities? you want to go on an offensive against the media when canadians are vehemently against american style politics?,conservatives
hdozgcg,2021-09-20T17:41:08.000-07:00,"election 2021: post-game discussion i'm not so sure. part of a leadership review has to answer the questions - where do we go from here and how do we form a government? does o'toole's performance answer those questions?   

his efforts to move the party to the centre have not improved the party's fortunes anymore than they have impressed or energized the conservative base of the party.   the poor performance of maxime bernier's ppc should not be taken as an indication that the right is dead - just that they don't want to repeat the whole reform / pc debacle of the 1990's.  the neo-liberal / social conservative base of the cpc is still the dominant force in alberta, saskatchewan and parts of bc (fraser valley / okanagan).  but i don't get the sense that conservatives from the suburbs of toronto are as passionate about the same issues.  i think it will take a very skilled politician to unite these factions and i don't think o'toole is that person.  

the opportunists in the party may not cut his head off immediately, but they will weaken him with a thousand tiny cuts and then hold the sword when he is ready to fall on it.",conservatives
hdozj6o,2021-09-20T17:42:25.000-07:00,"election 2021: post-game discussion fully agreed that the ppc vote is made up of way more than just former conservatives. look at hamilton for a good illustration of that. the conservatives are currently sitting at almost the exact same as their 2019 results in hamilton centre, east, and mountain, yet the ppc picked up 6 to 8% of the vote in each riding. while it's certainly likely that the conservatives lost some votes to the ppc (and made them up through transfers from the other parties), the idea that they cycled 1/4 to 1/3 of their votes in this way seems pretty hard to believe. timmins-james bay in northern ontario is an even more stark illustration, with the conservatives actually gaining votes despite the ppc skyrocketing to 14% from 3.5% last time. the fact is that populism and anti-vaccine rhetoric both have appeal in more than just the conservative base and to dismiss the whole party as nothing more than right wing vote splitters is to underestimate their coalition by quite a bit.",conservatives
hdozmz1,2021-09-20T17:44:02.000-07:00,election 2021: post-game discussion it looks like ekos seat projection in ontario will be the closest in the end. the liberals could hit 80 seats there in the end.,liberals
hdozocx,2021-09-20T17:44:38.000-07:00,"election 2021: post-game discussion if we’re talking on the world stage trudeau is a lot less of a mixed bag on climate then most world leaders, but yes, liberals over conservative is very important on the world stage for climate cooperation, let alone most issues of international cooperation.",liberals
hdozpzx,2021-09-20T17:45:23.000-07:00,election 2021: post-game discussion it didn't help the conservatives much that they were sending those awful flyers to some households if i recall in markham unionville.,conservatives
hdozwed,2021-09-20T17:48:08.000-07:00,cbc projects liberal victory because federal conservatives are not the same as the ucp in alberta...,conservatives
hdp05cg,2021-09-20T17:51:57.000-07:00,"election 2021: post-game discussion let me put it this way.

nobody is going to push trudeau out against his will. but he may be persuaded to do so.

if the cpc decide leslyn lewis is the next leader, he's not going anywhere and the lpc won't force him out and he will run again.",liberals
hdp08t6,2021-09-20T17:53:28.000-07:00,"election 2021: post-game discussion the earliest they can start counting is today (tuesday), but they have up to 5 days to complete the count if needed. i know glengarry-prescott-russell isn’t even going to start counting the mail in ballots until wednesday, 2 days after election day. the liberals are ahead by 9% and have already been declared the winner, so it won’t matter, but it goes to show that some ridings might take 2-5 days after election day to get their mail in ballots counted.",liberals
hdp0jfd,2021-09-20T17:58:13.000-07:00,"election 2021: post-game discussion conservative party - change in popular vote vs. 2019 (mail-in ballots not counted yet)

sk: 60% (-4)

ab: 55% (-14)

mb: 40% (-5)

bc: 33% (-1)

vs.

on: 35% (+2)

nb: 34% (+1)

pe: 32% (+5)

nl: 32% (+5)

ns: 30% (+4)

qc: 19% (+3)

there you go. erin o'toole got what he wanted - trading support in the west for support in the rest of the country. just not sure the tories are ready to have him double down on the strategy because it didn't result in net seat gains.",conservatives
hdp18ji,2021-09-20T18:09:14.000-07:00,election 2021: post-game discussion we ended up with a worse version of 2019 but across the country. instead of the trend being localized in the prairies it spread to the rest of the country. the tories did way better in rural areas this time especially in eastern canada but fell back a bit in more urban areas. i don't think o'toole is going to be happy about this.,conservatives
hdp1fo3,2021-09-20T18:12:28.000-07:00,"election 2021: post-game discussion a party also doesn't kick out the sitting pm against their will unless they want to end up looking like the greens.

trudeau has the job for as long as he wants the job and if he sees the cpc swing back to the right and abandon the center he's going to want it much longer than if the cpc remains committed to the center.",liberals
hdp1jlz,2021-09-20T18:14:15.000-07:00,discussion thread - the 44th canadian general election the liberals could support them.,liberals
hdp1jz5,2021-09-20T18:14:26.000-07:00,"election 2021: post-game discussion &gt;ppc factor cost close races in calgary

the ppc votes don't cover the difference in skyview. in calgary centre the cpc lost almost 5% of the vote without a ppc candidate; in confederation they lost 9%; in forest lawn they lost 20%; in heritage they lost 13%; in midnapore they lost 13%; in nose hill they lost 14%; in rocky ridge they lost 13%; in shepherd they lost 15%; and in signal hill they lost 12%. conservatives have become substantially less popular in urban alberta, and it cost them at least two seats, it's just that they had such huge leads that the other ridings didn't flip.",conservatives
hdp1kvp,2021-09-20T18:14:52.000-07:00,"discussion thread - the 44th canadian general election hey folks, first time poster here. i just wanted to ask if someone could give me an unbiased view on how justin trudeau has done in the past 2 terms? or if i could be pointed to sources that might provide the info.  thanks in advance!",liberals
hdp1ok5,2021-09-20T18:16:33.000-07:00,"cbc projects liberal victory &gt; nearly three quarters of canadians voted for someone other than the liberals

not to nit-pick, but even at 30% support for the liberals it would be more accurate to call it \"over two-thirds\" rather than \"nearly three-quarters\". as i write this, their support has gone up slightly to 32.2%.",liberals
hdp1q61,2021-09-20T18:17:17.000-07:00,"so, where do we go from here? for liberals, the final count is still to be counted but they're currently getting smaller vote share this election than 2019 even if they possibly getting same or more seats. so that's back to back election where he's getting fewer vote share than previous election.",liberals
hdp24w5,2021-09-20T18:23:51.000-07:00,5 things conservatives needs to do asap pierre doesn't want to be leader though. you can't *make* someone leader if they don't want it lol.,conservatives
