h0o7zof,2021-06-04T20:35:26.000-07:00,"trudeau calls on catholic church to publish residential school records, urges catholics to apply pressure religious organizations are tax exempt in some countries however",liberals
h0o8j1i,2021-06-04T20:42:55.000-07:00,"trudeau calls on catholic church to publish residential school records, urges catholics to apply pressure [removed]",liberals
h0o8lb6,2021-06-04T20:43:48.000-07:00,"trudeau calls on catholic church to publish residential school records, urges catholics to apply pressure [deleted]",liberals
h0o9dxa,2021-06-04T20:54:39.000-07:00,"trudeau calls on catholic church to publish residential school records, urges catholics to apply pressure oof. that name though...

i think i will send them some mail. thanks for the address!",liberals
h0o9y7k,2021-06-04T21:02:26.000-07:00,"trudeau calls on catholic church to publish residential school records, urges catholics to apply pressure yeah dont call all of us indians. we aren't from india.",liberals
h0oa207,2021-06-04T21:03:52.000-07:00,"trudeau calls on catholic church to publish residential school records, urges catholics to apply pressure that's just not true about the clean water. in 2015 there were drinking water advisories in 126 first nation communities and there are currently 33 communities with advisories. yes, that is short of the goal of march 2021 to have them all fixed but it is real progress and they are still working to fix the last 33.",liberals
h0ob2be,2021-06-04T21:17:13.000-07:00,"trudeau calls on catholic church to publish residential school records, urges catholics to apply pressure i don't like it simply for practical reasons. the expat indian (from india) community in canada is enormous. it is larger than the indigenous population in most urban areas. when hicks describe indigenous people as \"indian\" it just confuses me because i naturally presume they are actually indian, until i figure out that they are not, and the person is just a hick.",liberals
h0ob4wi,2021-06-04T21:18:10.000-07:00,"trudeau calls on catholic church to publish residential school records, urges catholics to apply pressure [removed]",liberals
h0obhlf,2021-06-04T21:22:39.000-07:00,"trudeau calls on catholic church to publish residential school records, urges catholics to apply pressure if that were the criteria, there would be no actual billionaires in the world. nobody’s looking at their bmo savings account to count their billions.",liberals
h0obpql,2021-06-04T21:25:36.000-07:00,trudeau will do covid-19 hotel quarantine after g7 meetings in u.k. [removed],liberals
gs9swk5,2021-03-25T18:59:44.000-07:00,"oosterhoff's extreme anti-choice views should be a 'bridge too far' in politics &gt;they even mobilized to oppose the climate change motion at the recent conservative party convention because (somehow??) that is linked to abortion too.

i have a guess that (i certainly have no special information!) they may have voted the motion down as payback for o'toole representing himself as on their side during the leadership campaign and then changing course once he got the leadership.  if that's the case then o'toole losing the next election and subsequently being removed as leader wouldn't cause them any sorrow.",conservatives
hpw9upb,2021-12-24T15:24:52.000-08:00,"provincial health officials warn record covid-19 cases are underestimations * quebec, ontario, manitoba and british columbia reported record high covid-19 case counts on christmas eve as nunavut ordered a full lockdown to prevent further spread of the virus.
* health officials across the country warned the latest numbers are an underestimation and a sign what is yet to come, and again urged people to rethink large gatherings over the holidays.
* quebec reported just over 10,000 new daily infections on friday, a record over the 9,397 cases reported a day earlier. 
* ontario had 9,571 new cases, a jump from 5,790 on thursday.
* b.c. reported 2,441 daily cases and a total of 10,415 active cases. the new cases overshadowed the previous record on thursday of 2,046 infections.
* manitoba announced 742 daily cases, its highest yet in the pandemic.
* in his annual christmas message posted on facebook, prime minister justin trudeau urged canadians to \"keep showing up for one another\" by following public health measures and encouraging friends and family members to get vaccinated.",liberals
hpwbdwt,2021-12-24T15:47:06.000-08:00,"liberals put 6-month pause on efforts to lower cost of patented medicines this is a talking point i've heard a lot of people say and it's frankly not true. 80% of drug development is done by scientists working for r&amp;d departments in pharma companies. most of the research in universities is basic and not applied science research, which yes pharma companies use but actual drug discovery happens at the pharma companies.",liberals
hhpqopx,2021-10-22T16:06:36.000-07:00,"conservatives, just get your shots already [removed]",conservatives
hhpqsbs,2021-10-22T16:07:58.000-07:00,"conservatives, just get your shots already these “reporters” are just talking heads.  don’t read too much into it.",conservatives
hhpqt2v,2021-10-22T16:08:17.000-07:00,"bc liberal party rejects aaron gunn’s leadership bid, he says fight ‘is only just beginning’ &gt; gunn, a “small-c conservative” who ran on a slogan of “bring back common sense,”

never been a big fan of common sense, to be honest - just too much opportunity to package all sorts of nonsense as common sense.",liberals
hhpr5jm,2021-10-22T16:12:58.000-07:00,"conservatives, just get your shots already [removed]",conservatives
hhpsccj,2021-10-22T16:29:40.000-07:00,"conservatives, just get your shots already saying that someone has a right to choose, and then stripping them of all their citizen rights due to that choice is contradictory.",conservatives
hhpt86e,2021-10-22T16:41:44.000-07:00,"o'toole does about-face on vaccine mandate for mps in commons, now says decision 'infringes' on their rights &gt;the unvaxxed are how new variants of the virus evolve

careful with such claims. the virus mutates in all hosts that carry it, vaccinated or not, human or not.

also with the current vaccines even a 100% vaccination rate won't \"end the crisis\". the general efficacy dictates full herd immunity cannot be reached, particularly with it waning after 6 months fairly significantly. 

it's the best we have for now unfortunately, but it's important to keep realistic expectations.",conservatives
hhptj15,2021-10-22T16:45:58.000-07:00,"bc liberal party rejects aaron gunn’s leadership bid, he says fight ‘is only just beginning’ [removed]",liberals
hhptof0,2021-10-22T16:48:01.000-07:00,"ndp will vote against the liberals ‘if they do something that hurts canadians,’ jagmeet singh says the delight people take in saying they are broke is beyond me.

it's like reveling in the other major parties being bought and paid for.",liberals
hhpudzf,2021-10-22T16:58:02.000-07:00,"conservatives, just get your shots already poilievre is electoral poison — his true-blue fan club loves him, everyone else hates him.",conservatives
hhpvb9x,2021-10-22T17:11:18.000-07:00,'stirring up sentiment': trudeau pours cold water on kenney’s equalization vote i don’t think you read what i wrote. i was pointing out the hypocrisy of the federal government and the silly changes in messaging along with it.,liberals
hhpvbqf,2021-10-22T17:11:30.000-07:00,"conservatives, just get your shots already [removed]",conservatives
hhpwiwh,2021-10-22T17:29:18.000-07:00,"o'toole does about-face on vaccine mandate for mps in commons, now says decision 'infringes' on their rights &gt; everyone, including the vaccinated are still at risk of contracting and transmitting the virus.

unvaccinated are for more likely to catch and transmit.",conservatives
hhpy8y9,2021-10-22T17:54:42.000-07:00,"conservatives say they're against decision to make covid-19 vaccines mandatory for mps how can the federal government require government accountants and call centre staff to get vaccinated, some of whom remain to work from home, while mps who physically cramp 338 into a room, with pages, aids, support staff, visitors, media, and security, many of whom will fall into contact with the unvaccinated mps for prolonged periods in confined spaces (offices, hallways, etc)?",conservatives
ghvek9y,2021-01-02T06:49:16.000-08:00,"conservative mp ron liepert has travelled to california twice since march for 'essential house maintenance' so, your response to this conservative politician doing this is literally, \"but, but trudeau!\"...

not even acknowledging the topic at hand...",liberals
hqo32uy,2021-12-30T18:50:14.000-08:00,beijing says canada-china relations ‘at a crossroads’ after trudeau’s ‘coercive diplomacy’ comment - national in a chinese court the gweiloh is always in the wrong.,liberals
hqo4w4d,2021-12-30T19:14:03.000-08:00,"beijing says canada-china relations ‘at a crossroads’ after trudeau’s ‘coercive diplomacy’ comment - national the us can be convinced to change their opinions and rhetoric. whisper the right words into bernie sanders' or aoc's ear, slip manchin and friends a $5 million dollar \"donation\" and things will change-albeit very slowly but, change will happen.

the only way change will come to china is through the use of overweening force. drop 24 emp bombs over the major industrial cities of china in late january, watch as all industry and infrastructure crumbles, the ccp falls and the survivors come hat in hand to the roc and its allies to make things work again. only then will the prc change.",liberals
hqo6sz0,2021-12-30T19:39:14.000-08:00,"trudeau calls the unvaccinated racist and misogynistic extremists funny didn't cure my mom's racism and i'm still a mysoginist.... jks. i just hate my cheating thieving ex wife, who now is a professional hoe.",liberals
hqo82tn,2021-12-30T19:55:28.000-08:00,beijing says canada-china relations ‘at a crossroads’ after trudeau’s ‘coercive diplomacy’ comment - national [removed],liberals
h105nws,2021-06-07T16:34:24.000-07:00,"liberals, bloc vote to end bill c-10 study amid social media free speech concerns [removed]",liberals
h105t0w,2021-06-07T16:36:20.000-07:00,"liberals, bloc vote to end bill c-10 study amid social media free speech concerns nah, the consumers are wrong. we need to coerce them to watch the schlock they're not watching on cbc gem.",liberals
h105x5b,2021-06-07T16:37:56.000-07:00,"liberals, bloc vote to end bill c-10 study amid social media free speech concerns uh what? if they produce a show, and then post clips of that show to youtube as promotional content, a canadian biased search algorithm will bring those clips higher than they would otherwise rise.",liberals
h10a7c3,2021-06-07T17:41:05.000-07:00,"why does justin trudeau’s government continue to fight indigenous compensation claims in court? ‘i can’t make sense of it,’ top advocate says uh, by what metric?",liberals
h10bfhm,2021-06-07T18:00:23.000-07:00,"why does justin trudeau’s government continue to fight indigenous compensation claims in court? ‘i can’t make sense of it,’ top advocate says they win most of the federal elections.  since 1900, the liberal party of canada has been the most successful political machine in the western world.",liberals
h10bnc7,2021-06-07T18:03:51.000-07:00,"why does justin trudeau’s government continue to fight indigenous compensation claims in court? ‘i can’t make sense of it,’ top advocate says haven’t they been in power 70 out of canada’s 152 years ? which is less than half, and the last two term party was harpers? either way, seems weird as hell to try to say the treatment of aboriginals is the fault of a specific party and not both as a whole?",liberals
h10box3,2021-06-07T18:04:33.000-07:00,"politicos predict a september federal election, but if not, expect october 2023 politicos were predicting an election all spring. i thought there was very little reason to expect that, and if it did the most likely outcome would be a similar parliament with a liberal minority.

i'd say fall is more likely, but i happen to think the liberals *might* continue longer than expected as long as they don't get stonewalled - they have a strong minority with 3 possible partners to pass any measure.",liberals
h10bu25,2021-06-07T18:06:46.000-07:00,"why does justin trudeau’s government continue to fight indigenous compensation claims in court? ‘i can’t make sense of it,’ top advocate says both parties are obviously at fault.  but most of the horrendous and monstrous things done during the twentieth century and beyond have been done under liberal governments, merely because they've dominated the political scene.  that cannot be ignored.",liberals
h5qg0cs,2021-07-18T19:28:53.000-07:00,"[deleted by user] i’d say nanos is correct and the online polls are all wonky again. parties always have better data than what’s publicly available. looking how they’re behaving certainly not the impression that you get that they’re in a dead heat within the margin of error. i’m betting  that the parties internal data looks much the same as nanos. hence why the ndp are making strides as are the liberals while the cpc is in a full blown panic attack.

singh sees an opportunity to get massive seat gains as does trudeau... o’toole is trying to stave off outright collapse/defeatism

but besides all that, saying polls were “best” is a deeply silly way to group polls. polls are a snapshot in time and as long as it is close enough to be within the margin of error it counts. the only thing that really matters is the trend lines anyway since they’re discreet data points 

i’d say that telephone polling has become more effective at controlling for its downsides and the samples are bigger. plus, pandemic, people are at home bored.",liberals
h5qgi4n,2021-07-18T19:36:09.000-07:00,eric grenier : why erin o'toole's best pm numbers are a problem [removed],conservatives
gzqbxod,2021-05-27T16:34:33.000-07:00,hiring boris johnson’s advisers shows erin o’toole’s conservatives don’t plan to play nice [removed],conservatives
gzqcnii,2021-05-27T16:44:02.000-07:00,hiring boris johnson’s advisers shows erin o’toole’s conservatives don’t plan to play nice [removed],conservatives
gzqdhp6,2021-05-27T16:55:28.000-07:00,"crtc scraps plan to mandate lower wholesale internet rates &gt; conservatives and everyone else that didn’t read it is

that's both an enormous assumption and unfair accusation. criticism of c-10 isn't confined to a political affiliation, and much of that criticism is informed and insightful.

&gt; a guy saying some opinionated stuff

it's pointed out elsewhere, but you're referring to canada's pre-eminent authority on digital law. if you're going to accuse critics of c-10 of not reading the bill, you might want to at least familiarize yourself with the qualifications of those critics, if not the content of their criticism.",conservatives
gzqe99r,2021-05-27T17:05:59.000-07:00,"canada supports u.s. efforts to seek origins of covid-19 -pm trudeau i wholeheartedly support this decision. if nothing else the truth will educate us on how to avoid this problem in the future.

nothing could be worse than burying our heads in the sand and not learning a single lesson from this global pandemic",liberals
gzqebzi,2021-05-27T17:07:00.000-07:00,"the reboot no one asked for: trudeau is reviving “fairplay”, bell’s failed website blocking plan you get to chose your distribution as the creator.",liberals
gzqeepo,2021-05-27T17:08:03.000-07:00,"hiring boris johnson’s advisers shows erin o’toole’s conservatives don’t plan to play nice there's a certain breathtaking arrogance in arguing that if one party wins it's because they fooled the electorate, whereas if other parties win it's because that's what the electorate wanted.",conservatives
gzqegwb,2021-05-27T17:08:55.000-07:00,hiring boris johnson’s advisers shows erin o’toole’s conservatives don’t plan to play nice [removed],conservatives
gzqeiqv,2021-05-27T17:09:38.000-07:00,ndp leader jagmeet singh apologizes after video shows him breaking covid-19 rules thank god indeed that nobody wants to hug mr. o'toole.,conservatives
gzqeisi,2021-05-27T17:09:39.000-07:00,hiring boris johnson’s advisers shows erin o’toole’s conservatives don’t plan to play nice i don't know if it's fair to call corbyn himself an anti-semite. but it is indisputable that he was happy to play patsy with some really objectionable anti-semitism. his personal views are frankly irrelevant.,conservatives
gzqeou7,2021-05-27T17:12:04.000-07:00,"hiring boris johnson’s advisers shows erin o’toole’s conservatives don’t plan to play nice that's an odd position to take when it is evident that the reason we haven't already had an election is because lpc internal polling shows a majority to be out of reach. given that the cpc won the popular vote last time around with one of the worst leaders in years, i think it's premature to be confident about the outcome here.",conservatives
gzqfbb1,2021-05-27T17:20:59.000-07:00,hiring boris johnson’s advisers shows erin o’toole’s conservatives don’t plan to play nice they are going to push a brexit campaign advertised on public buses. it will be a disaster.,conservatives
gzqg31w,2021-05-27T17:32:12.000-07:00,hiring boris johnson’s advisers shows erin o’toole’s conservatives don’t plan to play nice [removed],conservatives
gzqgttj,2021-05-27T17:43:05.000-07:00,canada supports u.s. efforts to seek origins of covid-19 -pm trudeau agreed. getting to the bottom of everything is the only way to learn all of the lessons this tragedy has to teach us,liberals
hhguukr,2021-10-20T18:12:07.000-07:00,"o’toole and trudeau to talk wednesday after speaker announces mandatory vaccination policy 1 - if they get hit by a car, their constituents will be unrepresented.

2 - if they die from covid because they're unvaccinated, their constituents will be unrepresented. 

you ready? 

3 - if they refuse a safe and effective vaccine, their constituents will still be unrepresented.

if it's actually about representation, wouldn't they want to protect their own ability to represent constituents by getting vaccinated to prevent scenarios 2 and 3?",liberals
hnz0w3s,2021-12-09T18:40:00.000-08:00,"saskatchewan privatizing some surgeries to reduce growing backlog from covid-19 conservative policy. destroy the system and say you have to privatize instead of fixing it.  legault is doing the same thing in quebec. conservatives call it \"starving the beast\":

[https://www.macleans.ca/economy/business/starving-the-beast-what-canadian-conservatives-can-teach-us-republicans/](https://www.macleans.ca/economy/business/starving-the-beast-what-canadian-conservatives-can-teach-us-republicans/)

i'm not sure why people in saskatchewan tolerates this. it's costing them their health to americanize their system.",conservatives
hnz3efs,2021-12-09T19:13:36.000-08:00,"quebec teacher’s removal for wearing hijab a ‘cowardly’ move, minister says he did not give the funding. the funding is there under canadian law. trudeau considered taking it away.",liberals
hfo7wno,2021-10-06T10:39:56.000-07:00,"federal public servants, rcmp, and all air and rail travellers must be vaccinated by end of october, trudeau says [removed]",liberals
hfo7zyt,2021-10-06T10:40:39.000-07:00,"trudeau’s tofino trip and the age of manufactured outrage or in this case, actually complete what is necessary for a symbolic gesture. instead of \"the canadian government has failed indigenous communities, so we are giving the federal government a holiday so we can party.\"",liberals
hfo8526,2021-10-06T10:41:47.000-07:00,"trudeau says tofino vacation was a ‘mistake’ what has justin trudeau done for indigenous rights? what rights do they have now that they didn’t before he was prime minister?

i think i could make a pretty compelling case that pierre elliott trudeau and brian mulroney have done the most for indigenous rights of any prime ministers.",liberals
hfo87an,2021-10-06T10:42:16.000-07:00,"federal public servants, rcmp, and all air and rail travellers must be vaccinated by end of october, trudeau says [removed]",liberals
hfo8fhh,2021-10-06T10:44:04.000-07:00,"trudeau says tofino vacation was a ‘mistake’ most people didn't create the holiday themselves. 

trudeau literally created the holiday for a specific purpose.  then, he being the one in power that can actually change things, did nothing to commemorate it. 

it's like people forget that he's the pm and can actually do things. me, joe blow, trying to find some residential school survivors is a) not possible b) unlikely to lead to anything concrete as i am not an elected official and have no power of any kind. 

trudeau could meet with some residential school survivors and decide to give them a billion dollars. i'd say they'd prefer to meet with him.",liberals
hfo8jrv,2021-10-06T10:45:01.000-07:00,"trudeau’s tofino trip and the age of manufactured outrage &gt; does having remembrance day off give people time to reflect or does it just become the first shopping day of christmas?

it very well might, but i would expect the government to set the desired tone. in this case the tone trudeau has set is that this is just a day off.",liberals
hfo8v6i,2021-10-06T10:47:31.000-07:00,doug ford defends decision to let unvaccinated mpps sit as progressive conservatives [removed],conservatives
hfo8y6z,2021-10-06T10:48:11.000-07:00,"trudeau says tofino vacation was a ‘mistake’ and why didn't you send a note of congratulations to president biden upon his election? 

did you congratulate the losing candidates following the recent election?

and, finally, did you send a letter of condolence after passing of prince philip? 

if not, i can't see how you can criticize trudeau for failing to do so.",liberals
hfo913t,2021-10-06T10:48:49.000-07:00,le plc remporte finalement châteauguay-lacolle... par 12 voix | liberal party of canada wins châteauguay-lacolle by 12 votes crazy thought but......perhaps next time the moderator shouldn't be one of the main figures of a pollster known for consistent cpc bias? just an idea!,liberals
hfo96fr,2021-10-06T10:49:59.000-07:00,trudeau says tofino vacation was a ‘mistake’ you can't really reconcile without one half of the reconcilers being involved.,liberals
hfo9mjx,2021-10-06T10:53:29.000-07:00,le plc remporte finalement châteauguay-lacolle... par 12 voix | liberal party of canada wins châteauguay-lacolle by 12 votes honestly. the lpc have nobody but themselves to blame.,liberals
hfoa3gn,2021-10-06T10:57:05.000-07:00,trudeau says tofino vacation was a ‘mistake’ those 24-hour workdays must just be exhausting!,liberals
hfoap46,2021-10-06T11:01:42.000-07:00,"trudeau says tofino vacation was a ‘mistake’ omg, i'm so sorry your boss doesn't let you go home or engage in activities of your choice outside of work!",liberals
hfoato6,2021-10-06T11:02:41.000-07:00,"le plc remporte finalement châteauguay-lacolle... par 12 voix | liberal party of canada wins châteauguay-lacolle by 12 votes they also got body checked *hard* in quebec, and gaspésie—les iles.

the fact that diane lebouthillier won for a third time, and won with over 2600 votes over the bloc in that riding should have blanchet in shambles. she’s really a force of nature.",liberals
hfob2eb,2021-10-06T11:04:31.000-07:00,"federal public servants, rcmp, and all air and rail travellers must be vaccinated by end of october, trudeau says [removed]",liberals
hfob2vy,2021-10-06T11:04:37.000-07:00,"‘they lost the air war’: trudeau liberals missed their majority government by only 16,870 votes in 11 ridings, hill times analysis yeah didn't think so. disappointing that after all that you can't even defend the way fptp prioritizes ridings over the national popular vote.

if i didn't know better, i would think that you are only defending such a system because you are a liberal who likes seeing your favourite party being handed unchallenged power every so often, rather than actually believing in the merits of the system you defend. but i and many others are sick of being disenfranchised, so we will keep pushing for a better system.",liberals
hfob8rx,2021-10-06T11:05:53.000-07:00,"federal public servants, rcmp, and all air and rail travellers must be vaccinated by end of october, trudeau says [removed]",liberals
hfob9iy,2021-10-06T11:06:03.000-07:00,"trudeau says tofino vacation was a ‘mistake’ are you kidding me? if any of those guys hadn’t gone to an event, they would be called out. trudo had two invitations and chose to disregard both of them. think of it much like a remembrance day event. you go and show respect. he failed first nations and all of canada.",liberals
hfobc4y,2021-10-06T11:06:38.000-07:00,trudeau says tofino vacation was a ‘mistake’ ya think?,liberals
hfobfm9,2021-10-06T11:07:25.000-07:00,"trudeau says tofino vacation was a ‘mistake’ i'm not sure but did he say that the day should be a day of reflection and not of a long weekend? if he did, it doesn't look good, though it doesn't matter.",liberals
hfobnou,2021-10-06T11:09:12.000-07:00,"federal covid-19 vaccine mandate: here’s what we know, what we don’t the liberals need to rename themselves to the illiberals.",liberals
hfoc27j,2021-10-06T11:12:20.000-07:00,"federal public servants, rcmp, and all air and rail travellers must be vaccinated by end of october, trudeau says [removed]",liberals
hfocyak,2021-10-06T11:19:17.000-07:00,"trudeau says tofino vacation was a ‘mistake’ oh don't worry, we're reconciling with those of you that make the effort.",liberals
hfod852,2021-10-06T11:21:24.000-07:00,doug ford defends decision to let unvaccinated mpps sit as progressive conservatives [removed],conservatives
