h10d7pn,2021-06-07T18:28:56.000-07:00,trudeau’s liberals promised to end the blood ban. now they say it’s ‘complicated’. great summary but one major flaw in your numbers is that you treat all hiv+ men as being equally likely to donate blood. the truth is that anyone who is aware of their positive status is not going to donate. so these people should be taken out of your numbers.,liberals
hqnqqul,2021-12-30T16:05:37.000-08:00,"trudeau calls the unvaccinated racist and misogynistic extremists guys i just discovered that covid vaccine cures misogynism and racism. it has to be! otherwise what is the point of justin trudeau's comments? if there are vaccinated and unvaccinated misogynists, which clearly is impossible, then justin trudeau's comments would be unproductive and even divisive. 

but this is nothing new. modern left does this to everyone. not just unvaccinated. the conversation on racism always has white people as the perpetrators, as if other races are incapable of racism. the conversation about sexism is always about misogyny. the conversation about climate change is always about uneducated, science denying right wingers, not about our narcissistic society which keeps consuming more and more shit. 

the left always wants to find an effective caricature for people to hate.",liberals
hqnrtxk,2021-12-30T16:19:17.000-08:00,"trudeau calls the unvaccinated racist and misogynistic extremists so, last year before the vaccines were available, everyone was a racist misogynist? 🤔  makes perfect sense. also this is very rich coming from the blackface groper",liberals
h2qwelw,2021-06-22T18:12:53.000-07:00,"liberals to introduce new hate speech bill, possibly bringing back controversial section 13 [removed]",liberals
h2qx2l2,2021-06-22T18:23:42.000-07:00,"liberals to introduce new hate speech bill, possibly bringing back controversial section 13 [removed]",liberals
h2qx5z9,2021-06-22T18:25:15.000-07:00,trudeau challenges china to publicly probe its mistreatment of uyghurs as beijing attacks canada’s indigenous record [removed],liberals
h2qxcf5,2021-06-22T18:28:10.000-07:00,"liberals to introduce new hate speech bill, possibly bringing back controversial section 13 i've seen this argument before, and i don't find it particularly convincing. for one, this is is much less of an argument against such a law, and much more of an argument against willy-nilly electing whomever without thought to the enormous power that electing that person is granted. politics is not a game, and elections are not without real consequences, and they should be treated with the grave seriousness they're due.

but, perhaps more problematic for this argument is that it assumes, inexplicably, that a cpc or hypothetical party forming government would somehow be incapable of creating such a law without the law already being on the books. as pm they would be more than capable doing so, and using it to whatever horrible ends you might imagine. if anything, if you paid any attention to the sort of things the trump administration got up to, its clear that many political and even legal norms have very little strength if someone is willing to bull on through them and no one is willing, or capable, of standing up to them. 

this of course goes back to my first point: don't elect people who will abuse power, because nothing is going to stop them from abusing power in the first place.",liberals
h2r0tdx,2021-06-22T19:26:08.000-07:00,"annamie paul is still ‘unpacking’ the threat to her leadership &gt; this entire situation looks strongly like convenient cover provided by the liberals for atwin's defection. 

what do you mean \"by\" the liberals? what have they done to cause this?

&gt; it is strange that the liberals have suffered zero fallout for this

how could they? what is there to blame them for?

&gt; indeed, trudeau's name really isn't even in the conversation besides paul's vitriol towards him. 

funny because my impression was that paul's vitriol was a means to distract from her party's problems 

&gt; it gets even better for the liberals because it is conveniently hiding mumilaaq qaqqaq's extremely unsettling reasoning behind leaving parliament.

how much more attention do you believe that would've gotten otherwise?",liberals
h2r228j,2021-06-22T19:46:25.000-07:00,"with o’toole behind in polls, u.k. consultants unlikely to be helpful for conservatives, say some politicos [removed]",conservatives
h2r2294,2021-06-22T19:46:25.000-07:00,trudeau challenges china to publicly probe its mistreatment of uyghurs as beijing attacks canada’s indigenous record at least canada can admit to a problem. china thinks its shit doesn't stink and its perfect. china's just acting like a silly child. boycott china.,liberals
h2r2epk,2021-06-22T19:51:55.000-07:00,"trudeau challenges china to publicly probe its mistreatment of uyghurs as beijing attacks canada’s indigenous record i think a lot of americans are not aware of the extent to which the us plays a global role... everything from economics to politics to culture. good or bad, right or wrong, the us has a huge influence over the planet. naturally the us is a \"big concern\", especially when it elects a failed businessman and reality show host to be its president. the years 2017 to 2021 were bad, and i think the world is breathing a sigh of relief that he-who-shall-not-be-named is no longer the president.",liberals
h2r3hy6,2021-06-22T20:08:49.000-07:00,"liberals to introduce new hate speech bill, possibly bringing back controversial section 13 this is scary, and i'm a full tilt tree hugging liberal.

individuals should have the right and freedom to say whatever they think without consequences from the government even if it is hateful. 

i personally feel like the crackdown needs to happen in the media which is a scary undertaking. too many people i know are reading facebook articles from websites that have people from nazi adjacent groups working for them, i don't know how but that's what needs to stop. 

the individual posting their own idiotic ideas is fine, media corporations spreading idiocracy across the internet with clickbait titles with opinion piece that lack any substance or self criticism is what is eroding the minds of many.",liberals
h2r3jqc,2021-06-22T20:09:37.000-07:00,"liberals to introduce new hate speech bill, possibly bringing back controversial section 13 yet any liberal argument is half hate speech and it’s ok because they’re liberals",liberals
gs1nikw,2021-03-23T23:26:56.000-07:00,"it’s time to close trudeau's dirty and dangerous quarantine hotels you're misunderstanding the charter.  the right is not absolute.  hence why you can be detained for customs checks at the border.  

personally, i don't get the sympathy for dumbasses who choose to travel during a pandemic but can't somehow meet requirements like providing a clean test on arrival.  their problem.  not mine.  and letting them become a public health risk would make it my problem.",liberals
gs1nz86,2021-03-23T23:30:45.000-07:00,"it’s time to close trudeau's dirty and dangerous quarantine hotels i travelled during the pandemic to see my partner, tests on departure and arrival in both directions and then followed the quarantine directions in both canada and the other country, are people like me the issue?

i don’t think so, but now i can’t see my partner because of these shitty new rules.

i personally think that being detained at customs for questioning/investigation based on a suspicion to be different from just returning to your home country and being detained and slapped with a 2000 $ fee without committing a crime to be different.",liberals
gs1o7ix,2021-03-23T23:32:41.000-07:00,"when it comes to climate change, conservatives are in danger of becoming irrelevant oh i was commrnting dtrictly on the environmental stuff here, i mentioned the antiabortion wing only because they packed the votes at the convention and are crowing  victory about having defeated this motion.

like you i dont believe abortion will be a huge issue this election. the environment will anf its nice to see the cpc shooting itself in the ass before the writ has even dropped.",conservatives
gs1o96r,2021-03-23T23:33:04.000-07:00,"np: majority of canadians are feeling politically homeless, poll finds i don't think our relatively small size is an argument to not do enough - it's not conducive to credibility on the world stage. future growth in emissions is mostly going to come from developing countries as they increase the size of their middle classes, and with us having mostly developed, we need to take a leadership role and accept that we can't have developed ourselves and then tell other countries that they can't develop to the same standard of living simply because they came late to the party.

i do agree that what we are doing is not enough, but i think these things have to be done incrementally and with majority agreement. activism and polarizing debate has not really got us anywhere, even though it feels good. on the carbon tax, i am glad that something concrete is in place and that it has a long-term trajectory that people can plan around.

the approach to carbon emissions has shifted in the last 5 years or so from having less focus on conservation and severe emissions reductions and more on capture and sequestration of constrained emissions. who knows if that will be possible on a large scale, but i think that the global warming advocates got tired of being criticized for flying around the world in their private jets and living in big mansions sucking down resources simply to keep the lights on, so the channel has been changed to one that is more permissive of consumption, balanced with offsets and sequestration.

however, this position is also more practical when you look at the trajectory of the issue - when have emissions ever come close to targets? and we're told this is urgent. this approach still requires us to keep a lid on emissions, which is what the carbon tax hopes to enable.

if climate change was seen as a critical issue by the majority, we might see o'toole do what boris johnson gambled with in the uk around brexit - that is, to strip the dissenting conservative members of their entitlement to run in the next election and replace them with people who were onside with the new program. it is starting to feel like that kind of situation to me, but it would be a very un-canadian thing to do.

a couple of reasons he wouldn't do this:

* the hard right is stronger in canada (particularly in the west) and more liable to fragment the conservative vote than it is in the uk.
* climate change is not seen by the majority of canadians to be as critical an existential issue as was brexit in the uk.",conservatives
gs1od2p,2021-03-23T23:33:58.000-07:00,"it’s time to close trudeau's dirty and dangerous quarantine hotels &gt; i travelled during the pandemic to see my partner, tests on departure and arrival in both directions and then followed the quarantine directions in both canada and the other country, are people like me the issue?

you're a responsible person who wouldn't end up in a quarantine hotel.  that's the point.   

can we trust every traveler to be as responsible as you?  or should we just roll the dice with our health and economy on the assumption that they might be.

to quote ronald reagan, \"trust.  but verify.\"

the issue that i agree with is how badly these centres are being run.  and if they're not going to be run properly then i agree there's no point.",liberals
gs1oiy1,2021-03-23T23:35:16.000-07:00,"it’s time to close trudeau's dirty and dangerous quarantine hotels oh but the thing is i can do that all again and still get smacked with that 2000$ bill! it’s not if you don’t have a test, it’s no matter what.",liberals
gs1ortm,2021-03-23T23:37:13.000-07:00,"when it comes to climate change, conservatives are in danger of becoming irrelevant the polling has showed them at a pretty hard limit of 30% for the last year, with both the party and otooles approval #s sinking steadily. i think that the polling by the cbc is within the statistical norms.
also the economy is roaring back strongly, the growth in the last 2 quarters was way ahead of preditctions. this idea that jobs are in the shitter mostly applies to the shit nuggets companies were hoping to not have to hire back anyway.",conservatives
gs1otpl,2021-03-23T23:37:39.000-07:00,"when it comes to climate change, conservatives are in danger of becoming irrelevant sure is weird that it keeps coming up then. again and again. makes you wonder.",conservatives
gs1ozgi,2021-03-23T23:38:56.000-07:00,"when it comes to climate change, conservatives are in danger of becoming irrelevant huh, what else happened between 2019 and now that could’ve impacted the economy...",conservatives
gs1p1yp,2021-03-23T23:39:29.000-07:00,"singh’s student-debt plan could push other parties to offer more for youth i know a strange amount of people who call themselves “socialists,” praise aoc/bernie on sm and support trudeau/lpc.

singh going after this demographic is just smart politics. the entire liberal/ndp platform from 2004-2008 was “harper = bush,” after all.

besides, i hear from lots of people left right and centre say all the time that they think that tuition should be free (i don’t agree, but they do).",liberals
gs1p28s,2021-03-23T23:39:32.000-07:00,"when it comes to climate change, conservatives are in danger of becoming irrelevant because ontsrio has.more people, they still didnt have enough to win seats. your dishonesty is brutally apparent to anyone who understands basic math.",conservatives
gs1p2rr,2021-03-23T23:39:39.000-07:00,"conservatives demand national plan to end covid-19 restrictions | cbc news &gt; which is still interference in provincial responsibilities. o'toole knows that, but is ignoring it in order to score political points.

i literally said that the federal government guides provinces all the time. it can work with them and set up a plan or create a basis. you know this, everyone knows this. everything every politician does is to score political points, so that's not a convincing argument as to why this is a bad idea.

&gt;yes, but the provinces have to develop their plans

yes and as i said earlier and just now, the government could help them. the economies of provinces matter in the economic health of the country, and i'm saying this as a quebecer, lol. 

there is absolutely nothing controversial about this, anyone saying so is either reading only the headline and interpreting it in an uncharitable light or is just anti-conservative, which is fine (i'm not the biggest fan myself, to say the least) but you have to be able to judge ideas separately.",conservatives
gs1pn1v,2021-03-23T23:44:10.000-07:00,"np: majority of canadians are feeling politically homeless, poll finds sorry i had to chuckle at the notion that the \"hard right\" is stronger in canada.  that is laughable.  there is no hard right in canada.  or at least, it is a couple dozen posters.  we don't even have a centre right party in canada.  maybe the ppc.  conservatives are centre left.",conservatives
gs1pwxf,2021-03-23T23:46:22.000-07:00,"singh’s student-debt plan could push other parties to offer more for youth it wasn’t a fluke, ndp just ran a really terrible campaign in 2015, especially in comparison to trudeau.",liberals
gs1pyg9,2021-03-23T23:46:42.000-07:00,"it’s time to close trudeau's dirty and dangerous quarantine hotels 3 nights at an airport hotel.  so we can be sure you're not infected.  tough life.

and you can blame your fellow travelers.  none of this would be necessary if folks had been following the rules and guidelines all along.  all those stories of folks ignoring quarantine guidelines is why we have mandatory quarantine.

again, why should i, a person who has not travelled, bear the public health risk of people who do travel?  you're worried about the cost of a three night stay.  what about the lost earnings of those who get infected from a returning traveler?  if we want to play this game, make those who travel and infect others fully liable.",liberals
gs1qsfn,2021-03-23T23:53:10.000-07:00,"when it comes to climate change, conservatives are in danger of becoming irrelevant cpc having more votes does not mean they had the popular vote, theybhad a plurality of votes. learn to use words correctly.

and the quantity of votes the cpc has in toronto, and wether or not that is more than in alberta, is irrelevant. percentage of the population in specific ridings is what matters. 

youre claiming your team won the baseball game because they scored more touchdowns. even if true they still lost because baseball isnt scored on touchdowns",conservatives
gs1qw9d,2021-03-23T23:54:00.000-07:00,"it’s time to close trudeau's dirty and dangerous quarantine hotels i understand that, but if this was really based on protecting the public, the bill would not be so high.

what i would propose is to reduce the age of the test to get on the plane to 48 hours and to refuse boarding to those that can’t produce a test. hotel quarantine upon arrival for a reasonable amount of money (base it on yearly average for the hotel plus 15%) and an additional test upon arrival. if you get your test back early you get refunded the amount if you overspent initially and off you pop to finish your quarantine.

if the government/hotel fails to provide you with the essentials (e.g. going more than 12 hours without food being brought) you can leave and the hotel refunds it.",liberals
gs1rzvp,2021-03-24T00:02:21.000-07:00,"when it comes to climate change, conservatives are in danger of becoming irrelevant i honestly think that the excommunication of patrick brown was a pivotal moment.

pat brown tried the ultimate gambit: a naked backstab against the socon wing of his party after he took leadership, and then campaigning hard as a centrist, almost making explicit that he was running as basically \"liberal platform but with conservative fiscal discipline\".

he was polling substantially higher than ford, and so likely could've turned ford's easy win into a record-breaking landslide.

obviously now with covid world, ford's polling numbers have jumped... but after his election there was almost \\*immediate\\* buyer's remorse.  brown might've escaped that.

brown could've revolutionized canadian conservatism.  now, instead, he's a cautionary tale.

don't try to boink your staff, folks.",conservatives
gs1s2u0,2021-03-24T00:02:58.000-07:00,"np: majority of canadians are feeling politically homeless, poll finds &gt; the liberals are drowning the country in debt

i mostly agree with the rest of your comment, but not on this. they kept the debt stable up until the pandemic where they rightfully spent a shit load of money. even after all that spending in 2020 the debt:gdp is lower than it was in the 90.",liberals
gs1s9ya,2021-03-24T00:04:28.000-07:00,"when it comes to climate change, conservatives are in danger of becoming irrelevant [removed]",conservatives
gs1sjak,2021-03-24T00:06:27.000-07:00,"rural ontario housing prices see ‘bigger dollar rise in one year than in the past 30 years combined’ yeah, i think singh's 75% inclusion rate would be more palatable.

the problem is that the supply-side of the problem is almost exclusively a provincial issue.

at best, the federal liberals could empower the provinces by using their access to international travel data and address information to help build a database of vacant units that could be slapped with a punitive provincial vacant unit tax.",liberals
gs1skci,2021-03-24T00:06:40.000-07:00,"alberta’s petrostate propaganda has turned conspiratorial between this and the federal conservative convention it is becoming increasingly hard for me to even consider voting for a party that espouses conservative ideology.  in case you missed it, during the convention religious social conservatives mobilized their people to vote against the climate change motion because: **“global warming is being used by global elites and the united nations to advance population control through abortion and sterilization\"** [source is here](https://pressprogress.ca/conservative-party-votes-down-resolution-designed-to-reassure-everyone-they-believe-in-science/)

this party is increasingly living in their own alt-right reality devoid of facts or reason. i consider myself to be an unaffiliated centrist and have voted for a wide variety of parties, including the conservatives, both federally and provincially.  it is \\*very\\* unlikely that i give these guys the time of day come election time.",conservatives
gs1spmd,2021-03-24T00:07:48.000-07:00,"np: majority of canadians are feeling politically homeless, poll finds that party exists only in your imagination.  the conservative party i'm talking about leader said the argument for climate change is over, is not a trump supporter, wants reconciliation, will never privatize healthcare (even though every single european country has better and more privatized healthcare than us)",conservatives
gs1ul0a,2021-03-24T00:21:52.000-07:00,"when it comes to climate change, conservatives are in danger of becoming irrelevant [deleted]",conservatives
gs1uv97,2021-03-24T00:24:00.000-07:00,"when it comes to climate change, conservatives are in danger of becoming irrelevant removed; rule 3",conservatives
gs1v3ux,2021-03-24T00:25:43.000-07:00,"np: majority of canadians are feeling politically homeless, poll finds evidently, you're a hard righter. only a hard righter would say the conservative party is center left.

lol.

it's weird how politics views calibrate.",conservatives
h9rnm04,2021-08-20T18:24:16.000-07:00,trudeau to o’toole: pro-choice does not mean the freedom of doctors to choose [removed],liberals
h9rnmwl,2021-08-20T18:24:37.000-07:00,"opinion: in a campaign about nothing, liberals struggle to find a wedge issue it's hilarious that you think this is in defence of the liberals, and goes to show how you little you know about the subject.",liberals
h9rnugs,2021-08-20T18:27:43.000-07:00,trudeau to o’toole: pro-choice does not mean the freedom of doctors to choose [removed],liberals
h9ro100,2021-08-20T18:30:28.000-07:00,"conservative opposition to mandatory vaccinations is irresponsible and dangerous, says trudeau really? so private comanies can violate people's rights and government  can't?",liberals
h9ro1aa,2021-08-20T18:30:35.000-07:00,"'i won't change': maxime bernier confident about ppc's chances with same platform &gt; he was almost the leader of the cpc, losing by less than 1% to scheer.

jesus, i'd forgotten about that",conservatives
h9ro3h3,2021-08-20T18:31:28.000-07:00,"conservative opposition to mandatory vaccinations is irresponsible and dangerous, says trudeau that's okay you can stay at home or wear a mask where they let you in.",liberals
h9ro8zm,2021-08-20T18:33:44.000-07:00,"conservative opposition to mandatory vaccinations is irresponsible and dangerous, says trudeau disagree. why should we allow unvaccinated to infect plane loads of people?",liberals
h9roc69,2021-08-20T18:35:00.000-07:00,trudeau to o’toole: pro-choice does not mean the freedom of doctors to choose [removed],liberals
h9roesm,2021-08-20T18:36:05.000-07:00,trudeau to o’toole: pro-choice does not mean the freedom of doctors to choose [removed],liberals
h9rorci,2021-08-20T18:41:16.000-07:00,"erin o’toole says his position on abortion hasn’t changed. but his leadership platform suggests otherwise. then harper, scheer, and o’toole are pro choice",conservatives
h9roy5c,2021-08-20T18:44:03.000-07:00,trudeau to o’toole: pro-choice does not mean the freedom of doctors to choose [removed],liberals
h9rp5nr,2021-08-20T18:47:14.000-07:00,"conservative opposition to mandatory vaccinations is irresponsible and dangerous, says trudeau vaccinated people can have covid also? is that not correct? the reason to get vaccinated if you believe it, is so that you don't get as sick / hospitalized. that's a poor excuse in my opinion to trounce on the fundamental freedoms that so many canadians died for in various wars to maintain and provide a \" free\" canada for us to live in. and again, we as canadians are paying for all these infrastructures with our tax dollars only to be told that we can't use them unless the government mandated vaccine is forced into our bodies? plus, a responsible canadian isn't travelling if symptomatic. it is a very slippery slope we are on here. what is next? eventually the government says you can't leave your region without your vaccine passport / \" papers\" ? people need to wake up and see this is the government taking control of all aspects of our lives here. and to force all public servants to get vaccinated is a major infringement  on ones ability to earn. so a person who doesn't want to be vaccinated should lose their job now? it's ridiculous that the government has become a dictator to our health and freedoms over a 2 yr period based on covid 19 fears. it's a personal choice to get vaccinated or not.. don't punish those that don't get it. let them continue with temperature checks, wearing a mask in a public setting.",liberals
h9rp9zt,2021-08-20T18:49:00.000-07:00,trudeau to o’toole: pro-choice does not mean the freedom of doctors to choose because i persons beliefs should not effect what type of health care you get.,liberals
h9rpfa3,2021-08-20T18:51:10.000-07:00,"as a fiscally moderate, social progressive, how does the conservative party intend to appeal to me and why should i support them given i’m in a relationship with a trans woman who is scared shitless of them? on a international stage you had no respect left after trump",conservatives
h9rpiun,2021-08-20T18:52:40.000-07:00,trudeau to o’toole: pro-choice does not mean the freedom of doctors to choose [removed],liberals
