hff4ap0,2021-10-04T09:56:23.000-07:00,"as tories review election loss, weak support in immigrant communities a crucial issue: of the 41 ridings in canada where more than half the population is racialized, the conservatives won just one in the 2021 election [removed]",conservatives
hff4d28,2021-10-04T09:56:57.000-07:00,"‘they lost the air war’: trudeau liberals missed their majority government by only 16,870 votes in 11 ridings, hill times analysis technically, changing the voting system doesn't even require a referendum, so if he was very cynical, he could have just push through ranked voting using his bare majority mandate",liberals
hff4gdd,2021-10-04T09:57:45.000-07:00,"is the ppc racist? i think at this point he’s just looking for reasons to hate. people need to take their anger out on something.

i’m sure if we put a microscope on liberals or any other political parties we’d find bad apples too.",liberals
hff4hmq,2021-10-04T09:58:04.000-07:00,"as tories review election loss, weak support in immigrant communities a crucial issue: of the 41 ridings in canada where more than half the population is racialized, the conservatives won just one in the 2021 election [removed]",conservatives
hff4mbb,2021-10-04T09:59:11.000-07:00,"ndp to request recount in toronto's davenport riding, where liberals won by 76 votes ###this is a reminder to [read the rules before posting in this subreddit](https://www.reddit.com/r/canadapolitics/wiki/rules-thelongversion).
 
1. **headline titles should be changed only [when the original headline is unclear](https://www.reddit.com/r/canadapolitics/wiki/rules-thelongversion#wiki_1._headline_titles_should_be_changed_only_where_it_improves_clarity.)**
2. **be [respectful](https://www.reddit.com/r/canadapolitics/wiki/rules-thelongversion#wiki_2._be_respectful).**
3. **keep submissions and comments [substantive](https://www.reddit.com/r/canadapolitics/wiki/rules-thelongversion#wiki_3._keep_submissions_and_comments_substantive).**
4. **avoid [direct advocacy](https://www.reddit.com/r/canadapolitics/wiki/rules-thelongversion#wiki_4._avoid_direct_advocacy).**
5. **link submissions must be [about canadian politics and recent](https://www.reddit.com/r/canadapolitics/wiki/rules-thelongversion#wiki_5._link_submissions_must_be_canadian_and_recent).**
6. **post [only one news article per story](https://www.reddit.com/r/canadapolitics/wiki/rules-thelongversion#wiki_6._post_only_one_news_article_per_story).** ([with one exception](https://www.reddit.com/r/canadapolitics/comments/3wkd0n/rule_reminder_and_experimental_changes/))
7. **replies to removed comments or removal notices will be removed** without notice, at the discretion of the moderators.
8. **downvoting posts or comments**, along with urging others to downvote, **[is not allowed](https://www.reddit.com/r/canadapolitics/wiki/downvotes)** in this subreddit. bans will be given on the first offence.
9. **[do not copy &amp; paste the entire content of articles in comments](https://www.reddit.com/r/canadapolitics/wiki/rules-thelongversion#wiki_9._do_not_copy_.26amp.3b_paste_entire_articles_in_the_comments.)**. if you want to read the contents of a paywalled article, please consider supporting the media outlet.

*please [message the moderators](https://www.reddit.com/message/compose?to=%2fr%2fcanadapolitics) if you wish to discuss a removal.* **do not reply to the removal notice in-thread**, *you will not receive a response and your comment will be removed. thanks.*


*i am a bot, and this action was performed automatically. please [contact the moderators of this subreddit](/message/compose/?to=/r/canadapolitics) if you have any questions or concerns.*",liberals
hff4tay,2021-10-04T10:00:51.000-07:00,[deleted by user] the right to that speech against trudeau is one of the most important freedoms in this country. this was a defamation case one of the few exceptions to freedom of speech and expression.,liberals
hff4tki,2021-10-04T10:00:55.000-07:00,"liberals’ electric-vehicle ambitions require mandate: study &gt;the proposal is to phase out the sale of new gas/diesel powered passenger vehicles by 2035.

fair enough. although the way the article is framed at the beginning is a little misleading.

&gt;to meet their goal that all cars in canada be electric by 2035, the liberals must make it the law, according to a new study.

&gt;in june, transport minister omar alghabra announced he was advancing the target to make all cars electric by 2035, five years ahead of schedule.

as for the grid, parking lots will essentially have to be full-service charging stations. adding ac/electric heat has already put great stress on our infrastructure, tho think adding more to that system seems unrealistic. cities in the us already suffer from energy shortages, we'll really have to get innovative to overcome that.

not only that, but those systems have been slowly been updated over the past 100 years, but we expect to make these changes in 15 years. 

personally, i hope we can do it, but man, i just don't have confidence in the ability of our government to handle such a situation.",liberals
hff4zk3,2021-10-04T10:02:21.000-07:00,"‘they lost the air war’: trudeau liberals missed their majority government by only 16,870 votes in 11 ridings, hill times analysis its a good illustration of how a lot of the power of having a majority is in controlling the gavel in committees, rather than the perceived main advantage in house votes. its not that hard to for the government to win straight up and down votes in the house and when in minority the ones you might lose might be future ammunition.

what we saw in the last parliament was the government didn't have that much difficulty passing legislation once it was ready for voting, but the committees had become a quagmire of dysfunction. that largely was beneath the notice of the commentariat who don't really cover what goes on at the hill rather than the party press communications.",liberals
hff599q,2021-10-04T10:04:40.000-07:00,"‘they lost the air war’: trudeau liberals missed their majority government by only 16,870 votes in 11 ridings, hill times analysis i am not angry at all. if the argument of ' dont favour a system that allows crazies more power' is not compelling enough, then your position is anti human benefit and of purely ideological in nature. 

every government mode is expendable to another, if the latter provides superior benefit for the people. most of us favour democracy and have done so, not because its more right or moral- but because it throws up less tyrants who can commit genocides and mass murders on their own people. its supremacy currently is purely due to its superior delivery of social stability and security. thats all there is to it.",liberals
hff5e1p,2021-10-04T10:05:48.000-07:00,"‘they lost the air war’: trudeau liberals missed their majority government by only 16,870 votes in 11 ridings, hill times analysis err china says hello. they are far more efficient at public works than any other nation in its implementation. as for corruption - you will find the recent leaked papers have far more democratic leaders that are pilfering funds than totalitarian ones. this is because the power of money to influence decision is far more in a democratic format.",liberals
hff5k0d,2021-10-04T10:07:12.000-07:00,"‘they lost the air war’: trudeau liberals missed their majority government by only 16,870 votes in 11 ridings, hill times analysis under fptp nothing would have changed - the pr put nazis in majority, so would fptp. but its pr that made the nazis relevant and able to project power at a national level - much like the afd today. without pr, nazis and the afds would've been fringe parties for a long, long time, unable to garner more than half a dozen to a dozen seats.",liberals
hff5p26,2021-10-04T10:08:21.000-07:00,"‘they lost the air war’: trudeau liberals missed their majority government by only 16,870 votes in 11 ridings, hill times analysis nazis weren't fringe belief in 1932, they were fringe beleif in 1922. and pr is what gave them far more of a presence. pr does magnify. meaning, it puts more power into the hands of the fringe elements. by what mechanism it does so, is irrelevant.",liberals
hff5sa3,2021-10-04T10:09:05.000-07:00,"as tories review election loss, weak support in immigrant communities a crucial issue: of the 41 ridings in canada where more than half the population is racialized, the conservatives won just one in the 2021 election i shudder to think of who they would get to replace poilievre after his inevitable defeat",conservatives
hff5u9m,2021-10-04T10:09:33.000-07:00,"as tories review election loss, weak support in immigrant communities a crucial issue: of the 41 ridings in canada where more than half the population is racialized, the conservatives won just one in the 2021 election [removed]",conservatives
hff5ud0,2021-10-04T10:09:34.000-07:00,"who wants to bet the trudeau family is on the ‘pandora papers’ list? sure i don’t disagree, though this is related to the pandora papers how exactly?",liberals
gy8bd8x,2021-05-15T02:44:37.000-07:00,"cbc has lost its lawsuit against the conservative party over the use of cbc material in ads during the 2019 federal election. federal court of canada rules it was \"fair use\" are you being deliberately obtuse?",conservatives
gy8bdmn,2021-05-15T02:44:43.000-07:00,"innovative research: lpc 40%, cpc 27%, ndp 18%, bq 4%, grn 7% but in the only poll that actually matters (an election) - albeit a provincial election - they lost out in stronghold areas like langley, abbotsford and most surprisingly, chilliwack. i realize that their numbers in the interior will continue to be very strong, but as more and more urbanites move out into the valley, the makeup of the voter base is changing.

regardless of my thoughts, you're probably right, and the drop is less than the poll suggests, and of course all sorts of vote splitting and multi-party scenarios come into play provincially vs federally. i will say though, as a old fart that started out life in northern bc, then rural farming in the valley and then urban usa and then back to various places in bc -- the fraser valley is far less conservative than it was 40 years ago. the party would be well served to go back to the red tory policies of days gone by instead of shrinking the tent via their lip service pandering to the vocal minority of social conservatives.",conservatives
gy8c6js,2021-05-15T02:51:02.000-07:00,john ivison: why the ethics commissioner got it right with his rulings on trudeau and morneau [removed],liberals
gy8c94u,2021-05-15T02:51:36.000-07:00,"alberta's jason kenney put down a caucus revolt. but he got hurt in the process &gt; . if they dropped the socons, the ancap libertarians and the white supremacist garbage it would be fine by me.

at least federally, that would leave you with something that looks a lot like the lpc, but that doesn’t want to be called liberal.  the social conservatives are too important to the party for them to be ditched.",conservatives
gy8d08x,2021-05-15T02:57:32.000-07:00,"the harper conservatives say they sought an investigation into canada’s top soldier. but the man they say they asked has no recollection they were both cabinet ministers under harper iirc, o'toole being the mod. i would be very surprised if they weren't implicated.",conservatives
gy8d6mu,2021-05-15T02:58:57.000-07:00,the inside story of justin trudeau’s ‘one-dose summer’ controversy [removed],liberals
gy8drbq,2021-05-15T03:03:33.000-07:00,"cbc has lost its lawsuit against the conservative party over the use of cbc material in ads during the 2019 federal election. federal court of canada rules it was \"fair use\" are you?

perhaps who would like to explain how this is not bais? after all, all parties did the same thing. all parties withdrew the clips when asked.

the only party that was sued despite all acting thr exact same was the cpc.",conservatives
gy8duy1,2021-05-15T03:04:20.000-07:00,"the harper conservatives say they sought an investigation into canada’s top soldier. but the man they say they asked has no recollection they are the least relevant part of the story imo. vance is in the news because of this current govts actions, still unresolved.",conservatives
gy8e1r0,2021-05-15T03:05:51.000-07:00,the harper conservatives say they sought an investigation into canada’s top soldier. but the man they say they asked has no recollection [removed],conservatives
gy8e8e7,2021-05-15T03:07:19.000-07:00,"alberta's jason kenney put down a caucus revolt. but he got hurt in the process &gt;some day? that day was years ago.

o'toole isn't exactly like that. though if you're arguing that he's an \"intermediary\" for them then you'll get no argument from me. there was a big chance for mackay to win though, so i don't think all is lost. unfortunately, once again the moderates let the socons do whatever the hell they wanted.",conservatives
gy8e8u5,2021-05-15T03:07:25.000-07:00,"cbc has lost its lawsuit against the conservative party over the use of cbc material in ads during the 2019 federal election. federal court of canada rules it was \"fair use\" i have.  to you.  repeatedly. 

https://www.reddit.com/r/canadapolitics/comments/nbkbdc/cbc_has_lost_its_lawsuit_against_the_conservative/gy3ex3a/?utm_source=share&amp;utm_medium=ios_app&amp;utm_name=iossmf&amp;context=3",conservatives
gy8ee31,2021-05-15T03:08:35.000-07:00,"alberta's jason kenney put down a caucus revolt. but he got hurt in the process because the only way the right can win elections in canada now is if they get literally everyone right of the liberals under the same umbrella.

the cpc only get 1/3 of the votes but they're always in range of a majority because of this.",liberals
gy8eh2p,2021-05-15T03:09:14.000-07:00,"trudeau's minister can't defend his own bill this guy just screams patsy. if tptb have their way he will take the brunt of the criticism and hammer this bill through, only to be dumped from cabinet after it passes",liberals
gy8ehlh,2021-05-15T03:09:21.000-07:00,"cbc has lost its lawsuit against the conservative party over the use of cbc material in ads during the 2019 federal election. federal court of canada rules it was \"fair use\" so no proof?

this is a clear and undeniable example of the bias at the cbc against the conservative government.

they only sued one party, right before the election for a practice all parties did 

more than clear evidence of bais.",conservatives
gy8expv,2021-05-15T03:12:56.000-07:00,"cbc has lost its lawsuit against the conservative party over the use of cbc material in ads during the 2019 federal election. federal court of canada rules it was \"fair use\" he who asserts must prove. you are asserting “evidence and proof” of exists. 

the onus is on you to show that the use of the material, use you’ve asserted exists, is equivalent to the point that it shows bias. 

you have not done so.",conservatives
gy8fmbz,2021-05-15T03:18:28.000-07:00,herd immunity has a problem—conservatives tbh modern conservatism has nothing to do with the philosophy of conservatism.,conservatives
gy8g4nb,2021-05-15T03:22:34.000-07:00,the inside story of justin trudeau’s ‘one-dose summer’ controversy [removed],liberals
gy8gge9,2021-05-15T03:25:15.000-07:00,"cbc has lost its lawsuit against the conservative party over the use of cbc material in ads during the 2019 federal election. federal court of canada rules it was \"fair use\" the existence of the lawsuit is the proof.",conservatives
gy8h1fd,2021-05-15T03:30:03.000-07:00,the inside story of justin trudeau’s ‘one-dose summer’ controversy [removed],liberals
gy8hoz8,2021-05-15T03:35:19.000-07:00,"military head of canada’s vaccine rollout steps aside amid investigation what is missing ?  are you serious?  what is missing is the detailed testimony under oath, repeat  under oath, of such luminaries as brison , sajjan, general vance and a host of senior bureaucrats and functionaries.  norman’s lawyer had the subpoenas ready, the presiding judge had publicly stated the final and complete end of her patience with the delays by the prosecution .  trudeau of course could not possibly tolerate any of those people speaking under oath, a behaviour we have since seen several times. instead, charges dropped instantly, secret agreement reached, everybody subject to strict ndas.  that’s not a conspiracy, that’s what happened.",liberals
gy8hz4b,2021-05-15T03:37:31.000-07:00,"cbc has lost its lawsuit against the conservative party over the use of cbc material in ads during the 2019 federal election. federal court of canada rules it was \"fair use\" no it isn’t.",conservatives
gy8i60q,2021-05-15T03:39:02.000-07:00,"herd immunity has a problem—conservatives &gt; these kind of generalization are tiresome and dangerous

what separates a generalization from a statistic for you? i agree that we have to be careful maligning and alienating groups of people, but what do you do when you have one group behaving so outside the norms of the rest of society?

&gt; 28 percent of albertans are either unsure whether they’ll get vaccinated or won’t get jabbed at all...to compare, 16 percent of canadians in total are nervous about getting jabbed

those are meaningful numbers. how do we talk about it without mentioning \"conservatives\"?",conservatives
gy8i9zb,2021-05-15T03:39:53.000-07:00,"cbc has lost its lawsuit against the conservative party over the use of cbc material in ads during the 2019 federal election. federal court of canada rules it was \"fair use\" it clearly is given despite all else being equal the cbc only sued the conservatives.

that is more then adequate proof of bias.

if they were not biased then they would have sued all parties.",conservatives
gy8iept,2021-05-15T03:40:55.000-07:00,"cbc has lost its lawsuit against the conservative party over the use of cbc material in ads during the 2019 federal election. federal court of canada rules it was \"fair use\" no it isn’t.  

the ruling of the case itself, at para 55, specifically says as much.

you have also identified the premise you didn’t prove: all else being equal.  onus on you.",conservatives
hby3piy,2021-09-07T02:18:49.000-07:00,"electoral reform: is trudeau's broken promise on any party's agenda? | cbc news i totally get what you're saying. i agree the poll results would be different if you asked people to choose from a list of systems, fptp is familiar so it would probably poll quite highly. but when about 70% of canadians support some form of er (whether it's pr or ranked ballot, whatever), it demonstrates to me that it isn't a niche issue, but something people are generally interested in.",liberals
hby3pnu,2021-09-07T02:18:51.000-07:00,"politics, polls, and punditry - tuesday, september 7, 2021 sounds like the model assumes a bunch of four-way races that end up helping the liberals",liberals
hby42qb,2021-09-07T02:21:19.000-07:00,"politics, polls, and punditry - tuesday, september 7, 2021 nik nanos has actually donated to the conservatives in the past.",conservatives
hby4d48,2021-09-07T02:23:16.000-07:00,"protesters throw rocks at trudeau in london, ontario you just summed up the united states.",liberals
hby4k81,2021-09-07T02:24:37.000-07:00,"politics, polls, and punditry - tuesday, september 7, 2021 &gt; 169 - liberal

liberals would go hard getting may to switch red or get one of the more urban ndp to jump ship",liberals
hby4xf4,2021-09-07T02:27:06.000-07:00,"politics, polls, and punditry - tuesday, september 7, 2021 if ndp supports a cpc while liberals also want to form government, the ndp might as well disband as a party. the 2023/2024 will be a complete slaughter of orange",liberals
hby4xsq,2021-09-07T02:27:11.000-07:00,"protesters throw rocks at trudeau in london, ontario [removed]",liberals
hby4zga,2021-09-07T02:27:28.000-07:00,"politics, polls, and punditry - tuesday, september 7, 2021 i doubt may would cross the floor but i could easily see her backing the liberals on most things. also yes i could see the lpc convincing a moderate ndp mp or two to cross over.",liberals
hby50o3,2021-09-07T02:27:42.000-07:00,"protesters throw rocks at trudeau in london, ontario [removed]",liberals
hby5ad9,2021-09-07T02:29:30.000-07:00,"protesters throw rocks at trudeau in london, ontario the chretiens didn't fuck around.

between that and the shawinigan handshake, it's clear the security detail wasn't to protect them from the public, but rather the other way around",liberals
hby5cb2,2021-09-07T02:29:52.000-07:00,"politics, polls, and punditry - tuesday, september 7, 2021 &gt; i could see the lpc convincing a moderate ndp mp or two to cross over.

[ruth ellen brosseau](https://www.cbc.ca/news/politics/brosseau-liberal-meeting-1.5021383) was courted by the liberals leading up to the 2019 election.",liberals
hby5e5u,2021-09-07T02:30:13.000-07:00,"canadians could have the right to live and work in the united kingdom, australia and new zealand under conservative plans for a new free-trade area. open borders mean a large labour pool which benefits businesses. why did you think the conservatives would be against something that benefits businesses?",conservatives
hby5pbe,2021-09-07T02:32:22.000-07:00,"protesters throw rocks at trudeau in london, ontario [removed]",liberals
hby5r9x,2021-09-07T02:32:45.000-07:00,"protesters throw rocks at trudeau in london, ontario canadians are obnoxious about elections. we take them for granted. there is nothing more entitled than whining about the timing, except for the endless, tedious whinging about \"my vote doesn't matter\" \"we need to change the whole system\", \"i'm not in the mood right now\",  and on and on. to carry on at this point about the timing of the election is just clinging to a gripe. not that i like the timing, because i would have liked to volunteer, but it just bugs me, this complacency that we are in a position to snipe about the mechanics and don't even see it.",liberals
hby5vac,2021-09-07T02:33:29.000-07:00,"protesters throw rocks at trudeau in london, ontario [removed]",liberals
hby5y55,2021-09-07T02:34:01.000-07:00,"protesters throw rocks at trudeau in london, ontario [removed]",liberals
hby6dmn,2021-09-07T02:36:58.000-07:00,"politics, polls, and punditry - tuesday, september 7, 2021 can’t see may crossing the floor it would kill the green party which she dedicated so much of her life too. but i can see the liberals giving her the minister of environment and climate change to at least try the strategy would be more on getting cpc / ndp members to come over",liberals
hby6e92,2021-09-07T02:37:05.000-07:00,"protesters throw rocks at trudeau in london, ontario removed for rule 2.",liberals
hby6ew5,2021-09-07T02:37:12.000-07:00,"protesters throw rocks at trudeau in london, ontario removed for rule 2.",liberals
hby6s4x,2021-09-07T02:39:46.000-07:00,"politics, polls, and punditry - tuesday, september 7, 2021 he donates money to the conservative party of canada.",conservatives
hby70z3,2021-09-07T02:41:26.000-07:00,"erin o’toole keeps changing his story — and, so far, it’s working even the liberals moved away from \"assault weapon\" in their order in council, though. assault weapons have been banned in canada since the 70s, and no one is making a serious effort to lift that ban. so they had to start using the tortured \"military-style, assault-type\" weapons. which, as far as i can tell, is code for \"a semi-automatic rifle that is functionally identical to any other semi-automatic rifle, but is black.\"",liberals
hby7719,2021-09-07T02:42:36.000-07:00,"gun control advocates unimpressed with o'toole's policy change on liberal gun ban the problem with this whole portfolio is the amount of imported politics from the us and an uninformed, vocal anti-gun lobby.  we have very strict laws around firearms and very low actual gun violence comparatively.  is there room for improvement? always.  is overly hyperbolic, kneejerk politics the answer? no.

it's easy to win cheap political points on a contentious issue, not so easy to actually put forward sensible policy to correct the root issues.

o'toole's recent statements are, i think, the right direction.  take the politics out of it, focus on where the crime actually is.  demonizing farmers in saskatchewan for owning rifles does nothing to stop gang shootings with handguns in toronto.",conservatives
hby7ryp,2021-09-07T02:46:36.000-07:00,"canadians could have the right to live and work in the united kingdom, australia and new zealand under conservative plans for a new free-trade area. conservatives always say they creat jobs, but when asked to produce proof or plans they always seem to fall short. i'll believe it when i see it. also, i agree with what others have already said this is in motion already. not a novel thing to be introduced.",conservatives
hby7sfz,2021-09-07T02:46:42.000-07:00,"politics, polls, and punditry - tuesday, september 7, 2021 iirc the cpc gun fiasco was kicked off by trudeau at the french debate on september 2, and has dogged them every day since.",liberals
hby7vr4,2021-09-07T02:47:20.000-07:00,trudeau says he ‘won’t back down’ from anti-vaxx protesters | globalnews.ca [removed],liberals
hby7zhe,2021-09-07T02:48:02.000-07:00,"'we will not let them win,' trudeau says after being pelted with gravel during campaign stop the good news, is the ppc is not going to win even a single seat, so on this at least he can stay true to his word.",liberals
hby82hs,2021-09-07T02:48:36.000-07:00,"politics, polls, and punditry - tuesday, september 7, 2021 a large cpc lead may lead the abc vote to the lpc so it is a conspiracy.   

good numbers for the lpc means trudeau is doing well so it is a conspiracy.  

a small lpc or cpc minority fits the narrative well and therefore is not a conspiracy.",liberals
