gxrgih6,2021-05-11T04:55:22.000-07:00,"trudeau government to spend $12b on toronto, hamilton transit projects &gt; 2) environmentalists: \"this will hurt the environment!\"

sorry, not buying that one. mass transit is well recognised as being the most environmentally friendly way of moving people around. sometimes a route might go through an area that has significant environmental concerns, but since we're talking about cities, that isn't common.

and overall, your list seems more like stereotypes, rather than actual concerns.",liberals
gxrhc4i,2021-05-11T05:00:56.000-07:00,"trudeau government to spend $12b on toronto, hamilton transit projects [removed]",liberals
gxrhkvr,2021-05-11T05:02:36.000-07:00,"trudeau government to spend $12b on toronto, hamilton transit projects [removed]",liberals
gxrhlbx,2021-05-11T05:02:42.000-07:00,"trudeau government to spend $12b on toronto, hamilton transit projects &gt;the reason for inflation is still that the increased cost of a good is based on an increase in demand without a corresponding increase in supply.

i work in construction, this can already be seen with lumber, plywood, steel etc ...

lumber is up 370% year to date, supply hasn't increased though. the cost of plywood went up 5$ a sheet from yesterday to today. 

you can.google it for yourself and find company after company rasing prices because cost of materials to produce their goods have gone up and supply of those materials hasn't. coca cola, pepsi, nestle, proctor and gamble just to name a few are all in the news saying the same thing.",liberals
gxrholp,2021-05-11T05:03:19.000-07:00,"justin trudeau’s liberals have a firm grip on toronto. can jagmeet singh’s new democrats break it? seems to me that the way the ndp succeeds is by persuading these folks that a sessional university instructor [making $28k with no job security](https://www.cbc.ca/news/canada/most-university-undergrads-now-taught-by-poorly-paid-part-timers-1.2756024) (for example) is no less a worker than the guy in coveralls whose manufacturing job just got moved to mexico or china, and that they are both victims of basically the same exploitative economic system.",liberals
gxrhwgl,2021-05-11T05:04:48.000-07:00,"léger: lpc 33%, cpc 30%, ndp 19%, bq 7%, gpc 7% the leger poll is the only to come out since the lat ekos poll. that one ekos poll was even an outlier for ekos polls. 

two other polls since january have had the conservatives down below 27%, so outliers like this would occur when the polls are flat like this. [https://en.wikipedia.org/wiki/opinion\\_polling\\_for\\_the\\_44th\\_canadian\\_federal\\_election](https://en.wikipedia.org/wiki/opinion_polling_for_the_44th_canadian_federal_election)",conservatives
gxri1a9,2021-05-11T05:05:42.000-07:00,"b.c. giving workers 3 paid days off for absences related to covid-19 keep in mind the bc ndp is basically the liberal party elsewhere... that is, a centre/centre-right party.",liberals
gxri4y9,2021-05-11T05:06:23.000-07:00,"justin trudeau’s liberals have a firm grip on toronto. can jagmeet singh’s new democrats break it? or, they ndp can move in a direction that doesn't involve being condescending to the person doing the blue collar work who made the decision not to go to university.",liberals
gxrjgo7,2021-05-11T05:15:22.000-07:00,trudeau government's deficit spending wins stephen poloz's praise as 'sustainable' [removed],liberals
gxrjjwf,2021-05-11T05:15:58.000-07:00,"trudeau government to spend $12b on toronto, hamilton transit projects i work in a related industry to yours. the reason the price of things have gone up is because of a supply chain disruption.

supply chains are very tightly run ships that are meant to buy goods at a cost as little as humanly possible so things are run at the tightest possible margins of safety to reduce inventory and thus cost. these supply chains do not allow for year long disruptions that can arise from workers being at home, borders being closed, capacities being reduced to protect against covid, etc. that's why lumber and steel are so expensive. not because there was a sudden demand or that we've been mining less or that there are fewer trees to cut.

these will take time to return to normal, but on the time scale of transit projects, the supply chains should be back to normal by the time we get to building.",liberals
gxrjjxm,2021-05-11T05:15:58.000-07:00,"anti-maskers slammed for flying flag linked to white supremacists at sask. war memorial \"wow, the rules i didn't follow didn't work.  thanks, trudeau.\"

it has the same energy as \"i didn't wear a seatbelt and i went through my windshield when i got into a car crash.  guess car safety is bullshit that doesn't work\".",liberals
gxrjmtq,2021-05-11T05:16:30.000-07:00,"trudeau government to spend $12b on toronto, hamilton transit projects &gt; yes, but environmentalists are usually rational. if damage to sensitive ecosystems can be mitigated, the environmental payoff from improved public transit connectivity can outweigh the costs.

ymmv.

as evidenced by the high speed rail project u/greetingsfromcanada mentioned as well as the usual dim view towards nuclear power. sometimes you get very evidence-based organizations like wcs, sometimes you get media-stunt driven organizations that attract attention like greenpeace.",liberals
gxrjskn,2021-05-11T05:17:34.000-07:00,"justin trudeau’s liberals have a firm grip on toronto. can jagmeet singh’s new democrats break it? well the good news is nobody (apart from the \"university students\" of your imagination—womyn's basket weaving majors, all, no doubt) is actually doing that. 

or maybe i'm wrong! surely if this is the pervasive, existential problem for the ndp that you suggest it to be, you'll have no difficulty pointing me to  some examples of the party condescending to to blue collar workers.",liberals
gn3yc0q,2021-02-12T06:26:07.000-08:00,"canada is on track to receive 84m doses of covid-19 vaccine by september, justin trudeau says [removed]",liberals
gn3yhzu,2021-02-12T06:27:27.000-08:00,"canada to get more pfizer doses earlier than planned, with some q3 deliveries moved to q2, trudeau says [removed]",liberals
gn3yji5,2021-02-12T06:27:48.000-08:00,opinion: trudeau has presided over worst business investment growth of past five prime ministers i really wish there was a party that was 90% for the people not like it is now! they only address certain needs and the rest of the time is cut cut cut to meet budgetary needs but dont seem to realise that the things they cut are things that our forefathers strived for the 🤷‍♂️,liberals
gn3yqh5,2021-02-12T06:29:22.000-08:00,"federal government could distribute covid-19 rapid tests itself if the provinces don’t start using them, justin trudeau says [deleted]",liberals
gn3yvwg,2021-02-12T06:30:37.000-08:00,"erin o’toole is banking on a bro-covery while you do have a point, the conservative party overall does have certain amount of... inauthenticity(?)... when it comes to the topic of helping out the poor rather than the corporations/wealthy.",conservatives
gn40j6k,2021-02-12T06:44:05.000-08:00,"opinion: trudeau has presided over worst business investment growth of past five prime ministers well, what's an example of that? in my mind our fathers mostly fought for us to have our freedoms, but what's an example of what you're thinking of?",liberals
gn41012,2021-02-12T06:48:03.000-08:00,"sean speer: to avoid cancel culture and censorship, tories must champion pluralism &gt;no. this article isn't referring to fringe groups.

as we see from the u.s., these groups aren't quite so fringe.

and yes, the u.s. is relevant since it is the source of great deal of influence on the direction of thought here in canada. you can try to ignore it all you want, but you're not living in reality if you do.

trump, is not \"fringe.\" he's all kinds of things, but he's not fringe. and a huge swathe of conservatives (not the majority, but a significant minority) are quite in favour of trump.

so does that extend to the bigotry, anti-semitism, racism, etc. to canadian conservatives or not.

you say no.

that's good.

what do other canadian conservatives say?

is it ok to fire anti-semites for their anti semitism or is that \"cancel culture\"? 

are the there standards of behaviour or not? can they be enforced or not?

these are the questions you haven't answered and they're still quite relevant.

so do tell.",conservatives
gn410ha,2021-02-12T06:48:09.000-08:00,"trudeau's criticism of trump cited at u.s. impeachment trial. democrats seeking to convict trump argue jan. 6 capitol riot damaged u.s. reputation around the world to be clear, i am not american.

i am not going to look into the metrics that are used in your source, but america is uniquely free regarding access to firearms and free speech.",liberals
gn421nx,2021-02-12T06:56:51.000-08:00,opinion: trudeau has presided over worst business investment growth of past five prime ministers health care education military and police should never be cut we should be adding to our odsp .. i do have an issue with welfare it was never designed as a living income .was designed to help people out,liberals
gn45ubu,2021-02-12T07:29:23.000-08:00,"canada to get more pfizer doses earlier than planned, with some q3 deliveries moved to q2, trudeau says [removed]",liberals
gtyusfn,2021-04-09T05:52:20.000-07:00,"‘now is the moment’ to act on child care, says freeland at virtual liberal convention we’re talking about pharmacare here, not childcare. the liberals have been promising *that*, too, since 1988!

also weird how you single out layton and not duceppe or harper voting down martin’s government, or even paul martin himself for running one of the worst political campaigns in canadian history",liberals
gtyv6vt,2021-04-09T05:55:26.000-07:00,"should the tories be worried about their political future? | tvo.org i'm actually worried for the conservative party in the longer term. in one sense, they're sitting on a demographic time bomb since most of their base is in the older age cohorts. as they age out and die, there isn't an influx of new members and new blood to replace them. the party will literally wither into almost nothing in a couple of decades

if they want to survive, they need to evolve past their base to attract swing voters and moderates across the board as their new base. if they succeed, they have a chance at forming government in the future. if they fail, they might never even sniff opposition status. the fact that they're refusing to see that is laughably tragic, especially when we take it to the federal level.",conservatives
gtyvf5d,2021-04-09T05:57:12.000-07:00,"discussion thread - 2021 liberal party of canada convention to re-litigate what's now ancient history, if the lpc had been serious about electoral reform they would have struck the committee as a [legislative committee](https://www.ourcommons.ca/about/procedureandpractice3rdedition/ch_20_2-e.html#20-2-3), tasked specifically with drafting an electoral reform bill to bring to the house.  that would have put real skin in the game.

instead, the committee-to-study approach was prone to manipulation from the start, leading to its chimeric report-plus-minority-opinions product.",liberals
gtyvl36,2021-04-09T05:58:28.000-07:00,"globe editorial: the liberals are absolutely, positively not planning for that election that they’re planning for i guarantee you that no professional political consultant thinks the way you do.  also no successful major politician.  from a partisan perspective the best way to govern the country is if your side has as much power as possible.  that way you don't have to water down your ideas just to get the ndp on board to pass a bill.  all parties want a majority government for themselves and their supporters.  that's the point of the horse race part of politics that always must be in the back of your mind if you want power, or to stay in power.  this is really basic \"art of war\" type stuff.",liberals
gtyvn2c,2021-04-09T05:58:54.000-07:00,"globe editorial: the liberals are absolutely, positively not planning for that election that they’re planning for if you're not prepared for an election, there's a very good chance the opposition will vote down your budget to take advantage.",liberals
gtyvonq,2021-04-09T05:59:13.000-07:00,"liberals start national convention hoping to avoid the infighting, controversy of their rivals i don't understand why the government needs to provide childcare. can't feed em don't breed em.",liberals
gtyvvcc,2021-04-09T06:00:40.000-07:00,"not so united conservatives: kenney being punished politically for doing the right thing his problem is he over promises and under delivers. again and again and again. the only two things he's followed through on to date is uniting both right of centre parties, and getting rid of the ndp.

otherwise:

- the budget is worse than ever.
- he continues to set reopening plans on *leading*, not *lagging* indicators like he should.
- he didn't get rid of the carbon tax.
- he's never going to get a 'fair deal' for alberta from the feds.
- no keystone... 

at this point no one trusts him to do anything right and it shows.",conservatives
gtywup1,2021-04-09T06:08:20.000-07:00,"globe editorial: the liberals are absolutely, positively not planning for that election that they’re planning for in the liberal party convention program, which is undeniably representative of canadian values.",liberals
gtyyofh,2021-04-09T06:22:34.000-07:00,"globe editorial: the liberals are absolutely, positively not planning for that election that they’re planning for yikes. i mean, i'm not arguing that that's how the political calculus works right now, under our current system, but that doesn't make it the best way to run a country. it just means that five years down the line, the other guy gets 100% power with 37% support and can ctrl-z whatever policy ideas you passed. and it makes a government ideologically brittle, unable to flex when changing circumstances makes their policy less useful. our system needs to change. 

(that's why i have proportional representation in my flair!)",liberals
gtyysjd,2021-04-09T06:23:26.000-07:00,"after his latest outing, doug ford is officially anti-worker blame the idiot premier who is treating ontario like his private piggy bank as opposed doing what's right then.

we would have been fine if schools remained closed until december and start vaccinating essential workers in jan.

instead we are at 4,000 cases while ford simultaneously begs trudeau for help while also blaming him because ford is a moron.",liberals
gtyyw71,2021-04-09T06:24:13.000-07:00,"discussion thread - 2021 liberal party of canada convention in fairness, i have no interest in relitigating either. it's the past; let's move on, it didn't happen and none of the parties were willing to work together on it. agree they could have handled it differently but what's also forgotten is that the liberal bench was incredibly green at the time.",liberals
gtyyz1a,2021-04-09T06:24:50.000-07:00,"erin o'toole: canadians conquered vimy ridge. we can win the battle against covid, too ###this is a reminder to [read the rules before posting in this subreddit](https://www.reddit.com/r/canadapolitics/wiki/rules-thelongversion).
 
1. **headline titles should be changed only [when the original headline is unclear](https://www.reddit.com/r/canadapolitics/wiki/rules-thelongversion#wiki_1._headline_titles_should_be_changed_only_where_it_improves_clarity.)**
2. **be [respectful](https://www.reddit.com/r/canadapolitics/wiki/rules-thelongversion#wiki_2._be_respectful).**
3. **keep submissions and comments [substantive](https://www.reddit.com/r/canadapolitics/wiki/rules-thelongversion#wiki_3._keep_submissions_and_comments_substantive).**
4. **avoid [direct advocacy](https://www.reddit.com/r/canadapolitics/wiki/rules-thelongversion#wiki_4._avoid_direct_advocacy).**
5. **link submissions must be [about canadian politics and recent](https://www.reddit.com/r/canadapolitics/wiki/rules-thelongversion#wiki_5._link_submissions_must_be_canadian_and_recent).**
6. **post [only one news article per story](https://www.reddit.com/r/canadapolitics/wiki/rules-thelongversion#wiki_6._post_only_one_news_article_per_story).** ([with one exception](https://www.reddit.com/r/canadapolitics/comments/3wkd0n/rule_reminder_and_experimental_changes/))
7. **replies to removed comments or removal notices will be removed** without notice, at the discretion of the moderators.
8. **downvoting posts or comments**, along with urging others to downvote, **[is not allowed](https://www.reddit.com/r/canadapolitics/wiki/downvotes)** in this subreddit. bans will be given on the first offence.
9. **[do not copy &amp; paste the entire content of articles in comments](https://www.reddit.com/r/canadapolitics/wiki/rules-thelongversion#wiki_9._do_not_copy_.26amp.3b_paste_entire_articles_in_the_comments.)**. if you want to read the contents of a paywalled article, please consider supporting the media outlet.

*please [message the moderators](https://www.reddit.com/message/compose?to=%2fr%2fcanadapolitics) if you wish to discuss a removal.* **do not reply to the removal notice in-thread**, *you will not receive a response and your comment will be removed. thanks.*


*i am a bot, and this action was performed automatically. please [contact the moderators of this subreddit](/message/compose/?to=/r/canadapolitics) if you have any questions or concerns.*",conservatives
gtyzuxu,2021-04-09T06:31:48.000-07:00,"globe editorial: the liberals are absolutely, positively not planning for that election that they’re planning for what's wrong with going back to the public to confirm their mandate to govern and implement their plan? seems like a very democratic thing to do.

i also don't necessarily want an election now, and if there is, i hope to see more green and ndp representation. 

but there is nothing wrong to call an election in the middle of your minority mandate if they can implement an election safely.",liberals
gtz0lf6,2021-04-09T06:37:38.000-07:00,"erin o'toole: canadians conquered vimy ridge. we can win the battle against covid, too [removed]",conservatives
gtz0n46,2021-04-09T06:37:59.000-07:00,"globe editorial: the liberals are absolutely, positively not planning for that election that they’re planning for they don't have a mandate to govern, they have the confidence of the house. they wouldn't have a mandate to govern with 40% and 200 mps either, just the confidence of the house. and the house resembles the actual political demographics in this country now, with a minority government, much more than it would with a liberal majority on a 3-7% vote share boost.",liberals
gtz0qhs,2021-04-09T06:38:43.000-07:00,new democrats launch policy convention with a pitch to voters: we have your backs i’d still take them over the #istandwithtrudeau or the #removethepm types tbh,liberals
gtz0qov,2021-04-09T06:38:46.000-07:00,"after his latest outing, doug ford is officially anti-worker only in canada could a conservative, populist leader whos election platform was cutting nursing jobs and 1$ beer not be considered a anti worker reactionary from the jump. of course doug ford hates the poor and worships the rich just look at who's he's friends with. the ruling class will never be on the side of the workers, and conservatives don't even pretend to be. never have.",conservatives
gtz1fzp,2021-04-09T06:44:18.000-07:00,discussion thread - 2021 liberal party of canada convention wow. only two contested party positions in the whole convention.,liberals
gtz1t4s,2021-04-09T06:47:13.000-07:00,"erin o'toole: canadians conquered vimy ridge. we can win the battle against covid, too this man was calling on a national plan to reopen the economy just weeks ago when the third wave was emerging.  

the gall to compare vimy ridge to covid when he's sabotaging his own side.",conservatives
gtz29zw,2021-04-09T06:50:56.000-07:00,"globe editorial: the liberals are absolutely, positively not planning for that election that they’re planning for they have the confidence of the house...to govern(?) which legitimizes the gg asking them to form gov't, n'est-ce pas? 

i just meant that its legit for a minority government after a while to ask canadians whether they want a change or not. 

sucks that we don't have pr. the current system doesn't allow canadians' real views to be translated into parliament. and in my eyes, this compromises the mandate of any government. but not in the eyes of parliamentary democratic convention, which matters more, i guess.",liberals
gtz2bjf,2021-04-09T06:51:17.000-07:00,"liberals, ndp could use a bump in the polls — at each other's expense the ndp under layton in 2004 gained a total of 4 more seats but lost all representation in saskatchewan, the place where the ndp were founded, because the ndp did nothing and relied on layton's popularity to get elected. in 2006 they did well but went down hill fast and lost any credibility with canadians because they talked big but when the time came they did nothing but whine and pout as an opposition. they were so bad that by 2019 even a bunch of their own elected members were quitting and not running and they lost a lot of the seats.  the only thing the ndp has done in the last few years is tell everyone else how everyone is doing everything wrong, but they have no plan how they would do anything better and have spent more time and effort infighting than anything positive.  empty words and empty promises is all you'll get from the ndp.",liberals
gtz2fa9,2021-04-09T06:52:04.000-07:00,"liberals start national convention hoping to avoid the infighting, controversy of their rivals [deleted]",liberals
gwuc355,2021-05-03T09:12:06.000-07:00,"mlas from the yukon’s conservative party apologize after inappropriate text message exchange made public ###this is a reminder to [read the rules before posting in this subreddit](https://www.reddit.com/r/canadapolitics/wiki/rules-thelongversion).
 
1. **headline titles should be changed only [when the original headline is unclear](https://www.reddit.com/r/canadapolitics/wiki/rules-thelongversion#wiki_1._headline_titles_should_be_changed_only_where_it_improves_clarity.)**
2. **be [respectful](https://www.reddit.com/r/canadapolitics/wiki/rules-thelongversion#wiki_2._be_respectful).**
3. **keep submissions and comments [substantive](https://www.reddit.com/r/canadapolitics/wiki/rules-thelongversion#wiki_3._keep_submissions_and_comments_substantive).**
4. **avoid [direct advocacy](https://www.reddit.com/r/canadapolitics/wiki/rules-thelongversion#wiki_4._avoid_direct_advocacy).**
5. **link submissions must be [about canadian politics and recent](https://www.reddit.com/r/canadapolitics/wiki/rules-thelongversion#wiki_5._link_submissions_must_be_canadian_and_recent).**
6. **post [only one news article per story](https://www.reddit.com/r/canadapolitics/wiki/rules-thelongversion#wiki_6._post_only_one_news_article_per_story).** ([with one exception](https://www.reddit.com/r/canadapolitics/comments/3wkd0n/rule_reminder_and_experimental_changes/))
7. **replies to removed comments or removal notices will be removed** without notice, at the discretion of the moderators.
8. **downvoting posts or comments**, along with urging others to downvote, **[is not allowed](https://www.reddit.com/r/canadapolitics/wiki/downvotes)** in this subreddit. bans will be given on the first offence.
9. **[do not copy &amp; paste the entire content of articles in comments](https://www.reddit.com/r/canadapolitics/wiki/rules-thelongversion#wiki_9._do_not_copy_.26amp.3b_paste_entire_articles_in_the_comments.)**. if you want to read the contents of a paywalled article, please consider supporting the media outlet.

*please [message the moderators](https://www.reddit.com/message/compose?to=%2fr%2fcanadapolitics) if you wish to discuss a removal.* **do not reply to the removal notice in-thread**, *you will not receive a response and your comment will be removed. thanks.*


*i am a bot, and this action was performed automatically. please [contact the moderators of this subreddit](/message/compose/?to=/r/canadapolitics) if you have any questions or concerns.*",conservatives
gwucez6,2021-05-03T09:14:43.000-07:00,critics say sajjan or trudeau should take responsibility for failure to investigate sexual misconduct allegation against vance in 2018 [removed],liberals
gwucj03,2021-05-03T09:15:37.000-07:00,mark carney’s potential run for office has liberals talking removed for rule 3.,liberals
gwuct22,2021-05-03T09:17:48.000-07:00,critics say sajjan or trudeau should take responsibility for failure to investigate sexual misconduct allegation against vance in 2018 [removed],liberals
