gp05v73,2021-02-26T22:00:49.000-08:00,"to win the next election, conservatives need a credible climate plan it’s pretty simple: invest in carbon capture like carbon engineering, invest in clean energy like nuclear there is a next generation plant be done in new brunswick. without carbon tariff, you can’t cripple local manufacturing by imposing carbon taxes. impose sale tax on things that are bad and use the money for carbon capture and new energy sources. a simple message",conservatives
gp073qu,2021-02-26T22:05:35.000-08:00,"liberals rhetorically support ndp pharmacare bill, then vote against it [removed]",liberals
gp07gk3,2021-02-26T22:06:55.000-08:00,"conservatives authorized chinese police-owned company to run visa centre: blair it is not unfair at all to blame the cpc for this. they made a choice to hire an outside company instead of running the application center themselves out of the embassy.

if they care that much, they shouldn’t have outsourced. but obviously they don’t, they’re just grabbing at “gotcha” straws, hoping one of them sticks.",conservatives
gp09ueq,2021-02-26T22:16:41.000-08:00,"to win the next election, conservatives need a credible climate plan [deleted]",conservatives
gp0a3bt,2021-02-26T22:18:10.000-08:00,"liberals rhetorically support ndp pharmacare bill, then vote against it the issue is, they're not really advancing pharmacare through their own work either.

they made some very modest commitments in 2019 to do some of the things that could be precursors to pharmacare. but their original timelines make them unworkable as part of a plan to create pharmacare, and they don't even seem to have followed through on beginning that work.

you accuse the ndp of playing politics. i simply think they're doing politics -- and that politics are not a game. the status quo plan from the liberals will not lead to pharmacare. but the ndp accusing the liberals of not wanting pharmacare could lead to the liberals developing a real plan that will get it done, to prove the ndp wrong.

that's a good thing, not a bad one.",liberals
gp0aaj7,2021-02-26T22:19:27.000-08:00,"matt gurney: a hundred years from now, who'll apologize to the uyghurs for trudeau? [removed]",liberals
gp0cfeu,2021-02-26T22:28:13.000-08:00,"liberals rhetorically support ndp pharmacare bill, then vote against it just so you know, the liberals promised to set up the cda, who would create the formulary and do that other stuff, in 2019.

at that time, the plan was to have the formulary done by 2027.

two years later, the cda hasn't even been created yet, and as far as is public (and why would they keep it secret?) the formulary work hasn't begun yet either... so that 2027 target seems optimistic at this point.

and the liberals have called that work \"foundational\" to pharmacare. once that's done is when they plan to design the actual pharmacare program, negotiate with the provinces, and figure out how it will work.

i hope that the ndp calling the liberals out for not moving on pharmacare will convince the liberals to actually get serious about it. but, if you're relying on their pre-existing plan to get it done, they're pretty unlikely to be in government long enough to see it through.",liberals
gp0e4dn,2021-02-26T22:34:54.000-08:00,"liberals rhetorically support ndp pharmacare bill, then vote against it i hope they hold the liberals to account as well until there is movement on the file, or they're voted out. breaking the pharmacare promise, again, is absolutely grounds for punishing them in the polls.",liberals
gp0ffvn,2021-02-26T22:40:02.000-08:00,"to win the next election, conservatives need a credible climate plan [removed]",conservatives
gp0h05i,2021-02-26T22:45:47.000-08:00,"matt gurney: a hundred years from now, who'll apologize to the uyghurs for trudeau? [removed]",liberals
gp0ipmf,2021-02-26T22:52:32.000-08:00,"to win the next election, conservatives need a credible climate plan [removed]",conservatives
gp0kqsw,2021-02-26T23:02:03.000-08:00,"to win the next election, conservatives need a credible climate plan [removed]",conservatives
gjelogg,2021-01-15T08:57:26.000-08:00,"trudeau slams blanchet for ‘pandering’ to ‘worst elements’ with comments about new minister alghabra thats litterally not what this is about.

you wanna accuse him of something **specific** ok fine but just saying \"he was a part of an islamic organization thats sus tho\" is litterally the definition of racism",liberals
gjem4ej,2021-01-15T09:01:28.000-08:00,"trudeau slams blanchet for ‘pandering’ to ‘worst elements’ with comments about new minister alghabra the pm is right to call this out. he hits the nail on the head. blanchet should be censured for this kind of stuff, otherwise it just goes on and on.",liberals
gjemmoi,2021-01-15T09:06:05.000-08:00,"n.l. heading to the polls on feb. 13 as andrew furey seeks liberal majority i'm pretty sure the liberals will win but who knows.

i hope the ndp keeps their seat count and the pc's don't lose much.",liberals
gjemuqy,2021-01-15T09:08:07.000-08:00,"trudeau slams blanchet for ‘pandering’ to ‘worst elements’ with comments about new minister alghabra that's not what blanchet is arguing, though. he's arguing that alghabra isn't to be trusted because he was involved with *any* arab/muslim community organisation, which is being tarred as inherently predisposed to supposed \"stealth sharia\" operations and the like. he's dogwhistling conspiracy theories and it's obvious. what's even more disturbing (but not surprising) is the silence of the cpc.",liberals
gjen1xg,2021-01-15T09:09:55.000-08:00,"trudeau slams blanchet for ‘pandering’ to ‘worst elements’ with comments about new minister alghabra i agree with you. 

\"person x who clearly doesn't align with person y on many views, slams person y on those views they disagree with\". 

it's a goddamn echo-chamber of news, and if it's on cnn it's also breaking news apparently.",liberals
gjen46z,2021-01-15T09:10:29.000-08:00,trudeau slams blanchet for ‘pandering’ to ‘worst elements’ with comments about new minister alghabra [removed],liberals
gjenq9r,2021-01-15T09:16:07.000-08:00,"trudeau slams blanchet for ‘pandering’ to ‘worst elements’ with comments about new minister alghabra i thought it wouldn’t hurt him until i heard drainville, it was pretty scathing.",liberals
gjeoa9x,2021-01-15T09:21:14.000-08:00,trudeau slams blanchet for ‘pandering’ to ‘worst elements’ with comments about new minister alghabra [removed],liberals
gjeoauj,2021-01-15T09:21:23.000-08:00,"the public has the right to know, says information chief. trudeau may disagree [deleted]",liberals
gjeofor,2021-01-15T09:22:37.000-08:00,"abacus data | lpc 35, cpc 31, ndp 17, grn 6, blc 8 it's also not the highest. this is an oft repeated mis-information. ill have to go back in my own post history (watching the game now) to find it

but the claim of this comes from the a chart that removes financial institution revenue from gdp. when you include canada's finance sector, canada's debt to gdp falls to around 83%, which is around the 15th \"worst in the world\".  

the chart oft referenced was in a contextual article. it was taken out of context and used as political rhetoric. give you a guess who was spreading it.

believe it or not, we're ... \"fine\"... well not fine. shit sucks. but the \"trudeau has destroyed our futures!!! worst in the world sky is falling\" is pathetic because it just isn't based in fact.

and this is coming from someone who didn't vote for lpc in 2019. gotta call it as i see it.

edit: citations as i promised

canada's debt to gdp ranked and their percentages: https://worldpopulationreview.com/countries/countries-by-national-debt

the oft repeated chart ignoring the subline for misinformation campaign
https://www.weforum.org/agenda/2020/12/global-debt-gdp-covid19/
&gt; not including the financial sector, canada's debt-to-gdp rose by nearly 80% in 2020.

our finance sector is our 3rd largest industry. ignoring that would skew any chart. 

we are as a country still very financially stable. imf puts canada as one of the leading countries for expected economic growth in 2021.

https://www.imf.org/external/datamapper/ngdp_rpch@weo/oemdc/advec/weoworld

we have some segments of our economy that are hurting though for assorted reasons.",liberals
gjeofrv,2021-01-15T09:22:38.000-08:00,"trudeau slams blanchet for ‘pandering’ to ‘worst elements’ with comments about new minister alghabra sure but the largest one chinese folk religion is a unique blend of buddhism, taoism, and confucianism but you are right that only 16% identify as primarily buddhist. figured my point would get across easier using buddhism but probably fair that the distinction is made.",liberals
gjep4jb,2021-01-15T09:29:01.000-08:00,we've run out the clock — and trudeau's climate accountability bill isn't enough [deleted],liberals
gjep9qq,2021-01-15T09:30:19.000-08:00,"trudeau slams blanchet for ‘pandering’ to ‘worst elements’ with comments about new minister alghabra they lost, [the decision was upheld in court](https://en.wikipedia.org/wiki/canadian_arab_federation#court_ruling_on_denial_of_funding):

&gt; \"all of the statements and actions raised by the minister can, in my view, reasonably lead one to the view that caf appears to support organizations that canada has declared to be terrorist organizations and which are arguably anti-semitic.\" the government had cited six incidents to support its claims against the caf; although the caf insisted that none of these incidents had been authorized or approved by the organization, zinn ruled that \"this defense ignores the maxim that ‘one is known by the company one keeps.",liberals
gjepwp7,2021-01-15T09:36:04.000-08:00,"canada's trudeau urges unified front against china detentions, says all nations vulnerable [removed]",liberals
gjepxnx,2021-01-15T09:36:19.000-08:00,"donald trump’s departure could be good for erin o’toole. if he can face up to these unpleasant truths i would not mind seeing a fracture in the party ( not like the ppc, that was just sad), having a more central conservative party  would balance nicely. we have 2 left leaning parties but only a single conservative where everyone has to find a place",conservatives
gjeq01k,2021-01-15T09:36:55.000-08:00,"trudeau slams blanchet for ‘pandering’ to ‘worst elements’ with comments about new minister alghabra i am appropriately condemning the bq for being racist and prejudiced against the minister of transportation. please read the article we are commenting on before replying, especially with bizarro concepts like the kkk.",liberals
gjeqpjo,2021-01-15T09:43:26.000-08:00,"trudeau slams blanchet for ‘pandering’ to ‘worst elements’ with comments about new minister alghabra &gt;if the cpc defunds the cbc we might as well have our news come from wwe announcers.

that could be fun.",liberals
gjeqstt,2021-01-15T09:44:16.000-08:00,"abacus data | lpc 35, cpc 31, ndp 17, grn 6, blc 8 thanks for that...i thought the initial claim sounded fishy, but didn't have the time/wherewithal to chase it down.

&gt;and this is coming from someone who didn't vote for lpc in 2019. gotta call it as i see it.

i hear that. the amount of time i spend defending the liberals you'd think my last name was \"butts\" (not seymour, the other one).",liberals
gjeqtbt,2021-01-15T09:44:24.000-08:00,trudeau slams blanchet for ‘pandering’ to ‘worst elements’ with comments about new minister alghabra then you need to watch idiocracy (if you haven’t seen it),liberals
gjeqxax,2021-01-15T09:45:25.000-08:00,trudeau slams blanchet for ‘pandering’ to ‘worst elements’ with comments about new minister alghabra i pictured someone jumping from the top rope yelling the news mid-air. perhaps my imagination made it too fun.,liberals
gjer134,2021-01-15T09:46:22.000-08:00,trudeau slams blanchet for ‘pandering’ to ‘worst elements’ with comments about new minister alghabra just watch idiocracy - it’s a comedy...and a warning. def worth a watch!,liberals
gjer21r,2021-01-15T09:46:37.000-08:00,"canada's trudeau wants to serve for 'number of more years,' rules out vaccine passports there could still be an intelligent person with vision at the top making constructive contributions, and building a cacus out of similar types.  dare to dream...",liberals
gjeran3,2021-01-15T09:48:48.000-08:00,"american chaos offers canadians a chance to reflect on their own democracy | cbc news &gt;if anything, it’s about cautious questioning of censorship t

mandatory reminder that the charter and the first amendment only apply to government action, not private platforms like google, which have discretion over the content they host.

  
i believe conservatives litigated this principle when it came to christian bakers not baking a wedding cake for a gay couple, but now they've decided that they don't agree with that principle at all and want society to compel private companies to host content they don't like.  


there's no rhyme or rhythm to these people.",conservatives
gjerbnz,2021-01-15T09:49:04.000-08:00,"rex murphy: canada is in crisis. erin o'toole, where are you? no yeah. twitter has frequently allowed death threats to all kinds of people. sorry - it's a bold faced lie to pretend parler was any worse in that respect. 

parler was killed because it's used by conservatives and the left saw it's opportunity, nothing more.",conservatives
gjerjo1,2021-01-15T09:51:06.000-08:00,"trudeau slams blanchet for ‘pandering’ to ‘worst elements’ with comments about new minister alghabra iirc drainville was spilling some tea awhile back about poilievre's possible reasons for abruptly abandoning his bid for cpc leader. i got the translation from some bilingual folks on social. apparently poilievre has a serious history of workplace abuse toward civil servants, and possibly even more skeletons in his closet than the warehouse of a halloween decor store.

https://www.985fm.ca/audio/279161/course-au-leadership-du-parti-conservateur-la-video-de-jean-charest-et-pierre-poilievre-ny-va-pas-dimanche-alexandre-cusson-lance-sa-campagne-au-leadership-du-plq",liberals
gjes3f4,2021-01-15T09:56:09.000-08:00,"trudeau slams blanchet for ‘pandering’ to ‘worst elements’ with comments about new minister alghabra oh, i've read the article. this one, the cbc one and even the original bq press release.

so, when you are commenting the following :

&gt;why are you even trying logic with the bloc quebecois? racism and prejudice are beneath logic.

does this only apply to the narrow case of that stupid statement regarding the cabinet reshuffle? 'cause it's sound a lot like a blanket statement about the party.",liberals
gjeslpn,2021-01-15T10:00:47.000-08:00,trudeau slams blanchet for ‘pandering’ to ‘worst elements’ with comments about new minister alghabra [removed],liberals
gjesxj3,2021-01-15T10:03:46.000-08:00,"american chaos offers canadians a chance to reflect on their own democracy | cbc news no, it’s called tech companies can do what they want. they can limit free speech and censor who they want. the uproar is that only several big companies run social media, and actively censoring conservatives and the right/trump supporters is pretty shocking. 
it’s bad business, as people will flock to a free speech social media platform (see parler), but the truth is that a minority leftist segment of the population (and large amount of tech companies employees) would like to censor views they don’t like. i mean, the left loves to assign those with views they don’t like as bigots, so nothing new to see here. 

the baker is different. you can’t force someone to do something against their religious views. 
imagine being a ‘solicitor’ and not understanding this 😂",conservatives
gjetgct,2021-01-15T10:08:32.000-08:00,trudeau slams blanchet for ‘pandering’ to ‘worst elements’ with comments about new minister alghabra [removed],liberals
gjeti2g,2021-01-15T10:08:58.000-08:00,trudeau slams blanchet for ‘pandering’ to ‘worst elements’ with comments about new minister alghabra the ccp is the only condoned religion in china,liberals
gws608u,2021-05-02T23:44:16.000-07:00,"mark carney’s potential run for office has liberals talking guy's a force. everyone just looks at the surface and says  *banker - no chance* 

wrong.  super bright, likable, articulate, has great policy prescriptions...  i'm would join the lpc to vote for him if he decides to run.",liberals
gws6c2c,2021-05-02T23:46:42.000-07:00,"liberals shut down debate on bill c-10 amendment allowing regulation of social media content well that seems to be a take based on conspiracism. which i disagree with. the government just wants shows that take place in canada, focus on canadian characters and are made by canadian studios. anything other then that they’ve never seen to particularly care. its why what shows are made don’t change between administrations.",liberals
gws6o97,2021-05-02T23:49:16.000-07:00,"mark carney’s potential run for office has liberals talking yeah, i'm not really sure having the former goldman sachs global manager of investment banking as your leader is a great way for the liberals to shed their elitist vibes.",liberals
gws6rnk,2021-05-02T23:49:57.000-07:00,"mark carney’s potential run for office has liberals talking please. think of the competence that carney could bring to the party as opposed to the ancien, and dare i say originally inexperienced crew that started in 2015. 

spending to oblivion is one thing, but having a leader who knows something of finance a la paul martin, would be the solution to a spiraling debt at the hands of two people who are eminently unqualified to hand finances.

perhaps the real concern that was left unsaid is that the liberal party could experience a split. that’s the real worry isn’t it?",liberals
gws6yzw,2021-05-02T23:51:29.000-07:00,"climate change: o’toole’s carbon pricing gamble draws mixed political reviews - angus reid institute summary:

* one on hand, one-in-five 2019 cpc voters (19%) say his new policy plank will make them less likely to vote for the party again in a future election.
* 19 per cent of past bloc quebecois voters in battleground quebec say the move makes them more likely to consider the conservative party when the next election is held.
* cpc members rejected a proposal to formally recognize climate change at the party’s policy convention in march.

electroally, it's a plus for them. the albertans that deny global warming  aren't going to vote for anyone but conservative.",conservatives
gws778r,2021-05-02T23:53:13.000-07:00,"climate change: o’toole’s carbon pricing gamble draws mixed political reviews - angus reid institute conservative party of canada supporters:

&gt; climate change is a fact and is mostly caused by human activities: 34%

&gt; climate change is a fact and is mostly caused by natural changes and cycles: 43%

&gt; climate change is a theory that has not yet been proven: 17%

the responses from conservative party supporters are starkly different from the other parties (others respond with 90%+ for the first option). this is where erin o’toole and future cpc leaders will have a lot of trouble.

edit: oh and 50% of those who identify as cpc supporters say we should decrease our efforts on tackling climate change. 50%!!!

erin o’toole’s climate plan would actually decrease our current efforts - so maybe he does know his base after all!",conservatives
gws78no,2021-05-02T23:53:32.000-07:00,"mark carney’s potential run for office has liberals talking &gt; perhaps the real concern that was left unsaid is that the liberal party could experience a split. that’s the real worry isn’t it?

lol. that's something for the other parties.",liberals
gws7cgd,2021-05-02T23:54:20.000-07:00,"mark carney’s potential run for office has liberals talking do people really think of the bank of canada like that? referring to central bankers as bankers is kind of weird because a central bank is so far off of what people think of as a bank. 

i feel like they would be able to communicate that he spent most of his career as a public servant at central banks and the department of finance. plus the work he did on the financial stability board. although if i recall correctly he was at goldman sachs prior to his life in public service.",liberals
gws7fna,2021-05-02T23:55:00.000-07:00,"in the book \"ares le mandat\", astrology and sociology are combined to form an actual system that would empower democrats to understand and accommodate conservatives ###this is a reminder to [read the rules before posting in this subreddit](https://www.reddit.com/r/canadapolitics/wiki/rules-thelongversion).
 
1. **headline titles should be changed only [when the original headline is unclear](https://www.reddit.com/r/canadapolitics/wiki/rules-thelongversion#wiki_1._headline_titles_should_be_changed_only_where_it_improves_clarity.)**
2. **be [respectful](https://www.reddit.com/r/canadapolitics/wiki/rules-thelongversion#wiki_2._be_respectful).**
3. **keep submissions and comments [substantive](https://www.reddit.com/r/canadapolitics/wiki/rules-thelongversion#wiki_3._keep_submissions_and_comments_substantive).**
4. **avoid [direct advocacy](https://www.reddit.com/r/canadapolitics/wiki/rules-thelongversion#wiki_4._avoid_direct_advocacy).**
5. **link submissions must be [about canadian politics and recent](https://www.reddit.com/r/canadapolitics/wiki/rules-thelongversion#wiki_5._link_submissions_must_be_canadian_and_recent).**
6. **post [only one news article per story](https://www.reddit.com/r/canadapolitics/wiki/rules-thelongversion#wiki_6._post_only_one_news_article_per_story).** ([with one exception](https://www.reddit.com/r/canadapolitics/comments/3wkd0n/rule_reminder_and_experimental_changes/))
7. **replies to removed comments or removal notices will be removed** without notice, at the discretion of the moderators.
8. **downvoting posts or comments**, along with urging others to downvote, **[is not allowed](https://www.reddit.com/r/canadapolitics/wiki/downvotes)** in this subreddit. bans will be given on the first offence.
9. **[do not copy &amp; paste the entire content of articles in comments](https://www.reddit.com/r/canadapolitics/wiki/rules-thelongversion#wiki_9._do_not_copy_.26amp.3b_paste_entire_articles_in_the_comments.)**. if you want to read the contents of a paywalled article, please consider supporting the media outlet.

*please [message the moderators](https://www.reddit.com/message/compose?to=%2fr%2fcanadapolitics) if you wish to discuss a removal.* **do not reply to the removal notice in-thread**, *you will not receive a response and your comment will be removed. thanks.*


*i am a bot, and this action was performed automatically. please [contact the moderators of this subreddit](/message/compose/?to=/r/canadapolitics) if you have any questions or concerns.*",conservatives
gws7i1j,2021-05-02T23:55:31.000-07:00,"mark carney’s potential run for office has liberals talking &gt; perhaps the real concern that was left unsaid is that the liberal party could experience a split. that’s the real worry isn’t it?

uhhhhhh extremely unlikely. less likely than a tory split.",liberals
gws7ron,2021-05-02T23:57:35.000-07:00,"liberals shut down debate on bill c-10 amendment allowing regulation of social media content are you saying that cbc, for example, is a 1:1 reflection of canadian culture?",liberals
gws7tt3,2021-05-02T23:58:02.000-07:00,"mark carney’s potential run for office has liberals talking the liberal party of canada has one is the world's strongest \"brands\" as a political party. they're seen as the \"natural governing party\" by a majority of the population (even non-supporters).

there's no chance in hell they experience a schism - it would shut them out of power similar to the experience of the reform party and the cpc. first past the post doesn't allow for splintered parties.",liberals
gws86xj,2021-05-03T00:00:53.000-07:00,"federal budget lacked a plan to combat violence against indigenous women, advocates say what can they do?

we’ve known since harpers inquiry what the cause is, and we still can’t work something out or dare say what the main cause is. liberals patted themselves about starting a new inquiry, found the same thing, and quickly buried the topic.

doesn’t help reserves refuse to work with the government, and the government doesn’t want to look bad. given this, seems the only answer available to this government is to keep writing blank cheques.",liberals
gws8rk4,2021-05-03T00:05:28.000-07:00,"in the book \"ares le mandat\", astrology and sociology are combined to form an actual system that would empower democrats to understand and accommodate conservatives [removed]",conservatives
gws8yt6,2021-05-03T00:07:01.000-07:00,"a harper dynasty and the end of the liberals? how the 2011 election didn’t change everything you had me in the first half, but pierre poilievre is a partisan hack. he is literally the opposite of how you described him.",liberals
gws934v,2021-05-03T00:07:59.000-07:00,"liberals shut down debate on bill c-10 amendment allowing regulation of social media content no, obviously not. however neither would any private industry. if it was then every show would be limited to vancouver, montreal and toronto.",liberals
gws97j7,2021-05-03T00:08:56.000-07:00,"mark carney’s potential run for office has liberals talking i may give people too little credit but that is how i would bet, after all plenty of effort will be put into reinforcing any politically useful confusion.",liberals
gws9o3t,2021-05-03T00:12:35.000-07:00,mark carney’s potential run for office has liberals talking [removed],liberals
