h0rxaxk,2021-06-05T18:20:18.000-07:00,conservative protest erupts in house of commons after liberals invoke rarely used rule to end bill c-10 debate [removed],liberals
h0rxpfw,2021-06-05T18:26:44.000-07:00,conservative protest erupts in house of commons after liberals invoke rarely used rule to end bill c-10 debate [removed],liberals
h0rxuo0,2021-06-05T18:29:05.000-07:00,"conservative protest erupts in house of commons after liberals invoke rarely used rule to end bill c-10 debate good thing you'll still be able to take a phone video of anything you want and post it to your zine and this bill has absolutely nothing to do with any of that then!

but maybe you should read the actual bill and listen to some real journalists with actual qualifications for once, because whatever sources you read are obviously full of mis- or disinformation.",liberals
h0ry2ys,2021-06-05T18:32:47.000-07:00,conservative protest erupts in house of commons after liberals invoke rarely used rule to end bill c-10 debate [removed],liberals
h0rycuj,2021-06-05T18:37:07.000-07:00,conservative protest erupts in house of commons after liberals invoke rarely used rule to end bill c-10 debate [removed],liberals
h0ryvrj,2021-06-05T18:45:37.000-07:00,"maclean's: canada, where vaccine acceptance isn't political (poll analysis by philippe fournier) ahh, i get it.  you are likely embarrassed already by the large social conservative noise the party makes and now the noise associated with the antivaxers settles in your camp as well.   

better blame the liberals for making your party look so bad.",liberals
h8rhrby,2021-08-12T19:04:00.000-07:00,canada pm trudeau is planning to call snap election for sept 20 -sources like sabastian gorka the dude that’s a trumpist/magat,liberals
h8rjw2j,2021-08-12T19:34:43.000-07:00,canada pm trudeau is planning to call snap election for sept 20 -sources [removed],liberals
h8rk0yv,2021-08-12T19:36:35.000-07:00,"canadian party brands have shifted significantly since 2019 you need to tell that to the canadahousing subreddit, they’re convinced only trudeau is responsible",liberals
h8rk4r3,2021-08-12T19:38:06.000-07:00,"canada pm trudeau is planning to call snap election for sept 20 -sources i imagine that most of the bernie -&gt; trump people were never about a specific ideology, they were simply seeking someone who was perceived as being different from the status quo, regardless of the differences. 'we want social democracy' and 'we want a change to the system, any change at all' were two potentially radically different beliefs who were both able fit under one banner for a time.",liberals
h8rl4h5,2021-08-12T19:52:00.000-07:00,"canadian party brands have shifted significantly since 2019 just feels like the cpc needs to be dragged kicking and screaming on a whole bunch of issues that the majority of canadians don't think are up for debate anymore. same-sex marriage was a big one in the earlier 2000s, cannabis is another one, carbon tax is another one, etc. 

it also seems the wingnuts of that party are getting more and more vocal, and whether it's fair or not, people are drawing comparisons to the rise of trumpism in the us and have no interest in supporting the canada-lite equivalent. 

a fiscally conservative party with a more consistent/unified moderate position on social/environmental issues? i think a lot of my friends/family would consider voting for that, but as is, the majority of them are turned off by that party at the moment, even if they historically voted for them during the harper era.",conservatives
h8rmehz,2021-08-12T20:09:38.000-07:00,"ndp leader jagmeet singh, spouse gurkiran kaur sidhu expecting first child i think the opposition the ndp has had to opposing the liberals on things. they did not want an early election as they are in a good place now, throw in his wife being pregnant and that’s another reason not to go to the campaign trail.",liberals
ho3g8qt,2021-12-10T15:29:13.000-08:00,"quebec teacher’s removal for wearing hijab a ‘cowardly’ move, minister says i mean i care about results,  while jagmeet singh will refuse to call it racist trudeau has given money",liberals
ho3hgio,2021-12-10T15:44:26.000-08:00,ontario premier doug ford invites justin trudeau to summit on housing affordability | globalnews.ca [removed],liberals
ho3jrjo,2021-12-10T16:13:41.000-08:00,r/ontario r/alberta more like headquarters of liberal albertans. same for every provincial sub reddit. they're all  liberals peeps hq of that specific province.,liberals
h3wh8rc,2021-07-02T18:29:09.000-07:00,"liberals want to recall the senate to pass conversion therapy bill nice strawman. you’re assuming that only an elected senate is acceptable to me. i don’t see the current status quo as acceptable in a modern democracy in 2021. either elected with some kind of proportional representation, or abolition is acceptable to me. or the model of the german bundesrat, where the individual states send delegates directly that speak for the state government. but the bundesrat can only vote on matters that affect the states, for example in questions where competences are shared. it’s not really considered an upper house per se, in german political science, although it functions like one to some degree. senators appointed by (ok, selected by) the pm to represent provinces does not make sense in the modern day. trudeau’s non-partisan reforms have made it slightly better (although the jury’s still out, imo and there are no guarantees that the current system will continue when he eventually is replaced by someone else as pm) but it’s still rotten.",liberals
h3wjn1z,2021-07-02T19:08:37.000-07:00,the liberals are riding high in the polls. that could be a double-edged sword [deleted],liberals
h3wkjn9,2021-07-02T19:23:21.000-07:00,liberals want to recall the senate to pass conversion therapy bill [deleted],liberals
h3wkzds,2021-07-02T19:30:27.000-07:00,"stop hedging on pharmacare even if the liberals were taking every step to implement it rn wouldn’t it still take a decently long time? like potentially a few years to get up and running properly and coverage for everyone, not to mention provincial coordination.

edit: just before anyone says it, yea it’s probably just another bamboozle because the liberals have yelled pharmacare for years.",liberals
h3wncbm,2021-07-02T20:08:03.000-07:00,"\"unacceptable and wrong\" : trudeau condemns attacks on churches [removed]",liberals
h3wocf6,2021-07-02T20:24:13.000-07:00,338canada: the conservatives keep falling behind [removed],conservatives
h3woggy,2021-07-02T20:26:05.000-07:00,"338canada: the conservatives keep falling behind harper keeps their monkeys in the barrel, no other leaders has managed that feat.",conservatives
h3worpe,2021-07-02T20:31:06.000-07:00,liberals want to recall the senate to pass conversion therapy bill [deleted],liberals
h3woyjt,2021-07-02T20:34:08.000-07:00,338canada: the conservatives keep falling behind [removed],conservatives
h061f88,2021-05-31T16:49:23.000-07:00,"federal poll (abacus) — lpc 34%, cpc 31%, ndp 17%, grn 7%, bq 7% they’re already radicalized, in that the bay street, moderate conservatives are being held hostage by a vocal (and insane) minority.",conservatives
h0626g5,2021-05-31T17:00:28.000-07:00,pm trudeau walking with cane after he sprained his ankle playing frisbee [removed],liberals
h063mjt,2021-05-31T17:22:12.000-07:00,is the conservative party liberal-lite? [deleted],conservatives
h064b91,2021-05-31T17:32:42.000-07:00,"rex murphy: who speaks for canada? not trudeau, but jody wilson-raybould ###this is a reminder to [read the rules before posting in this subreddit](https://www.reddit.com/r/canadapolitics/wiki/rules-thelongversion).
 
1. **headline titles should be changed only [when the original headline is unclear](https://www.reddit.com/r/canadapolitics/wiki/rules-thelongversion#wiki_1._headline_titles_should_be_changed_only_where_it_improves_clarity.)**
2. **be [respectful](https://www.reddit.com/r/canadapolitics/wiki/rules-thelongversion#wiki_2._be_respectful).**
3. **keep submissions and comments [substantive](https://www.reddit.com/r/canadapolitics/wiki/rules-thelongversion#wiki_3._keep_submissions_and_comments_substantive).**
4. **avoid [direct advocacy](https://www.reddit.com/r/canadapolitics/wiki/rules-thelongversion#wiki_4._avoid_direct_advocacy).**
5. **link submissions must be [about canadian politics and recent](https://www.reddit.com/r/canadapolitics/wiki/rules-thelongversion#wiki_5._link_submissions_must_be_canadian_and_recent).**
6. **post [only one news article per story](https://www.reddit.com/r/canadapolitics/wiki/rules-thelongversion#wiki_6._post_only_one_news_article_per_story).** ([with one exception](https://www.reddit.com/r/canadapolitics/comments/3wkd0n/rule_reminder_and_experimental_changes/))
7. **replies to removed comments or removal notices will be removed** without notice, at the discretion of the moderators.
8. **downvoting posts or comments**, along with urging others to downvote, **[is not allowed](https://www.reddit.com/r/canadapolitics/wiki/downvotes)** in this subreddit. bans will be given on the first offence.
9. **[do not copy &amp; paste the entire content of articles in comments](https://www.reddit.com/r/canadapolitics/wiki/rules-thelongversion#wiki_9._do_not_copy_.26amp.3b_paste_entire_articles_in_the_comments.)**. if you want to read the contents of a paywalled article, please consider supporting the media outlet.

*please [message the moderators](https://www.reddit.com/message/compose?to=%2fr%2fcanadapolitics) if you wish to discuss a removal.* **do not reply to the removal notice in-thread**, *you will not receive a response and your comment will be removed. thanks.*


*i am a bot, and this action was performed automatically. please [contact the moderators of this subreddit](/message/compose/?to=/r/canadapolitics) if you have any questions or concerns.*",liberals
h067rcl,2021-05-31T18:26:52.000-07:00,trudeau vows ‘concrete action’ after discovery of 215 bodies at former residential school site [removed],liberals
h068iia,2021-05-31T18:39:08.000-07:00,"rex murphy: who speaks for canada? not trudeau, but jody wilson-raybould these people has a very limited understanding of canada. canada isn’t a one size fits all unitary state like france, china or japan. canada is a historic collection of nations.",liberals
hp0wly0,2021-12-17T15:30:56.000-08:00,budget officer estimates liberals' heavy icebreaker plan will cost $7.25b [removed],liberals
hp0wuco,2021-12-17T15:34:01.000-08:00,westjet says trudeau's travel restrictions 'not based on science and data' didn’t read. i’m not a full on conspiracy anti vaxxer nor am i a lockdown supporter just saying this is a really bad comparison/argument,liberals
hp0x2rp,2021-12-17T15:37:03.000-08:00,westjet says trudeau's travel restrictions 'not based on science and data' no it’s a bad comparison. you have medical experts that are telling you to take the vaccine. it’s a false comparison with cigarette companies telling you to smoke because there’s no 3rd party involved verifying the cigarette companies claims,liberals
hp0z64g,2021-12-17T16:05:30.000-08:00,"trudeau, blanchet spar over quebec’s bill 21 amid heated debate across ottawa on secularism law look up marian mourani.",liberals
hp0zb47,2021-12-17T16:07:23.000-08:00,"trudeau calls on canadians to \"starve\" omicron by following public health guidance over the winter you would be mistaken. you can literally look at the case counts and deaths between countries and see how much better canada has done.",liberals
hp0zg09,2021-12-17T16:09:17.000-08:00,"trudeau calls on canadians to \"starve\" omicron by following public health guidance over the winter pretty much everyone in south africa already caught a previous variant (why they also had so many deaths). that is why omicron will seem weaker in comparison",liberals
hp10fbd,2021-12-17T16:22:35.000-08:00,"trudeau on military misconduct: ‘i wish i could have done more’ - national | globalnews.ca “i wish i could have done more. i wish i had — i wish i had been able to do more.”

two swings and two misses.  here's what you should have said:

\"i wish i had done more.\"",liberals
hp10hj8,2021-12-17T16:23:26.000-08:00,trudeau presses for canada to become a critical mineral powerhouse rare earths are getting a lot of attention across canada lately. iirc thor lake is just one such location in saskatchewan like you are mentioning. the company there is supposedly trying something with plants called phytomining.,liberals
hp10imz,2021-12-17T16:23:52.000-08:00,budget officer estimates liberals' heavy icebreaker plan will cost $7.25b [removed],liberals
hp116fy,2021-12-17T16:33:09.000-08:00,"trudeau calls on canadians to \"starve\" omicron by following public health guidance over the winter well... reports are coming in that omicron is 5x more transmissible and has the same effect as delta in regards to sickness/hospitalization/death.   


[https://www.ctvnews.ca/health/coronavirus/omicron-five-times-more-likely-to-reinfect-than-delta-no-milder-study-says-1.5711645](https://www.ctvnews.ca/health/coronavirus/omicron-five-times-more-likely-to-reinfect-than-delta-no-milder-study-says-1.5711645)  


i'm saying this to you, because this means that the next summer might be the last one that 'feels normal'. plan a nice trip, cause the next variant after this one really has only so many evolutionary options at this point. it could mutate to become more virulent, or it could mutate become more deadly. one way or another, lock downs in summer could become a real possibility. localized maybe, but still.",liberals
hp118ek,2021-12-17T16:33:53.000-08:00,"trudeau calls on canadians to \"starve\" omicron by following public health guidance over the winter ctv is reporting similar. https://www.ctvnews.ca/health/coronavirus/omicron-five-times-more-likely-to-reinfect-than-delta-no-milder-study-says-1.5711645",liberals
hp11jaa,2021-12-17T16:37:59.000-08:00,"[deleted by user] really? cause i’m looking at bc and horgan and not seeing a difference between him and trudeau. the federal ndp has never been in power, so we don’t know how consistent they would be.

btw, ‘leftists’ prioritize economics over so-called social policies, but the ‘left’ is a vague term that means different thing to different people, and ‘progressives’ do not consider inequalities to be side issues.",liberals
hp1206l,2021-12-17T16:44:35.000-08:00,"budget officer estimates liberals' heavy icebreaker plan will cost $7.25b we have no choice anymore folks. we need to be able to properly patrol our waters and properly defend ourselves in the event of a foothold situation.

russia has been doing arctic drills, and china hasn't exactly been playing docile lately. pretty much every country that has reason to take hold of the northwest passage has been making small moves here and there over the years as things seem to thaw out more and more.

&amp;#x200b;

time to bite the bullet and just go full tilt into setting ourselves up with modern equipment. or at least as modern as we can afford. we can't assume america will always have our back anymore. this has become startling clear with the way biden has been between canada and australia as of late.

if we play our cards right, we can catapult ourselves into a noteworthy position of power, without having to fund our allies and enemies to do it. the avro arrow is something people often bring up in regards to our ingenuity as a nation; but we have other companies making some really neat stuff too if you dare to look around for it.

what's more is we have the resources to do it all self sufficiently. we just have to double down on industry to be able to extract, refine, transport and use it all. luckily we do have some of that started already, though the infrastructure connecting it all via our roads and rails could be better.

quite frankly, canada has only one option; and that is to open the wallet. if we don't, all those resources in the arctic that could be managed in a eco-friendly manner will instead be warred after by those who would not. take your pick.",liberals
hp126ml,2021-12-17T16:47:06.000-08:00,"[deleted by user] his motive is to tarnish trudeau for progressives so the ndp gets enough support to usher in a cpc government. plus, gurney just hates trudeau with every fiber of his embittered conservative soul.",liberals
h36pi8z,2021-06-26T16:04:22.000-07:00,"‘pierre trudeau’ trends on twitter as canadians demand his statue be removed totems are a west coast haida thing.

besides, we already destroyed much of their material history and completely uprooted their social fabric.  haven't you been paying attention?",liberals
h36rbej,2021-06-26T16:29:35.000-07:00,trudeau says pope should apologize on canadian soil for church's role in residential schools 40 years is more than enough time.,liberals
h36rh2o,2021-06-26T16:31:52.000-07:00,"trudeau says pope should apologize on canadian soil for church's role in residential schools blows my mind that people don’t understand that infrastructure on reserves is a federal responsibility, but here we are.",liberals
h36tgr6,2021-06-26T17:00:54.000-07:00,"trudeau faces mounting calls for independent probe of residential school deaths an independent investigation? you mean like an ‘independent’ senator?

the problem with an actual independent investigation is that it is going to do two things:

1. expose the liberal party to liability with respect to atrocities against first nations people while in government for a majority of canada’s 20th century history. had that not been the case, the investigation would have been announced.

2. expose the rcmp to significant liability for acting as enforcers to ensure the atrocities could be carried out. again, had that not been the case, the investigation would have been announced.

this is why it is more convenient for arson attacks, cancellations and calls for meaningless apologies to occur.",liberals
h36tsgs,2021-06-26T17:05:41.000-07:00,pierre trudeau's failures on indigenous rights tarnish his legacy because they're in canada.,liberals
hms4v4b,2021-11-30T18:31:13.000-08:00,"editorial: trudeau's policies are worsening inflation i never thought i’d say it, but i’d rather be an american",liberals
hpjf5sq,2021-12-21T17:40:39.000-08:00,"trudeau says after two michaels, allies must confront china united [removed]",liberals
hpjhdb3,2021-12-21T18:12:03.000-08:00,"trudeau says after two michaels, allies must confront china united [removed]",liberals
hpjkqyp,2021-12-21T18:59:10.000-08:00,"ontario poll (leger) - pc 38%, ndp 28%, lib 25% i also think this is the case. del duca is clearly modeling his campaign off trudeau's 2015 campaign. the problem is, he's the wrong person to run a campaign like that. they need a fresh face, but del duca has too much baggage from his time in the olp government. 

the other thing i don't hear talked about is money. the liberals are not in good financial shape compared to the other two parties. 

i'll admit i'm biased against the liberals, so maybe i'm wrong and del duca wins a landslide. it wouldn't shock me to see any of the three parties end up in government next year. i think del duca is the big wildcard. if he makes a good impression, he becomes premier. if he's meh, the vote split continues and ford gets a second term. if people dislike him, he tanks and horwath could finally get her shot.",liberals
hpjlcfl,2021-12-21T19:07:00.000-08:00,"federal liberals slash criminal pardon application fee to $50 as of new year 

&gt; prisoner unlawfully at large (can you be a prisoner lawfully at large?)

presumably day parole or an unsupervised leave.",liberals
hj91gzp,2021-11-03T15:57:31.000-07:00,"twitter bans ottawa law professor amir attaran for saying trudeau should be 'tarred and feathered' well they've refused his appeals so in the end it's person,",liberals
hj92ku3,2021-11-03T16:12:08.000-07:00,"canadian flags on federal buildings to be raised next week: government source i’m not, the public opinion of not having the flags raised by remembrance day was very negative, and if there’s one thing you can count on trudeau to be it’s a populist.",liberals
hj93it3,2021-11-03T16:24:55.000-07:00,"trudeau promised to cap emissions, but canada’s oil and gas companies have different plans [removed]",liberals
hj956g5,2021-11-03T16:47:45.000-07:00,twitter bans ottawa law professor amir attaran for saying trudeau should be 'tarred and feathered' [deleted],liberals
hi3guxs,2021-10-25T19:56:49.000-07:00,"apart from the 300k/year immigrants, 500k+ intl students came to canada under trudeaus regime. most of them convert to prs,and later citizenship,but the govt considers only the landed pr holders as \"immigrants\",just to keep the public away from reality. money",liberals
hi3hi12,2021-10-25T20:05:29.000-07:00,innovative research poll: tofino trip more damaging to trudeau than we or blackface you forgot to add the fact he went surfing at a resort on unceded land.,liberals
hi3hkfa,2021-10-25T20:06:24.000-07:00,innovative research poll: tofino trip more damaging to trudeau than we or blackface not good enough.,liberals
hi3hqrw,2021-10-25T20:08:52.000-07:00,guilbeault to become canada's next environment minister as trudeau unveils new cabinet good god this country has hit rock bottom,liberals
hi3kr5w,2021-10-25T20:47:50.000-07:00,innovative research poll: tofino trip more damaging to trudeau than we or blackface [removed],liberals
hi3loai,2021-10-25T20:59:07.000-07:00,"conservatives must take 'soft' pro-life stance on abortion to win back socially conservative base, say mps and campaign life coalition [removed]",conservatives
hi3lrt3,2021-10-25T21:00:18.000-07:00,discussion thread - cabinet announcement - 26 october 2021 i wonder if macaulay will have a similar fate. replacing the old guard with newer blood seems to be something trudeau is happy to do if they're set up for ambassador positions.,liberals
hi3mg6u,2021-10-25T21:08:15.000-07:00,"conservatives must take 'soft' pro-life stance on abortion to win back socially conservative base, say mps and campaign life coalition abortion back in the news, is it time for another election already? 

it's a good thing the cpc is clearly doing the opposite of what these socons want. the fringe can go live in the ppc. we've had nearly a decade of federal conservatives who wouldn't touch abortion, and now the federal leader of the cpc is very openly pro-choice. isn't that what people want?",conservatives
hi3mgzs,2021-10-25T21:08:31.000-07:00,"discussion thread - cabinet announcement - 26 october 2021 as althia raj pointed out on \"at issue\" a few days ago, the current leadership of the liberal party doesn't really like having old people in cabinet.  it shouldn't be a great surprise that garneau has been given the boot.",liberals
h72g649,2021-07-29T20:34:09.000-07:00,"justin trudeau blasts jagmeet singh’s request that the governor general not agree to an election ah, i missed that, but the way it’s worded on wikipedia is odd.",liberals
h72g7cf,2021-07-29T20:34:37.000-07:00,justin trudeau blasts jagmeet singh’s request that the governor general not agree to an election that’s what i just said.,liberals
h72gaaa,2021-07-29T20:35:45.000-07:00,"justin trudeau blasts jagmeet singh’s request that the governor general not agree to an election &gt;fill in the blanks with what you choose.

that sounds like an accurate description of every single take of the cbc on this subreddit.",liberals
h72gxyy,2021-07-29T20:44:39.000-07:00,"justin trudeau blasts jagmeet singh’s request that the governor general not agree to an election i mean i'm not a doctor, but isn't there also a concern that more variants will will spread if people are unvaccinated? they've already been talking about a booster for delta as soon as september.",liberals
h72hfg3,2021-07-29T20:51:00.000-07:00,"justin trudeau blasts jagmeet singh’s request that the governor general not agree to an election not trying to argue with you, it's just that your post talks about a fall election is ns, it does not mention the august 17th election, which is why i commented.",liberals
h72hnuk,2021-07-29T20:54:07.000-07:00,"justin trudeau blasts jagmeet singh’s request that the governor general not agree to an election sorry, for whatever reason i consider the latter half of august to be fall in ns. i can see why that would be confusing as it isn’t really fall.",liberals
h72hsbm,2021-07-29T20:55:44.000-07:00,"justin trudeau blasts jagmeet singh’s request that the governor general not agree to an election remember that elbowgate was trudeau actually injuring an ndp member. 

and it happened while he was trying to physically manhandle another opposition member back into his seat because he was upset he wasn't getting the vote he wanted in the house. 

if stephen harper had tried to physically force another mp to vote for his legislation, i'm pretty sure the outrage would continue to this day. 

let's not pretend it was some misunderstanding. trudeau is a childish individual.",liberals
h72key5,2021-07-29T21:27:39.000-07:00,"conservatives push feds to ensure canadians who got mixed covid-19 vaccines can travel abroad imagine thinking that the conservatives have any credibility on the vaccination issue left? michelle “2030” rempel should be taken off the health file, she’s been horrible.

this also isn’t a winning issue for them. of course the government is going to get it done. the pm himself is a mixed dose recipient, the chancellor of germany is a mixed dose recipient. they’ll come to an agreement with other countries soon.",conservatives
