hfodq39,2021-10-06T11:25:20.000-07:00,doug ford defends decision to let unvaccinated mpps sit as progressive conservatives [removed],conservatives
hfodypy,2021-10-06T11:27:15.000-07:00,le plc remporte finalement châteauguay-lacolle... par 12 voix | liberal party of canada wins châteauguay-lacolle by 12 votes did they choose the moderator?,liberals
hfoe5aq,2021-10-06T11:28:37.000-07:00,"federal public servants, rcmp, and all air and rail travellers must be vaccinated by end of october, trudeau says [removed]",liberals
hfoe9nx,2021-10-06T11:29:35.000-07:00,"[on] provincial version of the people's party of canada in 'exploratory stage' such a party would get very little support outside of some of rural eastern ontario. if anything, it will help the liberals or ndp.",liberals
hfoeaim,2021-10-06T11:29:46.000-07:00,"federal public servants, rcmp, and all air and rail travellers must be vaccinated by end of october, trudeau says [removed]",liberals
hfoetm1,2021-10-06T11:33:55.000-07:00,trudeau says tofino vacation was a ‘mistake’ [removed],liberals
hfoexzc,2021-10-06T11:34:52.000-07:00,"federal public servants, rcmp, and all air and rail travellers must be vaccinated by end of october, trudeau says [removed]",liberals
hfof155,2021-10-06T11:35:33.000-07:00,trudeau says tofino vacation was a ‘mistake’ ??? media did not ignore the holiday in the slightest and this news only broke out after his itinerary was corrected and we learned he was surfing instead of meeting people like it originally said.,liberals
hfofdab,2021-10-06T11:38:05.000-07:00,"federal public servants, rcmp, and all air and rail travellers must be vaccinated by end of october, trudeau says federal employees have to follow the three rules above though. no choice. if you refuse, you get put on unpaid leave (and no ei) until you come into compliance.

further, lying on the attestation is going to be a firing offence according to the policy out today. supervisors can demand to see proof at any time.

they're really done playing.",liberals
