hotyimm,2021-12-16T05:22:26.000-08:00,"trudeau government committing $1 billion to help provinces — and maybe cities — get rid of handguns after they banned handguns in the 90s, the uks homicide rate *didnt* drop at all, it actually went up a little bit and mostly remained steady for 20 years before it returned to the pre ban rate. during which time, other countries including canada and the usa had pretty significant reductions. 

there is no reason to believe they wouldnt be just about as well off today had they not done that ban.",liberals
hotyta8,2021-12-16T05:24:20.000-08:00,trudeau government committing $1 billion to help provinces — and maybe cities — get rid of handguns [removed],liberals
hotzo18,2021-12-16T05:29:56.000-08:00,"trudeau government committing $1 billion to help provinces — and maybe cities — get rid of handguns antivaxxers have nothing to do with this discussion, regardless of whatever weird reference point you want to hang on to. you see a lot of gun crime in victoria do you?

we have one of the best ranges in the province, which holds canadian handgun tournaments every year....and i am wondering when is the last time you went to visit? did you visit them this year?  i wonder what you would think of the 5000+ members.  i am sure you are the first to crucify someone for judging groups as a whole, but all i hear from you is bigotry, mistrust, fear, hate and bitterness.  as i said, i have no doubt you would execute people for not acting how you want to act.

canada has one of the highest percentages of gun ownership in the world. if there was an issue, you would have long known. if you think stolen guns come from legal canadian gun owners, you are completely misinformed, or willfully ignorant. my guess is the latter.",liberals
hou0qr7,2021-12-16T05:37:05.000-08:00,"conservative mps free to travel internationally, liberal, ndp mps must stay home then another pack of jackals will come out in three months braying about how \"sissy trudeau stayed in his safe basement instead of taking the fight to covid on the front lines\" or whatever.",liberals
hou1g0p,2021-12-16T05:41:42.000-08:00,"prominent conservatives condemn quebec's bill 21: 'we can’t let laws like that go unchallenged' oof. its upsetting to hear all that. sorry you have to deal with it.

&gt; i've seen little old ladies here bawl out a couple in the grocery store for speaking french in her presence.

that's mind blowing, does she not know what province she is in? i have inlaws in nb and they are all pretty darn french, and they wouldn't blink at bawling little old ladies out (probably in french, lol).",conservatives
hou1nm8,2021-12-16T05:43:05.000-08:00,"prominent conservatives condemn quebec's bill 21: 'we can’t let laws like that go unchallenged' yeah i know one is political and one is religious that’s not the point. what i’m saying is religion and politics are both ideological. both religion and politics guide people views of the world and in that sense wearing a symbol of either ones are open advocacy of the direction things should go in, one is just more focused on concrete things regarding the country while the other is more about general life.

still both announce what the wearer stands for in regard to certain aspects of his personal life which is what the discussion is about. 

&gt; you want reality to match your convictions

what does that even mean? my convictions are based into reality even if they don’t match yours. the goal of this conversation is for you to understand my point of view of the issue at hand and for you to clarify how your point of view adresse the issue and how the issue can be resolved with harmony. 

it’s just that you seem to say “there’s no issue” while the reality is a majority of quebec population says “there’s an issue” and your reaction seems to be “they’re all racists for having that opinion”. i’d like to believe you’re more open to resolve conflicts then entrench yourself in your own opinion.",conservatives
hou2d6q,2021-12-16T05:47:41.000-08:00,prominent conservatives condemn quebec's bill 21: 'we can’t let laws like that go unchallenged' and for not making any good or logical ones himself.,conservatives
hou38wb,2021-12-16T05:53:32.000-08:00,"trudeau government committing $1 billion to help provinces — and maybe cities — get rid of handguns your stats are a little off. 

the ban was enacted in 1997, and the rate did rise a bit until 2002, but it did not return to the pre-ban rate after that (it averaged around 1.5 for the few years before the ban)

it got down as low as 0.9 in 2014 before climbing back up to around 1.2 for 2016/2017/2018

0.3 people per 100k for reference is about 200 fewer people murdered per year in the uk. 

how much of that is related to handguns is definitely up for debate, but 2002 was the only year in which homicides were significantly higher than the year they banned firearms. 

in any case, compared to canada, the uk has a lower homicide rate. 

and both canada and the uk are a tiny fraction of the us rate. in fact, if you removed all gun homicides from the us rate, you actually end up pretty close to the canadian and uk homicide rate.",liberals
hou3pue,2021-12-16T05:56:40.000-08:00,prominent conservatives condemn quebec's bill 21: 'we can’t let laws like that go unchallenged' [removed],conservatives
hou3qjh,2021-12-16T05:56:48.000-08:00,"trudeau government committing $1 billion to help provinces — and maybe cities — get rid of handguns all of this has happened before, all of this will happen again.",liberals
hou4bec,2021-12-16T06:00:41.000-08:00,prominent conservatives condemn quebec's bill 21: 'we can’t let laws like that go unchallenged' [removed],conservatives
hhfmncf,2021-10-20T10:44:06.000-07:00,conservatives say they oppose 'secret' move to introduce mandatory vaccine rule for mps | cbc news [removed],conservatives
hhfnbty,2021-10-20T10:49:12.000-07:00,"o’toole and trudeau to talk wednesday after speaker announces mandatory vaccination policy https://www.google.com/amp/s/globalnews.ca/news/8264435/covid-conservative-mps-vaccine-otoole/amp/

longtime ontario mp dean allison is one of two members who say they can’t receive a shot because of medical reasons.

https://www.google.com/amp/s/beta.ctvnews.ca/national/politics/federal-election-2021/2021/9/6/1_5575255.html

trudeau has said every liberal candidate -- except for one with a medical exemption – has been fully vaccinated",liberals
hhfnirj,2021-10-20T10:50:38.000-07:00,"mainstreet research poll: 47% of albertans support independence, 53% wish to remain okay you're right. if all three leave that would be bad. but it alberta and manitoba leave they are likely to form a union, hence it would be possible to get them back. but that is besides the point. if conservative provinces start leaving, even it it is the liberals in power, they are going to start thinking about changing their rhetoric and policies.",liberals
hhfnzb2,2021-10-20T10:54:07.000-07:00,o’toole and trudeau to talk wednesday after speaker announces mandatory vaccination policy [removed],liberals
hhfocvk,2021-10-20T10:57:03.000-07:00,"what do you think of canada's current and former arms deals and involvement with saudi arabia? &gt; i have no idea why we are giving them arms, if we are so “liberal” and “democratic”. it just sounds a little bit hypocritical of the liberals. 

liberals only care about money and power. let's be honest here. this is why they pretend to care about fiscal responsibility while proposing new expensive social programs. this is why they pretend to be feminists while selling arms to a country that sees women as second class citizens.",liberals
hhfop8p,2021-10-20T10:59:41.000-07:00,o’toole and trudeau to talk wednesday after speaker announces mandatory vaccination policy [removed],liberals
hhfoy9y,2021-10-20T11:01:38.000-07:00,"o’toole and trudeau to talk wednesday after speaker announces mandatory vaccination policy this isn't logically coherent. if the mps are willing to represent their constituents, then it is the board of internal economy that is stopping them.

maybe that's a sacrifice you're willing to make. but at least be honest about it, and don't flip who is responsible for this decision.

edit: do any of the 15 people who downvoted this comment want to explain why?",liberals
hhfp0f4,2021-10-20T11:02:06.000-07:00,"o’toole and trudeau to talk wednesday after speaker announces mandatory vaccination policy is it your position that people should not be allowed to run for office if they are unvaccinated?

edit: hi downvoters. this is a very simple question, and one you should feel free to answer.",liberals
hhfp19x,2021-10-20T11:02:16.000-07:00,o’toole and trudeau to talk wednesday after speaker announces mandatory vaccination policy [removed],liberals
hhfpvql,2021-10-20T11:08:48.000-07:00,conservatives opposing house vaccine policy [removed],conservatives
hhfqzmq,2021-10-20T11:17:20.000-07:00,o’toole and trudeau to talk wednesday after speaker announces mandatory vaccination policy [removed],liberals
hhfsubg,2021-10-20T11:31:34.000-07:00,o’toole and trudeau to talk wednesday after speaker announces mandatory vaccination policy [removed],liberals
hhftvga,2021-10-20T11:39:28.000-07:00,o’toole and trudeau to talk wednesday after speaker announces mandatory vaccination policy [removed],liberals
hhftwd9,2021-10-20T11:39:40.000-07:00,o’toole and trudeau to talk wednesday after speaker announces mandatory vaccination policy [removed],liberals
hhfu6j1,2021-10-20T11:41:49.000-07:00,o’toole and trudeau to talk wednesday after speaker announces mandatory vaccination policy [removed],liberals
h4tkanw,2021-07-11T02:17:55.000-07:00,"the green party has lost the plot. instead of identity politics, the party should focus on our global ecological crises but they don't. the cpc held a vote to officially recognize climate change, it lost because the cpc majority do not recognize climate change. until the party has another vote on policy, they don't recognize climate change and you should believe them. o'toole is no harper, so anything he says is meaningless if it goes against party policy.

he also voted against c-6, so he does not support lgbtq.",conservatives
h4tmpyy,2021-07-11T02:38:30.000-07:00,"ontario's new grade 9 curriculum preaches 'subjective' nature of math | toronto sun reminder that ontario has **conservatives** in power. majority government. **majority**. 

i remember hearing about this \"racism in math\" last year. pcs were considering dropping streaming (applied, academic courses) from math education. the reason why is because \"racism\".  

https://www.thestar.com/news/gta/2021/06/09/ontario-unveils-new-grade-9-math-curriculum-that-eliminates-streaming.html

im gonna come out clean to all of you i took applied in high school. i took it because i got high fifty or low sixty in grade 9.  so i took applied for the rest of my high school and got into criminology which doesn't need math as a prerequisite. there is nothing racist about streaming. it is a choice given to students.

but now pcs went a step further into ndp territory. if you were to remove names from the article, i would think that it is ndp members that are saying this. 

with each year i wonder whether i should start spoiling my vote. i don't feel represented by any party in canada.",conservatives
h4tnmtr,2021-07-11T02:46:14.000-07:00,justin trudeau’s government actively aids israeli occupation [removed],liberals
h4toaut,2021-07-11T02:51:45.000-07:00,bill c-6 proves conservative party still a long way from genuine lgbtq2 allyship removed for rule 3.,conservatives
h4todvw,2021-07-11T02:52:26.000-07:00,bill c-6 proves conservative party still a long way from genuine lgbtq2 allyship removed for rule 3.,conservatives
h4tp4ij,2021-07-11T02:58:34.000-07:00,"bill c-6 proves conservative party still a long way from genuine lgbtq2 allyship when it comes to the federal vote on bills pertaining to lgbtq rights the record is unambiguous. conservative parties have *consistently* opposed bills that support and/or enshrine lgbtq persons with the same rights, freedoms and protections as their fellow canadians.


bill c-33, majority opposed by conservatives, affirmed by all other parties. 


bill c-38, majority opposed by conservatives, affirmed by all other parties. 


bill c-250, majority opposed by conservatives, affirmed by all other parties. 


bill c-16, majority opposed by conservatives, affirmed by all other parties.


bill c-6, majority opposed by conservatives, affirmed by all other parties.


let me be clear, ***all*** attempts to ratify lgbtq persons with the same rights, freedoms and protections as the rest of canadians have been opposed by conservative parties.


**the cpc is not pro lgbt, they are anti-lgbt.** the record is factual and quite frankly speaks for itself.",conservatives
h4tpau8,2021-07-11T03:00:02.000-07:00,bill c-6 proves conservative party still a long way from genuine lgbtq2 allyship [removed],conservatives
h4tqubx,2021-07-11T03:13:02.000-07:00,"bill c-6 proves conservative party still a long way from genuine lgbtq2 allyship for sure, i know the younger generations don't vote as much but eventually the cpc needs to realize social conservatism is not canada's future",conservatives
h6378xl,2021-07-21T13:52:14.000-07:00,"canadians see ndp's singh as a better pm than tories' o'toole, leger survey suggests [deleted]",conservatives
h637hj6,2021-07-21T13:54:36.000-07:00,"former dartmouth south candidate says liberals dropped her over 'boudoir' photos - 'when i was told to step down, i was asked to blame myself,' robyn ingraham says in social media post robyn is my barber and has been for a couple of years. she was managing a trendy and very busy barber shop and felt like she was being treated poorly by the owner, so she left and started her own business during the pandemic (the planning started brfore). 

my impression is that she is hard working and thoughtful. she has business partners but it appears that robyn does most of the management. 

from my perspective (mid 50s) she seems very young but i admire her. she has started a business and works hard. she has a very egalitarian relationship with her partners although she seems to support the business back end. also  she is thoughtful and sincere. 

her of was not a hidden secret; i stumbled upon the fact she has one when i googled her business - it is listed in her linktree. i don't subscribe (that would be creepy) but i am sure if i asked, she would discuss it with me. 

in short, she is a kind, hard working person who wants to make a difference in her community. dartmouth south could do worse; however, i cannot help but think this is a bullet dodged for robyn.",liberals
h637ief,2021-07-21T13:54:50.000-07:00,"former dartmouth south candidate says liberals dropped her over 'boudoir' photos - 'when i was told to step down, i was asked to blame myself,' robyn ingraham says in social media post ... you mean in an election? this is ns liberals.",liberals
h63896o,2021-07-21T14:02:22.000-07:00,"former dartmouth south candidate says liberals dropped her over 'boudoir' photos - 'when i was told to step down, i was asked to blame myself,' robyn ingraham says in social media post i meant 2023 but who would want to risk it going into any election",liberals
h638d5n,2021-07-21T14:03:27.000-07:00,"former dartmouth south candidate says liberals dropped her over 'boudoir' photos - 'when i was told to step down, i was asked to blame myself,' robyn ingraham says in social media post i just mean that it's not going into an election year in 2023. nova scotia is having an election right now. that's all! 

feds are scheduled for 2023 so i assumed it was a mix up. though as we all know a 2021 election seems more likely anyways.",liberals
h638l19,2021-07-21T14:05:37.000-07:00,"former dartmouth south candidate says liberals dropped her over 'boudoir' photos - 'when i was told to step down, i was asked to blame myself,' robyn ingraham says in social media post yeah it was a mixup on my part i didn't know i nova scotia was having a election now all seriousness what political party wouldn't want to risk going into either a nova scotia election or national election",liberals
h6395vy,2021-07-21T14:11:37.000-07:00,"former dartmouth south candidate says liberals dropped her over 'boudoir' photos - 'when i was told to step down, i was asked to blame myself,' robyn ingraham says in social media post [removed]",liberals
h63agq6,2021-07-21T14:25:11.000-07:00,"canadians see ndp's singh as a better pm than tories' o'toole, leger survey suggests i don't understand why this should be surprising. singh is a likeable guy, he has ideas and is generally very charismatic. o'toole is none of these things.


i honestly wish that we would give singh a shot at being pm, and i'm saying that as a liberal. he seems like a good guy.",conservatives
h63bhen,2021-07-21T14:35:55.000-07:00,"canadians see ndp's singh as a better pm than tories' o'toole, leger survey suggests [removed]",conservatives
h63by54,2021-07-21T14:40:55.000-07:00,"canadians see ndp's singh as a better pm than tories' o'toole, leger survey suggests i mean, there’s only been 2 elections since layton’s orange wave, so “their greatest ever vote share after le bon jack’s orange wave” doesn’t mean a whole lot.",conservatives
h63c29w,2021-07-21T14:42:08.000-07:00,"former dartmouth south candidate says liberals dropped her over 'boudoir' photos - 'when i was told to step down, i was asked to blame myself,' robyn ingraham says in social media post [removed]",liberals
h63cbes,2021-07-21T14:44:50.000-07:00,"canadians see ndp's singh as a better pm than tories' o'toole, leger survey suggests i think the cpc may be close to losing the second position in a few years time. things are already heading in the wrong direction(ie the whole country is moving further left), and meanwhile they don’t know whether to try and head left or further right. the ppc is only gaining more of the far right votes every election, draining more and more cpc votes, meanwhile half the cpc wants to start leaving the crazies while the other half wants to fight for them(scaring away the more regular conservatives).",conservatives
h63d4cj,2021-07-21T14:53:39.000-07:00,"canadians see ndp's singh as a better pm than tories' o'toole, leger survey suggests it’s not a direct correlation of anti-vax= racist, but more has to do with the “alt right pipeline”. have you ever heard people talk about how joe rohan viewers are racist? well, obviously not everyone who listens to jre is a racist. but, they have a high% of right wing followers, and jre has a lot of fairly right-&gt; alt right guests on. again, he has left wing guests too, but their is a clear correlation that you can see for yourself if you start watching jre highlights on youtube. it goes modest conservative guy watching jre, probably not that politically involved, gets reccomend done ben shapiro, or jordan peterson, and then slowly(or fairly quickly) there is a rabbit whole of increasingly right wing/conspiracy theory you tubers being recommended.  
  
alt right groups legit recruit out of jre fans, and more so jre fans who start watching jordan peterson and ben shapiro. they do the same thing with anti vax crowds. essentially anti vax crowds have been co opted by the far right as recruiting grounds for the proud boys and the like. idk if i’m explaining this well but maybe you get the jyst of it.",conservatives
hoqesde,2021-12-15T11:10:21.000-08:00,trudeau government committing $1 billion to help provinces — and maybe cities — get rid of handguns [removed],liberals
hoqew7f,2021-12-15T11:11:08.000-08:00,"$2/l for gas by the end of 2022? the energy sector around the world is screwed. i doubt that under trudeau, we will do any better.",liberals
hoqfpz2,2021-12-15T11:17:24.000-08:00,"conservatives believe 13 ridings were targeted by foreign interference in 2021 election this reads to me as mainly an exercise by o’toole people to make excuses for their poor performance in the campaign and their support within the chinese canadian community plummeting. i have no doubt nefarious things are posted on wechat with questionable sources, but stuffing ballots? that seems a little outlandish and unrealistic.",conservatives
hoqgf6z,2021-12-15T11:22:37.000-08:00,"canada willing to 'align' ev incentives with u.s. to avert tax-credit crisis, says trudeau [deleted]",liberals
hoqgmgm,2021-12-15T11:24:03.000-08:00,"canadian blood services recommends end to ban on donations from gay men i'm pretty sure that's not true at all.  any requests for change are a matter of public record.  the contention politically has been that many think the liberals should have ordered health canada to make the change by force of law, rather than going through the process of cbs making the request, and health canada evaluating &amp; approving.",liberals
hoqif71,2021-12-15T11:37:48.000-08:00,"conservatives believe 13 ridings were targeted by foreign interference in 2021 election &gt;\"there’s suspicion of potential mail-in ballot fraud, we’ve heard cases of potential foreign government-paid campaign workers who were getting brown envelopes of cash to do stuff for other campaigns, we’ve heard of illegal advertising.\"",conservatives
hoqjn0z,2021-12-15T11:47:21.000-08:00,"canada's home prices will rise 10.5% by the end of 2022, no immediate answer says liberals great post and the responses offering some sort of critique/rebuttal are also great. heres another idea, a real estate wealth tax on non primary residences, one that increases for each additional residence.",liberals
hoqkr39,2021-12-15T11:56:04.000-08:00,"he’s been attacked by the far right. but justin trudeau is more worried about the ‘casual cynicism’ of the left &gt; it's the people who had status, and lost it.

i'd argue that men without a university education fit that bill to a tee. for many decades, canada had lots of jobs in manufacturing and later in oil and gas, where these people could command good salaries without a degree. those sectors are starting to require less labour.

people with degrees are the ones who are relatively well-off in today's economy.",liberals
hoql765,2021-12-15T11:59:45.000-08:00,he’s been attacked by the far right. but justin trudeau is more worried about the ‘casual cynicism’ of the left [removed],liberals
hoqlh1z,2021-12-15T12:02:01.000-08:00,"conservatives should be prepared to challenge quebec’s bill 21 in court, mp mark strahl says &gt;i'd like to see the catholic school system go as well, but it's existence doesn't negate the value of the stand against bill 21

it is a bit hypocritical though.  \"we routinely discriminate against people on the basis of sexual orientation and religion, but we'll ignore this for now and instead point fingers at quebec for discriminating against wearing visible religious garb while on the job\".",conservatives
hoqligr,2021-12-15T12:02:21.000-08:00,"trudeau open to discussing decriminalization of hard drugs i don't expect the demand to change much for people already addicted to nicotine, but i expect the demand of people not already addicted to nicotine to go down.",liberals
hoqlmia,2021-12-15T12:03:17.000-08:00,"he’s been attacked by the far right. but justin trudeau is more worried about the ‘casual cynicism’ of the left the relevant quotes from the article:

&gt; though he says he took it personally, he says it’s not a “poor prime minister” lament or a plea for a pat on the back. trudeau believes the “you did nothing” refrain cuts deeper — it turns people off the idea of government altogether.

&gt; “it undercuts everything we’re trying to do,” he says, and its logical conclusion is voter apathy.

&gt; “maybe it’s quibbling. maybe it’s a subtle difference between doing nothing and doing not enough. but ‘not enough’ seems like a fair argument,” he says. “yeah, i probably disagree with it because i think we’ve done lots, but (i know) it’s never enough.” 

it sounds like trudeau isn't bothered by \"you're not doing enough\" talk, that's fair game for an opposition. but he *is* bothered by people who say he's all talk and *no action*, because he has fought hard for a lot of progressive things like affordable child care, carbon taxes, or ev mandates, and he thinks the left should be more willing to give credit where credit is due.",liberals
hoqlr7x,2021-12-15T12:04:22.000-08:00,"conservatives should be prepared to challenge quebec’s bill 21 in court, mp mark strahl says &gt;abolish the public system and fold it into catholic school board. and fire all the deadweight. also works.

ah yes, instead of just banning gays and non-catholics from catholic school boards, let's ban them from all school boards!",conservatives
hoqlsvs,2021-12-15T12:04:44.000-08:00,"why do conservatives premiers agree to $10/free childcare? because it creates deadweight losses from people entering the workforce who would be more productive as stay-at-home mothers and it creates a lot of underpriced daycare that will be badly run because of the resulting shortage (because price ceilings cause the demand to exceed the supply). anyone who doesn't want to send their children to what will surely be terrible daycares (because they have no reason to compete for customers) will be forced to pay for it with productivity reducing taxes (because they induce tax avoiding behaviour, such as working fewer hours or dropping out of the workforce).",conservatives
hoqm2q7,2021-12-15T12:07:02.000-08:00,"conservatives should be prepared to challenge quebec’s bill 21 in court, mp mark strahl says i'm guessing there's a big overlap between cpc voters in quebec and supporters of 21 too.",conservatives
