hqgvkeo,2021-12-29T06:27:48.000-08:00,"beijing says canada-china relations ‘at a crossroads’ after trudeau’s ‘coercive diplomacy’ comment - national should we forget that the whole crisis was in fact created by the us, which is politicizing and ideologizing everything that goes against its wishes? should we not try to remember the first causes?",liberals
hqgw5kv,2021-12-29T06:31:44.000-08:00,beijing says canada-china relations ‘at a crossroads’ after trudeau’s ‘coercive diplomacy’ comment - national [removed],liberals
hqgx2et,2021-12-29T06:37:52.000-08:00,"beijing says canada-china relations ‘at a crossroads’ after trudeau’s ‘coercive diplomacy’ comment - national i saw uk/us keeping assange hostage, and i saw the us killing via drone a high level iranian general. jumping to china as the embodiment of evil and having as a modus operandi taking hostages, etc., flies in the face of evidence. just check how alstom was sold to gm... https://www.economist.com/business/2019/01/17/how-the-american-takeover-of-a-french-national-champion-became-intertwined-in-a-corruption-investigation",liberals
hqgx3hu,2021-12-29T06:38:05.000-08:00,perpetual anger not working for conservatives [removed],conservatives
hqgxies,2021-12-29T06:40:54.000-08:00,beijing says canada-china relations ‘at a crossroads’ after trudeau’s ‘coercive diplomacy’ comment - national it was all a charade that provided the air of respectability. check the extradition act btw us and canada and see that the engagement in economic exchange with iran is not a crime recognized by the appendix of said act.,liberals
hqgxmwv,2021-12-29T06:41:45.000-08:00,beijing says canada-china relations ‘at a crossroads’ after trudeau’s ‘coercive diplomacy’ comment - national which are not a crime in canada and as such the extradition does not apply.,liberals
hqgxtyg,2021-12-29T06:43:03.000-08:00,"beijing says canada-china relations ‘at a crossroads’ after trudeau’s ‘coercive diplomacy’ comment - national &gt; where in the rules governing extradition is it up to the country making the arrest to decide if it's valid or not?

check the extradition act btw canada and us. it was absolutely on canada's purview to decide if it was valid or not.",liberals
hqgxv3x,2021-12-29T06:43:16.000-08:00,perpetual anger not working for conservatives i mean this seems pretty fair enough! i think it was just a private members bill but i'd be ok with this,conservatives
hqgy4vo,2021-12-29T06:45:07.000-08:00,beijing says canada-china relations ‘at a crossroads’ after trudeau’s ‘coercive diplomacy’ comment - national [removed],liberals
hqgz8sh,2021-12-29T06:52:35.000-08:00,beijing says canada-china relations ‘at a crossroads’ after trudeau’s ‘coercive diplomacy’ comment - national there was a hearing on this and everything. she's charged with bank fraud which is a crime. almost like the letter of the law matters in this sort of thing.,liberals
hqgzqgh,2021-12-29T06:55:56.000-08:00,"beijing says canada-china relations ‘at a crossroads’ after trudeau’s ‘coercive diplomacy’ comment - national yes, let's hold onto that sophistry. cannot accuse her for dealing with iran because it is not on the books, then it will be bank fraud, eh mate?

plus, here we are talking about a \"crime\" that has not happened in the us and nobody else complained about. the extraterritoriality of the us reach should upset any sane person in the world...",liberals
hqh012i,2021-12-29T06:57:57.000-08:00,"beijing says canada-china relations ‘at a crossroads’ after trudeau’s ‘coercive diplomacy’ comment - national wait, wait, wait … you mean these guys might have been spies after all?",liberals
hqh0fef,2021-12-29T07:00:39.000-08:00,"beijing says canada-china relations ‘at a crossroads’ after trudeau’s ‘coercive diplomacy’ comment - national &gt;hundreds of thousands of canadians working and living in china with their families    

source? with covid what ive heard is there are significantly less than there used to have pre covid.      

i seriously doubt that there are more than 100000 canadians working in china.",liberals
hqh0mcc,2021-12-29T07:01:57.000-08:00,perpetual anger not working for conservatives [removed],conservatives
hqh17jz,2021-12-29T07:05:57.000-08:00,"beijing says canada-china relations ‘at a crossroads’ after trudeau’s ‘coercive diplomacy’ comment - national thats a rather one-sided view of things, unfortunately.",liberals
h0zx4dq,2021-06-07T14:46:47.000-07:00,trudeau’s liberals promised to end the blood ban. now they say it’s ‘complicated’. you could literally say that about anything though... at some point trust your fellow canadians.,liberals
h0zxqvy,2021-06-07T14:53:56.000-07:00,"liberals, bloc vote to end bill c-10 study amid social media free speech concerns [removed]",liberals
h0zzoyb,2021-06-07T15:16:53.000-07:00,"liberals, bloc vote to end bill c-10 study amid social media free speech concerns [removed]",liberals
h0zzvjl,2021-06-07T15:19:07.000-07:00,"why does justin trudeau’s government continue to fight indigenous compensation claims in court? ‘i can’t make sense of it,’ top advocate says honestly the lpc is usually the government of canada. it is fair to give them a lot of blame.",liberals
h1006gt,2021-06-07T15:22:49.000-07:00,"trudeau’s liberals promised to end the blood ban. now they say it’s ‘complicated’. you’re desperately trying to avoid the statistical fact that msm as a group are disproportionately more likely to have hiv and also represent new hiv cases than any other group. 

unless only gay people can be msm this is not a ban on sexuality. as you yourself pointed out, a transgender woman who engages in penetrative anal intercourse is also prohibited from donating. while statistics are limited in post-op transgender individuals, they do support the idea that the hiv prevalence in that population is lower than in the msm population.",liberals
h100c5w,2021-06-07T15:24:48.000-07:00,"trudeau’s liberals promised to end the blood ban. now they say it’s ‘complicated’. no, you can’t have sex with your partner and donate blood for the next three months because msm as a group have one of the highest prevalences of hiv in any single population. 

someone chooses to have sexual intercourse. that’s literally the very basis for consent.",liberals
h101bjk,2021-06-07T15:37:00.000-07:00,"trudeau’s liberals promised to end the blood ban. now they say it’s ‘complicated’. both articles you linked specifically address individuals receiving drug therapy to combat hiv. and they’re completely accurate and something we’ve understood about hiv drug therapies and prep as that’s the entire point of these therapies. my point about being able to transmit hiv while testing negative is still accurate. unfortunately hiv testing does generate a substantial amount of false negatives for a test for a viral infection. this is particularly true among recently infected individuals. these false negatives are the reason why it is recommended that when tested for hiv you have one test and then another at least three months after the exposure. this is known as the window period and is very well understood. it takes time for the body to produce the anti-bodies that are routinely tested for in an hiv test, about a month in most people. tests that detect the virus itself have been developed but they still have a window period of 2+ weeks.

in my comment i am not referring to people receiving medical treatment for hiv who would be banned from donating blood anyway because a positive hiv test disqualifies you. i am instead referring to the 25%+ of people who are estimated to be hiv positive and unaware of it.",liberals
h101tef,2021-06-07T15:43:09.000-07:00,trudeau’s liberals promised to end the blood ban. now they say it’s ‘complicated’. you are misinterpreting the statistics. what we see are cases where the existing screening failed to catch some positive cases. what we don't see reflected in these numbers is *all the positive cases that were prevented from donating because of the existing policies*. there may be 1 or there may be 1000; we can't tell from what you have quoted. so it is not safe to conclude anything.,liberals
h102j6n,2021-06-07T15:52:15.000-07:00,"trudeau’s liberals promised to end the blood ban. now they say it’s ‘complicated’. this has been studied quite extensively and there has never really been a conclusion to it. part of it is likely the lack of care for the aids crisis of the 80s and 90s which led hiv to become endemic in the msm population. another part is simply the mechanics of msm. anal intercourse is always more likely to yield an hiv infection because hiv is actually somewhat hard to get. it needs some sort of entrance into the blood stream. in anal sex small tears are extremely common which lend themselves well to leading to an infection.

there’re a lot of analogues between hiv and the msm population and other diseases endemic to specific groups. once something transmissible is released into a relatively insular group the ability to eliminate that diseases relies upon essentially getting this insular group to stop what is causing the transmission.",liberals
h102szq,2021-06-07T15:55:49.000-07:00,"liberals, bloc vote to end bill c-10 study amid social media free speech concerns &gt; that’s $260 million that cannot be spend on other shows.

the crown is an anchor show, most content on netflix doesn't cost anywhere near that much for them to acquire; and as prime has shown, it's entirely possible to have a service _flooded_ with cheap-to-produce content. *cough*gravitas*cough*.

and, of course, there's youtube, facebook, vimeo and others where content creation is as cheap as a webcam or cellular phone.

&gt; you were vague about which were supposed to be “scary foreign content distributors”.

i really don't know who _specifically_ is being referred to when proponents of c-10 refer to large foreign media broadcasters. i've seen netflix, amazon, youtube, facebook and others all used interchangeably as the nefarious foreign powers.

&gt; do you think the goals of c-10 in respect of each is identical?

that's anyone's guess, at this point, because the minister in charge of the portfolio has claimed that large youtube channels may be subject to cancon regulation; and then he waffled and sorta back-tracked. and that important section of c-10 was removed, but we've been assured that it totally doesn't matter, right?

we'll see. no one can say for certain.

&gt; whether or not they attempted to create open platforms like youtube, they do not have them, and therefore your claim that regulating them somehow benefits bell or rogers is demonstrably false.

it's relevant because if the argument _for c-10_ is that the regulation is necessary to support canadian competition, if _no such competition exists_ then we have to question _how c-10 is intended to encourage it to exist_.

so can we expect bell, rogers et al to create competitors to youtube, netflix, facebook, and prime? or is the scope narrower, and we're just trying to ensure that these foreign distributors host canadian content?

again, i'm not really clear, because the minister has waffled considerably.

&gt; and you really think that foreign correspondents and international field offices is proof of…what, exactly?

transnational content creation.

&gt; if cbc news has a foreign correspondent, then cbc doesn’t make canadian news?

that's a good question. when does it stop being the ship of theseus? at what point is it _sufficiently canadian_? when it's owned by a canadian company, regardless of who made it and where? or when it has a canadian actor, regardless of who owns it and where it was made? or what?

&gt; that canadian local and national news is not important?

the cbc still exists; it's not going anywhere.

&gt; that we’re “post-national” and canada doesn’t exist anymore?

_[‘‘there is no core identity, no mainstream in canada,’’ he claimed. ‘‘there are shared values — openness, respect, compassion, willingness to work hard, to be there for each other, to search for equality and justice. those qualities are what make us the first postnational state.’’](https://archive.is/2uaig)_

&gt; if none of it matters, you should have no problem watching or reading the news in danish each night. if that strikes you as problematic, maybe you need to reflect on the issue more.

i already do read foreign news because canadian news tends to fail miserably in its scope _and quality_.  scmp, reuters and bbc, among others. there's also better independent news online, often, for local and canadian news.",liberals
h102vfc,2021-06-07T15:56:42.000-07:00,"liberal promise to reduce canadians' cellphone bills shredded by recent crtc decision all the pc's have done in my province is help create more monopolies. and they are working hard to make even more. we had the cheapest cellphone plans in the country in manitoba. then the pc's sold off mts, promising everyone rates wouldn't go up, and oooh! what a surprise! they did go up!

and now they want to do the same to our utilities, starting with manitoba hydro, which manitobans have, through their tax dollars, helped make into a green, reliable and cheap electrical network. what do you think will happen when it gets sold off to the highest bidder?

if the pc's had a real strategy to fend off monopolies, i'd consider them, but they don't. the liberals suck, but the pc's are far worse.

edit: oh, you wrote ppc, not pc. my bad. ppc is ten times worse. far-right crazies.",liberals
hmga9bq,2021-11-28T05:50:00.000-08:00,"opinion: a higher carbon price could get us to paris on its own, at much less cost to the economy another approach to selling carbon taxes and rebates is that whenever you have a project idea that either prevents tax cuts or adds to deficit or replaces some other unrelated useful program, is that you could instead have a carbon tax of $x (where $x is also program cost), and then have a rebate/dividend that is $2x. 

there are extreme corner cases of poverty and inability to escape carbon costs that conservatives will disingenuously elevate as counter arguments to carbon taxes.  those go away when rebate/dividend is 2x the tax cost.  and then, only those really good/effective programs are popular enough to get funded.

a high carbon dividend also serves as a base for ubi which solves poverty and crime issues.  less other funding for it.",conservatives
hmggbcb,2021-11-28T06:31:17.000-08:00,"opinion: a higher carbon price could get us to paris on its own, at much less cost to the economy blaming rich people for climate change is the same as conservatives blaming china for emissions. sure they contribute way more then the average joe, but all in all the vast millions of smaller contributors amount to more then the few big ones.

does that mean they don’t *also* have a responsibility to reduce emissions? no absolutely not, they’ve got the farthest to go and most to improve. but to solve climate change we all need to change, and blaming a country or class of people or whatever is just shifting the blame so you don’t feel the need to change",conservatives
hmggv8c,2021-11-28T06:35:08.000-08:00,"a 20-year spike in inflation could put the bite on the trudeau liberals i thought this explanation of the difference between \"demand-pull\" and \"cost-push\" inflation from ken boessenkool and mike moffatt was quite good. the bank of canada needs to tighten monetary policy in response to excess demand (\"demand-pull\" inflation), but not supply-side disruptions (\"cost-push\" inflation). [the bank of canada needs to clearly communicate to canadians what's happening with inflation.](https://theline.substack.com/p/ken-boessenkool-and-mike-moffatt)

&gt; let’s return to our two-person, two banana, two-dollar economy, where each person pays one dollar for each banana. now imagine you take away one banana temporarily (say it is stuck on a boat in the port of vancouver). now with only one banana, each person pays one dollar for half a banana or two dollars for one banana. destroying one of the dollars does not solve the core problem, that we have a banana stuck on a boat, and our inflation is only transitory, as it disappears once the banana arrives.
&gt; 
&gt; in short, our standard monetary policy playbook was not designed for these times. treating pent-up or supply-side inflation as demand-pull inflation will result in applying exactly the wrong solution — monetary tightening, rising interest rates. rising interest rates in the face of supply-side inflation could exacerbate the short-term economic harm of these supply-side challenges just as we start to recover. this economic harm will be, to quote the bank of canada governor, transitory, but not short-lived. if some of these supply-side shocks impact our domestic economy (production of automobiles or automobile parts), then the last thing we would want is the bank of canada to harm the economy further by raising rates.
&gt; 
&gt; this puts the bank of canada in a tough spot, as they are required by mandate to keep inflation near two per cent, a mandate that makes no distinction between demand-pull and cost-push inflation. if the bank of canada sticks too closely to that mandate, they risk unnecessarily damaging the economy. however, if they allow inflation to persist, they create an opportunity for opposition politicians to question the independence of the organization.",liberals
hesg71u,2021-09-29T10:10:37.000-07:00,"if the cpc and the bloc had some kind of hypothetical cdu/csu style agreement i’ve thought about something along these lines too but i don’t think the bloc would go along with it.

however…..if the caq were to form a federal party and make a formal alliance with the conservatives this could be a great strategy.",conservatives
heshcfg,2021-09-29T10:19:54.000-07:00,"unvaccinated conservative mps should ‘stay home’ from parliament: bloc leader sorry, it was ignatieff, not trudeau.",liberals
heshct2,2021-09-29T10:19:59.000-07:00,"unvaccinated conservative mps should ‘stay home’ from parliament: bloc leader &gt;by implementing a rule that all parties are required to declare candidates across all provinces in at least 25% of the ridings per province and territory in good faith

that would actually really hurt the possibility of small parties ever making it to parliament and just benefit the larger parties, who already have a huge advantage.

&gt;that being said, i'm still more in favour of a system where the parties themselves are forced to disband and candidates are chosen in their local riding without any party affiliation

that sounds great in theory, but if you think about it more, it doesn't work:

1. candidates would have to be knowledgeable in literally everything. when a candidate looks for a party to join, they look for the one where most of their views align and just go along with everything else.
2. it would make it incredibly difficult for constituents to vote. the platforms would be so varied every election that they'd have to read them carefully to see which current candidate goes best with their views, rather than just knowing the platform of the parties. worst case: it turns into even more of a popularity contest.
3. historically, systems that begin this way end up creating caucuses and, eventually, parties. mostly because people will want to band together with others with similar views. you don't even have to go far back in time or to another country to see this: trudeau dissolved the senate liberal caucus in 2014 and every non conservative senator was independent. then in 2019 two caucuses were formed (canadian senators group and, 10 days later, the progressive senate group).

there's more points, but i'm kinda lazy to keep typing.",liberals
heshvrg,2021-09-29T10:24:07.000-07:00,trudeau strikes a triumphant tone after an election that was his to lose  ‎,liberals
hesihdu,2021-09-29T10:28:47.000-07:00,"drug decriminalization movement gaining momentum in canada as overdose deaths surge true conservatives should want to go back to when this stuff was never on the books as criminal. unwarranted government interference in personal lives.

but hammer those who cause crimes while under the influence. like duis.",conservatives
hesijnm,2021-09-29T10:29:17.000-07:00,gun-control group urges trudeau to name new minister to advance liberal promises  ‎,liberals
hesjal3,2021-09-29T10:35:06.000-07:00,tom mulcair: trudeau has to get serious. the time for bluffing and emoting is over. [removed],liberals
hesjcj4,2021-09-29T10:35:31.000-07:00,"unvaccinated conservative mps should ‘stay home’ from parliament: bloc leader well he wants quebec separatism, but ultimately the bloc position is to represent québécois in ottawa and so the positions of the elected provincial government which is not led by a separatist party at the moment. so even if you’re not a separatist what’s wrong with a party that does a great job at representing their constituents? i’m not a separatist and still voted for them the last two elections. ultimately you’re right in the fact that they can take these positions because they only run in quebec, but to say another party wouldn’t be able to take these positions while running everywhere is false, but that might be true that they wouldn’t be able to run the country because it seems like a lot of the country still believes oil is still something we need to focus on and the only parties that get elected are the ones that still try to make it works (yes the liberals too, despite what the west seems to think about it).",liberals
hesjdjn,2021-09-29T10:35:44.000-07:00,"gun-control group urges trudeau to name new minister to advance liberal promises &gt;they won't stop until every cooey is gone to the smelter.

i feel like you're correct on this assessment. they want complete civil disarmament.",liberals
heskrqp,2021-09-29T10:46:32.000-07:00,"\"if only chong, ambrose, or raitt were leader, then i would have voted cpc!\" i like chong, but this argument some liberals use is bs, they will always find a reason to vote abc",liberals
hesm1up,2021-09-29T10:56:17.000-07:00,"\"if only chong, ambrose, or raitt were leader, then i would have voted cpc!\" they will never vote for the cpc. most of the cpc votes are already from the center. the liberals want the party to move to the left(this election it was in the center left), they want you to do this because then you lose your identity as a party. so people would rather vote for the actual liberals, rather than the liberals with the \"conservative\" branding.

we are better off in the long term taking the party to the distant-right, rather than to the left. we have to stand out in a great way, and not just blend in for people who will never vote for us anyway.",liberals
hq7r950,2021-12-27T08:31:52.000-08:00,"trudeau says china ‘playing’ democracies against each other, urges a ‘united front’ not regular people. employees of the red army.",liberals
hq7t601,2021-12-27T08:46:05.000-08:00,"trudeau says china ‘playing’ democracies against each other, urges a ‘united front’ you mean 2020?",liberals
hq7trzn,2021-12-27T08:50:37.000-08:00,"liberal idealistic policies are unsustainable as the world faces resource shortages by 2030 &gt;i will just ignore your bad faith comments, and insults and get to the point.

translation - i'll ignore everything you say that's true that i can't refute.  well done. 

&gt;yes the community is obviously a social structure. he is saying conservatism values the community

they value the social structure of the community. that is not the same thing. 

lets move on to your quotes :) this is hilarious. 

first giant block you obviously didn't read yourself:

this is in response to my question about where is family mentioned etc.  and in your quote.... he doesnt' mention family except to mention that people need family less as they go on in life. you're a frikkin' genius. :)

and again what he's discussing there is social structure. he's advocating for the 'conservation' of the status quo of the social structure. so all you've done is post a quote that proves my point again. 

second giant block you obviously didn't read

the first quote says we live in communities. well - true but makes no mention of how that's an issue for conservativism. fail. 

second quote says we like cities. doesn't actually say anything about conservative policy. 

third one admits that it wasnt' conservatives who fought for the environment in britian, the politicians did nothing. he claims that it was 'conservative principles' that motivated the people who did fight but in reality we know that's not true. and still today we see that - the people blockading logging aren't conservatives are they. so the conservatives, who are a political party, did not do it. 

&gt;how is that different from classical and neo liberalism. you have failed to answer my question 

i posted an article that explained it in detail. i take it you didn't read that either. sigh - you are living proof that you can lead a horse to water but you can't make him think. 

&gt;as i have already proven community, religion, familily, health and tradition are all conservative values.

well first off not really. in fact we know for at least two types of conservativism you propose exist they're expressly not. and you haven't touched on health at all.  

but regardless even if they were that doesn't mean they're exclusively conservative. 

seriously - did you just suggest that anyone who believes in religion must ipso facto be a conservative? do you really need me to explain why that's wrong? 

&gt;yes i would say \"nope\"

