gpbhkie,2021-03-01T01:23:48.000-08:00,"just because singh vows to prop up the liberals, it doesn't mean we'll avoid a pandemic election i think this is - at the bare minimum - a delaying tactic for the ndp. they are trying to delay an election until either the liberals take a dip in the polls, or until the ndp have re-filled their treasury. or both.

if the liberals call an election before vaccinations are done, the ndp can turn around and shame the liberals for calling an election before the pandemic is over, framing it as risking the lives of canadians for political gain. and since the ndp supported the liberal minority, they would have much more credibility on that claim.",liberals
gpbhsk0,2021-03-01T01:25:24.000-08:00,"liberals shameful vote against pharmacare is another unacceptable broken promise with canadians the last meaningful expansion of public drug coverage in ontario was under the ndp in 1995, in one of their last bills which created the odb and trillium drug program.  part of the impetus was the introduction of effective therapies for hiv that year.  thousands of hiv+ ontarians could not afford the new medications that had just been introduced.",liberals
h37znka,2021-06-27T01:48:38.000-07:00,"one way or the other, justin trudeau needs to shake up his team [removed]",liberals
h37zslf,2021-06-27T01:49:48.000-07:00,"pierre trudeau's failures on indigenous rights tarnish his legacy i think things would improve over time if we stopped living primarily in segregation. 

crazy idea i know.. but, the way some bands operate.. causes a lot of pain and suffering of people and children unnecessarily.",liberals
h3803xi,2021-06-27T01:52:30.000-07:00,"commentary: lack of consequences for carolyn bennett is par for the course for the liberals imho, the media has really jumped the shark on this one.  completely overblown.",liberals
h3805k2,2021-06-27T01:52:53.000-07:00,"one way or the other, justin trudeau needs to shake up his team removed; rule 3",liberals
h38071f,2021-06-27T01:53:13.000-07:00,"one way or the other, justin trudeau needs to shake up his team not a *star* subscriber so i’m going to infer from the title, thumbnail, and context that this is at least partially about sajjan.

i think it’s interesting that, if sajjan was to stay on and remain mnd through the fall, he will surpass peter mackay as the longest-serving minister in that portfolio since brooke claxton (1946-1954). few mnds stick it out past four years. art eggleton was the only other mnd to break five years in one stretch; james ralston had eight years but they were two discontinuous four-year terms.",liberals
h381pm3,2021-06-27T02:06:05.000-07:00,"one way or the other, justin trudeau needs to shake up his team [removed]",liberals
h381var,2021-06-27T02:07:26.000-07:00,pierre trudeau's failures on indigenous rights tarnish his legacy [removed],liberals
h3828tl,2021-06-27T02:10:37.000-07:00,"trudeau faces mounting calls for independent probe of residential school deaths &gt; i would like the church to deal with its own skeletons with the residential schools

they didn't do such a great job holding pedophiles to account, so...",liberals
h3838zt,2021-06-27T02:19:07.000-07:00,"saskatoon man assaulted, has part of beard cut off in early morning racist attack the comment i was replying to was removed so i’m not sure how you’re interpreting this. the context was the poster (who had cpc flair) was blaming this attack on the liberals and trudeau for talking about identity politics.",liberals
h3839an,2021-06-27T02:19:12.000-07:00,"paul bernardo should rot in jail: premier doug ford \\&gt; was it political interference for electoral gain when he and trudeau said the london van attack was terrorism? no.

yes it was. we're talking about a designation taking away the civil rights of people (right to trial, right to know the charges against you) with a terrorism designation. the pm has no business interfering in a criminal investigation. it's extremely dangerous territory here, moreso than with a parole board.",liberals
h383f50,2021-06-27T02:20:33.000-07:00,pierre trudeau's failures on indigenous rights tarnish his legacy [removed],liberals
h383fg2,2021-06-27T02:20:38.000-07:00,"trudeau faces mounting calls for independent probe of residential school deaths accepting responsibility and making amends for its prior atrocities isn't something the catholic church is capable of doing. 

they've shown it time and time again. with the atlantic slave trade, with the aztec genocide, for the victims of sexual assault or for this.",liberals
h383imi,2021-06-27T02:21:23.000-07:00,"trudeau faces mounting calls for independent probe of residential school deaths why would this call for a separate independent probe? .... you need an independent probe when the investigators of something are the accused. like the cops investigating police abuse would be bad, so we use the siu/ocpc. this isn't the case here. 

first off, this isn't a criminal investigation since we're talking mostly a 100+ year gap. there is likely no one that would be facing serious repercussions from any findings anyways given the dates, most of the abusers will be long dead. besides, the investigations currently are basically done by relatively independent native groups like the trc. 

what are people hoping for? do people think that random people hired by the fed are going to falsify documents in order to hide bodies or something? like, the concern doesn't make any sense.",liberals
h383l6r,2021-06-27T02:21:59.000-07:00,"one way or the other, justin trudeau needs to shake up his team it starts by talking about how sajjan has lost the moral authority to lead. it's a bit generous in its description (i.e. sajjan was the on being fooled, not doing the fooling) but the conclusion is the same as everyone else has reached.

&gt;he spent his political career boasting about his feminist credentials, only to allow an independently documented systemic problem to fester on his watch.

&gt;but one can sympathize with the plight of the embattled sajjan and still know that he is no longer the person the situation calls for.

&gt;on the face of ever-mounting evidence that key members of canada’s military command have spent the past six years pulling wool over sajjan’s ministerial eyes, he no longer has the moral authority or the credibility to clean house.


it then kind of takes a turn from sajjan and mid-term replacements and talks about how trudeau can add to and shake up his team, including with unelected people (which isn't novel.) in a way to surround himself with better, more competent people.

indigenous affairs, pandemic recovery, and the lack of any representation in the west are all places that were mentioned where trudeau can get new blood and new brains into the mix to help him be a better leader.

and after seeing how his minister's have rather recently shit the bed on defense, indigenous affairs, fisheries, veterans affairs, public safety, communication etc maybe it is time that they start surrounding themselves people who know what they're doing.",liberals
h383r1v,2021-06-27T02:23:23.000-07:00,"trudeau says pope should apologize on canadian soil for church's role in residential schools something that's been rattling around in my head over this lately. i keep having the same question:

if the pope were to come to canada and apologize, would there be forgiveness from the canadian indigenous community?

like, how would that even work? i don't expect answers.

edit: there is a case to be made here that the church also wronged canada itself by carrying out these activities in the manner they did.",liberals
h383rtm,2021-06-27T02:23:35.000-07:00,"one way or the other, justin trudeau needs to shake up his team yeah i agree, although the timing really sucks, especially if there's potential for an election before the house even gets a chance to sit again.",liberals
h383yb7,2021-06-27T02:25:04.000-07:00,trudeau faces mounting calls for independent probe of residential school deaths trudeau took away control of the schools from the church and started giving oversight  in '69. this signaled the beginning of the end for the schools but he didn't fix the problem.,liberals
h384lml,2021-06-27T02:30:27.000-07:00,"one way or the other, justin trudeau needs to shake up his team &gt;key members of canada’s military command have spent the past six years pulling wool over sajjan’s ministerial eyes

sounds like some generals need to go. are there any left who haven't been schtupping their subordinates, or are these the same members?",liberals
h384nw1,2021-06-27T02:31:00.000-07:00,"doug ford’s ham-fisted blunder on campaign spending limits will end up hurting him twice &gt;[https://m.youtube.com/watch?v=wgzx\\_yq8-iy&amp;t=6s](https://m.youtube.com/watch?v=wgzx_yq8-iy&amp;t=6s)

in my opinion the efficacy of our elections is paramount over the idea that these third parties need more notice.   ~~as far as i am aware, the secondary suggestion for the regulation was 6th months - not the current back stop, so there is no 6 month limit currently in place.~~  the 6 month mandate by the liberals is different than the conservative mandate had it been 6 like it was initially introduced as. i would encourage the idea of a study to determine the cost of reaching a voter so that the limit is no longer arbitrary. the regulation applies to all political messaging  regardless of party affiliation. the arguments made by the presenters on tvo suggest the use is illegal, it's not, it's using the legal means outlined within the charter to further important government objectives.

edit:  strikethrough for incorrect information and 2nd edit for added new opinion and information",liberals
h385g3f,2021-06-27T02:37:30.000-07:00,pierre trudeau's failures on indigenous rights tarnish his legacy [removed],liberals
h3863j8,2021-06-27T02:42:55.000-07:00,"pierre trudeau's failures on indigenous rights tarnish his legacy this is an interesting critique of pet. the ideas are half baked but give considerable insight to contemporary debates on indigenous issues.

liberal ideals of procedural equality can't work when we have treaties signed by internal nations. these require ideas of substantive equality which recognise the historic injustices and contemporary challenges faced by indigenous peoples. just look at how procedural equality has worked for francophones outside of qc and apply that to indigenous peoples to see how pet's ideas would have worked.",liberals
h08ukqa,2021-06-01T08:23:44.000-07:00,"liberals seek to run out the clock on parliamentary disclosure the people who rage about trudeau not fulfilling his election reform promise (and even more foolishly thinking that the election reform was the main reason people voted for trudeau rather than to turf harper) need to take a look at this list and remember why strategic voting remains a thing b canada. until/if the left is ever united, the cpc—and the cpc base which is more powerful than ever running roughshod over o’toole—is a real danger.",liberals
h08uxnq,2021-06-01T08:26:41.000-07:00,"residential schools are not a footnote in canada’s history. they are its past and present the government can do both. survivors of this ordeal need money now as well, we can’t just wait until they all past and be like “ok now we can approve the payments”. not just for this black mark on canadian history; trudeau isn’t funding indigenous causes enough, like healthcare. you could probably count on one hand the number of real hospitals the government has built for any indigenous nation over the past decade or so.",liberals
h08vgdq,2021-06-01T08:30:57.000-07:00,o'toole wants an investigation of winnipeg virus lab's ties to china [removed],conservatives
h08w6gf,2021-06-01T08:36:57.000-07:00,"trudeau’s covid-19 spending was tilted to high-earning canadians okay what?

my wife and i are middle class essential workers, we thankfully kept our jobs and didn't see a dime of the cerb. wife's brother got laid off, divorced, and had his place sold out from under him right as covid was starting. as a service industry worker he was the target beneficiary of cerb and without it he would have been destitute. it let him survive for the 7 months it took him to get a job as a painter in calgary. 

i don't really get how this measure didn't benefit the poor, there are people still refusing to go back to work because they make more off government income support than they do at minimum wage part time jobs.",liberals
h08x3d4,2021-06-01T08:44:29.000-07:00,"prime minister justin trudeau promises cities help to lower high cost of housing the big reason  for targeting the tax (tho i agree that aiming at just foreign buyers is dumb) is that if it applied broadly to all empty homes then it could have some seriourly bad effects  on locations that are primarilly vacation destinations. immagin if you had to pay 1% per year to own a vacation home in some resort town. most people would just say \"fuck that shit\" and the resort town would lose their primary income source.  


that said i would like to see this be a vacancy tax with some real teeth on urban centers. im not sure what the best way to roll that out canada wide though. would be to have an effective tax, that does not crush tourism towns but also does not make rural locations a hot bed of speculation and investing.",liberals
h08xpm7,2021-06-01T08:49:36.000-07:00,"trudeau’s covid-19 spending was tilted to high-earning canadians not cerb (which was totally insufficient, though necessary, i totally agree and should’ve been a universal benefit), but cews — the subsidies that went directly to employers.",liberals
h08y19l,2021-06-01T08:52:13.000-07:00,trudeau’s covid-19 spending was tilted to high-earning canadians it’s embarrassing how flaccid and ineffective the ndp have been to stand up to the massive transfer of wealth upwards the liberals pulled off with the cews — which the ndp celebrated and tried to claim as their victory!! embarrassing,liberals
h08yssz,2021-06-01T08:58:32.000-07:00,"prime minister justin trudeau promises cities help to lower high cost of housing and who's fault is that? it's the same age-old problem. the voting blocs that need help, can't be relied upon, so they are essentially invisible. it's pointless to cater to them. 

on the other hand, the people who don't want this to change, well they're voting alright. 

you know i'm part of one of those unreliable voting blocs, told my peers time and again that they will not see any solutions to their problems if they keep fighting against reality. they don't want to listen though and would rather not vote or place their hopes on impossible causes.",liberals
h08z1u1,2021-06-01T09:00:35.000-07:00,trudeau’s covid-19 spending was tilted to high-earning canadians [removed],liberals
h08z8pa,2021-06-01T09:02:08.000-07:00,o'toole wants an investigation of winnipeg virus lab's ties to china [removed],conservatives
h08zbqh,2021-06-01T09:02:50.000-07:00,"quebec nationalism push poses election challenge for justin trudeau are you a quebecker? if not, sorry to say but you don’t get a say how quebeckers choose to regulate the place of religion in the public sector.",liberals
h08ze7l,2021-06-01T09:03:26.000-07:00,"trudeau’s covid-19 spending was tilted to high-earning canadians lol there’s a chinese startup that i know who benefited from the cews, but wasn’t making a dime of revenue to begin with so why are they eligible? we gave free money to wealthy chinese investors",liberals
h08zwi8,2021-06-01T09:07:42.000-07:00,trudeau’s covid-19 spending was tilted to high-earning canadians [removed],liberals
h09014a,2021-06-01T09:08:47.000-07:00,"residential schools are not a footnote in canada’s history. they are its past and present &gt; survivors of this ordeal need money now 

... the money settlement happened in 2005/2006. the payments were already approved and sent out.

i don't understand how people can feel comfortable coming into a conversation swinging their opinions about on topics like this without knowing even the basic facts on the subject.

&gt;trudeau isn’t funding indigenous causes enough, like healthcare. you could probably count on one hand the number of real hospitals the government has built for any indigenous nation over the past decade or so.

the current proposal from the fed for 2021 includes $18bn for fns... natives got a special race based line skip for covid vaccines too. federal fn specific spending is now &gt;$14bn of ~$500bn budget (2.8%). this is with &lt;1% of canadians living on reserve (~3% being native) and natives being able to benefit from most of the general purpose spending of the government (natives are obviously able to share many things with non natives. military, roads, etc). 

i'm not sure what you think is a reasonable spending figure but i really doubt you had any idea what it was before you formed your opinion either, nevermind a clue as to what it should reasonably be.

there is an assumption that conditions sucking on reserves is because they don't have enough funding, or that the whiteman in government is just so full of hate that they must being fucking over the natives on purpose, but reality isn't that simple. unfortunately, reality requires a bit more effort and leaping to conclusions, very little.",liberals
h090qq9,2021-06-01T09:14:53.000-07:00,ndp joins calls for liberals to overturn crtc internet price decision [removed],liberals
h0913te,2021-06-01T09:17:53.000-07:00,"o'toole wants an investigation of winnipeg virus lab's ties to china cynical? china is committing genocide in xinjiang, have 2 canadians hostage, executed another and have engaged in purposefully damaging trade tactics and electronic warfare.",conservatives
h0924c5,2021-06-01T09:26:24.000-07:00,"o'toole wants an investigation of winnipeg virus lab's ties to china &gt; have engaged in purposefully damaging trade tactics

the last time your party was in government, it was perfectly fine with this. the constant virtue signalling from the conservatives on china nowadays is incredibly hollow considering their actions in government.",conservatives
h0928l7,2021-06-01T09:27:24.000-07:00,"trudeau’s covid-19 spending was tilted to high-earning canadians [kevin milligan](https://twitter.com/kevinmilligan/status/1399734344835506182?s=20):

&gt; this headline is bad.
&gt;
&gt; the 3rd column shows a progressive trend as a % of income. that's the right measure.
&gt;
&gt; imagine if we use absolute dollars (instead of income proportion) to measure progressivity....
&gt;
&gt; ... try that with the income tax burden!

covid support as share of disposable income: 13.7% for the lowest quintile (20% of households), 10.2% for the second-lowest quintile, 8.2% for the middle quintile, 6.6% for the second-highest quintile, 3.9% for the highest quintile.",liberals
hbz6qf6,2021-09-07T06:46:17.000-07:00,"known white nationalists spotted at violent anti-trudeau demonstration the situation to the south, especially in 2016, really hammers home the point that nothing should be taken for granted and do not assume anything.",liberals
hbz6r0u,2021-09-07T06:46:24.000-07:00,trudeau says he ‘won’t back down’ from anti-vaxx protesters | globalnews.ca they really are ignoring health.  calorie counting doesn't make you healthy. walking a certain amount of steps shouldn't even be considered exercise.  i havent moved the goal post at all.,liberals
hbz6rxn,2021-09-07T06:46:34.000-07:00,o'toole pressed to release price tag for conservative campaign promises are you sure?.. pandemic aside.. the conservatives are planning 60b in 10 years just with the increase in health transfers,conservatives
hbz6sm1,2021-09-07T06:46:42.000-07:00,"erin o'toole betrayal \\&gt;the debate would be over by then

im not sure what you're missing but the debates are sept 8th and 9th maybe try rereading?

\\&gt;pretty sure it never really came up

okay then if you're pretty sure

\\&gt;plus no platform

at this point im pretty sure you just have no idea what you're talking about, maybe a bot?",conservatives
hbz71dy,2021-09-07T06:48:22.000-07:00,known white nationalists spotted at violent anti-trudeau demonstration [deleted],liberals
hbz72ut,2021-09-07T06:48:39.000-07:00,"home ownership is becoming a lost cause and the liberals did worse than diddly squat they absolutely have input from the feds (including in the next 6 months when the boc gets orders from the feds). we also know this because \"politicians\" will often talk about making changes openly but their names not revealed..

the bank of canada building is right across from parliament hill after all...

here's also a policy that's unique to this government - this is the first time in history we used qe. harper never touched it, and it wasn't a tool used prior to the 08 financial crisis. there are also credit expansion policies, chmc changes, and increasing of immigrant quotas (and encouraging developers to seek foreign capital) that has caused these issues.

even if you believe they did not cause it - it is undoubtable they did not act. and before you tell me its provincial and municipal jurisdiction.. (1) 90%+ of mortgage debt is governed on a federal level (2) banks have made provided guidelines on what the government can do within their power to reduce housing demand. the government did nothing but a lousy 1% foreign buyers tax that is self reported and easy to get around with trudeau's generous use of visa exceptions...

i've been tracking this since last year. what the government did was insane and is the key reason we're in this situation.",liberals
hbz75au,2021-09-07T06:49:06.000-07:00,known white nationalists spotted at violent anti-trudeau demonstration [removed],liberals
hbz75r5,2021-09-07T06:49:12.000-07:00,"politics, polls, and punditry - tuesday, september 7, 2021 i suspect that even if their polling is accurate they are far more likely to underperform than outperform on election day.

ppc voters will jump to the tories at the last second in the same way that some ndp voters jump to the liberals.",liberals
hbz7670,2021-09-07T06:49:17.000-07:00,"politics, polls, and punditry - tuesday, september 7, 2021 left enough that they believe trudeau is right wing on most issues, which, come on. he’s clearly centre left.",liberals
hbz7cfr,2021-09-07T06:50:28.000-07:00,known white nationalists spotted at violent anti-trudeau demonstration i can safely assume that bernier isn't trump.,liberals
hbz7wgm,2021-09-07T06:54:16.000-07:00,o'toole pressed to release price tag for conservative campaign promises he’s waiting for it to be costed by the parliamentary budget office to get an unbiased costing. hardly seems to be an election issue.,conservatives
hbz80os,2021-09-07T06:55:06.000-07:00,voters should look carefully before swapping trudeau for o’toole i’d rather vote him out before the average house or condo costs 30x my salary.,liberals
hbz89zu,2021-09-07T06:56:53.000-07:00,gun control advocates unimpressed with o'toole's policy change on liberal gun ban [deleted],conservatives
hbz8fri,2021-09-07T06:57:59.000-07:00,"politics, polls, and punditry - tuesday, september 7, 2021 lack signs. shouldn't be a big problem for the conservatives in the st. john's ridings either (or the ndp in the rural ridings). 

but i wouldn't be surprised if they don't believe in hurricanes.",conservatives
hbz8jrx,2021-09-07T06:58:45.000-07:00,"erin o’toole keeps changing his story — and, so far, it’s working if the other parties are just as critical, then what is wrong with the conservatives also being critical of them? just seems to be needless bias against the conservatives.",conservatives
hbz9g53,2021-09-07T07:04:56.000-07:00,"known white nationalists spotted at violent anti-trudeau demonstration thing is. with these morons, the pile of shit just keeps growing and they contaminate everything else.

when your dog takes a shit on your rug, you clean it up. if you leave it there, the smell will get worse and you'll never take away the stain.",liberals
hbz9hhx,2021-09-07T07:05:13.000-07:00,"o’toole says he’d appoint vaccinated health minister, but no mandate for candidates well o'toole's the one who says he'll get us to 90% vaccination rate by sending mail-outs appealing to canadian's sense of patriotism.

i hope he has the mailing addresses for his own party's candidates.",conservatives
hbz9nwe,2021-09-07T07:06:27.000-07:00,trudeau says he ‘won’t back down’ from anti-vaxx protesters | globalnews.ca [removed],liberals
hbza28d,2021-09-07T07:09:15.000-07:00,known white nationalists spotted at violent anti-trudeau demonstration [removed],liberals
hbzaazn,2021-09-07T07:10:56.000-07:00,"politics, polls, and punditry - tuesday, september 7, 2021 r/onguardthee is certainly not far-left, i got downvoted and/or banned for criticizing trudeau from the left side of the spectrum. there also exists r/canadaleft which actually includes centre-left to far-left elements.",liberals
