gs2sbpi,2021-03-24T04:19:11.000-07:00,"lilley: trudeau bet on china over canada at height of pandemic ###this is a reminder to [read the rules before posting in this subreddit](https://www.reddit.com/r/canadapolitics/wiki/rules-thelongversion).
 
1. **headline titles should be changed only [when the original headline is unclear](https://www.reddit.com/r/canadapolitics/wiki/rules-thelongversion#wiki_1._headline_titles_should_be_changed_only_where_it_improves_clarity.)**
2. **be [respectful](https://www.reddit.com/r/canadapolitics/wiki/rules-thelongversion#wiki_2._be_respectful).**
3. **keep submissions and comments [substantive](https://www.reddit.com/r/canadapolitics/wiki/rules-thelongversion#wiki_3._keep_submissions_and_comments_substantive).**
4. **avoid [direct advocacy](https://www.reddit.com/r/canadapolitics/wiki/rules-thelongversion#wiki_4._avoid_direct_advocacy).**
5. **link submissions must be [about canadian politics and recent](https://www.reddit.com/r/canadapolitics/wiki/rules-thelongversion#wiki_5._link_submissions_must_be_canadian_and_recent).**
6. **post [only one news article per story](https://www.reddit.com/r/canadapolitics/wiki/rules-thelongversion#wiki_6._post_only_one_news_article_per_story).** ([with one exception](https://www.reddit.com/r/canadapolitics/comments/3wkd0n/rule_reminder_and_experimental_changes/))
7. **replies to removed comments or removal notices will be removed** without notice, at the discretion of the moderators.
8. **downvoting posts or comments**, along with urging others to downvote, **[is not allowed](https://www.reddit.com/r/canadapolitics/wiki/downvotes)** in this subreddit. bans will be given on the first offence.
9. **[do not copy &amp; paste the entire content of articles in comments](https://www.reddit.com/r/canadapolitics/wiki/rules-thelongversion#wiki_9._do_not_copy_.26amp.3b_paste_entire_articles_in_the_comments.)**. if you want to read the contents of a paywalled article, please consider supporting the media outlet.

*please [message the moderators](https://www.reddit.com/message/compose?to=%2fr%2fcanadapolitics) if you wish to discuss a removal.* **do not reply to the removal notice in-thread**, *you will not receive a response and your comment will be removed. thanks.*


*i am a bot, and this action was performed automatically. please [contact the moderators of this subreddit](/message/compose/?to=/r/canadapolitics) if you have any questions or concerns.*",liberals
gs2sebc,2021-03-24T04:19:42.000-07:00,"akin: the climate change gap between o’toole and his party may be too much to overcome i know what i will get if i vote ndp. i know what i will get if i vote liberal. i have no clue what i would get if i voted conservative because they have been so vague about their policy plans. a policy convention should make things more clear for voters and in this case, it made things less certain. i don’t hate o’toole as much as i did scheer but this is not a great look for the conservatives.",conservatives
gs2t1d1,2021-03-24T04:24:14.000-07:00,"trudeau says he does not need mandate for pandemic budget because he already has one ###this is a reminder to [read the rules before posting in this subreddit](https://www.reddit.com/r/canadapolitics/wiki/rules-thelongversion).
 
1. **headline titles should be changed only [when the original headline is unclear](https://www.reddit.com/r/canadapolitics/wiki/rules-thelongversion#wiki_1._headline_titles_should_be_changed_only_where_it_improves_clarity.)**
2. **be [respectful](https://www.reddit.com/r/canadapolitics/wiki/rules-thelongversion#wiki_2._be_respectful).**
3. **keep submissions and comments [substantive](https://www.reddit.com/r/canadapolitics/wiki/rules-thelongversion#wiki_3._keep_submissions_and_comments_substantive).**
4. **avoid [direct advocacy](https://www.reddit.com/r/canadapolitics/wiki/rules-thelongversion#wiki_4._avoid_direct_advocacy).**
5. **link submissions must be [about canadian politics and recent](https://www.reddit.com/r/canadapolitics/wiki/rules-thelongversion#wiki_5._link_submissions_must_be_canadian_and_recent).**
6. **post [only one news article per story](https://www.reddit.com/r/canadapolitics/wiki/rules-thelongversion#wiki_6._post_only_one_news_article_per_story).** ([with one exception](https://www.reddit.com/r/canadapolitics/comments/3wkd0n/rule_reminder_and_experimental_changes/))
7. **replies to removed comments or removal notices will be removed** without notice, at the discretion of the moderators.
8. **downvoting posts or comments**, along with urging others to downvote, **[is not allowed](https://www.reddit.com/r/canadapolitics/wiki/downvotes)** in this subreddit. bans will be given on the first offence.
9. **[do not copy &amp; paste the entire content of articles in comments](https://www.reddit.com/r/canadapolitics/wiki/rules-thelongversion#wiki_9._do_not_copy_.26amp.3b_paste_entire_articles_in_the_comments.)**. if you want to read the contents of a paywalled article, please consider supporting the media outlet.

*please [message the moderators](https://www.reddit.com/message/compose?to=%2fr%2fcanadapolitics) if you wish to discuss a removal.* **do not reply to the removal notice in-thread**, *you will not receive a response and your comment will be removed. thanks.*


*i am a bot, and this action was performed automatically. please [contact the moderators of this subreddit](/message/compose/?to=/r/canadapolitics) if you have any questions or concerns.*",liberals
gs2tfxh,2021-03-24T04:27:08.000-07:00,trudeau says he does not need mandate for pandemic budget because he already has one [removed],liberals
gs2twv3,2021-03-24T04:30:22.000-07:00,"john ivison: majority of canadians are feeling politically homeless, poll finds &gt; says this:

insert true statement. 

&gt;and then follows with this:

insert another true statement

&gt;but apparently i'm the insincere troll:

roflmao - if you're complaining about two statements which are absolutely true then yes - that would suggest you're the troll :) roflmao ;)  

i notice you didn't have any defense for those statements ;)

&gt;do you accuse everybody who has a different viewpoint of being troll?

no, just the ones who bring lies to the table. your comments simply aren't true. harper's immigration policies for example were hailed again and again for their popularity but you're trying to claim without evidence that they were unpopular. you claim he relaxed housing rules where he tightened them up several times in his term after the liberals relaxed them. etc etc. 

those aren't \"opinions\". those are facts and its not hard to see that they're wrong in your case. 

but i love that you're trying to play the victim over it  ;)  very liberal :) 
add to that the emotionally changed language. so.. sorry, but it's a fair question.",liberals
gs2txh5,2021-03-24T04:30:29.000-07:00,"np: majority of canadians are feeling politically homeless, poll finds &gt; if one party is constantly sliding towards awfulness (the cpc) all the liberals have to do is the bare minimum... there's no incentive otherwise.

except that there's the ndp to pull them the other way.",liberals
gs2u43s,2021-03-24T04:31:46.000-07:00,"akin: the climate change gap between o’toole and his party may be too much to overcome &gt;well o'toole has already said he wants to replace the carbon tax with another tax on industry. the cost obviously will be handed down to consumers but it will make albertans happy. clever imo

how is that clever?... so basically he wants to call the carbon \"tax\" a \"environmental fee\" or something like that because the word tax is bad since the cpc boogeyman that term like crazy",conservatives
gs2u772,2021-03-24T04:32:21.000-07:00,"liberals maintain slight lead amid election buzz: mainstreet poll #my [model](http://www.daemonology.net/poll-aggregation-canada/) consensus polling average: lpc 34.65% (+0.07) cpc 30.52% (+0.55) ndp 16.62% (-1.36) blq 7.34% (+0.36) gpc 6.65% (-0.12) 

the computed house effect for mainstreet research, including this poll, is
lpc +2.00% cpc +0.85% ndp -2.90% blq -0.45% gpc -0.33% so this poll is equivalent to if an average pollster reported
lpc 35.00% cpc 33.15% ndp 12.90% blq 8.45% gpc 6.33%",liberals
gs2udcc,2021-03-24T04:33:32.000-07:00,"np: majority of canadians are feeling politically homeless, poll finds ppc is trying brand themselves as the new conservative party and not the libertarian-esque party they started off as.",conservatives
gs2ufuy,2021-03-24T04:34:01.000-07:00,"liberals maintain slight lead amid election buzz: mainstreet poll editorial note: for all the people freaking out about the lpc being at 37% and the ndp being down at 10%... calm down.  mainstreet has big house effects, especially for those two parties.  this poll certainly isn't good news for the ndp but it's nowhere near the disaster the headline numbers look like.",liberals
gs2ujco,2021-03-24T04:34:42.000-07:00,trudeau says he does not need mandate for pandemic budget because he already has one [removed],liberals
gs2v5xn,2021-03-24T04:39:06.000-07:00,"tasha kheiriddin: the conservative convention was a smashing success — for the trudeau liberals well - i don't think the quebec one will actually mean much. but otherwise - yes, that's true. 

we screwed that one up. and it is a very badly wasted opportunity at best, a fatal blow at worst.",liberals
gs2vaqm,2021-03-24T04:40:03.000-07:00,"singh says he disagrees with mp’s post on racism in quebec, but demands no apology they could have created something long lasting after 2015 at least, which was more of a huge opportunity for a \"new normal\" since the lpc was doing fine (unlike 2011), people were angry with the cpc, and the bloc was getting stale. the ndp could have implemented itself as a strong economic left bloc. there is plenty of room for the ndp to have a place in canada, the liberals are still very pro-corporate, so the ndp could easily suggest some great support programs for provinces. there is especially plenty of room on foreign policy, it's so easy to point out faults with the liberals (selling guns to saudi arabia, wasting time sucking up to the un, etc.). 

singh has an opportunity. he was screwed in quebec even before this but it seems like they're not even trying to gain any more seats. i live in montreal, trust me, they could gain at least 2 other seats on the island (+ sherbrooke, college town!) if they try harder. not every part of the province is saguenay-lac st. jean. 3-4 seats ain't much, but it's a very good start to building credibility. most of us don't like overt religiousness but a lot more of us like ndp values than we're given credit for.

edit: removed an unfinished sentence.",liberals
gs2vavs,2021-03-24T04:40:05.000-07:00,lilley: trudeau bet on china over canada at height of pandemic [removed],liberals
gs2vnek,2021-03-24T04:42:30.000-07:00,"np: majority of canadians are feeling politically homeless, poll finds &gt; conservatives are centre left.

it's fair to say this is not a view that is shared widely among...just about anyone who follows canadian politics. you way want to consider recalibrating your scale here a little.",conservatives
gs2vnig,2021-03-24T04:42:32.000-07:00,"tim houston says federal conservative partys denial of climate change not helpful i mean, houston himself criticized the government in question period either late 2019, early 2020 for \"building electric car charging stations in cape breton, for all the people with expensive tesla's in inverness\", forgetting apparently that the point of cars is to drive them, and if we want people to transition we need to ensure them that they'll be able to charge their car. he's not a climate ally.",conservatives
gs2wsuf,2021-03-24T04:50:34.000-07:00,liberals maintain slight lead amid election buzz: mainstreet poll we'll get another liberal minority but maybe a different conservative leader. that's what is going to happen if we have an election.,liberals
gs2xpem,2021-03-24T04:56:43.000-07:00,"np: majority of canadians are feeling politically homeless, poll finds i never said it wouldn't amount to anything. i was just pointing it out as the reason why o'toole had to ignore his party's rejection of that resolution. fptp is flawed, but it can lead to changes. new zealand was able to make the change from fptp to pr. the only way we can change the system is through the current system (or i guess a violent revolution, but that's not what i want and it would never happen even if it was what i wanted).

what is your solution then? how do you get rid of people's apathy other than by working to change the system from within the system?",conservatives
gs2xu8g,2021-03-24T04:57:36.000-07:00,"np: majority of canadians are feeling politically homeless, poll finds well campaigning towards the centre isn't necessarily the problem. you can govern towards the centre and still be incredibly progressive's and enact comprehensive and meaningful reforms when necessary, not to mention that a lot of our best post war prime ministers were centrists (king, laurent, mulroney, chretien/martin etc.) the problem with the liberals is that they'd rather rest on their laurels due to a weak opposition than address the areas where reform is increasingly needed.",liberals
gs2yg8i,2021-03-24T05:01:48.000-07:00,tim houston says federal conservative partys denial of climate change not helpful i'd have a hard time distinguishing who is to the left of whom.  they seem to occupy exactly the same ideological space.,conservatives
gs2yktz,2021-03-24T05:02:41.000-07:00,"change in leadership rules shows conservative party's old fault lines haven't gone away ###this is a reminder to [read the rules before posting in this subreddit](https://www.reddit.com/r/canadapolitics/wiki/rules-thelongversion).
 
1. **headline titles should be changed only [when the original headline is unclear](https://www.reddit.com/r/canadapolitics/wiki/rules-thelongversion#wiki_1._headline_titles_should_be_changed_only_where_it_improves_clarity.)**
2. **be [respectful](https://www.reddit.com/r/canadapolitics/wiki/rules-thelongversion#wiki_2._be_respectful).**
3. **keep submissions and comments [substantive](https://www.reddit.com/r/canadapolitics/wiki/rules-thelongversion#wiki_3._keep_submissions_and_comments_substantive).**
4. **avoid [direct advocacy](https://www.reddit.com/r/canadapolitics/wiki/rules-thelongversion#wiki_4._avoid_direct_advocacy).**
5. **link submissions must be [about canadian politics and recent](https://www.reddit.com/r/canadapolitics/wiki/rules-thelongversion#wiki_5._link_submissions_must_be_canadian_and_recent).**
6. **post [only one news article per story](https://www.reddit.com/r/canadapolitics/wiki/rules-thelongversion#wiki_6._post_only_one_news_article_per_story).** ([with one exception](https://www.reddit.com/r/canadapolitics/comments/3wkd0n/rule_reminder_and_experimental_changes/))
7. **replies to removed comments or removal notices will be removed** without notice, at the discretion of the moderators.
8. **downvoting posts or comments**, along with urging others to downvote, **[is not allowed](https://www.reddit.com/r/canadapolitics/wiki/downvotes)** in this subreddit. bans will be given on the first offence.
9. **[do not copy &amp; paste the entire content of articles in comments](https://www.reddit.com/r/canadapolitics/wiki/rules-thelongversion#wiki_9._do_not_copy_.26amp.3b_paste_entire_articles_in_the_comments.)**. if you want to read the contents of a paywalled article, please consider supporting the media outlet.

*please [message the moderators](https://www.reddit.com/message/compose?to=%2fr%2fcanadapolitics) if you wish to discuss a removal.* **do not reply to the removal notice in-thread**, *you will not receive a response and your comment will be removed. thanks.*


*i am a bot, and this action was performed automatically. please [contact the moderators of this subreddit](/message/compose/?to=/r/canadapolitics) if you have any questions or concerns.*",conservatives
gs2yxsx,2021-03-24T05:05:12.000-07:00,"coyne: the same arguments? it would be nice if the tories made any i don't think explaining the ideas of \"climate change and global warming aren't real\" and \"abortion should be criminalized\" better to the public are going to help mr. coyne. the conservatives have been drifting further right for slightly longer than the last two elections and that rightward shift sunk them both times by increasing degrees. 

the vast majority of the canadian electorate do not want conservative government and policy and are willing to do everything within their power to stop it from happening. harper stayed in power by keeping that shit in the back locked up tight and as how it slowly seeped out since harper's last election is slowly been poisoning the cpc brand.",conservatives
gs2yy38,2021-03-24T05:05:15.000-07:00,"trudeau says he does not need mandate for pandemic budget because he already has one the word mandate bothers me at times. in theory sure a government *should* aim to focus on the priorities in their election platform and not devaite from those as much as possible. beyond that though it's not like a democratically elected government can't effectively due whatever they want (within the bounds of our constitution) once in office so long as they maintain the confidence of the house.

no trudeau does not need a \"mandate\" to do anything as long as the opposition parties don't decide to pass a vote of no confidence in his government.",liberals
gs2z7i0,2021-03-24T05:07:04.000-07:00,"rural ontario housing prices see ‘bigger dollar rise in one year than in the past 30 years combined’ i agree. they've already come out to say that interest rates won't rise right now and that is because they fear the result explained. young people are not going to vote for liberals like they did before so they're the sacrificial lamb. it's going to be a real mess when we have to sort out estates with no money and no experience.

if we had a party willing to address this with clear fiscal policy, i think it would be a winning electoral ticket. we can't talk about higher wages and ubi until we address these very fundamental issues.",liberals
gs2zhvb,2021-03-24T05:09:05.000-07:00,"trudeau says he does not need mandate for pandemic budget because he already has one well, the argument would be, the world has significantly changed since the 2019 election and as such the policies and platforms the parties campaigned on are now irrelevant to the needs/wants of most canadians. therefore, an election should be called so the government can govern with confidence. 

in actuality, it'd mostly be a pretext to trigger an election... so i guess trudeau/liberals aren't that interested in one (for now).",liberals
gs2zk2x,2021-03-24T05:09:31.000-07:00,"trudeau says he does not need mandate for pandemic budget because he already has one tbh i think there does need to be a new mandate for the pandemic budget considering its high price tag. but because they would probably get that mandate, the opposition opposes an election. funny how it works.",liberals
horia6q,2021-12-15T18:09:06.000-08:00,"trudeau open to discussing decriminalization of hard drugs i'm not aware of any cities which have actually followed through with a proper abolitionist program wherein police services are phased out in favour of a properly funded and implemented system of social supports and the necessary teams to provide them.

can you provide the examples you're speaking to?",liberals
horj0fx,2021-12-15T18:19:17.000-08:00,"trudeau open to discussing decriminalization of hard drugs minneapolis actually went through with \"abolish the police\" and carjacking alone went up 300% over the next month alone, after the fact.

 the \"autonomous zones\" that criminals and their anarchist friends tried to create generally fell apart due to chaos and criminality as well, and i'm just referring to minneapolis again.

seattle and portland are good cities to cite wherein the city government has largely neutered domestic law enforcement. and what paradises they are.

your fantasy about treating criminal recidivists with social workers and paycheques is hilarious all by itself. i bet you judge immigrants to this country if they're too socially conservative for your liking, don't you?

you seem like the type.",liberals
horj9cs,2021-12-15T18:22:36.000-08:00,"trudeau open to discussing decriminalization of hard drugs minneapolis cut the police budget by 4% and the police responded by mass resigning and refusing to enforce laws they were asked to, which is a well documented pressure tactic used by forces to punish politicians for acting against them. they also did nothing even remotely like replacing the existing force with the systems of social supports needed to make up for the social ills policing exists to violently suppress.

nice try, though.",liberals
horjzjv,2021-12-15T18:32:31.000-08:00,"he’s been attacked by the far right. but justin trudeau is more worried about the ‘casual cynicism’ of the left all those yoga teachers, organic vegans, and crystal healing ladies are far right?  the anti vaccine crowd is a pretty mixed bag from what i've seen. 

what is the actual definition of 'far right' redditors are now using? i've seen redditors claim we should mass arrest and imprison anti vaxx people, and then claim that anyone who disagrees is 'far right', lol.",liberals
hork74a,2021-12-15T18:35:21.000-08:00,"trudeau open to discussing decriminalization of hard drugs &gt;minneapolis cut the police budget by 4%

lol

jake frey and the minneapolis city council voted to \"abolish\" the minneapolis polic department. 

&amp;#x200b;

&gt; and the police responded by mass resigning and refusing to enforce laws they were asked to, 

lol

they just stepped back because they were asked to by jake \"woke\" frey and the minneapolis city council.

so much for \"troubled communities can police themselves\", per the wokes. regular citizens had to take the law into their own hands, hence the creation of the \"rooftop ramadans\" who wouldn't let \"marginalized folk\" loot and destroy their property. 

&amp;#x200b;

&gt;which is a well documented pressure tactic used by forces to punish politicians for acting against them. 

nope. 

i see you call them forces, like you want to quote that song by the known anarchist band rage against the machine.

&amp;#x200b;

&gt;they also did nothing even remotely like replacing the existing force with the systems of social supports needed to make up for the social ills policing exists to violently suppress.

yeah, every habitual criminal high school drop out just needs a nice cushy social worker to solve all their problems. they dropped out of high school to chop and to steal but they're society's victims, you see. 

&amp;#x200b;

&gt;nice try, though.

you lost this round, lol. god bless the leos.",liberals
horkuv7,2021-12-15T18:44:27.000-08:00,"trudeau government committing $1 billion to help provinces — and maybe cities — get rid of handguns https://toronto.citynews.ca/2021/04/23/gun-chase-smuggled-guns-border-toronto/

here's an article on it.  the vast majority of illegal guns in canada are smuggled from the states.  this handgun ban will do next to nothing to actually address gun crime in this country.  this is a wasted billion dollars when we can least afford it.",liberals
horl226,2021-12-15T18:47:12.000-08:00,he’s been attacked by the far right. but justin trudeau is more worried about the ‘casual cynicism’ of the left [removed],liberals
horn5oh,2021-12-15T19:14:40.000-08:00,conservatives believe 13 ridings were targeted by foreign interference in 2021 election i’d say more,conservatives
hornc6l,2021-12-15T19:16:53.000-08:00,trudeau government committing $1 billion to help provinces — and maybe cities — get rid of handguns [removed],liberals
hornwbb,2021-12-15T19:23:42.000-08:00,"trudeau government committing $1 billion to help provinces — and maybe cities — get rid of handguns you really think if we got rid of all the guns, the gangs in toronto will stop shooting at each other?",liberals
horpo9s,2021-12-15T19:44:57.000-08:00,"canada's home prices will rise 10.5% by the end of 2022, no immediate answer says liberals &gt;but my mortgage for a 2000 square foot house is less than rent for condos in an area i want to live.

you're realizing something that lots of people realized 20 years ago, mortgages are cheaper than rent, so why pay someone else's mortgage when you can pay your own.",liberals
horq4lb,2021-12-15T19:50:07.000-08:00,conservatives believe 13 ridings were targeted by foreign interference in 2021 election [removed],conservatives
h7ejsyn,2021-08-01T17:07:35.000-07:00,"'be ready for aug. 8’: some senior liberals expect to kick off federal election campaign in a week go say that in western canada. you think they are riled up about separation now… just imagine if that was brought in.. 

edit: i am not a separatist",liberals
h7enf5i,2021-08-01T18:01:03.000-07:00,'be ready for aug. 8’: some senior liberals expect to kick off federal election campaign in a week [removed],liberals
h7epk8d,2021-08-01T18:33:25.000-07:00,'be ready for aug. 8’: some senior liberals expect to kick off federal election campaign in a week [removed],liberals
h7ercm1,2021-08-01T19:00:46.000-07:00,'be ready for aug. 8’: some senior liberals expect to kick off federal election campaign in a week [removed],liberals
h7ergh9,2021-08-01T19:02:26.000-07:00,'be ready for aug. 8’: some senior liberals expect to kick off federal election campaign in a week [deleted],liberals
