h7t792j,2021-08-05T00:25:57.000-07:00,liberals ahead by 12 as election speculation heats up [removed],liberals
h7t7zce,2021-08-05T00:29:23.000-07:00,"trudeau is currently in majority territory - will it still be the case after a campaign? justin only worry is inflation and the issues it causes. so nobody can afford to buy a home, food is getting more expensive and we are starting to see labour issues. the border guards are the first, i expect nurses and others are not far behind.",liberals
h7t81q5,2021-08-05T00:29:46.000-07:00,liberals ahead by 12 as election speculation heats up curious who 338 has winning for ppc in that data. [from what i’m seeing they have ppc as not leading in any constituencies or even involved in any toss-ups.](https://338canada.com/districts.htm),liberals
h7t8855,2021-08-05T00:30:51.000-07:00,liberals ahead by 12 as election speculation heats up [removed],liberals
h7t8gft,2021-08-05T00:32:18.000-07:00,"federal polling (angus reid) - lpc 35%, cpc 30%, ndp 19%, bq 7%, other 6%, green 3% there is no reason to pay him any attention because he has nothing to say. the trudeau bad routine was played out a long time ago and it's boring. if he wants people to pay attention he needs to talk about policy and what they would do for canadians, otherwise it's just more noise.",liberals
h7t8isz,2021-08-05T00:32:43.000-07:00,"liberals ahead by 12 as election speculation heats up just so you know, you accidentally commented this three times.",liberals
h7t98tn,2021-08-05T00:37:12.000-07:00,liberals ahead by 12 as election speculation heats up [removed],liberals
h7taqzb,2021-08-05T00:46:28.000-07:00,liberals ahead by 12 as election speculation heats up thanks for the heads-up :),liberals
h7tc37a,2021-08-05T00:54:45.000-07:00,"trudeau is currently in majority territory - will it still be the case after a campaign? i do think he'll be prime minister after the campaign but i suspect it will be a minority. last time i remember singh being great in the debates and trudeau being pretty mediocre. trudeau could have improved more if he's worked on it but, since he's never tried to fix his speech pattern issue (which doesn't bother me tbh but i know it bothers a lot of people), i doubt it's been a priority for him. so, if that repeats, it could mean a gain for the ndp over the lpc. especially since there is no reason for those of us who prefer the ndp or greens to vote strategically right now with the cpc at such low numbers anyway. 

ultimately this is just speculation though and we can only wait and see what happens. probably soon since i've already started seeing some party attack ads during the commercials of my local news.",liberals
h7tckff,2021-08-05T00:58:08.000-07:00,"federal polling (angus reid) - lpc 35%, cpc 30%, ndp 19%, bq 7%, other 6%, green 3% it's the doug ford strategy where you disappear and hope that once you resurface people forget why they were annoyed with you and like you more. not sure how it'll work for o'toole but, sadly imo, it does seem to be working well for ford in ontario.",conservatives
gul1omr,2021-04-14T18:25:06.000-07:00,"conservative leader erin o'toole confirms that free vote is allowed on mp cathay wagantall's ‘sex-selective abortion’ bill i've read other comments and only a handful touches upon the real issue, cultural &amp; familial pressure onto the woman. in a lot of asian culture, the husband's mother is basically the top-matriacrch, and she could influence the daughter-in-law through cultural reasoning (often to have a male heir to carry the surname). 

socons approach this problem very narrow-mindedly. i would advocate for *women's rights* and *women's education*, letting them know their body is their choice. external pressure be damned. however i doubt socons would like to empower women as well.",conservatives
gul1rfx,2021-04-14T18:26:27.000-07:00,"pm talking to opposition leaders ahead of budget, as o'toole balks at basic income [removed]",conservatives
gul1rgi,2021-04-14T18:26:28.000-07:00,conservative leader erin o'toole confirms that free vote is allowed on mp cathay wagantall's ‘sex-selective abortion’ bill no green candidate is allowed to run without affirming to the party (and being vetted to confirm) their full commitment to a woman's right to control her body. we're pro-choice. full stop.,conservatives
gul3hbi,2021-04-14T18:56:03.000-07:00,trudeau says he supports restricting interprovincial travel when necessary to stem spread of covid-19 [removed],liberals
gul3rpn,2021-04-14T19:00:59.000-07:00,trudeau to issue formal apology for treatment of italian-canadians during second world war [removed],liberals
gul44m6,2021-04-14T19:07:10.000-07:00,"conservatives' climate plan would replace liberal carbon tax with lower one of their own ###this is a reminder to [read the rules before posting in this subreddit](https://www.reddit.com/r/canadapolitics/wiki/rules-thelongversion).
 
1. **headline titles should be changed only [when the original headline is unclear](https://www.reddit.com/r/canadapolitics/wiki/rules-thelongversion#wiki_1._headline_titles_should_be_changed_only_where_it_improves_clarity.)**
2. **be [respectful](https://www.reddit.com/r/canadapolitics/wiki/rules-thelongversion#wiki_2._be_respectful).**
3. **keep submissions and comments [substantive](https://www.reddit.com/r/canadapolitics/wiki/rules-thelongversion#wiki_3._keep_submissions_and_comments_substantive).**
4. **avoid [direct advocacy](https://www.reddit.com/r/canadapolitics/wiki/rules-thelongversion#wiki_4._avoid_direct_advocacy).**
5. **link submissions must be [about canadian politics and recent](https://www.reddit.com/r/canadapolitics/wiki/rules-thelongversion#wiki_5._link_submissions_must_be_canadian_and_recent).**
6. **post [only one news article per story](https://www.reddit.com/r/canadapolitics/wiki/rules-thelongversion#wiki_6._post_only_one_news_article_per_story).** ([with one exception](https://www.reddit.com/r/canadapolitics/comments/3wkd0n/rule_reminder_and_experimental_changes/))
7. **replies to removed comments or removal notices will be removed** without notice, at the discretion of the moderators.
8. **downvoting posts or comments**, along with urging others to downvote, **[is not allowed](https://www.reddit.com/r/canadapolitics/wiki/downvotes)** in this subreddit. bans will be given on the first offence.
9. **[do not copy &amp; paste the entire content of articles in comments](https://www.reddit.com/r/canadapolitics/wiki/rules-thelongversion#wiki_9._do_not_copy_.26amp.3b_paste_entire_articles_in_the_comments.)**. if you want to read the contents of a paywalled article, please consider supporting the media outlet.

*please [message the moderators](https://www.reddit.com/message/compose?to=%2fr%2fcanadapolitics) if you wish to discuss a removal.* **do not reply to the removal notice in-thread**, *you will not receive a response and your comment will be removed. thanks.*


*i am a bot, and this action was performed automatically. please [contact the moderators of this subreddit](/message/compose/?to=/r/canadapolitics) if you have any questions or concerns.*",conservatives
gul45zs,2021-04-14T19:07:51.000-07:00,trudeau to issue formal apology for treatment of italian-canadians during second world war [removed],liberals
gul50rs,2021-04-14T19:22:40.000-07:00,"just 11% of albertans highly impressed with conservative leader erin o'toole: poll ###this is a reminder to [read the rules before posting in this subreddit](https://www.reddit.com/r/canadapolitics/wiki/rules-thelongversion).
 
1. **headline titles should be changed only [when the original headline is unclear](https://www.reddit.com/r/canadapolitics/wiki/rules-thelongversion#wiki_1._headline_titles_should_be_changed_only_where_it_improves_clarity.)**
2. **be [respectful](https://www.reddit.com/r/canadapolitics/wiki/rules-thelongversion#wiki_2._be_respectful).**
3. **keep submissions and comments [substantive](https://www.reddit.com/r/canadapolitics/wiki/rules-thelongversion#wiki_3._keep_submissions_and_comments_substantive).**
4. **avoid [direct advocacy](https://www.reddit.com/r/canadapolitics/wiki/rules-thelongversion#wiki_4._avoid_direct_advocacy).**
5. **link submissions must be [about canadian politics and recent](https://www.reddit.com/r/canadapolitics/wiki/rules-thelongversion#wiki_5._link_submissions_must_be_canadian_and_recent).**
6. **post [only one news article per story](https://www.reddit.com/r/canadapolitics/wiki/rules-thelongversion#wiki_6._post_only_one_news_article_per_story).** ([with one exception](https://www.reddit.com/r/canadapolitics/comments/3wkd0n/rule_reminder_and_experimental_changes/))
7. **replies to removed comments or removal notices will be removed** without notice, at the discretion of the moderators.
8. **downvoting posts or comments**, along with urging others to downvote, **[is not allowed](https://www.reddit.com/r/canadapolitics/wiki/downvotes)** in this subreddit. bans will be given on the first offence.
9. **[do not copy &amp; paste the entire content of articles in comments](https://www.reddit.com/r/canadapolitics/wiki/rules-thelongversion#wiki_9._do_not_copy_.26amp.3b_paste_entire_articles_in_the_comments.)**. if you want to read the contents of a paywalled article, please consider supporting the media outlet.

*please [message the moderators](https://www.reddit.com/message/compose?to=%2fr%2fcanadapolitics) if you wish to discuss a removal.* **do not reply to the removal notice in-thread**, *you will not receive a response and your comment will be removed. thanks.*


*i am a bot, and this action was performed automatically. please [contact the moderators of this subreddit](/message/compose/?to=/r/canadapolitics) if you have any questions or concerns.*",conservatives
h80r5ih,2021-08-06T14:24:15.000-07:00,"‘a slippery slope’: liberals’ proposed online harms bill raises serious privacy, free speech concerns, say experts [deleted]",liberals
h80svyg,2021-08-06T14:41:59.000-07:00,globe editorial: justin trudeau is about to call an unneeded pandemic election. the least he can do is help make it a safe one [deleted],liberals
h80tq5b,2021-08-06T14:50:57.000-07:00,conservatives outline plan for bold new international human rights agenda [removed],conservatives
h80u0f0,2021-08-06T14:54:01.000-07:00,"blanchet says he aims to increase seat count, bloc presence in montreal &gt; while french parts (north, east) tend to vote for the npd or the bloc. 

the ndp only had a meaningful presence in montreal during two elections, so \"tend\" might be a bit strong here. 

also, at this point, the bloc isn't strong even in the francophone areas of montreal. they haven't won more than a single seat in montreal since 2008.

ultimately, large numbers of francophone and allophone quebeckers vote liberal was well. that's particularly true in montreal - they won every seat but two here, and while yes, montreal is one of the more anglophone parts of the province, anglophones still only make up ~15% of the population in montreal. in the province as a whole, less than 10% of the population are anglophones, yet the liberals got over a third of the popular vote.",liberals
h80v0b4,2021-08-06T15:04:55.000-07:00,"‘a slippery slope’: liberals’ proposed online harms bill raises serious privacy, free speech concerns, say experts [removed]",liberals
h80wqun,2021-08-06T15:24:39.000-07:00,"alberta premier says he won't \"take lectures\" from federal health minister on covid-19 &gt; we're not going to ... take lectures from minister hajdu, particularly when it appears that she and her boss (prime minister) justin trudeau are hell-bent on a federal election campaign,\" kenney said friday at a news conference in bowden, alta., about drought support for farmers.

kenney’s had the worst performance of all the premiers during this pandemic, but he’s got a point. it’s pretty hypocritical of the feds to say alberta’s being reckless while they’re on the cusp of calling an opportunist election during the beginning of the fourth wave.

edit: yeah, not really surprised at the heavy downvotes. this is also the only place on the internet that the internet censorship bill wasn’t outright lambasted too. your heavy lpc bias is showing again r/canadapolitics lol.",liberals
h80x5pm,2021-08-06T15:29:28.000-07:00,"‘a slippery slope’: liberals’ proposed online harms bill raises serious privacy, free speech concerns, say experts [removed]",liberals
h80xe25,2021-08-06T15:32:11.000-07:00,"‘a slippery slope’: liberals’ proposed online harms bill raises serious privacy, free speech concerns, say experts there’s a stark difference between social media and private companies and government. government has far more power over our lives than tech companies, despite the vast influence the media and tech companies have.",liberals
h80xew9,2021-08-06T15:32:28.000-07:00,"‘a slippery slope’: liberals’ proposed online harms bill raises serious privacy, free speech concerns, say experts [removed]",liberals
h80xl2r,2021-08-06T15:34:30.000-07:00,"‘a slippery slope’: liberals’ proposed online harms bill raises serious privacy, free speech concerns, say experts [removed]",liberals
h80xzef,2021-08-06T15:39:15.000-07:00,"‘a slippery slope’: liberals’ proposed online harms bill raises serious privacy, free speech concerns, say experts [removed]",liberals
hfa64co,2021-10-03T08:29:28.000-07:00,will justin trudeau’s new government get serious on canada’s widening wealth inequality? rule 3,liberals
hfa6xle,2021-10-03T08:35:29.000-07:00,"issam saleh: the conservatives cannot afford to alienate muslims if they hope to win next time around but why are the intrests of immigrants bad? its not like they are giving money to immigrants. sure they send some money home, but they also pay rent and buy things, things that contribute to the economy. they also usually take the jobs no one else wants. if the conservative movement/platform isn't appealing to immigrants then maybe we should try to make it more appealing.  i hope my questions don't come off as idiotic or annoying.",conservatives
hfa7tvx,2021-10-03T08:42:00.000-07:00,"justin trudeau may have needed a holiday, but he chose the wrong day to take it lol, i am clearly never going to convince you that i am not a trudeau supporter unless i say he should be flayed alive and burned at the stake. the best i can do is the unedited comment that i started with:

&gt;i think trudeau is in the wrong and should have done something else with his day.

it's not partisan to simply say he was in the wrong. seems pretty clear to everyone at this point. most of the top comments here are trashing trudeau. i even suggested other things to compare this incident to, like trump not showing for the 20th anniversary of 9/11 and hosting a boxing match instead. if you have an example of where i defended him, please quote me. this whole thread is just repeatedly saying that your initial comparison was hyperbolic, and you continue to be hyperbolic in your description of trudeau's wrongdoing here.

the trudeau to cruz comparison was bad. even all the other people in this post trashing trudeau don't seem to agree that it was a good comparison.",liberals
hfa8fce,2021-10-03T08:46:29.000-07:00,trudeau apologizes to first nation in b.c. for not following up on truth and reconciliation day invite [deleted],liberals
hfa95ry,2021-10-03T08:52:03.000-07:00,"trudeau's got a cabinet to build — and this time, it'll be harder they're extremely scummy landlords who manage lots of apartments in halifax. i have had the misfortune of renting from them, and it was a terrible experience. they're widely considered slumlords, and she is (was?) their lawyer, so she can't claim any distance from them",liberals
hfaa9ej,2021-10-03T09:00:18.000-07:00,"trudeau's got a cabinet to build — and this time, it'll be harder and that’s why we have government of hypocrites.",liberals
hfaat6s,2021-10-03T09:04:28.000-07:00,trudeau apologizes to first nation in b.c. for not following up on truth and reconciliation day invite [removed],liberals
hfaaujh,2021-10-03T09:04:46.000-07:00,"will justin trudeau’s new government get serious on canada’s widening wealth inequality? well just to be pedantic, bail-outs are very anti-capitalist. you are basically supporting unproductive businesses and siphoning off capital that could go to more productive businesses. this is why we have companies like bombardier, which ought to have failed a long time ago, being held hostage by the family founders.",liberals
hfab08u,2021-10-03T09:06:00.000-07:00,"justin trudeau may have needed a holiday, but he chose the wrong day to take it no one else replied. except you. so no, get off your high horse and quit pretending that the entire world is behind you (lmfao). if it was a bad comparison, i simply would not have made it. end of story. but you continue to misunderstandmy point which has been clearly conveyed since the very first post. and i've spelled it out for you repeatedly, so that's 100% on you, not me. it doesn't seem like you're very good at this whole internet thing, so i suggest you take a break at this point, to be honest. 

i mean the fact that you're now referring to meaningless \"reddit internet points\" when i already explained to you how that works in a community with overall favour towards one of the mainstream points of view, simply demonstrates an inability to think critically on your end.",liberals
hfac2do,2021-10-03T09:14:14.000-07:00,trudeau apologizes to first nation in b.c. for not following up on truth and reconciliation day invite [removed],liberals
hface4o,2021-10-03T09:16:47.000-07:00,trudeau apologizes to first nation in b.c. for not following up on truth and reconciliation day invite [removed],liberals
hfacu54,2021-10-03T09:20:19.000-07:00,"trudeau apologizes to first nation in b.c. for not following up on truth and reconciliation day invite &gt; working largely on zoom for over a year, and taking a hybrid ceremonies-and-zoom approach for this? i can see how a person would think that was reasonable.

i would have agreed with this point if this was before the election. trudeau specifically went out of his way to do as many in person events as possible during the campaign even as opposition parties were doing tele-town halls.",liberals
hfadpv2,2021-10-03T09:27:21.000-07:00,"intentions de vote au fédéral pour les électeurs de chaque parti provincial &gt; traditional quebecois culture is conservative 

yes, but \"traditional quebecois culture\" has not been dominant in québec since the quiet revolution.  the modern culture is fanatically secularist and has a strong resentment of all things associated with anglo culture when they are in québec (like, for example, the conservative party). 

modern culture here is conservative in the sense that it wants to conserve something.  i am just not convinced that the things people want to conserve in québec are worth conserving.  and at the provincial level, the contents of what you want to conserve are the most relevant thing. 
 
and at the federal level, if i am nationalist, why would i vote for the conservative party when i can vote for the bloc?  are you seriously going to try to convince me that a party that wins 10 seats in québec (on a good day) out of its ~120 seats will look after québec's interests better than the bloc, who have no interests outside of the province?  

the reason the conservative party is not successful with many nationalists is because whatever they can promise, the bloc can promise more.  most people who vote conservative in québec right now do not vote that way out of nationalism.  they're mostly older, middle-class people who want lower taxes and better job opportunities.

&gt;!en bref, la révolution tranquille et ses conséquences ont été un désastre pour l'humanité!&lt;

edited because i realized my word order was confusing.",conservatives
h8r2000,2021-08-12T15:35:49.000-07:00,canada pm trudeau is planning to call snap election for sept 20 -sources elections  canada is where i get all my covid information...,liberals
h8r210j,2021-08-12T15:36:09.000-07:00,"canada pm trudeau is planning to call snap election for sept 20 -sources at this point, the ppc is a fringe party. time will tell if they can eventually grow into a real party, but right now - less than 2% of votes cast and only one candidate anyone can name? that's practically the definition of a fringe party.",liberals
h8r26qu,2021-08-12T15:37:58.000-07:00,"canada pm trudeau is planning to call snap election for sept 20 -sources no, they don't have to happen as soon as possible - byelections need to happen within six months of a seat becoming vacant.",liberals
h8r295q,2021-08-12T15:38:44.000-07:00,"canada pm trudeau is planning to call snap election for sept 20 -sources no we didnt. halloween sure, but it still wasn't ok to black face in the 90s, let alone do it so many times that you can't remember how many times",liberals
h8r2hm6,2021-08-12T15:41:26.000-07:00,canada pm trudeau is planning to call snap election for sept 20 -sources [removed],liberals
h8r3ob9,2021-08-12T15:55:20.000-07:00,"typical 'vaccine hesitant' person is a 42-year-old ontario woman who votes liberal: abacus polling read [this exchange](https://www.reddit.com/r/canadapolitics/comments/p2ojbb/typical_vaccine_hesitant_person_is_a_42yearold/h8mgau5?context=1) - i don't think the difference between hesitancy and refusal is even obvious to everyone commenting on this sub (whose participants skew heavily towards people inclined to critically analyze headlines!). in terms of how a headline like this would be read/interpreted by the average person just scanning the headline, i think it's obvious that a huge proportion of people will take away the message \"liberals are anti vaxers too?\" and won't consider digging any deeper into what the data actually tell us in this case.",liberals
h8r42rw,2021-08-12T16:00:13.000-07:00,"canada pm trudeau is planning to call snap election for sept 20 -sources well there’s the people’s party. they hate immigrants, vaccines, and cow farmers.

you’re right about the federal greens. they’re in the midst of an ongoing civil war. ontario greens are doing fine.",liberals
h8r4ml3,2021-08-12T16:06:49.000-07:00,canada pm trudeau is planning to call snap election for sept 20 -sources to me it all depends on whether bernier makes it into the debates again this year. at the moment they're either minor or fringe depending on the upcoming decision of the leaders' debates commission.,liberals
h8r4s6b,2021-08-12T16:08:39.000-07:00,canada pm trudeau is planning to call snap election for sept 20 -sources [removed],liberals
h8r4vgo,2021-08-12T16:09:47.000-07:00,"canada pm trudeau is planning to call snap election for sept 20 -sources officially, \"canadians deserve a chance to choose who they want to lead them in the years ahead as we recover from the pandemic\"

unofficially, \"oh look, the liberals are 9 points up in the polls\"",liberals
h8r521o,2021-08-12T16:12:02.000-07:00,"canada pm trudeau is planning to call snap election for sept 20 -sources but [only with a two-thirds vote of parliament](https://www.justice.gc.ca/eng/csj-sjc/rfc-dlc/ccrf-ccdl/check/art4.html), so unless one party wins in a mulroney-style landslide they can't postpone the next election without the opposition agreeing to it.",liberals
h8r5255,2021-08-12T16:12:04.000-07:00,canada pm trudeau is planning to call snap election for sept 20 -sources he’s promised to remove trudeau’s carbon tax and replace it with his own carbon tax. so are you going to vote for him?,liberals
h8r5cax,2021-08-12T16:15:30.000-07:00,"canada pm trudeau is planning to call snap election for sept 20 -sources i can't see why he would. he couldn't even win his own seat last time, and the ppc hasn't polled high enough to make it out of the \"other\" bucket. annamie paul probably won't even get invited to those, and the greens have won seats in multiple elections and are polling around 5%.",liberals
h8r5ikv,2021-08-12T16:17:40.000-07:00,canada pm trudeau is planning to call snap election for sept 20 -sources i’m fairly confident some of the parties will propose a housing plan once the campaign begins. i’d suggest a “wait and see” approach.,liberals
h8r5orl,2021-08-12T16:19:45.000-07:00,"canada pm trudeau is planning to call snap election for sept 20 -sources to be invited a party must satisfy at least two of the following (at least, these were the qualifications last time around):

1. have at least one member elected under the party's banner;
2. nominate candidates to run in at least 90% of all ridings; and
3. have captured at least 4% of the votes in the previous election or be considered by the commissioner to have a legitimate chance to win seats in the current election, based on public opinion polls.

the ppc doesn't qualify for #1, but they can probably pull off #2 fairly easily, and #3 will depend on how well bernier can campaign in the next week or two. the greens qualify for #1 and can probably pull off #2 pretty easily, so they'll score an invite.",liberals
h8r5p1x,2021-08-12T16:19:51.000-07:00,canada pm trudeau is planning to call snap election for sept 20 -sources wasn't that raybold,liberals
h8r6x4w,2021-08-12T16:35:10.000-07:00,"canada pm trudeau is planning to call snap election for sept 20 -sources you sound like an ndp voter. why don’t you vote for them instead? not likely to do so myself but curious why you wouldn’t consider them if your primary concern is corruption, electoral reform, environmental policy, or first nations issues. this is all ndp turf.",liberals
