h1g8dp4,2021-06-11T07:29:29.000-07:00,trudeau consults queen on process for picking a new governor general this is correct.,liberals
h1g8q8c,2021-06-11T07:32:16.000-07:00,"justin trudeau promises 'action' on anti-muslim hate, but won’t fight quebec’s anti-muslim law [removed]",liberals
h1g8uc5,2021-06-11T07:33:11.000-07:00,adam zivo: everyone seems to agree the gay blood ban should be repealed. why are obstinate liberals still standing in the way? probably just comes down to logistics and cost imo. the science is there but screening costs shoot up a ton if they repeal the ban.,liberals
h1g8vex,2021-06-11T07:33:25.000-07:00,"opinion: trudeau will fight discrimination against muslims – so long as they don’t live in quebec used incorrectly, how? i already told you. their definition of discrimination makes any dress code or code of conduct discrimination. 

the quebec superior court upheld bill 21.",liberals
h1g8xm6,2021-06-11T07:33:55.000-07:00,"ontario to recall legislature, invoke notwithstanding clause over ruling on election advertising first of all, this is not a democratic issue, its a rule of law issue. in fact, letting loose with s.33 is entirely democratic, as it gives full voice to the will of the electorate - consequences be damned. 

majoritarian abuse is a substantial danger of unrestricted democracy, which is why we had the charter in the first place. if anything, my modest proposal to let loose with s.33, which i hope you understand is made largely tongue in cheek, is hyper-democratic. 

second, you cannot have it both ways. 

either using s.33 is an outrage, and we should be outraged and force a real confrontation that could lead to a lasting peace by constitutional amendment, or it is a perfectly normal thing to use, and we should use it on the same footing as anyone else might. 

pretending that s.33 is only an outrage when used to protect minorities is bizarre self-flagellation that will get us nowhere. 

judging from some of your other posts, you may know just how much is at stake here. like it or not,  the push to normalise s.33 is a slow-burn attack on minority rights, including gay family rights. 

as i see it, we have two chances to avoid disaster:

1) succeed in amending the \"ontario constitution\" by mutual passage through the ontario and canadian legislatures of new sections restricting the use of s.33 in ontario, whether by requiring a \"two key\" system of federal and provincial consent, confirming referendum or supermajority;

2) come out swinging with a full throated progressive rebuttal to ford's causal partisan use of s.33 to remind conservatives of why these protections are so important and why its probably a very good idea to support option 1, or else face a culture war the cannot hope to win.

or we can go with the ever popular option 3, of smiling and being nice and saying softly \"please don't hurt us.\" i've never known that third option to work, but perhaps you know something i don't. at the very least, it would not hurt our precious civility.",conservatives
h1g999y,2021-06-11T07:36:28.000-07:00,"maxime bernier getting arrested in st. pierre manitoba muh freedom! 

every day i become more thankful the cpc didn't elect this clown as leader. all he does is help hand swing ridings to trudeau.",liberals
h1g9dsm,2021-06-11T07:37:29.000-07:00,"opinion: trudeau moves to the middle on quebec good analysis, thank you. think on this i will.",liberals
h1g9iky,2021-06-11T07:38:34.000-07:00,"trudeau consults queen on process for picking a new governor general well, it's been 140 days of vacancy so far.  if the pm is going to get the shortlist in the next few days, perhaps we'll have someone named by day 150.",liberals
h1g9n4i,2021-06-11T07:39:34.000-07:00,green party mp jenica atwin crossing the floor to join liberals you know what i'm talking about.,liberals
h1ga2di,2021-06-11T07:42:55.000-07:00,"opinion: trudeau will fight discrimination against muslims – so long as they don’t live in quebec &gt;their definition of discrimination makes any dress code or code of conduct discrimination.

no it doesnt, because wearing shorts is not legally the same as wearing a yarmulke, despite your insistence they are.

see bhinder v. cn

see the etobicoke test

see syndicat northcrest v amselem

&gt; the quebec superior court upheld bill 21.

because of article 33, not because it wasn't discriminatory.",liberals
h1ga8d0,2021-06-11T07:44:17.000-07:00,"ivison: collapse of the green vote could help trudeau win next election paul was may's hand-picked successor. visit may's riding in victoria and you will see who her base is. it isn't pretty lol.

greens are dodging over the isreal-palestine issue, of all things. also, with all the parties embracing an environmental policy, their wedge issue is fading. they had the most disjointed base of any party; righties and lefties who happened to have the environment as their #1 issue. now that there are other homes for it, their usefulness as a party is fading. personal loyalty to may \\*was\\* the party.",liberals
h1gaa4m,2021-06-11T07:44:40.000-07:00,"justin trudeau promises 'action' on anti-muslim hate, but won’t fight quebec’s anti-muslim law if we want a separation of church and state then a government employee should not wear religious symbols. even if some religious symbols are bigger and more apparent than others.",liberals
h1gaclz,2021-06-11T07:45:12.000-07:00,adam zivo: everyone seems to agree the gay blood ban should be repealed. why are obstinate liberals still standing in the way? [deleted],liberals
h1gagdc,2021-06-11T07:46:03.000-07:00,"justin trudeau promises 'action' on anti-muslim hate, but won’t fight quebec’s anti-muslim law lost in the discussion about whether 21 is racists is that the federal government has limited means of opposing it, so if you object you should either be directing your ire to politicians in quebec city rather than ottawa to change it

its not ottawa's responsibility under our system of government to prevent quebec from being racist in areas of sovereign responsibility. quebec is responsible to itself.",liberals
h1gakwq,2021-06-11T07:47:05.000-07:00,"justin trudeau promises 'action' on anti-muslim hate, but won’t fight quebec’s anti-muslim law [removed]",liberals
h1gaq6i,2021-06-11T07:48:16.000-07:00,"adam zivo: everyone seems to agree the gay blood ban should be repealed. why are obstinate liberals still standing in the way? i meant testing batches of donated blood, they don't test them individually.",liberals
h1gav17,2021-06-11T07:49:22.000-07:00,"trudeau consults queen on process for picking a new governor general fun spin, but i’d bet good money that this was not a process discussion. two reasons for this:

1) the process has been in place for months, and is at its end.

2) the queen has to approve the prime minister’s final choice.

it wouldn’t make sense (and would be a waste of both her majesty’s and the prime minister’s time) to set up a formal audience in early june to talk about the process, just to have another audience in mid-june to confirm the final decision.

minister leblanc said today the pm “hasn’t made a final decision” but that a shortlist will be coming to him “in a few days.” my guess is that he already has the shortlist in hand, with a preference in mind, and today presented the queen with the shortlist and his preference, and briefed her on the process that was followed.

why not just tell the public that? well, really just two reasons:

1) saying “we have a shortlist, stay tuned” primes the pump for an announcement when the pm returns from the g7 (and has finished quarantine);

2) choice made or not, the final vetting is probably still happening and with no announcement made they still have time and room to back out and make a different choice if necessary.

so it isn’t written in stone, but odds are very good the choice has been made, and the queen has been informed and provided her consent.",liberals
h1gaxkz,2021-06-11T07:49:57.000-07:00,adam zivo: everyone seems to agree the gay blood ban should be repealed. why are obstinate liberals still standing in the way? removed for rule 6.,liberals
h1gb7fx,2021-06-11T07:52:13.000-07:00,"canada will not approve new thermal coal mining projects, cites environmental damage well, if we're going to have a corridor, we'll need some sort of government program to administer it. since it's national, and concerns energy we could call it the... national energy program. i'm sure alberta will love trudeau for introducing it.",liberals
h1gb9zz,2021-06-11T07:52:47.000-07:00,"justin trudeau promises 'action' on anti-muslim hate, but won’t fight quebec’s anti-muslim law [removed]",liberals
h1gbdmv,2021-06-11T07:53:35.000-07:00,"opinion: trudeau will fight discrimination against muslims – so long as they don’t live in quebec discrimination isn’t only a legal term. you can’t say that something is only discrimination if it violates the charter. i have no idea why you can’t understand that. 

they still upheld it. you rely on the charter to define everything, then you have to go with the courts decision that’s based on the charter. 

if i was you i’d construct an argument that didn’t rely on the charter as this law seems to be have been passed in accordance with said charter.",liberals
h1gbvze,2021-06-11T07:57:47.000-07:00,"green party mp jenica atwin crossing the floor to join liberals there's a difference between begging and mutual support. it's also not entirely their fault, the provincial ndp was decimated after cardy left and has yet to recover which continues to cripple their support at both levels. it's a long road to recovery but supporting them will help them get there.",liberals
h1gc381,2021-06-11T07:59:29.000-07:00,"justin trudeau promises 'action' on anti-muslim hate, but won’t fight quebec’s anti-muslim law look, define \"fight\". there's basically 3 options.

1) get federal politicians to condemn quebec: would only harden attitudes here and wouldn't overturn bill 21.

2) allow the court challenge to bill 21 to go though. this is being done now. sometimes this works.

3) use the never used federal override clause in the constitution and go to political war with about 70 (includes bill 21 supporters) to 90% (includes opponents who think this is none of the roc's  buisness) of francophone quebec. respond to english moderates saying \"my canada includes quebec\" with \"my canada doesn't include predjudice\". dare quebec to put a knife to the throat of the confederation. 

this could work, historically overwhelming external pressure has against institutional predjudice. this is something i've thought of.

but this will dominate all the political oxygen, all of it, until the next inevitable referendum, which might well not be won. if you really care this badly about this, tell me you'll pressure jagmeet to do this, and shoot for a borden-like majority while being mired around 5% at best in francophone quebec, and ram this thing through.

anything other than 2 or 3, unless you bring in a very culturally informed argument on 1 or are just very quebecois, is frankly a waste of time.",liberals
h1gcg1i,2021-06-11T08:02:28.000-07:00,"opinion: trudeau will fight discrimination against muslims – so long as they don’t live in quebec &gt;  you can’t say that something is only discrimination if it violates the charter.

where did i say that?

&gt; you can’t say that something is only discrimination if it violates the charter.

which is why i referenced two court cases that say non bona fide restrictions are discriminatory.",liberals
h1gd8a3,2021-06-11T08:09:05.000-07:00,"opinion: trudeau will fight discrimination against muslims – so long as they don’t live in quebec you defined discrimination as ‘infringes charter rights’ again and again and again. 

i don’t believe that that narrow a description is the only thing that matters. i also don’t put much truck in rights upheld by the charter as they can be disregarded at will as it is.",liberals
h1gdr62,2021-06-11T08:13:37.000-07:00,"opinion: trudeau will fight discrimination against muslims – so long as they don’t live in quebec i said that if it infringes rights, thats means its discrimination.

i didn't say the opposite.

in either case, my definition is pointless, bill 21 remains discriminatory, despite its legality (as per section 33)",liberals
h1ge5n3,2021-06-11T08:17:05.000-07:00,"ivison: collapse of the green vote could help trudeau win next election &gt;may didn't want to lead. i'm not sure if she'll even run for re-election

her not wanting to lead doesn't mean her leaving wasn't worse for the party",liberals
h1ge6j0,2021-06-11T08:17:17.000-07:00,"opinion: trudeau will fight discrimination against muslims – so long as they don’t live in quebec yes, it’s just as discriminatory as all dress codes and codes of conduct, i agree.",liberals
h1gesa2,2021-06-11T08:22:32.000-07:00,"opinion: trudeau will fight discrimination against muslims – so long as they don’t live in quebec &gt;discriminatory as all dress codes

again, wearing shorts isnt charter protected, religious garments are.  they are not \"as discriminatory\" blocking the latter is generally illegal.",liberals
h1gfapl,2021-06-11T08:27:03.000-07:00,trudeau consults queen on process for picking a new governor general [removed],liberals
h1gftfe,2021-06-11T08:31:32.000-07:00,"opinion: trudeau will fight discrimination against muslims – so long as they don’t live in quebec generally illegal is meaningless. it’s obviously legal or the court wouldn’t have upheld it.

and again, discrimination does not only equal charter protected.",liberals
h98lphy,2021-08-16T12:09:08.000-07:00,"2021 conservative party platform: \"canada's recovery plan\" &gt; they should have gone with the second picture

the one where he's trapped in the bottom of a well?",conservatives
h98ls3y,2021-08-16T12:09:43.000-07:00,"trudeau calls federal election, voters to go to the polls sept. 20 i am willing to bet they are rushing to push the great reset plan as fast as possible. people are waking up quickly to whats going on. i find it very convenient that a government is trying to increase their power right as they are trying to force experimental vaccines on people.",liberals
h98lubm,2021-08-16T12:10:11.000-07:00,erin o'toole's campaign hits the rocks before it even sets sail [removed],conservatives
h98lzhy,2021-08-16T12:11:19.000-07:00,"welcome to the 44th canadian general election! o'toole was the one that came up with a carbon tax, more or less against the party delegates that voted down climate change policy.",conservatives
h98mtmh,2021-08-16T12:17:56.000-07:00,"trudeau vows to extend business supports to march, as o’toole proposes scrapping liberal child-care plan in platform release it’s too costly at this point and the worst of the pandemic is behind us. things are reopening now so there’s really no justification for financial relief to businesses or individuals.",liberals
h98n1vn,2021-08-16T12:19:44.000-07:00,"conservatives release full platform promising billions of dollars in new pandemic aid if that 5% tax credit on capital investments includes buying existing (residential) housing, that could make the market heat up even more.",conservatives
h98n5an,2021-08-16T12:20:29.000-07:00,"trudeau vows to extend business supports to march, as o’toole proposes scrapping liberal child-care plan in platform release first you have to have the cash in hand to pay out to get your 75% back. it’s expensive to be low income!",liberals
h98na48,2021-08-16T12:21:33.000-07:00,"liberals failed to win any seats in alberta in 2019 but are now competitive in at least four ridings, say top strategists and insiders the liberals might have a shot in edmonton centre. running randy again they have name recognition but there is a downside for them doing that. edmonton griesbach may very well go ndp and they will hold edmonton strathcona. that’s it. probably 2 ndp seats and a bunch of tory fence posts. as an albertan i wish federal elections provided more drama but oh well.",liberals
h98ncth,2021-08-16T12:22:08.000-07:00,"welcome to the 44th canadian general election! trudeau claims he needs the election for a mandate on covid recovery, but the ndp said they would support any of the motions he is talking about.",liberals
h98nhy9,2021-08-16T12:23:16.000-07:00,erin o'toole's campaign hits the rocks before it even sets sail [removed],conservatives
h98nzdc,2021-08-16T12:27:08.000-07:00,"doug ford was justin trudeau’s punching bag in 2019. for this campaign, insiders say, the leaders have called a truce i think it's a symptom of the same disease, so while it doesn't increase the chances of a federal split in and of itself, it certainly doesn't auger well for the cpc either.",liberals
h98o38b,2021-08-16T12:28:00.000-07:00,"doug ford was justin trudeau’s punching bag in 2019. for this campaign, insiders say, the leaders have called a truce &gt;i don't think liberals have lost much support here in southern ontario since 2 years ago.

if anything, their pandemic process has made them even more popular. 

i would not be surprised at all to see the liberals *sweep* the greater toronto area this time around. they came within four seats of doing so in 2019, and they were within very close margins of winning the four seats they did lose.",liberals
h98o54x,2021-08-16T12:28:25.000-07:00,"2021 conservative party platform: \"canada's recovery plan\" unimpressed. a lot of the same standard stuff we always see from the conservatives, an insignificant approach to climate change, wanting to replace the $10 a day childcare with a tax credit, pushing a conversion therapy ban that only mentions sexual orientation, a bunch of meaningless/ineffectual plans  (as if uppping the price fixing fine will at all lower the cost of food in grocery stores, like they posit), etc. etc.

just unimpressive as a whole. a few highlights, like investing in r&amp;d, but that's about it. canadians deserve better.",conservatives
h98o80q,2021-08-16T12:29:06.000-07:00,"2021 conservative party platform: \"canada's recovery plan\" where are you getting 840k/3 years from? cmhc data says we average 200-240k/year, so making the leap to 330k/year seems pretty wild. 

source: https://www150.statcan.gc.ca/t1/tbl1/en/tv.action?pid=3410013501&amp;pickmembers%5b0%5d=1.1&amp;pickmembers%5b1%5d=4.1&amp;cubetimeframe.startmonth=04&amp;cubetimeframe.startyear=2018&amp;cubetimeframe.endmonth=04&amp;cubetimeframe.endyear=2021&amp;referenceperiods=20180401%2c20210401",conservatives
h98obl0,2021-08-16T12:29:55.000-07:00,"canada evacuated 34 diplomats, 807 afghans: trudeau is that true?",liberals
h98oi2p,2021-08-16T12:31:24.000-07:00,tom mulcair: trudeau has bet everything on securing a majority which maybe makes her a good candidate for the job.,liberals
h98oi69,2021-08-16T12:31:25.000-07:00,"conservative party outlines plan to make canadian real estate more affordable canada as a whole build about 200,000 homes a year. i would hope that the federal government can build 150k in a term. and it won’t really change much.

so much more public housing used to be built, but we’ve stopped for decades. we’re at a million+ home deficit right now.

a possible more substantial way to help the housing crisis would be to target the ~9% empty homes (1.34 million) across the country with penalties/incentives to ensure they are not empty any longer.",conservatives
h98okrx,2021-08-16T12:32:00.000-07:00,"trudeau vows to extend business supports to march, as o’toole proposes scrapping liberal child-care plan in platform release [removed]",liberals
h98omj2,2021-08-16T12:32:25.000-07:00,"trudeau vows to extend business supports to march, as o’toole proposes scrapping liberal child-care plan in platform release the cpc offers an immediate helping hand, in a way that doesn't help society in the big picture. the lpc offers slower improvements, in a way that helps society move forward, and achieve its promise half a decade or more from now. instant gratification is usually not the most prudent choice, but god damn is it a strong motivator.",liberals
h98ou7m,2021-08-16T12:34:07.000-07:00,"nova scotia provincial poll (forum) - lib 39% (25 seats), pc 36% (22 seats), ndp 21% (8 seats) &gt; so is it possible that the ndp might prop up the pcs in the case of a minority government? that would be an interesting prospect.

i wouldn't put it past them necessarily. economically right now the pcs are definitely to the left of the liberals and tim houston himself seems *fine* (?) but some of their members, or past members, are questionable. but i wouldn't be surprised if the ndp decided to help topple the liberals

edit: apparently editing that previously i really fucked up my grammar",liberals
h98ox60,2021-08-16T12:34:48.000-07:00,nanos: 'turbulence' for liberals if questions persist about snap election my bad!  was misremembering the crazy times of 2008,liberals
h98p6nk,2021-08-16T12:36:56.000-07:00,"canada evacuated 34 diplomats, 807 afghans: trudeau [removed]",liberals
h98p8vs,2021-08-16T12:37:26.000-07:00,"battle in quebec is between the liberals and the bloc: blanchet ###this is a reminder to [read the rules before posting in this subreddit](https://www.reddit.com/r/canadapolitics/wiki/rules-thelongversion).
 
1. **headline titles should be changed only [when the original headline is unclear](https://www.reddit.com/r/canadapolitics/wiki/rules-thelongversion#wiki_1._headline_titles_should_be_changed_only_where_it_improves_clarity.)**
2. **be [respectful](https://www.reddit.com/r/canadapolitics/wiki/rules-thelongversion#wiki_2._be_respectful).**
3. **keep submissions and comments [substantive](https://www.reddit.com/r/canadapolitics/wiki/rules-thelongversion#wiki_3._keep_submissions_and_comments_substantive).**
4. **avoid [direct advocacy](https://www.reddit.com/r/canadapolitics/wiki/rules-thelongversion#wiki_4._avoid_direct_advocacy).**
5. **link submissions must be [about canadian politics and recent](https://www.reddit.com/r/canadapolitics/wiki/rules-thelongversion#wiki_5._link_submissions_must_be_canadian_and_recent).**
6. **post [only one news article per story](https://www.reddit.com/r/canadapolitics/wiki/rules-thelongversion#wiki_6._post_only_one_news_article_per_story).** ([with one exception](https://www.reddit.com/r/canadapolitics/comments/3wkd0n/rule_reminder_and_experimental_changes/))
7. **replies to removed comments or removal notices will be removed** without notice, at the discretion of the moderators.
8. **downvoting posts or comments**, along with urging others to downvote, **[is not allowed](https://www.reddit.com/r/canadapolitics/wiki/downvotes)** in this subreddit. bans will be given on the first offence.
9. **[do not copy &amp; paste the entire content of articles in comments](https://www.reddit.com/r/canadapolitics/wiki/rules-thelongversion#wiki_9._do_not_copy_.26amp.3b_paste_entire_articles_in_the_comments.)**. if you want to read the contents of a paywalled article, please consider supporting the media outlet.

*please [message the moderators](https://www.reddit.com/message/compose?to=%2fr%2fcanadapolitics) if you wish to discuss a removal.* **do not reply to the removal notice in-thread**, *you will not receive a response and your comment will be removed. thanks.*


*i am a bot, and this action was performed automatically. please [contact the moderators of this subreddit](/message/compose/?to=/r/canadapolitics) if you have any questions or concerns.*",liberals
h98pbmh,2021-08-16T12:38:03.000-07:00,"justin trudeau liberals' top five promises broken doesn’t surprise me that you are a racist pos, foxer.",liberals
h98pdkw,2021-08-16T12:38:29.000-07:00,"2021 conservative party platform: \"canada's recovery plan\" &gt; subsidized cheap daycare effectively pushes parents in the daycare route rather than the stay-at-home route.

how? if parents want to forgo the extra income, there is nothing stopping them from doing so, and staying at home. the current situation, of daycare being so expensive, is what's pushing parents to stay at home.

a tax refundable subsidy, was never going to provide enough funding to let a parent choose to work, unless they had close to enough money to afford child care anyway.",conservatives
h98pfi5,2021-08-16T12:38:56.000-07:00,"2021 conservative party platform: \"canada's recovery plan\" or, we provide cheap daycare, which has an immediate benefit.",conservatives
h98pfpo,2021-08-16T12:38:59.000-07:00,"kinsella: beware of a fall election, justin trudeau foxer, you sure you are not in love with trudeau ? you are obsessed a bit aren’t you. do you think about him while you do the dirty deed ?",liberals
h98plv4,2021-08-16T12:40:21.000-07:00,"erin o'toole on vaccine passports at b.c. town hall | cpac vaccine passport does not equal mandatory vaccine. 

i'm totally ok with showing proof of vaccination for things like live sports, concerts and conventions.",conservatives
h98pnnx,2021-08-16T12:40:46.000-07:00,"trudeau vows to extend business supports to march, as o’toole proposes scrapping liberal child-care plan in platform release eventually, yes. a program like this, will take time to ramp up to the point where everyone who wants a cheap daycare can get one. it will take time to train the larger labour force required, and for daycares to find/build the required infrastructure.",liberals
h98pqfz,2021-08-16T12:41:25.000-07:00,"2021 conservative party platform: \"canada's recovery plan\" it was an odd angle, but it still looked better than they one they want with.",conservatives
h98prda,2021-08-16T12:41:38.000-07:00,"2021 conservative party platform: \"canada's recovery plan\" [deleted]",conservatives
