hfq7aad,2021-10-06T23:42:00.000-07:00,"wilson-raybould wasn't consulted on freeing catholic church from residential school compensation deal: source kurl’s question happened in english but the vast majority of the fallout happened in french. it was almost getting the feel of one of those famous quebec waves but it didn’t materialize. i just don’t think an anglo leader could have stopped that wave.

either way you’re in a minority parliament situation and already admitting that a loss of seats is likely. also, being a human being, freeland will no doubt make mistakes and have errors in judgement that media will feast on. “oh, we thought she was one of the good ones, but she’s just a typical liberal.” it’s coming and i’m just saying any liberal trying to push trudeau to the exits should think twice.",liberals
hfq7q94,2021-10-06T23:45:29.000-07:00,doug ford defends decision to let unvaccinated mpps sit as progressive conservatives i'd love to see the evidence they provided to obtain these medical exemptions.,conservatives
hfq7rgh,2021-10-06T23:45:45.000-07:00,"wilson-raybould wasn't consulted on freeing catholic church from residential school compensation deal: source oh i’m of the opinion that trudeau should stay on until he loses, but that’s the reality of politics - no leader will be at the helm forever and parties must adjust accordingly.

with that, while they might lose in some places, they stand to gain in others. 

however, freeland (or the next leader) would probably be coming in at a time when the country is ready for a change in government, so it’s unlikely that this whole discussion will matter anyway haha",liberals
hfq9313,2021-10-06T23:56:07.000-07:00,doug ford defends decision to let unvaccinated mpps sit as progressive conservatives removed for rule 2.,conservatives
hfq9uy2,2021-10-07T00:02:09.000-07:00,"trudeau says tofino vacation was a ‘mistake’ what? ontario rejected the calls for a holiday and so no one got a day off. in hindsight that makes sense because we dont want people to be celebrating and relaxing on the tr day, we want them to be discussing and listening on how we improve canada",liberals
hfqa252,2021-10-07T00:03:42.000-07:00,"federal public servants, rcmp, and all air and rail travellers must be vaccinated by end of october, trudeau says [removed]",liberals
hfqa8tg,2021-10-07T00:05:06.000-07:00,"federal public servants, rcmp, and all air and rail travellers must be vaccinated by end of october, trudeau says removed for rule 2.",liberals
hfqamxh,2021-10-07T00:08:09.000-07:00,"federal public servants, rcmp, and all air and rail travellers must be vaccinated by end of october, trudeau says removed for rule 2.",liberals
hfqb0sp,2021-10-07T00:11:10.000-07:00,"trudeau says tofino vacation was a ‘mistake’ this should not be a holiday in the first place. the canadian government genocided a culture and now they get a day off to relax and enjoy?? it should be a day of learning and discussing how we fix our country, not a day to go and celebrate with your family.

on a day dedicated to reconciliation, him being the representative of the government, he should have focused on reconciliation. symbolic gestures matter and indigenous people being angry is completely reasonable",liberals
hfqbgdg,2021-10-07T00:14:31.000-07:00,"wilson-raybould wasn't consulted on freeing catholic church from residential school compensation deal: source i agree with you but i’m just not ready to push trudeau to the exits or pretend like freeland won’t face challenges of her own. 

the only reasons trudeau should leave before the next election is if he decides to or if he faces a wynne-like wave of unpopularity.",liberals
hfqc8zd,2021-10-07T00:20:29.000-07:00,trudeau says tofino vacation was a ‘mistake’ [removed],liberals
hfqcr1e,2021-10-07T00:24:11.000-07:00,"federal public servants, rcmp, and all air and rail travellers must be vaccinated by end of october, trudeau says where's the heard immunity in israel and singapore ? 

shove that carrot up your ass and move to china, thanks. :)",liberals
ghs1s7g,2021-01-01T08:49:01.000-08:00,"rod phillips paid the price for his deception. but doug ford deceived us, too. they didn't screw up on that one in any significant way, other than in the way they managed it publicly. 
many legal scholars and poli sci instructors i encountered/know described it as a nothing burger. the big mistake wasn't a pm trying to explain a situation to a minister to protect a fair number of jobs, but rather the bumbling way they dealt with it once the media were on the scent.
https://www.canadianlawyermag.com/news/opinion/trudeau-was-protecting-innocent-victims-not-snc-lavalin-no-conflict-of-interest/304371

the conflict of interest legislation is such a poor piece of legislation, harper was involved so i'm not shocked, that any pm discussing issues with any minister could be found in violation of it.",liberals
ghs262c,2021-01-01T08:52:43.000-08:00,"rod phillips paid the price for his deception. but doug ford deceived us, too. if only it was me who is delusional or blind.
i'm in alberta.
i witness scandals and criminality in a daily basis care of the kenney conservatives.
believe you me, it ain't me that needs to give my head a shake.
whats happening here will happen if the cpc get their grubby mits near power again.",conservatives
ghs2fyn,2021-01-01T08:55:19.000-08:00,"where in the world is justin trudeau? ah yes reporting on the prime minister is \"desperate\".

the reporter debunked a conspiracy that trudeau went on an international trip, and confirmed he went to quebec. 

change the word trudeau with trump so you can look at it objectively. there ya go.",liberals
ghs2pbm,2021-01-01T08:57:48.000-08:00,"rod phillips paid the price for his deception. but doug ford deceived us, too. if that is a “scheerism” than pleas try posting some black face videos of yourself on mainstream media. you’re probably right only scheer would be upset.",conservatives
ghs3udh,2021-01-01T09:08:42.000-08:00,"where in the world is justin trudeau? right i guess i should have said this article combined with your commentary is desperate. 

i wouldn't think this is a big deal if a conservative or ndp prime minister did this either.

you're the one who thinks trudeau should resign and demote himself over this.",liberals
ghs3y8m,2021-01-01T09:09:44.000-08:00,"rod phillips paid the price for his deception. but doug ford deceived us, too. nice try.
can't you discuss things honestly, or compare apples with apples?

dui isn't an ethics violation and is in the criminal code. the ethics legislation was deliberately written so it couldn't be classified as a criminal offence. that's why those found in contravention of it pay the fine and move on.  

there are legal opinions that the commissioner got it wrong.
https://www.canadianlawyermag.com/news/opinion/trudeau-was-protecting-innocent-victims-not-snc-lavalin-no-conflict-of-interest/304371",liberals
ghs4myw,2021-01-01T09:16:14.000-08:00,"where in the world is justin trudeau? you guess? you should have? that's actually desperate writing.

also, you are being twofaced: half an hour ago you commented on how the ontario finance minister and ford failed on the same issue of non essential travel.

pardon me, but you clearly are a hypocrite or have some sort of mental health issue if you have this much derangement.",liberals
ghs5r6i,2021-01-01T09:26:41.000-08:00,"rod phillips paid the price for his deception. but doug ford deceived us, too. yes, given my public posting history i am absolutely a harper sycophant. i mean, i've never voted for a conservative party in the last 27 years, but you got me there. it's a very deep game that i'm playing.

anyways, i see that you're not actually engaging with anything substantive here, so you have a good night.",conservatives
ghs6159,2021-01-01T09:29:15.000-08:00,"where in the world is justin trudeau? 
&gt;also, you are being twofaced: half an hour ago you commented on how the ontario finance minister and ford failed on the same issue of non essential travel.

i commented that kicking him out of caucus would be a huge headache for ford. this is a comment on how they're handling the fallout. i'm honestly surprised he resigned and i don't think he had to. people would forget and not care about it come next election time. 

&gt;pardon me, but you clearly are a hypocrite or have some sort of mental health issue if you have this much derangement.

no you're a doody-face!",liberals
ghs7ju9,2021-01-01T09:43:15.000-08:00,"where in the world is justin trudeau? and for what it's worth, cp shouldn't have removed this article. hopefully they put it back up.",liberals
grqrbox,2021-03-21T07:30:33.000-07:00,climate change denial proof erin o’toole’s conservatives are living in their own virtual reality [removed],conservatives
grqrsnn,2021-03-21T07:34:28.000-07:00,"o'toole's pitch to get conservatives to embrace 'change' may be off to a shaky start preston manning tried to put forth that argument through his think-tank and in the media, and likely through his back channels, for many years actually.

no one listened.",conservatives
grqs570,2021-03-21T07:37:27.000-07:00,"pierre trudeau thought about legalizing pot in 1981 but stopped over cabinet infighting, documents reveal imagine the economic boon it would have been to have had legal marijuana in a world where it's condemned everywhere else? we could have been ahead of the game by having accumulated so much money and/or acted as trendsetters for other countries!

i am sure it would have gotten recriminalized during the mulroney years, but this alternate reality is interesting to pontificate upon. would it have made the world more open to soft drug usage at an earlier date? would it have negatively stereotyped canadians as potheads? probably a bit of both.",liberals
grqt3yd,2021-03-21T07:45:33.000-07:00,"o'toole's pitch to get conservatives to embrace 'change' may be off to a shaky start frankly, this choice has me wondering if he's going to bail on the leadership. now, clearly, that's a huge step, but at what point do you just say \"well, i tried,\" and ride off into the sunset? 

is it after you, as the leader of a party, say \"we need to do this or we'll never get elected\" and are soundly rejected by your party? because that sounds like a good time to get off the wild ride tbh.",conservatives
grqt5ze,2021-03-21T07:46:01.000-07:00,"o'toole's pitch to get conservatives to embrace 'change' may be off to a shaky start the conservatives are like your 70 year old white conservative middle class father figure. he spent the majority of his life with a big high paying job, he was king of the house, he made all the payments, everybody praised him, everyone feared him, he would beat any children that stood up to him, berated his wife if she spoke up, did whatever he wanted, said whatever he wanted, bought whatever he wanted and basically was king of his domain. he spent the majority of his power trip being a complete total jerk to everyone and ruthlessly bought, sold, took over and screwed anyone and everyone during his entire career with a smile on his face. 

now he is getting old and feeble and his kids are taking more and more control of his estate. his wife has left him because he was abusive. his kids hate his guts but love his money. he has no friends, only associates who hang onto to him on the off chance he might share some of his fortune. his family loathe him, put up with him and actively avoid him. some people still fear him. a few people hang out with him as part of an old boys club but they all secretly hate each other and will gladly back stab one another for a dollar. most people just ignore him because he doesn't have much power over anyone anymore. 

everyone keeps an eye on him because he's attached somehow to all the family functions. and everyone is just waiting for him to die.",conservatives
grqts4v,2021-03-21T07:51:10.000-07:00,o'toole's pitch to get conservatives to embrace 'change' may be off to a shaky start removed for rule 2; you have used a term that is on our [list of prohibited insults](https://www.reddit.com/r/canadapolitics/wiki/insults).,conservatives
grqtsj1,2021-03-21T07:51:16.000-07:00,o'toole's pitch to get conservatives to embrace 'change' may be off to a shaky start removed for rule 2.,conservatives
grqttkp,2021-03-21T07:51:32.000-07:00,"o'toole's pitch to get conservatives to embrace 'change' may be off to a shaky start except the party does not have a losing stance of climate change. 

canadian workers do not want the canadian primary sector to be hit by unworkable policies while chinese and indian industries outcompete them, making them unemployed as well as negating any environmental benefits that may occur. 

the only people supporting these green type policies are people too scientifically ignorant to understand they aren’t green nor genuine as well as employed in secondary and tertiary sectors such as finance, education etc. and therefore not directly or immediately impacted by the industrial impacts of climate change regulations.

o’toole made a big mistake pushing this kind of policy rather than playing to his base. how much success would you expect from a canadian liberal pushing gun control for example?",conservatives
grqun1q,2021-03-21T07:58:26.000-07:00,"o'toole's pitch to get conservatives to embrace 'change' may be off to a shaky start &gt; that being said, i don’t want to see a major canadian party disappear and become unelectable. it’s not good for democracy. 

i agree with you there.  while i've never voted conservative and likely never will, it would be a very bad thing for a large chunk of our population to be disenfranchised because their party leaders are stuck in the past.  

but they're going to have to get their shit together- the oil fields disappearing aren't going to be an issue for much longer, and the social conservativism isn't working for the younger generation, who are voting in greater numbers each election.",conservatives
grquyqg,2021-03-21T08:01:09.000-07:00,o'toole's pitch to get conservatives to embrace 'change' may be off to a shaky start same energy as when the republicans blamed obama for not vetoing legislation that they voted to pass. conservatives never argue in good faith.,conservatives
grqv4a2,2021-03-21T08:02:26.000-07:00,o'toole's pitch to get conservatives to embrace 'change' may be off to a shaky start [removed],conservatives
grqv4ts,2021-03-21T08:02:34.000-07:00,"pierre trudeau thought about legalizing pot in 1981 but stopped over cabinet infighting, documents reveal don't forget reagan ignored aids until 1985 and hugely increased the deficit and military spending.",liberals
grqvlgq,2021-03-21T08:06:24.000-07:00,o'toole's pitch to get conservatives to embrace 'change' may be off to a shaky start that sub isn't for typos.,conservatives
grqw00j,2021-03-21T08:09:49.000-07:00,"climate change denial proof erin o’toole’s conservatives are living in their own virtual reality the cpc is much more a bunch of people that tolerates eachother than a united party with common goals. if the policies don't change they will not win, if the policies change the party will implode.",conservatives
grqwkzd,2021-03-21T08:14:43.000-07:00,"climate change denial proof erin o’toole’s conservatives are living in their own virtual reality are we just going to ignore the fact that two weeks ago there were tons of articles about how the socons essentially stacked the roster of delegates for this convention?

is this *really* a surprise to anyone. o'toole even came out right after the convention in a q and a and said quite clearly that climate change was real and the conservative party would absolutely have an in depth climate plan and policy. saying the cpc is in climate denial is going to be a pretty lame arguement to make come election time when anyone can just link the conservative policy on climate change.

the real situation here is that the party *is* starting to split. the socons who voted for these policies probably aren't very happy with what o'tooles said just after the convention and he may just lose those votes but at the same time he's able to ditch some socon support for more center voting canadians. isn't that what i've been hearing echoed on this very sub? that's kind of whats happening here.

like come on. the titles of these articles should be \"idiots who stacked the roster of delegates pass idiotic policy.\" i saw this coming. i even made a post about it on another subreddit.",conservatives
grqx18q,2021-03-21T08:18:33.000-07:00,"climate change denial proof erin o’toole’s conservatives are living in their own virtual reality the liberal voters are increasingly composed of anyone but conservatives...don't see that changing.
if ndp had a better leader like an ed broadbent they might have a chance",conservatives
grqxaqc,2021-03-21T08:20:46.000-07:00,o'toole's pitch to get conservatives to embrace 'change' may be off to a shaky start wat?,conservatives
grqxfgi,2021-03-21T08:21:53.000-07:00,climate change denial proof erin o’toole’s conservatives are living in their own virtual reality the conservative policy on climate change is what exactly?,conservatives
grqxqb9,2021-03-21T08:24:27.000-07:00,"climate change denial proof erin o’toole’s conservatives are living in their own virtual reality &gt; saying the cpc is in climate denial is going to be a pretty lame arguement to make come election time when anyone can just link the conservative policy on climate change.

and then we can link to stories like this showing they can't actually be trusted to do anything about it when those at their conventions won't agree it exists. and if they ever finally release a plan i don't expect it to be a good one anyway.",conservatives
grqy02a,2021-03-21T08:26:47.000-07:00,"climate change denial proof erin o’toole’s conservatives are living in their own virtual reality &gt;saying the cpc is in climate denial is going to be a pretty lame arguement to make come election time when anyone can just link the conservative policy on climate change.

can you link the conservative policy on climate change then? i'd like to see it. thank you!",conservatives
grqy0xg,2021-03-21T08:27:00.000-07:00,climate change denial proof erin o’toole’s conservatives are living in their own virtual reality what’s wrong with jagmeet?,conservatives
grqy7u5,2021-03-21T08:28:36.000-07:00,"climate change denial proof erin o’toole’s conservatives are living in their own virtual reality &gt;and then we can link to stories like this showing they can't actually be trusted to do anything about it when those at their conventions won't agree it exists

so you're going to link to an article about how a bunch of idiots (a minority in the party) intentionally stacked the roster of delegates and in turn made idiotic policy that **the party** then immediately went against when someone can straight up link you the actual current cpc policy on climate change...",conservatives
h3ae0iu,2021-06-27T14:39:31.000-07:00,liberals name azam ishmael as campaign director amid growing speculation for fall federal election [deleted],liberals
h3algej,2021-06-27T16:15:15.000-07:00,"i’ve been behind in the polls before and i’ve won: o’toole he only needs to target a few specific ridings to win the election. same for the liberals to get a majority government.

&amp;#x200b;

https://www.thewrit.ca/p/six-per-cent-election?r=8ahwm&amp;utm\\_campaign=post&amp;utm\\_medium=web&amp;utm\\_source=copy",liberals
h3zjhcn,2021-07-03T13:17:58.000-07:00,something is dragging the federal conservatives down in alberta – is it jason kenney? [removed],conservatives
h3zjojc,2021-07-03T13:20:07.000-07:00,"editorial: an early election is a bad plan, mr. trudeau [removed]",liberals
h3zkjyo,2021-07-03T13:29:29.000-07:00,"trudeau not committing to timeline for independent military sexual misconduct system of course the man isn't. we have found, in the past r months, a plethora of general and flag officers who've pulled the wool over the mnd, and also found that the mnd sat on knowledge of sexual misconduct by the former cds for the past half decade.

to announce any change now is to announce he has no confidence in sajjan, and he needs that man's riding in any future election.

it is better, politically, to sit on his ass and do nothing to support the personnel in uniform, again, than to lift one finger, on even announce a simple timeline.",liberals
h3zkrwy,2021-07-03T13:31:54.000-07:00,"rex murphy: now trudeau's liberals are journalism instructors? | national post is he, though? because, to me, reading through this piece, he never really seems to formulate an actual criticism of the guide. instead he repeatedly pulls in outside issues and vaguely allude to some sort of connection between the two. 

i mean, there's a certain irony in him saying this is 'alarming' because the government thinks it judgement is 'superior' because of the whole suing the speaker thing, but fails to acknowledge that the guide is neither legally binding, nor does it produce binding obligations; if you sign it, you can try to come up with specific commitments to implement these principles, but that's on you. i'm not even sure if you're expected to sign it, if you're a media group.

of course, one imagines that not signing something that talks about journalistic standards is, as i alluded to, not a good look for a media organization that lives and dies on its credibility. but it ought to be an easy thing to commit to, for the same reasons.",liberals
h3zmu97,2021-07-03T13:54:38.000-07:00,"u.k. prime minister's office condemns toppling of queen victoria, queen elizabeth ii statues then why are we asking the current pope to come from italy to say sorry for what canadian/european missionaries did? trudeau's thoughts and prayers weren't enough? it is a canadian only issue right?",liberals
h3zo1ge,2021-07-03T14:08:13.000-07:00,338canada: the conservatives keep falling behind it's a common galaxybrain take online.,conservatives
h3zo5e8,2021-07-03T14:09:29.000-07:00,338canada: the conservatives keep falling behind this x 1000,conservatives
h3zqajt,2021-07-03T14:34:47.000-07:00,"something is dragging the federal conservatives down in alberta – is it jason kenney? it's a demand shock, just like how prices crept up on all materials for goods because of a empty jit manufacturing channel. when it goes back to full speed it's hard to say if the price will stay. as a albertan i wouldn't mind if the price stayed higher. the pandemic starting and ending will create chaos in markets",conservatives
h3zqnrk,2021-07-03T14:39:07.000-07:00,something is dragging the federal conservatives down in alberta – is it jason kenney? [removed],conservatives
gynu21q,2021-05-18T15:04:21.000-07:00,"doug ford’s popularity is in free fall. is he finished? they vote for who they are less mad at, but more importantly, to try and balance who is in power in ottawa.  trudeau is going to win again, so ford will too.  the elections after that will probably see them both out.",liberals
gynucg4,2021-05-18T15:07:30.000-07:00,"ottawa supports quebec constitutional challenge on language reform, trudeau says they'll just leave and go to uni outside of quebec. 

which i suspect is the goal",liberals
gynuip2,2021-05-18T15:09:27.000-07:00,imagine a conservative party led by rona ambrose. where would it be now? apparently albertans aren't canadians lol?,conservatives
gynuo81,2021-05-18T15:11:09.000-07:00,"quebec can modify part of the canadian constitution unilaterally, trudeau says there's a possiblity that depending on what is done, that this is distinct society 2.0, with all that implied.",liberals
gynvc6g,2021-05-18T15:18:43.000-07:00,quebec can alter canadian constitution to say it's a nation and french is its official language: trudeau so what is the purpose of quebec's recent changes? make quebec nationalists feel good? is there actually evidence that new immigrants do not want to learn french?,liberals
gynvu79,2021-05-18T15:24:25.000-07:00,"quebec can modify part of the canadian constitution unilaterally, trudeau says &gt;the 1867 act was not a federal law. it was an imperial law, and the 1982 act allowed for the provinces and the national parliament to amend the aspects of the constitution which they had a part in. 

true, but also irrelevant because of how the *constitution act, 1982* defines the constitution of canada.

the *constitution act, 1867* is - in its entirety - part of the constitution of canada (note the big c - it's a formal term), as defined in section 52(2) of the ca 1982 and listed in the schedule to the ca 1982.

the ca 1982 provides for the constitution of canada to be amended through the general procedure (section 38), the unanimous procedure (section 41), the unilateral federal procedure (section 44), and the bilateral/multilateral procedure (section 43).

the ca 1982 does **not** provide for unilateral (i.e. with no involvement of the federal parliament) amendments to the constitution of canada by the provinces. section 45 says provinces can make laws amending the constitution (note the small c - a general term) of the province - it does not use the formal term \"constitution of canada\" utilized in sections 38, 41, 43 and 44.

some provinces do have specific \"constitutional\" acts (e.g. bc has its own 1996 constitution act). provincial constitutions in most cases are just ordinary statutes that rise to constitutional status (you could argue the charter of the french language is part of quebec's constitution, for instance). nobody disputes that provinces have the right to unilaterally amend these. if quebec wants to pass a law declaring that quebecers form a nation and that french is their common language, it has that right.

