h5o59f2,2021-07-18T06:09:09.000-07:00,"opinion | trudeau’s liberals would promise us the moon to secure a majority. just don’t expect them to deliver the tories would take the moon, cut any and all costs associated with traveling there and then cut taxes for the removers all while denying climate change and covering up the removal.",liberals
h5o5rxk,2021-07-18T06:12:57.000-07:00,"analysis: federal cash fuels launch of nova scotia liberal campaign this is a nonsensical false equivalency. trudeau offered the same childcare deal to all provinces and ns took it. ontario, alberta and saskatchewan are allowed to take it too, they haven’t and that’s their problem. they’re hurting their own people to own the liberals.",liberals
h5o60qr,2021-07-18T06:14:46.000-07:00,"opinion | trudeau’s liberals would promise us the moon to secure a majority. just don’t expect them to deliver or that we have a functional democratic system that the population is more or less happy with. as someone who follows international politics, there aren't many countries whose democracy is doing particularly better than ours.",liberals
h5o67ub,2021-07-18T06:16:14.000-07:00,"ndp could be positioned to get some wealth-tax revenge on justin trudeau not how taxes work lol. if he reached a net worth of $20 milion he'd pay nothing, and at $21 million he'd pay an additional $10 000 in wealth tax. i think he'd be okay.",liberals
h5o6dj1,2021-07-18T06:17:23.000-07:00,"nova scotia ndp promises major social supports if they form government - leader gary burrill says rent control, $15/hr minimum wage, sick pay all to be immediate priorities &gt;	if anyone can drop the ball, it’s rankin

he’s leading the liberals in ns. 

he’s probably the worst leader of the 3 but you can afford to drop the ball a bit when your brand is so strong. who else are they gonna vote for? the conservative brand is unpopular in ns and burrill is seen as a strident leftist.

&gt;	mcneil was hated in a visceral way

the man who was elected to back-to-back majority governments?

&gt;	they still might earn a majority, but there’s a real weakness to them right now with rankin at the helm and some key ministers not seeking reelection.

and they are also recruiting candidates like bill casey - it goes both ways.",liberals
h5o7j3f,2021-07-18T06:25:54.000-07:00,"kinsella: erin o’toole appears poised to win fewer seats than his predecessor given how consistently the conservatives in caucus lean toward the hard right, there's no way they'd get our votes. they elected the wrong leader. they should have chosen a moderate like michael chong.",conservatives
h5o7k1y,2021-07-18T06:26:05.000-07:00,opinion | trudeau’s liberals would promise us the moon to secure a majority. just don’t expect them to deliver [removed],liberals
h5o89po,2021-07-18T06:31:16.000-07:00,opinion | trudeau’s liberals would promise us the moon to secure a majority. just don’t expect them to deliver its almost like is matters if a matter falls under the federal government's sole constitutional competence or not.,liberals
h5o8bmm,2021-07-18T06:31:40.000-07:00,"kinsella: erin o’toole appears poised to win fewer seats than his predecessor the strategy was ignore policy, throw everything and see what sticks, but the clock is running out.   they keep trying to gin up \"scandals\" because they lack credibility to debate trudeau on most policy questions now, like the environment for example.  and frankly, a detailed discussion of conservative policy ideas isn't going to win them votes where the need them.",liberals
h5o91wc,2021-07-18T06:36:54.000-07:00,"opinion | trudeau’s liberals would promise us the moon to secure a majority. just don’t expect them to deliver &gt;	pharmacare to be instituted sustainably is a fair bit more complex than that, and it’s never been a clear liberal policy priority

[*a new liberal government will pursue a strategy - together with representatives of provincial and territorial governments, health service providers, private payers (employers and unions), and consumers - to address the fact
that drugs have become an essential component
of health care. we will develop with these
groups a timetable and fiscal framework for the implementation of universal public coverage for medically necessary prescription drugs. when
this plan and timetable have been devised, and when a sufficient number of provinces have agreed, a new liberal government will be able to make a significant financial contribution to bringing pharmacare into reality.*](https://www.poltext.org/sites/poltext.org/files/plateformesv2/canada/can_pl_1997_lib_en.pdf) - 1997 liberal platform

[*take the critical next steps to implement national universal pharmacare so that all canadians have the drug coverage they need at an affordable price.*](https://www.poltext.org/sites/poltext.org/files/plateformesv2/canada/can_pl_2019_lib_en.pdf) - 2019 liberal platform",liberals
h5o94r3,2021-07-18T06:37:30.000-07:00,"nova scotia ndp promises major social supports if they form government - leader gary burrill says rent control, $15/hr minimum wage, sick pay all to be immediate priorities so because burrill is not conservative enough you switch? the whole point for the ndp is to be a center left party not a center leaning right party like the liberals.",liberals
h5o99ik,2021-07-18T06:38:30.000-07:00,"opinion | trudeau’s liberals would promise us the moon to secure a majority. just don’t expect them to deliver okay?

this piece isn’t arguing in favour of a tory government, it’s arguing against a liberal majority.",liberals
h5o9krd,2021-07-18T06:40:51.000-07:00,"trudeau announces $440 million for quebec aerospace industry &gt;the innovation is literally my entire first sentence.

there's no evidence that ths is commercializeable until there's a profit. right now, these ventures are all losing money big-time, and no one is investing in them except musk and branson (because they have the money to waste). the most innovative thing here so far is the hype and self promotion. the space shuttle was retired because it proved to be more expensive than rockets, and there's no evidence here that this has changed. musk is still sending up his satellites with rockets. so far, these aricraft heaven;t done anything airtplanes have been doing since the 1950's.",liberals
h5o9m32,2021-07-18T06:41:08.000-07:00,opinion | trudeau’s liberals would promise us the moon to secure a majority. just don’t expect them to deliver the ndp aren't forming a government anytime soon.,liberals
h5o9sx3,2021-07-18T06:42:32.000-07:00,"kinsella: erin o’toole appears poised to win fewer seats than his predecessor fwiw, ford and the ontario pc party are now *more* popular in ontario than o'toole and the cpc are. the ford brand really hurt the cpc in 2019, but under o'toole, an ontarian and nominally more of a moderate than scheer, the cpc has surpassed ford in pissing off moderates. strange times we live in.",conservatives
h5o9ug1,2021-07-18T06:42:51.000-07:00,"opinion | trudeau’s liberals would promise us the moon to secure a majority. just don’t expect them to deliver i didn’t say anything about the ndp.

the liberals can be in government without it being a majority. we’re living under one right now.",liberals
h5oa7vt,2021-07-18T06:45:36.000-07:00,"kinsella: erin o’toole appears poised to win fewer seats than his predecessor while trudeau and the lpc will be shamelessly obnoxious about vaccines in the upcoming election, i can't blame them. the government took a lot of abuse on the vaccine front in the early stages, and perhaps rightly so, but the turnaround canada (and in particular anita anand, the procurement minister) have managed is bloody remarkable.",liberals
h5obmms,2021-07-18T06:55:57.000-07:00,trudeau announces $440 million for quebec aerospace industry how much profit have they made doing that?,liberals
h5oc7il,2021-07-18T07:00:11.000-07:00,"opinion | trudeau’s liberals would promise us the moon to secure a majority. just don’t expect them to deliver yeah, and cerb fucking ruled. clearly, good policy can be done quick. 

see the other commentor for info on pharma.",liberals
h5ocdh8,2021-07-18T07:01:23.000-07:00,opinion | trudeau’s liberals would promise us the moon to secure a majority. just don’t expect them to deliver [removed],liberals
h5ocgrq,2021-07-18T07:02:02.000-07:00,opinion | trudeau’s liberals would promise us the moon to secure a majority. just don’t expect them to deliver ugh yeah. like when he sold weapons to saudi arabia and got corporations off the hook for legal issues.,liberals
h5ocpcf,2021-07-18T07:03:48.000-07:00,"nova scotia ndp promises major social supports if they form government - leader gary burrill says rent control, $15/hr minimum wage, sick pay all to be immediate priorities as for that i am not sure. i think 2013 was a wake up call and people decided to leave the nsndp and go for the liberals, and it just seemed like they stayed with them. dexter was that bad. i think the nsndp had enough time to rebrand as the progressive left and can win once again, plus doesn't help that gary looks like bernie.",liberals
gxtyii6,2021-05-11T18:32:52.000-07:00,"the trudeau cult that entire situation was bullshit. the mod in question was looking to drum up drama to advertise for the echo chamber he was starting, and redditors ate it up since it was when t_d was at its peak.

of the 20 or so people on the /r/canada mod team, there was **one** verified white supremacist. the rest of the accused white supremacists (3-4) were mods on metacanada. that’s it.

the best part? ogft has actual communists and communist sympathizers moderating it. but you won’t see that hitting the front page.",liberals
gxu0tki,2021-05-11T19:10:28.000-07:00,"why is the conservative party of canada considered to be equivalent to the democratic party in the us? the only people i’ve seen trying to compare the cpc to us democrats are ppc supporters trying to sway votes by implying that the cpc isn’t conservative.

which is something i 100% agree with, but that isn’t a good comparison. a better comparison is that the cpc is very politically similar to the lpc when compared to democrats versus republicans. at the end of the day, the two countries have completely different political climates, and it’s not surprising that comparisons are drawn given that canada’s favourite pastimes includes comparing ourselves to the us.",conservatives
gxu4jzh,2021-05-11T20:09:20.000-07:00,the trudeau cult it was created because harvo is mentally ill and tried doxxing and constantly sent harassing messages to the mods of metacanada.,liberals
gxpn21r,2021-05-10T20:00:47.000-07:00,justin trudeau’s liberals have a firm grip on toronto. can jagmeet singh’s new democrats break it? [removed],liberals
gxpneti,2021-05-10T20:06:09.000-07:00,"ontario poll: olp: 36%, pcpo: 32%, ondp: 22%, gpo: 8% &lt;&lt; innovative research &gt;ford barely, like one or two percentage points, won the opc leadership race and he was by far... by a dozen points less favorable to non registered conservatives than either of elliot or mulroney.

and? the demographic he did well in order to win the toronto's inner suburbs (racialized, working class) wouldn't have voted in the leadership race.",conservatives
gxpomnh,2021-05-10T20:24:02.000-07:00,malcolm: trudeau government has a blind spot for left-wing extremism trudeau is turning the liberal party into a terrorist organization.,liberals
gxpqtwk,2021-05-10T20:54:36.000-07:00,"the federal government, the media, and the alberta ndp wanted a covid-19 disaster, says alberta's justice minister two things,

 conservatives seem to really be doubling down on look what the feds let happen. it sad because it seems there are enough people that don’t understand how levels of government work and then blame the feds because of what the conservatives said.",conservatives
hpm169o,2021-12-22T06:16:09.000-08:00,"in his own words: at 50, justin trudeau is no longer working in his father’s shadow — and sees no ‘finish line’ in politics removed for rule 2.",liberals
hgsiqae,2021-10-15T08:01:09.000-07:00,"if i don’t change ontario’s election law, i’ll resign as premier, steven del duca promises &gt;i guarantee that if he's elected, he'll find a way to break his promise and come up with a bs justification to not resign.

generally the argument is that liberals benefit most from a ranked ballot (although horwath would have won a majority in the last election under a ranked system) 

so i don't understand why anyone would think he would not want to do as he says.",liberals
hgsj4fn,2021-10-15T08:04:14.000-07:00,"trudeau to unveil new cabinet oct. 26, parliament to return nov. 22 [removed]",liberals
hgsl3la,2021-10-15T08:20:06.000-07:00,"davenport recount halted: liberals win riding at least half the recounts end up not being completed, because the losing party realizes they won’t be able to flip the riding, so they end the recount.",liberals
hgsl9r1,2021-10-15T08:21:29.000-07:00,"rupa subramanya: why did so many chinese-canadians turn against the conservatives? there was very little (i.e. none) during harper's governments, majority or minority, that was railroaded by anyone other than harper.  i don't know how much you remember of that period but compromise was not the buzzword of that era.",conservatives
hgsmaez,2021-10-15T08:29:46.000-07:00,"if i don’t change ontario’s election law, i’ll resign as premier, steven del duca promises if the appetite for a ranked ballot was there, you can bet trudeau would have pushed a lot harder for it than he actually ended up doing.

the thing is, people who support fptp still do not like ranked ballots, and neither do a good chunk of people who loathe fptp. there are many fair criticisms of rv that are going to come under attack from both sides of the spectrum. i can't see ranked ballots actually coming to fruition, so i don't know why del duca is putting his premiership on the line over it.",liberals
hgsn3xy,2021-10-15T08:36:23.000-07:00,"trudeau to unveil new cabinet oct. 26, parliament to return nov. 22 the idea that elections are a nuisance is the height of western privilege.

considering democracy as an inconvenience is a really disturbing sentiment that opposition and media put on sale this year.",liberals
hgsnr73,2021-10-15T08:41:35.000-07:00,"trudeau to unveil new cabinet oct. 26, parliament to return nov. 22 so parliament is effectively doing nothing from august 2021 to february 2022. that’s 6th months during an unprecedented crisis. covid is still very much around",liberals
hgso08e,2021-10-15T08:43:41.000-07:00,"if i don’t change ontario’s election law, i’ll resign as premier, steven del duca promises wonder if this is a promise meant to carry past just this next election?  it's fairly high odds that the liberals won't win next year, i'd be impressed if del duca brings it up for future platforms when the party is in better shape.",liberals
hgsomlv,2021-10-15T08:48:46.000-07:00,"chinese-canadian tories urge o'toole to resign, saying tough-on-china platform alienated voters &gt;yeah because between the two the us is far greater aggressor

your position is ludicrous, and i'm done with this.",conservatives
hgsp73d,2021-10-15T08:53:28.000-07:00,"doug ford still leads ontario voting intentions, but over half of ontarians have unfavourable view of him: poll if the liberals would live up to their big tent claims, they could have 65% support!",liberals
hgspf9j,2021-10-15T08:55:21.000-07:00,"david wells: the canadian flag should not be used as a political prop your comment was the entire point of the article.  trudeau's lowering of the flags was cheap theatrics.  \"we care\" one day, then t&amp;r day comes along... \"nice long weekend to go surfing!, let's take the 2 challenger jets for my trip and burn more fossil fuels for my weekend vacation than most canadians do in half a decade.\".

the public is looking to the liberals to get serious, not more cheap theatrics.",liberals
hextg3d,2021-09-30T14:24:00.000-07:00,"the conservative vote in alberta shrunk. here's why actually in the 2021 election, a majority of greens had the cpc as their second choice. there’s a wrinkle there because a lot of greens had already left the party and became ndp/liberal/whoever  voters, so it’s not a true majority of the 2019 green vote (done if which may come back), but it still goes to show that the greens are not a left wing progressive party with a focus on the environment. there’s a solid 25-40% of them who are conservatives.",conservatives
hextg61,2021-09-30T14:24:01.000-07:00,"trudeau spends 1st truth and reconciliation day in tofino on vacation, contradicting itinerary [deleted]",liberals
hextrtu,2021-09-30T14:27:26.000-07:00,"r/canadapolitics defending this................the sub would blow up if o'toole did the same thing i'm really done with political teams. with the gangs. with the \"my side did this, and it isn't that bad. but if your side does it, you're satans.\" in my heart, i really believe we're better than that. as i get older though, i become less sure.",conservatives
hexuiq3,2021-09-30T14:35:26.000-07:00,"eco-socialist dimitri lascaris is considering running again for green party leader the greens main accomplishment is splitting the center left vote and helping elect more conservative mp’s. if the party disappears, vote splitting will drop and we’ll have less cpc mp’s, and more liberals and ndp mp’s.",liberals
hexuuv9,2021-09-30T14:39:07.000-07:00,"eco-socialist dimitri lascaris is considering running again for green party leader i voted ndp in this last election, but the party as it currently stands is not as serious about climate change as it needs to be. nor is it particularly left, in its current incarnation under jagmeet singh.

as for the liberals: they bought a pipeline. 'nuff said.

i want there to be an actual leftist (i.e. anticapitalist) option to vote for in canada. currently no such party exists, despite clear demand for it. lascaris might turn the greens into that party.",liberals
hexuw42,2021-09-30T14:39:30.000-07:00,"r/canadapolitics defending this................the sub would blow up if o'toole did the same thing depends on the action being performed:

\"sow\" refers to the act of spreading something - \"you can sow a field with seed\"

\"sew\" refers to the act of alteration, repair or creation through the craft of sewing and needlework. \"you can sew a button onto a jacket\"",conservatives
hexuza1,2021-09-30T14:40:28.000-07:00,"trudeau spends 1st truth and reconciliation day in tofino on vacation, contradicting itinerary really? so this whole article is just bullshit? i wouldn't be especially surprised to find that global news is just outright wrong, but do you have any source to back that up?",liberals
hexuzah,2021-09-30T14:40:28.000-07:00,"free speech friday — october 01, 2021 last week i became obsessed with germany's coalition naming terms so i spent some time coming up with my own german-styled terms for the kinds that could form in canada:

* lpc-bq-ndp : armenia
* lpc-bq : laurentian consensus
* lpc-ndp : spain
* lpc-bq-gpc : gambia
* lpc-ndp-gpc : traffic light
* lpc-gpc : red green show 
* lpc-ndp-bq-gpc: all dressed
* cpc-ppc : united conservative
* cpc-bq : blue-blue
* cpc-bq-ppc : progressive conservatives
* cpc-lpc : grand coalition 

not a fan of them all, but it was fun trying to think of them. anybody have any other ideas?",conservatives
hexv31e,2021-09-30T14:41:38.000-07:00,"as alberta sees near-record number of covid deaths, but offers of help go untaken, experts ask: what is jason kenney waiting for? he's waiting for the election to come around in spring 2023. he assumes that covid-19 will be over by then.

my guess is that during the election he will somehow try to blame it on notley and trudeau, and half the province will be, \"how could notley have done that to us?\" she was blamed for things that happened on the conservative watch before, they'll just try it again. unfortunately, there are too many people that will fall for it.",liberals
hexvna1,2021-09-30T14:47:50.000-07:00,"trudeau spends 1st truth and reconciliation day in tofino on vacation, contradicting itinerary i agree it wasn't about him personally. 

but as the pm he represents the government and the people of canada.  and the reconciliation part is between first nations and the government and other peoples of canada.

especially for the very first one.  it is just bad optics to take a vacation and ignore invitations from first nations people.

also the day isn't necessarily about quiet reflection.  i know my community had a smudge at the town square all were invited to and then a walk afterwards along with some speakers.",liberals
hexvzg0,2021-09-30T14:51:36.000-07:00,"trudeau spends 1st truth and reconciliation day in tofino on vacation, contradicting itinerary this was likely planned a week ago when trudeau won the election.

so i doubt he would have wanted to reschedule.

so let the media, ndp and cpc get angry. 

i think with the way that the media pursued his children and his wife i think the pm is sick and tired of this.

he might even regret even being pm with his family being pursued.",liberals
hexw2hl,2021-09-30T14:52:31.000-07:00,"trudeau spends 1st truth and reconciliation day in tofino on vacation, contradicting itinerary i think i would. i’m not the type to cast negative opinions on public figures at every opportunity. and i’ve worked in government enough to know that what can seem simple and obvious to others often isn’t. overall, i’m just tired of people criticizing every public figure all the time. let’s pay attention to our own inadequacies for a bit. it might actually change something.",liberals
hexwlxo,2021-09-30T14:58:46.000-07:00,"trudeau spends 1st truth and reconciliation day in tofino on vacation, contradicting itinerary those are the only two options, of course. spending time with indigenous communities without doing a photo op was never a possibility.",liberals
hexworh,2021-09-30T14:59:40.000-07:00,"trudeau spends 1st truth and reconciliation day in tofino on vacation, contradicting itinerary &gt; een where? which school? which community?

most critics today have focused on the invitation he received without response to a ceremony in kamloops where the school that set off this years' unmarked graves story was.",liberals
hexwstd,2021-09-30T15:00:59.000-07:00,"trudeau spends 1st truth and reconciliation day in tofino on vacation, contradicting itinerary this is a misrepresentation of the criticism. no one is saying trudeau doesn't deserve a vacation. i'm not a fan of his, but he absolutely does deserve nice a vacation for what i'm sure are long hours he has put in over 18 months.

the national day for truth and reconciliation is not a day for the prime minister to take a vacation.",liberals
hexwv04,2021-09-30T15:01:40.000-07:00,"r/canadapolitics defending this................the sub would blow up if o'toole did the same thing yes, but do you \"sow division\" or \"sew division\"?",conservatives
hexx0sr,2021-09-30T15:03:34.000-07:00,"trudeau spends 1st truth and reconciliation day in tofino on vacation, contradicting itinerary [deleted]",liberals
hexx59p,2021-09-30T15:04:57.000-07:00,"the conservative vote in alberta shrunk. here's why in 2015, the liberals crushed the cpc by over 7% nationally, and yet the cpc got 60% of the vote in alberta. 




in 2021, the cpc **won** the popular vote by 1.1%, and yet they had less than 55% of alberta votes. in case you don’t get why that’s so crazy, the cpc performed worse in alberta this time around, than when they got slaughtered in the 2015 election.",liberals
hexx84i,2021-09-30T15:05:51.000-07:00,"eco-socialist dimitri lascaris is considering running again for green party leader &gt; nuclear is just one out of a portfolio of low-carbon energy options.

no offence intended, but this statement is kind of a misunderstanding of energy production policy at it's core. 

to simplify the needs of a society (in terms of electricity), you need 2 things: 

1. available power generation. that is, the availability to flip a switch and have additional power available during peak periods as needed (wind, tidal, solar, hydro, and even fossil fuel). this is something that you can't necessarily control the output from due to environmental, supply, or literally just it being nighttime. wind, solar, tidal, etc, are not reliable constant sources of power. they just aren't. 

2. available \"base load\" (as it's called). this is what the power grid of a society/area requires as a baseline. as in, anything lower, and things start to fail or die. *this* is where nuclear power is so incredibly important. because nuclear power is completely separated from the environmental, supply, or daylight factors that all other current sources of renewable energy require to operate. this also supplements as a sort of 'battery' when needed, because the power is always there. some countries use lake-based hydroelectric 'batteries' (uk), but we don't have that luxury in most of our nation due to, well, flatness. 

tldr: nuclear (and possibly hydro in some areas) power should be what everything relies on, with wind, solar, tidal, etc, being the boosters to the system. 

