h72kg5s,2021-07-29T21:28:04.000-07:00,"justin trudeau blasts jagmeet singh’s request that the governor general not agree to an election he almost won them the election. he lost because the abc vote coalesced around the pretty boy with the famous name. if he was running against anyone but trudeau he would have won. if he was still around, they would probably be still pulling closer to even with the liberals. singh has done nothing but lose support. you deserve what you get for booting him. 
irrelevance.",liberals
h72kh4t,2021-07-29T21:28:23.000-07:00,justin trudeau blasts jagmeet singh’s request that the governor general not agree to an election [removed],liberals
h72kjui,2021-07-29T21:29:16.000-07:00,justin trudeau blasts jagmeet singh’s request that the governor general not agree to an election this is one of the most lopsided description of elbow gate i’ve seen since the conservative media tried to convince us trudeau basically turned into chuck norris on the floor and was roundhouse kicking mp’s.,liberals
h72kplf,2021-07-29T21:31:07.000-07:00,justin trudeau blasts jagmeet singh’s request that the governor general not agree to an election it's a literal description of what happened.,liberals
h72kqt4,2021-07-29T21:31:29.000-07:00,justin trudeau blasts jagmeet singh’s request that the governor general not agree to an election isn't he essentially asking for the queen's intervention? i thought we were past this.,liberals
h72lbsv,2021-07-29T21:38:07.000-07:00,"justin trudeau blasts jagmeet singh’s request that the governor general not agree to an election i never commented either way, was just speaking to the reality of the situation. ggs don't say no to pms",liberals
h72loyx,2021-07-29T21:42:17.000-07:00,"justin trudeau blasts jagmeet singh’s request that the governor general not agree to an election i think like most canadians i remember seeing the elbowgate footage everyday for weeks and thinking “wait what happened?”

trudeau shouldn’t be grabbing people in parliament like he did and should have been reprimanded but to act like someone was injured when an mp left feeling overwhelmed after accidental contact is just playing up the events.

i’d argue the people being childish that day were the mp’s blocking people from returning to their seats to delay a vote they didn’t want to happen. not to mention “physically force another mp to vote for his legislation” makes it sound like he was out back breaking people’s knees if they didn’t give him what he wanted. 

it was an incredibly minor and inconsequential event to everyone who wasn’t looking for ways to chip away at the “sunny days” persona he’d crafted leading up to the election and there’s been plenty of actually significant moments since then that do a better job of that anyways.",liberals
h72m14l,2021-07-29T21:46:02.000-07:00,"justin trudeau blasts jagmeet singh’s request that the governor general not agree to an election i agree it's just one in a series of unbelievably ghoulish behaviours trudeau has been caught doing, and certainly one of the more mild ones compared to repeatedly wearing blackface and sexually assaulting journalists. 

but elbowgate absolutely required calling out at the time. the same standard would have applied to anybody else had the situation been reversed. i don't know what the bar is for calling something overblown -- maybe this meets it -- but trudeau was in the wrong in this situation and i don't think anybody owes him the benefit of the doubt even years later.",liberals
h72mls7,2021-07-29T21:52:20.000-07:00,"in likely september snap vote, trudeau to gamble on vaccinations, economic rebound [removed]",liberals
ho80gdk,2021-12-11T15:24:31.000-08:00,"no matter how far o'toole shifts to the left, people will still find an excuse to not vote conservative (r/ontario thread in this image) can't get more liberal than o'tool.  sacrificed all principles for more votes.",conservatives
ho81mjb,2021-12-11T15:39:32.000-08:00,"no matter how far o'toole shifts to the left, people will still find an excuse to not vote conservative (r/ontario thread in this image) exactly. even harper wasn't as center as that last campaign was but oooooo he's right of castro so he must be a radical rightwinger.  they're just trying to excuse why they voted for someone who's sexually assaulted women and committed endless corruption crimes.  \"oh we had to vote for someone who's clearly corrupt and incompetent, the cpc forced us to because their leader said \"woke\"  (after the election).",conservatives
ho86amh,2021-12-11T16:42:05.000-08:00,"[deleted by user] to be honest, i don't have too big of a problem with kenney. i prefer him over all the other premiers (i actually resent ford) and know that he is doing his best with the situation that's been handed to him.

jean is a libertarian, and is mostly where i lean myself. if either man ran alberta, i don't think it would matter much. like the top things would be covid-19 policies for me, which is where i've been disappointed with kenney but again, he's been much better than ford. that said, jean admitted [that things wouldn't be much different under him](https://edmontonjournal.com/news/politics/brian-jean-says-he-opposes-mandatory-covid-19-vaccinations-expanding-albertas-vaccine-passport-program) depending on the circumstances. either way, i would vote for either of them.

in terms of social conservatism, i think it's really important to define terms. for example, i wouldn't consider myself a social conservative cause i support abortion, gay marriage, premarital sex, contraception, etc. however, as we shift left, this term becomes a bigger umbrella. i don't believe in gender ideology, white privelege, anti-patriotism and all the other woke nonsense the left peddles. does that make me a social conservative? what i'm getting at is: \"who is jean referring to?\" if he's referring to anti-gay and prolife activists (which is what most people think of when they think socon), then that's not a bad hill to place yourself on politically. it's what harper did to ensure an election. 

i don't think brian jean is woke, so all i'm saying is that \"anti-socon\" needs to be better defined. in fact, his schools comment clearly show that he isn't on board with this woke shit. it also clearly appears that jean's contempt was with homophobes so i think this is all hyperbolic; jean seems actually pretty based. the socons should alsp know by now that any conservative party is not going to implement any socon policy; what they'll do is delay implementing socilly progressive policies until the next leftist party gets in, which is the best you can hope for in canada.",conservatives
ho87h6b,2021-12-11T16:58:23.000-08:00,"[deleted by user] &gt;doesn't mean you can't do things that side likes. like giving funding to adoption options. but that's not the same as pandering to the socialist conservatives which is a dead end. 

i agree. in fact, reforming our foster care system should be a top priority and can make conservatives stand out as \"compassionate\", which i sometimes feel they get a bad wrap for not being.

also, i think we should focus on giving easy and free access to contraceptions (e.g. iuds). embracing the whole sexual and women's health aspect would be popular with their demographic. plus, if socons really want to deter abortions in canada, that would be the way to do it (so people don't get pregnant in the first place).",conservatives
h729f6e,2021-07-29T18:56:11.000-07:00,crimes have been committed against canada’s indigenous people. justin trudeau has no excuse for not bringing the perpetrators to justice [removed],liberals
h72abwu,2021-07-29T19:09:49.000-07:00,"justin trudeau blasts jagmeet singh’s request that the governor general not agree to an election its legal yeah sure, but it's just not something thats done. asking the gg to dissolve parliament for an election is a simple procedural formality. just like getting royal assent for a law, technically it doesn't have to be given but it always is. the only time i can think of where the gg said no is the whole king/byng affair a hundred years ago",liberals
h72aoja,2021-07-29T19:14:59.000-07:00,justin trudeau blasts jagmeet singh’s request that the governor general not agree to an election all of the ethics violations (arguably since there actually isn't any punishments to them you could argue that it actually shows he does understand the intricacies of the ethics laws i guess) his various campaign promises to change the way the senate works. his promise to change canada away from first past the post. both of those actions would require next to impossible to gather levels of support from the provincial premiers - those decisions aren't really up to him,liberals
h72bjcj,2021-07-29T19:27:35.000-07:00,"green party faces tough battle in next election, to the benefit of liberals and ndp; paul may not even win toronto centre, say politicos its brian chang, no? thats who ran against her last time, and ive been seeing ads for him again.",liberals
h72c72a,2021-07-29T19:37:27.000-07:00,"justin trudeau blasts jagmeet singh’s request that the governor general not agree to an election you do realize that, if we accept that number of 75% of canadians not wanting an election, by default that means 75% of canadians are to some degree happy with a liberal government?

the number would be much higher if people wanted to toss the pm. this isn’t the strong argument you think it is.",liberals
h72efkm,2021-07-29T20:10:03.000-07:00,justin trudeau blasts jagmeet singh’s request that the governor general not agree to an election should it matter? why substitute the judgment of one prime minister for the 327-1 vote of the commons to not hold an election this year?,liberals
h72elz4,2021-07-29T20:12:38.000-07:00,kenney outraged over trudeau's senate appointment as banff mayor karen sorensen appointed as independent [removed],liberals
h72ew5u,2021-07-29T20:16:41.000-07:00,kenney outraged over trudeau's senate appointment as banff mayor karen sorensen appointed as independent [removed],liberals
gqzqbxm,2021-03-14T17:57:37.000-07:00,"erin o’toole says he needs 1 million more votes in the next election. where will he find them? i’m not sure if that’s really the lesson here. blackface was certainly a bad thing, but it didn’t really hurt trudeau because the implication wasn’t credible. if you say trudeau did something very stupid and inappropriate, you’re obviously correct. but if you say “therefore, trudeau is a racist”, you’re clearly delusional. no one with a brain would believe that, since trudeau’s whole shtick is multiculturalism, supporting minorities, combating racism, etc... 



no one can credibly claim “trudeau wore blackface, therefore he is racist”. combine that with the apology, and it makes sense why it didn’t destroy him. if o’toole or harper we’re caught with blackface, they don’t have an entire political history of promoting multiculturalism that canadians would look to for context.",liberals
gzynoiw,2021-05-29T20:23:26.000-07:00,these people on r/canadapolitics think michael chong is a social conservative...........i have no words........... they'd be shocked to find out trudeau was a stonch pro-lifer who recently changed his stance.,liberals
gzypnk4,2021-05-29T20:55:59.000-07:00,"these people on r/canadapolitics think michael chong is a social conservative...........i have no words........... i hate this gay marriage argument, shouldn't they be happy when people change their minds on it? when the first debate came up many liberals also voted againist it. it was a very divided issue in the country at the time",liberals
hfbxdpd,2021-10-03T19:02:51.000-07:00,"‘they lost the air war’: trudeau liberals missed their majority government by only 16,870 votes in 11 ridings, hill times analysis for sure. we need the ndp to be elected as government so they can implement this like they already have done provincially where they’ve been elected.",liberals
hfby54b,2021-10-03T19:15:21.000-07:00,"‘they lost the air war’: trudeau liberals missed their majority government by only 16,870 votes in 11 ridings, hill times analysis bc begs to differ.",liberals
hfby84a,2021-10-03T19:16:41.000-07:00,tofino trip may only hasten trudeau’s departure i just don't  get how he could possibly think this was a good idea espically after failing to win his majority. it should be common sense as pm not to go on vacation on the holiday you created to reconcile with the natives for the genocide your country caused. i'm shocked that none of his advisors tried to tell him this was a bad idea or maybe they didi and he just didn't listen. it's these things that are costing him majority governments and he just never seems to learn.,liberals
hfby8zf,2021-10-03T19:17:06.000-07:00,tofino trip may only hasten trudeau’s departure [removed],liberals
hfbz245,2021-10-03T19:30:11.000-07:00,tofino trip may only hasten trudeau’s departure  being pm is pretty ambitious. more people care about climate change and affordable childcare than ego stroking.,liberals
hfbzk3q,2021-10-03T19:38:06.000-07:00,"elizabeth may: annamie paul told me to stay silent. but now i must say something yes, better. the pipeline talking point sells well on social media but isn't rooted in reality. canadian oil will get to market either way, and it's safer and better for the environment to be transported by pipeline than rail.

here's two other ratings from climate experts:

[liberals: a- for ambition, a- for feasibility, vs greens: a+ for ambition, c- for feasibility](https://www.chatelaine.com/news/canada-election-2021-climate-plans-graded/)

[liberal climate sincerity 10, vs green climate sincerity 4](https://policyoptions.irpp.org/magazines/septembe-2021/assessing-climate-sincerity-in-the-canadian-2021-election/)

i'd welcome a link to any sort of neutral assessment that ranks the green climate plan as being better than the liberals'. i'm sure you have plenty of sources?",liberals
hfbzkzl,2021-10-03T19:38:31.000-07:00,"will justin trudeau’s new government get serious on canada’s widening wealth inequality? i'm definitely in camp a. seems much more doable than b. b would likely require a good bit of anti globalization, which would help us, but cripple the third world.",liberals
hfbzllf,2021-10-03T19:38:47.000-07:00,"‘they lost the air war’: trudeau liberals missed their majority government by only 16,870 votes in 11 ridings, hill times analysis so 1+1=8?

a report looking at election results from a hill times somehow has something to do with the overconfidence of the liberal party?


some interesting logic you have going on.",liberals
hfbzvq9,2021-10-03T19:43:15.000-07:00,"elizabeth may: annamie paul told me to stay silent. but now i must say something waiting on a single link to any source whatsoever that ranks the green climate plan as being better than the liberals. go on, let's see it. an environmental party surely must have a well-thought-out, realistic climate plan, lauded by experts and pundits alike, with countless sources singing its praises.",liberals
hfc04mx,2021-10-03T19:47:09.000-07:00,sounds about right trudeau is a narcissist. it’s as clear as bold font.,liberals
hfc0ocu,2021-10-03T19:55:35.000-07:00,"will justin trudeau’s new government get serious on canada’s widening wealth inequality? ranked-choice ballot would not be a significant improvement, at least not unless it was paired with multi-member ridings. winner-takes-all rcv significantly biases toward centrist parties since voters on both the left and the right will typically select the centrists as their second or third choice, and for voters who actually want the centrist party to win, they will soon realize that they shouldn’t even mark a second choice. tl;dr, given our political landscape, alternative voting would almost certainly result in a de facto one-party government with the liberals in a false-supermajority. it wouldn’t matter that the ndp would probably gain some seats as well, because the liberals could simply ignore them. and every other party as well.",liberals
hfc1ekw,2021-10-03T20:06:35.000-07:00,"‘they lost the air war’: trudeau liberals missed their majority government by only 16,870 votes in 11 ridings, hill times analysis that’s their point. they were being sarcastic.",liberals
hfc1gun,2021-10-03T20:07:31.000-07:00,"tofino trip may only hasten trudeau’s departure you know how i know this is a non-issue being blown out of proportion by click-hungry \"journalists\"? literally not one person on my social media, not even the anti-trudeau types have made even a passing mention about this.

this is at worst a pr problem. this should have been maybe 1 news article and 1 opinion piece.",liberals
hfc1jjt,2021-10-03T20:08:41.000-07:00,"‘they lost the air war’: trudeau liberals missed their majority government by only 16,870 votes in 11 ridings, hill times analysis you realize the liberals didn’t write this, right?",liberals
hfc1mjv,2021-10-03T20:09:53.000-07:00,"‘they lost the air war’: trudeau liberals missed their majority government by only 16,870 votes in 11 ridings, hill times analysis i was being sarcastic. i actually think if trudeau was as cynical as people say he is he would have held a referendum on it knowing full well the status quo would win and he could put it to bed for a generation. like horgan.",liberals
hfc1ppc,2021-10-03T20:11:10.000-07:00,tofino trip may only hasten trudeau’s departure never heard a liberal say what you're saying and doubt you're a liberal or speak for liberals,liberals
hfc2kxc,2021-10-03T20:23:39.000-07:00,"will justin trudeau’s new government get serious on canada’s widening wealth inequality? the cabinet position \"minister of middle-class prosperity\" was created by the liberal gov't under jt's leadership.   what more proof is needed that they're serious about widening the wealth inequality?",liberals
hfc3af0,2021-10-03T20:33:20.000-07:00,"‘they lost the air war’: trudeau liberals missed their majority government by only 16,870 votes in 11 ridings, hill times analysis except this isn't liberal spin since they didn't write this up",liberals
hfc3bec,2021-10-03T20:33:42.000-07:00,"‘they lost the air war’: trudeau liberals missed their majority government by only 16,870 votes in 11 ridings, hill times analysis i'm so ever grateful they didn't get a majority. minority governments force them to walk on egg shells as they should to appeal to everyone",liberals
hfc3e3b,2021-10-03T20:34:43.000-07:00,"‘they lost the air war’: trudeau liberals missed their majority government by only 16,870 votes in 11 ridings, hill times analysis it’s hard numbers and data, how can you deny it?",liberals
hfc3gei,2021-10-03T20:35:32.000-07:00,tofino trip may only hasten trudeau’s departure [removed],liberals
hfc3rfi,2021-10-03T20:39:31.000-07:00,who wants to bet the trudeau family is on the ‘pandora papers’ list? would have been reported by now if they were,liberals
hfc45tk,2021-10-03T20:44:41.000-07:00,"will justin trudeau’s new government get serious on canada’s widening wealth inequality? exactly, it was an attempt at being populist...now, if you think tories don't favour 'societal elites', the 'good stock' canadians if you will, you're in for a rude political awakening!",liberals
hfc4d90,2021-10-03T20:47:22.000-07:00,"china’s ‘mouthpiece’: senator faces online backlash, calls to resign after 2 michaels, meng tweet this guy isn't a ccp sympathizer.  it's funny how the media is trying to spin this getting conservatives pundits to comment.

canada for a fact was caught in between a technological cold war between usa and china",conservatives
hfc4ipu,2021-10-03T20:49:19.000-07:00,"tofino trip may only hasten trudeau’s departure the idea that any swing voter cares enough about justin trudeau neglecting to attend first nations ceremonies for the holiday he saw fit to create is ridiculous. we don't and won't ever care about such trivial nonsense.

the only people who give a single thought to these type of articles are those already busy spending every day hating trudeau and sharing right wing memes on facebook - half the people who voted liberal probably don't like trudeau, but that doesn't fucking matter if their local liberal candidate is miles better than the other parties' options and the platform is the only one they like the look of. he's just a figurehead, but i guess the right wings' tendency to rally around a figurehead makes them believe people feel the same about jt - and they largely don't. 

if you want to win voters, stop attacking trudeau and make better policies.",liberals
h6k6hay,2021-07-25T16:40:45.000-07:00,"maxime bernier visits southern alberta during tour for people’s party of canada canadians displeased with their parties still vote strategically. the ppc has done poorly even in overwhelmingly conservative ridings where it wouldn't have \"mattered\" to not vote cpc. voters of all stripes want to see electorally viable parties and regional representation, not just ideological alignment. with the lpc projecting very well, even the bluest conservatives aren't going to be wasting votes in fringe parties. maybe after this election cycle it'll be a different story but right now i just don't see it.",conservatives
h6k958d,2021-07-25T17:18:12.000-07:00,trudeau says he would support a criminal investigation into residential schools [removed],liberals
h6kchaj,2021-07-25T18:08:11.000-07:00,"pierre trudeau ahead of harper as best recent pm for canadians again, you are missing the forest for the trees, and also seem to be imagining and implying stances i am not actually taking. this poll is about the perceptions of pms, not their accomplishments. so calling their perception mythologized isn't out of place if one wanted to hold that stance. though frankly i think you are just talking to yourself at this point. good luck out there.",liberals
h2mnjdu,2021-06-21T17:39:04.000-07:00,"2 catholic churches destroyed in overnight fires in okanagan fucking conservatives love everything to be in their narrative, even if it means promoting genocide.",conservatives
h3scfcc,2021-07-01T19:47:48.000-07:00,"trudeau rival o’toole attacks him on investment climate, backs deficits [removed]",liberals
h3scn1z,2021-07-01T19:50:48.000-07:00,"canada's racist? blame the liberals. they were usually in charge there seems to be a strategy at play here with the cpc and the media that is friendly to them. i see pierre trudeau being brought up an awful lot the last couple weeks. it seems the right-wing media is trying to “cancel” him and anybody associated with him. wink wink, nudge nudge.",liberals
h3sdq2u,2021-07-01T20:06:21.000-07:00,"trudeau tells canadians to ‘be honest’ about our past in canada day statement for the record, i think it's wrong to pre-suppose people are racist, but when they get defensive before you've asserted anything about them specifically i don't know what other conclusion to draw.",liberals
h3sebod,2021-07-01T20:14:55.000-07:00,trudeau tells canadians to ‘be honest’ about our past in canada day statement we know what op was doing on canada day,liberals
h3sfqm9,2021-07-01T20:34:19.000-07:00,trudeau tells canadians to ‘be honest’ about our past in canada day statement and your dad did nothing to help the indigenous people.,liberals
h3sfshs,2021-07-01T20:35:00.000-07:00,"garth is a natural treasure and they stole his flag trudeau, the destroyer of canada. i hope karma hits trudeau and his liberal cult following square in the face.",liberals
h0o4hsr,2021-06-04T19:44:24.000-07:00,"liberal party triggers ‘electoral urgency’ rule for nominations mandates can alter a bit to deal with the reality of a pandemic. so why don’t you want the liberals to get credit for helping people not just corporations, having better pandemic financial supports than most the world, and being amazing when it comes to vaccinations? my canadian family and friends, both employers and employees from all political stripes have been helped directly or indirectly by the support plan the liberals created. credit where credit is due, my friend.",liberals
h0o4t6m,2021-06-04T19:49:13.000-07:00,"trudeau calls on catholic church to publish residential school records, urges catholics to apply pressure it’s a catholic church…",liberals
h0o5l43,2021-06-04T20:00:57.000-07:00,"trudeau calls on catholic church to publish residential school records, urges catholics to apply pressure [deleted]",liberals
h0o5zxt,2021-06-04T20:07:10.000-07:00,"trudeau calls on catholic church to publish residential school records, urges catholics to apply pressure oh sorry. freedom of expression (with limitations). how’s first year poli-sci going?",liberals
h0o68rp,2021-06-04T20:10:51.000-07:00,"trudeau calls on catholic church to publish residential school records, urges catholics to apply pressure [removed]",liberals
h0o6f62,2021-06-04T20:13:32.000-07:00,"trudeau calls on catholic church to publish residential school records, urges catholics to apply pressure removed for rule 3.",liberals
h0o6k9f,2021-06-04T20:15:39.000-07:00,"trudeau calls on catholic church to publish residential school records, urges catholics to apply pressure removed for rule 3.",liberals
h0o6ljf,2021-06-04T20:16:10.000-07:00,"trudeau calls on catholic church to publish residential school records, urges catholics to apply pressure removed for rule 2.",liberals
h0o766p,2021-06-04T20:24:16.000-07:00,"trudeau calls on catholic church to publish residential school records, urges catholics to apply pressure [removed]",liberals
h0o7g2v,2021-06-04T20:28:09.000-07:00,"trudeau calls on catholic church to publish residential school records, urges catholics to apply pressure [removed]",liberals
