hp979t6,2021-12-19T12:00:43.000-08:00,"justin trudeau's unknown facts #shorts ###this is a reminder to [read the rules before posting in this subreddit](https://www.reddit.com/r/canadapolitics/wiki/rules-thelongversion).
 
1. **headline titles should be changed only [when the original headline is unclear](https://www.reddit.com/r/canadapolitics/wiki/rules-thelongversion#wiki_1._headline_titles_should_be_changed_only_where_it_improves_clarity.)**
2. **be [respectful](https://www.reddit.com/r/canadapolitics/wiki/rules-thelongversion#wiki_2._be_respectful).**
3. **keep submissions and comments [substantive](https://www.reddit.com/r/canadapolitics/wiki/rules-thelongversion#wiki_3._keep_submissions_and_comments_substantive).**
4. **avoid [direct advocacy](https://www.reddit.com/r/canadapolitics/wiki/rules-thelongversion#wiki_4._avoid_direct_advocacy).**
5. **link submissions must be [about canadian politics and recent](https://www.reddit.com/r/canadapolitics/wiki/rules-thelongversion#wiki_5._link_submissions_must_be_canadian_and_recent).**
6. **post [only one news article per story](https://www.reddit.com/r/canadapolitics/wiki/rules-thelongversion#wiki_6._post_only_one_news_article_per_story).** ([with one exception](https://www.reddit.com/r/canadapolitics/comments/3wkd0n/rule_reminder_and_experimental_changes/))
7. **replies to removed comments or removal notices will be removed** without notice, at the discretion of the moderators.
8. **downvoting posts or comments**, along with urging others to downvote, **[is not allowed](https://www.reddit.com/r/canadapolitics/wiki/downvotes)** in this subreddit. bans will be given on the first offence.
9. **[do not copy &amp; paste the entire content of articles in comments](https://www.reddit.com/r/canadapolitics/wiki/rules-thelongversion#wiki_9._do_not_copy_.26amp.3b_paste_entire_articles_in_the_comments.)**. if you want to read the contents of a paywalled article, please consider supporting the media outlet.

*please [message the moderators](https://www.reddit.com/message/compose?to=%2fr%2fcanadapolitics) if you wish to discuss a removal.* **do not reply to the removal notice in-thread**, *you will not receive a response and your comment will be removed. thanks.*


*i am a bot, and this action was performed automatically. please [contact the moderators of this subreddit](/message/compose/?to=/r/canadapolitics) if you have any questions or concerns.*",liberals
hp97ado,2021-12-19T12:00:51.000-08:00,"in his own words: at 50, justin trudeau is no longer working in his father’s shadow — and sees no ‘finish line’ in politics i think he's suggesting that the united states is the only country that could start printing obscene amounts of money out of nothing given its unique position of being a military/scientific/cultural power and that almost all major commodity transactions will go through the us dollar and that canada lacking those things would not be successful if it just started printing more money",liberals
hp97ngj,2021-12-19T12:03:58.000-08:00,"pm trudeau hopes 2022 will be the year canada can leave the pandemic behind people say that, until we're all given mandatory electricity quotas, expected to reuse paper eighty times, and eating rice and lentils for every meal due to an extensive list of \"forbidden foods\" while people richer than god get to continue using private jets and eating steak and lobster. face it, the rich will never suffer the consequences. only you and i will. if that's a world i'm leaving behind, i'm glad it's dying. the thought of the rich getting to survive at my expense makes my blood boil.",liberals
hp97w2l,2021-12-19T12:05:56.000-08:00,"stop criticizing quebec&amp;#39;s ban on religious symbols, erin o'toole warns conservative mps in tense meeting &gt; for judges and policemen? i'm not quite sure (but you probably are, haha).

of course i'm sure, because we've had this debate before, and the scc ruled in favour of religous expression. the scc only changes precedent when there is very good reason to do so, like we saw with medical aids in dying.

&gt; are they all wrong ?

i would say so.",conservatives
hp98383,2021-12-19T12:07:35.000-08:00,pm trudeau hopes 2022 will be the year canada can leave the pandemic behind [removed],liberals
hp98a4w,2021-12-19T12:09:07.000-08:00,"stop criticizing quebec&amp;#39;s ban on religious symbols, erin o'toole warns conservative mps in tense meeting you didn't answer my questions.",conservatives
hp98ixe,2021-12-19T12:11:10.000-08:00,"stop criticizing quebec&amp;#39;s ban on religious symbols, erin o'toole warns conservative mps in tense meeting &gt; if you say something substantive, you'll get a substantive response.

so, i guess not then. oh well. it's been swell.",conservatives
hp98m3l,2021-12-19T12:11:54.000-08:00,"stop criticizing quebec&amp;#39;s ban on religious symbols, erin o'toole warns conservative mps in tense meeting i don’t think government should limit religious freedom unless it impedes on someone’s life. a construction site needs proper equipment, so no they should not be exempt.",conservatives
hp98m5s,2021-12-19T12:11:55.000-08:00,"pm trudeau hopes 2022 will be the year canada can leave the pandemic behind children are also antivaxors, in norway and denmark school  are massively spreading it to the point that many schools are closed, as well kids dont have to wear masks, and buses are being packed with those mini antimaskers daily.  christmas will be fun for those people.

edit: also animals, 30 percent of deer in the states have antibodies, so dogs and birds and minks probably do too.  need to manidate vaccines for wildlife 100 percent every creature on the planet, or oxygen tanks for all creatures to protect the communities.",liberals
hp98shg,2021-12-19T12:13:25.000-08:00,"stop criticizing quebec&amp;#39;s ban on religious symbols, erin o'toole warns conservative mps in tense meeting well, i'm happy to have given you an opportunity to express your opinion.

have a good night!",conservatives
hp98t34,2021-12-19T12:13:34.000-08:00,"pm trudeau hopes 2022 will be the year canada can leave the pandemic behind we are stuck with covid at this point. 

&amp;#x200b;

we may be able to reduce the number of infected/spreading down via vaccination and various restrictions but the thing is every time we've had a chance to stamp out the virus we've failed. we've had several opportunities to do so during the summer time for example when cases were low and we reduced restrictions during that time which allowed for the virus to survive.

&amp;#x200b;

at this point, it's looking like the latest version of covid will become extremely widespread very quickly (over 4000 cases in ontario, was like 3100 the previous day i think).

&amp;#x200b;

fundamentally we do not have an effective quarantine ability as a province and as a nation. the virus spreads easily and quickly in a low-income type of housing because it generally consists of a lot of people living in a small space breathing in the same air with ventilation systems that are not good enough or non-existing. our quarantine measures seem to be \"go home and stay home\" rather than a \"you are going to have to come with us and we will make sure you have a safe place to stay for the next few weeks\" approach. the few quarantine approaches that we have put in place (i.e. feds using hotel rooms) have seen their share of serious problems.",liberals
hp99baz,2021-12-19T12:18:01.000-08:00,pm trudeau hopes 2022 will be the year canada can leave the pandemic behind [removed],liberals
hp99k6s,2021-12-19T12:20:04.000-08:00,"justin trudeau’s position looks strong heading into 2022 — but only compared to his opponents yep.  governments can skate through many failures, grim situations and scandals, but rarely do they survive a poor economy.   give credit to the liberals , they know the excrement is going to get deep and have planned for it .  the first step is to buy some time, via an election . accomplished .  

another factor will be the certain loss in valuation of the $cdn.  a low $ relative to the $us always has good and bad sides.  it greatly increases the cost of imports,  the upside is that it benefits our national exports.  

but whoa, what do we make and who do we sell it to? our largest customer by far is still the usa, who have clearly served notice  that our business relationship is changing, and not in our favour .  that reality won’t be changed with  new regimes in america.  our big exports like oil&amp;gas, automotive, lumber- all under threat .  

china is at number 2 for canada, all our business there is at risk.  europe is going to buy all they possibly can from each other, not from us.  india  is a massive potential market but our relationship  remains toxic.

but all is not lost , not at all, for this government .  they are excellent at managing the electorate , have a terrific social media presence, and  no difficulty manipulating  a weakly organized  opposition .  they have a young, attractive , bilingual new leader selected to lead us out of the situation and will  introduce us when it suits .   it won’t be difficult to distract us from noticing who made a major contribution to getting us in the mess.  business as usual .",liberals
hp9a1rc,2021-12-19T12:24:22.000-08:00,"stop criticizing quebec&amp;#39;s ban on religious symbols, erin o'toole warns conservative mps in tense meeting &gt; comme si l'opinion d'un offensé exalté sans nuance comptait pour quoi que ce soit...",conservatives
hp9a9gv,2021-12-19T12:26:16.000-08:00,pm trudeau hopes 2022 will be the year canada can leave the pandemic behind my guess is we won’t truly see the virus go away to the point where it doesn’t cause restrictions every 4 months until about mid to late 2023 when a majority of the developing countries get vaccinated,liberals
hp9ai0k,2021-12-19T12:28:25.000-08:00,pm trudeau hopes 2022 will be the year canada can leave the pandemic behind pandemic preparedness is a form of climate legislation as they become more common with climate chsnges,liberals
hp9akwp,2021-12-19T12:29:11.000-08:00,justin trudeau’s position looks strong heading into 2022 — but only compared to his opponents [removed],liberals
hp9an59,2021-12-19T12:29:45.000-08:00,"pm trudeau hopes 2022 will be the year canada can leave the pandemic behind it is, and always has been, an issue of the rich fucking over us peasants. climate change and pandemics are no exception. lockdowns for you and i, caribbean getaways for the powerful",liberals
hp9anbl,2021-12-19T12:29:47.000-08:00,pm trudeau hopes 2022 will be the year canada can leave the pandemic behind vaccine “mandates” would be restrcted to federal regulated businesses and non-essential businesses. something already happening,liberals
hp9as16,2021-12-19T12:30:59.000-08:00,pm trudeau hopes 2022 will be the year canada can leave the pandemic behind not trying to downplay the wealthy not paying their fair share in society but i'm talking about in a general sense.,liberals
hp9asqh,2021-12-19T12:31:09.000-08:00,pm trudeau hopes 2022 will be the year canada can leave the pandemic behind [removed],liberals
hp9bb3c,2021-12-19T12:35:51.000-08:00,"justin trudeau’s position looks strong heading into 2022 — but only compared to his opponents &gt; harper didn’t run up the debt like trudeau.

uhh, he did though? or did you forget about his famous \"canada's economic action plan\" with the advertising everywhere?",liberals
hp9bhsw,2021-12-19T12:37:35.000-08:00,pm trudeau hopes 2022 will be the year canada can leave the pandemic behind [removed],liberals
hp9dngg,2021-12-19T12:58:13.000-08:00,"justin trudeau’s position looks strong heading into 2022 — but only compared to his opponents hold on a second. 

i understand that canadians can run into financial trouble because they used up too much credit and interest rates go up. i understand that they could lose a significant amount of income and that lack of tax income could hurt the government and force them to borrow.

but how is this specifically the government's fault? shouldn't we be blaming the people who are using up that credit for investing poorly? or maybe the banks who are lending out all that credit and didn't do their research either? 

sure they could have done a better job regulating, but i think that we're glossing over something really important. we're mixing up the availability of private and public credit here, and the reality is that the private sector will experience financial trouble way before the public sector should there be interest rate increases.

we shouldn't be paying for the risks that people make on speculative investments.",liberals
h4gfo8b,2021-07-07T19:40:17.000-07:00,liberals set august date for one-time $500 payment to seniors aged 75 and older with a 400b deficit this feels like no big deal. a drop in the bucket.,liberals
h4gfuna,2021-07-07T19:43:05.000-07:00,liberals set august date for one-time $500 payment to seniors aged 75 and older you might want to read up on inflation yourself because inflation does not take into consideration the price of housing. inflation in canada is based on the cpi which looks at the change in the price of goods and services. household expenses are considered but the actual cost of housing is most certainly not. housing is considered an asset and is excluded from inflation.,liberals
h4ghssc,2021-07-07T20:13:10.000-07:00,"liberals set august date for one-time $500 payment to seniors aged 75 and older nope, current covid programs run out sept 25th, they need the election over before then",liberals
h4gii80,2021-07-07T20:23:42.000-07:00,liberals set august date for one-time $500 payment to seniors aged 75 and older not all of ontario loves him. mostly the toronto area. he needs to go.,liberals
h4gjs2g,2021-07-07T20:42:01.000-07:00,what did alberta do with $1b from trudeau for o&amp;g cleanup? [removed],liberals
h4gl9u7,2021-07-07T21:02:17.000-07:00,liberals set august date for one-time $500 payment to seniors aged 75 and older [deleted],liberals
h4gm7gv,2021-07-07T21:14:34.000-07:00,liberals set august date for one-time $500 payment to seniors aged 75 and older [removed],liberals
h4gmkwc,2021-07-07T21:19:20.000-07:00,how do conservatives feel about erin o'toole? he probably isn't. but i'll have a clean conscience.,conservatives
h3b19n2,2021-06-27T20:24:22.000-07:00,"the trudeau government: a mixed record interesting that there is barely a passing mention of china. i think the deterioration and challenges of that relationship are much more noteworthy of mention when assessing this government's record on foreign policy than lacklustre peacekeeping and foreign aid contributions (not that they're not important, just comparatively less noteworthy imho). 

thoughts?",liberals
h3b1q5h,2021-06-27T20:31:18.000-07:00,"ladies and gentlemen, the most despicable \"canadian\" subreddit out there! there are lots of things to criticize trudeau over that aren't the sins of his father.",liberals
h3b2351,2021-06-27T20:36:41.000-07:00,"chris selley: now is a strange time for 'rah-rah' canadian patriotism what we did last year was not normal, not even compared to what any other western country did:

https://www.ceicdata.com/en/indicator/canada/government-debt--of-nominal-gdp

will it lead to imminent collapse of the canadian state? no.  especially as interest rates are basically zero.

what trudeau did do was overspend on this crisis by basically twice what he needed to, if i look at europe.    this erodes our future ability to respond to other crises.  in the shorter term, it dilutes the government's abilities to institute new programs.  there will likely be a slow burn of cuts to social programs for the next decade or so, like canada was forced to do in the 90s. 

 stop pretending this is about some catastrophe, it's not.  saying everything isnt collapsing and therefore debt has no impact on society is wrong.   it's about a generation living through cuts, which i feel isnt healthy for anyone. it means the government's programs wont be as flexible responding to the times.  it will harm many people as future governments' fiscal flexibility is eroded.   all to win this next election.  spending far more than needed was not optimal.  the europeans show it could have  been done with less spending, without spiralling fatalities.",liberals
h3b2dvz,2021-06-27T20:41:08.000-07:00,"canada to make online hate speech a crime punishable by $16,000 fine the conservatives repealed it because, in part, because muslim law students went after their darling ezra levant for his islamophobic commentary. it was a popular move for the free speech absolutists and hate mongers.",conservatives
h3b5yjm,2021-06-27T21:30:07.000-07:00,"o’toole speculates he’s the ‘only’ leader who is proud of canada amid calls to cancel canada day legit this subreddit is infested with shills and gets heavily brigaded often. if you're trying to be serious here, the thing you should focus on is calling out the \"hello fellow conservatives\" posts.

letting them spam their idiocy here and not calling them out for what they are is foolish.",conservatives
h3b7adi,2021-06-27T21:47:11.000-07:00,"ladies and gentlemen, the most despicable \"canadian\" subreddit out there! trudeau bathes in teflon",liberals
h6i4h5n,2021-07-25T05:08:54.000-07:00,"eric grenier: yes, the greens are in serious trouble there was a deal at one point where the greens wouldn't really campaign in trudeau's riding if the liberals didn't run a hard campaign in her riding.  that said i think both parties would have been distant thirds in the opposite race anyway so in practice it wasn't that big of a deal.  may made a big deal about it at the time but i don't think the liberals really publicly acknowledged it.",liberals
h6i5jtt,2021-07-25T05:17:39.000-07:00,"liberal majority government in ‘doubt’ as lead over conservatives shrinks, poll finds - national | globalnews.ca desegregation was forced by the countrywide majority on a minority that had local majorities. that's quite a bit different.",conservatives
h6i67x7,2021-07-25T05:23:02.000-07:00,"liberal majority government in ‘doubt’ as lead over conservatives shrinks, poll finds - national | globalnews.ca &gt;rd it said that by a geopolitical analyst that i respect who isn't left leaning, that christie freeland is one of the smartest people that he's ever met. 

he should get out more. 

she failed horribly in venezuela, china, really horribly in the european trade deal, and she started off with nafta by directly insulting trump. and he kind of has an ego issue about women insulting him :) nafta wasn't a complete disaster but it sure wasn't great. we lost ground. and when you lose ground it's a fail. arguing that you could have failed worse isn't impressive. when harper faced the same mess with softwood lumber, for example, he did what needed to be done to get a win even if that meant reaching across the isle to recruit his negotiator. and he won. 

freeland isn't terribly smart and her performace has been extremely lackluster at best even accounting for justin's stupidity making it harder.",conservatives
hiug9vt,2021-10-31T13:33:47.000-07:00,o'toole should show 'leadership' and show unvaccinated conservative mps the door: former pm mulroney [removed],conservatives
hiuit04,2021-10-31T13:57:16.000-07:00,"in netherlands ahead of g20, trudeau warns disinformation threatens democracy, global economy lmao.

yes because those subs make someone a \"right wing reactionist\". i can make many assumptions about you too but they are just that, assumptions, and are inherently irrelevant.

also thank you for taking the time to go through my comment history. i find it interesting instead of replying with something relevant to what i've commented here you instead try to dig something up for some reason? interesting indeed. 

also you found an old post that said kill em all in reference to islamic state jihadists. i guess that makes me awful. yawn.",liberals
hiuklsn,2021-10-31T14:15:33.000-07:00,justin trudeau the nowhere man of international stage [removed],liberals
gl7x6lo,2021-01-28T18:25:21.000-08:00,"julie payette upset that her rcmp security detail was allowed to participate in workplace review: sources | national post there's a lot of commentary out there about trudeau not vetting her appropriately with respect to her temperment and suitability for the job. all for good reason, i am on record as saying she was a bad pick from the start. but what's not being talked about is how payette shouldn't have ever accepted the job. 

payette is clearly a private person. i feel something of an affinity with her on that. i would hate the 24/7 spotlight, the rcmp detail with me everywhere i went, the high workload and the seemingly unending receptions, ceremonies, and diplomatic meetings. imagine having to go to your nephew's graduation ceremony 3 times a week for 5 years. you would be bored to tears. 

all of that to say, i would not want to accept the role of gg if i had the choice. if i could end my career by sitting on the board of some museum or consult for an engineering firm and then retire on a pile of cash i would be inclined to take that over the 5 years of unending scrutiny. 

my point here is that payette should have vetted herself better for this job. the person best suited to know she wouldn't be fit for this position was payette herself. she either didn't educate herself sufficiently on the duties of the gg or she lied to herself about her own personality and capabilities.",liberals
gl7xpuj,2021-01-28T18:32:35.000-08:00,"kelly mcparland: trudeau needs to postpone the revolution and fix dismal covid-19 response ###this is a reminder to [read the rules before posting in this subreddit](https://www.reddit.com/r/canadapolitics/wiki/rules-thelongversion).
 
1. **headline titles should be changed only [when the original headline is unclear](https://www.reddit.com/r/canadapolitics/wiki/rules-thelongversion#wiki_1._headline_titles_should_be_changed_only_where_it_improves_clarity.)**
2. **be [respectful](https://www.reddit.com/r/canadapolitics/wiki/rules-thelongversion#wiki_2._be_respectful).**
3. **keep submissions and comments [substantive](https://www.reddit.com/r/canadapolitics/wiki/rules-thelongversion#wiki_3._keep_submissions_and_comments_substantive).**
4. **avoid [direct advocacy](https://www.reddit.com/r/canadapolitics/wiki/rules-thelongversion#wiki_4._avoid_direct_advocacy).**
5. **link submissions must be [about canadian politics and recent](https://www.reddit.com/r/canadapolitics/wiki/rules-thelongversion#wiki_5._link_submissions_must_be_canadian_and_recent).**
6. **post [only one news article per story](https://www.reddit.com/r/canadapolitics/wiki/rules-thelongversion#wiki_6._post_only_one_news_article_per_story).** ([with one exception](https://www.reddit.com/r/canadapolitics/comments/3wkd0n/rule_reminder_and_experimental_changes/))
7. **replies to removed comments or removal notices will be removed** without notice, at the discretion of the moderators.
8. **downvoting posts or comments**, along with urging others to downvote, **[is not allowed](https://www.reddit.com/r/canadapolitics/wiki/downvotes)** in this subreddit. bans will be given on the first offence.
9. **[do not copy &amp; paste the entire content of articles in comments](https://www.reddit.com/r/canadapolitics/wiki/rules-thelongversion#wiki_9._do_not_copy_.26amp.3b_paste_entire_articles_in_the_comments.)**. if you want to read the contents of a paywalled article, please consider supporting the media outlet.

*please [message the moderators](https://www.reddit.com/message/compose?to=%2fr%2fcanadapolitics) if you wish to discuss a removal.* **do not reply to the removal notice in-thread**, *you will not receive a response and your comment will be removed. thanks.*


*i am a bot, and this action was performed automatically. please [contact the moderators of this subreddit](/message/compose/?to=/r/canadapolitics) if you have any questions or concerns.*",liberals
gl7xwh6,2021-01-28T18:35:06.000-08:00,kelly mcparland: trudeau needs to postpone the revolution and fix dismal covid-19 response [removed],liberals
